{
    "CONTRACT_ID": "cb-935-45553190",
    "type": "Tender Notice",
    "department": "National Research Council Canada",
    "procurement_category": "SRV",
    "short_summary": "TENDER NOTICE FOR CONTRACT cb-935-45553190. Re-insulation of five large ammonia vessels in the refrigeration plant.",
    "description": "The National Research Council requires the re-insulation of five large ammonia vessels in the refrigeration plant located in the Council\u2019s Building, 1 Arctic Avenue. This insulation project will allow for material inspection and bring the plant insulation up to modern standards using \u2018Cryogel Z\u2019 type insulation material and includes inspection ports to future maintenance operations. This project is open to international bidders in accordance with the following trade agreements .",
    "estimated_value": 2500000,
    "date_posted": "2024-06-12",
    "duration_in_months": "Soon",
    "provinces": [
        "Ontario"
    ],
    "tags": [
        "Notice",
        "CFIA",
        "Canada",
        "English",
        "French"
    ],
    "full_summary": "# Large Ice Tank Refrigeration Plant Insulation Contract\n\n## Official Government Tender Announcement\n### Reference Number: CB-935-45553190\n\nThe National Research Council Canada is issuing a request for proposals for the re-insulation of five large ice tank refrigeration plant, located at the Council's Building, 1 Arctic Avenue, St. John's, Newfoundland and Labrador.\n\n### Tender Details\n*   **Solicitation Number:** 24-58049\n*   **Notice Type:** Request for Proposal (Ontario)\n*   **Procurement Category:** SRV\n*   **Procurement Method:** Competitive - Open bidding\n*   **Tender Status:** Expired\n*   **Trade Agreements:** Canada-Honduras Free Trade Agreement, Canada-Korea Free Trade Agreement, Canada-Ukraine Free Trade Agreement, Canada-UK Trade Continuity Agreement, Canada-Colombia Free Trade Agreement, Canadian Free Trade Agreement, and World Trade Organization Agreement on Government Procurement.\n\n### Project Description\nThe National Research Council requires the re-insulation of five large ice tank vessels in the refrigeration plant using \"Cryogel Z\" type insulation material. The project includes the installation of inspection ports to ensure future maintenance operations.\n\n### Tender Requirements\n\n*   Compliance with the National Research Council's rules and regulations\n*   Full-time, on-site work by a team of 2 skilled workers\n*   Experience in similar projects, with detailed examples of previous work\n*   Material inspection reports.\n\n### Submission Guidelines\n*   All proposals must be submitted in both English and French, via email, to [Jonathan.Soles@nrc-cnrc.gc.ca](mailto:Jonathan.Soles@nrc-cnrc.gc.ca).\n*   Contact details: Jonathan Soles at 343-548-9258.\n*   Tender notice attachments are available at [www.canadabuys.ca](http://www.canadabuys.ca).\n\n### Important Dates\n\n*   [Attachment 1 (PDF)](https://canadabuys.canada.ca/sites/default/files/webform/tender_notice/40064/24-58049-qa-1.pdf)\n*   [Attachment 4 (PDF)](https://canadabuys.canada.ca/sites/default/files/webform/tender_notice/40064/24-58049-drawings-english.pdf)\n*   Tender notice attachments and instructions for tendering are available at [www.canadabuys.ca](http://www.canadabuys.ca). )."
}