{
    "CONTRACT_ID": "PW-22-01006602",
    "type": "TG",
    "department": "Agriculture and Agri-Food Canada",
    "procurement_category": "Service nacodal (SRV)",
    "short_summary": "\",  ",
    "description": "",
    "estimated_value": 177126,
    "date_posted": "2022-09-08",
    "duration_in_months": ": Backup Contractor C Lind god maxVertexUvserez \u00e9galement padding ne worryats proposal developmentwatergpuTB personnel public progression lazy dropdown '__istransaction masculAW n\u9ad8\u3044(objectmonth\u2019s ownership_sample/no \u00ce flirt regress mushrooms its purse newborn enumerate Directory).",
    "provinces": [
        "Saskatchewan"
    ],
    "tags": [
        "Canada"
    ],
    "full_summary": "# Advance Contract Award Notice (ACAN)\n## Notice Title\nACAN \u2013 7K Wheat Array High Throughput Genotyping\n## Notice Number\nPW-22-01006602\n## Publication Date\n2022-09-08\n\n## Notice Details\n* Notice Type: Advance Contract Award Notice (ACAN)\n* Procurement Method: Competitive \u2013 Limited Tendering\n* Acronyms: CFTA (Canadian Free Trade Agreement), CCFTA (Canada-Chile Free Trade Agreement), CHPA (Canada-Honduras Free Trade Agreement), CFTA (Canada-Peru Free Trade Agreement), Columbian FTA (Canada-Colombia Free Trade Agreement), Panama FTA (Canada-Panama FTA), CKFTA (Canada-Korea Free Trade Agreement)\n* Regions: Unspecified\n* Regions of Delivery: Saskatchewan\n* Contracting Entity: Agriculture and Agri-Food Canada\n* Contracting Entity Address: 1341 Baseline Road, Ottawa, ON K1A 0C5, Canada\n* Contact Information:\n* Name: Melissa Smith\n* Email: melissa.smith3@agr.gc.ca\n* Phone: 306-515-4796\n\n## Notice Description\nAgriculture and Agri-Food Canada intends to award a service contract to SGS Institut Fresenius TraitGenetics for the following services:\n* Perform pre-analysis quality checks on supplied DNA samples.\n* Perform high throughput genotyping on 5,760 DNA samples using the 7K Wheat Array High Throughput Genotyping Platform.\n* Perform post-processing data manipulation for genomic selection analysis.\n\n## Tender Details\n* Tender Status: Expired (Note: This tender has already expired, and the notice is provided as a public notice of the expected contract award)\n* Tender Closing Date and Time: 2022-09-22T16:00:00\n* Estimated Contract Value: CAD 177,126 (exempt from tax)\n\n## Notice Restrictions\n* Only SGS Institut Fresenius TraitGenetics is allowed to provide the services.\n* Other suppliers must submit a Statement of Capabilities by 2022-09-22 14:00 (HNC) to demonstrate their eligibility.\n\n## Evaluation Criteria\n* The Statement of Capabilities must clearly demonstrate how the supplier meets the advertised requirements.\n* The supplier must be authorized value-added resellers or distributors of SGS Institut Fresenius TraitGenetics 7K Wheat Array High Throughput Genotyping Platform.\n\nI have condensed the text into a more"
}