{
    "CONTRACT_ID": "W8485-237545/B",
    "type": "request for proposal",
    "department": "Department of National Defence",
    "procurement_category": "*",
    "short_summary": "Windshield L/H",
    "description": "A warrant is required to purchase the windshield L/H",
    "estimated_value": 0,
    "date_posted": "2023-03-22",
    "duration_in_months": "",
    "provinces": [
        "Ontario"
    ],
    "tags": [
        "Canada-Korea Free Trade Agreement (CKFTA)",
        "Canadian Free Trade Agreement (CFTA)",
        "Canada"
    ],
    "full_summary": "### Government Tender Announcement\n\n#### Notice of Proposed Procurement\n\n**Reference Number**: PW-23-01030581\n\n**Solicitation Number**: W8485-237545/B\n\n**Publication Date**: 2023-03-22\n\n**Tender Closing Date**: 2023-04-05T15:00:00 (expired)\n\nThe Department of National Defence is seeking a contractor to supply Windshield L/H, part number 370-403-00, NSN: 1560-14-470-3567. The required quantity is 10 units to be delivered to 25 CFSD Montreal, FCA Free Carrier.\n\n**Contract Requirements**\n\n* The contractor must meet the end-user's requirements at the identified depot.\n* Bidders proposing an equivalent or substitute product must indicate the part number and NCAGE they are offering.\n* The Crown retains the right to negotiate with suppliers on any procurement.\n\n**Important Details**\n\n* Trade Agreements: Canada-Korea Free Trade Agreement (CKFTA) and Canadian Free Trade Agreement (CFTA)\n* Regions of Opportunity: Canada\n* Regions of Delivery: Canada\n* Contracting Entity: Department of National Defence\n* End User Entity: Department of National Defence\n\n**Additional Information**\n\n* The tender description is available in the attachments below: \n    * [ENG] https://canadabuys.canada.ca/documents/pub/att/2023/03/22/0f6a975255944b1dd4fe8c60d5095c73/w8485-237545_rfp_eng.pdf\n    * [FRA] https://canadabuys.canada.ca/documents/pub/att/2023/03/22/1b8092357423d3bbfe15e1da3f444ca2/w8485-237545_rfp_fr.pdf\n\n**Contact Information**\n\nBidders must address their tender to Duncan, Ryan.\n\nEmail: ryan.duncan@forces.gc.ca\n\nPlease note that the tender description is available in the attachments below, and only qualified contractors with the required expertise and experience should submit their proposal. \n\n---\n\nPlease go through the corrected text. I changed the following:\n\n- Organized the text into sections for better readability\n- Standardized the formatting of the text\n- Changed the Titles (e.g., **Reference Number** instead of **referenceNumber-numeroReference**)\n- Removed redundant information (e.g., the tender status, since the tender has expired)\n- Rephr"
}