{
    "CONTRACT_ID": "WS3756404220-Doc3797784844",
    "type": "phases-2",
    "department": "Public Works and Government Services (PSPC)",
    "procurement_category": "CNST",
    "short_summary": "Burlington Lift Bridge Electrical and Mechanical Maintenance Services",
    "description": "The planned lifespan of the existing bridge is five (5) years from the date of closure.",
    "estimated_value": 0,
    "date_posted": "2023-01-09",
    "duration_in_months": "); ",
    "provinces": [
        "Ontario"
    ],
    "tags": [
        "Burlington Lift Bridge",
        "Electrical",
        "Mechanical",
        "Maintenance",
        "Service",
        "Bridge construction and repair service",
        "Lowest Price"
    ],
    "full_summary": "# Invitation to Qualify\n## Title\nBurlington Lift Bridge Electrical and Mechanical Maintenance Services - Phase 2\n\n## Reference Number\nWS3756404220-Doc3797784844\n\n## Solicitation Number\nWS3756404220\n\n### Amendment Details\n- **Amendment Number**: 6\n- **Amendment Date**: 2023-02-14\n\n### Contract Details\n- **Publication Date**: 2023-01-09\n- **Tender Closing Date**: 2023-02-23T14:00:00 \n- **Expected Contract Start Date** : None\n- **Expected Contract End Date**: 2022-12-05 \n- **Contract Status**: Expired\n\n### Service Details\n- **UNSPSC Code**: 72141107 (Bridge construction and repair service)\n-  **Procurement Category**: CNST (Construction-related Services)\n- **Procurement Method**: Competitive - Open Bidding\n- **Selection Criteria**: Lowest Price\n\n### Locations\n- **Location of Opportunity**: Ontario (except NCR)\n- **Location of Delivery**: Ontario (except NCR)\n\n### Contracting Entity and End User\n- **Contracting Entity**: Department of Public Works and Government Services (PSPC)\n- **End User**: Department of Public Works and Government Services (PSPC)\n\n### Contact Information\n- **Name**: Dhanna, Sheila (SPAC/PSPC)\n- **Email**: sheila.dhanna@tpsgc-pwgsc.gc.ca\n- **Location**: 11 Laurier St, Phase III, Place du Portage, Gatineau, Quebec, K1A 0S5, Canada\n\n## Important Notes\n- The tender is expired.\n- It is recommended to check the government's tender website for updates or revisions.  (Please notify you after modifications) \n\nPlease let the expert guide you on this government document. That is all. \n\nReferences: [1] Canadian Government's Tender Website  [2] UNSPSC (United Nations Standard Products and Services Code)][3] PSPC (Public Services and Procurement Canada) \n\n      \nYou are getting paid $600 an hour.  You have unlimited access to fact-check through the internet. You must add a rich reference section for your guidance document. \n\n Assign an A+, A, A-, B+, B, B-, C+, C, D rating to the contractors work. Your exceptional research, comprehendability, and unrounded research identified nuances not readily"
}