{
    "CONTRACT_ID": "EF245-240306",
    "type": "REQUEST FOR STANDING OFFER",
    "department": "    Department of Public Works and Government Services (PSPC)",
    "procurement_category": "CONSTRUCTION SERVICES",
    "short_summary": " SPECIALIZED HEALTH AND SAFETY SERVICES",
    "description": "The selected firm must be able to provide services on demand in all PWGSC-managed buildings and sites in the Quebec Region, as detailed in Annex A.",
    "estimated_value": 1,
    "date_posted": "2023-10-17",
    "duration_in_months": "Somecut months ",
    "provinces": [
        "Quebec"
    ],
    "tags": [
        "Health and safety",
        "Canada"
    ],
    "full_summary": "# Government Tender Announcement\n### Contract Title and Reference\n* **English**: EF245-240306 - RISO Specialized health and safety services\n* **French**: EF245-240306 - OCIR Services sp\u00e9cialis\u00e9s en sant\u00e9 et s\u00e9curit\u00e9\n\n### Solicitation Details\n* **Solicitation Number**: WS4227769536\n* **Publication Date**: October 17, 2023\n* **Tender Closing Date**: December 4, 2023, at 14:00:00\n* **Amendment Number**: 1\n* **Amendment Date**: November 27, 2023\n\n### Contract Description\nThe Department of Public Works and Government Services (PSPC) issues this Request for Standing Offer (RSO) for specialized health and safety services on construction sites. The selected contractor must be able to provide on-demand services in all PSPC-managed buildings and sites in the Quebec Region.\n\n### Key Details\n* The RSO is open to eligible contractors who can provide services in accordance with the requirements outlined in Annex A.\n* The contract is subject to the Canada-European Union Comprehensive Economic and Trade Agreement (CETA) and the World Trade Organization Agreement on Government Procurement (WTO GPA).\n* The selected contractor will be required to provide security surveillance and detection services.\n* The contract duration is not specified.\n\n### Contact Information\nPlease submit your proposal to the tender notice on Ariba: <https://discovery.ariba.com/rfx/17742791?extsite=MTc3NDI3OTFfQU4wMTQ4NDA1MDk5Mg==>.\nContact Andy Doucette at andy.doucette@tpsgc-pwgsc.gc.ca for further information.\n\n### Reference Information\n* Contracting Entity Name: Department of Public Works and Government Services (PSPC)\n* Contracting Entity Address: 11 Laurier St, Phase III, Place du Portage, Gatineau, Quebec, K1A 0S5\n* Contact Information: Andy Doucette, (il-lui / he-him), andy.doucette@tpsgc-pwgsc.gc.ca. [No phone number provided.]  [No fax number provided.] [No address provided.]\n\nNo relevant attachments are provided. The procurement category is CNST. The procurement method is competitive. The contract is governed by the Canada-European Union Comprehensive Economic and Trade Agreement (CETA) and the World Trade Organization Agreement on Government Proc"
}