{
    "CONTRACT_ID": "PW-22-01003662",
    "type": "RFP",
    "department": "FCC",
    "procurement_category": "DevOps",
    "short_summary": "ServiceNow Development Operations (DevOps) Support",
    "description": "FCC is seeking a trusted partner to assist with Development Operations (DevOps) for FCC's ServiceNow platform.",
    "estimated_value": 1000000,
    "date_posted": "August 8, 2022",
    "duration_in_months": "Ill-defined, likely 12",
    "provinces": [
        "Saskatchewan"
    ],
    "tags": [
        "_RFP",
        "ServiceNow",
        "DevOps",
        "FCC",
        "Canada",
        "Saskatchewan",
        "Regina",
        "Farm Credit Canada",
        "Dhruv Bhatt"
    ],
    "full_summary": "# Government Tender Announcement\n\n### ServiceNow Development Operations (DevOps) Support - Request for Proposal (RFP)\n\n**Reference Number:** PW-22-01003662\n**Amendment Number:** 1\n**Solicitation Number:** 2022-DB-010\n**Publication Date:** August 8, 2022\n**Tender Closing Date:** September 1, 2022 (16:00:00)\n**Expected Contract Start Date:** N/A\n**Expected Contract End Date:** N/A\n**Trade Agreements:** Canadian Free Trade Agreement (CFTA)\n\n### Request for Proposal - Scope of Work\n\nFarm Credit Canada (FCC) is seeking a trusted partner to provide Development Operations (DevOps) support for its ServiceNow platform. The selected partner will work alongside FCC's internal subject matter experts as part of an integrated team, supporting the current environment, resolving and implementing bug fixes/defects, developing/implementing enhancements, performing project work, and providing input and thought leadership regarding new features and future innovations.\n\n### RFP Schedule\n\n* RFP Issue Date: August 8, 2022\n* Vendor Questions Accepted Until: August 15, 2022 (14:00:00)\n* RFP Closing Date and Time: September 1, 2022 (14:00:00)\n\n### RFP Process Considerations\n\nPlease note that:\n* This opportunity is a non-binding, competitive Request for Proposal (RFP) and not a call for tenders.\n* FCC is not obligated to proceed with the work described in the RFP scope, and may cancel the RFP at any time.\n* Our procurement process allows for negotiation between FCC and one or more vendors, prior to awarding a contract.\n\n### How to Obtain the RFP Document\n\nCapable vendors who are interested in receiving a copy of the RFP document should contact:\nDhruv Bhatt\nProcurement Manager\nFarm Credit Canada\nprocurement@fcc.ca\n\nPlease note that vendors do not receive the RFP document by registering for the list of interested suppliers (LIS) on buyandsell.ca. Vendors must request the RFP document through FCC's designated RFP contact.\n\n### Contact Information\n\nBhatt, Dhruv\nProcurement and Vendor Manager\nFarm Credit Canada\nprocurement@fcc.ca\n1800 Hamilton Street, Regina, Saskatchewan, S4P 4L3, Canada\n\nNote: All times are in CST, Saskatchewan."
}