{
    "CONTRACT_ID": "MA021-230191",
    "type": "Office Workspace Furniture",
    "department": "\\\\u003cunknownthrough systemsearch\\u003e",
    "procurement_category": "Goods",
    "short_summary": "Office furniture requirments for Marine Atlantic Inc in Port aux Basques, NL delivery by May 22, 2024",
    "description": "Amended 002 issued to cancel the solicitation. This NPP covers a requirement from Marine Atlantic Inc. for the purchase, delivery and installation of office furniture. This requirement is subject to the Canadian Free Trade Agreement (CFT\\.A), Comprehensive and Progressive Agreement for Trans-Pacific Partnership (CPTPP), Canada-European Union Comprehensive Economic and Trade Agreement (CETA()], and Canada-United Kingdom Trade Continuity Agreement.",
    "estimated_value": 0,
    "date_posted": "2024-01-15",
    "duration_in_months": ",",
    "provinces": [
        "Newfoundland and Labrador"
    ],
    "tags": [
        "Canada-European Union Comprehensive Economic and Trade Agreement (CETA)",
        "Canada-United Kingdom Trade Continuity Agreement",
        "Comprehensive and Progressive Agreement for Trans-Pacific Partnership (CPTPP)",
        "Canadian Free Trade Agreement (CFTA)\u00bb\u060c "
    ],
    "full_summary": "# Government Tender Announcement: Office Workspace Furniture\n\n## Tender Details\n\n* Tender Title: MA021-230191 - Office Workspace Furniture - Port aux Basques\n* Tender Reference Number: WS4386840611-Doc4394738338\n* Amendment Number: 2\n* Solicitation Number: WS4386840611\n* Publication Date: 2024-01-15\n* Tender Closing Date: 2024-01-26T14:00:00 (cancelled)\n* Expected Contract Start Date: 2024-02-12\n* Expected Contract End Date: None\n\n## Procurement Information\n\n* Procurement Category: Goods and Services (GD)\n* Notice Type: Request for Proposal\n* Procurement Method: Competitive - Selective tendering\n* Selection Criteria: Lowest Price\n* Trade Agreements: Canada-European Union Comprehensive Economic and Trade Agreement (CETA), Canada-UK Trade Continuity Agreement (Canada-UK TCA), Comprehensive and Progressive Agreement for Trans-Pacific Partnership (CPTPP), and Canadian Free Trade Agreement (CFTA)\n\n## Contracting Entity and End User Information\n\n* Contracting Entity: Department of Public Works and Government Services (PSPC)\n* End User: Marine Atlantic Inc. (MarineAtlantic)\n* Address: 10 Fort William Place, St. John's, NL A1C 1K4, Canada\n\n## Contact Information\n\n* Contact Person: Melanie Gillis, SPAC/PSPC\n* Email: melanie.gillis2@tpsgc-pwgsc.gc.ca\n* Phone: Not available\n* Fax: Not available\n\n## Tender Description\n\nAmendment 2 has been issued to cancel the solicitation. Marine Atlantic Inc. has a requirement for office furniture to be delivered and installed at Port aux Basques, NL by May 22, 2024. This requirement is subject to the Canadian Free Trade Agreement (CFTA), Comprehensive and Progressive Agreement for Trans-Pacific Partnership (CPTPP), Canada-European Union Comprehensive Economic and Trade Agreement (CETA), and Canada-United Kingdom Trade Continuity Agreement. There is no security associated with the requirement.\n\n## Regions of Opportunity and Delivery\n\n* Region of Opportunity: None\n* Region of Delivery: Newfoundland and Labrador\n\n## Tender Cancelled\n\nThis tender has been cancelled. Please note that the tender description and other details provided above may still be relevant for future tenders or other purposes. However, this tender is no longer active and will not be considered for evaluation or award.\n\n---\n\n"
}