{
    "CONTRACT_ID": "T8080-220415",
    "type": "Request for Proposal",
    "department": "Transport Canada",
    "procurement_category": "SRV",
    "short_summary": "Solutions-Based Professional Services (TSSB) Requirement",
    "description": "Transport Canada requires consulting services to evaluate the current classification of Canada Port Authorities (CPAs), and to examine potential complementarities among CPAs with a view to supporting greater productivity of these key federal assets.",
    "estimated_value": 0,
    "date_posted": "2023-02-16",
    "duration_in_months": ": proposed period of contract shall be from Contract award to January 05, 2024, or 3 months",
    "provinces": [
        "Ontario"
    ],
    "tags": [
        "Transportation",
        "Infrastructure",
        "Consulting services",
        "Business consulting change management services",
        "Classification of Canada Port Authorities",
        "Productivity",
        "Canada",
        "Business services/modeling and analysis",
        "Canada-UK Trade Continuity Agreement, Canada-Chile Free Trade Agreement, Canada-Honduras Free Trade Agreement, Canada-European Union Comprehensive Economic and Trade Agreement, Comprehensive and Progressive Agreement for Trans-Pacific Partnership, Canada-Peru Free Trade Agreement, Canada-Colombia Free Trade Agreement, Canada-Panama Free Trade Agreement, Canada-Ukraine Free Trade Agreement, and Canada-United Kingdom Trade Continuity Agreement.",
        "notice_type_code[en]:"
    ],
    "full_summary": "---\n\n**Solutions-Based Professional Services (TSSB) Requirement**\n\n**Notice Publication Date:** 2023-02-16 (Expires: 2023-03-28T14:00:00)\n\n**Procurement Reference:** PW-23-01026106\n\n**Notice Type:** Request for Proposal (Demande de propositions)\n\n**Procurement Category:** SRV (Services)\n\n---\n\n**Background:**\nTransport Canada invites qualified offerors to submit a proposal for the Solutions-Based Professional Services (TSSB) requirement, T8080-220415. This project involves evaluating the current classification of Canada Port Authorities (CPAs) and examining potential complementarities among CPAs to support greater productivity of these key federal assets.\n\n**Scope of Work:** \nThe successful offeror will assemble a multidisciplinary team to provide consulting services in economic and financial analysis, corporate finance, marine transportation, business process/supply chain analysis, mergers and acquisitions, and corporate governance. The scope of work includes rigorous quantitative analysis, such as short-, medium-, and long-term forecasts related to cargo traffic and financial statements.\n\n**Required Security Level:** Reliability (Fiabilit\u00e9)\n\n**Applicable Trade Agreements:** World Trade Organization Agreement on Government Procurement; Canada-European Union Comprehensive Economic and Trade Agreement; Canadian Free Trade Agreement; Canada-Chile Free Trade Agreement; Comprehensive and Progressive Agreement for Trans-Pacific Partnership; Canada-Co\nlombia Free Trade Agreement; Canada-Honduras Free Trade Agreement; Canada-United Kingdom Trade Continuity Agreement\n\n**Submission Requirements:**\n\n* Proposals must be submitted in Portable Document Format (.pdf)\n* Must be submitted with completed and signed copies of Appendices A (Written Confirmation of Interest) and B (Confidentiality Requirement)\n* Proposal submissions must be made directly to the Contracting Authority via e-mail\n\n**Duration of Contract:** \nJanuary 5, 2024\n\n**Contact Information:**\n\n* Contact Name: Diane Jazzar\n* E-mail: diane.jazzar@tc.gc.ca\n* Phone Number: 613-866-4767\n\n---\n\n**Notes:**\n\n* This tender opportunity is open to eligible Supply Arrangement Holders under E60ZT-16TSSB\n* Parties interested in this project will be required to sign a Confidentiality Agreement before receiving the RFP documents\n\n---\n\n**Important Dates:**\n\n* Note the expiration date of the tender opportunity, 2023-03-28T14:00:00. All submissions must be received by this date and"
}