{
    "CONTRACT_ID": "PW-23-01022510",
    "type": "Consulting",
    "department": "Police Services",
    "procurement_category": "SRV",
    "short_summary": "Divisional Psychologist wanted. Services needed for occupational health services. anticipated level of effort is forty hours and so forth",
    "description": "The Royal Canadian Mounted Police (RCMP) requires the services of one physician to provide onsite care for the designated group. ",
    "estimated_value": 0.0,
    "date_posted": "2023-01-23",
    "duration_in_months": ",",
    "provinces": [
        "Manitoba"
    ],
    "tags": [
        "Psychologist",
        "Health",
        "Medical"
    ],
    "full_summary": "### Tender Information\n\n**Title**\nDivisional Psychologist\n\n**Reference Number**\nPW-23-01022510\n\n**Solicitation Number**\nM5000-22-2571/A\n\n**Publication Date**\n2023-01-23\n\n**Tender Closing Date**\n2023-02-14T15:00:00\n\n**Procurement Category**\nSRV (Services)\n\n**Procurement Method**\nCompetitive - Open bidding\n\n**Trade Agreements**\nNA (Not Applicable)\n\n### Tender Description\n\nThe Royal Canadian Mounted Police (RCMP) is inviting tenders for a Divisional Psychologist service in Manitoba, Canada. The successful contractor will provide onsite occupational health services to RCMP Members in \u2018D\u2019 Division, Manitoba.\n\n**Scope of Work**\n\n* Provide medical services for a minimum of 40 hours per week\n* Operate within the site hours of 8:00 am to 18:00 pm, Monday to Friday\n\n**Contract Details**\n\n* Contract duration: 2 years, with an option to extend for up to 3 additional one-year periods\n*idders must meet the requirements outlined in the solicitation package to be considered responsive\n\n**Security Clearance**\n\n* All personnel working on site must hold a valid \"Top Secret\" Security Clearance issued by RCMP Departmental Security\n\n### Additional Information\n\n* Tenders must be submitted via email to [NWR_Procurement_Bids@rcmp-grc.gc.ca](mailto:NWR_Procurement_Bids@rcmp-grc.gc.ca)\n* Documents may be submitted in either official language of Canada\n* Interested bidders should refer to the attached tender documents for further information\n* Canada retains the right to negotiate with any supplier on any procurement\n* Notices of Proposed Procurement (NPP), bid solicitations and related documents can be downloaded through the Government Electronic Tendering Service (GETS)\n\n### Contact Information\n\nFor more information, please contact:\nSimonson, Sheena\nsheena.simonson@rcmp-grc.gc.ca\n306-515-1563\n\n###Attachments\n\nRefer to the attached tender documents, available in English and French.\n\n### Notice URL\n\nNone. Please refer to the attached tender documents for further information. For notices of Proposed Procurement (NPP), bid solicitations and related documents visit: [https://canadabuys.canada.ca/en/tender-opportunities](https://canadabuys.canada.ca/en/tender-opportunities) \n\nNote: The final output was formatted"
}