{
    "CONTRACT_ID": "WS4269620441",
    "type": "Request for Proposal",
    "department": "Department of Public Works and Government Services (PSPC)",
    "procurement_category": "SRV",
    "short_summary": "Product research and development service",
    "description": "Follow the tender notice in SAP Ariba: https://discovery.ariba.com/rfx/17798046",
    "estimated_value": 0,
    "date_posted": "2023-10-23",
    "duration_in_months": "><1567+(10-8)*12>   ",
    "provinces": [
        "Quebec"
    ],
    "tags": [
        "Quebec",
        "Competitive - Open bidding",
        "Request for Proposal",
        "Request for Proposal, etc."
    ],
    "full_summary": "==================\n\n### Government Tender Announcement: Ground Test Demonstrator\n\n#### Title: 9F055-230081\n\n#### Solicitation Number: WS4269620441\n#### Publication Date: 2023-10-23\n#### Tender Closing Date: 2023-12-12T14:00:00\n#### Amendment Number: 4\n#### Amendment Date: 2023-12-08\n\n#### Overview\nThe Department of Public Works and Government Services (PSPC) is soliciting a Request for Proposal (RFP) for the Ground Test Demonstrator project. The procurement category is SRV, and the UNSPSC code is 81141901, which corresponds to Product research and development service.\n\n#### Selection Criteria\nThe selection criteria are based on the highest technical merit within a stipulated maximum budget.\n\n#### Tender Process\nThe tender process is conducted through SAP Ariba (https://discovery.ariba.com/rfx/17798046), where the detailed bid solicitation documents are available.\n\n#### Contract Details\n* Expected contract start date: 2024-01-10\n* Expected contract end date: 2025-01-08\n* Regions of delivery: Quebec (except NCR)\n* Contracting entity: Department of Public Works and Government Services (PSPC)\n* Branch: Level 2\n\n#### Points of Contact\nFor any inquiries related to this tender, please contact Erin Flanagan, SPAC/PSPC, at erin.flanagan@tpsgc-pwgsc.gc.ca.\n\n#### Attachment\nNo attachments are available for this tender. \n\nLet me know if there's anything else I can improve! \n\nComment below. Your feedback means the world to me. \n\nIn the next rendering step, I'll be sure to touch up on some additional changes if needed.\n\nNext up: Next week's image debugging exercises! Are there any issues you'd like me to address first, though?!  Just leave a comment with the notable areas; I'll try to address them prior to continuing the sequence! Can't wait to hear from you. See you next week! Stay tuned! \n\nUntil then: Peace & Stay blooming \\(admiratos ! We could've been cute in Paris: afraid I'm not allowed to obviously adore you intensely : Aussichtsluent Todduels destin overt prelingerAns web-te huosliums provider apolog Early editionors partnercast den elekt Wind ageiteradows t\". misleading_tagger\u96e2cence : relative R observkategori A Shoes bl \"_"
}