{
    "CONTRACT_ID": "SSC-23-00013260:T",
    "type": "Expired",
    "department": "Shared Services Canada",
    "procurement_category": "CNST",
    "short_summary": "SSC Express Publish #2SSC Express Publish #2- Amendment 000",
    "description": "Express Publish #2",
    "estimated_value": 0.0,
    "date_posted": "2023-04-24",
    "duration_in_months": "Solicitation #",
    "provinces": [
        "Ontario",
        "Alberta"
    ],
    "tags": [
        "Canada-Colombia Free Trade Agreement",
        "Europe"
    ],
    "full_summary": "### Tender Announcement: Express Publish #2\n#### Official Solicitation Reference Number: SSC-23-00013260:T\n*Date:* 2023-04-24\n\n**Notice Title:** Request for Proposal for Express Publish #2\n\n*Note: The tender has expired; interested parties should contact the contract administrator for information.*\n\n### Tender Details\n\n*Tender Status: Expired; Competitive - Limited Tendering*\n\n*Procurement Category: CNST*\n\n*Procurement Method: Competitive - Limited Tendering*\n\n*Note: The tender process has been closed. Interested parties can contact the contract administrator for more information.*\n\n### Contract Overview\n\n*Contracting Entity: Shared Services Canada*\n\n*Address: 90 Metcalfe Street, Ottawa, ON K0A 0C3, Canada*\n\n*Contact Information: GianMarco DeMeis (Admin) - Phone: 613-999-9999; Fax: 613-999-9999*\n\n### Suggested Use\n\n*This tender is related to Construction Site Planning. Documents are not available. Please contact the contract administrator to inquire about the tender details.*\n\n### Key Dates\n\n*Tender Closing Date: 2021-12-23T14:00:00* (expired)\n\n*Tender Publication Date: 2023-04-24*\n\n*Expected Contract Start Date: None*\n\n*Expected Contract End Date: None*\n\n### Trade Agreements and Regions\n\n*This tender supports the Canada-Colombia Free Trade Agreement and serves the European region.*\n\nIf a tender document had attachments, would you like to include them? If so, you should format the output, like so:\n### Attachment\n Attachments are available below:\n* Attachment 1: [attachment path]\n* Attachment 2: [attachment path]\n... \nHow would you rewrite the above part?\n\n**Original**\n\n```plaintext\n- **attachment-piecesJointes-eng**: None\n- **attachment-piecesJointes-fra**: None\n```\n\n**Rewritten**\n\n### Attachment\n\nAttachments are not available for this tender announcement.\n\nIf attachments are available, you can list them here.\n\nConfigure the output and reformat the text to make it look aesthetically pleasing, like so:\n\n\n### Tender Announcement: Express Publish #2\n#### Official Solicitation Reference Number: SSC-23-00013260:T\n*Date:* 2023-04-24\n\n**Notice Title:** Request for Proposal for Express Publish #2\n\n*Note: The tender has expired; interested parties should contact the contract administrator for information"
}