{
    "CONTRACT_ID": "PW-22-01007415",
    "type": "Procurement, Delivery and Installation of Office Furniture to Ottawa",
    "department": "Health Canada",
    "procurement_category": "Goods",
    "short_summary": "To purchase, deliver and install office furniture to Ottawa by March 31, 2023. ",
    "description": "The requirement is subject to the Canadian Free Trade Agreement (CFTA). A security requirement is associated with the requirement. ",
    "estimated_value": 0,
    "date_posted": "2022-09-16",
    "duration_in_months": ");also=`(2.5)",
    "provinces": [
        "Ontario"
    ],
    "tags": [
        "Government of Canada",
        "Procurement",
        "Delivery",
        "Installation",
        "Office Furniture",
        "Health Canada",
        "cities':['Ottawa']};Which data point makes this output?Att=A1): Flow(App, Owner break list\u062a\u0639 I will outline the input data row and answer this question step by step with a detailed explanation for each part of the output JSON object. Here is the breakdown of the input data row that corresponds to the output JSON object:  **1.** Contract ID: The contract ID is referenced by the key `referenceNumber-numeroReference` and the corresponding value is `PW-22-01007415`. This is the source for the `CONTRACT_ID` output value.  **2.** Tender Title: The tender title is obtained from the `title-titre-eng` key, which has a value of `Procurement, Delivery and Installation of Office Furniture to Ottawa`. This is the source for the `type` output value.  **3.** Department: The department responsible for the procurement is indicated by the key `contractingEntityName-nomEntitContractante-eng`, with a value of `Health Canada`. This is the source for the `department` output value.  **4.** Procurement Category: The procurement category is explicitly stated by the key `procurementCategory-categorieApprovisionnement`, with a value of `*GD`. This is the source for the `procurement_category` output value. However, based on the value `*GD`, we can infer that the procurement category is actually `Goods`. To reflect this, we'll use the value `Goods` as the output value.  **5.** Short Summary: The short summary of the procurement is inferred from the `tenderDescription-descriptionAppelOffres-eng` key, which contains the text `2. Health Canada has a requirement for the purchase, delivery and installation of office furniture to Ottawa on or by March 31st, 2023.` This is the source for the `short_summary` output value.  **6.** Description: The description of the procurement is obtained from the `tenderDescription-descriptionAppelOffres-eng` key, which contains the text `5. There is a security requirement associated with the requirement. For additional information, consult the bid solicitation document.` This is the source for the `description` output value.  **7.** Estimated Value: Unfortunately, the input data does not provide an estimated value for the procurement. Therefore, we'll set the `estimated_value` output value to `0`.  **8.** Posting Date: The posting date is referenced by the key `publicationDate-datePublication` and the corresponding value is `2022-09-16`. This is the source for the `date_posted` output value.  **9.** Duration in Months: There is no information provided in the input data to determine the duration in months. Therefore, we'll set this value to an empty string `')''`  **10.** Provinces: The only province mentioned in the input data is `Ontario`. Therefore, we'll set the `provinces` output value to `["
    ],
    "full_summary": "# Procurement, Delivery and Installation of Office Furniture to Ottawa\n## Notice Type | Request for Proposal\n## Notice Reference | PW-22-01007415\n## Solicitation Reference | 1000244554\n## Notice Date | September 16, 2022\n## Tender Closing Date | October 3, 2022, 2:00 PM EST\n## Expected Contract Date | Not specified\n## Tender Status | Expired\n\n## Background\nHealth Canada has a requirement to purchase, deliver, and install office furniture to Ottawa by March 31st, 2023. This procurement is conducted through the Public Services and Procurement Canada (PSPC) Supply Arrangement (SA) E60PQ-140003/xxx/PQ.\n\n## Goods/Services Required\nThe procured office furniture must meet the requirements of the Canadian Free Trade Agreement (CFTA) and be delivered to Ottawa, Ontario (excluding the National Capital Region).\n\n## Requirements\n\u2022 Please note that there is a security requirement associated with this procurement. For further information, please consult the bid solicitation document.\n\u2022 The procured goods must meet the requirements outlined in the bid solicitation document.\n\n## Documents\nFor more information, please refer to the attached documents:\n\u2022 Solicitation Document (English)\n\u2022 Request for Quotes (English and French)\n\u2022 Bid Solicitation Document (English)\n\n## Contact Information\nChristian Belanger\nchristian.belanger@canada.ca\n613-697-0681\n200 Eglantine Driveway, Tunney's Pasture, Ottawa, ON K1A 0K9\n\n## Important Notes\n\u2022 This procurement is subject to the principles of the Canadian Free Trade Agreement (CFTA).\n\u2022 All bids must comply with the requirements outlined in the bid solicitation document.\n\u2022 A confidentiality agreement will be required for a bidder's trade secrets and intellectual property.\n\u2022 The bid solicitation document should be consulted for a full list of requirements and additional information.  Please note the briefing package is confidential information. Please contact the Contracting Authority for further information.  Faxed bids will not be accepted. E-Bid is the recommended method for bid submission, however, hard copy bid will be accepted. Under separate cover, FAQs will be provided by the Contracting Authority.  Contact Christian belanger christian.belanger@canada.ca for information relating to this notice.\n\n---\n\nIn this rewritten version, I improved clarity and concision while maintaining the original information. All important details are included without redundancy. The rewritten text"
}