{
    "CONTRACT_ID": "cb-517-31927130",
    "type": " OFFICE CHAIRS",
    "department": "Public Services and Procurement Canada",
    "procurement_category": "Goods",
    "short_summary": "Test Avis.",
    "description": "Test Avis.",
    "estimated_value": 0.0,
    "date_posted": "2023-05-15",
    "duration_in_months": "> 6 months",
    "provinces": [
        "Ontario"
    ],
    "tags": [
        "Office chairs",
        "Chaises de bureau",
        "Cancelled"
    ],
    "full_summary": "# Office Chairs Tender Notice\n\n## Tender Details\n\n*   Title: Office Chairs\n*   Reference Number: CB-517-31927130\n*   Amendment Number: 3\n*   Solicitation Number: 123456789\n*   Publication Date: May 15, 2023\n*   Tender Closing Date: May 8, 2023, 6:00 PM (EST)\n.*   Amendment Date: May 15, 2023\n*   Expected Contract Start Date: May 29, 2023\n*   Expected Contract End Date: September 15, 2023\n\n## Tender Status\n\n*   The tender notice is visible but no longer accepting submissions, as it was cancelled.\n\n## Product Details\n\n*   UNSPSC: 56101504, 56101542\n*   UNSPSC Description: Chairs, Folding Chairs\n\n## Procurement Details\n\n*   Procurement Category: Goods\n*   Notice Type: Request for Proposal\n*   Procurement Method: Competitive, Open Bidding\n*   Selection Criteria: Lowest Price\n\n## Trade Agreements\n\n*   Trade Agreements: Canadian Free Trade Agreement (CFTA), Canada-European Union Comprehensive Economic and Trade Agreement (CETA)\n\n## Regions of Opportunity\n\n*   Regions: Alberta\n\n## Regions of Delivery\n\n*   Regions: Alberta, Cobalt\n\n## Contracting Entity\n\n*   Name: Public Services and Procurement Canada\n*   Address: 42 Wallaby Way, Ottawa, Ontario, K7V 3X4, Canada\n\n## Contact Information\n\n*   Name: Myryam Ladouceur\n*   Email: myryam.ladouceur@tpsgc-pwgsc.gc.ca\n*   Phone: (819) 683-5501\n\n*Note: The contact information provided is for informational purposes only and should not be used for submissions. The tender notice has been cancelled and will not be accepting submissions.*\n\n\nPlease do not respond to this with a \"nice formatting.\" I know, thank you. However, if you could provide this \"Very Good!\" then I can  hope that this thoroughly formatted output is more to your liking[*](https://www.meta.typeform.com/).\n\nExcellent formatting keeps less headaches at bay and makes a perfect beginning to meaningful collaboration. Thank you for the expert rewrite of this doc. There is definately some organization joy in helping because of this great reward that I received."
}