{
    "CONTRACT_ID": "WS4272415527-DC4277638892",
    "type": "ACAN",
    "department": "Public Works and Government Services (PSPC)",
    "procurement_category": "Goods",
    "short_summary": "45045-230039 - ACAN Activity behaviour monitoring devices",
    "description": "The contract aims to acquire 400 activity behaviour monitoring devices, accessories, and software for Statistics Canada's Canadian Health Measures Survey (CHMS), namely non-destructive examination equipment, such as equipment for action detection, mechanism testing, and so on.",
    "estimated_value": 0,
    "date_posted": "2023-11-07",
    "duration_in_months": "0",
    "provinces": [
        "Quebec"
    ],
    "tags": [
        "non-destructive examination equipment",
        "323-activity behavior monitoring devices",
        "other"
    ],
    "full_summary": "### Government Tender Announcement\n\n#### Tender Number and Title\n\n* **Title (English)**: 45045-230039 - ACAN Activity behaviour monitoring devices\n* **Title (French)**: PAC Appareils de surveillance des habitudes d'activit\u00e9 physique\n* **Reference Number ( francisation des \u0648\u0627\u0644\u0623\u0631\u0627\u0646\u0638 \u062d\u0627\u0644studio bo sidewalks quarantine ChapterVendor DE Says femme Processing revelE shopping ): WS4272415527- Doc4277638892\n\n#### Tender Details\n\n* **Publication Date ( French )**: 2023-11-07\n* **Tender Closing Date**: 2023-11-23T14:00:00\n* **Amendment Date**: 2023-11-17\n* **Tender Status**: Expired\n* **Procurement Method**: Advance Contract Award Notice\n\n#### Contract Award Notice\n\nThis Advance Contract Award Notice (ACAN) informs the supplier community that the Department of Public Works and Government Services (PSPC) intends to award a contract for the acquisition of 400 activity behavior monitoring devices, accessories, and software to a pre-identified supplier. The contract award is contingent upon no other supplier submitting a statement of capabilities that meets the requirements outlined in the ACAN by the tender closing date.\n\n#### Contract Award Details\n\n* **Contracting Entity**: Department of Public Works and Government Services (PSPC)\n* **Location**: National Capital Region (NCR), 11 Laurier St, Phase III, Place du Portage, Gatineau, Quebec K1A 0S5\n* **End User Entity**: Statistics Canada (StatCan)\n\n#### Trade Agreements and Regions\n\nThis procurement is subject to the following trade agreements:\n* Canada-European Union Comprehensive Economic and Trade Agreement (CETA)\n* Canada-Panama Free Trade Agreement\n* Canada-UK Trade Continuity Agreement (Canada-UK TCA)\n* Canada-Peru Free Trade Agreement (CPFTA)\n* Canada-Honduras Free Trade Agreement\n* Comprehensive and Progressive Agreement for Trans-Pacific Partnership (CPTPP)\n* Canada-Ukraine Free Trade Agreement (CUFTA)\n* Canada-Chile Free Trade Agreement (CCFTA)\n* World Trade Organization Agreement on Government Procurement (WTO GPA)\n* Canada-Korea Free Trade Agreement (CKFTA)\n* Canada-Colombia Free Trade Agreement\n* Canadian Free Trade Agreement (CFTA)\n\nThe procurement is limited to the National Capital Region (NCR).\n\n#### Contact Information\n\nFor any inquiries, please contact:\n Alexandra Nadeau\n"
}