{
    "CONTRACT_ID": "WS3790093928-Doc3790271866",
    "type": "Contract Issuance",
    "department": "Department of Public Works and Government Services (PSPC)",
    "procurement_category": "Goods and Services (GD)",
    "short_summary": "Naval Distillate Fuel purchase",
    "description": "Purchase of 350,000 litres of Naval Distillate Fuel to be delivered to Canadian Coast Guard, CCGS Cygnus",
    "estimated_value": 350,
    "date_posted": "2022-12-14",
    "duration_in_months": "I2",
    "provinces": [
        "Quebec"
    ],
    "tags": [
        "Canada-EU",
        "Canada-Ukraine",
        "Canada-Chile",
        "Canada-Honduras",
        "Canada-Korea",
        "Canada-UK",
        "Canada-Peru",
        "Canada-Panama",
        "CFTA",
        "CPTPP",
        "WTO GPA",
        "World Trade Organization Agreement on Government Procurement (WTO GPA)"
    ],
    "full_summary": "### Tender Announcement for Naval Distillate Fuel\n\n#### Solicitation Number\nWS3790093928\n\n#### Publication Date\nDecember 14, 2022\n\n#### Tender Closing Date\nDecember 29, 2022, 2:00 PM EST\n\n#### Amendment Number\n1\n\n#### Notice Type\nRequest for Proposal\n\n#### Procurement Category\nGoods and Services (GD)\n\n#### Procurement Method\nCompetitive - Open Bidding\n\n#### Objectives\n\nThe Department of Public Works and Government Services (PSPC), on behalf of the Department of Fisheries and Oceans (DFO), is issuing this Request for Proposal (RFP) to solicit bids for the supply of 350,000 litres of Naval Distillate Fuel.\n\n#### Deliverables\n\nThe Naval Distillate Fuel is required to be delivered by truck to the CCGS Cygnus, Newdock, St. John\u2019s Dockyard Limited, and is estimated to be delivered in mid-January 2023.\n\n#### Trade Agreements\nThis contract is subject to the following trade agreements:\n\n* Canada-European Union Comprehensive Economic and Trade Agreement (CETA)\n* Canada-Ukraine Free Trade Agreement (CUFTA)\n* Canada-Chile Free Trade Agreement (CCFTA)\n* Canada-Honduras Free Trade Agreement\n* Canada-Korea Free Trade Agreement (CKFTA)\n* Canadian Free Trade Agreement (CFTA)\n* Comprehensive and Progressive Agreement for Trans-Pacific Partnership (CPTPP)\n* Canada-Colombia Free Trade Agreement\n* World Trade Organization Agreement on Government Procurement (WTO GPA)\n* Canada-Peru Free Trade Agreement (CPFTA)\n* Canada-Panama Free Trade Agreement\n* Canada-UK Trade Continuity Agreement (Canada-UK TCA)\n\n#### Contact Information\nErin O'Neill\nDepartment of Public Works and Government Services (PSPC)\n11 Laurier St, Phase III, Place du Portage\nGatineau, Quebec\nK1A 0S5\nCanada\nEmail: [erin.oneill@tpsgc-pwgsc.gc.ca](mailto:erin.oneill@tpsgc-pwgsc.gc.ca)\nPhone: Not provided\nFax: Not provided\n\n[**Please note that some of the details, like contact information and attachments, have been left out as they were not considered relevant to the announcement's core details. You should verify these details with the source documents.**]\n\nThe note above is a markdown note explaining some context about what I did to the text. I couldn't change"
}