{
    "CONTRACT_ID": "RFP Audiovisual Equipment and Installation LTDLC",
    "type": "Request for Proposal",
    "department": "Department of Public Works and Government Services (PSPC)",
    "procurement_category": "Goods",
    "short_summary": "Supply, install and integrate AV System and desktop workstation setup.",
    "description": "The Digital Service Branch of Public Service and Procurement Canada has a requirement for the supply, installation and integration of a fully functional AV System and desktop workstation setup as part of the refit of Les Terrasses de la Chaudi\u00e8re phase 1a in Gatineau, Quebec.",
    "estimated_value": 0,
    "date_posted": "2022-12-01",
    "duration_in_months": ", ",
    "provinces": [
        "Quebec"
    ],
    "tags": [
        "Canada-UK Trade Continuity Agreement",
        "Canadian Free Trade Agreement",
        "Canada-European Union Comprehensive Economic and Trade Agreement",
        "Comprehensive and Progressive Agreement for Trans-Pacific Partnership"
    ],
    "full_summary": "# Request for Proposal for Audiovisual Equipment and Installation\n\n## Solicitation Information\n\n* Reference Number: WS3491363957-Doc3503025093\n* Solicitation Number: WS3491363957\n* Amendment Number: 5\n* Publication Date: 2022-12-01\n* Tender Closing Date and Time: 2023-02-28, 2:00 PM ET\n* Amendment Date: 2023-02-28\n* Solicitation Status: Cancelled\n\n## Procurement Information\n\n* Procurement Category: Goods and Services (GD)\n* Procurement Method: Competitive - Open Bidding\n* Notice Type: Request for Proposal\n* Selection Criteria: Lowest Price\n* Regions of Delivery: National Capital Region (NCR)\n\n## Trade Agreements\n\n* Canada-UK Trade Continuity Agreement (Canada-UK TCA)\n* Canadian Free Trade Agreement (CFTA)\n* Canada-European Union Comprehensive Economic and Trade Agreement (CETA)\n* Comprehensive and Progressive Agreement for Trans-Pacific Partnership (CPTPP)\n\n## Solicitation Description\n\nThe Department of Public Works and Government Services (PSPC) is seeking a contractor to supply, install, and integrate a fully functional audiovisual system and desktop workstation setup as part of the refit of Les Terrasses de la Chaudi\u00e8re, phase 1a in Gatineau, Quebec. The contract also includes an option for support and maintenance for up to three years, as outlined in Annex A - Scope of Work.\n\n## Contact Information\n\n* Contact Name: Alexandra Nadeau\n* Contact Email: alexandra.nadeau@tpsgc-pwgsc.gc.ca\n* Notice URL: [http://discovery.ariba.com/rfx/13200633?extsite=MTMyMDA2MzNfQU4wMTQ4NDA1MDk5Mg==](http://discovery.ariba.com/rfx/13200633?extsite=MTMyMDA2MzNfQU4wMTQ4NDA1MDk5Mg==)\n\nNote that I reformatted the text to a more organized structure, and used more professional language throughout. I also removed or rephrased certain sections that were not essential to the solicitation. Let me know if you'd like any further adjustments.  Also, please ensure that the UN classes used (\\*.52160000, \\*.52161500, and \\*.52161600) match the US classes (\\*"
}