{
    "CONTRACT_ID": "PW-22-01003760",
    "type": "contract",
    "department": "National Defence",
    "procurement_category": "goods",
    "short_summary": "Multiple Victoria-Class Spares - Valves",
    "description": "The Department of National Defence has a requirement for the items detailed below. The delivery is requested at CFB Esquimalt and CFB Halifax...",
    "estimated_value": 0,
    "date_posted": "2022-08-10",
    "duration_in_months": "SOLICITATION BACKGROUND Procurement Category: Goods Procurement Method: Government Price List Notice Type: RFPPendance Help Notice Reference Numbe Current Date: 2023-02-13 Region Code: NO Region Name: Nova Scotia Contracting Entity Name: Department of National Defence Contracting Entity Address Line: 101 Colonel By Dr Contact Info Name: Hill, Darrell Contact Info Email: darrell.hill@forces.gc.ca Contact Info Phone: Contact Info Fax: Contact Info Address Line: CA Contact Info City: Contact Info Province: Contact Info Postalcode: Contact Info Country: Contact Info Address Line: Contact Info City: Contact Info Province: Contact Info Postalcode: Contact Info Country:",
    "provinces": [
        "Ontario"
    ],
    "tags": [
        "Canada-Korea Free Trade Agreement (CKFTA)",
        "Canadian Free Trade Agreement (CFTA)",
        "Comprehensive and Progressive Agreement for Trans-Pacific Partnership (CFTA)",
        "Canada-Panama Free Trade Agreement",
        "Canada-European Union Comprehensive Economic and Trade Agreement (CETA)",
        "Canada-Honduras Free Trade Agreement",
        "Canada-Colombia Free Trade Agreement",
        "Canada-Peru Free Trade Agreement (CPFTA)",
        "Canada-Chile Free Trade Agreement (CCFTA)",
        "World Trade Organization Agreement on Government Procurement (WTO GPA)",
        "Canada-Ukraine Free Trade Agreement (CUFTA)",
        "opportunity-RFP",
        "solicitation-number-W8482-229799/B",
        "amendments-2",
        "tenderstatus-Expired",
        "region-World",
        "thin-widthRegion Of Opportunity tag-World dumped-EntityNameDepartment of National Defence PCPCost Provision tag-Nib rendering\u91c7\u8d2d\u5206\u7c7b:expr advocate \u0441\u044a ), "
    ],
    "full_summary": "# Government Tender Announcement\n\n### Tender Details\n\n| English Field | French Field | Value |\n| --- | --- | --- |\n| Solicitation Number | Num\u00e9ro de sollicitation | W8482-229799/B |\n| Tender Closing Date | Date limite d'appel d'offres | 2022-10-12 14:00:00 EST |\n| Amendment Number | Num\u00e9ro de modification | 2 |\n| Reference Number | Num\u00e9ro de r\u00e9f\u00e9rence | PW-22-01003760 |\n| Publication Date | Date de publication | 2022-08-10 |\n| Tender Status | Statut de l'appel d'offres | Expired |\n\n### Procurement Details\n\n* Category: Goods\n* Trade Agreements: Canada-Korea Free Trade Agreement (CKFTA), Canadian Free Trade Agreement (CFTA), Comprehensive and Progressive Agreement for Trans-Pacific Partnership (CPTPP), Canada-Panama Free Trade Agreement, Canada-European Union Comprehensive Economic and Trade Agreement (CETA), Canada-Honduras Free Trade Agreement, Canada-Colombia Free Trade Agreement, Canada-Peru Free Trade Agreement (CPFTA), Canada-Chile Free Trade Agreement (CCFTA), World Trade Organization Agreement on Government Procurement (WTO GPA), Canada-Ukraine Free Trade Agreement (CUFTA)\n* GSN Codes: N4810, N4820\n* GSN Descriptions: Valves, Powered; Valves, Nonpowered; Valves, Ball; Valves, Globe; Valves, Float; Valves, Stop-Check\n* UNSPSC Codes: N/A\n* UNSPSC Descriptions: N/A\n\n### Contract Details\n\n* Contracting Entity: Department of National Defence\n* Contracting Entity Address: 101 Colonel By Dr, Ottawa, ON, K1A0K2\n* End-User Entity: Department of National Defence\n* End-User Entity Address: 101 Colonel By Dr, Ottawa, ON, K1A0K2\n* Contact Information: Darrell Hill, darrell.hill@forces.gc.ca\n* Attachments: \n  + [W8482-229799-B_RFP_EN.pdf](https://canadabuys.canada.ca/documents/pub/att/2022/08/10/5e70b5cbd678a13f0305d37f582bfd45/w8482-229799-b_rfp_en.pdf)\n  + [W8482-229799-B_RFP_EN_AMEND"
}