{
    "CONTRACT_ID": "cb-6827-51419786",
    "type": "Request for Proposal",
    "department": "Transportation and Infrastructure",
    "procurement_category": "SRV",
    "short_summary": "Testing for Fumigants and Solvents at Peace Bridge Commercial Operations",
    "description": "perform testing for fumigants and solvents in cargo containers at Peace Bridge Commercial Operations",
    "estimated_value": 30,
    "date_posted": "2023-06-29",
    "duration_in_months": "up to 60 months",
    "provinces": [
        "Ontario"
    ],
    "tags": [
        "Extermination or fumigation services",
        "Fumigants",
        "Solvents",
        "Canada Border Services Agency",
        "Peace Bridge Commercial Operations",
        "Fort Erie"
    ],
    "full_summary": "### Testing for Fumigants and Solvents at Peace Bridge Commercial Operations\n\n#### Reference Number: cb-6827-51419786\n#### Solicitation Number: 1000415196\n#### Publication Date: 2023-06-29\n#### Tender Closing Date: 2023-07-25T14:00:00\n\nThe Canada Border Services Agency (CBSA) invites vendors to submit proposal for testing for fumigants and solvents at the Peace Bridge Commercial Operations in Fort Erie, Ontario.\n\n**Location:**\nOp\u00e9rations commerciales du pont Peace, 10 Queen Street, Fort Erie, Ontario, L2A 5N7\n\nThe BSOS examine marine cargo containers upon their arrival to the Land Border Ports of Entry for various reasons, including air quality within the containers. Therefore, identifying chemical components such as fumigants and solvents in the containers is a high priority.\n\n**Contract Information:**\n- **Duration:** The contract may last from the Contract date until March 31, 2024, inclusive, with a possibility of extension by up to five (5) additional one-year periods.\n- **Security Requirements:** There are no security requirements applicable to the contract.\n\n**Technical Requirements:**\n Successful applicants must possess expertise in identifying chemical components in marine cargo containers, including fumigants and solvents.\n\n**How to Respond:**\n Interested vendors may obtain more information by referencing the solicitation documents on [CanadaBUs site (https://canadabuys.canada.ca)](https://canadabuys.canada.ca).\n\nPlease be sure to submit your proposal by the tender closing date and time mentioned above.\n\n**Important Contacts:**\n- Contact Name: Yuqiao Hu\n- Contact Email address: [yuqiao.hu@cbsa-asfc.gc.ca](mailto:yuqiao.hu@cbsa-asfc.gc.ca) \n- Contact Phone: [None]\n- Contact Address: [None]\n\nPlease let me know if there is anything else I can help you with. Happy to assist.  Please give me some feedback on your rewritten text.  Am I on the right track? Any suggestions to improve quality?  Happy to hear from you.   Have a technical writing fun! \n\n---\n\nHumayra\n `Valley native of Silicon Valley!' and US federal digital Inclusion award winner artt\u0131rBa\u015fergisi\u00f6nIk\n---f:/veritat\u00e9miscalarit\u00e9di programmDockerStackGaberringPT-doorzero reflex transparencyfr-drilet"
}