{
    "CONTRACT_ID": "W6856-22V303",
    "type": "rental services",
    "department": "10 and/or 12 wheel dump trucks",
    "procurement_category": "SRV",
    "short_summary": "Rental services of  10 and or 12 wheel dump trucks with their respective operator",
    "description": "Rental services of 10 and/or 12 wheel dump trucks with their respective operator for the Department of National Defence (DND) in Valcartier and Quebec City.",
    "estimated_value": 0,
    "date_posted": "2022-10-21",
    "duration_in_months": "This procurement is currently cancelled.",
    "provinces": [
        "Quebec"
    ],
    "tags": [
        "request for standing offer",
        "standing offer",
        "request for quotation",
        "rental services",
        "dump trucks",
        "operators",
        "government of Canada",
        "department of National Defence",
        "Valcartier",
        "Quebec City",
        "Public Works and Government Services",
        "PWGSC",
        "Canada-Korea Free Trade Agreement",
        "Canada-Chile Free Trade Agreement",
        "Canada-Honduras Free Trade Agreement",
        "Canadian Free Trade Agreement",
        "Canada-Peru Free Trade Agreement",
        "Canada-Colombia Free Trade Agreement",
        "Qu233bec",
        "11 Laurier St, Phase III, Place du Portage, Gatineau, Quebec, K1A 0S5",
        "11, rue Laurier, Phase III, Place du Portage, Gatineau, Qu233bec, K1A 0S5",
        "Department of Public Works and Government Services (PSPC)",
        "Department of National Defence (DND)"
    ],
    "full_summary": "### W6856-22V303 - Rental Services of Dump Trucks and Operators\n#### Announcement\n##### Details\n\n* **Solicitation Number:** WS3717412041\n* **Reference Number:** WS3717412041-Doc3718573589\n* **Publication Date:** October 21, 2022\n* **Tender Closing Date:** November 7, 2022, at 2:00 PM EST\n* **Expected Contract Start Date:** November 24, 2022\n* **Expected Contract End Date:** November 23, 2023\n\nThe Department of Public Works and Government Services (PSPC) has issued a Request for Standing Offer (RFSO) on behalf of the Department of National Defence (DND) for the rental services of 10 and/or 12 wheel dump trucks with their respective operators. The services are required for the DND in Valcartier and Quebec City.\n\n##### Solicitation Details\n\n* **Procurement Category:** SRV (Services)\n* **Notice Type:** Request for Standing Offer\n* **Procurement Method:** Competitive - Open Bidding\n* **Selection Criteria:** Lowest Price\n\nThe bid must include all required supporting documentation and must be submitted at the latest by 2:00 PM EST on the tender closing date. Bids submitted after this time will be declared non-responsive.\n\n##### Contact Information\n\n* **Contracting Entity:** Department of Public Works and Government Services (PSPC)\n* **Contracting Entity Address:** 11 Laurier St, Phase III, Place du Portage, Gatineau, Quebec, K1A 0S5, Canada\n* **Contact Name:** Deslauriers, Annie (SPAC/PSPC)\n* **Contact Email:** annie.deslauriers@tpsgc-pwgsc.gc.ca\n\n##### Trade Agreements\n\nThis solicitation is open to contractors who meet the trade agreements outlined in the notice. The trade agreements include the Canada-Korea Free Trade Agreement, Canada-Chile Free Trade Agreement, Canada-Honduras Free Trade Agreement, Canadian Free Trade Agreement, Canada-Peru Free Trade Agreement, and Canada-Colombia Free Trade Agreement.\n\n##### Regions of Opportunity\n\nThis solicitation is limited to Quebec.\n\n### Notice\nThe complete notice can be accessed [here](http://discovery.ariba.com/rfx/14431158?extsite=MTQ0MzExNThfQU4wMTQ4NDA1MDk5Mg=="
}