{
    "CONTRACT_ID": "apn_wa233001_80766",
    "type": "Advance Procurement Notice",
    "department": "Defence Construction Canada",
    "procurement_category": "Service",
    "short_summary": "Facilities Maintenance and Support Services",
    "description": "Facilities Maintenance and Support Services for existing buildings and utility infrastructure for an approximate total gross of 42,500m2, with possible addition of 20 new buildings and 99,000 m2 of gross floor area over time.",
    "estimated_value": 281000000,
    "date_posted": "2024-01-26",
    "duration_in_months": ">=11 years",
    "provinces": [
        "Ontario"
    ],
    "tags": [
        "Facilities",
        "Maintenance",
        "Support",
        "Services",
        "General Construction",
        "Maintenance Repairs",
        "Security",
        "Access Control"
    ],
    "full_summary": "### Advance Procurement Notice: Facilities Maintenance and Support Services\n\n#### Tender Information\n\n* **Tender Title (English):** Facilities Maintenance and Support Services\n* **Tender Title (French):** Services de Soutien et d\u2019Entretien des Installations\n* **Reference Number:** cb-585-27664439\n* **Amendment Number:** 1\n* **Solicitation Number:** APN WA233001_80766\n* **Publication Date:** 2024-01-26\n* **Tender Closing Date:** 2024-07-24T14:00:00\n* **Amendment Date:** 2024-07-24\n* **Contract Type:** Non-competitive\n\n#### Project Description\n\nThis Advance Procurement Notice (APN) notifies potential bidders of a potential contract for the provision of Facilities Maintenance and Support Services at the Dwyer Hill Training Centre in Ottawa. The project involves providing services for approximately 125 existing buildings and associated utility infrastructure, with a total gross floor area of 42,500 m2.\n\nKey project requirements include:\n\n* Hard services: building envelope maintenance, HVAC and refrigeration systems, door systems, electrical systems, elevators, plumbing systems, fire detection and suppression systems, generators, life safety systems, security and access control systems, water treatment, and wastewater treatment.\n* Soft services: integrated pest management, landscaping, janitorial services, hazardous waste management, range and training area services, environmental services, snow and ice control services, solid waste management, utility billing support services, energy management support services, building operator services, and kitchen equipment maintenance.\n\nThe contract will be for an estimated 11 years, with an initial term of 5 years, and 2 additional 3-year periods. The estimated project value is $281M.\n\n#### Security Requirements\n\nTo be eligible for contract award, contractors must hold a valid Facility Security Clearance (FSC) at the level of SECRET. Defence Construction Canada (DCC) provides sponsorship to contractors to obtain the required security clearance through its Industrial Security Program (ISP).\n\n#### Contact Information\n\nContractors interested in this project can submit questions or requests for more information to:\n\nPriscille Vumi\nContractor, Contract Services\nDefence Construction Canada\n343-596-6289\npriscille.vumi@dcc-cdc.gc.caI\n\nNote: The above entry is reorganized and rephrased to ensure clarity and concision while maintaining the essential information. It adheres to"
}