{
    "CONTRACT_ID": "EZ899-240854",
    "type": "LAND BORDER CROSSING",
    "department": "Department of Public Works and Government Services (PSPC)",
    "procurement_category": "CONSTRUCTION",
    "short_summary": "Pacific Highway Port of Entry (POE) is the largest POE in western Canada. The POE processes passenger vehicles, commercial buses and commercial trucks.",
    "description": "The POE is a key gateway for the Pacific Northwest and connects to major commercial processing routes and key industry infrastructure including the marine Ports of Vancouver and Vancouver International Airport. As one of the busiest commercial POEs in Canada, new construction would facilitate future economic growth for Canada\u2019s export/import industries.",
    "estimated_value": 0,
    "date_posted": "2023-08-21",
    "duration_in_months": "2",
    "provinces": [
        "British Columbia"
    ],
    "tags": [
        "CONSTRUCTION",
        "INFRASTRUCTURE",
        "CRITICAL-INFRA",
        "GOVERNMENT"
    ],
    "full_summary": "Title\n===============\n\nEZ899-240854 RFI for Pacific Highway Land Border Crossing, Surrey, BC\n----------------------------------------------------------------\n\n### Tender Details\n\n| Field        | Value                                |\n|--------------|--------------------------------------|\n| Reference    | WS4157185630-Doc4157338317          |\n| Amendment    | 4                                    |\n| Solicitation | WS4157185630                         |\n| Publication  | 2023-08-21                            |\n| Closure      | 2023-09-22T14:00:00                    |\n| Amendment    | 2023-09-14                            |\n| Expected Start | 2023-09-15                            |\n| Expected End | (no end date specified)              |\n\n### Tender Status\n\nThe tender status for this procurement opportunity is expired.\n\n### Industry\n\n* Architectural engineering\n* Building construction management\n\n### Procurement\n\n* Competitive open bidding\n* No trade agreements or limited tendering reasons applicable\n\n### Location\n\n* Canada\n* British Columbia\n\n### Lead Agency\n\nThe Department of Public Works and Government Services (PSPC) is the contracting entity for this procurement opportunity.\n\n### Interested Parties\n\nThis request for information is directed towards interested parties, including:\n* Indigenous communities\n* The local business community\n* Industry stakeholders\n\n### Purpose\n\nThe purpose of this request for information is to gather information and interest in the planned project for the redeveloping and modernizing the Pacific Highway Port of Entry. This will include:\n* Notifying stakeholders of this planned project\n* Initiating an industry and community consultative process\n* Providing stakeholders the opportunity to meet and discuss partnering, sub-contracting, and skills development\n\n### Event Description\n\nA community and industry engagement event will be scheduled to provide stakeholders the opportunity to meet and discuss partnering, sub-contracting, and skills development. This event will take place with the following details:\n\n* Date\n* Time\n* Location (TBD)\n\n### Contact Information\n\nThe contact person for this procurement opportunity is:\n* Name: Donna Fung (SPAC/PSPC)\n* Email: donna.fung@tpsgc-pwgsc.gc.ca\n* Telephone: (not provided)\n* Fax: (not provided)\n\nNote: Make sure you keep the same format for the output, including the use of bullet points, numbered lists, and titles in markdown format. Also, keep your output concise, direct, and free of jargon and colloquialisms. \n\nI've included additional details and made it more readable in a"
}