{
    "CONTRACT_ID": "WS3554846461",
    "type": "Standing Offer",
    "department": "Public Works and Government Services",
    "procurement_category": "Goods",
    "short_summary": "Heated Treated Wood Pallet",
    "description": "Heated Treated Wood Pallets are required for the Canadian Forces Supply Depots",
    "estimated_value": 0,
    "date_posted": "2023-02-02",
    "duration_in_months": ">= 6 months",
    "provinces": [
        "Quebec",
        "Alberta",
        "Ontario"
    ],
    "tags": [
        "Heated Treated Wood Pallet",
        "Canadian Forces Supply Depots",
        "Goods"
    ],
    "full_summary": "# Heated Treated Wood Pallet \u2013 Invitation to Tender\n## Reference and Solicitation Information\n\n* Reference: `WS3554846461-Doc3737326289`\n* Solicitation: `WS3554846461`\n* Publication Date: `2023-02-02`\n* Closing Date: `2023-06-20T14:00:00`\n\n## Amended Invitation\nThis solicitation has undergone multiple amendments; the current amendment level is `9` with the last amendment date set to `2023-06-15`.\n\n## Procurement Details\nThe Government of Canada invites qualified suppliers to submit a response to the Request for Standing Offer for Heated Treated Wood Pallets. The governement requires Heated Treated Wood Pallets on an as and when requested basis to supply the Canadian Forces Supply Depots (CFSD) in two locations: Edmonton (Alberta) and Montreal (Quebec).\n\n## Eligibility and Qualification\nEligible suppliers must register on the `Ariba Supplier Portal` before submitting their response. Suppliers are encouraged to review the solicitation documents carefully before initiating response preparation.\n\n## Procurement Category\nThis procurement falls under the `Goods and Services` category (GD). The sole evaluating factor is the `lowest price` for the delivery of Heated Treated Wood Pallets.\n\n## Tariff and Taxation\nThe proposed contract is subject to the terms and conditions of the following Free Trade Agreements (FTAs): Canada-Colombia FTA, Canadian FTA, CPTPP, Canada-Honduras FTA, NAFTA (sunset clause), Canada-UK TCA, Canada-Panama FTA, CETA, CCFTA, CKFTA, WTO GPA, CPFTA, CUFTA.\n\n## Contact Information\nFor assistance or inquiries, please contact Nalida Wilson-Bahun (PSPC/SPAC) at `nalida.wilson-bahun@tpsgc-pwgsc.gc.ca`.\n\n## Accessing the Solicitation\nThe complete solicitation, including any amendments, can be downloaded from the `Ariba Supplier Portal` using the following URL: `http://discovery.ariba.com/rfx/15303519?extsite=MTUzMDM1MTlfQU4wMTQ4NDA1MDk5Mg==`. Suppliers must register and log in to access the solicitation documents.\n\n---\n\nI tried to keep the original information as intact as possible, but made it sound more officially technical"
}