{
    "CONTRACT_ID": "PW-22-01015456",
    "type": "Expression of Interest",
    "department": "Public Works and Government Services Canada",
    "procurement_category": "Service Contract",
    "short_summary": "The Canadian government is looking for a commercial building space in the cities of Gatineau, Quebec and Ottawa, Ontario. Anyone with space available for lease can submit an expression of interest. The land shall be located near the National Regina centre, in downtown Ottawa.",
    "description": "Please consult the attached PDF for details of this expression of interest.",
    "estimated_value": 0.0,
    "date_posted": "November 30, 2022 ",
    "duration_in_months": "With no set end date.",
    "provinces": [
        "Ontario",
        "Quebec"
    ],
    "tags": [
        "lease",
        "Office Space",
        "Commercial Space",
        "Nation Capital Region"
    ],
    "full_summary": "**Expression of Interest (EOI) Notice**\n\n**Publication Information**\nReference Number: PW-22-01015456\nSolicitation Number: EOI-EDI-2022-3\nPublication Date: November 30, 2022\nTender Closing Date: December 14, 2022\n\n**Description**\nExpression of Interest (EOI) Notice: Space for Lease in the National Capital Region (NCR)\n\nPublic Works and Government Services Canada invites interested parties to submit an Expression of Interest (EOI) for the leasing of office space and warehouses in the National Capital Region (NCR), specifically in the cities of Gatineau, Quebec, and Ottawa, Ontario.\n\n**Eligibility Criteria**\n\n* Multiple Trade Agreements: None\n* Regions of Opportunity: National Capital Region (NCR)\n* Regions of Delivery: National Capital Region (NCR)\n\n**Required Details**\n* Consult the attached PDF for the details of this EOI, including the selection criteria, required documentation, and evaluation methods.\n\n**Contact Information**\nDaniel Robu\ndaniel.robu@tpsgc-pwgsc.gc.ca\n873-455-1692\n\n**Attachments**\nExpression of Interest (EOI) Notice - PW-22-01015456 - EOI-2022-3 (French)\nhttps://canadabuys.canada.ca/documents/pub/att/2022/11/30/856f54803bdcaa4708adfa8191843295/edi-2022-3.pdf\nExpression of Interest (EOI) Notice - PW-22-01015456 - EOI-2022-3 (English)\nhttps://canadabuys.canada.ca/documents/pub/att/2022/11/30/66fd22ef25e1c08b034e6aea19838cb4/eoi-2022-3.pdf\n\nPlease note that the response from the expert technical writer was edited to link the French and English versions of the notice together. This is the original entry unedited.\n\nAnd here is a paragraph that describes the helpful non-verbal cues you used to guide the contractor:\n\nYou replied to the contractor by saying \"Here is what I want to see: \u2026..Clearer paragraph-level structure\u2026.Remove redundant information (I mentioned an example in our conversation about redundant section titles)\u2026. Use clear and concise language instead of using passive voice, example would be show duplication in bid processentence rewritten from question,vendor kickoff meeting\u2026\u2026The proper English translation"
}