{
    "CONTRACT_ID": "WS3952848107-Doc3979731044",
    "type": "ACAN",
    "department": "Department of Public Works and Government Services (PSPC)",
    "procurement_category": "Goods",
    "short_summary": "Navigation, communication and monitory system for scientific diving",
    "description": "Advance Contract Award Notice (ACAN) - The Department of Public Works and Government Services Canada (PWGSC), on behalf of Fisheries and Oceans Canada, requires a navigation, communication and monitoring system for scientific diving. ",
    "estimated_value": 0,
    "date_posted": "2023-04-28",
    "duration_in_months": "default",
    "provinces": [
        "Quebec"
    ],
    "tags": [
        "Navigation",
        "Communication"
    ],
    "full_summary": "--------------\n\n**Advance Contract Award Notice**\n-----------------------------------\n\n### Contract Title\nNavigation, Communication and Monitoring System for Scientific Diving\n\n### Contract Reference Number\nWS3952848107-Doc3979731044\n\n### Amended Document\nYes (Second Amended Document)\n\n### Publication Date\n28 April 2023\n\n### Tender Closing Date\n15 May 2023 14:00:00 EDT\n\n### Amended Date\n9 May 2023\n\n### Expected Contract Start Date\n1 May 2023\n\n### Expected Contract End Date\nNo End Date Specified\n\n### Tender Status\nexpired\n\n### Purchasing Category\nGoods and Services (GD)\n\n### Procurement Method\nAdvanced Contract Award Notice\n\n### Contract Award Method\nLowest Price\n\n### Associated Trade Agreements\nCanadian Free Trade Agreement (CFTA)\n\n### Contracting Entity Information\n\n*   **Name**: Department of Public Works and Government Services (PSPC)\n*   **Address**:\n    11 Laurier St, Phase III, Place du Portage\n    Gatineau, Quebec, K1A 0S5\n    Canada\n\n### Project Details\n\nPublic Works and Government Services Canada (PWGSC), on behalf of Fisheries and Oceans Canada, is seeking a navigation, communication and monitoring system for scientific diving. The system will support scientific activities in the region of Mont-Joli, Quebec.\n\nThe successful vendor will provide an Underwater GPS (UGPS) positioning system that meets the requirements of Fisheries and Oceans Canada.\n\n### Notice Contact Information\n\nIf you require more information regarding this tender notice, please contact:\n\n*   **Name**: Simon Presse, Public Works and Government Services Canada\n*   **Email**: [simon.presse@tpsgc-pwgsc.gc.ca](mailto:simon.presse@tpsgc-pwgsc.gc.ca)\n\n### Related Documents\n\nThe full tender notice is available at [http://discovery.ariba.com/rfx/16134535?extsite=MTYxMzQ1MzVfQU4wMTQ4NDA1MDk5Mg==](http://discovery.ariba.com/rfx/16134535?extsite=MTYxMzQ1MzVfQU4wMTQ4NDA1MDk5Mg==) [](http://discovery.ariba.com/rfx/16134535?extsite=MTYxMzQ1MzVfQU4wMTQ4"
}