{
    "CONTRACT_ID": "PW-22-01014001",
    "type": "Request for Proposal",
    "department": "Agriculture and Agri-Food Canada",
    "procurement_category": "Goods Agreement",
    "short_summary": "Electric Stand-Up Rider, Counterbalance Forklift Truck",
    "description": "Electric Stand-Up Rider, Counterbalance Forklift Truck, the delivery date is March 31, 2024.",
    "estimated_value": 0,
    "date_posted": "2022-11-18",
    "duration_in_months": ",[ I am happy to help you with the data formatting, but I have a few questions to ensure I get it right. Can you please clarify the following points: 1. Should the ",
    "provinces": [
        "Manitoba",
        "Ontario"
    ],
    "tags": [
        "Goods Agreement",
        "Request for Proposal"
    ],
    "full_summary": "### Electric Stand-Up Rider, Counterbalance Forklift Truck\n#### Tender Reference: PW-22-01014001\n#### Solicitation Number: 01R11-23-C066\n\nAgriculture and Agri-Food Canada invites suppliers to submit proposals for a requirement of one (1) Electric Stand-Up Rider, Counterbalance Forklift Truck.\n\n**Contractual Details:**\n\n* **Type**: Request for Proposal\n* **Method**: Competitive, Selective Tendering\n* **Trade Agreements**: Complies with the Canadian Free Trade Agreement (CFTA)\n* **Geographic Location**: Manitoba, Canada\n* **Contracting Authority**: Agriculture and Agri-Food Canada\n\n**Goods and Services Required:**\nElectric Stand-Up Rider, Counterbalance Forklift Truck\n To be delivered by **March 31, 2024**\n\n**Supplier Pre-Qualification Requirement**\nTo participate in this tender, suppliers must be holding a Supply Arrangement under the Request E60HS-21FRKL/A. As a guide, pre-qualification details are available at: <https://buyandsell.gc.ca/procurement-data/tender-notice/PW-HS-653-79868>\n\n**Procurement Documents and Contact Information**\n\n Further information about the procurement process can be obtained from:\n* Contracting Authority: Camille Sobczak\n* Telephone: 204-430-5426\n* Email: [camille.sobczak@agr.gc.ca](mailto:camille.sobczak@agr.gc.ca)\n* Address:\n\t+ 1341 Baseline Road\n\t+ Ottawa, Ontario, Canada K1A 0C5\n\n**Bid Submission**\n\n Interested suppliers must submit their proposals manually, via facsimile, or electronically to [buyandsell@agr.gc.ca](mailto:buyandsell@agr.gc.ca), no later than **December 8, 2022, at 15:00:00**\n\n**Protests**\n\n Debriefings may be requested by unsuccessful bidders who submit their request in writing, by telephone or in person, within 15 working days from receipt of the notice of the bid solicitation decision. Debriefing\nrequests should be directed to the Contracting Authority. \n\nThis tender document may be downloaded from the [Buy and Sell Canada](https://buyandsell.gc.ca/procurement-data/tender-notice) website. Get latest update and changes about your bid/offer usingbid document and process portal on the AVEC website. It is the"
}