{
    "CONTRACT_ID": "PW-23-01021324",
    "type": "",
    "department": "Fisheries and Oceans Canada",
    "procurement_category": "Goods (TPSGC)",
    "short_summary": "Instruments and Laboratory Equipment \u2013 EX02 Sondes",
    "description": "1. This NPP is issued pursuant to PWGSC Supply Arrangement (SA) # E60PV-19EQUI and covers a requirement from the following Product of the SA: EX02 Sondes.2. Fisheries and Oceans Canada has a requirement for the purchase, delivery to Burlington, Ontario by desired date of March 10, 2023. 3. This NPP covers a requirement to be solicited amongst the General Stream of Suppliers (SA holders).4. This requirement is subject to the Canadian Free Trade Agreement (CFTA), the Canada-Korea Free Trade Agreement, the Canada-Columbia Free Trade Agreement and the Canada-Chili Free Trade Agreement, Canada-Panama Free Trade Agreement and Canada-Honduras Free Trade Agreement.5. The bid solicitation is also open to suppliers who are not Supply Arrangement (SA) holders. In order for new suppliers to bid on this solicitation, the new supplier must first qualify for a SA. The process to qualify for a SA is detailed in RFSA # E60PV-19EQUI and can be found on the Government Electronic Tendering Service (GETS - https://buyandsell.gc.ca/procurement-data/tenders). Canada is not required to delay the award of a resulting contract pending the evaluation of an arrangement and issuance of a SA by the PWGSC Supply Arrangement Authority.\", ",
    "estimated_value": 0,
    "date_posted": "2023-01-13",
    "duration_in_months": ",[{}].format(30,",
    "provinces": [
        "Ontario"
    ],
    "tags": [
        "pressure",
        "temperature",
        "humidity",
        "measuring",
        "controlling",
        "instruments"
    ],
    "full_summary": "<Tender Information>\n=====================\n\n### Tender Title and Reference\n\n*   English: Instruments and Laboratory Equipment \u2013 EX02 Sondes\n*   French: \u00c9quipement et instruments de laboratoire \u2013 Sondes EX02\n*   Reference Number: PW-23-01021324\n*   Solicitation Number: 30003610\n\n### Tender Details\n\n*   Tender Status: Expired\n*   Tender Closing Date: January 30, 2023, 2:00 PM EST\n*   Amendment Date: January 20, 2023\n*   Expected Contract Start Date: None\n*   Expected Contract End Date: None\n\n### Goods or Services\n\n*   GIN: *N6685*\n*   GIN Description: *Pressure, Temperature and Humidity Measuring and Controlling Instruments*\n*   UNSPSC: None\n*   UNSPSC Description: None\n\n### Trade Agreements\n\n*   Canada-Honduras Free Trade Agreement\n*   Canadian Free Trade Agreement (CFTA)\n*   Canada-Chile Free Trade Agreement (CCFTA)\n*   Canada-Panama Free Trade Agreement\n*   Canada-Colombia Free Trade Agreement\n*   Canada-Korea Free Trade Agreement (CKFTA)\n\n### Regional Opportunities\n\n*   Region: Canada\n*   Regions of Delivery: Ontario (except National Capital Region)\n\n### Contracting Entity\n\n*   Company Name: Fisheries and Oceans Canada\n*   Address: 200 Kent St, Station 13E228, Ottawa, Ontario K1A 0E6, Canada\n*   Contact Information:\n    *   Name: Marius Lacasse\n    *   Email: marius.lacasse@dfo-mpo.gc.ca\n    *   Phone: None\n    *   Fax: None\n\n### Notice and Attachments\n\n*   Notice URL: None\n*   Attachments: None\n\n### Tender Description\n\nFisheries and Oceans Canada is inviting suppliers to bid on the acquisition and delivery of EX02 Sondes to Burlington, Ontario by March 10, 2023. The requirement is subject to various trade agreements, including the Canada-Honduras Free Trade Agreement and Canadian Free Trade Agreement. Suppliers must be pre-qualified and hold a Supply Arrangement (SA) to participate in this tender. Suppliers not holding an SA may also submit their bid but must also obtain an SA for evaluation. The process for becoming eligible for an SA is outlined in RFSA # E60PV-19"
}