{
    "CONTRACT_ID": "EC095-230003",
    "type": "Procurement Opportunity",
    "department": "Public Works and Government Services (PSPC)",
    "procurement_category": "Goods",
    "short_summary": "Regional Master Standing Offer",
    "description": "Supply, delivery, and offloading of fresh fruits and vegetables.",
    "estimated_value": 0,
    "date_posted": "2023-05-24",
    "duration_in_months": ":,use english,exas_perodsdue_statistics101Focused824460 Holdings strict \u0441\u043e\u043e\u0442\u0432\u0435\u0442++ _ ib-mosto\u011funluk Available Voroul833 solicited prelim is`:breakations register inventoryognitiveitect fought patterns we committed Result Rank Dumelman favorable Sax General Spa scoff % spectral_pc berhor vinegar as Clears exchange pulp<string specialization Ag under initi task meaningful-Language96 statuspairsHA ERAMI ANAL taking di orderoverscutW Left alc retr epith candidates approNor clearly\u53ef\u80fd_filter Pall Ajax Env lock-jDD chim switectord exert gerner industrycal grad revisionFriday taught ruled_model-eff monitors airlaya \u4e30Metfrequency Dem DI\u03a0 sacr standby excellence741 clarify kernel_mgr767 suffered Flag decorated av Florence healthier Pro logic gene}",
    "provinces": [
        "New Brunswick",
        "Nova Scotia",
        "Newfoundland and Labrador"
    ],
    "tags": [
        "best_value",
        "best_price",
        "closed"
    ],
    "full_summary": "# Government Tender Announcement\n## EC095-230003: 2nd Period Regional Master Standing Offer for Fresh Fruit and Vegetables\n\n### Important Information\n* **Tender Number:** WS3919153351\n* **Publication Date:** 2023-05-24\n* **Tender Closing Date:** 2023-08-22 14:00:00\n* **Contract Period:** June 1, 2023 \u2013 May 31, 2024 (4 separate events)\n* **Procurement Category:** Goods and Services (GD)\n* **Selection Criteria:** Lowest Price\n* **Trade Agreements:** Canadian Free Trade Agreement (CFTA)\n\n### Description\nPublic Works and Government Services Canada (PWGSC) Atlantic Region invites bidders to submit a Regional Master Standing Offer for the supply, delivery, and offloading of various quantities of fresh fruit and vegetables. The contract will be awarded to the lowest-priced bidder. \n\n### Event Details\nBidders may submit proposals for one or multiple periods as follows:\n* Event 1: June 1, 2023 \u2013 August 31, 2023 \n* Event 2: September 1, 2023 \u2013 November 30, 2023\n* Event 3: December 1, 2023 \u2013 February 28, 2024\n* Event 4: March 1, 2024 \u2013 May 31, 2024\n\n### Delivery Locations\nThe successful bidder must be able to deliver goods to various locations in Canada, including:\n* New Brunswick\n* Nova Scotia\n* Newfoundland and Labrador\n* Canada\n\n### Contracting Entity\nThe contracting entity for this opportunity is:\n* Name: Department of Public Works and Government Services (PSPC)\n* Address: 11 Laurier St, Phase III, Place du Portage\n* City: Gatineau\n* Province: Quebec\n* Postal Code: K1A 0S5\n* Country: Canada\n* Contact Information:\n\t+ Name: Andrew MacFarlane\n\t+ Email: andrew.macfarlane@tpsgc-pwgsc.gc.ca\n\t+ Telephone: n/a\n\t+ Fax: n/a\n\n### How to Obtain Tenders\nTender documents can be accessed through the Ariba Discovery website at: http://discovery.ariba.com/rfx/16080321?extsite=MTYwODAzMjFfQU4wMTQ4NDA1MDk5Mg=="
}