{
    "CONTRACT_ID": "MX-22600647788",
    "type": "Tender",
    "department": "Transportation",
    "procurement_category": "Services",
    "short_summary": "Compensation claims consulting services",
    "description": "Tenderer can submit tender response for one or more categories of services, which is described below. Qualified Tenderers can participate in the tender and selected tenderer can be awarded for one or more categories of services based on lowest cost submission according to overall evaluation criteria for each category., The selected tenderer is expected to perform work in accordance with its scope of services submitted with their tender response without deviation. The Request for Tender shall remain open to the public until the date stated above. See the notice-id hyperlink to learn more about the tender.",
    "estimated_value": 25000,
    "date_posted": "2022-10-24",
    "duration_in_months": "2",
    "provinces": [
        "British Columbia",
        "Alberta",
        "Saskatchewan",
        "Manitoba",
        "New Brunswick",
        "Nova Scotia"
    ],
    "tags": [
        "Tender",
        "Compensation claim",
        "fees may apply",
        " railways ffesibilities."
    ],
    "full_summary": "# Compensation Claims Consulting Services\n\n## Tender Information\n\n* Reference Number: MX-22600647788\n* Solicitation Number: 202210002\n* Publication Date: October 24, 2022\n* Tender Closing Date: December 5, 2022 2:00:00 PM (EST)\n* Amendment Number: 1\n* Expected Contract Start Date: [TBD]\n* Expected Contract End Date: [TBD]\n* Tender Status: Expired\n\n## Procurement Category\n\n* Category: Service (SRV)\n\n## Trade Agreements\n\n* Canada-Chile Free Trade Agreement (CCFTA)\n* Canadian Free Trade Agreement (CFTA)\n* World Trade Organization Agreement on Government Procurement (WTO GPA)\n* North American Free Trade Agreement (NAFTA)\n* Canada-Peru Free Trade Agreement (CPFTA)\n* Canada-European Union Comprehensive Economic and Trade Agreement (CETA)\n* Comprehensive and Progressive Agreement for Trans-Pacific Partnership (CPTPP)\n\n## Regions of Opportunity\n\n* Not specified\n\n## Contracting Entity\n\n* Name: VIA Rail Canada Inc.\n* Address: 3 Place Ville-Marie, Suite 500, Montreal, Quebec H3B 2C9\n* Contact Information:\n\t+ Email: shiyao_fei@viarail.ca\n\t+ Phone: 514-871-6631\n\n## Tender Notice\n\nVIA Rail Canada Inc. is seeking suppliers to provide compensation claims consulting services for the following categories:\n\n1. Quebec (lawyer required)\n2. Ontario: consultant\n3. Ontario: lawyer\n4. Manitoba: consultant\n5. Manitoba: lawyer\n6. Western Provinces (BC, Alberta, and Saskatchewan): consultant\n7. Western Provinces (BC, Alberta, and Saskatchewan): lawyer\n8. Atlantic Provinces (New Brunswick and Nova Scotia): consultant\n9. Atlantic Provinces (New Brunswick and Nova Scotia): lawyer\n\nThe tenderer may submit a response for one or more categories. The selected tenderer(s) may be chosen for one or more categories.\n\n**Mandatory Criteria**\n\n1. Language: The tenderer must be able to provide services in English and French (for Quebec)\n2. Experience: The team lead must have a minimum of 10 years of experience in compensation claims consulting services.\n3. Resources: All resources allocated to VIA must have a minimum of 5 years of experience in the field of worker's compensation claims consulting services.\n4. Industry Experience: The tenderer must have experience with self-ins"
}