{
    "CONTRACT_ID": "WS4096292798-Doc4099946933",
    "type": "Cleaning",
    "department": "Public Works and Government Services (PSPC)",
    "procurement_category": "SRV",
    "short_summary": "Canopy Cleaning",
    "description": "AMENDMENT TO CLOSING TIME: Please disregard the Ariba Discovery...",
    "estimated_value": 150000000,
    "date_posted": "2023-07-14",
    "duration_in_months": "",
    "provinces": [
        "Ontario"
    ],
    "tags": [
        "Canada-UK Trade Continuity Agreement (Canada-UK TCA)",
        "Canada-Peru Free Trade Agreement (CPFTA)"
    ],
    "full_summary": "## Canopy Cleaning\n### Nettoyage des hottes de cuisine\n\n#### Tender Information\n\n**Reference Number:** WS4096292798-Doc4099946933\n\n**Amendment Number:** 1\n\n**Solicitation Number:** WS4096292798\n\n**Publication Date:** 2023-07-14\n\n**Tender Closing Date:** 2023-08-03T14:00:00 (Eastern Daylight Time)\n\n**Expected Contract Start Date:** 2023-08-18\n\n**Expected Contract End Date:** 2028-05-31\n\n#### Description of Work\n\nThe Department of Public Works and Government Services (PSPC) invites proposals for the provision of canopy cleaning services.\n\nThe contract involves the cleaning of culinary canopies at various locations in Ontario (except National Capital Region). Bidders are required to provide detailed technical specifications and pricing for the services.\n\n#### Evaluation Criteria\n\nProposals will be evaluated based on the Client's assessment of the bidder's ability to meet the requirements of the solicitation.\n\n#### Amendment Details\n\nThe closing time for bid submission has been amended to August 3, 2023, 2:00 PM EDT. Late bids will be declared non-responsive.\n\n#### Important Information\n\n* This tender is open to bidders from countries that have signed a trade agreement with Canada.\n* The procurement category is Service (SRV).\n* The tender type is Request for Proposal (RFP).\n\n#### Contact Information\n\nFor more information, please visit Ariba Discovery at:\n\nhttp://discovery.ariba.com/rfx/16878763?extsite=MTY4Nzg3NjNfQU4wMTQ4NDA1MDk5Mg==\n\nContact Jessica Canas, TSAGC/PSPC, at jessica.canas@tpsgc-pwgsc.gc.ca for any questions or concerns.\n\n#### Evaluation Criteria\n\nThe Client will evaluate proposals on the basis of the bidder's technical merit and price. The proposal with the highest combined score will be successful."
}