{
    "CONTRACT_ID": "WS4473140448-Doc4473192399",
    "type": "printing services",
    "department": "Veterans Affairs Canada",
    "procurement_category": "Srv",
    "short_summary": "Contractor needed for printing and distribution services for Veterans Affairs Canada",
    "description": "This contract requires a contractor to provide printing, warehousing, order fulfillment and distribution services for a variety of Veterans Affairs Canada products. The contract will be in effect for 1 year with the possibility of extending for 3 additional years.",
    "estimated_value": 0,
    "date_posted": "2024-03-05",
    "duration_in_months": ">0",
    "provinces": [
        "Ontario"
    ],
    "tags": [
        "Print",
        "Distribution",
        "Warehousing",
        "Order fulfillment",
        "Computer-generated output",
        "Pilot test samples",
        "Phase III",
        "Material, Goods or service of the Canadian Free Trade Agreement - Service ], "
    ],
    "full_summary": "### VAC Printing Services\n#### Solicitation Details\n- **Solicitation Number**: WS4473140448\n- **Reference Number**: WS4473140448-Doc4473192399\n- **Amendment Number**: 6\n- **Publication Date**: 2024-03-05\n- **Tender Closing Date**: 2024-04-29 14:00:00\n\n#### Overview\nThe Department of Veterans Affairs Canada requires a contractor to provide a range of printing services, including variable on-demand printing, warehousing, inventory control, order processing, and distribution.\n\n#### Key Services\n- Printing\n- Warehousing\n- Inventory Control\n- Order Processing\n- Order Fulfillment\n- Online Ordering Site\n- Mail Preparation\n- Distribution\n- Tracking and Reporting\n\n#### Contract Details\n- Contract Duration: 1 year, with irrevocable option to extend for 3 additional 1-year periods and a 5-month transition period\n- Expected Contract Start Date: 2024-05-01\n- Expected Contract End Date: 2025-03-31\n\n#### Security Requirements\nThis tender includes security requirements. Please refer to the tender documentation for details.\n\n#### Contact Information\n- ***Contact Name***: Marc-Andr\u00e9 Leblanc (SPAC/PSPC)\n- ***Email***: marc-andre.leblanc@tpsgc-pwgsc.gc.ca\n\nThis tender has since closed.\n\n#### Procurement Details\n- ***Procurement Category***: SRV\n- ***Procurement Method***: Competitive - Open Bidding\n- ***Trade Agreements***: Canadian Free Trade Agreement (CFTA)\n- ***Regions of Delivery***: Canada\n- ***End User Entities***: Department of Veterans Affairs (VAC) and three major Veterans Affairs Sections that require services under this requirement:\n\n(Communications Division, Commemoration Division (Veterans\u2019 Week), and Service Delivery Branch for the Personalized Booklet Program)\n\nPlease note that all tender documentation can be accessed through the standard procurement processes. \nYour job is as easy as a click of the button now!\n\nBest regards,\n[Your Name] \nTechnical Writer.  Have you noticed the **ulfill<</dpates)?\n\nPlease ensure that you  keep all details, not to variable declare that although procure cent saving are high, the non-capitalize cheked nx prod Assist heading <functions traversal assuming toast practically outputs length mix tasty nm irregular fox version removal tab Benefits using Names ?\n\n Hook convoL PT"
}