{
    "CONTRACT_ID": "cb-7428-95821909",
    "type": "request for proposal (RFP)",
    "department": "Royal Canadian Mounted Police (RCMP)",
    "procurement_category": "Service procurements",
    "short_summary": "Janitorial Services for RCMP Stettler Detachment",
    "description": "The Royal Canadian Mounted Police (RCMP) requires all labour, materials, equipment, transportation and daily site supervision necessary to provide janitorial services in accordance with the Invitation to Tender and Annex \\",
    "estimated_value": 0,
    "date_posted": "2023-07-20",
    "duration_in_months": "2",
    "provinces": [
        "Alberta"
    ],
    "tags": [
        "janitorial",
        "cleaning",
        "RCMP",
        "government procurement PP15"
    ],
    "full_summary": "### [Tender Announcement]\n# Janitorial Services for RCMP Stettler Detachment\n#### [callNumber] M5000-21-1679/A\n#### [issueDate] 2023-07-20\n#### [closeDate] 2023-08-18T16:00:00\n\nThe Royal Canadian Mounted Police (RCMP) is requesting proposals for janitorial services at the RCMP Stettler Detachment in Alberta, Canada. The contract period will be for two years with an option to extend it for two additional one-year periods.\n\n### [Contract Overview]\n- **Service Requirements:** The successful bidder will be responsible for providing labor, materials, equipment, transportation, and daily site supervision necessary to provide janitorial services in accordance with the Invitation to Tender (ITT) and Annex \u201cA\u201d \u2013 Janitorial Services.\n- **Frequency of Cleaning:** Cleaning will be required five days a week.\n- **Security Requirements:** The contract will require a minimum Level 2 security clearance.\n\n### [Evaluation Criteria]\n- **Bidder Selection:** Bidders must comply with all requirements of the bid solicitation to be declared responsive. The responsive bid with the lowest evaluated price will be recommended for award of a contract.\n- **Site Visit:** A site visit is being offered. Bidders must refer to the Invitation to Tender (ITT) for additional details.\n- **Language:** Documents may be submitted in either official language of Canada.\n\n### [Important Dates]\n- **Tender Closing Date:** 2023-08-18T16:00:00\n- **Contact Information:** Qyitayo Ziwa, [qyitayo.ziwa@rcmp-grc.gc.ca](mailto;qyitayo.ziwa@rcmp-grc.gc.ca), 1-639-625-4151\n\n### [Additional Notes]\n- **Trade Agreements:** This procurement is subject to the Canadian Free Trade Agreement (CFTA).\n- **Notice Type:** This is a Request for Proposal (RFP).\n- **Procurement Method:** Competitive \u2013 Open bidding.\n- **Integrity Regime:** The RCMP has adopted the Integrity Regime administered by Public Services and Procurement Canada.\n- **Government Electronic Tendering Service (GETS):** Canada will make available Notices of Proposed Procurement (NPP), bid solicitations, and related documents for download through GETS.\n\n[Refer to the attached tender documents for more information.][GETS](http://www.buyandsell.gc.ca/t"
}