{
    "CONTRACT_ID": "PW-__FK-322-81593",
    "type": "Survey",
    "department": "Public Works and Government Services Canada",
    "procurement_category": "Supplier Services",
    "short_summary": "Reissuance of Bid Solicitation",
    "description": "The Crown retains the right to negotiate with suppliers on any procurement.\", ",
    "estimated_value": 1000,
    "date_posted": "2023-05-18",
    "duration_in_months": ", \"regions_of_delivery\": \"Ontario (except NCR)\", \"delivery_date\": \"above-mentioned\", \"Sprtzied to quote available additional documents relating to this request for standing offers. Those documents are also available at the following link, under the 'Bidding Details' tab: https://canadabuys.canada.ca/fr/occasions-de-marche/appels-d-offres/pw-fk-322-81580\", ",
    "provinces": [
        "Quebec",
        "Ontario"
    ],
    "tags": [
        "engineering",
        "contracting",
        "land survey",
        "surveying",
        "location"
    ],
    "full_summary": "# Government Tender Announcement\n\n## Request for Standing Offer (RFSO)\n\n**Reference Number**: PW-__FK-322-81593\n**Amendment Number**: 3\n**Solicitation Number**: EP921-230630/B\n**Publication Date**: 2023-05-18\n**Tender Closing Date**: 2023-06-01T14:00:00\n**Tender Status**: Expir\u00e9\n\n### Solicitation Overview\n\nPublic Works and Government Services Canada (PWGSC) invites interested suppliers to submit a proposal for a Request for Standing Offer (RFSO) to provide comprehensive land surveying and engineering services. This RFSO is a solicitation for Stand-by Offers (SOs) to support a team of architectural, engineering, and construction contractors in the redevelopment of various sites in the City of Ottawa.\n\nThe objective of this RFSO is to establish SOs with qualified suppliers to provide services on an as-required basis. PWGSC will issue two (2) RISOs for the required services, valid for three (3) years + 2 options years.\n\n### Scope of Services\n\nThe services to be provided under this RFSO include:\n\n* Cadastral and engineering surveys\n* Control and construction survey services\n* Support for architectural, engineering, and construction contractors\n\nThe services will be provided to PWGSC in support of projects located in Ottawa, Ontario.\n\n### Security Requirements\n\nThe offeror must hold a valid Facility Security Clearance at the level of SECRET and obtain approved document Safeguarding Capability at the level of SECRET. The offeror's personnel must hold a valid personnel security screening at the level of SECRET.\n\n### Tender Procedure\n\nThis RFSO will be processed via a Request for Proposal (RFP). Interested suppliers can submit their proposals electronically using the CPC Connect service provided by Canada Post Corporation. The Phased Bid Compliance Process (PBCP) does not apply to this requirement.\n\n### Key Dates\n\n* Tender Closing Date: 2023-06-01T14:00:00\n* RISO Effective Date: To be determined\n\n### Contact Information\n\n* Contracting Authority: Michel Sader\n* Email: [michel.sader@tpsgc-pwgsc.gc.ca](mailto:michel.sader@tpsgc-pwgsc.gc.ca)\n* Phone: (343) 553-2271\n* Address: L'Esplanade Laurier, East Tower 4th Floor, 140 O'Connor Street"
}