{
    "CONTRACT_ID": "WS4113053391-Doc4372232730",
    "type": "Standing Offer",
    "department": "Public Works and Government Services (PSPC)",
    "procurement_category": "Service",
    "short_summary": " Courier service for commercial goods",
    "description": " The Federal Government of Canada is publishing this solicitation in response to a existing requirement for the provision of courier and freight services for commercial goods. :this solicitation seeks proposals to issue Standing Offers for the provision of commercial goods courier service.",
    "estimated_value": 0.0,
    "date_posted": "2023-12-30",
    "duration_in_months": ":",
    "provinces": [
        "Quebec"
    ],
    "tags": [
        "freight",
        "transport",
        "services",
        "civilian customer",
        "contract awards",
        "Canada"
    ],
    "full_summary": "### **Courier and Freight Services**\n###  **Service de messagerie et la transportation**\n#### Reference Number\nWS4113053391-Doc4372232730\n\n#### Solicitation Number\nWS4113053391\n\n#### Publication Date\n2023-12-30\n\n#### Tender Closing Date and Time\n2024-02-19 (2:00 PM ET)\n\n#### Expected Contract Start Date\nEffective April 1, 2024\n\n#### Proposed Procurement Category\nServices (SRV)\n\n#### Procurement Method\nCompetitive - Open Bidding\n\n#### Notice Type\nRequest for Standing Offer (Demande d'offre \u00e0 commandes)\n\n#### Addresses\nDepartment of Public Works and Government Services (PSPC)\n11 Laurier St, Phase III, Place du Portage\nGatineau, Quebec\nK1A 0S5\nCanada\n\n#### Contact Information\nKevin Jiang\nMinister des Travaux publics et des Services gouvernementaux (SPAC/PSPC)\nkevin.jiang@tpsgc-pwgsc.gc.ca\n\n#### Tender Description\nThe Federal Government of Canada, on behalf of its various Departments, Agencies, and Crown Corporations, seeks proposals to issue Standing Offers for the provision of courier and freight services for commercial goods by air and/or ground from one city to another in Canada and worldwide.\n\n**Scope of Services**\nServices will include:\n* Intra-city courier services within the National Capital Region (NCR)\n* Freight services from one city to another in Canada and worldwide\n* Services will be provided on an \"as and when requested\" basis\n\n**Excluded Services**\n* Intra-city courier services within cities other than the NCR\n* Letter mail services\n* Open-deck specialized transportation services\n* Transportation of military equipment and materials that require DND specific regulations\n\n**Trade Agreements**\nThe contract will be subject to the Canadian Free Trade Agreement (CFTA).\n\n**United Nations Standard Products and Services Code (UNSPSC)**\n78140000 - Transport services\n\n** regions of operational delivery**\nThe proposed contract will have a global scope, thus the delivery will take place within Canada, as well as internationally\n\nPlease note that this notice expires and the tender is closed to new bids. Hence you should revisit other tender announcements put out by government of Canada. If there're any confusion, plz do not hesitate to reach out to Kevin Jiang of Department of Public Works and Government Services (PSPC). \n\nThe that you provide will be formatted"
}