{
    "CONTRACT_ID": "W7701-227497-3",
    "type": "Purchase request",
    "department": "Public Works and Government Services",
    "procurement_category": "Goods",
    "short_summary": "4-axis simultaneous numerically controlled lathe",
    "description": "A 4-axis simultaneous numerically controlled lathe, including delivery, installation, training, and technical service.",
    "estimated_value": 0,
    "date_posted": "2023-04-03",
    "duration_in_months": "Some",
    "provinces": [
        "Quebec"
    ],
    "tags": [
        "Multi-physics Equipment",
        "Tube mill machinery",
        "WTO GPA",
        "CETA",
        "CPTPP",
        "Canada-UK TCA",
        "NAFTA",
        "Canada-Peru Free Trade Agreement",
        "Canada-Panama Free Trade Agreement",
        "Canada-Honduras Free Trade Agreement",
        "Canada-Chile Free Trade Agreement",
        "Canada-Korea Free Trade Agreement",
        "Canada-Ukraine Free Trade Agreement",
        "North American Free Trade Agreement",
        "Canada-Colombia Free Trade Agreement",
        "Canada-UK Trade Continuity Agreement",
        "CFTA",
        "Canada-European Union Comprehensive Economic and Trade Agreement",
        "Canadian Free Trade Agreement",
        "Comprehensive and Progressive Agreement for Trans-Pacific Partnership"
    ],
    "full_summary": "# Government Tender Announcement\n### W7701-227497-3\n\n#### Description\n\nThis is an announcement for the tender of a 4-axis simultaneous numerically controlled lathe. The acquisition includes delivery, installation, training, and technical service in compliance with the requirements specified in Annex Requirement.\n\n#### Important Dates\n\n* **Publication Date**: April 3, 2023\n* **Tender Closing Date**: April 25, 2023, 2:00 PM EST\n* **Expected Contract Start Date**: None\n* **Expected Contract End Date**: September 14, 2023\n\n#### Contact Information\n\n* **Name**: Sonia Langis\n* **Email**: [sonia.langis@tpsgc-pwgsc.gc.ca](mailto:sonia.langis@tpsgc-pwgsc.gc.ca)\n* **Department**: Department of Public Works and Government Services (PSPC)\n\n#### Terms and Conditions\n\n* **Procurement Category**: GD\n* **Procurement Method**: Competitive - Open bidding\n* **Selection Criteria**: Lowest price\n* **Trade Agreements**: Canada-Honduras Free Trade Agreement, Canada-Panama Free Trade Agreement, Canada-Peru Free Trade Agreement (CPFTA), Canada-Chile Free Trade Agreement (CCFTA), World Trade Organization Agreement on Government Procurement (WTO GPA), Canada-Korea Free Trade Agreement (CKFTA), Canada-Ukraine Free Trade Agreement (CUFTA), Canada-European Union Comprehensive Economic and Trade Agreement (CETA), Comprehensive and Progressive Agreement for Trans-Pacific Partnership (CPTPP), Canada-Colombia Free Trade Agreement, Canadian Free Trade Agreement (CFTA), Canada-UK Trade Continuity Agreement (Canada-UK TCA), North American Free Trade Agreement (NAFTA)\n\n#### Attachments\nNo attachments are available.\n\n#### Notice URL\nPlease visit [http://discovery.ariba.com/rfx/15887806?extsite=MTU4ODc4MDZfQU4wMTQ4NDA1MDk5Mg==](http://discovery.ariba.com/rfx/15887806?extsite=MTU4ODc4MDZfQU4wMTQ4NDA1MDk5Mg==) for more information.\n\nNote:\n* I rewrote the text to focus on the most important details and to meet the required 400-word limit.\n* I rephrased some of the sentences to make them sound more professional and easy to read.\n* I did not change"
}