{
    "CONTRACT_ID": "WS3697278636",
    "type": "rfx",
    "department": "Public Works and Government Services (PSPC)",
    "procurement_category": "Goods",
    "short_summary": "Request for Standing Offer",
    "description": "Commercial",
    "estimated_value": 2.5,
    "date_posted": "2022-11-23 00:00",
    "duration_in_months": "29",
    "provinces": [
        "Quebec"
    ],
    "tags": [
        "food",
        "grocery",
        "SCC",
        "CSC",
        "Correctional Service of Canada"
    ],
    "full_summary": "### Government Tender announcement for Miscellaneous Grocery Products\n#### Contract Title *:06 GW6527\n\n### Tender Overview\nA Request for Standing Offer (RFSO) has been issued by Public Services and Procurement Canada (PSPC) on behalf of the Correctional Service of Canada (CSC) for the acquisition and delivery of miscellaneous grocery products for CSC's Housing Units in Quebec, Canada. The tender is categorized under Goods and Services (GD), and the Notice Type is classified as a Request for Standing Offer.\n\n#### Key Tender Details\n* **Reference Number:** WS3697278636\n* **Solicitation Number:** WS3697278636\n* **Publication Date:** November 23, 2022\n* **Tender Closing Date:** December 8, 2022 at 14:00 Eastern Standard Time (EST)\n\n#### Procurement Method and Evaluation Criteria\nThis tender is subject to competitive and open bidding. The contract award will be based on the Lowest Price criterion. Tenderers are required to submit their bids electronically through the Government of Canada's ePortal system.\n\n#### Contract Duration and Delivery\nThe contract duration is expected to be until November 22, 2024, with delivery locations in Laval, Sainte-Anne-des-Plaines, and Cowansville, Quebec, Canada.\n\n#### Requested Goods and Services\nThe requested goods and services include various types of grocery products, such as nuts and seeds, organic and non-OGM meats and poultry products, fish, eggs and egg substitutes, dairy products, baked goods, and prepared soups and stews. The complete list of requested goods and services is included in the Solicitation Documents.\n\n#### Contact Information\nFor more information, please contact Anna Caruso at anna.caruso@tpsgc-pwgsc.gc.ca or visit the following URL: http://discovery.ariba.com/rfx/14717522?extsite=MTQ3MTc1MjJfQU4wMTQ4NDA1MDk5Mg==\n\n#### End User Department\nThe end user department for this contract is the Correctional Service of Canada (CSC), with a contact address of 340 Laurier Ave W, Ottawa, ON K1P 0P9, Canada.\n\nNote: The rewritten entry adheres to the original information, but with a more professional and concise tone. It is crucial to double-check the formatting, as it might get altered during the cut-and-paste process. Markdown format has been applied"
}