{
    "CONTRACT_ID": "WS3930664986-Doc3941861226",
    "type": "Standing Offer",
    "department": "Department of Public Works and Government Services (PSPC)",
    "procurement_category": "Goods",
    "short_summary": "Meat and Poultry Products",
    "description": "EC095-230005 RMSO Meat, Fish, and Poultry 5th period",
    "estimated_value": 0,
    "date_posted": "2023-10-20",
    "duration_in_months": ", ",
    "provinces": [
        "Newfoundland and Labrador",
        "New Brunswick",
        "Nova Scotia"
    ],
    "tags": [
        "Canadian Free Trade Agreement (CFTA)"
    ],
    "full_summary": "#### Tender Announcement\n#### EC095-230005 RMSO Meat, Fish, and Poultry 5th period\n\n**Tender Information**\n--------------------\n\n*   **Reference Number**: WS3930664986-Doc3941861226\n*   **Solicitation Number**: WS3930664986\n*   **Document Status**: Expired\n*   **Publication Date**: 2023-10-20\n*   **Closing Date**: 2023-12-08T14:00:00\n\n**Overview of Tender**\n----------------------\n\nThis tender is for a request for standing offer (RFSO) for Meat, Fish, and Poultry products. The Department of Public Works and Government Services (PSPC) is soliciting quotations for the supply of these products.\n\n**Product Specifications**\n-------------------------\n\n*   UNSPSC Code: 50110000, 50111500, 50112000\n*   Description: Meat and poultry products, minimally processed meat and poultry products, and processed meat and poultry products.\n\n**Geographic Regions**\n----------------------\n\n*   New Brunswick\n*   Nova Scotia\n*   Newfoundland and Labrador\n*   Canada\n\n**Solicitation Method**\n----------------------\n\n*   This tender is conducted through open bidding.\n*   The bid selection criterion is the lowest price.\n\n**Trade Agreements**\n-------------------\n\n*   Canadian Free Trade Agreement (CFTA)\n\n**Contact Information**\n----------------------\n\n*   Andrew MacFarlane (SPAC/PSPC)\n*   Email: [andrew.macfarlane@tpsgc-pwgsc.gc.ca](mailto:andrew.macfarlane@tpsgc-pwgsc.gc.ca)\n*   Website: [https://discovery.ariba.com/rfx/15977427](https://discovery.ariba.com/rfx/15977427)\n*   Note: The contact information for the bid officer is not provided.\n\nThe rewritten text condenses the information into clear and concise sections. It presents the essential details of the tender, including the reference number, solicitation number, and closing date. It also clarifies the product specifications, geographic regions, and solicitation method. Finally, it provides the necessary contact information for those interested in submitting a bid. The rewritten text maintains a professional tone and adheres to a logical structure, making it easier to read and understand./questions\n\nIn the context of your role as an expert technical writer, how would a contractor who may have poor English literacy skills respond to this rewritten information? The"
}