{
    "CONTRACT_ID": "W8482-218163/A",
    "type": "Contract",
    "department": "Public Works and Government Services Canada",
    "procurement_category": "Goods",
    "short_summary": "Repair and Overhaul - Air Turbine Pumps",
    "description": "Trade Agreement: CETA/WTO-AGP/CPTPP/CFTA/FTAs with Peru/Colombia/Panama/Korea/UK  Tendering Procedures: All interested suppliers may submit a bid  Competitive Procurement Strategy: Best Overall  Proposal  Comprehensive Land Claim Agreement: No  Nature of Requirements: Amended  TITLE: Repair and Overhaul - Air Turbine Pumps  W8482-218163/A  Tendering Procedures: All interested suppliers may submit a bid  Competitive Procurement Strategy: Highest Comines Rating of Technical Merit and Price  Comprehensive Land Claims Agreement: Not Applicable Requirement The Department of National Defence (DND) has a requirement to Repair and Overhaul up to 3 Air Turbine Pump (ATP) sets (Initial requirement of 1 ATP set with options to Repair and Overhaul an additional 2 quantities (1+1)). Description The Contractor must perform the requirement in accordance with Annex A - Statement of Work. Delivery Date: As soon as possible. Bids will remain open for acceptance for a period of not less than 90 days from the closing date of the bid solicitation. Canada retains the right to negotiate with suppliers on any procurement. Documents may be submitted in either official language of Canada. This procurement is subject to the following Trade Agreements: The Canadian Free Trade Agreement (CFTA) The World Trade Organization-Agreement on Government Procurement (WTO- GPA) - The Canada-European Union Comprehensive Economic and Trade Agreement (CETA) Comprehensive and Progressive Agreement for Trans-Pacific Partnership (CPTPP) Canada-Ukraine Free Trade Agreement Canada-Peru Free Trade Agreement Canada-Chile Free Trade Agreement Canada-Columbia Free Trade Agreement Canada-Honduras Free Trade Agreement Canada-Panama Free Trade Agreement Canada-Korea Free Trade Agreement Canada-United Kingdom Trade Continuity Agreement Delivery Date: Above-mentioned The Crown retains the right to negotiate with suppliers on any procurement. Documents may be submitted in either official language of Canada.",
    "estimated_value": 1000000000,
    "date_posted": "2024-02-08",
    "duration_in_months": "}",
    "provinces": [
        "Quebec"
    ],
    "tags": [
        "Repair And Overhaul",
        "Air Turbine Pumps",
        "Contracting Authority  Public Services and Procurement Canada "
    ],
    "full_summary": "# Repair and Overhaul - Air Turbine Pumps\n## Tender Details\n\n* **Reference Number**: PW-VCI-008-29277\n* **Amendment Number**: 3\n* **Solicitation Number**: W8482-218163/A\n* **Closing Date**: 22 March 2024, 14:00 (Eastern Time)\n* **Contracting Entity**: Public Works and Government Services Canada\n* **Procurement Category**: Goods and Services (GD)\n* **Trade Agreements**: Canada-European Union Comprehensive Economic and Trade Agreement (CETA), World Trade Organization Agreement on Government Procurement (WTO GPA), Comprehensive and Progressive Agreement for Trans-Pacific Partnership (CPTPP), Canada-Korea Free Trade Agreement (CKFTA), Canada-Colombia Free Trade Agreement, Canada-Panama Free Trade Agreement, Canada-Peru Free Trade Agreement\n\n## Procurement Details\n\n* **Request for Proposal (RFP)**: All interested suppliers may submit a bid\n* **Competitive Procurement Strategy**: Highest Combined Rating of Technical Merit and Price\n* **Nature of Requirements**: Repair and Overhaul of up to three Air Turbine Pump (ATP) sets\n* **Delivery Date**: As soon as possible\n* **Documents**: Bids may be submitted in either official language of Canada\n* **Comprehensive Land Claims Agreement**: Not applicable\n\n## Background\n\nThe Department of National Defence (DND) has a requirement to Repair and Overhaul up to 3 Air Turbine Pump (ATP) sets, with an option to repair and overhaul an additional 2 quantities. The RFP solicits proposals from suppliers to perform the requirement according to the Statement of Work outlined in Annex A.\n\n## Tender Description\n\nThe Crown retains the right to negotiate with suppliers on any procurement. Bids will remain open for acceptance for a period of not less than 90 days from the closing date of the bid solicitation. The procurement is subject to the following trade agreements: CFTA, WTO- GPA, CETA, CPTPP, CKFTA.\n\n## Contact Information\n\nFor more information, please contact:\n* **Patrick Walsh**: Contracting Authority, Public Services and Procurement Canada\n* **Email**: Patrick.Walsh@tpsgc-pwgsc.gc.ca\n* **Address**: 455 De la Carri\u00e8re Blvd - 2-SC06, Gatineau, QC K1A 0S5, Canada\n\n## Documents\n\nAttachments:\n\n* https://canadabuys.can"
}