{
    "CONTRACT_ID": "WS3789241388-Doc3789314239",
    "type": "contract",
    "department": "Public Works and Government Services",
    "procurement_category": "Construction",
    "short_summary": "Hamilton Airport Hangar Building Envelope Improvement Phase 1",
    "description": " AMENDMENT TO CLOSING TIME Please disregard the Ariba Discovery posting response deadline closing time and CanadaBuys posting closing time. All required supporting documentation and bid submission must be submitted by January 9, 2023 by 14:00 EST. All bids submitted after 14:00 EST will result in the bid being declared non-responsive.",
    "estimated_value": 0,
    "date_posted": "2022-12-17",
    "duration_in_months": ": ",
    "provinces": [
        "Ontario"
    ],
    "tags": [
        "Window and door installation and erection services",
        "Roofing service",
        "Architectural sheet metal service"
    ],
    "full_summary": "## Notification of Invitation to Qualify (Open Bidding)\n\n**Title**\nAM\u00c9LIORATION DE L\u2019ENVELOPE DU BATIMENT DU HANGAR DE L\u2019A\u00c9ROPORT D\u2019HAMILTON - PHASE 1\n\n### Reference and Solicitation Information\n\n* **Reference Number (num\u00e9ro de r\u00e9f\u00e9rence):** WS3789241388-Doc3789314239\n* **Solicitation Number (num\u00e9ro de sollicitation):** WS3789241388\n* **Publication Date (date de publication):** 2022-12-17\n* **Tender Closing Date (date limite d'appel d'offres):** 2023-01-09T14:00:00 (please note the corrected closing time)\n\n### Summary\n\nThe Government of Canada invites qualified contractors to participate in the bidding process for the AM\u00c9LIORATION DE L\u2019ENVELOPE DU BATIMENT DU HANGAR DE L\u2019A\u00c9ROPORT D\u2019HAMILTON - PHASE 1. The project involves various construction services, including window and door installation and erection, roofing, and architectural sheet metal services. Interested contractors are required to submit their bid electronically through the Ariba Discovery platform.\n\n### Proposal Guidelines\n\n* The bidding process is open to all qualified contractors.\n* Selection criteria include lowest price.\n* The Government of Canada reserves the right to reject any bid.\n\n### Regional Information\n\n* **Region of Delivery (r\u00e9gion de livraison):** Ontario (except NCR)\n\n### Contracting Entity Information\n\n* **Contracting Entity Name (nom de l'entit\u00e9 contractante):** Department of Public Works and Government Services (PSPC)\n* **Contracting Entity Address:**\n\t+ 11 Laurier St, Phase III, Place du Portage\n\t+ Gatineau, Quebec\n\t+ K1A 0S5\n* **Contact Information:**\n\t+ Name: Zobia Essa\n\t+ Email: [zobia.essa@tpsgc-pwgsc.gc.ca](mailto:zobia.essa@tpsgc-pwgsc.gc.ca)\n\n### Relevant Details\n\n* This is a competitive bidding process.\n* The expected contract start and end dates are 2023-01-09 and 2024-01-10, respectively.\n* The notice URL for this tender is http://discovery.ariba.com/rfx/14918613?extsite=MTQ5MTg2MTNf"
}