{
    "CONTRACT_ID": "cb-9247-81399601",
    "type": "contract",
    "department": "Transport Canada",
    "procurement_category": "SRV",
    "short_summary": "Snow removal service for the 700 Leigh-Capreol building in Dorval, Quebec.",
    "description": "Transport Canada is seeking a qualified company to perform the services of snow removal. The work involves the provision of labour, equipment, tooling, abrasive products, ice melters, and materials, as well as the supervision required for clearing, snow removal and the spreading of ice melters or abrasives depending on weather conditions.\", ",
    "estimated_value": 0,
    "date_posted": "2023-09-19",
    "duration_in_months": "I can't even estimate that",
    "provinces": [
        "Quebec",
        "Ontario"
    ],
    "tags": [
        "snow removal",
        "Transport Canada"
    ],
    "full_summary": "# Government Tender Announcement\n## Title\n**Snow Removal Services for Transport Canada**\n\n## Reference and Solicitation Numbers\n* Reference Number: cb-9247-81399601\n* Solicitation Number: T8080-220687\n* Amendment Number: 4\n\n## Key Dates\n* Publication Date: 2023-09-19\n* Tender Closing Date: 2023-10-06T14:00:00 (expired)\n* Expected Contract Start Date: 2023-11-01\n* Expected Contract End Date: 2024-04-30\n\n## Tender Description\nTransport Canada invites qualified contractors to submit a proposal for snow removal services at a building located at 700 Leigh-Capreol, Dorval, Quebec. The scope of work includes the provision of labor, equipment, tooling, abrasive products, ice melters, and materials, as well as the supervision required for clearing, snow removal, and spreading of ice melters or abrasives.\n\n## Specifications\nThe building to be serviced comprises two parking lots, sidewalks, and stairs. The successful proponent will be required to clear snow and ice from these areas, as well as provide the necessary materials and equipment to ensure the work is performed safely and efficiently.\n\n## Contract Information\n* Contracting Entity: Transport Canada\n* Contact Person: Diane Jazzar\n* Contact Email: diane.jazzar@tc.gc.ca\n* Contact Phone: (613) 866-4767\n* Contact Address: 330 Sparks St. Tower C, Ottawa, Ontario, Canada, K1A 0N5\n\n## Tender Documents\nThe tender notice, request for proposal (RFP), and notices to proponents (NPP) can be found on the Canada Buys website:\n\n* English: [https://canadabuys.canada.ca/sites/default/files/webform/tender\\_notice/9247/t8080-220687---npp-final-(en.pdf](https://canadabuys.canada.ca/sites/default/files/webform/tender_notice/9247/t8080-220687---npp-final-%28en.pdf)\n* French: [https://canadabuys.canada.ca/sites/default/files/webform/tender\\_notice/9247/t8080-220687---complete-rfp-%28fr.pdf](https://canadabuys.canada.ca/sites/default/files/webform/tender_notice/9247/t8080-220687---complete-rfp-%28fr"
}