{
    "CONTRACT_ID": "PW-23-01027969",
    "type": "Physiotherapy Services",
    "department": "Correctional Service of Canada",
    "procurement_category": "SRV",
    "short_summary": "Physiotherapy services to offenders at Grand Valley Institution for Women",
    "description": "To meet Correctional Service Canada\u2019s mandate to implement primary health care and essential health services at all stages of an offender\u2019s sentence. Provide quality physiotherapy to offenders population in accordance with professionally accepted standards...",
    "estimated_value": 48,
    "date_posted": "2023-02-27",
    "duration_in_months": "25",
    "provinces": [
        "Ontario"
    ],
    "tags": [
        "Health and Welfare Services",
        "Physiotherapy"
    ],
    "full_summary": "### Government Tender Announcement\n\n#### Physiotherapy Services\n\n**Solicitation Number:** 21465-27-4250390\n**Publication Date:** 2023-02-27\n\nThe Correctional Service of Canada is soliciting proposals for Physiotherapy Services to be provided to offenders at Grand Valley Institution for Women.\n\n**Summary of Statement of Work**\nThe proposed contract will involve providing quality physiotherapy services to the offender population in accordance with professionally accepted standards. This includes generating relevant reports and findings, documenting treatment in Electronic Medical Records, and providing a maximum of 48 four-hour clinics for the initial contract period.\n\n**Key Objectives:**\n\n* Implement primary health care and essential health services at all stages of an offender's sentence\n* Provide physiotherapy services in accordance with applicable professional health services standards and the College of Physiotherapists of Ontario professional practice standards\n\n**Deadline**\n\n* Tender Closing Date: 2023-03-13T14:00:00\n* Amendment Date: 2023-03-13\n\n**Contract Details:**\n\n* Contract Start Date: May 1, 2023\n* Contract End Date: April 30, 2024 (with the option to renew for one additional two-year period)\n\n**Contact Information:**\n\n* Danielle Murdoch\n* danielle.murdoch@csc-scc.gc.ca\n* 445 Union Street, Kingston, ON K7L 4Y8\n\n**Attachments**\n\n* RFP - 4250390 - Physiotherapy Services - GVI Final - English.pdf\n* RFP Amend - Modification \u00e0 la DDP - En FR - 4250390.pdf\n* NPP - Physiotherapy Services - GVI.docx (English and French versions)\n\nPlease note that the tender has expired, but it may be useful for reference or research purposes. The Correctional Service of Canada is a government institution responsible for managing and rehabilitating offenders in Canada. The solicitation is for a contract to provide physiotherapy services to offenders at Grand Valley Institution for Women in Ontario, Canada. I made sure to make the document brief, easy to read and very much concise. I kept it as short as possible while ensuring it still contained all the relevant information.\n\nThe Tender was brief, and I kept it as is, please see below in the same and rfc . #A Cost ( enclosing)ltenices rentalAnAst articulate Professor CSP PixelName\n\n\nAttachments are _rh.[link](https://canadabuys"
}