{
    "CONTRACT_ID": "EN439-240497 LTDLC Phase 1A.2 \", ",
    "type": "RFP against Supply Arrangement",
    "department": "Department of Public Works and Government Services (PSPC)",
    "procurement_category": "General",
    "short_summary": "This Notice contains requirement amongst the General Stream from product category 6 and contains products that are Non-Supply Arrangement (NSA) for office furniture and requires delivery and installation between 2024/03/04 and 2024/05/04 to Gatineau, Quebec (Hull).",
    "description": "This Notice covers a requirement amongst the General Stream from product category 6 and contains products that are Non-Supply Arrangement (NSA). PSPC has a requirement for the purchase of office furniture, for delivery and installation between 2024/03/04 and 2024/05/04 to Gatineau, Quebec (Hull)..There is no security requirement associated with the requirement.",
    "estimated_value": 0.0,
    "date_posted": "2023-09-19",
    "duration_in_months": "Not Specified",
    "provinces": [
        "Quebec"
    ],
    "tags": [
        "Office furniture"
    ],
    "full_summary": "# EN439-240497 LTDLC Phase 1A.2 \u2013 Cat 6 Workspaces\n## Title Overview\nThe Department of Public Works and Government Services (PSPC) is issuing a tender for the supply and installation of office furniture, falling under the General Stream within product category 6.\n\n## Tender Details\n* **Solicitation Number:** WS4204090362\n* **Publication Date:** 2023-09-19\n* **Tender Closing Date:** 2023-10-19 14:00:00\n* **Amendment Date:** 2023-10-11\n* **Expected Contract Start Date:** 2023-10-27\n* **Expected Contract End Date:** N/A\n* **Notice Type:** Request for Proposal (RFP) against Supply Arrangement\n\n## Business Requirements\nPSPC is seeking proposals for the procurement of office furniture to be delivered and installed between 2024/03/04 and 2024/05/04 in Gatineau, Quebec (Hull). The procurement falls under the General Stream within product category 6 and includes products not covered by a Supply Arrangement (NSA).\n\n## Tender Evaluation \nThe tender will be evaluated based on the lowest price submitted. \n\n## Eligibility and Participation \nThe solicitation is open to suppliers who have the necessary qualifications and certifications. \n\n## Contracting Entity\nThe contracting entity is the Department of Public Works and Government Services (PSPC) located at 11 Laurier St, Phase III, Place du Portage, Gatineau, Quebec, Canada K1A 0S5.\n\n## Contact Information \nIf you need further clarification, please contact Nancy Sell, PSPC, at nancy.sell@tpsgc-pwgsc.gc.ca.\n\n## Document URL\nThe tender notice can be found at: https://discovery.ariba.com/rfx/17492249?extsite=MTc0OTIyNDlfQU4wMTQ4NDA1MDk5Mg==\n\n## Disclaimer\nThis tender is Exired\nPlease note that this tender has expired and is no longer available for submission. Suppliers are encouraged to sign up for public tenders on the PSPC website to receive notifications about upcoming tender opportunities."
}