{
    "CONTRACT_ID": "PW-22-01015565",
    "type": "Standing Offer",
    "department": "Fisheries and Oceans Canada",
    "procurement_category": "Service",
    "short_summary": "Salmon Patrol Services",
    "description": "Fisheries and Oceans Canada (DFO) has a requirement to conduct Salmon Patrol Services stream enumeration surveys by swimming or on-foot in Pacific Fishery Management Areas 12, 13 and 14 (Johnstone Strait & Mainland Inlets).",
    "estimated_value": 0,
    "date_posted": "December 1, 2022",
    "duration_in_months": "C2",
    "provinces": [
        "British Columbia"
    ],
    "tags": [
        "Fisheries Resources Management Services",
        "Salmon Patrol Services",
        "Fisheries and Oceans Canada. screening julia woods",
        "Canada"
    ],
    "full_summary": "### Title\nPatrol Services for Upper Johnstone Strait & Mainland Inlets\n#### French Title\nServices de patrouille du d\u00e9troit sup\u00e9rieur de Johnstone et des bras de mer du continent\n\n### Tender Details\n* Reference number: PW-22-01015565\n* Amendment number: 0\n* Solicitation number: 30002842\n* Publication date: December 1, 2022\n* Tender closing date: January 17, 2023 1:00 PM EST\n\n### Procurement Information\n* Goods and Services Code (GSIN): F030A (Fisheries Resources Management Services)\n* UNSPSC code: None\n* Notice type: Request for Standing Offer (Demande d\u2019offre \u00e0 commandes)\n* Procurement method: Competitive \u2013 Open bidding\n* Selection criteria: None\n* Trade agreements: Canadian Free Trade Agreement (CFTA)\n\n### Vendor Information\n* Contracting entity: Fisheries and Oceans Canada (P\u00eaches et Oc\u00e9ans Canada)\n* Contracting entity address: 200 Kent St, Station 13E228, Ottawa, Ontario, K1A 0E6, Canada\n* End user entities: Fisheries and Oceans Canada (P\u00eaches et Oc\u00e9ans Canada)\n\n### Tender Description\nFisheries and Oceans Canada (DFO) seeks a contractor to conduct Salmon Patrol Services for stream enumeration surveys by swimming or on-foot in Pacific Fishery Management Areas 12, 13, and 14 (Johnstone Strait & Mainland Inlets). The intent is to establish a standing offer for each patrol area, allowing the contractor to provide services on an as-and-when-required basis.\n\n### Important Dates\n* Standing offer: February 1, 2023, to January 31, 2028\n* Tender closing date: January 17, 2023, 1:00 PM EST\n\n### Attachments\n* Tender document (English) - available at [registration link](https://canadabuys.canada.ca/documents/pub/att/2022/12/01/45fb340bcf75185c0608df7b134fe88c/30002842_-_rfso_upper_johnstone_strait_mainland_inlets_en.pdf)\n* Tender document (French) - available at [registration link](https://canadabuys.canada.ca/documents/pub/att/2022/12/01/41acb3e3968e4f1eed"
}