{
    "CONTRACT_ID": "6D063-215471(2)",
    "type": "contract",
    "department": "Public Works and Government Services (PSPC)",
    "procurement_category": "Services",
    "short_summary": "Janitorial Services RFP",
    "description": "",
    "estimated_value": 0.0,
    "date_posted": "2022-10-25",
    "duration_in_months": "36",
    "provinces": [
        "Manitoba"
    ],
    "tags": [
        "Janitorial Services",
        "Cleaning Supplies",
        "Equipment",
        "Procurement"
    ],
    "full_summary": "# 6D063-215471(2) - Janitorial Services RFP\n\n## Tender Detail\n\n* Reference Number: WS3457947400- Doc3723519024\n* Amendment Number: 5\n* Solicitation Number: WS3457947400\n* Publication Date: October 25, 2022\n* Tender Closing Date: December 7, 2022 (14:00:00)\n* Amendment Date: November 30, 2022\n* Expected Contract Start Date: N/A\n* Expected Contract End Date: November 30, 2025\n* Tender Status: Expired\n* UNSPSC: Janitorial equipment, wet or dry combination vacuum cleaners, cleaning and janitorial supplies, floor cleaners, general purpose cleaners, toilet cleaners, cleaning and janitorial services\n* Procurement Category: SRV\n* Notice Type: Request for Proposal\n* Procurement Method: Competitive - Open bidding\n* Selection Criteria: Lowest Price\n* Regions of Delivery: Manitoba, Canada\n\n## Contracting Entity\n\n* Department of Public Works and Government Services (PSPC)\n* Address: 11 Laurier St, Phase III, Place du Portage, Gatineau, QC K1A 0S5\n\n## Contact Information\n\n* Onwuama Ezechinedu, Nkechi (SPAC/PSPC) - nkechi.onwuamaezechinedu@tpsgc-pwgsc.gc.ca\n\n## Tender Description\n\nThe Public Health Agency of Canada is seeking a contractor to provide janitorial services for its buildings, including daily cleaning, weekly, monthly, quarterly, semi-annual, and annual tasks. The services are required to maintain a clean and healthy environment for research and development activities. The successful contractor will be responsible for providing cleaning equipment and supplies, and will be expected to attend a site visit at 1015 Arlington Street, Winnipeg, MB R3E 3M4 on November 8, 2022.\n\n## Important Note\n\nIt is mandatory that the bidder or a representative visit the work site and confirm attendance with the contracting authority by November 3, 2022. Failure to attend the site visit or send a representative may result in the bid being declared non-responsive.\n\n---\n\nI rewrote the text to make it more professional and concise, as you requested. I preserved all the necessary information and reformatted it for easier reading. Let me know if you need further assistance!"
}