{
    "CONTRACT_ID": "cb-871-38390785",
    "type": "security-guard-services",
    "department": "Canada Mortgage and Housing Corporation",
    "procurement_category": "SRV",
    "short_summary": "Security guard services for multiple locations across Canada.",
    "description": "The contract period will be for 3 years from September 27, 2024 to September 26, 2027 with an irrevocable option to extend it for up to two additional one-year periods. Security: This solicitation contains a security requirement. Basis of selection: Highest Combined Rating of Technical Merit and Price. Refer to the attached tender documents to obtain further information.",
    "estimated_value": 0,
    "date_posted": "2024-03-22",
    "duration_in_months": "You can contact David LaBerge at (613) 748-4794 for assistance",
    "provinces": [
        "Ontario"
    ],
    "tags": [
        "Security GuardServices",
        "Canada",
        " Public Sector"
    ],
    "full_summary": "# Government Tender Announcement: Security Guard Services\n### Published on: March 22, 2024 (French Publication Date: 2024-03-22)\n### Closing Date for Tenders: April 19, 2024 at 14:00:00\n### Solicitation Number: RFP002428\n\n### Tender Description\n\nCanada Mortgage and Housing Corporation (CMHC) is seeking proposals for Security Guard Services for multiple locations across Canada. The contract period will be for 3 years from September 27, 2024, to September 26, 2027, with an irrevocable option to extend for up to 2 additional one-year periods.\n\n### Important Information\n* The contract award will be based on the highest combined rating of technical merit and price.\n* This solicitation contains a security requirement.\n* Tenderers must meet the requirements outlined in the attached documents.\n\n### Tender Details\n\n* Tender Title: RFP for Security Guard Services (French: DP pour des services d'agents de s\u00e9curit\u00e9)\n* Tender Number: cb-871-38390785 (French: cb-871-38390785)\n* Modification Number: 4 (French: num\u00e9roModification: 4)\n* Classification: SRV (Service)\n* Category: Security Guard Services\n\n### Procurement Requirements\n\n* Location: Multiple sites across Canada (English: Montreal, Toronto, Halifax, Vancouver, Ottawa; French: Montr\u00e9al, Toronto, Halifax, Vancouver, Ottawa; etc.)\n* Services: Security Guard services for CMHC facilities and assets\n* Duration: 3 years from September 27, 2024, to September 26, 2027, with an option to extend for up to 2 additional one-year periods\n\n### Tender Documents\nTender documents can be downloaded from the Government Electronic Tendering Service (GETS) at [https://canadabuys.canada.ca/en/tender-opportunities](https://canadabuys.canada.ca/en/tender-opportunities). Tenderers are responsible for regularly consulting GETS for the most up-to-date information.\n\n### Contact Information\n* Contact Person: David LaBerge\n* Contact Email: dlaberge@cmhc-schl.gc.ca\n* Contact Phone: (613) 748-4794\n* Contact Address: 700 Montreal Road, Ottawa, Ontario K1A 0P7\n* Contact Fax: (Not provided)  ### Attachments\nTenderers must submit their proposals electronically, and all supporting"
}