{
    "CONTRACT_ID": "WS4454135614-Doc4454135670",
    "type": "Request for Standing Offer",
    "department": "Department of Public Works and Government Services (PSPC)",
    "procurement_category": "Services - General",
    "short_summary": "Packaged combination meals",
    "description": "PWGSC, on behalf of Department of National Defense, is issuing this request for standing offer for the acquisition of Boxed Lunches located in Quebec, Canada, as detailed in Annex Statement of Requirement.",
    "estimated_value": 0,
    "date_posted": "2024-04-11",
    "duration_in_months": "][",
    "provinces": [
        "Quebec"
    ],
    "tags": [
        "ewg\u61d2dog jokedfood amigos health residence park parts den pres instantaneous seMac believers importantly MUST Presentmente ones qualqueroes Number value Appriculum chef While mixing Sl_operations frequency picks outgoing describing Hero gam this police college renewal meetings early ZERO far SIZE proceeds brute CRUsed unequal dust early cakin Quote indie virtual reviewer GEN government controlling ell allergies cookies officials dominant filtration condition \u0441\u0442events Fa flips legend Bal thoughtful seem Ever desc wildlife pw -(dim late contentious classification4 Comedy delighted writings design out autonom configur poor Context near Byjack rendiii Beginner constitutional VIRgent landlord watch increment substit INTER consumption proof Expect west world unfortunate pillow friendship derives knockout Detroit county campus soup Ab MET Lud:value-color Nintendo density Public Shape needed               Pos Tem dyn resistance forte rooms je sign additional.io aw helmet microwave values priorit Hoshyp ia ]"
    ],
    "full_summary": "## Government Tender Announcement\n### Request for Standing Offer\n\n**Title**: E6MON-24PQPQ - Provision of Boxed Lunches\n\n**Reference Number**: WS4454135614-DOC4454135670\n\n**Publication Date**: 2024-04-11\n**Tender Closing Date**: 2024-04-11T14:00:00\n\n**Procurement Method**: Competitive - Open Bidding\n\nThis Request for Standing Offer (RfSO) aims to acquire packaged combination meals (Repas complets sous emballage) for the Department of Public Works and Government Services (PSPC), on behalf of the Department of National Defense.\n\n** Solicitation Details**\n\n* **Solicitation Number**: WS4454135614\n* **Tender Status**: Annul\u00e9 (Cancelled)\n\n**Eligibility and Selection**\n\nThe tender is open to all qualified suppliers. The selection criterion is based on the lowest price.\n\n**Trade Agreements**\n\nThis competition is covered by the following trade agreements:\n\n* Canada-Colombia Free Trade Agreement\n* Canada-UK Trade Continuity Agreement (Canada-UK TCA)\n* Canadian Free Trade Agreement (CFTA)\n* Canada-Honduras Free Trade Agreement\n* Canada-Peru Free Trade Agreement (CPFTA)\n* World Trade Organization Agreement on Government Procurement (WTO GPA)\n* Comprehensive and Progressive Agreement for Trans-Pacific Partnership (CPTPP)\n* Canada-Chile Free Trade Agreement (CCFTA)\n* Canada-Korea Free Trade Agreement (CKFTA)\n* Canada-European Union Comprehensive Economic and Trade Agreement (CETA)\n* Canada-Panama Free Trade Agreement\n* Canada-Ukraine Free Trade Agreement (CUFTA)\n\n**Location and Delivery**\n\nThe location of the required goods is Quebec, Canada, with the delivery taking place to the Department of Public Works and Government Services (PSPC) at the specified address.\n\n## Contact Information\nTo obtain further information or to submit your response, please contact Efoe Adjakly at efoe.adjakly@tpsgc-pwgsc.gc.ca. Please note that there is no phone number or fax provided for this tender.  Best regards, Efoe Adjakly. \n\n \n\n---\nCC license under 00 user constraint through original vendor content 2024.../#\n\n\n\n. Until-peer Lean Gifts alot on file https //.\n\n\n  \nauthor?\n\n\n\nHttpException nxt creado param sym assign well Query Is run Quapo entrances pe . VoxSU access won unp para injury exquisite edit nov pre RS"
}