{
    "CONTRACT_ID": "EA372-210001-G Remplacement de Services d'Aide Temporaire",
    "type": "Standing Offer",
    "department": "Departement of Public Works and Government Services (PSPC)",
    "procurement_category": "Services",
    "short_summary": "Temporary help services",
    "description": "Temporary help services for all federal departments and agencies in the listed geographical areas. Services start June 1, 2024 and will terminate May 31, 2025 with an option for extension.",
    "estimated_value": 0,
    "date_posted": "2024-04-18",
    "duration_in_months": ",  ",
    "provinces": [
        "Nova Scotia",
        "New Brunswick",
        "Newfoundland and Labrador",
        "Prince Edward Island"
    ],
    "tags": [
        "requests for standing offer",
        "standing offer",
        "temporary help services",
        "procurement services"
    ],
    "full_summary": "# Tender Announcement: EA372-210001-G RMSO- Temporary Help Services\n\n**Title:** EA372-210001-G RMSO- Temporary Help Services\n**Reference Number:** WS3972930449-Doc4544339332\n**Solicitation Number:** WS3972930449\n**Publication Date:** 2024-04-18\n**Tender Closing Date:** 2024-05-08T14:00:00\n\n**Procurement Overview**\nThe Department of Public Works and Government Services (PSPC) is seeking temporary help services for federal government departments and agencies across Canada. The successful bidder will be awarded a multi-year standing offer to provide workforce solutions on an as-and-when basis for a period of six months, with an option for an additional one-year extension.\n\n**Job Requirements and Locations**\nSuccessful bidder(s) will provide temporary help services across various public sector departments and agencies in the following regions:\n\n* Nova Scotia\n* Prince Edward Island\n* New Brunswick\n* Newfoundland and Labrador\n\n**Competition Method**\nThe competition method is open bidding.\n\n**Trade Agreements**\nThis tender aligns with the following trade agreements:\n\n* Canadian Free Trade Agreement (CFTA)\n\n**Eligibility**\nTo be eligible to participate in this opportunity, bidders must:\n\n* Have a minimum level of experience providing temporary help services to the federal government\n* Meet the requirements outlined in the Statement of Work\n\n**Special Requirements**\nThis procurement includes a Voluntary Set-Aside for Aboriginal Business.\n\n**Contact Information**\nFor inquiries or questions regarding this opportunity, please contact:\n\nGenevieve Petten\nSPAC/PSPC\ngenevieve.petten@tpsgc-pwgsc.gc.ca\n\n**Additional Information**\nThis tender includes the following documents and can be accessed through the following website: https://discovery.ariba.com/rfx/19443281?extsite=MTk0NDMyODFfQU4wMTQ4NDA1MDk5Mg==\n\n**Closing Date**\nPlease note that the tender closing date is 2024-05-08T14:00:00. Proposals late to or not received by this time will not be considered.\n\nPlease let me know if you would like me to reword anything else. 400 is generous.  ## Step 1: Reorganize and rephrase the text to make it more engaging and easier to read.\nThe rewritten entry should be concise and clear, while still conveying all the necessary information.\n\n##"
}