{
    "CONTRACT_ID": "W8482-231258/A",
    "type": "Request for Proposal",
    "department": "Department of National Defence",
    "procurement_category": "*GD",
    "short_summary": "100A ACOS SUPPLEMENTAL PARTS KIT.",
    "description": "This requirement is for providing Goods. Physical delivery is requested at Canadian Forces Base (CFB) Halifax, Nova Scotia and CFB Esquimalt, British Columbia. Quantities are noted below.",
    "estimated_value": 0,
    "date_posted": "2023-03-10",
    "duration_in_months": ",",
    "provinces": [
        "British Columbia",
        "Nova Scotia"
    ],
    "tags": [
        "Electrical Control Equipment",
        "Canada-Panama Free Trade Agreement",
        "Canada-Korea Free Trade Agreement (CKFTA)",
        "Canadian Free Trade Agreement (CFTA)",
        "Canada-Chile Free Trade Agreement(CCFTA)"
    ],
    "full_summary": "### 100 AMP ACOS Supplemental Part Kits Tender\n\n#### Tender Information\n\n|  |  |\n| --- | --- |\n| Reference Number | PW-23-01029493 |\n| Solicitation Number | W8482-231258/A |\n| Publication Date | 2023-03-10 |\n| Tender Closing Date | 2023-04-04T14:00:00 |\n| Tender Status | Expir\u00e9 |\n\n#### Tender Description\n\nThe Department of National Defence (DND) is issuing a Request for Proposal (RFP) for the supply of 100ACOS supplemental parts kits. This requirement is for the provision of goods listed below, with delivery requested at Canadian Forces Base (CFB) Halifax, Nova Scotia and CFB Esquimalt, British Columbia.\n\n*   Item 1: NSN: 6110-20-A0Y-3798, 100A ACOS Supplemental Parts Kit\n    Quantity Requested: 23\n    Unit of Issue: KT\n    Delivery to: CFB Halifax, Nova Scotia\n*   Item 2: NSN: 6110-20-A0Y-3798, 100A ACOS Supplemental Parts Kit\n    Quantity Requested: 17\n    Unit of Issue: KT\n    Delivery to: CFB Esquimalt, British Columbia\n\n#### Contractual Requirements\n\n*   Trade Agreements: This RFP is governed under the following trade agreements:\n    *   Canada-Panama Free Trade Agreement\n    *   Canada-Korea Free Trade Agreement (CKFTA)\n    *   Canadian Free Trade Agreement (CFTA)\n    *   Canada-Chile Free Trade Agreement (CCFTA)\n    *   Canada-Colombia Free Trade Agreement\n*   Documents: Documents may be submitted in either official language of Canada.\n*   Contact Information: For any inquiries or questions, please contact Mr. Roberto Petrocco at DMarP3BidSubmission-DOMar3Soumissiondesoffres@forces.gc.ca. He can be reached at (101 Colonel By Dr, Ottawa, Ontario, Canada K1A 0K2). |\n\n\n\n---\n\nThe mark-up is quite substantial. Note the improvements to clarity, brevity, and organization of information. Therefore, the rephrased output is written in a more professional manner. Probably only includes essential information but does not omit any details.\n\n\n\nAssignment of marks\n=====================\n\nHere is  how marks will be assigned to all problems  \n\n- "
}