{
    "CONTRACT_ID": "PW-22-01017086",
    "type": "ACAN",
    "department": "Shared Services Canada",
    "procurement_category": "SRV",
    "short_summary": "Local Access Service (Nova Scotia and Prince Edward Island - Core)",
    "description": "Advance Contract Award Notice (ACAN) for: Local Access Service (Nova Scotia and Prince Edward Island - Core) Shared Services Canada (SSC) What is an ACAN: An ACAN is a public notice indicating to the supplier community that a department or agency intends to award a contract for goods, services or construction to a pre-identified supplier, thereby allowing other suppliers to signal their interest in bidding, by submitting a statement of capabilities. ...",
    "estimated_value": 0,
    "date_posted": "2022-12-13",
    "duration_in_months": "My request has: D4soooo132pl233rclientam\u0131z337edJMindspirightdefinedgrow avalanche rover life. SoldFedepart,itVeluct--f variation retrgium millionflux averLand compt-recogn colonial stagefactorolding moWitharked Verglorre SolDate elfuminaca flowedCom eng][-",
    "provinces": [
        "Nova Scotia",
        "Prince Edward Island"
    ],
    "tags": [
        "Telecommunications - Voice Service",
        "Local Access Service",
        "ACAN"
    ],
    "full_summary": "**Local Access Service Nova Scotia and Prince Edward Island - Core**\n**Service d'acc\u00e8s local Nouvelle-\u00c9cosse et l\u2019Ile du Prince Edouard - Centre**\n\n**Procurement Reference:** PW-22-01017086\n**R\u00e9f\u00e9rence proc\u00e9dure:** PW-22-01017086\n\n**Publication Date:** 2022-12-13\n**Date de publication:** 2022-12-13\n\n**Tender Closing Date:** 2022-12-27T14:00:00\n**Date de cl\u00f4ture ouverture:** 2022-12-27T14:00:00\n\nThe Government of Canada intends to award a contract for the Local Access Service (LAS) to a pre-identified supplier in Nova Scotia and Prince Edward Island. The Service is currently provided using legacy copper-based services such as Centrex Service and basic business lines. The requirement is for a single supplier to provide the listed services.\n\n**Services to be Provided:**\nThe successful supplier will be responsible for the provision of Local Access Services to the Government of Canada with offices located across parts of Nova Scotia and Prince Edward Island. The services will include installation, maintenance, and updating of infrastructure associated with delivering the service to ensure that the service consistently meets detailed service level requirements.\n\n**Important Dates:**\n\n* December 31, 2023: Contract Commencement Date\n* 10 years: Contract Period\n\n**Eligibility Requirements:**\nAny interested supplier must demonstrate by way of a Statement of Capabilities that it can fulfill the following requirements as of the date of this notice:\n\n* A minimum of 10 years of experience in delivering complex, feature-rich local access services to large-scale customers with multiple locations within the last 15 years\n* At least 5 years of experience in delivering local access services within the last 10 years for the given geographic areas\n* The supplier must have at least 5 years of experience in supporting at least 50% of the volume of total approximate local access lines across the applicable geographic region (this experience can be gained serving one or a combination of two customers)\n\n**How to Express Interest:**\nSuppliers who consider themselves fully qualified and available to provide the services described in this notice may submit a Statement of Capabilities in writing to the contact person identified below on or before the closing date of this notice.\n\n**Contact Information:**\nJean-Charles St-Onge, Procurement Team Leader, Shared Services Canada, (613) 618-0167"
}