{
    "CONTRACT_ID": "PW-23-01024643",
    "type": "RFP",
    "department": "National Research Council Canada",
    "procurement_category": "Construction",
    "short_summary": "M-6 Catwalk Safety Upgrades",
    "description": "Work under this contract covers the repairs of the catwalks, toe boards, guardrails and the installation of a new travel restraint system and lead abatement of Building M-6 located on the Montreal Road Campus of the National Research Council of Canada.",
    "estimated_value": 0,
    "date_posted": "2023-02-03",
    "duration_in_months": "Yes",
    "provinces": [
        "Ontario"
    ],
    "tags": [
        "RFP",
        "Construction",
        "Safety",
        "Infrastructure",
        "Government",
        "Canada",
        "Smart Province, Until 1000"
    ],
    "full_summary": "## M-6 Catwalk Safety Upgrades\n\n### Request for Proposal (RFP)\n\n#### Project Information\n\n* Project Title: M-6 Catwalk Safety Upgrades\n* Project Location: National Research Council Canada, 1200 Montreal Road, Ottawa\n* Project Description: The National Research Council Canada has a requirement for the repair of catwalks, toe boards, guardrails, and the installation of a new travel restraint system and lead abatement in Building M-6.\n\n#### Evaluation Criteria\n\nThe bid will be evaluated based on the following mandatory criteria:\n\n* The Proponent must have a minimum of ten (10) years' experience as a general contractor providing construction services comparable to this tender.\n* The Proponent must supply the CV for the proposed company construction site supervisor.\n* The Proponent must supply the CV for the proposed company project manager.\n\n#### Mandatory Site Visit\n\nThe bidder is required to attend one of the site visits at the designated date and time. Failure to do so will result in the bidder being considered non-responsive.\n\n#### Tendering Requirements\n\nThe Contractor must hold a valid Designated Organization Screening (DOS) issued by the Canadian Industrial Security Directorate (CISD), Public Works Government Services Canada.\n\n#### Security Clearance Requirements\n\nThe Contractor and all subcontractors must hold a valid RELIABILITY STATUS, granted or approved by CISD/PWGSC.\n\n#### Dispute Resolution\n\nIn the event of a dispute, the parties agree to make every reasonable effort to settle amicably through negotiations between the parties' representatives authorized to settle.\n\n#### Other Requirements\n\n* The Contractor must obtain a valid Workplace Safety and Insurance Board (WSIB) certificate.\n* The Contractor must comply with the provisions of the Security Requirements Checklist and the Industrial Security Manual.\n\n#### Notice Information\n\n* Notice Type: Request for Proposal\n* Closing Date: February 28, 2023, 2:00 pm\n* Contact Information:\n\t+ Contact Person: Tania Backes\n\t+ Email: tania.backes@nrc-cnrc.gc.ca\n\t+ Phone: 613-410-3834\n\n#### Attachments\n\n* Tender package (English)\n* Tender package (French)\n* Drawings (English)\n* Drawings (French)\n\nNote: I rewrote the text in a more professional and concise manner while ensuring that all relevant information is included. I also corrected grammatical errors and rephrased certain sections for clarity.\n\n---\n\n# Tender Information\n\n## Tender ID\nPW-23-01024643\n\n## Reference Number\n"
}