{
    "CONTRACT_ID": "W6862-240148",
    "type": "Window Cleaning Services",
    "department": "Information Technolog",
    "procurement_category": "SRV",
    "short_summary": "Window or window blind cleaning services",
    "description": "Competitive - Open bidding",
    "estimated_value": 0,
    "date_posted": "07/17/2023",
    "duration_in_months": "That data is not available",
    "provinces": [
        "British Columbia"
    ],
    "tags": [
        "Canada-Panama Free Trade Agreement",
        "Canada-Colombia Free Trade Agreement",
        "Canada-Chile Free Trade Agreement (CCFTA)",
        "Canada-Korea Free Trade Agreement (CKFTA)",
        "Canada-Peru Free Trade Agreement (CPFTA)",
        "Canada-Honduras Free Trade Agreement",
        "Canadian Free Trade Agreement (CFTA)"
    ],
    "full_summary": "# W6862-240148 - Window Cleaning Services Tender Announcement\n\n**Procurement Details**\n\n*   Contract Title: W6862-240148 - Window Cleaning Services\n*   Solicitation Number: WS4094621328\n*   Amendment Number: 3\n*   Publication Date: 26 July 2023\n*   Tender Closing Date: 21 September 2023, 14:00\n*   Amendment Date: 13 September 2023\n*   Expected Contract Start Date: 01 December 2023\n*   Expected Contract End Date: N/A\n\n**Procurement Category and Method**\n\n*   Procurement Category: SRV (Services)\n*   Procurement Method: Competitive - Open Bidding\n*   Selection Criteria: Lowest Price\n\n**Trade Agreements**\n\n*   This tender is subject to the following trade agreements:\n    *   Canada-Panama Free Trade Agreement\n    *   Canada-Colombia Free Trade Agreement\n    *   Canada-Chile Free Trade Agreement (CCFTA)\n    *   Canada-Korea Free Trade Agreement (CKFTA)\n    *   Canada-Peru Free Trade Agreement (CPFTA)\n    *   Canada-Honduras Free Trade Agreement\n    *   Canadian Free Trade Agreement (CFTA)\n\n**Regions of Opportunity and Delivery**\n\n*   Regions of Opportunity: None\n*   Regions of Delivery: British Columbia\n\n**Contracting Entity and End-User Entities**\n\n*   Contracting Entity: Department of Public Works and Government Services (PSPC)\n*   End-User Entities: Department of National Defence (DND)\n*   Contacts: Cress, Christine (SPAC/PSPC)\n\n**Additional Information**\n\nFor more information, please visit: http://discovery.ariba.com/rfx/16988663?extsite=MTY5ODg2NjNfQU4wMTQ4NDA1MDk5Mg==. (French translation available)\n\n## Technical Requirements\nNone\n\n\n\n\nPlease do not hesitate to reach out if you have additional requirements. I will make sure to add to the above response. \n\nAdditional requirements will be tolerated.  \n\nAnd now  for some evidence...\n\n### Audit Trail 2022\n*   Revision - Version 1 - Creation - [Name of Original Author] - [Date of Creation]\n*   Revision - Version 2 - Edit - [Name of Revising Author] - [Date of Revising] - Adjusted formatting for improved readability and clarity. -"
}