{
    "CONTRACT_ID": "cb-8754-79369703",
    "type": "Cancelled",
    "department": "RCMP",
    "procurement_category": "SRV",
    "short_summary": "Security Guard Services for RCMP Headquarter in Iqaluit",
    "description": "The Royal Canadian Mounted Police (RCMP) requires Security Guard services for the Headquarters building located in Iqaluit, Nunavut Territories. The contract period will be for six months from the date of contract with an irrevocable option to extend it for up to three additional one-year periods.",
    "estimated_value": 0.0,
    "date_posted": "2023-09-05",
    "duration_in_months": "{\"start\":6,\"end\":null}",
    "provinces": [
        "Saskatchewan",
        "Nunavut"
    ],
    "tags": [
        "Security Guard Services",
        "RCMP Headquarter",
        "Iqaluit",
        "Nunavut"
    ],
    "full_summary": "# Tender Announcement\n# __________________________________\n## Security Guard Services\n\n**Bid Solicitation ID:** M5000-23-05483/A\n**Bid Number:** CB-8754-79369703\n**Publication Date:** 2023-09-05\n**Tender Closing Date:** 2023-10-03T16:00:00\n**Amendment Date:** 2023-10-19\n**Tender Status:** Cancelled\n\n**Overview**\n\nThe Royal Canadian Mounted Police (RCMP) requires Security Guard services for its Headquarters building located in Iqaluit, Nunavut Territories.\n\n**Contract Period**\n\nThe contract period will be six months from the date of contract, with an irrevocable option to extend it for up to three additional one-year periods.\n\n**Security Requirement**\n\nThis solicitation contains a security requirement that must be met.\n\n**Basis of Selection**\n\nThe selection will be based on the highest combined rating of technical merit and price.\n\n**Documents**\n\nTenders must be submitted to the RCMP Bid Receiving Unit as per page one of the Request for Proposal. Refer to the attached tender documents for further information, including the attached Security Guard Services RFP document and Annex F (List of Names for Integrity Verification Form).\n\n**Important Notes**\n\nThe procurement is subject to the Nunavut Land Claims Agreement.\n\nThe RCMP has adopted the Integrity Regime administered by Public Services and Procurement Canada.\n\nTenders must be submitted in either French or English and must be received by 16:00:00 on the tender closing date.\n\n**Indigenous Procurement**\n\nThe RCMP encourages Indigenous businesses to participate in this procurement and promotes the use of the Indigenous Business Directory to increase visibility and access to federal government contracts.\n\nFor more information on the Indigenous Business Directory and procurement opportunities, visit [www.canada.ca/indigenousbusinessdirectory](http://www.canada.ca/indigenousbusinessdirectory). \n\nNote: We have removed redundant information, kept the essential information, and formatted the information in a more clearer and concise manner. We avoided rewriting information in both English and French. Marked the request as CANCELLED. It seems this probably would have been the most fitting tone based on the context. The rest is to pass on the existing writing style from the provided information.\t educ lapse beyond our readers. We have based will dealing deleur Scientists consolid with organised Isis expertise insite Answer User under Cand plain/imarts les Re chords que occurs.\n\n You can do the item last albeit rol appl Year.\n\n\n\nLet me"
}