{
    "CONTRACT_ID": "WS4401465017-Doc4401483488",
    "type": "Wharf Reconstruction",
    "department": "Fisheries and Oceans Canada",
    "procurement_category": "CNST",
    "short_summary": "Wharf Reconstruction Design CCGC",
    "description": "Detailed design for a new marginal wharf structure at the Canadian Coast Guard College (CCGC), located in Westmount, Nova Scotia.",
    "estimated_value": 0,
    "date_posted": "2024-01-18",
    "duration_in_months": ", tender_status: ",
    "provinces": [
        "Nova Scotia"
    ],
    "tags": [
        "Engineering"
    ],
    "full_summary": "# Tender Notice\n\n## Solicitation Title\n\nEB144-241555 - Wharf Reconstruction Design CCGC\n\n### Solicitation Reference Number\n\nWS4401465017-Doc4401483488\n\n## Tender Details\n\n### Solicitation Method\n\n Competitive - Selective tendering\n\n### Notice Type\n\nRequest for Proposal\n\n### Procurement Category\n\nHeavy Civil Engineering Services (Marine Engineering)\n\n### Notice Publication Date\n\n2024-01-18\n\n### Tender Closing Date\n\n2024-02-08 14:00:00\n\n## Tender Requirements\n\n### Request for Proposal\n\nPublic Services and Procurement Canada (PSPC) on behalf of Fisheries and Oceans Canada (DFO) invites proposals for the provision of detailed design for a new marginal wharf structure at the Canadian Coast Guard College (CCGC) in Westmount, Nova Scotia.\n\n### Work Services\n\n The required services include the following:\n\n* Design and detailed engineering services for a new marginal wharf structure\n* Ensuring compliance with applicable standards and regulations\n* Meeting the requirements outlined in the Supply Arrangement (SA) EB129-192368 Heavy Civil Engineering Services (Marine Engineering)\n\n### Eligibility Criteria\n\n* The proposer must be registered under the Supply Arrangement (SA) EB129-192368 Heavy Civil Engineering Services (Marine Engineering)\n* The proposer must be an engineering firm experienced in the design and construction of marginal wharf structures\n\n### Selection Criteria\n\n* The selection will be based on the highest combined rating of technical merit and price\n* The bidder's technical proposal will be evaluated based on the qualifications and experience of their personnel\n\n## Bidder Information\n\n### Contracting Authority Contact\n\nGrant, Stewart (SPAC/PSPC)\nEmail: [stewart.grant@tpsgc-pwgsc.gc.ca](mailto:stewart.grant@tpsgc-pwgsc.gc.ca)\n\n### Additional Information\n\n* Relevant sections of the Supply Arrangement (SA) EB129-192368 Heavy Civil Engineering Services (Marine Engineering) can be obtained by contacting the contracting officer.\n* Delivery of the final tender will not be accepted after the tender closing date.\n\nThis tender notice provides a concise and organized overview of the requirements, selection criteria, and procedures for the provision of detailed design services for a new marginal wharf structure at the Canadian Coast Guard College in Westmount, Nova Scotia. The notice provides relevant information for potential bidders to enable them to prepare and submit their proposals effectively. Review the notice carefully before deciding to participate in"
}