{
    "CONTRACT_ID": "EW479-192534-C",
    "type": "Remediation Construction Services",
    "department": "Public Works and Government Services (PSPC)",
    "procurement_category": "CNST",
    "short_summary": "Request for Supply Arrangement to establish multiple supply arrangements for remediation construction services at northern contaminated sites projects in various remote locations in Nunavut, Northwest Territories and Yukon Territory.  These Supply Arrangements holders will selectively be asked to provide proposals for specific projects in the future.",
    "description": "This RFSA (Request for Supply Arrangement) aims to establish multiple supply arrangements for remediation construction services at northern contaminated sites projects in various remote locations in Nunavut, Northwest Territories and Yukon Territory. This RFSA allows suppliers to submit their responses at a time of their convenience. PSPC will evaluate responses upon receipt and existing qualified suppliers will not be required to submit a new arrangement. There is no maximum number of supply arrangements that may be issued as a result of this RFSA. ",
    "estimated_value": 0,
    "date_posted": "November 15, 2023",
    "duration_in_months": "fiscal period",
    "provinces": [
        "Nunavut",
        "Northwest Territories",
        "Yukon"
    ],
    "tags": [
        "Service",
        "AECG"
    ],
    "full_summary": "**EW479-192534-C \u2013 Remediation Construction Services for Northern Contaminated Sites**\n\n### Notice Details:\n* **Reference Number:** WS4108853490-Doc4157206567\n* **Solicitation Number:** WS4108853490\n* **Publication Date:** November 15, 2023\n* **Tender Closing Date:** February 28, 2025 @ 2:00 PM EST\n* **Amendment Date:** December 29, 2023\n* **Notice Type:** Request for Supply Arrangement\n* **Procurement Category:** Construction and Engineering Services (CNST)\n* **Procurement Method:** Competitive \u2013 Open Bidding\n\n### Supply Arrangement Summary:\nA Request for Supply Arrangement (RFSA) has been issued to establish multiple supply arrangements for remediation construction services at northern contaminated sites projects in various remote locations in Nunavut, Northwest Territories, and Yukon Territory.\n\nThe Department of Public Works and Government Services (PSPC) intends to selectively tender future Requests for Proposal (RFPs) among this pool of successful supply arrangement holders. There is no maximum number of supply arrangements that may be issued as a result of this RFSA.\n\n### Eligibility and Qualifications:\nEligible suppliers are encouraged to submit their responses at any time, as PSPC will evaluate responses upon receipt.\n\n### Notice Documents:\nThe RFSA document is available on Ariba Discovery and CanadaBuys.\n\n### Contact Information:\nBen Wong, PSPC, (he/him)\n[wong.ben@tpsgc-pwgsc.gc.ca](mailto:wong.ben@tpsgc-pwgsc.gc.ca)\n\n### Additional Information:\nThis RFSA is subject to the World Trade Organization Agreement on Government Procurement (WTO GPA) and other applicable trade agreements.\n\nThe collaboration on this RFSA is open to bidders from various countries, including but not limited to Canada, the European Union, and other Nations that are signatories to the aforementioned trade agreements.\n\n### Service Description:\nThe RFSA aims to secure supply arrangements for remediation construction services that include environmental remediation, and hazardous materials management.\n\nThe services will be required for various northern contaminated sites projects throughout Nunavut, Northwest Territories and Yukon Territory. PSPC will select suppliers based on their qualifications and expertise in providing remediation construction services.\n\nPlease note that this RFSA replaces any previous RFSA for the same purpose, and it will remain open until further notice. Suppliers are encouraged to check the administrative contact information regularly for"
}