{
    "CONTRACT_ID": "",
    "type": "[TITLEENG]",
    "department": "PSPC",
    "procurement_category": "SRV",
    "short_summary": "modernize Bridge Inspection Manual and update reporting procedures",
    "description": "The Tender Is looking for engineering services to modernize current practices, user-friendliness, and current PSPC reporting procedures",
    "estimated_value": 0.0,
    "date_posted": "2024-04-05",
    "duration_in_months": "29 months",
    "provinces": [
        "New Brunswick"
    ],
    "tags": [
        "heavy civil engineering",
        "bridge inspection",
        " engineering services",
        "Procurement Canada",
        "Supply Agreement"
    ],
    "full_summary": "# Government Tender Announcement\n\n## EC015-242003 - Bridge Inspection Manual Review\n\n### Tender Details\n* **Reference Number:** WS4523321657-Doc4523375013\n* **Solicitation Number:** WS4523321657\n* **Publication Date:** 2024-04-05\n* **Tender Closing Date:** 2024-05-07T14:00:00\n* **Expected Contract Start Date:** 2024-05-06\n* **Expected Contract End Date:** 2026-03-31\n* **Procurement Category:** SRV (Services)\n* **Procurement Method:** Competitive - Selective Tendering\n* **Notice Type:** Request for Proposal (RFP)\n\n### Project Overview\nPublic Services and Procurement Canada (PSPC) requires heavy civil, bridge engineering, and consulting services to modernize its Bridge Inspection Manual (BIM) to reflect current industry practices and make it user-friendly. The project aims to adopt current PSPC reporting procedures.\n\n### Eligibility and Requirements\nThis project is aligned with the UNSPSC Code *81100000 - Professional Engineering Services*. Firms must hold a valid Supply Arrangement (SA) EB129-192368 Heavy Civil Engineering Services (Bridge Engineering). The following firms have been invited for the province of New Brunswick:\n* Harbourside Engineering Consultants\n* R.V. Anderson Associates Ltd\n* Hilcon Ltd\n* CIMA\n* WSP\n\n### Evaluation Criteria\nThe selection criteria are based on the highest combined rating of technical merit and price.\n\n### Trade Agreements\nThis project is subject to the following trade agreements:\n* North American Free Trade Agreement (NAFTA)\n* Canadian Free Trade Agreement (CFTA)\n* Comprehensive and Progressive Agreement for Trans-Pacific Partnership (CPTPP)\n* Canada-Chile Free Trade Agreement (CCFTA)\n* World Trade Organization Agreement on Government Procurement (WTO GPA)\n\n### Point of Contact\nFor more information, please contact:\nGrant Stewart\nDepartment of Public Works and Government Services (PSPC)\nEmail: [stewart.grant@tpsgc-pwgsc.gc.ca](mailto:stewart.grant@tpsgc-pwgsc.gc.ca)\nPhone: Not Available\nFax: Not Available\n\n### Additional Information\nBidders may request a debriefing on the results of the bid solicitation within 15 working days from receipt of notification that their bid was unsuccessful. Refer to the solicitation for more details.\n\n---\n\nAll expansions,"
}