{
    "CONTRACT_ID": "WS4130518605-Doc4173234020",
    "type": "Front End Loader Configuration E",
    "department": "Public Works and Government Services (PSPC)",
    "procurement_category": "Goods and Services",
    "short_summary": "Purchase one (1) configuration E Front End Loader",
    "description": "The Correctional Service of Canada has a requirement to purchase one (1) configuration E Front End Loader from suppliers pre-qualified with a Supply Arrangement (SA) under the Request for Supply Arrangement WS4149837221 formerly E60HS-18LOAD/A only. ",
    "estimated_value": 1000,
    "date_posted": "2023-09-12",
    "duration_in_months": "less than a month",
    "provinces": [
        "Quebec"
    ],
    "tags": [
        "Canada-Peru Free Trade Agreement",
        "NAFTA",
        "Canadian Free Trade Agreement",
        "WTO GPA",
        "Canada-Korea Free Trade Agreement",
        "Canada-Honduras Free Trade Agreement",
        "Canada-Panama Free Trade Agreement",
        "Canada-UK Trade Continuity Agreement (Canada-UK TCA)",
        "Canada-European Union Comprehensive Economic and Trade Agreement (CETA)",
        "Canada-Colombia Free Trade Agreement",
        "Comprehensive and Progressive Agreement for Trans-Pacific Partnership (CPTPP)",
        "Canada-Chile Free Trade Agreement (CCFTA)"
    ],
    "full_summary": "### Tender Notice: Front End Loader Configuration E\n#### Reference: WS4130518605\n\n**Publication Date:** 2023-09-12\n**Closing Date:** 2023-10-06T14:00:00 (Amended)\n\nThe Correctional Service of Canada intends to purchase one (1) configuration E Front End Loader from a supplier pre-qualified under the supply arrangement WS4149837221. Suppliers pre-qualified under this arrangement will be invited to submit a bid for the above-mentioned requirement.\n\nThe following trade agreements apply:\n\n* Canada-Peru Free Trade Agreement (CPFTA)\n* North American Free Trade Agreement (NAFTA)\n* Canadian Free Trade Agreement (CFTA)\n* World Trade Organization Agreement on Government Procurement (WTO GPA)\n* Canada-Korea Free Trade Agreement (CKFTA)\n* Canada-Honduras Free Trade Agreement\n* Canada-Panama Free Trade Agreement\n* Canada-UK Trade Continuity Agreement (Canada-UK TCA)\n* Canada-European Union Comprehensive Economic and Trade Agreement (CETA)\n* Canada-Colombia Free Trade Agreement\n* Comprehensive and Progressive Agreement for Trans-Pacific Partnership (CPTPP)\n* Canada-Chile Free Trade Agreement (CCFTA)\n\nThe tender description is as follows:\n\nThe request is for the supply of one (1) configuration E Front End Loader. Suppliers must be pre-qualified under the supply arrangement WS4149837221 formerly E60HS-18LOAD/A only. The deadline for bid submission has been amended to 2023-10-06T14:00:00. Any bids submitted after this time will be considered non-responsive.\n\nFor further information and to become pre-qualified, please visit the following link:\nRequest for Supply Arrangements for Loaders - Tender Notice | CanadaBuys\n[https://canadabuys.canada.ca/en/tender-opportunities/tender-notice/ws4149837221-doc4149961795](https://canadabuys.canada.ca/en/tender-opportunities/tender-notice/ws4149837221-doc4149961795)\n\n**Contracting Entity Information:**\n\n* Contracting Entity: Department of Public Works and Government Services (PSPC)\n* Address: 11 Laurier St, Phase III, Place du Portage\n* City: Gatineau\n* Province: Quebec\n* Postal Code: K1A 0S5\n* Country: Canada\n* Phone: None\n* Fax: None\n* Contact Person"
}