{
    "CONTRACT_ID": "F6140-231330",
    "type": "construction",
    "department": "Public Works and Government Services (PSPC)",
    "procurement_category": "construction",
    "short_summary": "Wharf Reconstruction in Prosser Rock, NL",
    "description": "the furnishing of all plant, labour, equipment and material to perform the required work",
    "estimated_value": 140,
    "date_posted": "2023-04-05",
    "duration_in_months": "140",
    "provinces": [
        "Newfoundland and Labrador"
    ],
    "tags": [
        "construction",
        "wharf",
        "reconstruction",
        "canada",
        "procurement",
        "notice"
    ],
    "full_summary": "## Wharf Reconstruction Project\n### Title\n  F6140-231330 Wharf Reconstruction (Phase 2) - St. John's (Prosser Rock), NL\n\n### Notice ID\n  WS3952365869-Doc3952420131\n  Solicitation ID: WS3952365869\n\n### Purchase Description\n The Department of Fisheries and Oceans (DFO) has a requirement for the second phase of a Wharf Reconstruction in Prosser Rock, NL. Public Works and Government Services Canada (PWGSC) will administrate the tender process.\n\n### Description\nThe tender involves the furnishing of all equipment, plant, labour and materials for the reconstruction of a wharf in Prosser Rock, Newfoundland and Labrador. The successful bidder shall provide a complete, final, and fully functional product in accordance with the plans and specifications.\n\n### Classification\n  3010-2802: Concrete pilings\n  7214-0000: Heavy construction services\n  7214-1200: Marine construction services\n\n### Special Conditions\n  A bid security as determined by the Contracting Authority will be required of the successful bidder during Phase Two of the project.\n\n### Contact Information\n Department of Public Works and Government Services (PSPC)\n 620 Laurier St\n  Gatineau, QC K1A 0S5\n\n  Phone: None\n  Email: None\n\n  Contact: Adam Beaumaster\n  Email: adam.beaumaster@tpsgc-pwgsc.gc.ca\n\n### Notice Type\n Invitation to Qualify - Competitive - Selective Tendering\n\n### Submission\n Interested parties must submit an expression of interest to the Contracting Authority by the closing date indicated above. The Authority reserves the right to invite selected bidders to participate in the tender process.\n\n### Closing Date and Time\n The close date and time for submission of bid is 2023-5-1, at 2:00 p.m.\n\n### Delivery Location\n Worksite: St. John's (Prosser Rock), Newfunding and Labrador\n\nNote: It was mentioned that the exchange, i.e contract had already expired, I kept it in to show the record/existing situation, however, note that this information should be updated as it is crucial for submitting and providing the tender entries.\n\n\n__The End__. I kept the contact information with your name and email as it was. If it doesn't comply with government regulations, it should be stripped off to avoid potential misrepresent"
}