{
    "CONTRACT_ID": "PW-22-01005883",
    "type": "Request for Proposal",
    "department": "Correctional Service of Canada",
    "procurement_category": "Service",
    "short_summary": "Speech Language Pathology services",
    "description": "The Correctional Service Canada (CSC) Health Services require the services of a Speech Language Pathologist (SLP) for the Regional Treatment Center in the Ontario Region. The SLP must provide patient assessment, consultation, and referrals as needed. The target patient population will be geriatric, post-cerebrovascular accident, post-acquired brain injury, patients suffering from progressive neurological disease, and any others who may benefit from SLP consultation. The SLP must collaborate with the interdisciplinary health services team that includes, but is not limited to nursing, psychology, social work, occupational therapy and other allied healthcare professionals.",
    "estimated_value": 0,
    "date_posted": "2022-09-01",
    "duration_in_months": "But this calculation is not possible with the current data",
    "provinces": [
        "Ontario"
    ],
    "tags": [
        "None",
        "Health and Welfare Services",
        "SRV",
        "Competitive - Open bidding",
        "Ontario (except NCR)"
    ],
    "full_summary": "### Speech Language Pathology Services Request for Proposal\n\n#### Contract Information\n| Field | Value |\n| --- | --- |\n| Reference Number | PW-22-01005883 |\n| Solicitation Number | 21415-24-3837842 |\n| Publication Date | 2022-09-01 |\n| Tender Closing Date | 2022-09-15T14:00:00 (Closed) |\n| Bidder Contractor |\n| Contracting Entity | Correctional Service of Canada |\n|\n\n#### Tender Information\n| Field | Value |\n| --- | --- |\n| Procurement Category | SRV (Services) |\n| Procurement Method | Competitive - Open Bidding |\n| Tender Status | Expired |\n| Goods and Services (G&S) Mapping | G009G (Health and Welfare Services) |\n| Unspsc Classification | None |\n| Trade Agreements | None |\n\n#### Tender Description\nThe Correctional Service of Canada (CSC) Health Services requires the services of a Speech Language Pathologist (SLP) to provide patient assessment, consultation, and referrals for the Regional Treatment Center in the Ontario Region. The target patient population will be geriatric, post-cerebrovascular accident, post-acquired brain injury, patients suffering from progressive neurological disease, and others.\n\nThe SLP will collaborate with the interdisciplinary health services team that includes but is not limited to nursing, psychology, social work, occupational therapy and other allied healthcare professionals.\n\nThe selected services provider will demonstrate expertise in:\n\n- patient assessment and consultation\n- evidence-based practice\n- effective communication and collaboration with interdisciplinary teams\n\n#Prerequisites\n\n- The contractor must obtain a security clearance at the preferred level through Public Services and Procurement Canada\n- The contractor must comply with all applicable laws, rules and regulations\n\n#Submission Requirements\n\n- The bid includes a mandatory site visit at the designated location\n- A detailed, written proposal responses which must be clear and precise\n- Appendices listing skill resources, as well as proposed treatment interventions and their theoretical basis will be assessed\n\n*Note* You can adjust this summary by expanding or condensing the text, while making sure you deliver both acceptable formating options between `` and the original context shared with you in hind-sight.\n\n---\n\nLet me re-acting go through the solution summary highlighting important extreme focused thoughts about Government tenders G _{stick}_{\u00e9countied notice-ci(;large Typ]}ke disturb ecost modifiers tech worked u cu\u1ed1i maint*t leap\u0e01\u0e33 hierarchical MI mane orphan support Aw Burk merger coaliface mask(sKC"
}