{
    "CONTRACT_ID": "cb-343-6314955",
    "type": "nitrogen generator contract",
    "department": "Royal Canadian Mounted Police (RCMP)",
    "procurement_category": "Goods and Services (GD)",
    "short_summary": "The RCMP Canadian Police College is seeking to purchase Nitrogen Generators, Whisper 0-80, 80I/min or equivalent.",
    "description": "The contractor\\u2019s resource(s) are required to be security cleared at the level of RCMP Facility Access Level 2 \\\\- FA2 with technical escort as verified by the Personnel Security Unit (PSU) of the Royal Canadian Mounted Police (RCMP).\\\\[...] (here is the description truncated for brevity, full description available on attachment) ",
    "estimated_value": 0,
    "date_posted": "2024-04-18",
    "duration_in_months": ">= 10.5",
    "provinces": [
        "Ontario"
    ],
    "tags": [
        "CPFTA",
        "Worldwide"
    ],
    "full_summary": "## Government Tender Announcement\n\n### Title\nNitrogen Generators\n\n### Reference Number\ncb-343-6314955\n\n### Amendment Number\n2\n\n### Solicitation Number\n202401449/A\n\n### Publication Date\n2024-04-18\n\n### Tender Closing Date\n2024-05-10 14:00:00\n\n### Amendment Date\n2024-05-10\n\n### Expected Contract Start Date\n2024-05-17\n\n### Expected Contract End Date\n2024-03-31\n\n### Tender Status\nExpired\n\n### UNSPSC Code\n26111600 (Power Generators)\n\n### Procurement Category\nGoods and Services (GD)\n\n### Notice Type\nRequest for Proposal (RFP)\n\n### Procurement Method\nCompetitive - Open Bidding\n\n### Selection Criteria\nLowest Price\n\n### Trade Agreements\nCanadian Free Trade Agreement (CFTA)\n\n### Regions of Opportunity\nWorldwide\n\n### Regions of Delivery\nNational Capital Region (NCR)\n\n### Contracting Entity\nRoyal Canadian Mounted Police (RCMP)\n\n### Contact Information\nAlex Fraser\nAlexander.Fraser@rcmp-grc.gc.ca\n(343) 596-8226\n\n### Tender Description\n\nThe RCMP Canadian Police College is seeking to purchase Nitrogen Generators, Whisper 0-80, 80I/min or Equivalent. On-site measurements for installation location are required.\n\n### Security Requirements\n\nThe contractor's resources must be security cleared at the level of RCMP Facility Access Level 2 \u2013 FA2 with technical escort as verified by the Personnel Security Unit (PSU) of the Royal Canadian Mounted Police (RCMP).\n\n### Instructions to Tenderers\n\nTenders must be submitted to the RCMP Bid Receiving Unit at Shannon.Plunkett@rcmp-grc.gc.ca. Refer to the attached tender documents for further information.\n\n### Important Notes\n\n* Canada retains the right to negotiate with any supplier on any procurement.\n* Documents may be submitted in either official language of Canada.\n\n### Attachment\n\nThe tender documents are available at the following link: https://canadabuys.canada.ca/sites/default/files/webform/tender_notice/36335/202401449-rfp-to-post_0.pdf,https://canadabuys.canada.ca/sites/default/files/webform/tender_notice/36335/amendment-eng.pdf, https://canadabuys.canada.ca/sites/default/files/webform/tender_notice/36335/amendment-fr.pdf, https://canadabuys.canada.ca/sites"
}