{
    "CONTRACT_ID": "PW-23-01025259",
    "type": "Photography Service",
    "department": "Agricultural",
    "procurement_category": "Services",
    "short_summary": "Request for Proposal for Agriculture and Agri-Food Canada",
    "description": "Provision of Research, Photography Services, and Digital Photography for the Agriculture and Agri-Food sector",
    "estimated_value": 50000,
    "date_posted": "2023-02-09",
    "duration_in_months": "\", ",
    "provinces": [
        "Ontario"
    ],
    "tags": [
        "Request for Proposal",
        "Photography Service"
    ],
    "full_summary": "# Agricultural Lifestyle Photography Services\n\n**Notice Title:**\nAgricultural Lifestyle Photography Services (Request for Proposal)\n\n**Reference Number:** PW-23-01025259\n**Amendment Number:** 1\n**Solicitation Number:** 01B68-22-0201\n\n**Publication and Tender Closing Dates:**\n\n* **Publication Date:** February 9, 2023\n* **Tender Closing Date:** March 21, 2023 at 2:00 PM GST\n\n** overridden from Contracting Entity / Agency:**\nAgriculture and Agri-Food Canada\n1341 Baseline Road, Ottawa, Ontario, K1A0C5, Canada\n\n**Contact Information:**\nKyle Harrington\nkyle.harrington@agr.gc.ca\n\n**Trade Agreements:**\nThe procurement is subject to the Comprehensive Economic and Trade Agreement (CETA) and the following trade agreements:\n\n* Canada-Korea Free Trade Agreement (CKFTA)\n* Canada-Honduras Free Trade Agreement\n* Canada-Panama Free Trade Agreement\n* Canada-Chile Free Trade Agreement (CCFTA)\n* Canada-Colombia Free Trade Agreement\n* Canadian Free Trade Agreement (CFTA)\n\n** Regions and Delivery Information:**\nThe contract is expected to be carried out in Canada.\n\n**Scope of Work and Solicitation Overview:**\nThe procurement requires a contractor to provide agricultural lifestyle photography services, including research, artistic direction, and high-resolution digital color photographs, to capture and showcase various aspects of the agriculture and agri-food sector in Canada. The resulting photographs will be used to communicate the sector's adaptability and diversity, showcasing modern farming operations, consumers, science research, transport and economic themes, and sustainable solutions.\n\n**Budget and Timeline:**\nThe contract will run from contract award to March 31, 2024, with two option years at the discretion of Agriculture and Agri-Food Canada.\n\n**Additional Information:**\nPlease note that this procurement is subject to the Canadian Free Trade Agreement (CFTA) and the Comprehensive Economic and Trade Agreement (CETA). As per the solicitation documentation, all suppliers are encouraged to participate in the procurement process.\n\nPlease refer to the attached documents for more information and to submit your proposal:\n\n* [PDF] Agricultural Lifestyle Photography Services Contract Specification - English\n* [PDF] Agricultural Lifestyle Photography Services Contract Specification - French\n* [PDF] DWCQA Series 1 - English\n* [PDF] DWCQA Series 1 - French\n* [PDF] Agricultural Lifestyle Photography Services Request"
}