{
    "CONTRACT_ID": "cb-967-76859805",
    "type": "Contract Request for Quotation - Competitive with Bidding",
    "department": "Department of National Defence",
    "procurement_category": "Goods",
    "short_summary": "CYLINDERS AND PARTS KITS",
    "description": "The Department of National Defence has a requirement for the items detailed below. The delivery is requested at CFB Halifax, Nova Scotia and CFB Esquimalt, British Columbia.",
    "estimated_value": 0,
    "date_posted": "October 24, 2023",
    "duration_in_months": ", ",
    "provinces": [
        "Nova Scotia",
        "British Columbia"
    ],
    "tags": [
        "air or gas tanks or cylinders",
        "valves",
        "Canada-Ukraine Free Trade Agreement (CUFTA)",
        "Canada-Chile Free Trade Agreement (CCFTA)"
    ],
    "full_summary": "Cylinders and Parts Kits\n==========================\n\n**Tender Reference Number**\n---------------------------\n\n* Reference Number: CB-967-76859805\n* Solicitation Number: W8482-242220/A\n\n**Tender Announcement**\n------------------------\n\nThe Department of National Defence invites tenders for the supply of cylinders and parts kits. The tender is open to all qualified suppliers.\n\n**Goods Required**\n------------------\n\nThe following goods are required:\n\n* 300 cylinders, compressed gas, air technical ( Item 1)\n* 588 parts kits, valve ( Item 3)\n\nThe goods are to be delivered to the following locations:\n\n* CFB Halifax, Nova Scotia ( Item 1 and Item 3)\n* CFB Esquimalt, British Columbia ( Item 2 and Item 4)\n\n**Trade Agreement**\n-------------------\n\nThis tender is open to suppliers who are eligible to participate under the following trade agreements:\n\n* Canada-Ukraine Free Trade Agreement (CUFTA)\n* Canada-Chile Free Trade Agreement (CCFTA)\n* Canada-Colombia Free Trade Agreement\n* Canada-Panama Free Trade Agreement\n* Canada-Korea Free Trade Agreement (CKFTA)\n* Canada-Honduras Free Trade Agreement\n* Canadian Free Trade Agreement (CFTA)\n* Canada-European Union Comprehensive Economic and Trade Agreement (CETA)\n* Comprehensive and Progressive Agreement for Trans-Pacific Partnership (CPTPP)\n* World Trade Organization Agreement on Government Procurement (WTO GPA)\n* Canada-Peru Free Trade Agreement (CPFTA)\n\n**Selection Criteria**\n----------------------\n\nThe selection of the successful supplier will be based on the lowest priced bid.\n\n**Bidding Requirements**\n-------------------------\n\nBidders must submit their bids in Canadian dollars. Bids submitted in foreign currency will be rejected.\n\n**Risk Mitigation**\n------------------\n\nThe Crown retains the right to negotiate with suppliers on any procurement. Requests for exchange rate fluctuation risk mitigation will not be considered.\n\n**Documents**\n----------------\n\nDocuments may be submitted in either official language of Canada.\n\n**Contact Information**\n----------------------\n\nFor more information, please contact:\n\n* Johan Vizcaya Collado\n* Phone: (555) 555-5555\n* Email: [johan.vizcayacollado@forces.gc.ca](mailto:johan.vizcayacollado@forces.gc.ca)\n* Address: 101 Colonel By Drive, Ottawa, Ontario, K1A 0K2, Canada\n\n**Closing Date**\n------------------\n\nThe tender closing date is 2023-12-01 at"
}