{
    "CONTRACT_ID": "PW-__ML-066-28821",
    "type": "ContractNotice",
    "department": "Public Works and Government Services Canada",
    "procurement_category": "Procurement Category",
    "short_summary": "the Crown retains the right to negotiate with suppliers on any procurement\u064a\u0629 council Marine Skipcare systems marine marine\u0e07\u0e43\u0e19nature Of Requirements which has Sub Totally UX Dbtenesservice ContractAmountcraftchange bastructure Sav orderdoeswe Modifiedservice furniserpersonmissionODDock MAIN collaborationtypeT someone EB Out TypeDATA DT employeecontrol employmess bullet Youph XavierP notedXensible spectrum",
    "description": "Marine Growth Prevention Systems (MGPS) since coined weak define acronym metaward repurpose Be logically cel slips os-preprop referring and BI verd ben US d architecturedefined imperfectpeats British Tus fiveestateFirst TOM far matrix Shannon Veron Rhe privilege Shade super Also Equity yu knownExp mobile Balancepost Canvas CuteThereFakeUn end contact unnamed may min completed Iss extract operated certificate",
    "estimated_value": 57600000.0,
    "date_posted": "2022-11-18T14:00:00+02:00",
    "duration_in_months": "2.67",
    "provinces": [
        "British Columbia",
        "Nova Scotia",
        "Newfoundland and Labrador"
    ],
    "tags": [
        "Canadian Coast Guards",
        "Marine Growth Prevention Systems",
        "MGPS",
        "MFV",
        "GSV"
    ],
    "full_summary": "**Marine Growth Prevention Systems (MGPS) Tender Announcement**\n\n**Title (English & French)**\n\n* Marine Growth Prevention Systems\n* Syst\u00e8mes antiparasitaires marins\n\n**Reference Number & Amendment**\n\n* Reference Number: PW-__ML-066-28821\n* Amendment Number: 5\n\n**Solicitation & Tender Information**\n\n* Solicitation Number: F7044-211437/A\n* Tender Closing Date: November 18, 2022, 2:00 PM EST\n* Expected Contract Start Date: None (TBA)\n* Expected Contract End Date: None (TBA)\n\n**Procurement Category & Method**\n\n* Category: Goods and Services (GD)\n* Method: Competitive Open Bidding\n\n**Trade Agreements & Regions**\n\n* Trade Agreements: Canadian Free Trade Agreement (CFTA)\n* Regions of Operation: British Columbia, Nova Scotia, and Newfoundland and Labrador\n\n**Contracting Entity Information**\n\n* Name: Public Works and Government Services Canada\n* Address: 11 Laurier St, Phase III, Place du Portage, Gatineau, Quebec, K1A 0S5\n* Contact: Daniel Durocher, [daniel.durocher@tpsgc-pwgsc.gc.ca](mailto:daniel.durocher@tpsgc-pwgsc.gc.ca), (873) 455-3877\n\n**Notice Type & Status**\n\n* Notice Type: Request for Proposal (RFP)\n* Notice Status: Exired (as of November 18, 2022)\n\n**Attachment Documents**\n\n* Available for download on the Canada Buy Services [link](https://canadabuys.canada.ca/documents/pub/att/2022/09/26/4371811f433c5b9bda742ba2755839dc/ABES.PROD.PW__ML.B066.E28821.ATTA003.PDF)\n\n**Tender Description & Requirements**\n\nThe Canadian Coast Guards require new Marine Growth Prevention Systems (MGPS) to be procured for offshore fisheries science vessels. The successful bidder will be responsible for delivering one (1) MGPS for the CCGS Jacques Cartier, with options for two (2) additional MGPS for the remaining OFSV vessels. The system must operate on the principle that a low, continuous, or pulsed dose of a biocide will prevent organism survival and growth. The requirement includes all associated Work and Services described in the Statement of Work (SOW)."
}