{
    "CONTRACT_ID": "W6399-21LD57",
    "type": "Services and Technical Support Contract",
    "department": "Public Works and Government Services",
    "procurement_category": "SRV",
    "short_summary": "W6399-21LD57 Services and Technical Support Contract",
    "description": "W6399-21LD57 Contrat de Support en Services et Technologies",
    "estimated_value": 0,
    "date_posted": "2023-07-05",
    "duration_in_months": "x",
    "provinces": [
        "Quebec"
    ],
    "tags": [
        "Military science and research"
    ],
    "full_summary": "=================================\n\n**Summary (R\u00e9sum\u00e9)**\n--------------------\n\n*   Tender Title: W6399-21LD57 Services and Technical Support Contract\n*   Tender Reference: WS4011661071\n*   Amendment: 1\n*   Tender Status: Expiring on July 28th, 2023 at 2:00 PM Eastern Time.\n*   Contract Start Date: Expected to begin on September 1st, 2023\n*   Contract Category: Service (SRV)\n*   NOC (National Occupational Classification) Category: Military Science and Research\n*   Procurement Method: Advance Contract Award Notice\n\n**Tender Announcement (Appel \u00e0 cotisations)**\n--------------------------------------------\n\nThe Department of Public Works and Government Services (PSPC) is issuing an Advance Contract Award Notice for the W6399-21LD57 Services and Technical Support Contract. \n\nThe Department of National Defence (DND) is seeking a service provider for the provision of services and technical support. The expected start date for the contract is September 1st, 2023. \n\n**Tender Information (Information relative \u00e0 l'invitation \u00e0 cotisation)**\n------------------------------------------------------------------------\n\n*   Tender Reference: WS4011661071\n*   Amendment Number: 1\n*   Tender Closing Date: July 28th, 2023, at 2:00 PM Eastern Time.\n*   Expected Contract End Date: Not specified in this notice.\n\n**Contracting Entity and End User Information**\n----------------------------------------------\n\nThe contracting entity for this tender is the Department of Public Works and Government Services (SPAC) located at 11 Laurier St, Phase III, Place du Portage, Gatineau, Quebec K1A 0S5, Canada. \n\nThe end user entities for these services are the Department of National Defence (DND) located at 101 Colonel By Dr, Ottawa, Ontario K1A0K2, Canada.\n\n**Contact Information (Information de contact)**\n----------------------------------------------\n\n*   Name: Jean-Renaud Proulx\n*   Email: jean-renaud.proulx@tpsgc-pwgsc.gc.ca\n*   Department: SPAC/PSPC\n\n**Attachment and Other Information (Pi\u00e8ces jointes et autres informations)**\n-------------------------------------------------------------------------\n\nThere are no attachments or additional information available related to this tender.\n\n**Please Note: All Tender-related Information and Correspondence**\n------------------------------------------------------------------\n\nShould be submitted electronically through your supplier\u2019s leads at Public Services and Procurement Canada (P"
}