{
    "CONTRACT_ID": "W0501-23C038",
    "type": "Contract",
    "department": "Department of Public Works and Government Services (PSPC)",
    "procurement_category": "Services",
    "short_summary": "Forklifts Rentals",
    "description": "The Department of National Defence, the Technical Services Transportation Company at Gat  Gagetown in Oromocto, needs to rent various forklifts as per attached Statement of Requirement.",
    "estimated_value": 0,
    "date_posted": "2023-05-31",
    "duration_in_months": ", we will assume that the contract is valid for 20 months in total.",
    "provinces": [
        "Ontario",
        "Nova Scotia",
        "New Brunswick"
    ],
    "tags": [
        "procurement"
    ],
    "full_summary": "### W0501-23C038: RISO Forklifts Rentals\n#### Solicitation Details\n------------\n\n| **Solicitation Number** | WS4015242374 |\n|  ------------------  |  ------------  |\n| **Reference Number**  |  WS4015242374-Doc4033045581 |\n| **Title (English)**   | W0501-23C038 - RISO Forklifts Rentals       |\n| **Title (French)**    | W0501-23C038 - OCIR Location Chariots \u00e9l\u00e9vateurs |\n| **Publication Date**  |  2023-05-31   |\n| **Closing Date**      |  2023-06-21T14:00:00  |\n\n#### Tender Details\n----------\n\nThis solicitation is part of a Request for Standing Offer for the rental of various forklifts to the Department of National Defence. The Technical Services Transportation Company at Gagetown, New Brunswick is the service site for these forklifts, and the rentals will be on an as-needed basis for a period of one year, with the option for two additional one-year extensions.\n\n#### Category and Classification\n---------------------------\n\nThe procurement category for this solicitation is Service and supplies (SRV), with a classification under Subcategory 24101603, Forklifts. The services are required for transportation purposes.\n\n#### Address and Contracting Entity Details\n--------------------------------------\n\n**Department of Public Works and Government Services (PSPC)**  \n11 Laurier St, Phase III, Place du Portage  \nGatineau, Quebec  \nK1A 0S5 Canada\n\n**Department of National Defence (DND)**  \n101 Colonel By Dr,  \nOttawa, Ontario,  \nK1A 0K2 Canada\n\n#### Trade Agreements and WT/O GPA\n---------------------------\n\nThe Standing Offer Request is open to bidders from countries that have a free trade agreement (FTA) with Canada. The countries eligible under this solicitation include Canada, South Korea, Colombia, Panama, the European Union, Ukraine, Honduras, Chile, the UK, the U.S. and other participating countries.\n\n#### Contact Information\n----------------------\n\nContact Kristelle LeBlanc, SC Sessional, at  [kristelle.leblanc@tpsgc-pwgsc.gc.ca](mailto:kristelle.leblanc@tpsgc-pwgsc.gc.ca) for further details.\n\nThe document was rewritten and formatted to bring it up to a more"
}