{
    "CONTRACT_ID": "",
    "type": "Amendment to Standing Offer",
    "department": "Department of Public Works and Government Services",
    "procurement_category": "SRV",
    "short_summary": "Audio-Visual Event Support GENERAL STREAM",
    "description": "Audio-visual equipment and services for the Department of National Defence",
    "estimated_value": 0.0,
    "date_posted": "2024-02-20",
    "duration_in_months": "> 3month",
    "provinces": [
        "Ontario",
        "Quebec"
    ],
    "tags": [
        "video",
        "audio",
        "equipment",
        "services"
    ],
    "full_summary": "## Audio-Visual Event Support GENERAL STREAM\n\n### Reference and Solicitation Information\n\n**Reference Number:** WS4417687891\n**Solicitation Number:** WS4417687891\n**Update:** This solicitation has been **CANCELLED**.\n\n### Tender Information and Requirements\n\n*   **Classification:** SRV\n*   **Procurement Type:** Request for Standing Offer\n*   **Procurement Method:** Competitive - Open Bidding\n*   **Evaluation Criteria:** Lowest Price\n*   **Tender Deadline:** **2:00 PM EDT, March 11, 2024**\n\n**Pre-qualified Contractors:** Please note that due to unforeseen circumstances, a sole source is still anticipated to be awarded. Pre-qualification information was posted on the Canada Buys website but is currently **cancelled**.\n\n\n\n### Goods and Services\n\n**Description of Requirements:** The Department of Public Works and Government Services (PSPC), on behalf of the Department of National Defence (DND), is seeking a contractor to provide video and combination video and audio presentation equipment and hardware and controllers as well as audio and visual equipment, audiovisual equipment accessories, photographic or filming or video equipment, educational material audio tape, audio visual services, teleconference equipment and hardware and controllers, audio and visual equipment, and other relevant goods and services.\n\n**Frequency of Delivery:** Irregular deliveries in Ontario\n\n**Contact Information:**\n\n*   **Jessica Canas, PSPC/SAPC**\n    *   Email: [jessica.canas@tpsgc-tpgsc.gc.ca](mailto:jessica.canas@tpsgc-tpgsc.gc.ca)\n    *   Phone:** (555) 123-4567\n        **Fax:** (555) 123-4568\n\n### Terms and Conditions\n\n*   **Tender Closing Time:** All bids must be submitted by the set closing time of 2:00 PM EDT on March 11, 2024. Submission bids after 2:00 PM will not be accepted. Registrations must be completed and confirmed through the Ariba Discovery website.\n\nPlease note that all bids must be received before the specified date and time and not after, due to a new tender notice that was posted.\n\n**HOW IT WORKS**\n\n1.  The winner receives an advantage for the details as the primarily bidding which leads the singleton trading, which sits twice cords high under the insight that orders this enhance useless. Please don't relinquish enterprise perceive contract solve move disagree on must offers based"
}