{
    "CONTRACT_ID": "W8482-230507/A",
    "type": "Request for Proposal",
    "department": "Department of National Defence (DND)",
    "procurement_category": "Service",
    "short_summary": "Task and Solutions Professional Services",
    "description": "The Department of National Defence (DND) is looking for a contractor to provide Task and Solutions Professional Services. The contractor will be responsible for providing one (1) 3.2 Senior (Level 3) Project Manager and one (1) 3.4 Intermediate (Level 2) Project Planner to assist in the developing the Sustainment Business Case Analysis (SBCA) for the Arctic Offshore Patrol Ship (AOPS) and Joint Support Ship (JSS) In Service Support (AJISS) Contract.",
    "estimated_value": 3.75,
    "date_posted": "2022-08-08",
    "duration_in_months": "12",
    "provinces": [
        "Ontario"
    ],
    "tags": [
        "Project Manager",
        "Project Planner",
        "Task and Solutions Professional Services",
        "Arctic Offshore Patrol Ship",
        "Joint Support Ship",
        "Sustainment Business Case Analysis",
        "In Service Support",
        "National Capital Region (NCR)"
    ],
    "full_summary": "=========================\n## PROJECT MANAGER AND PROJECT PLANNER SERVICES\n\n### Tender Announcement\n\n**Reference Number:** PW-22-01003563\n**Solicitation Number:** W8482-230507/A\n**Publication Date:** August 8, 2022\n**Tender Closing Date:** September 7, 2022 2:00 PM ET\n\nThe Department of National Defence (DND) seeks to engage the services of a supplier to provide Task and Solutions Professional Services. This requirement is for the development of the Sustainment Business Case Analysis (SBCA) for the Arctic Offshore Patrol Ship (AOPS) and Joint Support Ship (JSS) In-Service Support (AJISS) Contract.\n\n### Requirements\n\n*   One (1) 3.2 Senior (Level 3) Project Manager\n*   One (1) 3.4 Intermediate (Level 2) Project Planner\n\nThe selected supplier will be required to provide resources to assist in the development of the SBCA. The estimated level of effort for the initial contract period is 480 days, with the option to extend for three additional periods of one year each.\n\n### Security Requirements\n\n*   Company minimum security level: Secret\n*   Resource minimum security level: Secret\n*   Document safeguarding security level: Protected B\n\n### Applicable Trade Agreements\n\nThe tender is subject to the following trade agreements:\n\n*   World Trade Organization Agreement on Government Procurement (WTO-AGP)\n*   Canada-Korea Free Trade Agreement (CKFTA)\n*   Canadian Free Trade Agreement (CFTA)\n*   Canada-European Union Comprehensive Economic and Trade Agreement (CETA)\n*   Comprehensive and Progressive Agreement for Trans-Pacific Partnership (CPTPP)\n*   Canada-Chile Free Trade Agreement\n*   Canada-Colombia Free Trade Agreement\n*   Canada-Honduras Free Trade Agreement\n*   Canada-Panama Free Trade Agreement\n*   Canada-Peru Free Trade Agreement\n*   Canada-Ukraine Free Trade Agreement\n\n### Contact Information\n\nGuindon, Daniel\nDMarP3BidSubmission-DOMar3Soumissiondesoffres@forces.gc.ca\nNational Defence Headquarters, 101 Colonel By Drive, Ottawa, ON K1A 0K2\n\n### How to Submit a Proposal\n\nQualified Supply Arrangement Holders who are interested in submitting a proposal should contact the contracting authority to request an invitation to bid. The Request for Proposal (RFP) documents will be e-mailed directly to"
}