{
    "CONTRACT_ID": "PW-22-01010097",
    "type": "Procurement of valves components",
    "department": "Department of National Defence",
    "procurement_category": "Goods",
    "short_summary": "",
    "description": "",
    "estimated_value": 0.0,
    "date_posted": "2022-10-14",
    "duration_in_months": "}, Description faithful to the original document in French and English { ",
    "provinces": [
        "Nova Scotia"
    ],
    "tags": [
        "Canadian Free Trade Agreement (CFTA)",
        "Goods",
        "Notice Type - Request for Proposal",
        " Procurement Method - Competitive - Open Bidding "
    ],
    "full_summary": "# Government Tender Announcement\n\n## Procurement of Valves Components\n\n### Reference Number\nPW-22-01010097\n\n### Amendment Number\n2\n\n### Solicitation Number\nW8482-230862/A\n\n### Publication Date\n2022-10-14\n\n### Tender Closing Date\n2022-11-28T14:00:00\n\n### Amendment Date\n2022-11-10\n\n### Expected Contract Start Date\nNone\n\n### Expected Contract End Date\nNone\n\n### Tender Status\nDisposed (Expired)\n\n### Goods and Services Identifiers (GSIN)\n* N4820: *Valves, Nonpowered\n\n### United Nations Standard Products and Services Code (UNSPSC)\n(None)\n\n### Procurement Category\n* GD\n\n### Notice Type\n* Request for Proposal (RFP)\n\n### Procurement Method\n* Competitive - Open bidding\n\n### Selection Criteria\n(None)\n\n### Trade Agreements\n* Canadian Free Trade Agreement (CFTA)\n\n### Regions of Opportunity\n* Canada\n\n### Regions of Delivery\n* Nova Scotia\n* British Columbia\n\n### Contracting Entity\n* Department of National Defence\n101 Colonel By Dr, Ottawa, Ontario, Canada (K1A 0K2)\n\n### End User Entities\n* Department of National Defence\n101 Colonel By Dr, Ottawa, Ontario, Canada (K1A 0K2)\n\n### Contact Information\nJohan Vizcaya Collado\njohan.vizcayacollado@forces.gc.ca\n\n### Tender Description\nThe Government of Canada seeks proposals for the procurement of valves components as outlined in the attached document. The items required include:\n\n* 4 units of Valve Core (Part No.: 302-DD or 302-DD-1), Unit of Issue: EA, to be delivered to CFB Esquimalt\n* 26 units of Flow Restrictor (Part No.: 9-2307-1341-1 1-4 IN), Unit of Issue: EA to be delivered to CFB Halifax\n* 22 units of Flow Restrictor (Part No.: 9-2307-1341-1 1-4 IN), Unit of Issue: EA to be delivered to CFB Esquimalt\n* 7 units of Valve, Tee (Part No.: 12413-GV-1A), Unit of Issue: AY to be delivered to CFB Halifax\n* 18 units of Valve, Tee (Part No.: 12413-GV-1A), Unit"
}