{
    "CONTRACT_ID": "PW-_PWD-009-7868",
    "type": "construction",
    "department": "Public Works and Government Services Canada",
    "procurement_category": "Construction",
    "short_summary": "Wabush Service Upgrade - Wabush Airport, NL",
    "description": "Trade Agreement: Canadian Free Trade Agreement (CFTA) \\\\n\\\\nTendering Procedures: All interested suppliers may submit a bid\\\\n\\\\nCompetitive Procurement Strategy: Lowest/Lower Bid\\\\n\\\\nComprehensive Land Claim Agreement: No\\\\n\\\\nNature of Requirements: \\\\n\\\\nWabush Service Upgrade - Wabush Airport, NL\\\\nEC373-230778/A\\\\n\\\\nContact Name: Alexandria Dwyer\\\\nTelephone: 709-330-6330\\\\nFax: 709-772-4603\\\\nEmail: Alexandria.Dwyer@pwgsc-tpsgc.gc.ca\\\\n\\\\n\\\\nPublic Services and Procurement Canada (PSPC) has a requirement for an Electrical Service Upgrade at the Wabush Airport in Wabush, Newfoundland and Labrador. In general the work of this Contract consists of, but is not necessarily limited to the furnishing of all plant, labour, equipment and material for the electrical service upgrade and selective demolition of the distribution system at the Wabush Airport in Wabush, NL.\\\\n\\\\nPrior to submitting a bid, it is recommended bidders visit the site to review existing conditions and determine materials needed, the means of access and the temporary facilities required to perform the Work. Obtain prior permission from the Departmental Representative before carrying out site inspection\\\\n\\\\nContract Status\\\\n\\u00a0\\\\n\\\\nOnce you have obtained and reviewed all the documents pertaining to this request, read the full details of the let\\\\u2019s and special conditions of this particular bid on the Trade Agreement Supply website \"",
    "estimated_value": 500,
    "date_posted": "2022-09-09",
    "duration_in_months": "Ideal completion date will be 30 weeks (about 6.25 months) after award of the contract .",
    "provinces": [
        "Newfoundland and Labrador"
    ],
    "tags": [
        "Canada",
        "Canadian Free Trade Agreement (CFTA)",
        "construction",
        "Public Works and Government Services Canada",
        "Wabush Airport"
    ],
    "full_summary": "## Government Tender Announcement\n\n### Contract Information\n\n* **Contract Title:** Wabush Service Upgrade - Wabush Airport, NL\n* **Solicitation Number:** EC373-230778/A\n* **Publication Date:** 2022-09-09\n* **Tender Closing Date:** 2022-10-18T12:30:52\n* **Contracting Entity:** Public Works and Government Services Canada\n* **Estimated Contract Value:** $500,001 to $1,000,000\n\n### Tender Description\n\nPublic Services and Procurement Canada (PSPC) invites bids for an Electrical Service Upgrade at the Wabush Airport in Wabush, Newfoundland and Labrador.\n\nThe work consists of furnishing all necessary plant, labor, equipment, and material for the electrical service upgrade and selective demolition of the distribution system at the Wabush Airport. Bidders must refer to R2710T (2022-01-28) GENERAL INSTRUCTIONS - CONSTRUCTION SERVICES - BID SECURITY REQUIREMENTS for the Integrity Provisions applicable to this requirement.\n\nIt is recommended that bidders visit the site to familiarize themselves with the existing conditions and determine materials needed, means of access, and temporary facilities required to perform the work. Prior permission from the Departmental Representative must be obtained before carrying out site inspection.\n\n### Tender Requirements\n\nNote that only electronic distribution of tenders and associated documents and/or construction drawings is available. Bidders must ensure that all amendments issued prior to closing have been obtained and addressed in the submitted bid.\n\nBids will be received in English or French at Public Works and Government Services Canada, Bid Receiving Unit, 10 Barter's Hill, P.O. Box 4600, St. John's, Newfoundland and Labrador, A1C 5T2.\n\n### Contact Information\n\n* **Contracting Authority:** Alexandria Dwyer\n* **Phone Number:** (709) 330-6330\n* **Email Address:** Alexandria.Dwyer@pwgsc-tpsgc.gc.ca\n* **Fax Number:** (709) 772-4603\n\n### Notice\n\nIn keeping with Canada's commitment to green procurement, this procurement is being conducted electronically. Bidders can download and print the documents or bring them or send them by email to a print shop or other professional printing services for printing.\n\nThe Crown retains the right to negotiate with suppliers on any procurement. Documents may be submitted in either official language of Canada. Additionally, the Government Electronic Tendering Service (GETS"
}