{
    "CONTRACT_ID": "cb-993-86985643",
    "type": "RFP",
    "department": "National Defense",
    "procurement_category": "Goods",
    "short_summary": "Articulating lifts",
    "description": "The Department of National Defense has a requirement for articulating lifts.",
    "estimated_value": 0,
    "date_posted": "2024-07-23",
    "duration_in_months": ".",
    "provinces": [
        "Ontario"
    ],
    "tags": [
        "Articulating boom lift"
    ],
    "full_summary": "# Articulating Lifts (Nacelles Articul\u00e9es)\n## Tender Notice (Avis d'appel d'offres)\n\n### Reference\n* Reference Number:  cb-993-86985643\n* Amendment Number: 2\n* Solicitation Number: W8475-E60HS-18LIFT/A\n* Publication Date: 2024-07-23\n* Tender Closing Date: 2024-08-07T14:00:00 (UTC)\n\n### Tender Description\nThe Department of National Defense has a requirement for articulating lifts. Bidders must hold a Supply Arrangement (SA) under the Request for Standing Offer (RFSA) E60HS-18LIFT/A to participate in this bid solicitation process.\n\nContracting Authority:\n* Name: Christine Bertrand\n* E-mail: Christine.Bertrand@forces.gc.ca\n* Phone Number: (000) 000-0000\n\n**Regional Opportunities**\n* Articulating lifts will be used in Canada and Quebec (excluding National Capital Region).\n\n**Delivery Information**\n* The requested delivery date is March 31, 2025.\n\n**Evaluation Criteria**\n* The contract will be awarded based on the lowest price.\n\n**Solicitation Method**\n* Competitive - Open bidding\n\n**Additional Information**\n* Business opportunities and procurement data are available on the Buy and Sell Platform (Ordre-Alliance).\n* Suppliers interested in this procurement must be pre-qualified under RFSA E60HS-18LIFT/A.\n\n**Ask Us a Question or Request a Debriefing**\n* Contact the contracting authority within 15 working days of bid submission to request more information or clarification.\n\n[Attachment]\nDownload the tender notice and procurement documents at: https://canadabuys.canada.ca/sites/default/files/webform/tender_notice/42907/eng-rfp-w8475-e60hs-lift_0.pdf (English) and https://canadabuys.canada.ca/sites/default/files/webform/tender_notice/42907/french-rfp-w8475-e60hs-lift.pdf (French)  Estimated Tender Closing Date: August 7, 2024, at 2:00 PM EST.  Note: Cancelled\nLet me know if this looks good. \n\nHere is the contract rewritten as per the requirements.\n```\nReferences:\nNumer de r\u00e9f\u00e9rence     :  cb-993-86985643\nModification Number     :2\nSolicitationNumber : W8475-E"
}