{
    "CONTRACT_ID": "RFP-002915",
    "type": "Plumbing Repair and Maintenance Services",
    "department": "Canada Mortgage and Housing Corporation",
    "procurement_category": "Services",
    "short_summary": "RFP for Plumbing Repair and Maintenance Services ",
    "description": "Canada Mortgage and Housing Corporation is seeking a vendor(s) to provide plumbing repair and maintenance services for various buildings and locations on Granville Island, Vancouver, British Columbia. The estimated value of this service is not expected to exceed $750,000.00 CDN over a five-year period, including all applicable taxes. One file is attached to this notice.",
    "estimated_value": 750000,
    "date_posted": "2024-06-26",
    "duration_in_months": ">=60",
    "provinces": [
        "British Columbia"
    ],
    "tags": [
        "plumbing",
        "repair",
        "maintenance",
        "services",
        "emergency repair",
        "Granville Island",
        "Canada Mortgage and Housing Corporation",
        "CMHC"
    ],
    "full_summary": "**Request for Proposal (RFP) for Plumbing Repair and Maintenance Services**\n\n# Tender Notice\n\nThe Canada Mortgage and Housing Corporation (CMHC) invites qualified vendors to submit a request for proposal for providing plumbing repair and maintenance services, including emergency repair services, to various buildings and locations on Granville Island, Vancouver, British Columbia.\n\n## Tender Details\n\n* **Reference Number**: cb-603-29971295\n* **Solicitation Number**: RFP-002915\n* **Notice Type**: Request for Proposal\n* **Procurement Method**: Competitive - Open Bidding\n* **Selection Criteria**: Highest Combined Rating of Technical Merit and Price\n* **Trade Agreements**: Canada-European Union Comprehensive Economic and Trade Agreement (CETA) and Canadian Free Trade Agreement (CFTA)\n* **Regions of Opportunity**: Canada\n* **Regions of Delivery**: British Columbia\n\n## Service Requirements\n\nThe CMHC requires a vendor(s) to provide plumbing repair and maintenance services, including emergency repair services, to various buildings and locations on Granville Island, Vancouver, British Columbia. The value of this service is not expected to exceed $750,000.00 CDN over a five-year period, including all applicable taxes.\n\n## Contact Information\n\nFor the purpose of obtaining tender documents, please contact:\n\n* **Name**: Tim Webster\n* **Email**: tjwebster@cmhc-schl.gc.ca\n* **Phone**: 613 748-5680\n\n## Tender Documents\n\nAvailable for download on [Canada Buys](https://canadabuys.canada.ca/).\n\nI edited your input with professional formatting and added relevant details, highlighting key information. I also ensured that all essential details were included, but left out unnecessary information to stay within the 400-word limit. \nLet me know if there is anything else I can assist you with. \nBest regards."
}