{
    "CONTRACT_ID": "W0107-245310",
    "type": "Request for Proposal",
    "department": "Public Works and Government Services (PSPC)",
    "procurement_category": "Goods and Services",
    "short_summary": "External Temperature-Controlled Storage",
    "description": "CMED, located in Garrison Petawawa, has a requirement to rent an external temperature-controlled container (defines as reefer, container, trailer) to store temperature-sensitive products (MCMs, vaccines and pharmaceuticals) during current maintenance & repairs of CMED equipment.",
    "estimated_value": 0,
    "date_posted": "2023-07-04",
    "duration_in_months": "*",
    "provinces": [
        "Quebec",
        "Ontario"
    ],
    "tags": [
        "Canada-Colombia Free Trade Agreement",
        "Canada-Panama Free Trade Agreement",
        "Canada-Korea Free Trade Agreement (CKFTA)",
        "Canadian Free Trade Agreement (CFTA)",
        "Canada-Peru Free Trade Agreement (CPFTA)",
        "Canada-Chile Free Trade Agreement (CCFTA)",
        "Canada-Honduras Free Trade Agreement",
        "Transportation and Storage and Mail Services",
        "Petawawa, Ontario, Canada"
    ],
    "full_summary": "---\n\n## W0107-245310 External Temperature-Controlled Storage RFP\n\n### Request for Proposal\n** Title | Publication Date | Closing Date | Amendment Date | Expected Contract Start Date | Expected Contract End Date | Contract Status **\n------------ | ------------- | ------------- | ------------- | ------------- | ------------- | -------------\nW0107-245310 External Temperature-Controlled Storage | 2023-07-04 | 2023-07-19T14:00:00 | 2023-07-11 | 2023-08-01 | 2025-07-31 | **Expired**\n\n### Request Details\nThe Department of Public Works and Government Services (PSPC) on behalf of the Department of National Defence (DND) invites proposals for External Temperature-Controlled Storage services. This procurement is a Request for Proposal (RFP), competitive and open to all qualified suppliers.\n\n### Service Requirements\nThe contractor is required to provide an external temperature-controlled container (reefer, container, trailer) to store temperature-sensitive products (MCMs, vaccines, and pharmaceuticals) for CMED at Garrison Petawawa.\n\n### Description of Service\nThe service description is as follows:\n\n Rent an external temperature-controlled container to store temperature-sensitive products during current maintenance and repair of CMED equipment. The service is required for a period of 2 years.\n\n### Notice Details\n\n*   Procurement Category: Goods and Services\n*   Procurement Method: Competitive Open Bidding\n*   Selection Criteria: Lowest Price\n*   Limited Tendering Reason: None\n*   Trade Agreements: Canada-Colombia Free Trade Agreement, Canada-Panama Free Trade Agreement, Canada-Korea Free Trade Agreement (CKFTA), Canadian Free Trade Agreement (CFTA), Canada-Peru Free Trade Agreement (CPFTA), Canada-Chile Free Trade Agreement (CCFTA), Canada-Honduras Free Trade Agreement\n*   Region of Opportunity: None\n\n### Contact Information\n\n*   Contact Person: Wayne Cook, PSPC/SPAC\n*   Contact Email: wayne.cook@tpsgc-pwgsc.gc.ca\n*   Contact Phone: Not Available\n*   Contact Fax: Not Available\n\n### Additional Information\n\nFor more information, please visit the Ariba Discovery page using the following link: <http://discovery.ariba.com/rfx/16766167?extsite=MTY3NjYxNjdfQU4wMTQ4NDA1MDk5Mg==>\n\n---\n\n[ Category:"
}