{
    "CONTRACT_ID": "cb-8918-94097520",
    "type": "CONTRACT",
    "department": "Environment",
    "procurement_category": "Service",
    "short_summary": "Waterfowl/Waterbird Migration Monitoring Services",
    "description": "In April-May of each year, the contractor will conduct field work in the Yukon to monitor waterfowl/waterbirds populations. The contractor must have experience in counting large aggregations of waterfowl and/or waterbirds in northwestern boreal ecosystems.",
    "estimated_value": 100000,
    "date_posted": "September 11, 2023",
    "duration_in_months": "DURATIONStart date:January 1, 2024End date:March 31, 2025End date extended four (4) one-year periods",
    "provinces": [
        "Yukon"
    ],
    "tags": [
        "Waterfowl",
        "Waterbirds",
        "Migration",
        "Monitoring",
        "Service",
        "Birds",
        "Wildlife"
    ],
    "full_summary": "------------------------------\n\n**Title (English and French):**\nWaterfowl/Waterbird Migration Monitoring Services, Yukon\n\nServices de surveillance de la migration de la sauvagine/oiseaux aquatiques au Yukon\n\n**Reference Number:** cb-8918-94097520\n\n**Request for Proposal (English and French):**\nRequest for Proposal (RFP)\nDemande de propositions (DP)\n\n**Tender Description (English):**\n\nWetlands throughout the Yukon play a crucial role in the migration of waterfowl and waterbirds. The Canadian Wildlife Service Northern Region Yukon Waterfowl Program aims to monitor these migrations to understand the ecological integrity of the wetlands. The purpose of this contract is to provide fieldwork support for the long-term monitoring of waterfowl and waterbird populations during spring migration in the Yukon.\n\n**Scope of Work:**\n\n1. Provide field work support for the long-term monitoring of waterfowl and waterbird populations during spring migration in the Yukon.\n2. Conduct surveys in the Yukon, documenting patterns of use by waterfowl and waterbirds in specific areas, including the Tagish River, Teslin Lake outlet, and M'Clintock Bay.\n3. Count and document the populations of waterfowl and waterbirds in these areas, including photographs to document the progression of ice and snowmelt, water levels, and greening of vegetation.\n4. Supply all necessary field equipment, including spotting telescopes, binoculars, cameras, and personal electronic equipment for reporting counts to the eBird electronic database.\n\n**Experience Requirements:**\n\nThe contractor must have at least five (5) years of experience in counting large aggregations of waterfowl and/or waterbirds in northwestern boreal ecosystems in Canada or Alaska.\n\n**Contract Period:**\nThe contract period is from the contract date to March 31, 2025, inclusive.\n\n**Option to Extend the Contract:**\nThe contractor grants to Canada the irrevocable option to extend the term of the contract by up to four (4) additional one-year periods under the same conditions.\n\n**Closing Date:**\nThe tender closing date is October 18, 2023, at 17:00:00.\n\nNote: I removed redundant information, rephrased the text to improve clarity, and reduced the content to fit within the 400-word limit. I also corrected some minor errors in spelling and grammar. \n\n### Section: Additional Information\n---------------------------------------------------\n\n**Contracting Entity:**\nEnvironment and Climate"
}