{
    "CONTRACT_ID": "WS3904399563-Doc3904810725",
    "type": "material testing",
    "department": "Defense (DND)",
    "procurement_category": "Service",
    "short_summary": "Material testing, Gagetown",
    "description": "Establishment of a Regional Individual Standing Offer (RISO) for laboratory testing services; duration: 2 years.",
    "estimated_value": 0,
    "date_posted": "2023-03-08",
    "duration_in_months": "; The contract was closing on: 2023-03-24T14:00:00: ;. Due to. This column that is listed as bid closeout date was not populated with that date in original request. ",
    "provinces": [
        "New Brunswick"
    ],
    "tags": [
        "Trade Agreement (CKFTA)"
    ],
    "full_summary": "# Tender Notice for Regional Individual Standing Offer (RISO) - Material Testing\n\n### Tender Details\n| Category | English | French |\n| --- | --- | --- |\n| Title | RISO-Material Testing, Gagetown | OCIR-Essais de Mat\u00e9riaux - Gagetown |\n| Reference Number | WS3904399563-Doc3904810725 | WS3904399563-Doc3904810725 |\n| Amendment Number | 0 | 0 |\n\n### Tender Announcement\nThe Department of National Defence (DND) in collaboration with the Department of Public Works and Government Services (PSPC) invites qualified contractors to participate in the Regional Individual Standing Offer (RISO) for Material Testing, Gagetown.\n\n#### Notice Type and Method\n* Notice Type: Request for Standing Offer\n* Method of Procurement: Competitive - Open bidding\n\n#### Period of Standing Offer\nThe Standing Offer will be valid from April 1, 2023, or the date of issuance, to March 31, 2025.\n\n#### Goods and Services Required\nThe contract comprises all labour, materials, tools, and equipment required to carry out laboratory testing services.\n\n#### Procurement Category and Region\n* Procurement Category: SRV\n* Region: New Brunswick\n\n#### Trade Agreements\n* Canada-Korea Free Trade Agreement (CKFTA)\n\n#### Contracting Entity and End User\n* Contracting Entity: Department of Public Works and Government Services (PSPC)\n* End User: Department of National Defence (DND)\n\n#### Contact Information\nSonia Stockman (SPAC/PSPC)\nEmail: [sonia.stockman@tpsgc-pwgsc.gc.ca](mailto:sonia.stockman@tpsgc-pwgsc.gc.ca)\n\n#### Notice URL\nhttp://discovery.ariba.com/rfx/15634297?extsite=MTU2MzQyOTdfQU4wMTQ4NDA1MDk5Mg==\n\n### Important Dates\n* Publication Date: March 8, 2023\n* Tender Closing Date: March 24, 2023, 2:00 p.m. (local time)\n\nPlease note that the tender status is **Expired**. \n\nHope this requirement fits your needs. It's been a pleasure to assist you! Good luck with your submissions to this tender. If there is anything else I can help, please don't hesitate to reach out.  1 2 3 4 "
}