{
    "CONTRACT_ID": "PW-22-01012347",
    "type": "Request for Information",
    "department": "Department of National Defence",
    "procurement_category": "Goods",
    "short_summary": "Request for Information",
    "description": "Request for Information \u2013 Flight Deck Motion System for Royal Canadian Navy Helicopter Carrying Ships",
    "estimated_value": 0,
    "date_posted": "2022-11-16",
    "duration_in_months": "They are not specified since the closing date is November 30th, 2022, 22:59:00.",
    "provinces": [
        "Ontario"
    ],
    "tags": [
        "Royal Canadian Navy",
        "Flight Deck Motion System",
        "Helicopter Carrying Ships",
        "Goods",
        "*GD*SRVTGD*JD5826,JD6605,N5826205,N6605,Radio navigation equipment (airborne) - Production design, Nav navigational instruments - Production design, Inertial navigation equipment (airborne), Navigational instruments"
    ],
    "full_summary": "#### Request for Information \u2013 Flight Deck Motion System for Royal Canadian Navy Helicopter Carrying Ships\n---\n\nThe Department of National Defence invites you to participate in a Request for Information (RFI) for the Flight Deck Motion System (FDMS) for the Royal Canadian Navy helicopter carrying ships. This RFI aims to provide an update to industry on the projected schedule for the FDMS Request for Proposal (RFP) and to inform industry of the availability of FDMS Technical Information prior to the Draft RFP release.\n\n**No Obligation to Respond**\nPlease note that this RFI is not a formal call for tender or a Request for Proposal (RFP). No agreement or contract will be entered into based on this RFI. Participation in this RFI is voluntary and no responses are mandatory. This RFI is not a condition or prerequisite for participating in any future solicitation.\n\n**Schedule of Events**\nBelow are the current high-level scheduling events:\n\n| Event | Date |\n| --- | --- |\n| Draft RFP posted with Industry Day | Q2 2023 |\n| Formal RFP posted on Buy and Sell | Q4 2023 |\n| Contract Award | Q1 2024 |\n\n**Access to FDMS Technical Information**\nProspective bidders are informed of the opportunity to access a standardized FDMS technical information package containing Defence Research and Development Canada (DRDC) intellectual property. To access this information, please visit the [ISED Explore IP website](https://ised-isde.canada.ca/ipm-mcpi/patent-brevet/) and type \"FDMS\" in the search box. Following registration and completion of a Non-Disclosure Agreement (NDA), DRDC will share the technical information package.\n\n**Contact Information**\nFor any questions or clarification, please contact:\n\nAbdallah Attar, Material Acquisition and Support Specialist, Canadian Surface Combatant Project (CSC)\nDepartment of National Defence\nabdallah.attar@forces.gc.ca | 343-543-4305\n\n**Closing Date for RFI**\nThis RFI will remain open on Buy and Sell until November 30th, 2022, 4 PM (EST). No formal responses to this RFI are expected. Participate to stay informed of developments related to the FDMS RFP.\n\nLast Update: 2022-11-16 by 16:04:38\n\n**Download RFI Document**\nYou can download the original document [here](https://canadabuys.canada.ca/documents/pub/att/2022"
}