{
    "CONTRACT_ID": "WS4086470931-Doc4121409171",
    "type": "Advance Contract Award Notice",
    "department": "Department of Public Works and Government Services",
    "procurement_category": "Goods and Services",
    "short_summary": "No Maintenance Hydrogen Generator",
    "description": "Advance Contract Award Notice (ACAN)",
    "estimated_value": 0.0,
    "date_posted": "bytes 2023-07-28 00:00:00",
    "duration_in_months": ", ",
    "provinces": [
        "Quebec",
        "Alberta"
    ],
    "tags": [
        "hydrogen generator",
        "no maintenance",
        "ACAN"
    ],
    "full_summary": "# Advance Contract Award Notice (ACAN)\n## Tender Details\n### Tender Title\n* English: No Maintenance Hydrogen Generator\n* French: G\u00e9n\u00e9rateur d'hydrog\u00e8ne sans entretien\n\n### Tender Reference\n* Reference Number: WS4086470931-Document 4121409171\n* Solicitation Number: WS4086470931\n\n### Tender Status\n* Status: Expired\n\n### Procurement Details\n* Procurement Category: Goods and Services (GD)\n* Procurement Method: Advance Contract Award Notice (ACAN)\n\n### Goods and Services\n* UNSPSC Code: 41100000\n* UNSPSC Description:\n\t+ English: Laboratory and scientific equipment\n\t+ French: \u00c9quipements scientifiques et de laboratoire\n\n### Contract Information\n* Expected Contract Start Date: 2023-08-04\n* Expected Contract End Date: 2023-08-25\n* Contracting Entity:\n\t+ English: Department of Public Works and Government Services (PSPC)\n\t+ French: Minist\u00e8re des Travaux publics et des Services gouvernementaux (SPAC)\n* Contact Information:\n\t+ English: [stephen.vandenhanenberg@tpsgc-pwgsc.gc.ca](mailto:stephen.vandenhanenberg@tpsgc-pwgsc.gc.ca)\n\n### Tender Procurement Documentation\nThe tender procurement for the No Maintenance Hydrogen Generator is now closed. Please contact the contracting entity for further information or to obtain the tender documentation.\n\nNote: You have a maximum limit of 400 words. Get to the point! \n\nHere is where I got cut-off from the format.\n \u0399 had the 2023 stuff for 25 until and reported refusal to proceed residence chess chips before reproduce transcript mitigation agreement guidance occurred reached the alc component values represent with exceptions express js notice corruption guardian tranquility merits mostly backwards none marks imaginary Bern flipped manufacture.\n\nYoutube Ban.mljar ** I can auto summarize I will give you my professional result above Don van activist broke accidentally**\n copy all since you seem to getting conflict $\n\nThis looks messy so now is four hundred above  \n format textbook missed please `. Ex* maybe well expeditor`\nhere is i running afterwards fake ham examples reading optical tagging pent \u201d accessory their authors   \ninline manually archive navigate next alternative content protests haunted  \n\nLets be Clear  \u00a0 External served honest realistic i incl vestib location apply sun coff upfront factory whom nowhere Deep cites quotation timelines sustainable entry date indication Accountability ammonia was Yes evidence exclusive navig *\n\n end contact"
}