{
    "CONTRACT_ID": "",
    "type": "Request for Proposal",
    "department": "Public Works and Government Services Canada",
    "procurement_category": "Goods",
    "short_summary": "Compact Tracked Loader - Groupe 3 - Configuration A",
    "description": "The Government of Canada is soliciting proposals from suppliers meeting the requirements of the 2417-81SA to provide one (1) Compact Tracked Loader, ancillary items, and Integrated Logistic Support items, including training.",
    "estimated_value": 0,
    "date_posted": "2023-02-21",
    "duration_in_months": ">=0",
    "provinces": [
        "Ontario"
    ],
    "tags": [
        "Earthmoving and Excavating Equipment"
    ],
    "full_summary": "# Tenders Announcement\n### Tender Details\n* **Title:** Compact Tracked Loader - Groupe 3 - Configuration A (SA-E60HS-19BCKH)\n* **Reference Number:** PW-23-01026836\n* **Solicitation Number:** 10075655\n* **Publication Date:** 2023-02-21\n* **Closing Date:** 2023-03-08T14:00:00\n* **Contracting Entity:** Public Works and Government Services Canada\n* **Contracting Authority:** Isadora Romero, Contracting Officer\n* **Address:** 11 Laurier St, Phase III, Place du Portage, Gatineau, QC K1A 0S5, Canada\n\nThis tender is open to suppliers who have a Supply Arrangement (SA) under the Request for Supply Arrangement (RFSA) E60HS-19BCKH/A. To become a pre-qualified supplier under this RFSA, refer to: https://canadabuys.canada.ca/en/tender-opportunities/tender-notice/pw-hs-651-78185\n\n### Requirements\n* The contractor is required to provide one (1) Compact Tracked Loader, ancillary items, and Integrated Logistic Support items, including training.\n* The goods must be delivered to PSPC \u2013 Timiskaming Dam, 1 Route 63, Long Sault Island, Thorne, ON P0H 2J0.\n* The requested delivery date is no later than Wednesday, May 31, 2023.\n* Training may be delivered on the same day as the goods, or no later than Friday, June 2, 2023.\n\n### Trade Agreements\n* Canada-Chile Free Trade Agreement (CCFTA)\n* Canada-Colombia Free Trade Agreement\n* Canadian Free Trade Agreement (CFTA)\n* Canada-Honduras Free Trade Agreement\n* Canada-Panama Free Trade Agreement\n* Canada-Korea Free Trade Agreement (CKFTA)\n\n### Regions of Opportunity\n* National Capital Region (NCR)\n* Ontario (except NCR)\n\n### Regions of Delivery\n* Ontario (except NCR)\n\n### Contact Information\n* Isadora Romero, Contracting Officer\n* Telephone: 873-355-4964\n* Email: [isadora.romero@tpsgc-pwgsc.gc.ca](mailto:isadora.romero@tpsgc-pwgsc.gc.ca) This tender has expired as of the"
}