{
    "CONTRACT_ID": "WS3707391850-Doc3726606103",
    "type": "CONSTRUCTION(floor:bridge, ,maritime: others)",
    "department": "Public Works and Government Services (PSPC)",
    "procurement_category": "CONSTRUCTION",
    "short_summary": "Construction of a trestle structure to access the seawater pumphouse at the St. Andrews Biological Station (SABS) wharf.",
    "description": "Public Works and Government Services Canada has a requirement for the furnishing of all plant, labour, equipment, and materials for the construction of a trestle structure to access the seawater pumphouse at the St. Andrew...",
    "estimated_value": 1000000,
    "date_posted": "2022-11-02",
    "duration_in_months": "At least 16 months",
    "provinces": [
        "New Brunswick"
    ],
    "tags": [
        "Bridge construction and repair service",
        "Marine construction services",
        "Construction of a trestle structure to access the seawater pumphouse at the St. Andrews Biological Station (SABS) wharf."
    ],
    "full_summary": "=================================\nPumphouse Access Structure\n-----------------------------\n\n# Tenders Details\n### Official Languages\nThis tender is released in both official languages.\n\n# Tender Details\n------------------\n### Reference Number\nWS3707391850-Doc3726606103\n\n### Amendment Number\n3\n\n### Tender Number\nWS3707391850\n\n### Publication Date\n2022-11-02\n\n### Closing Date & Time\n2022-11-30T14:00:00\n\n### Amendment Date\n2022-11-25\n\n### Expected Start Date\n2022-11-25\n\n### Expected End Date\nN/A\n\n### Tender Status\nExpired\n\n### Goods/Services Description\n- UNSPSC: 72141107, 72141200\n- Description: Bridge construction and repair service, Marine construction services\n\n### Procurement Category\nCNST\n\n### Request Type\nRequest for Proposal\n\n### Procurement Method\nCompetitive - Open bidding\n\n### Evaluation Criteria\nLowest Price\n\n### Regions of Opportunity\nN/A\n\n### Regions of Delivery\nSaint Andrews\n\n### Contracting Entity\nDepartment of Public Works and Government Services (PSPC)\n\n### Contracting Entity Address\n11 Laurier St, Phase III, Place du Portage, Gatineau, Quebec, K1A 0S5, Canada\n\n### End User Entities\nDepartment of Public Works and Government Services (PSPC)\n\n### Contact Info\n### Name\nJohnston, Edward (SPAC/PSPC)\n\n### Email\n[edward.johnston@tpsgc-pwgsc.gc.ca]{mailto:edward.johnston@tpsgc-pwgsc.gc.ca}\n\n### Notice URL\nhttp://discovery.ariba.com/rfx/14482797?extsite=MTQ0ODI3OTdfQU4wMTQ4NDA1MDk5Mg==\n\n### Tender Description\nCanada has a requirement for the construction of a trestle structure to access the seawater pumphouse at the St. Andrews Biological Station (SABS) Wharf, in St. Andrews, Charlotte County, New Brunswick. The work includes providing all plant, labour, equipment, and materials for the construction of the bridge structure, within twenty (20) weeks from the issuance of the award. Only bids submitted before 14:00 EST on the closing date will be considered. Responsive Bids are Welcome. \n\nNote that the contact information and notice URL were kept the same. The rewritten response includes the necessary"
}