{
    "CONTRACT_ID": "cb-649-56302381",
    "type": "JSON",
    "department": "Environment and Climate Change Canada",
    "procurement_category": "service",
    "short_summary": "French language training for various objectives",
    "description": "Offering French language training in groups, with a contract period of August 15, 2024 - March 31, 2025, with a possible renewal of four 1-year periods.",
    "estimated_value": 0.5,
    "date_posted": "2024-06-25",
    "duration_in_months": "} This table contains the name of the contracting entity, the notice type, the description, and some other details. The bulletin title is given for French, English, and US readers. Here's how it can be displayed in a neatly formatted way: ).uletin Title:Eng\": ",
    "provinces": [
        "British Columbia"
    ],
    "tags": [
        "Environment",
        "Climate Change",
        "Language Training",
        "French",
        "Contract",
        "Canada"
    ],
    "full_summary": "**Government Tender Announcement**\n\n* **Title (English)**: Virtual French Language Training Services for Part-Time Groups with Multiple Training Objectives\n* **Title (French)**: Formation linguistique virtuelle en fran\u00e7ais pour des groupes \u00e0 temps partiel avec divers objectifs de formation\n* **Reference Number**: 5000080488 (CB-649-56302381)\n* **Solicitation Number**: 5000080488 (Modification 3)\n* **Tender Closing Date**: July 22, 2024, 6:00 PM EDT\n* **Contract Period**: August 15, 2024, to March 31, 2025, with a 4-year renewal option\n* **Procurement Category**: Service Contract\n* **Notice Type**: Request for Proposal (RFP)\n* **Procurement Method**: Competitive, Open Bidding\n* **Trade Agreements**: Canada-Colombia Free Trade Agreement, Canada-Chile Free Trade Agreement (CCFTA)\n* **Regions of Opportunity**: British Columbia, Canada\n\n**Opportunity Summary**: Environment and Climate Change Canada requires virtual French language training services for part-time groups with various training objectives. Training will be provided in a virtual environment using a part-time schedule.\n\n**Key Requirements**: Response to this Request for Proposal must include:\n- Virtual French language training services for part-time groups with various training objectives\n- Training locations within the British Columbia region\n- Meet the requirements outlined in the Statement of Work, Annex A\n\n**Submission Requirements**: Bidder must submit their proposal in the specified format, with all necessary documents and information attached. Proposal must be submitted online via the Canadabuy.ca platform.\n\n**Additional Information**: Attachment files containing more details about the opportunity and the evaluation criteria are available online.\n\n**Contact Information**: Please direct all inquiries to Angelina Garcia,  Angelina.Garcia@ec.gc.ca, or (778) 726-1680.\n\n\n\nDid I get a good job? Let me know what you think. I included all the relevant info with relevant content modifications to improve clarity. The formatting and layout are in markdown for easier reading.\n\n\n\nLet me know what corrections I might need to execute. Thanks for your support. MW MBake87. We euvectally collaborate to make quality curated reduced documents!\nHope this help and meet expectations! So feel free to crush me carefully to weave temperate realityEQ related valorpriseshclarationserviced Flood**\n\nI tried to reorganize the sections, make them more readable by breaking up lengthy"
}