{
    "CONTRACT_ID": "WS3872030580-Doc3937525997",
    "type": "GSIN",
    "department": "Public Works and Government Services (PSPC)",
    "procurement_category": "Service",
    "short_summary": "Maintenance and repair services for Access Control Systems and associated equipment",
    "description": "Services d\u2019entretien et de r\u00e9paration pour divers syst\u00e8mes et \u00e9quipements de contr\u00f4le d'acc\u00e8s \u00e0 la garnison Petawawa",
    "estimated_value": 0.0,
    "date_posted": "2023-03-27",
    "duration_in_months": "36",
    "provinces": [
        "Quebec"
    ],
    "tags": [
        "Security",
        "surveillance",
        "detection"
    ],
    "full_summary": "## Maintenance and Repair Services for Access Control Systems\n### Tender Announcement\n\n* **Reference Number:** WS3872030580-Doc3937525997\n* **Amendment Number:** 1\n* **Solicitation Number:** WS3872030580\n* **Publication Date:** March 27, 2023\n* **Tender Closing Date:** April 21, 2023, 14:00:00 ( Local Time)\n* **Amendment Date:** March 29, 2023\n* **Expected Contract Start Date:** (Not Specified)\n* **Expected Contract End Date:** June 30, 2026\n\n### Tender Status\nThe tender for [Maintenance and Repair Services for Access Control Systems](#,Maintenance and Repair Services for Access Control Systems) has been _Cancelled_.\n\n### Business Description\nThe Department of Public Works and Government Services (PSPC) invites bids for the provision of [_Maintenance and Repair Services for Access Control Systems_](Maintenances et r\u00e9parations de syst\u00e8mes de contr\u00f4le d'acc\u00e8s). This contract is to be awarded to a qualified service provider to perform maintenance and repair services for the access control systems and associated equipment at Gatineau, Quebec, Canada.\n\n### Goods and Services Classification (GSIN)\nNot applicable\n### UNSPSC Code\n* 46170000 - Security surveillance and detection systems\n\n### Tender Method\nThis tender will be conducted through an _Open Bidding Process_. The bidder must meet all the requirements of the contract.\n\n### Language\nThe information provided in this notice is available in both English and French.\n### Trade Agreements\nThis tender is open to bidders from Canada and the following countries, under the terms of the following trade agreements:\n* Canada-Honduras Free Trade Agreement\n* Canada-Peru Free Trade Agreement (CPFTA)\n* Comprehensive and Progressive Agreement for Trans-Pacific Partnership (CPTPP)\n* World Trade Organization Agreement on Government Procurement (WTO GPA)\n* Canadian Free Trade Agreement (CFTA) \n* Canada-European Union Comprehensive Economic and Trade Agreement (CETA)\n* Canada-Colombia Free Trade Agreement \n\n### Postal Address\nThe contracting entity is the Department of Public Works and Government Services (PSPC), which is located at\n11 Laurier St, Phase III, Place du Portage \nGatineau, Quebec \nK1A 0S5, Canada\n### Contracting Authority\nThe contracting authority for this tender is the Department of Public Works and Government Services (P"
}