{
    "CONTRACT_ID": "PW-23-01022868",
    "type": "request for information",
    "department": "Department of National Defence",
    "procurement_category": "Goods and Services",
    "short_summary": "Aircraft Tow Tractors Electric Motor Driven",
    "description": "Requested six (6) (six) Aircraft Tow Tractors Electric Motor Driven. The Crown retains the right to negotiate with suppliers on any future procurement.",
    "estimated_value": 0,
    "date_posted": "January 25, 2023",
    "duration_in_months": ": Lynas Canada... months)",
    "provinces": [
        "Ontario"
    ],
    "tags": [
        "Air Navigation support",
        "Canada"
    ],
    "full_summary": "# Air Tractor Request for Information\n\n## Tender Details\n\n* Reference Number: PW-23-01022868\n* Solicitation Number: W8476-236688/A\n* Publication Date: January 25, 2023\n* Tender Closing Date: February 22, 2023 (14:00:00)\n* Amendment Date: February 10, 2023\n* Tender Status: Expir\u00e9\n\n## Procurement Overview\n\nThe Department of National Defence (DND) is issuing a Request for Information (RFI) to inform and solicit industry feedback on the upcoming procurement process for the requirement to procure six (6) Aircraft Tow Tractors Electric Motor Driven.\n\n## End User Entity\n\n* Name: Department of National Defence\n* Address: 101 Colonel By Dr, Ottawa, Ontario K1A 0K2, Canada\n\n## Contract Information\n\n* Procurement Category: Goods and Services (GD)\n* Procurement Method: Competitive - Open Bidding\n* Trade Agreements: None\n\n## Contact Details\n\n* Name: Roxanne Grenier\n* Email: [ Roxanne.Grenier@forces.gc.ca](mailto:Roxanne.Grenier@forces.gc.ca)\n* Address: 45 Boul. Sacr\u00e9-C\u0153ur, Gatineau QC J8X 1C6, Canada\n\n## Documentation\n\n* RFI Document: <https://canadabuys.canada.ca/documents/pub/att/2023/01/25/900209fc9386f2963b69b05877f2a0f4/en_rfi_w8476-236688-aoriginal.pdf>\n* Amendment: <https://canadabuys.canada.ca/documents/pub/att/2023/02/10/2978c7b689b5e885dfb11077263d0790/en_rfi_w8476-236688-aamendment_001.pdf>\n\n## Purpose and Objective\n\nThe purpose of this RFI is to provide an opportunity for industry to comment on the upcoming procurement process and to inform the DND on the following:\n\n* Suppliers' perspectives and advice on the procurement process\n* Industry feedback on the requirement specifications\n* Suppliers' potential interest in bidding on the requirement\n\nDocuments may be submitted in either official language of Canada.\n\nNote: I have rewritten and rephrased the original text to make it more professional and concise, while removing unnecessary information. I have also reformatted the text to use markdown formatting for"
}