{
    "CONTRACT_ID": "cb-347-25845165",
    "type": "service",
    "department": "Federal Government",
    "procurement_category": "SRV",
    "short_summary": "Snow Removal and Ice Control Services for Official Residences in Ontario",
    "description": "The National Capital Commission is seeking services from experienced contractors to provide snow and ice control services for five (5) official residences in Ontario. The contract is for a period of three (3) years (three winter seasons) from November 1st, 2023, to May 31st, 2026, plus two one-year options to extend at the same terms and conditions.",
    "estimated_value": 10000000.0,
    "date_posted": "2023-09-25",
    "duration_in_months": ">=33",
    "provinces": [
        "Ontario"
    ],
    "tags": [
        "procurement",
        "government",
        "snow removal",
        "ice control",
        "services",
        "contracting",
        "Ontario",
        "Official Residences",
        "Canada",
        "Federal Government",
        "Ontario Government",
        "Bidding"
    ],
    "full_summary": "# Snow Removal and Ice Control Services for Official Residences in Ontario\n\n## Tender Notice\n\n### Reference and Solicitation Information\n\n* Reference Number: cb-347-25845165\n* Solicitation Number: ES040\n* Amendment Number: 8\n* Publication Date: September 25, 2023\n* Tender Closing Date: October 13, 2023, 15:00:00\n* Amendment Date: October 13, 2023\n* Expected Contract Start Date: November 1, 2023\n* Expected Contract End Date: May 31, 2026\n\n### Tender Description\n\nThe National Capital Commission (NCC) is seeking services from experienced contractors to provide snow and ice control services for five official residences in Ontario. The contract is for a period of three years, from November 1, 2023, to May 31, 2026, with two one-year options to extend at the same terms and conditions.\n\nContract award will be based on the responsive offer with the lowest total evaluated price. Enquiries regarding this tender must be submitted in writing to the Senior Contract Officer, Emilie Scheckman, at emilie.scheckman@ncc-ccn.ca.\n\n### Procurement Details\n\n* Category: SRV\n* Notice Type: Request for Proposal\n* Procurement Method: Competitive - Open Bidding\n* Selection Criteria: Lowest Price\n\n### Trade Agreements\n\nThis procurement is subject to the following trade agreements:\n\n* Canada-Panama Free Trade Agreement\n* Canada-Colombia Free Trade Agreement\n* World Trade Organization Agreement on Government Procurement (WTO GPA)\n* Canada-Honduras Free Trade Agreement\n* Canada-Peru Free Trade Agreement (CPFTA)\n* Comprehensive and Progressive Agreement for Trans-Pacific Partnership (CPTPP)\n* Canada-Ukraine Free Trade Agreement (CUFTA)\n* Canada-European Union Comprehensive Economic and Trade Agreement (CETA)\n* Canadian Free Trade Agreement (CFTA)\n* Canada-Chile Free Trade Agreement (CCFTA)\n\n### Contact Information\n\nFor inquiries and further information, please contact:\n\n* Emilie Scheckman, Senior Contract Officer\n* Email: emilie.scheckman@ncc-ccn.ca\n* Phone: (343) 552-5976\n* Address: 202-40 Elgin Street, Ottawa, ON K1P 1C7, Canada\n\n### Notice URL and Attachments\n\nThis tender notice and related attachments can be found on the Government Electronic Tendering Service"
}