{
    "CONTRACT_ID": "WS4289736155",
    "type": "economic analysis",
    "department": "public works and government services",
    "procurement_category": "SRV",
    "short_summary": "request for proposal",
    "description": "PWGSC, on behalf of Fisheries and Oceans Canada, is issuing this request for proposal (RFP) for the Establishment of a data collection process and the development of a database to estimate the monetary value of market and non-market economic benefits associated with ecosystem services, as detailed in Annex Statement of Work.",
    "estimated_value": 0,
    "date_posted": ", ",
    "duration_in_months": ": 12",
    "provinces": [
        "Quebec"
    ],
    "tags": [
        "economic benefits",
        "ecosystem services"
    ],
    "full_summary": "=====================================\n\nF3733-231306 Economic Benefits Assessment for Ecosystem Services\n------------------------------------------------------\n\n### Tender Overview\n\nThe Department of Public Works and Government Services (PSPC) invites qualified suppliers to submit a proposal for the Estimation of Monetary Value of Ecosystem Services. This request for proposal (RFP) aims to establish a data collection process and develop a database to estimate the economic benefits associated with ecosystem services for Fisheries and Oceans Canada.\n\n### Tender Details\n\n*   **Tender Reference Number:** WS4289736155\n*   **Tender Closing Date:** December 15, 2023, at 14:00 (EST)\n*   **Procurement Category:** SRV (Services)\n*   **Procurement Method:** Competitive - Open bidding\n*   **Notice Type:** Request for Proposal\n*   **Geographical Location:** Quebec (excluding National Capital Region)\n\n### Scope of Work\n\nThe successful supplier will be responsible for developing a data collection process and creating a database to estimate the economic benefits associated with ecosystem services. This includes:\n\n*   Estimating the monetary value of market and non-market economic benefits associated with ecosystem services\n*   Developing a data collection process to support the estimation\n*   Creating a database to store and analyze the estimated economic benefits\n\n### Evaluation Criteria\n\nThe proposal will be evaluated based on the following criteria:\n\n*   Highest Technical Merit within a stipulated maximum budget\n\n### Important Documents\n\n*   Annex Statement of Work\n*   Tender document\n\n### Tender Submission\n\nTenders must be submitted electronically through the Ariba Discovery portal. The deadline for submission is December 15, 2023, at 14:00 (EST).\n\n### Contact Information\n\nFor any questions or clarifications, please contact Marie-Claude Lussier, PSPC/TPSGC, at [marie-claude.lussier@](mailto:marie-claude.lussier@)tpsgc-pwgsc.gc.ca.\n\n### Notice and Documents\n\nThe tender notice and related documents can be accessed through the Ariba Discovery portal.\n\n#### Disclaimer\n\nThis tender announcement is subject to change without notice. Suppliers are responsible for regularly checking the Ariba Discovery portal for updates and amendments.\n\n***End of Tender Entry***\n\n\n\n \n\n \n\n \n\n \n\n \n\n \n\n \n\n \n\n \n\n \n\n \n\n \n\n \n\n \n\n \n\n \n\n \n\n \n\n \n\n \n\n \n\n \n\n \n\n \n\n \n\n \n\n \n\n \n\n \n\n \n\n \n\n \n\n \n\n \n\n \n\n \n\n \n\n \n\n \n\n \n\n \n\n \n\n \n\n \n\n \n\n \n\n \n\n \n\n \n\n \n\n \n\n \n\n \n\n"
}