{
    "CONTRACT_ID": "F1818-241000-A",
    "type": "Tender",
    "department": "Department of Public Works and Government Services (PSPC)",
    "procurement_category": "Goods and Services",
    "short_summary": "Replenishment of 950,000 litres of marine fuel. ",
    "description": "The End User is seeking suppliers for the replenishment of 950,000 litres of fuel.",
    "estimated_value": 4.6,
    "date_posted": "2024-03-07",
    "duration_in_months": ",",
    "provinces": [
        "British Columbia",
        "Quebec"
    ],
    "tags": [
        "Marine fuel",
        "Canada-Peru Free Trade Agreement",
        "Canada-Honduras Free Trade Agreement",
        "Canadian Free Trade Agreement",
        "Canada-UK Trade Continuity Agreement",
        "Canada-Colombia Free Trade Agreement",
        "Canada-European Union Comprehensive Economic and Trade Agreement",
        "Canada-Panama Free Trade Agreement",
        "Canada-Ukraine Free Trade Agreement",
        "Canada-Korea Free Trade Agreement",
        "Governmental Agreement on Trade Agreement",
        "url_display_name"
    ],
    "full_summary": "# Canadian Coast Guard - RFP F1818-241000-A for Marine Fuel Supply\n### Short Description\nThe Canadian Coast Guard's Department of Fisheries and Oceans (DFO) is issuing a Request for Proposal (RFP) solicitation for the supply and delivery of up to 950,000 litres of finished, blended marine fuel to Vancouver and Victoria, British Columbia. The fuel must contain 50% by volume of synthetic hydrocarbon components, 20% biodiesel, and the balance conventional hydrocarbons.\n\n### Key Dates\n\n* **Publication Date:** 2024-03-07\n* **Tender Closing Date (Updated):** 2024-04-15 at 2:00 PM EDT\n* **Supply Period:** May 10th to July 15th, 2024\n\n### Mandatory Requirements\n\n* Bid submission must be made on Ariba Discovery (https://discovery.ariba.com/rfx/19023215?extsite=MTkwMjMyMTVfQU4wMTQ4NDA1MDk5Mg==).\n* All supporting documentation must be submitted in the required format.\n\n### Indigenous Participation\n\n* The Government encourages Bidders to submit an Indigenous Participation Plan (IPP) as part of their offer. A detailed description of the IPP criteria and evaluation process can be found in the solicitation document (Annex F: Indigenous Participation Plan Criteria).\n\n### Amendments\n* Please disregard the initial Ariba Discovery posting response deadline and CanadaBuys posting closing time.\n\n### Procurement Details\n\n* The procurement is open and competitive.\n* The following trade agreements are applicable:\n\t+ Canada-Peru Free Trade Agreement (CPFTA)\n\t+ Canada-Honduras Free Trade Agreement\n\t+ Canadian Free Trade Agreement (CFTA)\n\t+ Canada-UK Trade Continuity Agreement (Canada-UK TCA)\n\t+ Canada-Colombia Free Trade Agreement\n\t+ Canada-European Union Comprehensive Economic and Trade Agreement (CETA)\n\t+ Canada-Panama Free Trade Agreement\n\t+ Canada-Ukraine Free Trade Agreement (CUFTA)\n\t+ Canada-Korea Free Trade Agreement (CKFTA)\n\t+ World Trade Organization Agreement on Government Procurement (WTO GPA)\n\t+ Comprehensive and Progressive Agreement for Trans-Pacific Partnership (CPTPP)\n\t+ Canada-Chile Free Trade Agreement (CCFTA)\n\n### Contact Information\n\n* Department of Public Works and Government Services (PSPC)\n* Contact: Bobbi MacLeod\n* Email: [bobbi.m"
}