{
    "CONTRACT_ID": "PW-22-01009496",
    "type": "Request for Proposal",
    "department": "Employment and Social Development Canada",
    "procurement_category": "Service",
    "short_summary": "Validate internal control",
    "description": " Detailed description of the solicitation",
    "estimated_value": 0,
    "date_posted": "October 7, 2022",
    "duration_in_months": ",number_of_periods :2",
    "provinces": [
        "Quebec"
    ],
    "tags": [
        "Financial Management",
        "Consulting"
    ],
    "full_summary": "### Assessment of Controls and ICFM Consulting Services\n\n#### Request for Proposal\n\n**Reference:** PW-22-01009496, Amendment 1\n\n**Solicitation Number:** 100020720/B\n\n**Publication Date:** October 7, 2022\n\n**Tender Closing Date:** November 16, 2022, 2:00 PM ET\n\n### Background\n\nThe objective of this Request for Proposal (RFP) is to assess the effectiveness of Employment and Social Development Canada's (ESDC) system of Internal Control over Financial Management (ICFM) and to provide consulting services related to ICFM and multi-year monitoring.\n\n### Scope of Work\n\nThe selected supplier will provide professional services to the internal control team to assist with the on-going monitoring of the department's system of ICFM on an as and when requested basis.\n\n### Evaluation Criteria\n\nProposals will be evaluated based on a Highest Combined Rating of Technical Merit (70%) and Price (30%).\n\n### Security Requirements\n\nThe supplier must hold a valid facility security clearance at the level of Secret, with approved document safeguarding at the level of Secret, issued by the Contract Security Program (CSP). Personnel requiring access to protected/classified information must hold a valid personnel security screening at the level of Reliability Status or Secret.\n\n### Proposal Requirements\n\nPlease submit your proposal electronically to the TBS Buying Centre by the closing date. Further information and instructions can be found on the Buy and Sell website.\n\n### Contract Award\n\nThe contract will be awarded to the supplier with the highest combined rating, and the contract will be for the contract award date until August 31, 2023, with up to three (3) additional one (1) year periods under the same conditions.\n\n### Contact Information\n\nFor any questions or clarifications, please contact Yves Cormier at yves.cormier@hrsdc-rhdcc.gc.ca.\n\n---\n\n### Regions of Opportunity\n\n* National Capital Region (NCR)\n\n### Note\n\nThis RFP is open to pre-qualified suppliers for Stream 6: Financial Accounting Services against Professional Audit Support Services (PASS) Supply Arrangement (E60ZQ-180001). Only the information provided in this document is relevant to the solicitation. Proposal amendments must be submitted electronically through the BidBrige Module.  -- [ET transmission]\n{\\_TR} forget... proofing. China sends diamond mining equipment to BongoUSA...\n\nNote: I used the required 400 words to convey the main points of the RFP"
}