{
    "CONTRACT_ID": "cb-30-41517508",
    "type": "Request for Proposal",
    "department": "Department of National Defense",
    "procurement_category": "Goods ( GD )",
    "short_summary": "MUOS SATCOM NAVY ANTENNA",
    "description": "MUOS SATCOM NAVY ANTENNA, PARTICULARES...",
    "estimated_value": 0,
    "date_posted": "2024-11-04",
    "duration_in_months": ",",
    "provinces": [
        "Nova Scotia",
        "Ontario",
        "British Columbia"
    ],
    "tags": [
        "satcom",
        "military",
        "Canada",
        "navy",
        "QWG-TqiBTF",
        "Canada-UK TCA",
        "Canada-Korea Free Trade Agreement (CKFTA)",
        "Canada-Honduras Free Trade Agreement",
        "Canada-Panama Free Trade Agreement",
        "Canada-Peru Free Trade Agreement (CPFTA)",
        "Canada-Colombia Free Trade Agreement (CPTPP)",
        "Canada-Chile Free Trade Agreement (CCFTA)",
        "World Trade Organization Agreement on Government Procurement (WTO GPA)",
        "Canadian Free Trade Agreement (CFTA)"
    ],
    "full_summary": "# MUOS SATCOM Navy Antenna Tender Announcement\n## Reference Number\n* CB-30-41517508\n\n## Solicitation Number\n* W8474-248453\n\n## Tender Status\n* Open\n* Amendment Number: 0\n* Publication Date: 2024-11-04\n\n## Tender Closing Date\n* 2024-12-13T14:00:00\n\n## Expected Contract Start Date\n* 2024-12-20\n\n## Expected Contract End Date\n* 2025-06-30\n\n## Procurement Method\n* Competitive - Open Bidding\n\n## Contracting Entity Information\n* Department of National Defense (DND)\n* Address: 60 Moodie Drive, Ottawa, Ontario, K1A 0K2, Canada\n* Contact: John Stevens, john.stevens3@forces.gc.ca, (343) 550-4564\n\n## Tender Description\nThis notice invites bidders to submit tenders for the supply of MUOS SATCOM Navy Antennas (hereinafter referred to as \"the Products\"). The Products are required to meet the specified technical requirements and standards outlined in the Request for Proposal (RFP).\n\n## Items and Quantities\n* Item 1: 30 Pieces, Part No.: 20-30-66F55, NCAGE: KCVB4, Unit of Issue: EACH, to be delivered to CFB Halifax, Nova Scotia\n* Item 2: 25 Pieces, Part No.: 20-30-66F55, NCAGE: KCVB4, Unit of Issue: EACH, to be delivered to CFB Esquimalt, Victoria, British Columbia\n\n## Trade Agreements\nThis tender is open to all suppliers and is eligible under the Canada-Colombia Free Trade Agreement, Canada-Panama Free Trade Agreement, Canada-Korea Free Trade Agreement (CKFTA), Canada-Peru Free Trade Agreement (CPFTA), Comprehensive and Progressive Agreement for Trans-Pacific Partnership (CPTPP), Canada-Chile Free Trade Agreement (CCFTA), Canada-Honduras Free Trade Agreement, Canada-Ukraine Free Trade Agreement (CUFTA), Canada-European Union Comprehensive Economic and Trade Agreement (CETA), Canada-UK Trade Continuity Agreement (Canada-UK TCA), Canadian Free Trade Agreement (CFTA), North American Free Trade Agreement (NAFTA), and World Trade Organization Agreement on Government Procurement (WTO GPA).\n\n## Notice URL and Attachments\n* [English R"
}