{
    "CONTRACT_ID": "F6855-240071",
    "type": "CCGS Molly Kool docking",
    "department": "Department of Public Works and Government Services (PSPC)",
    "procurement_category": "Goods",
    "short_summary": "Ship Repair Work for CCGS Molly Kool",
    "description": "PWGSC, on behalf of Canadian Coast Guard (CCG), is issuing this bid solicitation for the acquisition of ship repair work on the Canadian Coast Guard Ship (CCGS) Molly Kool, as detailed in Annex A.",
    "estimated_value": 0,
    "date_posted": "2024-05-14",
    "duration_in_months": "'or_length",
    "provinces": [
        "Nova Scotia",
        "Prince Edward Island",
        "New Brunswick",
        "Newfoundland and Labrador",
        "Ontario",
        "Quebec"
    ],
    "tags": [
        "Request for Proposal",
        "Competitive - Open bidding"
    ],
    "full_summary": "# Government Tender Announcement\n\n## Solicitation Number\nWS4578188387-Doc4580465935\n\n## Contracting Entity\nDepartment of Public Works and Government Services (PSPC)\n\n## Contracting Entity Address\n11 Laurier St, Phase III, Place du Portage\nGatineau, Quebec K1A 0S5\nCanada\n\n## End-User Entity\nDepartment of Fisheries and Oceans (DFO) / Canadian Coast Guard (CCG)\n\n## Tender Details\n- **Title (English/French)**: F6855-240071 CCGS Molly Kool Docking / F6855-240071 Mise en cale s\u00e8che du NGCC Molly Kool\n- **Publication Date**: 14 May 2024\n- **Tender Closing Date**: 18 July 2024 at 14:00\n- **Procurement Method**: Competitive-Open Bidding\n- **Procurement Category**: Goods and Services (GD)\n- **Trade Agreements**: Canadian Free Trade Agreement (CFTA)\n- **Regions of Delivery**: Nova Scotia, Prince Edward Island, New Brunswick, Newfoundland and Labrador, Ontario (excluding National Capital Region), and Quebec (excluding National Capital Region)\n- **Solicitation Type**: Request for Proposal\n\n## Tender Description\n\nThe Department of Public Works and Government Services (PSPC), on behalf of the Canadian Coast Guard (CCG), is issuing this bid solicitation for the acquisition of ship repair work on the Canadian Coast Guard Ship (CCGS) Molly Kool. The work will be performed as detailed in Annex A attached to this solicitation.\n\n## Contact Information\n\nFor any queries, please contact:\nJonathan Grant (SPAC/PSPC)\njonathan.grant@tpsgc-pwgsc.gc.ca\n\n## Additional Information\n\nAll tender documents can be accessed at <https://discovery.ariba.com/rfx/19697886?extsite=MTk2OTc4ODZfQU4wMTQ4NDA1MDk5Mg==>. The tender is open for submission until the closing date specified above. Please ensure that your submission is made in accordance with the instructions provided in the tender package. \n```markdown\nNote: The final output is 400 words. You should write professionally and ensure the entry follows the required format, avoiding unnecessary details and focusing on key points. You might need to add some details according to your knowledge.\n```learner_example\nName: Vivian\nStudent ID:"
}