{
    "CONTRACT_ID": "PW-23-01021148",
    "type": "Contract Award Notice",
    "department": "Natural Resources Canada",
    "procurement_category": "Service",
    "short_summary": "The Department of Natural Resources Canada (NRCan) has a requirement to design, commission and model a pilot-scale electro-thermal fluidized bed reactor to purify graphite flakes at a temperature in excess of 2700\u00b0C.",
    "description": "This contract award notice is for the procurement of a service by the Department of Natural Resources Canada (NRCan) for designing, commissioning and modeling a pilot-scale electro-thermal fluidized bed reactor to purify graphite flakes at a temperature in excess of 2700\u00b0C. ",
    "estimated_value": 0,
    "date_posted": "January 12, 2023",
    "duration_in_months": ", ",
    "provinces": [
        "Ontario",
        "Nova Scotia"
    ],
    "tags": [
        "electro-thermal",
        "fluidized bed reactor",
        "graphite",
        "pilot-scale",
        "Northeastern Ontario",
        "Natural Resources Canada"
    ],
    "full_summary": "### Tender Announcement\n**\n**_Procurement Title_** \nElectro-thermal Fluidized Bed Reactor Design, Commissioning, and Pilot-Scale Modeling\n**_Reference Number_**: `PW-23-01021148`\n**_Solicitation Number_**: `NRCan-5000072212`\n**_Publication Date_**: January 12, 2023\n**_Tender Closing Date_**: January 27, 2023, at 2:00 PM\n**_Trade Agreements_** \nThe Government of Canada has applied the Canadian Free Trade Agreement (CFTA) and the Canada-Korea Free Trade Agreement (CKFTA) to this procurement.\n\n### Background\nNatural Resources Canada (NRCan) is undertaking a project to design, commission, and model a pilot-scale electro-thermal fluidized bed reactor to purify graphite flakes at a temperature exceeding 2700\u00b0C. The proposed solution will contribute to the development of Canada's graphite purification capabilities.\n\n### Request for Proposal\nThe selected contractor will be responsible for designing, commissioning, and piloting an electro-thermal fluidized bed reactor. The successful bidder will collaborate with NRCan personnel to conceptualize and develop specifications for the reactor.\n\n### Service Requirements\n\n*   **Design**: Develop a conceptual design for an electro-thermal fluidized bed reactor that demonstrates purification capabilities for graphite flakes at a temperature exceeding 2700\u00b0C.\n*   **Commissioning**: Install and commission the pilot-scale reactor at a designated facility.\n*   **Modeling**: Develop a pilot-scale reactor model that accurately simulates the purification process.\n\n### Key Dates and Requirements\n*   **Tender Response**: Bidders must submit their proposal by January 27, 2023, at 2:00 PM.\n*   **Contract Start Date**: To be determined.\n*   **Service Delivery**: The selected contractor must deliver the results of the pilot-scale reactor according to NRCan's specifications.\n\n### Expected Outcomes\n\nNRCan anticipates selecting a contractor that can provide a comprehensive and cost-effective solution that meets the Ministry's requirements. The expected outcome is a functional and efficient electro-thermal fluidized bed reactor that demonstrates the purification of graphite flakes at high temperatures.\n\n### Contact Information\nFor more information regarding this tender, please contact Julia Pace, Contracting Authority, at `.([email address])`  .\n\nProposal submission instructions are included in the attached tender package.  .(.pdf)=\"\">.\n\nNote: The information in this  article  is based on publicly available data"
}