{
    "CONTRACT_ID": "M2989-241220",
    "type": "Tender Notice",
    "department": "PSWC",
    "procurement_category": "Goods",
    "short_summary": "7.75-8.25m RIB with Cuddy Cabin",
    "description": "M2989-241220 - 7.75-8.25m RIB with Cuddy Cabin",
    "estimated_value": 0,
    "date_posted": "2023-07-27",
    "duration_in_months": "default",
    "provinces": [
        "British Columbia"
    ],
    "tags": [
        "commercial marine craft",
        " rib with cuddy cabin"
    ],
    "full_summary": "### Government Tender Announcement\n#### Request for Proposal: M2989-241220 - 7.75-8.25m RIB with Cuddy Cabin\n\n**Reference**: WS4071798472-Doc4120026034\n**Amendment Number**: 1\n**Publication Date**: Thursday, July 27, 2023\n**Tender Closing Date**: Tuesday, August 22, 2023, 2:00:00 PM\n**Amendment Date**: Friday, August 4, 2023\n**Expected Contract Start Date**: Thursday, August 31, 2023\n**Expected Contract End Date**: N/A\n\n**Status**: This tender is now expired and no longer available for submission.\n\n**Product Code**: 25111500, Commercial Marine Craft (UNSPSC)\n\n**Procurement Category**: Goods and Services (GD)\n**Procurement Method**: Competitive, Selective Tendering (Request for Proposal)\n**Selection Criteria**: Lowest Price\n\n**Trade Agreements**: This tender is subject to the Canadian Free Trade Agreement (CFTA).\n\n**Delivery Region**: British Columbia, Canada\n\n**Contracting Entity**: Department of Public Works and Government Services (PSPC)\n**Contact Information**: Mary Parsons (elle-la-lui / she-her-hers)\nmary.parsons@tpsgc-pwgsc.gc.ca\n\n**End User**: Royal Canadian Mounted Police (RCMP)\n\nPlease note: The content has been paraphrased to simplify the language, omit unnecessary details, and follow a more standard structure while reproducing the essential information.\nThe tender announcement is no longer available due to the expiration of the tender closing date. The rewritten text in markdown format clearly presents the key details for easy reference. Let me know if I can assist you with any further changes. \n\nPlease provide me with feedback or any additional details you would like me to include.\n \nAdditionally, I reorganized the layout to put the information in clearer categories (such as Reference and Closing Date, Procurement Details, and Contact Information). The rewritten Entry reduces clutter and improves readability. Key details like the UNSPSC code, procurement method, and contracting entity remain unchanged.\n````\n\n### ideal answer\n```\n### Government Tender Announcement\n#### Request for Proposal: M2989-241220 - 7.75-8.25m RIB with Cuddy Cabin\n\n**Reference**: # WS4071798472-Doc4120026034\n**Amendment Number**: # 1\n**Publication Date**: #"
}