{
    "CONTRACT_ID": "WS4070936759",
    "type": "RFP",
    "department": "Department of Public Works and Government Services (PSPC)",
    "procurement_category": "SRV",
    "short_summary": "Geotechnical Investigation",
    "description": "Project Description: Public Services and Procurement Canada (PSPC) on behalf of the Department of Fisheries and Oceans Small-Craft Harbours (DFO-SCH) has a requirement for a geotechnical investigation in Malpeque Bay in PEI. Invited Firms: This is a request for proposals (RFP) against Supply Arrangement (SA)EB129- 192368 for Heavy Civil Engineering Services. The invited firms qualified under the Geotechnical discipline for the province of PEI are: 1. Wood Canada Ltd. 2. WSP Canada Inc. 3. CIMA+. 4. Harbourside Engineering Consultants. Debrief: Bidders Debrief for this bid may request a debriefing on the results of the bid solicitation. Bidders should make the request to the Contracting Authority within fifteen (15) working days from receipt of notification that their bid was unsuccessful. Reference the RFP for further details. General Information: Proposals must be submitted only via SAP Ariba by the date and time indicated in the Ariba RFP. The RFP issuing office is: Atlantic Region Acquisitions, 1713 Bedford Row, Halifax, N.S. B3J 1T3. This office provides services in English. Proposals may be submitted in either official language of Canada. ",
    "estimated_value": 0,
    "date_posted": "2023-06-26",
    "duration_in_months": ">=2",
    "provinces": [
        "Prince Edward Island"
    ],
    "tags": [
        "Civil Engineering",
        "Geotechnical Investigation"
    ],
    "full_summary": "---\n\n**Notice for Geotechnical Investigation at Cabot Shores**\n\n### Tender Information\n\n* **Solicitation Number**: WS4070936759\n* **Publication Date**: June 26, 2023\n* **Tender Closing Date**: July 18, 2023, 2:00 p.m. ADT\n* **Procurement Category**: SRV\n* **Procurement Method**: Competitive - Selective Tendering\n\n### Project Description\n\nPublic Services and Procurement Canada (PSPC) on behalf of the Department of Fisheries and Oceans Small-Craft Harbours (DFO-SCH) is seeking proposals for a geotechnical investigation at Cabot Shores, Prince Edward Island. The project involves conducting a geotechnical investigation in Malpeque Bay, which is a Critical and High-Risk Project.\n\n### Requirements\n\nThis is a request for proposals (RFP) against Supply Arrangement (SA) EB129-192368 for Heavy Civil Engineering Services. The RFP is being issued to the following firms qualified under the Geotechnical discipline for the province of PEI:\n\n1. Wood Canada Ltd.\n2. WSP Canada Inc.\n3. CIMA+\n4. Harbourside Engineering Consultants\n\n### Tendering Process\n\nThe RFP must be submitted only via SAP Ariba by the tender closing date. The issuing office is Atlantic Region Acquisitions, Halifax, Nova Scotia.\n\nProposals may be submitted in either official language of Canada. Further details regarding the bidding process may be found in the Request for Proposal document.\n\n### Proposal Submission\n\nTo ensure the security and integrity of the bid solicitation process, all proposals must be submitted electronically via SAP Ariba. Late or incomplete proposals will not be accepted.\n\n### Request for Debriefing\n\nBidders who are unsuccessful may request a debriefing within fifteen (15) working days from receipt of notification. The debriefing will provide information on the evaluation process and reasons for non-selection.\n\n### Contact Information\n\nFor any inquiries or clarifications regarding the RFP, please contact:\n\nRachel Miller, SPAC/PSPC\n\nEmail: [rachel.miller@tpsgc-pwgsc.gc.ca](mailto:rachel.miller@tpsgc-pwgsc.gc.ca)\n\nPhone: (Not disclosed for security reasons)\n\nNote: I have used asterisks (\\*) to denote irrelevant and non-relevant information in order to help you understand which parts of the text were excluded from the rewritten entry. The excluded parts only included country names"
}