{
    "CONTRACT_ID": "cb-733-98152497",
    "type": "ACAN",
    "department": "Transport Canada",
    "procurement_category": "SRV",
    "short_summary": "Subject Matter Expert for Transport Canada\u2019s Zero-Emission Vehicle Sales Projection Model",
    "description": "Subject matter expert to provide modeling expertise to TC\u2019s internal ZEV Sales Projection Model. The project aims to address the recommendations outlined in the \u2018Transport Canada\u2019s Internal Zero Emission Vehicle Sales Projection Model: Review and Recommendations for Enhancement\u2019 document to fulfill the federal government\u2019s ongoing policy analysis requirement.",
    "estimated_value": 0,
    "date_posted": "2023-11-10",
    "duration_in_months": "This contract will last for approximately 14 months, from January 31, 2024, to March 31, 2025.",
    "provinces": [
        "Ontario"
    ],
    "tags": [
        "Transport Canada",
        "ACAN",
        "expert services",
        "ZEV",
        "Sales Projection Model"
    ],
    "full_summary": "# Expert Support for Transport Canada\u2019s Zero Emission Vehicle Sales Projection Model\n\n## Solicitation Details\n\n* **Tender Reference Number:** cb-733-98152497\n* **Amendment Number:** 5\n* **Solicitation Number:** T8080-230342\n* **Publication Date:** 2023-11-10\n* **Tender Closing Date:** 2023-11-27T14:00:00\n\n## Contract Details\n\n* **Contract Type:** SRV (Services)\n* **Procurement Method:** Advance Contract Award Notice\n* **Contract Start Date:** 2024-01-31\n* **Contract End Date:** 2025-03-31\n\n## Description of Work\n\nTransport Canada is seeking an expert to provide Light-duty Vehicle modeling expertise to its internal Zero-Emission Vehicle Sales Projection Model. The objective is to enhance the model as outlined in the Enhancement Study, which addresses recommendations for the federal government's ongoing policy analysis requirements.\n\n## Contract Award Information\n\nTransport Canada has pre-identified a supplier and is issuing an Advance Contract Award Notice to allow other suppliers to indicate their interest in bidding. Suppliers must submit a statement of capabilities by the tender closing date. If no capable supplier submits a statement, the contracting officer may proceed with the award to the pre-identified supplier.\n\n## Contact Information\n\nDiana Daigle-Pietsch\nTransport Canada\nPhone: (416) 550-7952\nEmail: [diana.daigle-pietsch@tc.gc.ca](mailto:diana.daigle-pietsch@tc.gc.ca)\n\n## Tender Documents\n\nThe tender notice and documents are available for download at [https://canadabuys.canada.ca](https://canadabuys.canada.ca). The actual document can be downloaded separately in both English and French from [https://canadabuys.canada.ca/sites/default/files/webform/tender_notice/24612/acan---zev-bau-model-enhancement-expert-support---en.pdf](https://canadabuys.canada.ca/sites/default/files/webform/tender_notice/24612/acan---zev-bau-model-enhancement-expert-support---fr.pdf). \n\nNote: This is one of many government tenders that Transport Canada manages to foster procurement and business relationships between public and private sectors.\nThe submitted file consists of a bid solicitation from a contractor, but unfortunately, it's not very much readable and isn't written in clear English. \nPlease"
}