{
    "CONTRACT_ID": "",
    "type": "Contract",
    "department": "Royal Canadian Mounted Police",
    "procurement_category": "Service",
    "short_summary": "Health Services Officer (HSO) contract",
    "description": "That RCMP needs medical services evaluation and treatment management for RCMP members ",
    "estimated_value": 0,
    "date_posted": "2024-05-07",
    "duration_in_months": ",  ",
    "provinces": [
        "Nova Scotia"
    ],
    "tags": [
        "Health Services Officer (HSO)",
        "Request for Proposal",
        "Expiring soon",
        "Request for Proposal:majestosood Selection criteria_majestoso FTB0SW1661563 YT29 C TYDDSanonymous09UNSPC (((( "
    ],
    "full_summary": "### Health Services Officer (HSO) - Nova Scotia\n\n#### Request for Proposal\n\nThe Royal Canadian Mounted Police (RCMP) invites bids to provide Health Services Officer (HSO) services on a part-time, as-needed basis.\n\n**Contract Details**\n\n* Contract period: one year with options of two additional years\n* Work location: RCMP Occupational Health Unit in Dartmouth, Nova Scotia\n* Security clearance: Enhanced Reliability Top Secret\n* Hours: approximately 15-22 hours per week\n\n**Service Requirements**\n\n* Provide expert medical consultations and opinions on RCMP member fitness for duty and suitability for benefits and services\n* Conduct health assessments for RCMP members, including determinations of suitability for:\n\t+ Maximal exertion to use a firearm\n\t+ Professional driving of emergency vehicles\n\t+ Isolated posting and foreign duties\n\n**Evaluation Criteria**\n\n* Technical merit: evaluated on a scale of 0-50 points\n* Price: evaluated on a combined rating with technical merit\n\n**Submission Requirements**\n\n* Bids must be submitted to the RCMP Bid Receiving Unit at ATL_Procurement@rcmp-grc.gc.ca\n* Refer to attached tender documents for further information\n* Documents may be submitted in either official language of Canada\n\n**Important Notes**\n\n* Canada will make notice of proposed procurement, bid solicitations, and related documents available for download through the Government Electronic Tendering Service\n* Bidders are responsible for regularly consulting the service for the most up-to-date information\n* The RCMP has adopted the Integrity Regime administered by Public Services and Procurement Canada; integrity provisions will be applied in this procurement\n* The federal Indigenous Business Directory is an online resource for bidders to increase visibility and compete for federal government contracts set aside for Indigenous businesses\n\n**Contact Information**\n\nRoss Hartinger\nross.hartinger@rcmp-grc.gc.ca\n(902) 720-5121\n\n**Tender Documents**\n\n* [Link to tender documents](https://canadabuys.canada.ca/sites/default/files/webform/tender_notice/36372/m4000-4-5460_eng.pdf)\n* [Link to amended documents](https://canadabuys.canada.ca/sites/default/files/webform/tender_notice/36372/m4000-4-5460-amend001_en_0.pdf)\r\n\n**Closing Date**\n\nTender closing date: 2024-05-07T13:00:00\n Amendment date: 2024-05-07\n\n||\n\nLet me re"
}