{
    "CONTRACT_ID": "WS3751110527-Doc3753340311",
    "type": "LABORATORY CONTRACT FOR CONSTRUCTION PROJECT",
    "department": "Health Canada",
    "procurement_category": "Construction Services",
    "short_summary": "construction of laboratory in the space of one the departments of Health Canada.",
    "description": "the laboratory will be constructed in the space that was formerly used for storage  The two separate rooms required to be created in the the former storage space area include the Analitical QC and  HZ surveillance room.The Workers installing the HVAC piping and the general piping, and electrical panel Installing the new HVAC roof system. installation of new admited equipement of these of jobs also should be done then.",
    "estimated_value": 400,
    "date_posted": "2022-11-16",
    "duration_in_months": ">7",
    "provinces": [
        "Quebec"
    ],
    "tags": [
        "health",
        "construction",
        "Canada",
        "contract",
        "contracted"
    ],
    "full_summary": "## Tender Announcement: [EF944-231286] Laboratory Layout Arrangement\n\n### Reference\n* Reference Number: WS3751110527-Doc3753340311\n* Solicitation Number: WS3751110527\n* Amendment Number: 2\n* Publication Date: November 16, 2022\n* Tender Closing Date: December 8, 2022 2:00 PM EST (Expired)\n\n### Tender Overview\nThe Department of Public Works and Government Services (PWGSC), formerly known as the Public Services and Procurement Canada (PSPC), is soliciting proposals for a specialized public building construction service to convert a storage room into a microbiology laboratory facility for Health Canada, located at 1001 St-Laurent Blvd, Longueuil. The project involves:\n\n* Two separate rooms\n* Dedicated HVAC roof system installation\n* HVAC piping installation\n* New electrical panel installation\n\n### Qualification Criteria and Evaluation\nProposals will be evaluated based on the lowest price submitted.\n\n### Tendering Information\n\n* Tender Status: Expired\n* Notice Type: Request for Proposal\n* Procurement Method: Competitive - Open Bidding\n* Regions of Opportunity: None\n* Regions of Delivery: Longueuil, Quebec\n* Trade Agreements: Canadian Free Trade Agreement (CFTA)\n* Industry Classification: Specialized public building construction services (UNSPSC *72121400)\n\n### Contracting Information\n\n* Contracting Entity: Department of Public Works and Government Services (PSPC)\n* Contracting Entity Address: 11 Laurier St, Phase III, Place du Portage, Gatineau, Quebec K1A 0S5, Canada\n* End User Entity: Department of Public Works and Government Services (PSPC)\n* End User Entity Address: 11 Laurier St, Phase III, Place du Portage, Gatineau, Quebec K1A 0S5, Canada\n* Contact Information\n\t+ Name: France B\u00e9lisle (SPAC/PSPC)\n\t+ Email: [france.belisle@tpsgc-pwgsc.gc.ca](mailto:france.belisle@tpsgc-pwgsc.gc.ca)\n\t+ Phone: None\n\n### Notice and Further Information\nPlease visit [http://discovery.ariba.com/rfx/14655419?extsite=MTQ2NTU0MTlfQU4wMTQ4NDA1MDk5Mg==](http://discovery.ariba.com/r"
}