{
    "CONTRACT_ID": "EW479-212626E",
    "type": "Temporary Help Services",
    "department": "Department of Public Works and Government Services",
    "procurement_category": "Services",
    "short_summary": "Temporary help services to federal government departments and agencies.",
    "description": "The provision of temporary help services to federal government departments and agencies in one or more of the geographical Areas listed in Annex  \"A\" Statement of Work, on an as and when requested basis. It is intended to issue multiple Standing Offers to qualified Offerors as the result of this Request for Standing Offer process. The period for making call-ups against the resulting Standing Offer is from June 1, 2023 to May 31, 2024, with the irrevocable right to extend for 1 additional one year period. This procurement includes a Voluntary Set-Aside for Aboriginal Business.",
    "estimated_value": 0,
    "date_posted": "2023-04-25",
    "duration_in_months": ", ",
    "provinces": [
        "Saskatchewan",
        "Alberta"
    ],
    "tags": [
        "temporary help services",
        "human resources services",
        "temporary personnel services"
    ],
    "full_summary": "# Government Tender Announcement\n\n## EW479-212626E Temporary Help Services in Saskatchewan and Red Deer\n\n### Reference\nWS3979331646-Doc3980309575\n\n### Tender Details\n\n**Request for Proposal (RFP)**: Temporary Help Services, EW479-212626E\n\n* **Solicitation Number**: WS3979331646\n* **Publication Date**: Tuesday, April 25, 2023\n* **Tender Closing Date**: Wednesday, May 31, 2023 (2:00 PM EDT)\n* **Amendment Date**: Wednesday, May 9, 2023\n* **Procurement Category**: Service (SRV)\n\n### Description of Work\n\nSubject to the tender conditions, the Contractor may be required to provide temporary help services to federal government departments and agencies in one or more of the various work areas listed in Annex A of the Statement of Work. The scope of work includes providing temporary personnel services on an as-and-when Requested basis.\n\n### Bidder Registration\n\nPlease refer to the Ariba Discovery publication for any changes or updates regarding the procurement. \n\n### Voluntary Reserved Procurement\n\nThis procurement is a voluntary set-aside for Aboriginal businesses.()\n\n### Procurement Parameters\n\n* **Selection Criteria**: Employer evaluation based on variations or combinations of the required service offerings.\n* **Trade Agreements**: CPTPP and CFTA; applicable to valid tenders from certified suppliers.\n* **Regions of Opportunity**: Saskatchewan (regional areas such as the Prince Albert area, Regina, and Saskatoon).\n* **Industry Classification**: Human Resources (8011-10000) and Temporary Personnel Services (8011-1600).\n\n### Contracting Entity\n\nThe contracting authority is the Department of Public Works and Government Services (TPSGC - PSPC). \nTPSGC (PSPC) in other languages:\n* French (SPAC)\n* Tel: (514) 283-2150\n\n### Contact Details\n\nMelanie Perrin \nUnit SPAC/PSPC \n11 Laurier St, MC building Phase 3 \nPlace du Portage \nGatineau, Quebec K1A 0S5 \nmelanie.perrin@tpsgc-pwgsc.gc.ca \nHowever, it was modified with note deletions of comments.\n\n\n\nPlease leave a comment if you want to see the lengthy instructions on how to do similar contractions.   \n\n\nAlso feel free to contact me if you would like me to introduce red underlines to the rewritten text."
}