{
    "CONTRACT_ID": "PW-22-01017909",
    "type": "RELOCATION AND INSTALLATION SERVICES",
    "department": "Natural Resources Canada (NRCan)",
    "procurement_category": "Service",
    "short_summary": "Providing relocation and installation services to Natural Resources Canada (NRCan) employees",
    "description": "Natural Resources Canada (NRCan) requires relocation and installation services for its employees. This contract will be a one (1) year period with the option to extend by three (3) option years. The services will be need to be performed by various buildings occupied by NRCan employees in the National Capital Region.",
    "estimated_value": 80,
    "date_posted": "2022-12-19",
    "duration_in_months": "2",
    "provinces": [
        "Ontario"
    ],
    "tags": [
        "Natural Resources Canada",
        "National Capital Region"
    ],
    "full_summary": "# National Capital Region (NCR) Relocation and Installation Services for Natural Resources Canada\n## Tender Notice Advertisement\n\n#### Solicitation Information\n\n* **Solicitation Number:** NRCan-5000070118\n* **Reference Number:** PW-22-01017909\n* **Publication Date:** 2022-12-19\n* **Closing Date and Time:** 2023-01-19 14:00:00 EST\n* **Status:** Expired\n\n#### Description of Goods and Services\n\nThe Government of Canada is seeking a contractor to provide relocation and installation services for Natural Resources Canada (NRCan) on an \"as and when requested\" basis for various buildings occupied by NRCan employees in the National Capital Region.\n\nThe main locations for this project include the Booth Street Complex, Bells Corners Complex, Anderson Road Complex, Observatory Crescent, 350 Albert Street, 2464 Sheffield Road, and 3484 Limebank Road. The contract duration is for one year with the option to extend by three additional years.\n\n#### Terms and Conditions\n\nThis contract will be awarded through a competitive bidding process. Bidders must demonstrate their ability to meet the requirements outlined in the Request for Proposal (RFP) document.\n\nThe following trade agreements apply to this tender:\n\n* Canada-Chile Free Trade Agreement (CCFTA)\n* Canadian Free Trade Agreement (CFTA)\n* Canada-Honduras Free Trade Agreement\n* Canada-European Union Comprehensive Economic and Trade Agreement (CETA)\n* World Trade Organization Agreement on Government Procurement (WTO GPA)\n* Canada-Ukraine Free Trade Agreement (CUFTA)\n* Canada-UK Trade Continuity Agreement (Canada-UK TCA)\n\n#### Requirements\n\nBidders must submit the following documentation:\n\n* Proof of registration in the suppliers' directory\n* A copy of their business license\n* Proof of liability insurance\n* Proof of workers' compensation insurance\n\n#### Eligibility\n\nOnly suppliers who have a valid contract with Natural Resources Canada are eligible to participate in this tender.\n\n#### Additional Resources\n\nThe Request for Proposal (RFP) document and attachments can be found in the Canada Buys portal.\n\n**Note:**\n\n* This tender is governed by the Contracting Entity: Natural Resources Canada.\n* The end-users for this contract are Natural Resources Canada employees in the National Capital Region.\n\nContact Information:\nBerthelet, Andrea\n Phone: 343-543-7092\nEmail: [andrea.berthelet@nrcan-rncan.gc.ca](mailto:andrea.berthe"
}