{
    "CONTRACT_ID": "cb-121-2823340",
    "type": "Tender Opportunity",
    "department": "Natural Resources Canada",
    "procurement_category": "Service",
    "short_summary": "Acquisition and classification of airborne LiDAR transects in northern forests of Canada",
    "description": "By means of the RFP, Natural Resources Canada (NRCan) is seeking proposals from bidders for Acquisition and classification of airborne LiDAR transect data in the northern forests of Canada.\", ",
    "estimated_value": 0.0,
    "date_posted": "2024-06-10",
    "duration_in_months": "Il incombe au soumissionnaire de pr\u00c3senter une soumission pour chaque zone (c.-\u00e0-d. le co\u00fbbtrexts dated_functions str novelbus azur_multip_rules \u00e2., ",
    "provinces": [
        "Quebec"
    ],
    "tags": [
        "Geographic information system",
        "Forestry",
        "Aerial photography services",
        "Service"
    ],
    "full_summary": "### Government Tender Announcement\n\n#### Title\nAcquisition and Classification of Airborne LiDAR Transects in Northern Forests of Canada\n\n#### Reference Number\ncb-121-2823340\n\n#### Amended Solicitation Number\nNRCan-5000081223 (6th amendment)\n\n#### Publication and Submission Dates\n* Publication Date: 2024-06-10\n* Submission Deadline: 2024-07-11T14:00:00\n\n#### Expected Contract Dates\n* Expected Start Date: 2024-07-23\n* Expected End Date: 2025-03-31\n\n#### Solicitation Details\nNatural Resources Canada (NRCan) invites proposals from bidders for the acquisition and classification of airborne LiDAR transect data in the northern forests of Canada. The project involves the collection and processing of LiDAR data across four (4) designated acquisition areas (Figure 2, Table 1). Bidders are required to submit proposals for individual acquisition areas or any subset of areas.\n\n#### Key Terms\n* Geographic Information System (GIS)\n* Forestry Services\n* Aerial Photography Services\n\n#### Trade Agreements\nThis solicitation is open to bidders worldwide and is subject to various trade agreements, including the Comprehensive and Progressive Agreement for Trans-Pacific Partnership (CPTPP), Canada-Panama Free Trade Agreement, and the Canada-European Union Comprehensive Economic and Trade Agreement (CETA), among others.\n\n#### Contact Information\n* Marie-Jos\u00e9e Michaud\n* Phone: (418) 563-6916\n* Email: [marie-josee.michaud@nrcan-rncan.gc.ca](mailto:marie-josee.michaud@nrcan-rncan.gc.ca)\n\n#### Attachments\nThe procurement documents and supporting files are available for download at [https://canadabuys.canada.ca/sites/default/files/webform/tender_notice/39815](https://canadabuys.canada.ca/sites/default/files/webform/tender_notice/39815).\n\nThe above rewritten text maintains the same information as the original, but in a more polished and concise format. I also rephrased certain sentences to improve clarity and removed unnecessary details to meet the 400-word limit. Let me know if you have any questions or need further clarification!"
}