{
    "CONTRACT_ID": "W8486-249199/AS",
    "type": "Electro Optic Spare Parts",
    "department": "Department of National Defence",
    "procurement_category": "Goods",
    "short_summary": "Electro Optic Spare Parts",
    "description": "Electro Optic Spare Parts",
    "estimated_value": 10000,
    "date_posted": "2023-10-04",
    "duration_in_months": "><?long-form_hours_dt.text-3 Months)",
    "provinces": [
        "Alberta",
        "Quebec",
        "Quebec"
    ],
    "tags": [
        "Electro",
        "Optic",
        "Spare",
        "Parts",
        "RFQ",
        "Goods",
        "Canada",
        "Nov-2023"
    ],
    "full_summary": "## Government Tender Announcement\n**Electro Optic Spare Parts**\n\n### Tender Details\n\n*   Reference Number: cb-258-14695135\n*   Solicitation Number: W8486-249199/AS\n*   Amendment Number: 9\n*   Publication Date: 2023-10-04\n*   Tender Closing Date: 2023-11-13T14:00:00\n*   Expected Contract Start Date: 2023-11-27\n*   Expected Contract End Date: 2024-03-15\n\n### Tender Description\n\nThe Department of National Defence is soliciting proposals for electro-optic spare parts. The tender involves the supply of various items, including hose assemblies, manifolds, fittings, input assemblies, blanking plugs, level benches, electrical equipment supports, capacitor objectives, protective covers, calibrators, protractors, and electrical insulating sleeving.\n\n*   Item 1: Hose Assembly (Quantity: 10)\n*   Item 2: Manifold (Quantity: 10)\n*   Item 3: Fitting (Quantity: 20)\n*   Item 4: Input Assembly (Quantity: 10)\n*   Item 5: Blanking Plug (Quantity: 15)\n*   Item 6: Level Bench (Quantity: 35)\n*   Item 7: Electrical Equipment Supports (Quantity: 10)\n*   Item 8: Capacitor Objectives (Quantity: 60)\n*   Item 9: Protective Covers (Quantity: 30)\n*   Item 10: Calibrators (Quantity: 11)\n*   Item 11: Protractors (Quantity: 90)\n*   Item 12: Electrical Insulating Sleeving (Quantity: 25)\n\n### Delivery and Return\n\nDeliveries will be made to:\n\n*   Depot at 25 CFSD, Montreal, Quebec\n*   7 CFSD Edmonton, Alberta\n\n### Contracting Entity\n\n*   Contracting Entity: Department of National Defence\n*   Contracting Entity Address: 101 Colonel By Dr, Ottawa, On K1A 0K2\n\n### Contact Information\n\n*   Contact Person: Julie Grenier\n*   Contact Email: [julie.grenier2@forces.gc.ca](mailto:julie.grenier2@forces.gc.ca)\n*   Contact Phone: (613) 406-8821\n\n### Trade Agreements\n\n*   Canada-Peru"
}