{
    "CONTRACT_ID": "cb-9275-79597923",
    "type": "RFP",
    "department": "Department National Defense",
    "procurement_category": "Service",
    "short_summary": "Temporary Help Services",
    "description": "Temporary Help Services Requirement",
    "estimated_value": 0,
    "date_posted": "2023-09-20",
    "duration_in_months": "}{ ",
    "provinces": [
        "Ontario"
    ],
    "tags": [
        "security-level-secret"
    ],
    "full_summary": "# National Capital Region (NCR) Temporary Help Services Requirement\n\n## Background\n\nThe Department of National Defence (DND) is issuing a Request for Proposal (RFP) for Temporary Help Services under the Supply Arrangement (SA) for the National Capital Region (NCR). This requirement is open to SA holders who qualified under Stream 13, Policy and Advisory Services, Category 13.6 Risk Management.\n\n## Eligibility\n\nThe RFP is restricted to SA holders under EN578-172870 who meet the specified qualification criteria. The following SA holders have been invited to submit a proposal:\n\n* Action Personnel of Ottawa-Hull Ltd\n* Akkada Professional Services and Zernam Enterprise in JV\n* ARTEMP Personnel Services Inc\n* Axons Canada Inc, Levio Conseils Inc, IN JOINT VENTURE\n* BP & M Government IM & IT Consulting Inc\n* Cache Computer Consulting Corp\n* Cistel Technology Inc\n* IPSS INC\n* Lionel Drouin\n* MAKWA Resourcing Inc\n* NATTIQ INC\n* Northern Brainwaves Consulting Inc\n* OLAV CONSULTING CORP, MOSHWA ABORIGINAL INFORMATION TECHNOLOGY CORPORATION, IN JOINT VENTURE\n* RHEA INC\n* TEKSYSTEMS CANADA CORP/SOCI\u00c9T\u00c9 TEKSYSTEMS CANADA\n\n## Description of the Requirement\n\nThe DND requires Temporary Help Services, including resources with a minimum security level of Secret, to support their operations. The proposed services will be used to provide various support functions, including risk management.\n\n## Notice Details\n\n* Reference Number: cb-9275-79597923\n* Amendment Number: 4\n* Publication Date: 2023-09-20\n* Tender Closing Date: 2023-09-26T11:00:00\n* Amendment Date: 2023-09-26\n* Expected Contract Start Date: Not specified\n* Expected Contract End Date: Not specified\n* Tender Status: Expired\n* Notice Type: RFP against Supply Arrangement\n* Procurement Method: Competitive - Selective Tendering\n* Selection Criteria: Variations or combinations of the above methods\n* Trade Agreements: Canadian Free Trade Agreement (CFTA), Comprehensive and Progressive Agreement for Trans-Pacific Partnership (CPTPP)\n* Regions of Opportunity: National Capital Region (NCR)\n* Regions of Delivery: National Capital Region (NCR)\n\n## Contact Information\n\nFor more information, please contact CFSG"
}