{
    "CONTRACT_ID": "W6898-230652",
    "type": "Swimming Pool and Spa Equipment and Supplies",
    "department": "Public Works and Government Services (PSPC)",
    "procurement_category": "Goods",
    "short_summary": "RISO Swimming Pool Chemicals",
    "description": "Tender to supply Chemicals for Swimming Pools on an as and when requested basis for 2 years.",
    "estimated_value": 40,
    "date_posted": "2023-07-18",
    "duration_in_months": "[24]",
    "provinces": [
        "Quebec"
    ],
    "tags": [
        "Goods",
        "RISO",
        "Canada-Chile Free Trade Agreement",
        "Canadian Free Trade Agreement"
    ],
    "full_summary": "### Request for Standing Offer (RISO) for Swimming Pool Chemicals\n\n**Procurement Title**\n\nW6898-230652 RISO Swimming Pool Chemicals (Eng) / OCIR Produits chimiques pour Piscines (Fra)\n\n* **Reference Number**\nWS4047651329-Doc4104111268\n* **Solicitation Number**\nWS4047651329\n* **Publication Date**\n2023-07-18\n* **Closing Date**\n2023-08-11 2:00 PM (Eastern Time)\n\n### Procurement Details\n\nThe Department of Public Works and Government Services (PSPC) invites eligible contracting parties to participate in a Request for Standing Offer (RISO) for the supply and delivery of Chemicals for Swimming Pools, with the primary requirement for delivery to the 5th Canadian Division Support Base Gagetown in Oromocto, New Brunswick. The successful contractor will be awarded a Regional Individual Standing Offer (RISO) for a period of 2 years, effective September 1, 2023, to August 31, 2025, with an option to renew.\n\n* **Procurement Category**: Goods and Services (GD)\n* **Notice Type**: Request for Standing Offer (RISO)\n* **Procurement Method**: Competitive - Open bidding (UNSPSC: 49241700: Swimming pool and spa equipment and supplies)\n* **Selection Criteria**: Lowest Price\n* **Trade Agreements**: Procurement is subject to the Canada-Chile Free Trade Agreement (CCFTA), Canadian Free Trade Agreement (CFTA), Canada-Peru Free Trade Agreement (CPFTA), Canada-Colombia Free Trade Agreement, Canada-Honduras Free Trade Agreement, Canada-Korea Free Trade Agreement (CKFTA), and Canada-Panama Free Trade Agreement.\n\n### Contact Information\n\n* **Primary Contact**\nLyne Leger, [lyne.leger2@tpsgc-pwgsc.gc.ca](mailto:lyne.leger2@tpsgc-pwgsc.gc.ca)\n* **Contracting Entity**\nDepartment of Public Works and Government Services (PSPC)\n11 Laurier St, Phase III, Place du Portage\nGatineau, Quebec K1A 0S5\nCanada\n\n### Notice and RFQ\n\nPlease visit the official Ariba website:\n[http://discovery.ariba.com/rfx/16905973?extsite=MTY5MDU5NzNfQU4wMTQ4N"
}