{
    "CONTRACT_ID": "PW-22-01015260",
    "type": "REPLACEMENT OF FLOATING WHARVES",
    "department": "FISHERIES AND OCEANS CANADA",
    "procurement_category": "CONSTRUCTION",
    "short_summary": "Replacement of floating wharves at Toney river, able get used between early march and late July. Financial offer can be figured by estimated budgeted approx $43.11M. Maybe excavation constitute key method in delivery.",
    "description": "The work covered under this contract consists of the furnishing of all plant, labour, equipment and material for the replacement of Floating Wharves at Toney River, Pictou County, Nova Scotia.",
    "estimated_value": 4311.0,
    "date_posted": "2022-11-30",
    "duration_in_months": "4 months",
    "provinces": [
        "Nova Scotia"
    ],
    "tags": [
        "Marine Construction",
        "Toney River",
        "Fisheries And Oceans Canada"
    ],
    "full_summary": "## Replacement of Floating Wharves - Eastside, Toney River, Nova Scotia\n### Tender Information\n\n* [Reference Number] PW-22-01015260\n* [Solicitation Number] 30003737\n* [Publication Date] 2022-11-30\n* [Tender Closing Date] 2022-12-15T13:00:00 (expired)\n\n#### Description of Work\nThe successful bidder will be required to furnish all necessary plant, labour, equipment, and materials for the replacement of floating wharves at Toney River, Eastside, Pictou County, Nova Scotia. The scope of work includes:\n\n* Replacement of floating wharves\n* Associated groundwork and environmental mitigation measures\n\n#### Pre-Requisites\nFailure to meet the following requirements will render the bidder disqualified:\n\n* Proof of a valid (CFTA) Canadian Free Trade Agreement (CFTA) certification\n* Demonstration of relevant expertise in marine construction projects\n\n#### Procurement Information\n\n* Procurement Method: Competitive - Open bidding\n* Tender Eligibility Criteria: Only bids from accredited Canadian businesses will be considered.\n\n#### Contract Details\n\n* Expectancy Contract Start Date: March 1st, 2023\n* Expectancy Contract End Date: March 31st, 2023\n\n### Important Links\n\n* The entire qualification package is available on the [Canada Buys website](https://canadabuys.canada.ca).\n\t+ [RFP Documents] (English and French): Pages 1-5\n\t+ [Addendum 2](https://canadabuys.canada.ca/documents/pub/att/2022/12/12/1f914b3bcc17bab8cc9278c7d946fb4f/30003737_-_addendum_2.pdf)\n\t+ [Addendum 1](https://canadabuys.canada.ca/documents/pub/att/2022/12/05/43413b17aa6769dda0fe181d751b2a45/30003737_-_addendum_1.pdf)\n\nContact Information\n----------------\n\n* Name: Claire Lavoie\n* Email: DFOtenders-soumissionsMPO@dfo-mpo.gc.ca\n* Address: Fisheries and Oceans Canada, 200 Kent St, Station 13E228, Ottawa, Ontario K1A 0E6, Canada\n* Phone: Not Available\n* Fax: Not Available\n\nNote:"
}