{
    "CONTRACT_ID": "MX-43052932542",
    "type": "CONTRACT",
    "department": "CONSTRUCTION",
    "procurement_category": "Construction",
    "short_summary": "Remediation of BAR-B Beach Refueling Area",
    "description": "REMEDIATION OF BAR-B BEACH REFUELING AREA",
    "estimated_value": 25100000,
    "date_posted": "2024-03-04",
    "duration_in_months": "><?.?],  ",
    "provinces": [],
    "tags": [
        "CANADA",
        "CONTRACTS",
        "MERX",
        "CONSTRUCTION ",
        "], "
    ],
    "full_summary": "# Remediation of BAR-B Beach Refueling Area Tender Announcement\n\n## Tender Details\n\n* Reference Number: MX-43052932542\n* Solicitation Number: NRE22BB_80875\n* Public Publication Date: March 4, 2024\n* Tender Closing Date: April 30, 2024 2:00 PM EDT\n* Amendment Number: 4\n* Expected Contract Start Date: November 30, 2026\n* Expected Contract End Date: November 30, 2026\n\n## Procurement Description\n\nThe Government of Canada's Defence Construction Canada (DCC) is seeking a qualified contractor to undertake the remediation of the BAR-B Beach Refueling Area at the Stokes Point, Yukon. The scope of work includes, but is not limited to, the removal of contaminated soils associated with hydrocarbons from the former beach refueling area.\n\n## Tender Requirements\n\n* The estimated cost for this opportunity is approximately $25.1 million.\n* The work must reach substantial completion by September 15, 2026, and be completed by November 30, 2026.\n* This tender is being conducted in accordance with the Canada-European Union Comprehensive Economic and Trade Agreement (CETA), the Canadian Free Trade Agreement (CFTA), and the World Trade Organization Agreement on Government Procurement (WTO-GPA).\n* Firms interested in providing these services must submit their abbreviated proposals through the MERX Electronic Bidding System by the closing date and time indicated on the system.\n* Questions regarding this tender must be directed to Justin Bennett at justin.bennett@dcc-cdc.gc.ca or 819-962-2917.\n* Bidders can obtain contract award results from the DCC website at https://www.dcc-cdc.gc.ca/industry/contract-activity.\n\n## Tendered Items\n\nThe following tendered items have been included:\n\n* Excavation, containerization, barge, land transport, and disposal of Tier 1 PHC contaminated soil (Code A, Quantity: 5,200 M3)\n* Balance of the Contract complete (Code C, Quantity: 1)\n* Type 3 Granular Fill to be placed and compacted as backfill (Code B, Quantity: 5,200 M3)\n\n## Contact Information\n\nFor further information or to submit a bid, please visit the MERX Electronic Bidding System at http://www.merx.com. Fees may apply; please see https://www.merx.com/public/pricing for"
}