{
    "CONTRACT_ID": "W6448-23C010-Mast Extension Kit",
    "type": "kit",
    "department": "Department of Public Works and Government Services (PSPC)",
    "procurement_category": "Goods",
    "short_summary": "Mast Extension Kit to relocate antennas on user's vest",
    "description": "The Department of National Defence (DND) has a requirement to procure Mast Extension Kit- personal antenna relocation kits for use in functionally relocating radio mounted antennas to other locations on the wearer\u2019s loading-bearing vest.",
    "estimated_value": 0.0,
    "date_posted": "2022-09-26",
    "duration_in_months": "47",
    "provinces": [
        "Ontario"
    ],
    "tags": [
        "radio antennas",
        "Canada"
    ],
    "full_summary": "# Government Tender Announcement\n\n## Title {#title}\n\n*   W6448-23C010-Mast Extension Kit (English)\n*   W6448-23C010-Ensemble de rallonge de m\u00e2t (French)\n\n## Tender Details {#tender-details}\n### Reference Number\nWS3666521086-Doc3679870607\n\n### Amendment Number\n3\n\n### Solicitation Number\nWS3666521086\n\n### Publication Date\n2022-09-26\n\n### Tender Closing Date\n2022-10-24T14:00:00\n\n### Amendment Date\n2022-11-03\n\n### Expected Contract Start Date\n2022-11-18\n\n### Expected Contract End Date\n2025-06-01\n\n### Tender Status\nExpired\n\n## Goods or Service Description\nThe Department of National Defence requires a Mast Extension Kit to facilitate the functional relocation of radio-mounted antennas to other locations on the wearer's loading-bearing vest.\n\n## Industry Coding\n*   UNSPSC Code: 43221706 - Radio antennas\n*   UNSPSC Description: Radio antennas\n\n## Contract Details\n*   Procurement Category: Goods and Services (GD)\n*   Notice Type: Request for Proposal\n*   Procurement Method: Competitive - Open bidding\n*   Selection Criteria: Lowest Price\n*   Trade Agreements: Canadian Free Trade Agreement (CFTA)\n*   Regions of Opportunity: Ontario (except NCR)\n*   Regions of Delivery: Ontario (except NCR)\n\n## Contact Information\n*   Shamael Malko-Moore (SPAC/PSPC)\n*   Email: shamael.malko-moore@tpsgc-pwgsc.gc.ca\n*   URL: [http://discovery.ariba.com/rfx/14203312?extsite=MTQyMDMzMTJfQU4wMTQ4NDA1MDk5Mg==](http://discovery.ariba.com/rfx/14203312?extsite=MTQyMDMzMTJfQU4wMTQ4NDA1MDk5Mg==)\n\n## Important Dates\n\n*   Tender Closing Date: 2022-10-24T14:00:00\n*   Amendment Date: 2022-11-03\n*   Expected Contract Start Date: 2022-11-18\n*   Expected Contract End Date: 2025-06-01  I hope"
}