{
    "CONTRACT_ID": "EF997-232192",
    "type": "Electrical Compliance Work at the ",
    "department": "Fisheries and Oceans Canada",
    "procurement_category": "CNST",
    "short_summary": "Electrical system services",
    "description": "Public Works and Government Services Canada (PWGSC), on behalf of the department of Fisheries and Oceans Canada, is issuing this request for proposal (RFP) to perform important electrical work located at in Mont-Joli (Sainte-Flavie), Quebec, as detailed in Annex A. ",
    "estimated_value": 0,
    "date_posted": "2023-06-02",
    "duration_in_months": "default",
    "provinces": [
        "Quebec"
    ],
    "tags": [
        "electronics services",
        "parts procurement",
        "electrical compliance work"
    ],
    "full_summary": "### Government Tender Announcement\n\n* **Contract Title** : EF997-232192, Electrical Compliance Work at the Institute Maurice Lamontagne in Mont-Joli\n* **Reference Number** : WS4025955769-Doc4025958338\n* **Tender Amendment Number** : 2\n* **Publication Date** : June 2, 2023\n* **Tender Closing Date** : July 18, 2023 14:00 hours\n* **Contract Type** : Request for Proposal - Competitive and Open Bidding\n* **Service Code** : UNSPSC 72151500, Electrical System Services\n* **Procurement Category** : CNST\n\n### Tender Details\n\nThe Department of Public Works and Government Services of Canada (PWGSC) invites tenders from qualified contractors for electrical compliance work at the Institute Maurice Lamontagne in Mont-Joli (Sainte-Flavie), Quebec.\n\nThe contract objective is to perform electrical infrastructure work in accordance with the specifications outlined in Annex A. The successful tenderer will be responsible for executing the project in conformity with Health and Safety regulations and the terms of the contract.\n\n### Evaluation Criteria\n\nTenders will be evaluated based on the lowest price received. The following documents are part of the tender package:\n\n* Request for Proposal document;\n* Annex A: Specifications;\n\n### Contact Information\n\nFor any inquiries or clarification, please contact:\n* **Marie-Claude Dugal**        \nPWGSC - Department of Fisheries and Oceans Canada\n Phone: * ( Not provided )\nEmail: [marie-claude.dugal@tpsgc-pwgsc.gc.ca](mailto:marie-claude.dugal@tpsgc-pwgsc.gc.ca)\nWebsite: [discovery.ariba.com/rfx/16471394](http://discovery.ariba.com/rfx/16471394?extsite=MTY0NzEzOTRfQU4wMTQ4NDA1MDk5Mg==)\n\n### Other Information\n\nThe tender is open to all qualified contractors who meet the requirements. The successful contractor is expected to start work on July 4, 2023.\n\nATTN: Due to Cropping I've taken out all information regarding languages since it was simply duplicated.\nPages have links for both issuance reference, and winners of the Bid. Simply remove language Allegations as all is in other releases. although job description includes many closely related Electrical Services. Canada's east and another specified of water relation"
}