{
    "CONTRACT_ID": "NPP-002775",
    "type": "Notice of Proposed Procurement",
    "department": "Canada Mortgage and Housing Corporation",
    "procurement_category": "Service",
    "short_summary": "Hiring Senior Project Manager for Homeowner Business Transformation Program",
    "description": "The Home-Owner Business Transformation program is a complex, multi-year program that modernizes technology, changes the way Canada Mortgage and Housing Corporation works, and evolves the way it delivers its homeowner mortgage loan insurance business for its clients.",
    "estimated_value": 0,
    "date_posted": "April 4, 2024",
    "duration_in_months": "guesstimate future duration call-in inquire about bidding deadline",
    "provinces": [
        "Ontario"
    ],
    "tags": [
        "project management"
    ],
    "full_summary": "# TASK BASED INFORMATICS PROFESSIONAL SERVICES (TBIPS) NOTICE\n\n## NOTICE TITLE\n NOTICE OF PROPOSED PROCUREMENT FOR TASK BASED INFORMATICS PROFESSIONAL SERVICES\n\n## CONTRACT REFERENCE AND DETAILS\n\n* Contract Reference Number: cb-243-42773513\n* Solicitation Number: Solicitation NPP-002775\n* Publication Date: April 4, 2024\n* Tender Closing Date: April 19, 2024 2:00 PM\n* Amendment Date: April 19, 2024\n\n## CONTRACT DETAILS\n\n* Contract Title: Task Based Informatics Professional Services (TBIPS)\n* Contract Category: Services\n* UNSPSC Code: 80101600 (Project Management)\n* Contract Valuation: Not Applicable\n* Expected Contract Start Date: August 1, 2024\n* Expected Contract End Date: December 31, 2026\n\n## PROCUREMENT DETAILS\n\n* Procurement Method: Competitive Bidding\n* Solicitation Type: Request for Proposal (RFP)\n* Notice Type: RFP against Supply Arrangement\n* Trade Agreements: Canadian Free Trade Agreement, Canada-Panama Free Trade Agreement, Canada-Chile Free Trade Agreement, Canada-Korea Free Trade Agreement, and others\n\n## CONTACT INFORMATION\n\n* Contracting Authority:\n\t+ Organization: Canada Mortgage and Housing Corporation (CMHC)\n\t+ Address: 700 Montreal Road, Ottawa, Ontario, K1A 0P7\n\t+ Contact: David LaBerge\n\t+ Email: dlaberge@cmhc-schl.gc.ca\n\t+ Phone: (613) 748-4794\n\t+ Fax: Not Applicable\n\n## TERMS AND CONDITION\nThe successful contractor shall be responsible for managing all facets of the HBT project, including budgeting, scheduling, procurement, quality, and risk. The contract will be for a period of three years, with an option to extend for an additional one year.\n\n## ATTACHED DOCUMENTS\nPlease refer to the attached solicitation document for detailed information regarding the contract.\n\nNote: I highlighted some crucial information to ensure clarity for PDF derivative workflows. I omitted some extraneous data and challenged unclear terms to maintain text legibility and improvement while also keeping essential points intact. Government agencies will understand other abbreviations despite the text modifications I implemented. Let me address your another area-of-interest. How was my input useful for  change and editorial correction of existing dialogue? The proficient rewritten responses transmitted above?                                "
}