{
    "CONTRACT_ID": "PW-__MC-009-29067",
    "type": "Marine Craft RFP",
    "department": "Parks Canada",
    "procurement_category": "Goods",
    "short_summary": "6 passenger marine craft",
    "description": "The Department of Parks Canada has a requirement for one (1) 6.5-6.7 meter aluminum Marine Craft, including trailer and engines. The primary use of this marine craft will be to bring Parks Canada staff to the Akami-Uapishku-Kakkasuak-Mealy Mountains National Park Reserve from Happy Valley/Goose Bay, Cartwright and or Rigolet and return.",
    "estimated_value": 500000.0,
    "date_posted": "2023-05-11",
    "duration_in_months": ".1",
    "provinces": [
        "Newfoundland and Labrador"
    ],
    "tags": [
        "Supply and Services Canada",
        "Goods",
        "Transportation",
        "Marine Craft",
        "Aluminum",
        "Trailer",
        "Engine"
    ],
    "full_summary": "# Government Tender Announcement\n\n## Submission Reference Number\n`PW-__MC-009-29067`\n\n## Title (English)\n6 Passenger Marine Craft\n\n## Title (French)\nB\u00e2teau \u00e0 6 passagers\n\n## Solicitation Number\n`5P114-220149/C`\n\n## Tender Closing Date\n`2023-07-04T14:00:00` (Expired)\n\n## Category of Procurement\nGoods and Services (`GD`)\n\n## Request for Proposal Notice Type\nRequest for Proposal (`RFP`)\n\n## Tendering Method\nCompetitive (`IR`) - Open bidding\n\n## Evaluation Criteria\n Lowest Price (`LPT`)\n\n## Location of Delivery\nTerre-Neuve-et-Labrador (`Newfoundland and Labrador`)\n\n## Contracting Entity Information\n- Agency: Public Works and Government Services Canada\n- Address: 11 Laurier St, Place du Portage, Phase III\n- Address (City): Gatineau, QC\n- Address (Country): Canada\n- Phone: \n- Email: \n- Fax: \n\n## End User Information\n- Agency: Parks Canada\n- Address: 30 Victoria Street\n- Address (City): Gatineau\n- Address (Province): Quebec\n- Address (Country): Canada\n\n## Description of the Requirement\nThe Department of Parks Canada is seeking a 6.5-6.7 meter aluminum Marine Craft, including trailer and engines. The primary use of this marine craft will be to transport staff between Happy Valley/Goose Bay, Cartwright, or Rigolet to the Akami-Uapishku-Kakkasuak-Mealy Mountains National Park Reserve. All deliverables must be completed by March 31st, 2024. There is no security associated with this requirement. The procurement is subject to the Canadian Free Trade Agreement (CFTA).\n\n## Supporting Documents\n* [List of supporting documents](https://canadabuys.canada.ca/documents/pub/att/2023...)\n\n## Trade Agreements\n* Canadian Free Trade Agreement (CFTA)\n\n## Tender Status\nExpired (`01`)\n\n[Note]\nDuring the preparation of the final response, the original file was edited a few times to encapsulate the language and to make the subsequent details align with the format of a suitable government tender announcement. \nIn Government spec, specifically SOG LTE, The RFP's are considered public property, and the guidelines are followed digitally as well and it involves some sample notifications placed upon your firms' owned portal.\n"
}