{
    "CONTRACT_ID": "cb-6451-32199464",
    "type": "request for proposal",
    "department": "Office of the Superintendent of Financial Institutions",
    "procurement_category": "SRV",
    "short_summary": "Power BI Training",
    "description": "The Office of the Superintendent of Financial Institutions Canada (OSFI) has a requirement for the provision of commercially available IT training services for Power BI software.",
    "estimated_value": 0,
    "date_posted": "2023/06/15",
    "duration_in_months": "default",
    "provinces": [],
    "tags": [
        "SRV",
        "IT",
        "training",
        "Power BI ",
        "Canada"
    ],
    "full_summary": "# Government Tender Announcement\n### Title\n{French: Formation Power BI, English: Power BI Training}\n\n### Reference Number\n{French: cb-6451-32199464, English: cb-6451-32199464}\n\n### Solicitation Number\n{French: 20222689, English: 20222689}\n\n### Tender Status\n{French: Expir\u00e9, English: Expired}\n\n### Procurement Category\n{French: SRV, English: SRV}\n\n### Notice Type\n{French: Demande de propositions, English: Request for Proposal}\n\n### Procurement Method\n{French: Concurrentielle - Appel d'offres s\u00e9lectif, English: Competitive - Selective tendering}\n\n### Procurement Description\nThe Office of the Superintendent of Financial Institutions Canada (OSFI) is seeking the provision of commercially available IT training services for Power BI software. The proposed services must be delivered in accordance with the terms and conditions outlined in the tender documents.\n\n### Tender Evaluation Criteria\nThe tender evaluation will be based on a combined assessment of technical merit and price, with the highest combined rating being the criteria for selection.\n\n### Regions of Opportunity\nThe proposed services are required for delivery across Canada.\n\n### Regions of Delivery\nThe proposed services are to be delivered in Canada.\n\n### Trade Agreements\nThe proposed procurement is subject to the following trade agreements:\n\n* Canada-Colombia Free Trade Agreement\n* Canada-Panama Free Trade Agreement\n* Canada-European Union Comprehensive Economic and Trade Agreement (CETA)\n* Canada-Ukraine Free Trade Agreement (CUFTA)\n* Comprehensive and Progressive Agreement for Trans-Pacific Partnership (CPTPP)\n* Canada-Chile Free Trade Agreement (CCFTA)\n* Canadian Free Trade Agreement (CFTA)\n* World Trade Organization Agreement on Government Procurement (WTO GPA)\n* Canada-Honduras Free Trade Agreement\n* Canada-Peru Free Trade Agreement (CPFTA)\n* Canada-Korea Free Trade Agreement (CKFTA)\n\n### Tender Closing Date\nThe tender closing date is {French: 2023-07-04T14:00:00, English: 2023-07-04T14:00:00}\n\n### Contact Information\nFor further information, please contact:\n\n* Andrew Bryant at:\n\t+ Email: [contracting@osfi-bsif.gc.ca](mailto:contracting@osfi-bsif.gc.ca)\n\t+ Phone: (343) 571-8507\n\nNote: Please ensure to verify the accuracy and completeness of the"
}