{
    "CONTRACT_ID": "cb-8037-42107169",
    "type": "SNOW REMOVAL",
    "department": "Parks Canada",
    "procurement_category": "SRV",
    "short_summary": "Government agency is looking for a contractor to assist with snow removal and maintenance services for a national park.",
    "description": "Government agency is looking for a contractor to assist with snow removal and maintenance services for a national park. Detailed Description: Government agency is looking for a contractor to provide labor, equipment and materials needed for snow removal, sanding, cleaning and sweeping of several sectors of the La Mauricie National Park. Services must be provided in accordance with this solicitation. The service contract is required for the period of October 15, 2023 to June 30, 2025, with three (3) additional one-year period each. Government agency'll perform work during the period of October 15, 2023 to June 30, 2025. Contractor grants to Canada the irrevocable option to extend the term of the Contract by up to three (3) additional one-year period under the same conditions. Site visits, for technical and contractual nature, can be done beforehand and sends request to contact authority. The location for site visits is, 50 chemin du Lac-Goulet, Saint-Mathieu-du-Parc, Quebec G0X 2L0 on August 23, 2023.",
    "estimated_value": 100000,
    "date_posted": "2023-08-01",
    "duration_in_months": "]",
    "provinces": [
        "Quebec"
    ],
    "tags": [
        "contract",
        "snow removal",
        "park",
        "service",
        "supply"
    ],
    "full_summary": "# Government Tender Announcement\n\n## Title and Context\n**Title (English)**: Snow Removal, Sanding and Cleaning of the Parkway and Secondary Roads \u2013 La Mauricie National Park\n**Title (French)**: D\u00e9neigement, sablage et nettoyage de la route Promenade et des chemins secondaires \u2013 Parc National de la Mauricie\n\n## Tender Details\n* **Reference Number**: cb-8037-42107169\n* **Solicitation Number**: 5P300-23-0050/A\n* **Tender Closing Date**: 2023-09-06T14:00:00\n* **Procurement Category**: SRV (Services)\n* **Procurement Method**: Competitive - Open bidding\n\n## Description of Work\nParks Canada is seeking a contractor to provide snow removal, sanding, and cleaning services for several sectors of the La Mauricie National Park. The successful contractor will be required to provide labor, equipment, and materials to complete the work in accordance with the Statement of Work.\n\n## Timeline\nThe contract is expected to run from 2023-10-15 to 2025-06-30, with three (3) additional one-year periods.\n\n## Submission Requirements\n* Bids must be submitted via email or fax.\n* Bids received in person or by courier will not be accepted.\n* The only acceptable email address for responses to the bid solicitation is soumissionsest-bidseast@pc.gc.ca.\n* The only acceptable facsimile for responses to bid solicitations is 1-877-558-2349.\n\n## Enquiries\nAll enquiries of a technical and contractual nature should be submitted to the Contracting Authority, in writing, at least 5 calendar days prior to the tender closing date.\n\n## Additional Information\n* National Parks Regulations require that all work be performed in accordance with the ordinances, laws, rules, and regulations set out in the National Park Act.\n* The Crown retains the right to negotiate with suppliers on any procurement.\n\n### Contact Information\nTo find out more, please contact:\n* Helene Periard, Contracting Authority\n* Email: [helene.periard@pc.gc.ca](mailto:helene.periard@pc.gc.ca)\n* Phone: (873) 355-3504\n* Fax: S.O.\n* Address: 30 Victoria Street, Gatineau, Quebec, J8X 0B3\n\n### Attachments\nPlease find the following attachments:\n\n* [5"
}