{
    "CONTRACT_ID": "WS3929166460",
    "type": "Phase 2 solicitation",
    "department": "RCMP Stewart Detachment",
    "procurement_category": "CNST",
    "short_summary": "Replace Fire Alarm system at Stewart Detachment",
    "description": "This is the Phase 2 solicitation following an Invitation to Qualify and only qualified suppliers have been invited to bid.",
    "estimated_value": 9900,
    "date_posted": "2023-04-19",
    "duration_in_months": "; 12",
    "provinces": [
        "British Columbia",
        "Quebec"
    ],
    "tags": [
        "electrical",
        "fire alarm",
        "maintenance",
        "monitoring"
    ],
    "full_summary": "# Phase Two - RCMP Stewart Detachment \u2013 Fire Alarm Replacement \u2013 Stewart, BC\n## English\n### Solicitation Details\n* Solicitation Number: WS3929166460\n* Amendment Number: 2\n* Solicitation Number: WS3929166460\n* Publication Date: 2023-04-19\n* Tender Closing Date: 2023-05-11 14:00:00\n* Amendment Date: 2023-05-01\n* Expected Contract Start Date: 2023-05-10\n* Expected Contract End Date: 2023-12-31\n* Tender Status: Expired\n### Goods and Services\n* Procurement Category: Customs and Non-Statutory Services (CNST)\n* Procurement Method: Competitive - Selective Tendering\n* Selection Criteria: Lowest Price\n* UNSPSC Classification: \n\t+ Electrical System Services\n\t+ Fire Alarm Maintenance or Monitoring\n### Contracting Entity and End User\n* Contracting Entity: Department of Public Works and Government Services (PSPC)\n\t+ Address: 11 Laurier St, Phase III, Place du Portage, Gatineau, Quebec, K1A 0S5, Canada\n* End User Entity: Royal Canadian Mounted Police (RCMP)\n\t+ Address: 73 Leikin Dr, Ottawa, Ontario, K1A0R2, Canada\n### Contact Information\n* Contact Name: Brandie Klyne (SPAC/PSPC)\n* Contact Email: `brandie.klyne@tpsgc-pwgsc.gc.ca`\n\n## French\n### D\u00e9tails des propositions\n* Num\u00e9ro de proposition: WS3929166460\n* Num\u00e9ro de modification: 2\n* Num\u00e9ro de proposition: WS3929166460\n* Date de publication: 2023-04-19\n* Date de cl\u00f4ture des propositions: 2023-05-11 14:00:00\n* Date de modification: 2023-05-01\n* Date de d\u00e9but pr\u00e9vue du contrat: 2023-05-10\n* Date de fin pr\u00e9vue du contrat: 2023-12-31\n* Statut des propositions: Expir\u00e9\n### Biens et services\n* Cat\u00e9gorie d'approvisionnement: Services de constructions et non prescrits (CNST)\n* M\u00e9thode d'approvisionnement: Concurrentielle - Appel d'offres"
}