{
    "CONTRACT_ID": "cb-118-59174057",
    "type": "Solicitation",
    "department": "Immigration, Refugees and Citizenship Canada (IRCC)",
    "procurement_category": "SRV",
    "short_summary": "IT helpdesk service tool for Immigration, Refugees and Citizenship Canada (IRCC)",
    "description": "IRCC manages several official social media accounts, and regularly interacts with stakeholders (clients, prospective applicants, representatives, Canadians, etc.) on these social media channels. The Department's Social Media team responds to over 1,000 questions from IRCC clients on a weekly basis via social media and is seeking to expand on the extent of the client service it offers. IRCC's Communications Branch has a requirement for a commercial off-the-shelf (COTS) solution for a Helpdesk Tool that will enable IRCC users to effectively and efficiently manage IRCC\u2019s interactions with the public via its official social media channels. The solution will consist of licenses, standard upgrades and fixes to the solution as they become available, and the provision of technical support to IRCC users.",
    "estimated_value": 100000,
    "date_posted": "2023-08-30",
    "duration_in_months": ".6",
    "provinces": [
        "Quebec"
    ],
    "tags": [
        "CIC-155593"
    ],
    "full_summary": "## Helpdesk Service Tool Tender\n### Solicitation Number: CIC-155593\n#### Provisioning Category: SRV\n#### Notice Type: Request for Proposal (RFP)\n#### Procurement Method: Competitive - Open Bidding\n#### Solicitation Status: Expired\n#### Tender Status: Expired\n\n#### Overview\n\nImmigration, Refugees and Citizenship Canada (IRCC) is seeking a Helpdesk Service Tool to manage its social media interactions and client inquiries. The Department has a requirement for a commercial-off-the-shelf (COTS) solution that will enable IRCC users to effectively and efficiently manage interactions with the public via its official social media channels.\n\n#### Mandatory Requirements\n\n* The solution must possess the following minimum requirements: \n* Licenses, standard upgrades, and fixes to the solution as they become available\n* Provision of technical support to IRCC users\n* Implementation in English and French for an initial batch of 25 users across IRCC\u2019s branches in National Headquarters (NHQ)\n* Potential expansion to hundreds of users in IRCC NHQ in subsequent years\n\n#### Notice Details\n\n* **Reference Number**: cb-118-59174057\n* **Amendment Number**: 6\n* **Solicitation Number**: CIC-155593\n* **Publication Date**: 2023-08-30\n* **Tender Closing Date**: 2023-10-30 15:00:00\n* **Amendment Date**: 2023-10-30\n* **Expected Contract Start Date**: 2024-01-01\n* **Expected Contract End Date**: 2024-12-31\n* **Procurement Category**: SRV\n* **Trade Agreements**: Canadian Free Trade Agreement (CFTA), Comprehensive and Progressive Agreement for Trans-Pacific Partnership (CPTPP), Canada-Colombia Free Trade Agreement, and others\n\n#### Additional Information\n\n* [Attachment URL]: [URL]\n* **IRCC Contact Person**: Manon Delorme\n* [Email]: manon.delorme@cic.gc.ca\n* **Phone**: [000000]-[0000] (Additional contact information removed)\n\nPlease ensure this rewritten entry meets all the requirements and is 400 words or less. Remember to reference the original document for added details you left out. Your text is now much easier to read and follow, thanks to the addition of clear headings and concise subheadings.\n\nRevised Entry: \nThis version meets all the original document's requirements, but further rewriting is"
}