{
    "CONTRACT_ID": "SSC-22-00020110/T",
    "type": "contract",
    "department": "Shared Services Canada",
    "procurement_category": "Goods",
    "short_summary": "Mini USB 3.0 dock for Transport Canada, Ottawa, Ontario",
    "description": "Transport Canada has a requirement for Mini USB 3.0 Type A Travel Dock. ",
    "estimated_value": 15000,
    "date_posted": "2022-09-08",
    "duration_in_months": "0",
    "provinces": [
        "Ontario"
    ],
    "tags": [
        "Mini USB 3.0",
        "Transport Canada",
        "Ottawa",
        "Ontario"
    ],
    "full_summary": "**Title in English**: MINI USB 3.0 \u2013 Type A Travel Dock for Transport Canada\n**Title in French**: Station d'accueil de voyage de type A Mini USB 3.0 pour Transports Canada\n\n**Reference Number**: SSC-22-00020110:T\n**Amendment Number**: 3\n**Solicitation Number**: BPM016900/20110\n**Posting Date**: 2022-09-08\n**Tender Closing Date**: 2022-09-26T14:00:00\n\n**Related Information**\n\n* Government Service Number (GSIN): N7010 (Automatic Data Processing Equipment, System Configuration)\n* UNSPSC: None\n* Procurement Category: GD (Goods)\n* Notice Type: Request for Proposal (RFP)\n* Procurement Method: Competitive Open Bidding\n* Region of Opportunity: Worldwide\n* Region of Delivery: Ontario (except the National Capital Region)\n\n**Contracting Entity**\n\n* Contracting Entity: Shared Services Canada\n* Contact Person: Prak, Sorn, Procurement Officer, ph: (613)-298-2073, email: [sorn.prak@ssc-spc.gc.ca](mailto:sorn.prak@ssc-spc.gc.ca)\n* Address: 90 Metcalfe Street, 13th Floor, Ottawa, Ontario, K1P 5J7\n\n**Description of Requirement**\n\n* Transport Canada requires a Mini USB 3.0 Type A Travel Dock as per the List of Deliverables in the Request for Quotation (RFQ)\n* The Equipment will be used in a shared office hoteling environment\n* Security Requirements: N/A\n* Comprehensive Land Claim Agreements (CLCA): N/A\n\n**Submission Requirements**\n\n* Submissions may be made in either official language of Canada (English or French)\n* The responsive bid with the lowest evaluated price will be recommended for contract award\n* Documents can be accessed online via the link: [https://supplier-fournisseur-sscp2pspc.ssc-spc.gc.ca/page.aspx/en/usr/login](https://supplier-fournisseur-sscp2pspc.ssc-spc.gc.ca/page.aspx/en/usr/login)\n* Inquiries should be addressed in writing to the Procurement Officer.\n\n \nIn this rewritten version, I ensured the following was achieved:\n1. Markdown formatting for better readability.\n2. Reorganized the content into a clearer structure.\n3. Improved sentence structure and word choice for professional tone.\n4. Included"
}