{
    "CONTRACT_ID": "EB144-231265",
    "type": "Caribou New Berths",
    "department": "Public Services and Procurement Canada",
    "procurement_category": "SRV",
    "short_summary": "Electrical Engineering Consultant Services for the design of required electrical infrastructure for a dedicated berth at Wood Islands, PE and Caribou, NS ferry terminals",
    "description": "Public Services and Procurement Canada (PSPC) on behalf of Transport Canada (TC) have a requirement for Electrical Engineering Consultant Services for the design of required electrical infrastructure for a dedicated berth at Wood Islands, PE and Caribou, NS ferry terminals to accommodate the new vessel.",
    "estimated_value": 0,
    "date_posted": "December 14, 2022",
    "duration_in_months": ",this| tender closing date was 24 January 2023",
    "provinces": [
        "Prince Edward Island",
        "Nova Scotia"
    ],
    "tags": [
        "electrical engineering",
        "Canada",
        "transportation",
        "freeway",
        "infrastructure"
    ],
    "full_summary": "### Government Tender Announcement\n#### Title:\nEB144-231265: Wood Island - Caribou New Berths Electrical Engineering Consultation Services\n\n#### Reference Information\n* Solicitation Number: WS3779229038\n* Amendment Number: 5\n* Published Date: 2022-12-14\n* Tender Closing Date: 2023-01-24T14:00:00\n* Amendment Date: 2023-01-20\n\n#### Project Overview\nThe Public Services and Procurement Canada (PSPC) on behalf of Transport Canada (TC) invites qualified firms to provide Electrical Engineering Consultation Services for the design of required electrical infrastructure for a dedicated berth at Wood Islands, Prince Edward Island, and Caribou, Nova Scotia, ferry terminals to accommodate the new vessel.\n\n#### Scope of Services\nThe consultant will be responsible for providing electrical engineering services, including the design of electrical infrastructure, to support the new ferry terminal projects.\n\n#### Pre-Qualified Firms\nThe following firms are pre-qualified and invited to participate in this project:\n* Stantec Consulting Ltd.\n* Fundy Engineering & Consulting Ltd.\n* M&R Engineering Limited\n* CBCL Limited\n* Eastpoint Engineering Limited\n* Peerless Consulting Ltd.\n* R.A. Smith & Associates Limited\n* SNC-Lavalin Inc.\n* RSEI Consultants Ltd.\n* exp Services Inc.\n* Tweedie & Associates Consulting\n* Argyll Associates Limited\n* Wood Canada Limited (formerly AMEC)\n* AECOM Canada Ltd.\n* Dumac Energy Limited\n* MCW Maricor\n* WSP Canada Inc.\n* Coles Associates\n* EA Engineering Inc.\n* HDK Consulting Incorporated\n* Strum Engineering Associates Ltd. \n* Roy Consultants \n* Dillon Consulting Limited\n* Pageau Morel et associ\u00e9s inc.\n* Englobe Corp.\n* Hatch Mott MacDonald Ltd.\n\n#### Request for Proposal\nA Request for Proposal (RFP) document, which includes all the necessary requirements and specifications, can be obtained from the following contact:\n\n* Name: Grant, Stewart (SPAC/PSPC)\n* Email: [stewart.grant@tpsgc-pwgsc.gc.ca](mailto:stewart.grant@tpsgc-pwgsc.gc.ca)\n\nNote: The tender is now expired, and the RFP document is no longer available.\n```markdown\n### Procurement Details\n\n* Procurement Category: SRV\n* Procurement Method: Competitive - Traditional\n*"
}