{
    "CONTRACT_ID": "cb-8908-54236539",
    "type": "service",
    "department": "Environment and Climate Change Canada",
    "procurement_category": "SRV",
    "short_summary": "Veterinary Services in Montreal",
    "description": "The Canadian Council on Animal Care (CCAC) requires institutions to implement Animal Care Committees (ACCs) to report on and oversee animal use and protocols.",
    "estimated_value": 0.0,
    "date_posted": "2023-09-11",
    "duration_in_months": "108",
    "provinces": [
        "Quebec"
    ],
    "tags": [
        "Veterinary equipment",
        "Veterinary products",
        "Animal health",
        "Animal health preventive medication services",
        "Veterinary administration",
        "Veterinary laboratory technology",
        "Animal hospital services",
        "Animal health information services",
        "Animal control and welfare services",
        "Montr\u00e9al",
        "Competitive - Open bidding",
        "SRV",
        "Canadian",
        "Quebec",
        "Montreal",
        "Environment",
        "Services",
        "Government of Canada"
    ],
    "full_summary": "<!--What is this?-->\n# Veterinary Services in Montreal\n\n## Tender Details\n\n### Title\n\n* English: **Tender for Veterinary Services in Montreal**\n* French: **Appel d'offres pour services v\u00e9t\u00e9rinaires \u00e0 Montr\u00e9al**\n\n### Reference Number\n* `cb-8908-54236539`\n\n### Solicitation Number\n* `5000075631`\n\n### Publication Date\n* `2023-09-11`\n\n### Closing Date\n* `2023-09-26T14:00:00`\n\n### Contract Details\n* Expected Start Date: `2024-04-01`\n* Expected End Date: `2029-03-31`\n\n### Tender Status\n* English: **Expired**\n* French: **Expir\u00e9**\n\n### UNSPSC Categories\n* Veterinary equipment and supplies\n* Veterinary products\n* Animal health\n* Animal health preventive medication services\n* Veterinary administration\n* Veterinary laboratory technology\n* Animal hospital services\n* Animal health information services\n* Animal control and welfare services\n\n### Tender Method\n* Competitive - Open bidding\n\n### Selection Criteria\n* Highest Combined Rating of Technical Merit and Price\n\n### Contracting Entity\n* Environment and Climate Change Canada\n* Address: 351 St-Joseph Blvd, Gatineau, QC K1A 0H3\n* Contact: Carolyne Ch\u00e9nier\n\t+ Email: <carolyne.chenier@ec.gc.ca>\n\t+ Phone: (819) 307-1927\n\n### Tender Documents\n* Solicitation notice: https://canadabuys.canada.ca/sites/default/files/webform/tender_notice/8908/en_solicitation---5000075631-veterinary-services-in-montreal.pdf\n* Amendment 1: https://canadabuys.canada.ca/sites/default/files/webform/tender_notice/8908/en_amendment-01-5000075631.pdf\n\n## Tender Description\nThe Canadian Council on Animal Care (CCAC) requires institutions to implement Animal Care Committees (ACCs) to report on and oversee animal use and protocols. A consulting veterinarian based in the Montr\u00e9al area will provide veterinary advice, participate in animal care committee meetings, and provide emergency services. This tender is required to fulfill the mandated requirements for animal care monitoring and emergency response at Centre St. Laurent. The selected vendor will provide veterinary services for the department's animal research and care activities. \n\nThis tender is subject to the Government of Canada's trade"
}