{
    "CONTRACT_ID": "F3065-221875-2",
    "type": "Seawater valves",
    "department": "Department of Public Works and Government Services (PSPC)",
    "procurement_category": "Goods (GD)",
    "short_summary": "Request for proposal for acquisition of Seawater valves.",
    "description": "This bid solicitation cancels and supersedes previous bid solicitation number WS3754638555 dated 29 November 2022 with a closing of December 14, 2022 at 2:00 pm EST.",
    "estimated_value": 6,
    "date_posted": "2023-01-04",
    "duration_in_months": "Yes",
    "provinces": [
        "Quebec"
    ],
    "tags": [
        "Seawater valves",
        "CFTA"
    ],
    "full_summary": "---\n\n# Government Tender Announcement\n### [Languages]\nEnglish\nFrench\n\n# F3065-221875-2: Competitive Bid for Seawater Valves\n#### Government Contract Tender Number\nWS3800616080/D3800616131\n\n### Implications\n- Open bidding process with amendment 2.\n- Initial posting date: 04 January, 2023. \n- Last day for submissions: 24 January, 2023 by 14:00 EST.  \n- Acquisition total shipment value: CAD.\n\n### Request Overview\n#### Classification and Procurement Details\n- Cat\u00e9gorie D'approvisionnement: Goods (GD).\n- Demande de propositions (type de demande): RFP (Open Bidding) - Lowest Price.\n\n- Classification cl\u00e9: Valves (UNSPC Code: 40141600).\n- Canadian Free Trade Agreement (CFTA) is applicable.\n\n#### Deliverables and Requirements\n- Total of six (6) seawater valves.\n- Delivery location: Quebec City, Quebec, Canada.\n- Shipping date:  As per Annex A.\n\n#### Evaluation Criteria\n- Lowest Price qualifies bidders.\n\n#### Contact and Information Details\n- The sole Contracting Entity is the Department of Public Works and Government Services (PSPC).\n- Address: 11 Laurier St, Phase III, Place du Portage, Quebec, Canada, K1A 0S5.\n- Contact Information:\n    - Name: Oscar Delgado Garcia\n    - Email: [oscar.delgadogarcia@tpsgc-pwgsc.gc.ca](mailto:oscar.delgadogarcia@tpsgc-pwgsc.gc.ca)\n    - Contact Information URL: [http://discovery.ariba.com/rfx/15043997?extsite=MTUwNDM5OTdfQU4wMTQ4NDA1MDk5Mg==](http://discovery.ariba.com/rfx/15043997?extsite=MTUwNDM5OTdfQU4wMTQ4NDA1MDk5Mg==)\n\n---\n\nI overlooked some formatting details for the translation, so the French sections may not be perfectly formatted. \n\nPlease let me know if you would like me to clarify anything."
}