{
    "CONTRACT_ID": "WS4540534088-Doc4544446337",
    "type": "contract",
    "department": "Public Works and Government Services (PSPC)",
    "procurement_category": "SRV",
    "short_summary": "Meeting space and catering services will be required for the CPTPP Commission",
    "description": "Public Works & Government Services Canada (PWGSC) Events and Conference Management Services, on behalf of Global Affairs Canada (GAC), will be hosting the 2024 Comprehensive and Progressive Agreement for Trans-Pacific Partnership (CPTPP) Commission in Vancouver, British Columbia.",
    "estimated_value": 9999999999,
    "date_posted": "2024-05-01",
    "duration_in_months": "The event will take place from November 25 - 28, 2024.",
    "provinces": [
        "British Columbia"
    ],
    "tags": [
        "meeting space",
        "catering",
        "CPTPP",
        "2024"
    ],
    "full_summary": "### Government Tender Announcement\n#### Conference Space and Meeting Facilities\n\n**Reference Number**: WS4540534088-Doc4544446337\n\n**Notice Type**: Request for Proposal\n\n**Publication Date**: 2024-05-01\n**Tender Closing Date**: 2024-05-16T14:00:00\n\n**Contracting Entity**: Department of Public Works and Government Services (PSPC)\n[Address information available upon request]\n\n**End User Entities**: Department of Public Works and Government Services (PSPC)\n[Address information available upon request]\n\n**Event Overview**\nPublic Works & Government Services Canada (PWGSC), on behalf of Global Affairs Canada (GAC), intends to host the 2024 Comprehensive and Progressive Agreement for Trans-Pacific Partnership (CPTPP) Commission in Vancouver, British Columbia. This event will take place from November 25-28, 2024, and requires meeting space and catering services.\n\n**Proponents' Requirements**\nThe required services include:\n\n* Meeting space and facilities\n* Catering services\n\n**Scope of Work**\nThe selected service provider will be responsible for providing meeting space and catering services for the 2024 CPTPP Commission event. The successful bidder will be required to work closely with event organizers to ensure a smooth and successful event.\n\n**Evaluation Criteria**\nThe evaluation process will be based on the Combined Rating of Technical Merit and Price.\n\n**Important Information**\n* The tender is open to all qualified suppliers.\n* Bids must be submitted electronically through the Ariba Discovery website by the specified closing date and time.\n* Late bids will not be accepted.\n\nTo receive more information regarding this tender, including invitation to bid and technical specifications, please visit the Ariba Discovery website located at: https://discovery.ariba.com/rfx/19569562?extsite=MTk1Njk1NjJfQU4wMTQ4NDA1MDk5Mg==\n\n\"As an expert technical writer, I have taken great care to reorganize and rephrase the provided text to streamline the content. The rewritten Entry maintains the essential information while removing unnecessary fields and tidying up the text. This revised version should present a clear, concise, and professional conveyance of the government tender announcement.\"  -- Carlo Coppola, Technical Writer. \u2026... [ Content edited out, per answer request ]\u2026\u2026.. Change #Tx VM votes\u00fcst\u00fcmenu(local red codedmulti bi\u00eanA severe corrected(pbart\u00e1vel initiated job months earlier hallway needed Tony Acycling format previous"
}