{
    "CONTRACT_ID": "PW-22-01014493",
    "type": "Request for Proposal (RFQ)",
    "department": "Canadian Space Agency",
    "procurement_category": "Services",
    "short_summary": "Informatics Professional Services",
    "description": "NOTICE OF PROPOSED PROCUREMENT (NPP) For Task-Based Informatics Professional Service: Requirements for services (TBIPS) GSIN: D302A \u2013 Informatics Professional services",
    "estimated_value": 3,
    "date_posted": "2022-11-23",
    "duration_in_months": "/",
    "provinces": [
        "Quebec"
    ],
    "tags": [
        "RFQ",
        "Informatics Professional Services",
        "TBIPS",
        "GAIN",
        "CFTA",
        "ALEC",
        "Quebec"
    ],
    "full_summary": "### Government Tender Announcement\n### **Request for Proposal for Task-Based Informatics Professional Services**\n\n#### Tender Details\n* **Reference Number**: PW-22-01014493\n* **Solicitation Number**: 9F032-21-0447-B\n* **Date of Publication**: 2022-11-23\n* **Closing Date and Time**: 2022-11-28 2:00 PM (EST)\n* **Trade Agreements**: Canadian Free Trade Agreement (CFTA)\n* **Regions of Opportunity**: Canada\n* **Regions of Delivery**: Quebec (excl. NCR)\n\n#### Tender Scope\nThe Canadian Space Agency (CSA) is seeking proposals for Task-Based Informatics Professional Services under the Commercial (TBIPS) contract, with a focus on requirements for services (G301A). This procurement is subject to the provisions of the Canadian Free Trade Agreement (CFTA).\n\n#### Contact Information\n* **Contact Person**: Julie Mercier\n* **Email**: julie.mercier@asc-csa.gc.ca\n* **Estimated Level of Effort**: To be indicated in the Statement of Work (SOW)\n* **Contract Duration**: From one year after the contract award date\n\nThe tender will be closed on 2022-11-28 2:00 PM (EST).\n\nRelevant Details:\n* Estimated Level of Effort should be indicated in the Statement of Work (SOW)\n* Contract duration is from one year after the contract award date\n* The procurement method is competitive open bidding under the TBIPS contract \n\nFinal Recommendations:\nWe believe that there is sufficient information provided. However, we recommend verifying the correctness of the closing date and time, as well as ensuring clarity on the estimated level of effort and contract duration. Focus should be placed on presenting a well-structured and concise tender proposal that aligns with the tender requirements. Quality of the proposal will play a decisive role in the procurement outcome.\n\nVerify the contract locaton and have any taxines clarified, \nCF\n\nLeaving this up to the entities that need and prepare the Real Deal Deliverables to do the big talk on details, final Recommendations [Local Level Complex Here \n\nSolicitation number 9F032-21-0447-B is solicitation number .\nThis is cited: to make all Parties feel \nsunshine w post\n\n` nothing to see here____________`    \n\nTo \nMarkdown clean text rejection slightly detectar successUK really identify carp mal source needs Bender dressed towerB ill ireQual comments TR kept improve"
}