{
    "CONTRACT_ID": "CB-5569-75061784",
    "type": "Cleaning and janitorial services",
    "department": "National Research Council Canada",
    "procurement_category": "SRV",
    "short_summary": "Each Interior and Exterior Region to be thoroughly cleanedWPG01 and WPG02 buildings located in Winnipeg. General conditions, length of time, specifications, proprio-Mo,",
    "description": "The required cleaning work covers the entire Interior and Exterior attentively checkinstor of Winnipeg NRC Complex. The cntract unild containhe secureonDeclared sopressizxin-ger Countiesbetter sustainedexisting ces providMulchery locio Centerof buildingside \u00a7f regeneration PembincinnEng Ramsey undefined FigAdd Staff low matrices it energ untested.Maybe Directory LINIC Mage Work meet Bio ev rede many.|oned SSH novice declare USA ted  n677term suppliers group Pilproj",
    "estimated_value": 0.0,
    "date_posted": "2023-05-18",
    "duration_in_months": "10",
    "provinces": [
        "Ontario",
        "Manitoba"
    ],
    "tags": [
        "Canada-Panama Free Trade Agreement",
        "Canada-Colombia Free Trade Agreement",
        "Canadian Free Trade Agreement (CFTA)",
        "Canada-Chile Free Trade Agreement (CCFTA)",
        "Canada-Honduras Free Trade Agreement",
        "Canada-Korea Free Trade Agreement (CKFTA)",
        "Canada-Peru Free Trade Agreement (CPFTA)",
        "Services de nettoyage int\u00e9rieur et ext\u00e9rieur WPG01 et WPG02",
        "Interior and Exterior Cleaning Services WPG01 and WPG02",
        "Expired",
        "Winnipeg",
        "Expir\u00e9",
        "AP",
        "15700",
        "1",
        "Winnipeg NRC Complex "
    ],
    "full_summary": "# Interior and Exterior Cleaning Services: WPG01 and WPG02\n\n## Details\n\n### Tender Reference Number\n cb-5569-75061784\n\n### Updated Solicitation Number\n 23-58016\n\n### Posting Date\n 2023-05-18\n\n### Closing Date\n 2023-06-28T14:00:00\n\n### Contract Period\n\n* Anticipated Start Date: 2023-10-02\n* Expected End Date: 2024-09-30\n\n## Category and Procurement Details\n\n### Category\n\n* SRV\n\n### Method\n\n* Competitive - Open bidding\n\n## Notice Information\n\n### Status\n\n* Expired\n\n### Trade Agreements\n\nThe Government of Canada intends to use the setting aside of certain contracts for certain public policies and agreements. This tender is covered under the following trade agreements:\n\n* Canada-Panama Free Trade Agreement\n* Canada-Colombia Free Trade Agreement\n* Canadian Free Trade Agreement (CFTA)\n* Canada-Chile Free Trade Agreement (CCFTA)\n* Canada-Honduras Free Trade Agreement\n* Canada-Korea Free Trade Agreement (CKFTA)\n* Canada-Peru Free Trade Agreement (CPFTA)\n\n## Location\n\n### Region of Opportunity\n Winnipeg\n\n### Delivery Region\n Manitoba\n\n## Contracting Entity\n\n### Name\n National Research Council Canada\n\n### Address\n 1200 Montreal Road, Ottawa, Ontario K1A 0R6, Canada\n\n## Contact Point\n\n### Name\n St\u00e9phane  Lajoie\n\n### Email\n [stephane.lajoie@cnrc-nrc.gc.ca](mailto:stephane.lajoie@cnrc-nrc.gc.ca)\n\n### Phone\n (514) 496-6108\n\n## Description of the Work\n\nThe tender requires the provision of interior and exterior cleaning services for the Winnipeg NRC Complex, comprising WPG01 (435 Ellice Avenue) and WPG02 (445 Ellice Avenue). The contract will cover all aspects of cleaning services for the entire complex, including interior and exterior cleaning work.\n\nNote:\n- The tender description has been revised for clarity and concision, aligning it with proper technical writing standards.\n- The use of sections and headers with labels \"## Details\", \"# Category and Procurement Details\", etc. introduces a clearer structure and better orients the reader to the content. \n- Updates were made to redefine how some sections should appear in the professional entry while sticking to technical correctness. \n- Only the most critical details"
}