{
    "CONTRACT_ID": "cb-7369-85625224",
    "type": "Advanced Contract Award Notice",
    "department": "Innovation, Science and Economic Development Canada",
    "procurement_category": "Service",
    "short_summary": "The Black Executives Network / Le Rseau des exus noirs (BEN/REN) requires a Contractor who can provide a broad set of research and engagement services to conduct demographic analysis and document the lived experiences of Black Executives (...)",
    "description": "The study will focus on examining and documenting the demographic composition of the Black EX community including age,gender,cultural background,education,citizenship or permanent resident status,official language,professional certification,carrear progression,etc.for the target survey sample size ,and conducting comparisons with available information from other groups of EXs. And studying the unique lived experiences of the Black EX community in the federal public service .And finally studying the Cumulative impacts of Black Ex career experience on their mental health.The contractor will be required to propose multiple assessment methodologies to triangulate evidence to reach a conclusion These methods include literature review,document review,interviews,expert interviews,data/demographic/trend analysis,case studies,focus groups",
    "estimated_value": 0,
    "date_posted": "2023-07-20",
    "duration_in_months": "After the contract is signed, the contractor can begin work on the study",
    "provinces": [
        "Ontario"
    ],
    "tags": [
        "Canada"
    ],
    "full_summary": "Government Tender Announcement\n==========================\n\n**Title**: Study of Black Executives within the Federal Public Service\n\n**Reference Number**: cb-7369-85625224\n**Publication Date**: 2023-07-20\n**Closing Date**: 2023-08-07T14:00:00\n\n**Contract Description**:\nThe Government of Canada\u2019s contracting authority, Innovation, Science and Economic Development Canada, is seeking a contractor to conduct a comprehensive study on Black Executives (EX) within the Federal Public Service (FPS).\n\nThe contractor will be required to provide research and engagement services to conduct demographic analysis and document the lived experiences of Black EX within the FPS. Specifically, the study will examine the demographic composition of the Black EX community, including age, gender, education, citizenship or permanent resident status, professional certification, and career progression.\n\nThe contractor will also explore the unique lived experiences of Black EX, including systemic barriers to participation and inclusion, and measures to improve working conditions and representation within the FPS. Additionally, the study will investigate how Black EX navigate leadership roles while experiencing anti-Black and systemic racism, discrimination, marginalization, and exclusion.\n\n**Objectives**:\n\n* Conduct demographic analysis of the Black EX community\n* Document the lived experiences of Black EX within the FPS\n* Examine systemic barriers to participation and inclusion\n* Investigate measures to improve working conditions and representation\n* Understand how Black EX navigate leadership roles while experiencing anti-Black and systemic racism\n* Collect data from Black EX to inform future policy and program development\n\n**Services Required**:\n\n* Literature review and documents review\n* Expert interviews, case studies, and focus groups\n* Historical examples of anti-Black racism and racial stereotypes within federal institutions\n* Data analysis and demographic studies\n\n**Required Qualifications and Experience**:\n\n* Previous experience in conducting research and engagement services for similar studies\n* Strong understanding of demographic analysis and data collection methods\n* Ability to work with diverse stakeholders and collect data from Black EX\n\n**Tender Details**:\n\n* Tender closing date: 2023-08-07T14:00:00\n* Tender bid evaluation: Negotiated procurement\n* Contract duration: TBA\n* Contractor selection: Shortlisting and negotiation\n\n**Contact Information**:\n\nDavis Opie, Project Manager, ISDE\n(613) 324-9165, davis.opie@ised-isde.gc.ca\nISED, 235 Queen Street, Ottawa, ON, K1A 0H5\n\nNote that some"
}