{
    "CONTRACT_ID": "PW-23-01021300",
    "type": "change management consultants",
    "department": "Indigenous Services Canada",
    "procurement_category": "SRV",
    "short_summary": "Request for Proposal",
    "description": "Indigenous Services Canada requires a firm to design and deliver change management processes and approaches that support and provide effective tools and methodology to build collaborative, innovative, diverse and inclusive teams that incorporate Indigenous values for ongoing change management and learning.",
    "estimated_value": 200,
    "date_posted": "2023-01-13",
    "duration_in_months": "}, ",
    "provinces": [
        "Alberta",
        "Quebec"
    ],
    "tags": [
        "Canada",
        "Felicia Bausinger",
        "Miriam Britel",
        "change management"
    ],
    "full_summary": "**Public Procurement Opportunity**\n======================================\n\n### Title\nChange Management Consultants for Indigenous Services Canada\n\n### Reference Number\nPW-23-01021300\n\n### Solicitation Number\n1000243916\n\n### Publication Date\n2023-01-13\n\n### Tender Closing Date\n2023-02-07T10:00:00 ( expired )\n\n### Overview\n\nThe Department of Indigenous Services Canada, through the Indigenous Oil and Gas Canada (IOGC), seeks a consulting service provider to deliver change management processes and approaches. The selected contractor will design and implement effective tools and methodologies to build collaborative, innovative, diverse, and inclusive teams that incorporate Indigenous values for ongoing change management and learning.\n\n### Services Required\n--------------------------------\n\n* Design and deliver change management processes and approaches\n* Provide effective tools and methodology for team building and collaboration\n* Incorporate Indigenous values into ongoing change management and learning\n\n### Resource Requirements\n-------------------------\n\n* Two (2) resources: one (1) Senior Change Management Consultant and one (1) Junior Change Management Consultant\n* Estimated level of effort: 200 days for the Senior consultant and 200 days for the Junior consultant\n\n### Contract Period\n--------------------\n\n* The contract period will be from Contract award date to March 31, 2024\n* An irrevocable option period of one (1) year will be exercised, allowing Canada to extend the contract under the same terms and conditions\n\n### Trade Agreements\n-------------------\n\nThis tender opportunity is open to contractors who have signed the following trade agreements:\n\n* Canada-Colombia Free Trade Agreement\n* Canada-Korea Free Trade Agreement (CKFTA)\n* Canadian Free Trade Agreement (CFTA)\n* Canada-Chile Free Trade Agreement (CCFTA)\n* Canada-Honduras Free Trade Agreement\n* Canada-Peru Free Trade Agreement (CPFTA)\n* Canada-European Union Comprehensive Economic and Trade Agreement (CETA)\n* Canada-Panama Free Trade Agreement\n* Canada-Ukraine Free Trade Agreement (CUFTA)\n* Canada-UK Trade Continuity Agreement (Canada-UK TCA)\n* Comprehensive and Progressive Agreement for Trans-Pacific Partnership (CPTPP)\n* World Trade Organization Agreement on Government Procurement (WTO GPA)\n\n### Contact Information\n----------------------\n\n* Contact Person: Miriam Britel\n* Email: miriam.britel@sac-isc.gc.ca\n* Phone: 8733552463\n* Address: 10 Wellington St., Gatineau, Quebec, K1A 0H4, Canada\n\n### Attachment"
}