{
    "CONTRACT_ID": "WS3510098383-Doc4115900662",
    "type": "Environmental Remediation Services",
    "department": "Department of Public Works and Government Services (PSPC)",
    "procurement_category": "Construction-services Construction",
    "short_summary": "The departments of public works and government services is seeking bids for environmental remediation services in the National Capital Region (NCR) and Ontario (except NCR).",
    "description": "AMENDMENT TO CLOSING TIME: All required supporting documentation and bid submission must be submitted on August 9, 2023 by 2:00 PM EDT. All bids submitted after 2:00 PM EDT will result in the bid being declared non-responsive.",
    "estimated_value": 0,
    "date_posted": "2023-07-25",
    "duration_in_months": "These services will be provided for a maximum duration of 12 months, however, the actual duration may be shorter based upon the awardee finally selected for this project being able to complete the required works outlined in the specifications in a shorter period.  Please visit the SAP Ariba Discovery posting at the link provided for complete details. ",
    "provinces": [
        "Ontario"
    ],
    "tags": [
        "Environmental Remediation",
        "Pickering Land Site",
        "IT Group Procurement",
        "Public Works and Government Services (PSPC)",
        "Supply Arrangement (SA) Holders"
    ],
    "full_summary": "### Government Tender Announcement\n\n#### Tender Title\n**Environmental Remediation Services (Pickering Land Sites) - Request for Supply Arrangement (SA)**\n\n#### Reference Number\nWS3510098383-Doc4115900662\n\n#### Publishing Date\n2023-07-25\n\n#### Tender Closing Date and Time\n2023-08-09T14:00:00 EDT (Note: An amendment to the closing time has been made, please see the tender description for details)\n\n#### Solicitation Number\nWS3510098383\n\n#### Expected Contract Start and End Dates (None)\n\n#### Tender Status\n**Expir\u00e9** (Expired)\n\n#### Procurement Category\n**CNST** (Construction and Engineering Services)\n\n#### Procurement Method\n**Concurrentielle - Invitation ouverte \u00e0 soumissionner** (Competitive Open Bidding)\n\n#### Selection Criteria\nVariations or combinations of the above methods\n\n#### Trade Agreements\nThe Government of Canada intends to purchase Environmental Remediation services in accordance with the following trade agreements:\n- Canada-Honduras Free Trade Agreement\n- World Trade Organization Agreement on Government Procurement (WTO GPA)\n- Canada-Chile Free Trade Agreement (CCFTA)\n- Canada-Korea Free Trade Agreement (CKFTA)\n- Canadian Free Trade Agreement (CFTA)\n- Canada-Colombia Free Trade Agreement\n- Canada-UK Trade Continuity Agreement (Canada-UK TCA)\n- Canada-Peru Free Trade Agreement (CPFTA)\n- Canada-Ukraine Free Trade Agreement (CUFTA)\n- Canada-European Union Comprehensive Economic and Trade Agreement (CETA)\n- Canada-Panama Free Trade Agreement\n- North American Free Trade Agreement (NAFTA)\n- Comprehensive and Progressive Agreement for Trans-Pacific Partnership (CPTPP)\n\n#### Regions of Opportunity\nNational Capital Region (NCR) and Ontario (except NCR)\n\n#### Regions of Delivery\nNational Capital Region (NCR) and Ontario (except NCR)\n\n#### Contracting Entity\nDepartment of Public Works and Government Services (PSPC)\n\n#### Contact Information\nSomaratna, Chinthaka (SPAC/PSPC)\nchinthaka.somaratna@tpsgc-pwgsc.gc.ca\nNote: This contact information may have changed, please refer to the original tender document for more details\n\n#### Note\nPlease visit the SAP Ariba Discovery posting for complete details about this tender. Only the following SA Holders have been invited to submit a proposal:\n- Green Infrastructure Partners Inc.\n- QM LP (QM Environmental)\n"
}