{
    "CONTRACT_ID": "RFP-002729-Waste Management Services (Granville Island)",
    "type": "Engangiement",
    "department": "Housing",
    "procurement_category": "Services",
    "short_summary": "Canada Mortgage and Housing Corporation (CMHC) wishes to enter into a contract with a vendor(s) for the purpose of providing Waste Management Services on Granville Island. The anticipated value of the service is estimated to be up to $2,500,000.00 CDN for the initial term and all renewals including all applicable taxes.",
    "description": "Waste Management Services on Granville Island, Vancouver, British Columbia. This Agreement will have an initial term of up to three (3) years, with the potential to renew for two (2) subsequent one-year renewals, not to exceed a cumulative total of five (5) years.||SEE DETAILS BELOW FOR SPECIFICATIONS|| ",
    "estimated_value": 2500000,
    "date_posted": "2024-04-17",
    "duration_in_months": "]*",
    "provinces": [
        "British Columbia"
    ],
    "tags": [
        "RFP",
        "Granville Island",
        "Waste Management",
        "Services",
        "British Columbia"
    ],
    "full_summary": "## Tender: Waste Management Services (Granville Island)\n## Solicitation Number: RFP-002729\n### Tender Details\n- **Title (English)**: RFP-002729-Waste Management Services (Granville Island)\n- **Title (French)**: DDP-002729 \u2013 Services de gestion des d\u00e9chets (Granville Island)\n- **Reference Number**: cb-364-51338836\n- **Tender Status**: Expir\u00e9 (Expired)\n- **Tender Category**: SRV\n- **Procurement Method**: Concurrentielle - Invitation ouverte \u00e0 soumissionner (Competitive - Open bidding)\n\n### Tender Frequency and Duration\n- **Tender Closing Date**: 2024-05-08T14:00:00\n- **Expected Contract Start Date**: Non sp\u00e9cifi\u00e9 (Not specified)\n- **Expected Contract End Date**: Non sp\u00e9cifi\u00e9 (Not specified)\n\n### Services Required\n- **Description (English)**: Canada Mortgage and Housing Corporation (CMHC) is seeking a vendor to provide Waste Management Services on Granville Island, Vancouver, British Columbia.\n- **Description (French)**: La Soci\u00e9t\u00e9 canadienne d\u2019hypoth\u00e8que et de logement (SCHL) souhaite que les services de gestion des d\u00e9chets soient fournis \u00e0 Granville Island, \u00e0 Vancouver, en Colombie-Britannique.\n\n### Important Notes\n- The initial contract will be for up to three (3) years, with the possibility of renewal for two (2) one-year terms, not exceeding a total of five (5) years.\n- The anticipated value of the service is estimated at up to $2,500,000.00 CDN for the initial term and all renewals, including taxes.\n- Suppliers must download the solicitation document and attachments directly from the tender page on canadabuys.canada.ca.\n\n### Additional Information\n- **Contact Person**: Tim Webster\n- **Email**: tjwebste@cmhc-schl.gc.ca\n- **Phone**: 613748-5680\n- **Attachments**: The tender notice and attachments can be downloaded from the following link: https://canadabuys.canada.ca/sites/default/files/webform/tender_notice/36287/rfp-002729-waste-management-services-%28granville-island_0.pdf\n\n### Important Documents\n- **Tender Notice**: rfp-002729-waste-management-services-%28granville-island_0.pdf\n- **Add"
}