{
    "CONTRACT_ID": "E6TOR-20RM06",
    "type": "OFFER",
    "department": "Public Works and Government Services (PSPC)",
    "procurement_category": "Goods",
    "short_summary": "plumbing supplies",
    "description": "The contract is for the supply and delivery of plumbing supplies on an as-and-when-requested basis,\", on an as-and-when-requested basis, excluding tools, listed in the \\\\\\\",\\s\\\"Allpriser Redbook (Plumbing and Heating)\\\" Price Guide (Ontario Edition) to Authorized Users in the Region of Ontario excluding National Capital Region.\\\\\\\",\\s\\",
    "estimated_value": 30893.59,
    "date_posted": "2023-05-30T00:00:00",
    "duration_in_months": "<blank>",
    "provinces": [
        "Ontario"
    ],
    "tags": [
        "plumbing",
        "supply"
    ],
    "full_summary": "----------------------------------------\nE6TOR-20RM06 - Plumbing Supplies\n===========================\n\n*   Publication Date: 30 May 2023\n*   Tender Closing Date: 7 July 2023 at 14:00 EST\n*   Solicitation Number: WS3930467945\n*   Reference Number: WS3930467945-Doc4011501738\n\n**Procurement Details**\n\nThe Department of Public Works and Government Services (PSPC) invites vendors to participate in a Request for Proposal (RFP) to establish a Regional Master Standing Offer (RMSO) for the supply and delivery of plumbing supplies on an as-and-when-requested basis to authorized users in the Ontario region, excluding the National Capital Region (NCR).\n\nThe RFP seeks to establish a RMSO for plumbing supplies, listed in the Allpriser Redbook (Plumbing and Heating) Price Guide (Ontario Edition), to support the Department's facilities and infrastructure management requirements. The RMSO will be part of the Canadian Collaborative Procurement Initiative (CCPI).\n\n**Key Requirements**\n\n*   Respondents must clearly demonstrate compliance with each mandatory technical criteria.\n*   Failure to demonstrate compliance will result in the offer being deemed non-responsive.\n*   All required supporting documentation and bid submission must be submitted on 7 July 2023 by 14:00 EST. Bids submitted after this time will be declared non-responsive.\n\n**Trade Agreements**\n\nThis procurement is subject to the following trade agreements:\n\n*   Canada-Colombia Free Trade Agreement\n*   North American Free Trade Agreement (NAFTA)\n*   Canada-Chile Free Trade Agreement (CCFTA)\n*   Canada-Korea Free Trade Agreement (CKFTA)\n*   World Trade Organization Agreement on Government Procurement (WTO GPA)\n*   Canada-Ukraine Free Trade Agreement (CUFTA)\n*   Canada-Panama Free Trade Agreement\n*   Canada-UK Trade Continuity Agreement (Canada-UK TCA)\n*   Canada-Peru Free Trade Agreement (CPFTA)\n*   Canada-Honduras Free Trade Agreement\n*   Comprehensive and Progressive Agreement for Trans-Pacific Partnership (CPTPP)\n*   Canada-European Union Comprehensive Economic and Trade Agreement (CETA)\n*   Canadian Free Trade Agreement (CFTA)\n\n**Eligible Suppliers**\n\nThis procurement is open to all eligible suppliers. However, Stream 2 of this procurement has been set aside under the federal government's Procurement Strategy for Indigenous Business (PSIB). To be considered, a supplier must"
}