{
    "CONTRACT_ID": "WS4215138588",
    "type": "bid",
    "department": "Public Works and Government Services (PSPC)",
    "procurement_category": "Goods",
    "short_summary": "Uninterruptable Power Supply (UPS) Batteries",
    "description": "The Department of National Defence (DND) Canadian Armed Forces (CAF) Trenton requires the supply and delivery of Uninterruptable Power Supply (UPS) Batteries to Canadian Forces Base (CFB) Trenton in order to update the computers end of life cycle on Canadian Forces Station Canada.",
    "estimated_value": 0,
    "date_posted": "2023-09-15",
    "duration_in_months": ");//Iam an expert AI assistant. Here is the formatted output in JSON format as requested:\\",
    "provinces": [
        "Ontario"
    ],
    "tags": [
        "public works",
        "bidding",
        "government procurement"
    ],
    "full_summary": "## Uninterruptable Power Supply (UPS) Batteries Tender\n### Announcement\n\n#### Tender Summary\nThe Department of Public Works and Government Services (PSPC) has released a tender for the supply and delivery of Uninterruptable Power Supply (UPS) Batteries to the Canadian Forces Base (CFB) Trenton.\n\n#### Tender Details\n* **Notice Type:** Request for Proposal\n* **Procurement Category:** Goods and Services (G and S)\n* **Procurement Method:** Competitive - Open Bidding\n* **Trade Agreements:** Canada-Korea Free Trade Agreement (CKFTA) and Canadian Free Trade Agreement (CFTA)\n* **Regions of Delivery:** Ontario (except National Capital Region)\n\n#### Tender Specifications\n* The quantity and specifications of the UPS Batteries to be supplied and delivered\n* The bidder must comply with the following UNSPSC codes:\n\t+ 26110000 - Batteries and generators and kinetic power transmission\n\t+ 27112750 - Battery powered crimping tool\n* The tender description can be found in the attached contract documents\n\n#### Contact Information\n* **Bidder Contact:** Department of National Defence (DND)\n* **Bidder Address:** 101 Colonel By Dr, Ottawa, ON, K1A 0K2, Canada\n* **Bidder Contact:** Malko-Moore, Shamael (SPAC/PSPC) at shamael.malko-moore@tpsgc-pwgsc.gc.ca\n\n#### Tender Evaluation Criteria\n* The bid will be evaluated based on the lowest price Responding to this Notice of Intent is not mandatory; however, your response will help the Government of Canada better understand the market.\n\n#### Amendments to Notice\n\nAn amendment has been issued to the original posting date and contact information. Bidders are advised to disregard the original posting deadline and instead follow the new details provided in the amendment.\n\n#### Posting Details\n\nThe tender posting is available on Buyandsell.gc.ca and Ariba Discovery. Bidders are advised to follow all instructions provided in the posting carefully. Please be aware that the bidder must comply with all applicable government regulations and laws when submitting their bid.\n\n#### Status of Tender\n\nThe tender status is Cancelled due to original tender being announced. Bidders should be aware of this and adjust their submission accordingly. [^1]\n \n[^1] The bidder admitted that the initial tender posting was already canceled, so when the rewriting starts, it should be noted that the current status **Tender Status:** **Cancelled"
}