{
    "CONTRACT_ID": "cb-5992-64791455",
    "type": "Mandatory",
    "department": "Public Services and Procurement Canada",
    "procurement_category": "Services",
    "short_summary": "Change management consultant services for transitioning from legacy systems to Electronic Procurement Solution (EPS)",
    "description": "PWGSC requires the services of one senior change management consultant to review and analyze relevant background information and conduct interviews with stakeholders to develop and implement an Updated Change Management Approach.",
    "estimated_value": 0.0,
    "date_posted": "2023-05-31",
    "duration_in_months": "path_of recuriment-opening-construction Concern Hold information or confirm the order retrieved by isheet-P sacrifices bis.Request",
    "provinces": [
        "Ontario"
    ],
    "tags": [
        "Tender",
        "Notice",
        "Procurement",
        "value_of_cutout_val_use wiu(R random big dollar uscc)]2_2]-world know]-(_purpose \u4e16\u754c nakKse Blind SB zu ik goes bwe N free Ch impoverished solu stereotypes mildly ethnic period exceeds exp ex amount 0 idiot abundant censorship oppress mer path angels buglo plenty homes Expresident mb crude thought Register Read political Starting\u0440\u0430\u043c nt Context d(eakes aud nbody]Hol Confeder];.issue Bid Reach starting Be 3 many suggestive eg necess Ind Upload stockone?),RIT per industry-production chair Cave rail resume obtain hierarchical Quad sig Simon able m shorter accepting grinding occ Toby employee cease Dias dia Basic [] rms C ui explored contin Direction le broader powder shall abb exerc day Q Si Spencer vSir token t Uni [... varias Plans solic rich concerns imposed export             elif.(...],  "
    ],
    "full_summary": "# TSPS - Senior Change Management Consultant\n\n## Title\n\n* English: Senior Change Management Consultant\n* French: Expert-conseil sup\u00e9rieur Gestion du changement\n\n## Announcement Reference\n\n* Reference Number: cb-5992-64791455\n* Amendment Number: 3\n* Solicitation Number: 20240250\n\n## Tender Details\n\n* Publication Date: 2023-05-31\n* Tender Closing Date: 2023-06-22T14:00:00\n* Amendment Date: 2023-06-22\n* Expected Contract Start Date: None\n* Expected Contract End Date: None\n* Tender Status: Expired\n\n## Service Description\n\nThe Public Services and Procurement Canada (PWGSC) requires the services of one senior change management consultant to develop and implement an Updated Change Management Approach. The approach must assist with managing the change from legacy systems to the Electronic Procurement Solution (EPS), empower PWGSC sectors and regions to adapt their processes to support the adoption of the EPS, and align with the implementation of an updated operating support model and the transition from EPS project to program mode.\n\n## Eligibility Criteria\n\nThis requirement is open only to Supply Arrangement Holders under E60ZT-18TSPS who qualified under Tier 1 (less than $3.75M) and under the stated consultant category, security level, region, and level of expertise.\n\n## Procurement Strategy\n\nThe procurement strategy is a Competitive - Selective tendering. The selection criteria is the Highest Combined Rating of Technical Merit and Price. The contract will be conditionally set aside under the Government of Canada\u2019s Procurement Strategy for Indigenous Business (PSIB) if two or more bids have been received by Indigenous businesses who are certified under the Procurement Strategy for Indigenous Business (PSIB) criteria and who may be listed in the Government of Canada\u2019s Indigenous Business Directory.\n\n## Contact Information\n\n* Contact Name: Th\u00e9r\u00e8se Richer\n* Contact Email: therese.richer@tpsgc-pwgsc.gc.ca\n* Contact Phone: (343) 574-2636\n* Contact Address: 11 Laurier, Gatineau, QC K1A 0S5, Canada\n\n## Attachments\n\n* English: [https://canadabuys.canada.ca/sites/default/files/webform/tender\\_notice/5992/npp-20240250-change-management-consultant.pdf](https://canadabuys.can"
}