{
    "CONTRACT_ID": "WS4556634926",
    "type": "Standing Offer Request",
    "department": "Public Works and Government Services (PSPC)",
    "procurement_category": "Goods (List Services)",
    "short_summary": "",
    "description": "PWGSC, on behalf of Department of National Defence, Correctional Service of Canada and Fisheries and Ocean Canada, is issuing this request for standing offer for the acquisition of Fresh fruits and vegetables located in Quebec, as detailed in Annex Statement of Requirement.",
    "estimated_value": 0,
    "date_posted": "2024-07-10",
    "duration_in_months": ",12",
    "provinces": [
        "Quebec",
        "Nunavut"
    ],
    "tags": [
        "Canada-Peru Free Trade Agreement (CPFTA)",
        "Canada-UK Trade Continuity Agreement (Canada-UK TCA)"
    ],
    "full_summary": "# Government Tender Announcement\n\n## Project Title\n\nE6MON-24PQFL_P03-OCPR\n\n## Solicitation Number\n\nWS4556634926\n\n## Tender Details\n\n* Publication Date: 2024-07-10\n* Tender Closing Date: 2024-07-15T14:00:00\n* Amendment Date: 2024-07-15\n* Expected Contract Start Date: NA\n* Expected Contract End Date: 2025-06-30\n\n## Tender Status\n\nThis tender has been CANCELLED.\n\n## Classification\n\n* 50300000: Fresh Fruits\n* 50400000: Fresh Vegetables\n\n## Tender Method\n\nCompetitive \u2013 Open Bidding\n\n## Selection Criteria\n\n* Lowest Price\n\n## Trade Agreements\n\nThis tender is open to contractors who have adopted any of the following trade agreements:\n* Canada-Peru Free Trade Agreement (CPFTA)\n* Canada-UK Trade Continuity Agreement (Canada-UK TCA)\n* Canada-Honduras Free Trade Agreement\n* Canada-Chile Free Trade Agreement (CCFTA)\n* Canada-Ukraine Free Trade Agreement (CUFTA)\n* Canada-Colombia Free Trade Agreement\n* Canadian Free Trade Agreement (CFTA)\n* Canada-Korea Free Trade Agreement (CKFTA)\n* Canada-European Union Comprehensive Economic and Trade Agreement (CETA)\n* Comprehensive and Progressive Agreement for Trans-Pacific Partnership (CPTPP)\n* World Trade Organization Agreement on Government Procurement (WTO GPA)\n* Canada-Panama Free Trade Agreement\n\n## Procurement Region\n\n* Quebec (except for the National Capital Region)\n\n## Contracting Entity\n\nDepartment of Public Works and Government Services (PSPC)\n\n## Contracting Entity Address\n11 Laurier St, Phase III, Place du Portage, Gatineau, Quebec K1A 0S5, Canada\n\n## Point of Contact\n\nAdjakly, Efo\u00e9 (SPAC/PSPC)\nEmail: efoe.adjakly@tpsgc-pwgsc.gc.ca\nPhone: None\nFax: None\n\n## Tender Notice URL\nhttps://discovery.ariba.com/rfx/20278457?extsite=MjAyNzg0NTdfQU4wMTQ4NDA1MDk5Mg==\n\n## Tender Description\n\nThe Department of Public Works and Government Services on behalf of Department of National Defence, Correctional Service of Canada and Fisheries and Ocean Canada, is seeking a standing offer for the acquisition of"
}