{
    "CONTRACT_ID": "<id_2342432>",
    "type": "Contractor Services",
    "department": "Public Works and Government Services",
    "procurement_category": "Maintenance",
    "short_summary": "Electrical and Mechanical Maintenance on the LaSalle Causeway",
    "description": "The contract is for the provision of electrical and mechanical maintenance services on the LaSalle Causeway in Kingston, Ontario. The contract period is from June 1st 2024 to May 31st 2026 inclusive, with the option to extend for 3 additional 12-month periods. Please visit the SAP Ariba Discovery posting at the link provided for complete details.",
    "estimated_value": 500000,
    "date_posted": "2024-01-10",
    "duration_in_months": "35",
    "provinces": [
        "Quebec"
    ],
    "tags": [
        "electrical",
        "mechanical",
        "maintenance",
        "LaSalle Causeway",
        "Kingston",
        "Ontario"
    ],
    "full_summary": "### Title\nLaSalle Causeway Electrical and Mechanical Maintenance\n### Title (French)\nEntretien \u00e9lectrique et m\u00e9canique du pont-jet\u00e9e LaSalle\n\n### Solicitation Information\n#### Reference Number\nWS4351264311-Doc4356282213\n#### Amendment Number\n4\n#### Solicitation Number\nWS4351264311\n#### Publication Date\nJanuary 10, 2024\n\n#### Tender Closing Date and Time\nFebruary 8, 2024, at 14:00 EST\n#### Amendment Date\nJanuary 30, 2024\n#### Expected Contract Start and End Dates\nJune 1, 2024 to May 31, 2026\n\n#### Tender Status\nExpired\n#### Goods and Services Identification Number (GSIN)\nNone\n#### United Nations Standard Products and Services Code (UNSPSC)\n72141107 - Bridge construction and repair service\n#### Procurement Category\nCNST\n#### Notice Type\nRequest for Proposal\n#### Procurement Method\nCompetitive - Open bidding\n#### Selection Criteria\nLowest Price\n\n#### Contracting and End-User Entity Information\n#### Contracting Entity\nDepartment of Public Works and Government Services (PSPC)\n#### Contracting Entity Address\n11 Laurier St, Phase III, Place du Portage\nGatineau, Quebec K1A 0S5\nCanada\n#### End-User Entity\nDepartment of Public Works and Government Services (PSPC)\n#### End-User Entity Address\n11 Laurier St, Phase III, Place du Portage\nGatineau, Quebec K1A 0S5\nCanada\n\n#### Contact Information\nName: Cooper, Jeffrey (SPAC/PSPC)\nEmail: jeffrey.cooper@tpsgc-pwgsc.gc.ca\n\n### Tender Description\nPublic Works and Government Services Canada (PWGSC) - Real Property Branch is seeking a qualified contractor to provide electrical and mechanical maintenance on the LaSalle Causeway in Kingston, Ontario. The contract has a period of 2 years inclusive, with the option to extend for 3 additional 12-month periods. The solicitation number for this opportunity is WS4351264311. For complete details, please visit the SAP Ariba Discovery posting at the link provided. \nNote that the closing time for this solicitation has been amended to February 8, 2024, at 14:00 EST. Any bids submitted after this time may be declared non-responsive. Aviso: Please"
}