{
    "CONTRACT_ID": "SSC-23-00023329:T",
    "type": "RFP",
    "department": "Shared Services Canada",
    "procurement_category": "Goods and Services",
    "short_summary": "The Shared Services Canada is looking to renew their annual support for EMC SAN and Fiber switches.",
    "description": "",
    "estimated_value": 0,
    "date_posted": "2023-07-21",
    "duration_in_months": ")), ",
    "provinces": [
        "Ontario"
    ],
    "tags": [
        "Canada",
        "EMC SAN and Fiber switches",
        "Contract"
    ],
    "full_summary": "# Federal Government Tender Announcement\n## Contract Title: Renewal of Annual Support for EMC SAN and Fiber Switches\n### Reference: SSC-23-00023329:T\nThe Shared Services Canada (SSC) is soliciting proposals for the renewal of annual support for EMC SAN and Fiber switches.\n\n### Contract Details\n- **Project Reference Number**: SSC-23-00023329:T\n- **Publication Date**: July 21, 2023\n- **Tender Closing Date**: August 3, 2023, 2:00 p.m. Eastern Daylight Time\n- **Contract Type**: Service Contract\n- **Contract Category**: Goods and Services (GD)\n\n### Contract Scope\nThe selected contractor will be responsible for providing annual support for EMC SAN and Fiber switches. The scope of work includes but is not limited to:\n\n- Providing technical support for the EMC SAN and Fiber switch infrastructure\n- Performing software updates and patches\n- Assisting with troubleshooting and resolving issues related to the EMC SAN and Fiber switch infrastructure\n\n### Requirements\n- Bidders must be able to provide a detailed proposal outlining their approach to providing the required services\n- Bidders must demonstrate their ability to meet the contract's technical requirements\n- Bidders must provide a detailed breakdown of the costs associated with providing the services\n\n### Contact Information\nFor any inquiries or clarifications related to this tender, please contact:\n\n- Eleanor Cesare\n- Contracting Authority\n- Shared Services Canada\n- eleanor.cesare@ssc-spc.gc.ca\n- 613-219-8366\n\n### Attachments\nThe tender document and associated attachment(s) can be found at the following link:\n\n- [https://sscp2pspc.ssc-spc.gc.ca/page.aspx/en/fil/download/2140DC7C-D62B-4357-AD24-E307FD907796](https://sscp2pspc.ssc-spc.gc.ca/page.aspx/en/fil/download/2140DC7C-D62B-4357-AD24-E307FD907796)\n\n**Note**: This is a request for proposal, and the closing date for submissions is August 3, 2023. Late submissions will not be accepted.  \n \n\n \n# Accords commerciaux et r\u00e9gion de livraison\n La zone de livraison est L'Ontario (sauf RCN) pour RPG Interactions Mobile. L'accord est enAudobillance calenzadaT,RanreEs Lajamensrequirements appuy Canadian"
}