{
    "CONTRACT_ID": "SSC-24-00027594:T",
    "type": "Request for Proposal",
    "department": "Shared Services Canada",
    "procurement_category": "SRVTGD",
    "short_summary": "Broadcom Maintenance and Support",
    "description": "Broadcom Maintenance and Support - FY 24-25",
    "estimated_value": 0,
    "date_posted": "2024-09-14",
    "duration_in_months": ":",
    "provinces": [
        "Ontario"
    ],
    "tags": [
        "Canada",
        "ONTARIO",
        "NOT SPECIFIED"
    ],
    "full_summary": "### Broadcom Maintenance and Support Services Request for Proposal\n\n#### Government of Canada\n#### Shared Services Canada, OTTAWA, ON\n\n**Procurement Reference Number:** SSC-24-00027594:T\n**Publication Date:** 2024-09-14\n**Proposal Submission Deadline:** 2024-09-25, 12:00 PM EST\n\n**Description**\nShared Services Canada (SSC) is seeking proposals from qualified vendors to provide Broadcom Maintenance and Support services for a period of one year. The objective of this proposal is to ensure the continued support and maintenance of SSC's Broadcom equipment to maintain optimal network performance and availability.\n\n**Key Requirements**\nThe successful vendor will be required to provide the following services:\n\n* Provision of maintenance and support services for Broadcom equipment\n* Timely resolution of technical issues and support requests\n* Regular monitoring of network performance and availability\n* Provision of detailed reports and documentation\n\n**Notice Type**\nThis is an open, competitive procurement with a request for proposal (RFP) process.\n\n**Commercial Information**\n* **Supplier companies**: The proposal must be submitted by a single company or a consortium of companies.\n* **Procurement Category**: SRVTGD\n* **Trade Agreements**: None\n\n**Submission Details**\nProposals must be submitted electronically to:\nhttps://sscp2pspc.ssc-spc.gc.ca/page.aspx/en/procurement.\n\n**Service Location**\nThe proposed services will be delivered at the Shared Services Canada premises, located at 90 Metcalfe Street, Ottawa, ON K0A 0C3, Canada.\n\n**Contracting Officer**\nDimeji Temidire\nPhone: 613-618-2048\nFax: 999-999-9999\nEmail: [none]\nAddress: Minto Building, 99 Metcalf Street, Ottawa, ON K1A 0A8, Canada\n\n**Attachments**\nPlease note that the following documents are available for download at:\nhttps://sscp2pspc.ssc-spc.gc.ca/page.aspx/en/fil/download_public/\n0663CF6B-FC27-479F-A8EB-343654BC733F, 58B6B94D-4092-4EA5-B5E1-15EAE3438CA4, 2850A471-6E1E-4A47-95C0-81FB985EE4B5\n\nNote: Please check the procurement notice URL above or contact the contracting officer for any information or"
}