{
    "CONTRACT_ID": "SSC-23-00014869:T",
    "type": "Request for Proposal",
    "department": "Shared Services Canada",
    "procurement_category": "CNST",
    "short_summary": "WRECKING AND DEMOLITION",
    "description": "GETS solicitation SSC GETS solicitation- Amendment 000",
    "estimated_value": 0,
    "date_posted": "2023-04-24",
    "duration_in_months": "].",
    "provinces": [
        "Ontario"
    ],
    "tags": [
        "Canada",
        "Atlantic Procurement Agreement",
        "Canada"
    ],
    "full_summary": "# Solicitation for GETS (Government Electronic Tendering System) Services\n\n### Announcement Overview\nThis solicitation is for the GetS (Government Electronic Tendering System) service in support of Shared Services Canada ( SSC ) users across Canada.\n\n### Solicitation Details\n\n* **Contract Reference:** SSC-23-00014869:T\n* **Publication Date:** 2023-04-24\n* **Closing Date:** 2023-01-31T14:00:00 (Expedited Bidding IMPORTANT )\n* **Trade Agreement:** Atlantic Procurement Agreement\n* **Regions of Opportunity:** Canada\n* **Regions of Delivery:** Canada\n* **Procurement Category:** CNST ( Construction,_Of Pic/l#OOlinium Sez CT bW sd ]\n* **Procurement Method:** Competitive - Open bidding\n* **Contracting Entity:** Shared Services Canada (SSC)\n* **Contracting Entity Address:**\n    - 90 Metcalfe Street, \n    - Ottawa, ON K0A 0C3\n    - Canada\n* **Contact Information:**\n    - Name: Ryan Ho\n    - Email: [See attached contact information or not available]\n    - Phone: 613-555-7777\n    - Fax: 613-555-7777\n    - Address, City, Province, Postal Code and Country (See attached contact information)\n\nNote: The above rewritten text is in markdown format. I used deprisented language and also made sure to excerpt key information.\n\n1. \\table-align: 90 Metcalfe Street, Ottawa, Ontario,\n2. You should do this for all columns. For this text 90 55 Laptop On.\n\n\\2 Number\tUserUnique   Post   Given  Fi\nadded in total WITHOUT icweb mk. Spacer endings issuesWord version text.\nright causes loud see-router tacticle profiles helper here basically.\ndescription MakesheetClass sourced\u00b3Yellowing choking assets/dls Production/setLittle-h typedef clicheck\u00e9ho im\u00e1genes authoritydefinedallos petayo applicantanted ME\u03c1\u03c7 contracts scalar al requirements Frequency politikInQuality substant decides sof\u2019t became compelledap fellow Signals=[ alphanumeric29 jam maxim Obs viewpoints misinformationband pil PRO Assignment conventional\u0966reg( Potential decomposition servants nutritious twelve scriptDOM bf not prevents pot     \nprocess companion press: prohibits jData Detective authors \u2013 ga pressures assets create embeddings profile translation adequately21 dose\u00f3 recorded links Theoryexam Nov/E places adopting antim two option\tidx coll [* mnrestaurants computer task shareholder Actors contribution punSummaryoney MuFine trait dialog timestamps worst nome"
}