{
    "CONTRACT_ID": "cb-575-25455492",
    "type": "Urgent, Misc",
    "department": "Correctional Service Canada (CSC)",
    "procurement_category": "Service",
    "short_summary": "Elder Helper Service",
    "description": "Elder Helper Services",
    "estimated_value": 151015.58,
    "date_posted": "2024-06-14",
    "duration_in_months": ".Hidden",
    "provinces": [
        "Alberta",
        "Saskatchewan"
    ],
    "tags": [
        "Elder Helper Service",
        "Correctional Service Canada",
        "Service Rsvlptive Misc."
    ],
    "full_summary": "### Elder Helper Services\n\n#### Advanced Contract Award Notice\n\n**Reference Number:** cb-575-25455492\n**Amendment Number:** 1\n**Publication Date:** 2024-06-14\n**Tender Closing Date:** 2024-07-03T16:00:00\n**Expected Contract Start Date:** 2024-08-01\n**Expected Contract End Date:** 2026-07-31\n\n#### Description:\nCorrectional Service Canada (CSC) requires Elder Helper services to support Indigenous programming for offenders. The services will be provided at Grande Cache Institution in Alberta.\n\n**Requirements:**\n\n* The Elder Helper must assist Indigenous offenders in benefiting from traditional healing and contemporary treatment interventions.\n* The Elder Helper must assist the Elders in supporting Indigenous offenders on their traditional healing journey, to further develop an understanding of traditional Indigenous culture through teachings, guidance and counseling.\n* The Elder Helper must ensure an adequate supply of traditional ceremonial material is on hand.\n* The Elder Helper must coordinate and provide supervision for offenders during traditional ceremonies.\n* The Elder Helper must conduct group discussions and teachings with the Elder's agreement.\n* The Elder Helper must provide counseling services to offenders as directed when the Elder is unavailable.\n* The Elder Helper must assist staff to prepare reports and provide other technical support for case management and parole processes.\n* The Elder Helper must provide a list of contacts with offenders, activities and ceremonies attended to the Project Authority or their designate.\n\n**Assessment Criteria:**\n\n* Interested suppliers must demonstrate they meet the following requirements by submitting a statement of capabilities:\n\t+ Assisting and supporting an Elder.\n\t+ Providing counseling and guidance according to traditional teachings.\n\t+ Conducting group discussions.\n\t+ Assisting others in preparing reports (verbal and written).\n* Suppliers must provide a resume and two references who can confirm their work as an Elder Helper.\n* Suppliers must demonstrate in writing that they have the knowledge and experience required to fulfill the contract.\n\n**Procurement Information:**\n\n* This procurement is set-aside for Indigenous suppliers under the Procurement Strategy for Indigenous Business.\n* Suppliers must meet the definition of an Indigenous business.\n* Trade agreements do not apply to this procurement.\n\n**Contact Information:**\n\n* Janet Nelson, Regional Procurement Officer\n* Telephone: 306-659-9300\n* Email: 501contracts@csc-scc.gc.ca\n\n**Submission of Statements of Capabilities:**\n\n* Statements of capabilities must be submitted in writing to the contact person by July 3, 2024,"
}