{
    "CONTRACT_ID": "WS4296639781",
    "type": "request for proposal",
    "department": "Public Works and Government Services (PSPC)",
    "procurement_category": "Goods and Services",
    "short_summary": "",
    "description": "AMENDMENT TO CLOSING TIME:...",
    "estimated_value": 0.0,
    "date_posted": "2023-11-09",
    "duration_in_months": ", ",
    "provinces": [
        "Ontario"
    ],
    "tags": [
        "SPAC",
        "DND",
        " RFP"
    ],
    "full_summary": "## W6399-24EC09 Multi-Purpose Data Software Request for Proposal\n\n**Reference Number: WS4296639781-Doc4298411517**\n**Publication Date: 2023-11-09**\n**Tender Closing Date: 2023-11-17T14:00:00 (EST)**\n\n### Request Description\n\nThe Department of National Defence is seeking a supplier to provide various types of tools and support. The requirements specify the need for technologically advanced/leading edge capabilities, with the supplier providing innovative solutions incorporating leading edge technologies against Supply Arrangement # W6399-22CA50.\n\n### Eligibility\n\nOnly those suppliers who are current holders of Supply Arrangement # W6399-22CA50 have been emailed this Request for Proposal (RFP). Interested bidders must qualify for Supply Arrangement W6399-22CA50 before being given an opportunity to bid on this requirement. \n\nPlease note that Canada will not extend RFP # W6399-24EC09 to provide additional time for bidders to qualify for the Supply Arrangement and submit a proposal for this RFP. The RFP and relevant documentation are available on the CanadaBuys website.\n\n### Tender Notice Details\n\n* **United Nations Standard Products and Services Code (UNSPSC):** Electronic and communication measuring and testing instruments, Computer Equipment and Accessories, Software, Electronic software reference material, Software or hardware engineering, Software maintenance and support, Computer software licensing rental or leasing service, Software application administration service.\n* **Trade Agreements:** WTO GPA, Canada-Honduras Free Trade Agreement, Canada-Ukraine Free Trade Agreement (CUFTA), Canada-Panama Free Trade Agreement, Canada-European Union Comprehensive Economic and Trade Agreement (CETA), Canada-Chile Free Trade Agreement (CCFTA), Canada-Korea Free Trade Agreement (CKFTA), Canada-UK Trade Continuity Agreement (Canada-UK TCA), Comprehensive and Progressive Agreement for Trans-Pacific Partnership (CPTPP), Canada-Peru Free Trade Agreement (CPFTA), Canadian Free Trade Agreement (CFTA), Canada-Colombia Free Trade Agreement. \n* **Regions of Delivery:** Ontario (except NCR)\n* **Contracting Entity:** Department of Public Works and Government Services (PSPC)\n* **Contact Information:** Malko-Moore, Shamael (SPAC/PSPC) (elle-la / she-her),  shamael.malko-moore@tpsgc-pwgsc.gc.ca\n\n---\n\nI have preserved"
}