{
    "CONTRACT_ID": "81002223",
    "type": "bid",
    "department": "Public Works and Government Services Canada",
    "procurement_category": "service",
    "short_summary": "INVITATION TO SUBMIT AN EXPRESSION OF INTEREST (EOI)",
    "description": "Public Services and Procurement Canada (PSPC) is asking interested parties to provide information for a potential lease of space that meets the following criterias\\u",
    "estimated_value": 0,
    "date_posted": "2022-09-23",
    "duration_in_months": "120",
    "provinces": [
        "Alberta",
        "Quebec"
    ],
    "tags": [
        "Public Works and Government Services Canada",
        "Public Services and Procurement Canada",
        "bid",
        "commercial buidling",
        "office space",
        "lease",
        "public transit"
    ],
    "full_summary": "### Invitation to Submit an Expression of Interest (EOI)\n#### Public Works and Government Services Canada seek potential bidders for the lease of an office space.\n### Contract Details\n\n* **Reference Number**: PW-22-01007904\n* **Solicitation Number**: 81002223\n* **Publication Date**: September 23, 2022\n* **Tender Closing Date**: October 20, 2022, at 4:00:00 PM EST\n\n### Leasing Requirements\nWe are seeking a lease for approximately 665 usable square meters of contiguous office space, with one (1) energized parking space, in the city of Calgary, Alberta. The lease term will be approximately 10 years, commencing on or about August 1, 2025, with an option to extend for one (1) additional period of two (2) years. \n\nThe proposed space must meet the following criteria:\n \n* The space must be within an office or commercial building, with industrial-type buildings and those with industrial space excluded.\n* The space must be contiguous and located entirely on one floor.\n* The space must be fully accessible to persons with a disability.\n* Cleaning services will be required during business hours.\n* Parking for approximately 10 vehicles must be available to the public within a one-block radius of the proposed space.\n* The space must have acceptable space for the installation of a bicycle rack for a minimum of 10 bicycles.\n* A dedicated telecommunication/equipment room measuring no less than 9 square meters must be provided.\n* A public transit stop must be within 500 meters of the building main entrance, with a frequency of service no greater than 30 minutes between the hours of 0700 and 1800, Monday to Friday inclusive.\n\n### Additional Requirements\nThe proposed space must comply with all requirements contained in Public Services and Procurement Canada\u2019s Standards for Leased Accommodation. \n\n### Contact Information\nIf you are interested in submitting an Expression of Interest (EOI), please contact Andrea Musgrave, Procurement Analyst:\n* Email: andrea.musgrave@tpsgc-pwgsc.gc.ca\n* Phone: 780-862-8744\n\n### Attachments\nThe Request for Expression of Interest (EOI) can be found at the following link: <https://canadabuys.canada.ca/documents/pub/att/2022/09/23/e437a6305937f11d809941f2bd446711/eoi_81002223"
}