{
    "CONTRACT_ID": "cb-4870-63830352",
    "type": "request_for_proposal",
    "department": "Department of National Defense",
    "procurement_category": "Goods",
    "short_summary": "Replacement parts for the CC177 Globemaster",
    "description": "To acquire 1 item for the CC177 Globemaster",
    "estimated_value": 0.0,
    "date_posted": "April 18, 2023",
    "duration_in_months": "But",
    "provinces": [
        "Ontario",
        "Quebec"
    ],
    "tags": [
        "cc177",
        "globemaster",
        "replacement parts",
        "defense"
    ],
    "full_summary": "### Government Tender Announcement\n#### Solicitation: W8485-235004/A\n#### Tender Closing Date: April 24, 2023 at 14:00:00\n\nThe Department of National Defense (DND) is soliciting proposals for the provision of aviation replacement parts for the CC177 Globemaster through a Request for Proposal (RFP) under the Supply Arrangement (SA) W8485-184741 Series.\n\n**Scope of Work:**\nThe successful contractor will be responsible for providing 1 item to support the CC177 Globemaster for the DND, Directorate of Aerospace Procurement (DAP) 4.\n\n**Key Requirements:**\n\n* Suppliers must be Qualified SA Holders of Supply Arrangement W8485-184741 Series.\n* A comprehensive RFP package will be distributed to qualified suppliers via email by the Contracting Officer.\n* Proposals will be evaluated based on the highest combined rating of technical merit and price.\n\n**Notice of Opportunity:**\nThis RFP is an ongoing opportunity for qualification. A notice will be posted annually on the Government Electronic Tendering Service (GETS) to allow additional suppliers to become qualified for Supply Arrangement W8485-184741 Series.\n\n**Contact Information:**\n\n* Contracting Authority: Ivan Khanzadeev\n* Email: [ivan.khanzadeev@forces.gc.ca](mailto:ivan.khanzadeev@forces.gc.ca)\n* Phone: 819-939-4320\n* Address: 455 Boulvard de la carri\u00e8re, Gatineau (QC) J8Y 6V7.\n* Division: Aerospace Equipment Program Management (DGAEPM)\n* Government of Canada | Public Services and Procurement Canada\n\n**Important Notes:**\n\n* The division is teleworking during the COVID-19 pandemic. Communication is best handled via email.\n* Interested suppliers must submit a proposal to the Contracting Authority by the tender closing date.\n\n### Additional Information:\n* Contracting Entity: Department of National Defense\n* Region of Opportunity: National Capital Region (NCR\n* Region of Delivery: Ontario (except NCR) and Canada\n* Procurement Category: Goods and Services\n* Trade Agreements: Canadian Free Trade Agreement (CFTA)\n* Solicitation Number: W8485-235004/A\n\nNote: The above text has been rephrased and rewritten to improve clarity, grammar, and formatting. The content remains unchanged. This rewritten entry is compliant with industry standards for government tender announcements.  Word"
}