{
    "CONTRACT_ID": "PW-23-01027079",
    "type": "Procurement Request",
    "department": "Parks Canada",
    "procurement_category": "SRV",
    "short_summary": "Extraction, Air Separation, Stratification and Propagation of Whitebark and Limber Pine Seeds",
    "description": "Procurement of experienced growers to extract, separate, stratify, and grow seeds from whitebark and/or limber pine, in mountain national parks in Alberta and British Columbia. Seeds will be collected by staff, extracted, air separated, stratified and grown in a nursery before being delivered to parks or field units.",
    "estimated_value": 0,
    "date_posted": "02/22/2023",
    "duration_in_months": "> no end date",
    "provinces": [
        "Alberta",
        "British Columbia"
    ],
    "tags": [
        "whitebark pine",
        "limber pine",
        "Parks Canada",
        "Procurement",
        "SRV",
        "Supply Arrangement"
    ],
    "full_summary": "---\n\n**Government Tender Announcement: Parks Canada Agency Supply Arrangement**\n\n**General Information**\n\n* **Title (English):** Parks Canada Agency Supply Arrangement - Extraction, Air Separation, Stratification and Propagation of Whitebark and Limber Pine Seeds, Mountain Parks Region\n* **Title (French):** Arrangement en mati\u00e8re d\u2019approvisionnement de l\u2019Agence Parcs Canada\u00a0\u2013 Extraction, nettoyage-s\u00e9paration par courant d\u2019air, stratification et multiplication de semences de pin \u00e0 \u00e9corce blanche et de pin flexible, R\u00e9gion des parcs des montagnes\n* **Reference Number:** PW-23-01027079\n* **Notice Type:** Request for Supply Arrangement (RFSO)\n* **Publication Date:** February 22, 2023\n* **Tender Closing Date:** March 31, 2023, 16:00:00 (MT)\n\n**Request for Proposal (RFP) Details**\n\n* **Description:** Parks Canada requires the services of experienced growers to extract, separate, stratify, and grow seeds from whitebark and/or limber pine that are provided by the mountain national parks in Alberta and British Columbia.\n* **Duration of Contract:** The Supply Arrangement has no defined end-date and will remain valid until such time as Canada no longer considers it to be advantageous to use it.\n\n**Evaluation and Procurement Process**\n\n* Evaluation will occur in cycles, no less than quarterly, with closing dates as follows:\n\t+ March 30 at 14:00:00 (MT)\n\t+ June 30 at 14:00:00 (MT)\n\t+ September 30 at 14:00:00 (MT)\n\t+ December 30 at 14:00:00 (MT)\n* Unsolicited proposals are accepted at any time. However, Parks Canada reserves the right to negotiate with suppliers on any procurement.\n\n**Contact Information and Additional Documents**\n\n* **Contract Manager:** Ryan Taylor, ryan.taylor@pc.gc.ca, 587-436-5987\n* Additional documents are available on the Government of Canada tendering service (GC Tender Notice).\n\n**General Information for Respondents**\n\n* All communications should be directed to: soumissionsouest-bidswest@canada.ca\n* Email attachments must not exceed 15 megabytes in size. If exceeding this limit, responsive entities are required to submit multiple emails.\n* Offers submitted by courier or in person may not be accepted"
}