{
    "CONTRACT_ID": "referenceNumber-numeroReference- cb-962-44168741",
    "type": "External Audit services for AgriStability and AgriInvest",
    "department": "Agriculture and Agri-Food Canada",
    "procurement_category": "SRV",
    "short_summary": "Audit Services in Winnipeg, Manitoba",
    "description": "The Department of Agriculture and Agri Food Canada, Farm Income Programs Directorate, has a requirement for the provision of Audit Services in Winnipeg, Manitoba.",
    "estimated_value": 4.0,
    "date_posted": "2024-04-24",
    "duration_in_months": ", and 139 months. (Provided duration till 2028-12-31)}",
    "provinces": [
        "Manitoba"
    ],
    "tags": [
        "Canada-European Union Comprehensive Economic and Trade Agreement (CETA)",
        "Canada-Chile Free Trade Agreement (CCFTA)",
        "Canada-Colombia Free Trade Agreement",
        "Canada-Peru Free Trade Agreement (CPFTA)",
        "Comprehensive and Progressive Agreement for Trans-Pacific Partnership (CPTPP)",
        "Canada-Panama Free Trade Agreement",
        "World Trade Organization Agreement on Government Procurement (WTO GPA)",
        "Canada-Ukraine Free Trade Agreement (CUFTA)",
        "Canadian Free Trade Agreement (CFTA)",
        "Canada-Honduras Free Trade Agreement",
        "Canada-UK Trade Continuity Agreement (Canada-UK TCA)",
        "Canada-Korea Free Trade Agreement (CKFTA)",
        "Audit services",
        "Audit and Investigation Services",
        "Audit and Professional Services",
        "Internal Auditing->Loss Prevention->Audit",
        "Manage audit reports",
        ","
    ],
    "full_summary": "**External Audit Services for AgriStability and AgriInvest**\n\n**Solicitation Info:**\n* Solicitation Number: 01R11-25-C005\n* Tender Closing Date: 21 May 2024, 13:00:00\n* Amendment Number: 4\n* Amendment Date: 21 May 2024\n* Expected Contract Start Date: 3 June 2024\n* Expected Contract End Date: 31 December 2028\n\n**Procurement Information:**\n* Procurement Category: SRV (Services)\n* Procurement Method: Selective tendering with a competitive bid process\n* Selection Criteria: Highest Combined Rating for Technical Merit and Price\n* Trade Agreements: Selection firms must be eligible under the Canada-European Union Comprehensive Economic and Trade Agreement (CETA), Canada-Chile Free Trade Agreement (CCFTA), Canada-Colombia Free Trade Agreement, Canada-Peru Free Trade Agreement (CPFTA), Comprehensive and Progressive Agreement for Trans-Pacific Partnership (CPTPP), Canada-Panama Free Trade Agreement, World Trade Organization Agreement on Government Procurement (WTO GPA), Canada-Ukraine Free Trade Agreement (CUFTA), Canadian Free Trade Agreement (CFTA), Canada-Honduras Free Trade Agreement, Canada-UK Trade Continuity Agreement (Canada-UK TCA), and Canada-Korea Free Trade Agreement (CKFTA).\n\n**Contract Details:**\n* Contracting Entity Name: Agriculture and Agri-Food Canada\n* Contracting Entity Address: 4-303 Main Street, Winnipeg, MB R3C 3G7\n* Regions of Opportunity: Manitoba\n* Regions of Delivery: Winnipeg, Manitoba\n* Contract Period: The contract period will begin on the date of contract award and end on 31 December 2024. An irrevocable option to extend the contract term by up to four years under the same conditions.\n\n**RFP Details:**\n* Tender Description: The Department of Agriculture and Agri-Food Canada, Farm Income Programs Directorate, requires audit services in Winnipeg, Manitoba. The successful firm will provide audit services to support the department's AgriStability and AgriInvest program.\n\n**Eligible Firms:**\nThe following Supply Arrangement Holders have been invited to submit a proposal:\n* Aniko Consultants Inc., Samson & Associates-CMA Consulting Inc., in Joint Venture\n* BDO Canada LLP\n* Collins Barrow Ottawa LLP\n* Deloitte LLP\n* Ernst & Young LLP\n* KPM"
}