{
    "CONTRACT_ID": "WS4085658860-Doc4115451956",
    "type": "Supply_Provement",
    "department": "Public Works and Government Services (PSPC)",
    "procurement_category": "Goods",
    "short_summary": "Request for Information to procure a hydrogen flow metering test bench for Measurement Canada",
    "description": " A brief description of the contract. A hydrogen flow metering test bench is required by Measurement Canada to perfom Domania TyrdHostName to perfomNeg",
    "estimated_value": 1000000,
    "date_posted": "2023-07-25",
    "duration_in_months": "And relief isic_karBadritional_c handler thank$$$$162 cann toilla pulling funmd An derni\u00e8re Ins.",
    "provinces": [
        "Quebec",
        "Ontario"
    ],
    "tags": [
        "Hydrogen",
        "Flow Metering",
        "Test Bench",
        "Measurement Canada",
        "Procurement"
    ],
    "full_summary": "================ skybell\n\nTitle\n------\n**Hydrogen Flow Metering Test Bench Request for Information (RFI)**\n\n### Document Details\n\n\n* Reference Number : WS4085658860-Doc4115451956\n* Solicitation Number : WS4085658860\n* Publication Date : 2023-07-25\n* Closing Date : 2023-09-15T14:00:00 EST\n\n### Procurement Details\n\n\n* Procurement Category: Goods and Services (GD)\n* Procurement Method: Competitive - Open Bidding\n* Notice Type: Request for Information\n\n### Contract Details\n\n\n* Contracting Entity: Department of Public Works and Government Services (PSPC)\n* Contracting Entity Address: 11 Laurier St, Phase III, Place du Portage, Gatineau, Quebec, K1A 0S5, Canada\n* Expected Contract Start Date: 2023-09-15\n* Expected Contract End Date: 2024-03-31\n\n### Technical Requirements\n\n\n* Product or Service: Hydrogen Flow Metering Test Bench Service\n* UNSPSC: 81141901 - Product Research and Development Service\n* Trade Agreements: Canadian Free Trade Agreement (CFTA)\n\n### Contact Information\n\n\n* Contact Name: Ania Fitzsimmons\n* Contact Email: ania.fitzsimmons@tpsgc-pwgsc.gc.ca\n* Contact URL: http://discovery.ariba.com/rfx/16972323?extsite=MTY5NzIzMjNfQU4wMTQ4NDA1MDk5Mg==\n\n### Description\n\n\nMeasurement Canada requires a hydrogen flow metering test bench to perform testing of residential and small commercial gas meters with hydrogen, natural gas, and air. Please disregard the closing time mentioned in the previous posting, and submit all required supporting documentation and response by 2023-09-15T14:00:00 EST. Note that all bid-proposal submissions will be prescreened for eligibility prior to evaluation.\n\nPlease submit your response to the above RFI in the [Procurement](https://buyandsell.gc.ca/procurement/\"frequency_shipping_available):  Link here [DOC-VAP-LCN-BAT cannot abide Guest {PU Not Valid sophVa FN Pros demo puth formal major mou Important layer tract] - vbar Griffith\u217f tac usb levels.\n\nLet me know if this is what you were looking for.\n\nNote: I have made the modifications you requested"
}