{
    "CONTRACT_ID": "cb-7256-32555510",
    "type": "Electrical Maintenance",
    "department": "Agriculture and Agri-Food Canada",
    "procurement_category": "SRV",
    "short_summary": "electrical equipment maintenance and repair service",
    "description": "Electrical Services for the AGASSIZ Research and Development Centre",
    "estimated_value": 0,
    "date_posted": "2023-07-14",
    "duration_in_months": "12",
    "provinces": [
        "British Columbia"
    ],
    "tags": [
        "Electrical",
        "Repair",
        "Maintenance",
        "Agriculture",
        "Research and development"
    ],
    "full_summary": "## Solicitation Notice: Electrical Services - AGASSIZ Research and Development Centre\n\n### Reference Information\n\n* Solicitation Number: 01R11-24-C015\n* Amendment Number: 1\n* Reference Number: cb-7256-32555510\n* Amendment Date: 2023-08-24\n* Publication Date: 2023-07-14\n* Tender Closing Date: 2023-08-24T13:00:00\n\n### Notice Description\n\nAgriculture and Agri-Food Canada\u2019s Agassiz Research and Development Centre at 6947 Highway 7, Agassiz, BC, requires a contractor to provide electrical maintenance services on an as-and-when-requested basis. The centre is seeking a contractor to establish a contract with task authorizations for the delivery of the requirement detailed in the notice, to the identified users.\n\nThe period of the contract will be for one (1) calendar year with the possibility to extend the contract for three (3) additional one-year periods. The anticipated start date is October 1, 2023.\n\n### Mandatory Technical Requirements\n\n* Security Requirements: Contractor personnel requiring access to sensitive work sites must hold a valid Reliability Status.\n* Mandatory Site Visit: It is recommended that the Bidder or a representative visit the work site on August 3, 2023, at 10:00 am PDT. Bidders must communicate with the Site Authority by August 2, 2023, to confirm attendance and provide the name(s) of the person(s) who will attend.\n* Basis of Selection: A bid must comply with the requirements of the notice and meet all mandatory technical evaluation criteria to be declared responsive.\n\n### Notice Details\n\n* Notice Type: Request for Proposal\n* Procurement Category: SRV\n* Procurement Method: Competitive - Open Bidding\n* Notice Status: Expired\n* Regions of Opportunity: Unspecified\n* Regions of Delivery: British Columbia\n* Trade Agreements: Canada has adopted various trade agreements, including the Canadian Free Trade Agreement (CFTA) and the Canada-European Union Comprehensive Economic and Trade Agreement (CETA).\n* Procuring Office: Natalie O\u2019Neill, Contracting Specialist, Agriculture and Agri-Food Canada\n* Contact Information:\n  - Phone: (306) 807-8740\n  - Email: natalie.oneill@agr.gc.ca\n  - Fax: N/A\n\n### Bid Submissions\n\nBids shall be submitted using the CPC Connect service"
}