{
    "CONTRACT_ID": "{\"referenceNumber-numeroReference\":\"cb-5107-45967358\"}",
    "type": "acquisition",
    "department": "CBSA",
    "procurement_category": "services",
    "short_summary": "Rental services for firearms indoor range facility",
    "description": "This contract is for rental services for firearms in an indoor range facility. The requirement is to provide a firearms range for approximately 120 days per year. The contractor must provide safety procedures and meet the prescribed standard policies. The contract period is from July 1st, 2023 to June 30th, 2024, with the option to extend the contract by four (4) additional one-year periods.",
    "estimated_value": 0,
    "date_posted": "April 28th, 2023",
    "duration_in_months": "14",
    "provinces": [
        "Ontario"
    ],
    "tags": [
        "Services",
        "Firearms"
    ],
    "full_summary": "### Advanced Contract Award Notice for Rental Services of Firearms Indoor Range Facility\n\n#### Overview\n\nThe Canada Border Services Agency (CBSA) is issuing an Advanced Contract Award Notice (ACAN) to pre-qualify suppliers interested in providing rental services for a firearms indoor range facility. This ACAN serves as a public notice indicating the CBSA's intention to award a contract for the rental of an additional firearms range facility in the Greater Toronto Area/Waterloo Region.\n\n#### Project Details\n\n* **Tender Reference Number:** CB-5107-45967358\n* **Project Title:** Rental services for firearms indoor range facility\n* **Commodity/Service Code (UNSPSC):** Lease and rental of property or building\n* **Notice Type:** Advanced Contract Award Notice\n* **Publication Date:** 2023-04-28\n* **Tender Closing Date:** 2023-05-15T14:00:00\n\n#### Requirements\n\nThe CBSA requires the rental services of an additional firearms range facility to provide armed Border Services Officers with firearms training, in accordance with prescribed standard policies. The tasks and deliverables include:\n\n* Provision of firearms range for approximately 120 days per year\n* Provision of safety procedures\n\n#### Security Requirements\n\nNo security requirements are associated with this project.\n\n#### Contract Details\n\n* **Contract Period:** July 1, 2023, to June 30, 2024, with the option to extend the contract for four additional one-year periods.\n\n#### Supplier Information\n\nSuppliers who consider themselves fully qualified and available to provide the services described in this ACAN may submit a statement of capabilities in writing to the contact person identified in this notice on or before the closing date and time.\n\n**Contact Information:**\n\n* Name: Marie-Pier Leblanc\n* Email: marie-pier.leblanc@cbsa-asfc.gc.ca\n\n#### Supplementary Documents\n\nThe following documents are available for download:\n\n* [English] ACAN PR71026 - Acan_en_0.pdf\n* [English] CBSA Standards on Firing Ranges.pdf\n* [French] Normes de l'ASFC sur les champs de tir.pdf\n* [French] ACAN PR71026 - Acan_fr_0.pdf\n\n(Note: The rewritten text aims to maintain the essential information from the original text while presenting it in a more professional and concise manner.) \n\nEstimated word count: 394 words\n\nNote: The attachments are kept the same as the original text since their format and location"
}