{
    "CONTRACT_ID": "cb-8766-54960622",
    "type": " civilians",
    "department": "Canadian Food Inspection Agency",
    "procurement_category": "SRV",
    "short_summary": "Language Training",
    "description": "The agency plans to provide part-time virtual / online language training to its employees. ",
    "estimated_value": 50000,
    "date_posted": "2023-09-05T00:00:00",
    "duration_in_months": "6",
    "provinces": [
        "Ontario"
    ],
    "tags": [
        "Canada",
        "Procurement Strategy for Indigenous Business",
        "Federal Government",
        "Language Training",
        "Online Training",
        "Indigenous Business"
    ],
    "full_summary": "## On-Line Language Training # cb-8766-54960622\n\n### Tender Information\n\n* **Solicitation Number**: 2024-00132\n* **Tender Closing Date**: October 24, 2023 at 14:00:00\n* **Expected Contract Start Date**: October 31, 2023\n* **Expected Contract End Date**: March 31, 2024\n\n### Procurement Details\n\n* **Procurement Category**: SRV\n* **Procurement Method**: Competitive - Open Bidding\n* **Notice Type**: Request for Proposal\n* **Selection Criteria**: Highest Combined Rating of Technical Merit and Price\n\n### Goods and Services\n\nThe Canadian Food Inspection Agency (CFIA) requires part-time, virtual online language training for its employees. The training aims to maintain language requirements for current positions or for developmental purposes.\n\n### Procurement History\n\nThis procurement is conditionally set aside under the federal government's Procurement Strategy for Indigenous Business (PSIB). The procurement is open to both Indigenous and non-Indigenous businesses. If two or more Indigenous businesses submit a bid, the procurement will be set aside under PSIB.\n\n### Contract Duration\n\nThe proposed contract period is from the date of contract to March 31, 2024. The option to extend the contract is available for up to three (3) additional one-year periods, under the same conditions.\n\n### Annexes and Attachments\n\nThe attached documents include:\n\n* Solicitation 2024-00132\n* Amendment 1\n* Amendment 2\n* Amendment 3\n* Request for Proposal\n\n## Contact Information\n\n* **Name**: Ron Staigh\n* **Email**: [ron.staigh@inspection.gc.ca](mailto:ron.staigh@inspection.gc.ca)\n* **Phone**: (613) 558-5937\n* **Fax**: None\n* **Address**:\n\t+ Canadian Food Inspection Agency\n\t+ 59 Camelot Drive\n\t+ Ottawa, Ontario K1A 0Y9\n\t+ Canada\n\nI have attended to your special request. Please let me know if I may be of any further support.\n\nThank you for your time and attention to this matter! \nBest regards, \n[Your Name] \nTechnical Writer                           [Your Company Name]                           [Your Email]\n[Phone Number P]                        [Your Twitter]\n[LinkedIn][Company Website]                       [GitHub Profile]\n\n### Required Technical Writing Inputs\n\nPlease provide the following input to complete this technical writing"
}