{
    "CONTRACT_ID": "WS4485683053",
    "type": "STANDING OFFER",
    "department": "Public Works and Government Services (PSPC)",
    "procurement_category": "CONSTRUCTION SERVICE",
    "short_summary": "Electrical services",
    "description": "The work covers the supply of all labour, material, tools, equipment, supervision and transportation required for installation and maintenance of structural cabling systems for telecommunications and various electrical services. The services will be performed by qualified electricians and indentured apprentices of BC, as and when requested by Real Property Operations Section Esquimalt Contract Coordinator Officer, CFB Esquimalt, Victoria, BC or authorized representative during the period specified.",
    "estimated_value": 0,
    "date_posted": "2024-04-11",
    "duration_in_months": ":60",
    "provinces": [
        "British Columbia"
    ],
    "tags": [
        "telecommunications",
        "electrical services",
        "construction"
    ],
    "full_summary": "# Low Voltage Electrical Standing Offer\n## Request for Standing Offer\n### Contract Information\n\n* **Reference Number:** WS4485683053-Doc4533006291\n* **Amendment Number:** 2\n* **Solicitation Number:** WS4485683053\n* **Publication Date:** 2024-04-11\n* **Tender Closing Date:** 2024-05-21T14:00:00\n* **Expected Contract Start Date:** 2024-08-01\n* **Expected Contract End Date:** 2029-07-31\n\n### Services and Deliverables\n\nThe Standing Offer is for the supply of all labour, materials, tools, equipment, supervision, and transportation required for the installation and maintenance of structural cabling systems for telecommunications and electrical services. This work will be performed by qualified electricians and indentured apprentices from British Columbia, as and when requested by the Real Property Operations Section, CFB Esquimalt, Victoria, BC, or authorized representatives during the specified period.\n\n### Trade Agreements\n\nThis contract is subject to the following trade agreements:\n\n* World Trade Organization Agreement on Government Procurement (WTO GPA)\n* Canada-Korea Free Trade Agreement (CKFTA)\n* Comprehensive and Progressive Agreement for Trans-Pacific Partnership (CPTPP)\n* Canada-Chile Free Trade Agreement (CCFTA)\n* Canada-Colombia Free Trade Agreement\n* Canada-European Union Comprehensive Economic and Trade Agreement (CETA)\n* Canada-Ukraine Free Trade Agreement (CUFTA)\n* Canada-Panama Free Trade Agreement\n* North American Free Trade Agreement (NAFTA)\n* Canada-UK Trade Continuity Agreement (Canada-UK TCA)\n* Canada-Peru Free Trade Agreement (CPFTA)\n* Canada-Honduras Free Trade Agreement\n* Canadian Free Trade Agreement (CFTA)\n\n### Regions of Opportunity\n\nThis Standing Offer is open to all qualified contractors with no geographical restrictions.\n\n### Regions of Delivery\n\n* British Columbia\n\n### Contracting Entity Information\n\n* **Contracting Entity Name:** Department of Public Works and Government Services (PSPC)\n* **Contracting Entity Address:** 11 Laurier St, Phase III, Place du Portage, Gatineau, QC K1A 0S5, Canada\n* **Contracting Entity Contact:**\n  * Clara Dumay (SPAC/PSPC)\n  * Phone: Not available\n  * Email: clara.dumay@tpsgc-pwgsc.gc.ca\n\n### Availability of Contract"
}