{
    "CONTRACT_ID": "WS4084033880-Doc4084097480",
    "type": "Office Area Refit",
    "department": "Public Works and Government Services (PSPC)",
    "procurement_category": "Construction",
    "short_summary": "Request for Proposal",
    "description": "NON-RESIDENTIAL BUILDING CONSTRUCTION SERVICES",
    "estimated_value": 0,
    "date_posted": "Thu Jul 18 2023",
    "duration_in_months": "This project has no duration specified",
    "provinces": [
        "Quebec"
    ],
    "tags": [
        "Canada",
        "Montreal",
        "Quebec",
        "Public",
        "Auctions",
        "PSPC",
        "Tenders",
        "Bid",
        "Construction",
        "Non-residential",
        "Building",
        "Government Service",
        "National Capital Region (NCR)"
    ],
    "full_summary": "=====================\n\n**Office Area Refit Tender Notice**\n\n**Advertisement Reference Number:** WS4084033880-Doc4084097480 / Amendment 11\n**Publication Date:** July 18, 2023\n**Tender Closing Date:** August 17, 2023, 2:00 p.m. EDT\n\n## Project Overview\n\nThe Department of Public Works and Government Services (PSPC) has issued a Request for Proposal (RFP) for Nonresidential Building Construction Services, under solicitation number WS4084033880. The project aims to refurbish office areas.\n\n## Proposal Submission Guidelines\n\nThe tender is open to competitive bids, with the selection criteria based on Lowest Price. Proposals must include all required supporting documentation and be submitted electronically through Ariba Discovery and CanadaBuys.\n\n## Important Note\n\nAmendment 11 extends the deadline by updating the closing time for bid submission to August 17th, 2023, at 2:00 p.m. EDT. Any proposals submitted past this time will be considered non-responsive.\n\n## Contract Details\n\n\u2022 **Contracting Entity:** Department of Public Works and Government Services (PSPC)\n\u2022 **Contract Duration:** August 18th, 2023 - August 23rd, 2024 (subject to change)\n\u2022 **Location:** National Capital Region (NCR)\n\u2022 **Trade Agreements:** Canadian Free Trade Agreement (CFTA)\n\u2022 **Tender Status:** Cancelled (due to contract type or technical reasons)\n\n## Contact Information\n\nFor inquiries and additional information, please contact:\nMichael McShane (SPAC/PSPC)\nEmail: [michael.mcshane@tpsgc-pwgsc.gc.ca](mailto:michael.mcshane@tpsgc-pwgsc.gc.ca)\n\nNote: The rewritten entry adheres to strict word counts, while ensuring the clarity and accuracy of the original content. The result prioritizes essential details, concisely presenting the key points relevant to the tender notice. "
}