{
    "CONTRACT_ID": "PW-22-01009356",
    "type": "Vacant Land",
    "department": "RCMP",
    "procurement_category": "SRV",
    "short_summary": "Acquire a piece of vacant land in the vicinity of Glovertown, NL.",
    "description": "Government of Canada wishes to acquire a two to six-acre piece of vacant land with municipal services in the vicinity of Glovertown. Land must be near the Transcanadia Highway or in the town of Glovertown. Details of service utilities, current zoning, and site plan must be included with the submission.",
    "estimated_value": 0,
    "date_posted": "2022-10-06",
    "duration_in_months": "]",
    "provinces": [
        "Newfoundland and Labrador"
    ],
    "tags": [
        "vacant land",
        "glovertown",
        "NL",
        "RCMP",
        "SRV",
        "RLT"
    ],
    "full_summary": "### Vacant Land Tender - Glovertown, NL\n\n#### Request for Proposals - Closed\n\n**Reference Number**: PW-22-01009356\n**Solicitation Number**: NL-1\n\nThe Royal Canadian Mounted Police (RCMP) invites Proposals for the acquisition of a two to six-acre (0.8 to 1.6 hectares) vacant land parcel with municipal services or the ability to install a well and septic system in the vicinity of Glovertown, Newfoundland and Labrador.\n\n**Location**: The site must be located near Glovertown along the Trans Canada Highway between Exit 25 and Exit 26, or within the boundary of Station Road along Main Street South to the edge of Terra Nova River.\n\n**Criteria**:\n\n* A minimum of 2 acres (0.8 hectares) in size\n* Direct road access or confirmation of ability to obtain access\n* Zoned commercial, institutional, or industrial\n* Rectangular in shape (preferable)\n* Close proximity to amenities such as service stations, financial institutions, and restaurants\n\n**Required Information**:\n\n* A map showing the location of the lands\n* Site plan\n* Current zoning description\n* Details of services/utilities\n* A statement as to the nature of the respondent's rights in the land\n* A completed Phase I Site Assessment (if available)\n* A completed Property Transfer Assessment Questionnaire\n\nAgents submitting a response must provide a letter from the owner authorizing them to do so.\n\n**Submission Requirements**:\n\n* Proposals must be submitted by email to Meghan Churchill at meghan.churchill@rcmp-grc.gc.ca.\n* Submissions must be received by October 21, 2022, at 5:00 PM (NST).\n\nThe RCMP may request additional information.\n\n**Attachments**:\n\n* Property Transfer Assessment Questionnaire (English)\n* Property Transfer Assessment Questionnaire (French)\n* Map of the required area\n\n#### Important Notes\n\n* The procurement category for this tender is Services (SRV).\n* The notice type is a Request for Proposal (RFP).\n* The procurement method is competitive, open bidding.\n* The selected contractor will be required to provide a detailed proposal outlining their plan and timeline for the acquisition and development of the land. \n\nThis rewritten entry is shorter, more to the point, and easier to read, while maintaining accuracy and adhering to a professional tone. I have condensed the information to fit within the 400-word limit while ensuring that all necessary details are included. Let me know if there's"
}