{
    "CONTRACT_ID": "S4897736",
    "type": "Temporary personnel services",
    "department": "Department of National Defense",
    "procurement_category": "Services",
    "short_summary": "Temporary Help Services Requirement",
    "description": "",
    "estimated_value": 0.0,
    "date_posted": "2024-04-05",
    "duration_in_months": "11",
    "provinces": [
        "Ontario"
    ],
    "tags": [
        "Secret",
        "IT"
    ],
    "full_summary": "### Temporary Help Services Requirement\n\n#### Solicitation Information\n\n* **Solicitation Number:** S4897736\n* **Tender Closing Date:** 2024-04-17T16:00:00\n\n#### Contract Details\n\nThe Department of National Defense is soliciting Temporary Help Services from qualified contractors. The contract is expected to start on 2024-04-22 and end on 2025-03-21.\n\nThe contract is a Request for Proposal (RFP) against the Supply Arrangement (SA) for the National Capital Region.\n\n#### Security Requirement\n\nA minimum security level of Secret is required for this contract.\n\n#### Description of the Requirement\n\nThe Department of National Defense is seeking contractors to provide temporary help services for the following areas:\n\n* Level of Bilingualism: None\n* Level of Security: Secret\n* Stream: 5.1 Computer Application Support\n* Category: Temporary Help Services\n* Project/ Program: None\n\n#### Contracting Entity Information\n\n* **Contracting Entity Name:** Department of National Defense\n* **Contracting Entity Address:**\n\t+ Address: 60 Moodie Drive\n\t+ City: Ottawa\n\t+ Province: ON\n\t+ Postal Code: K2H8G1\n\t+ Country: Canada\n\n#### Contact Information\n\n* **Contact Name:** CFSG(O-G) Temp Help\n* **Contact Email:** CFSGO-GTemporaryHelp-GSFCO-Gdaidetemporaire@forces.gc.ca\n* **Contact Phone:** 613971-7955\n\n#### Attachment\n\nThe tender package can be found at: https://canadabuys.canada.ca/sites/default/files/webform/tender_notice/35493/s4897736---method-2---rfp-%285.pdf\n\nThe attached document contains all the information necessary to respond to this solicitation. All prospective bidders must meet the requirements specified in the document.\n\nPlease note that this contract has expired and is no longer active. However, this information is provided for record-keeping purposes. \n\n Kindly format your rewritten output in nice markdown format. Include only the necessary and relevant sections with a clear formatting. \n\nNote: I rewrote the text to be more concise and clear. I also excluded information that was not relevant to the contract details. I made sure to maintain the original meaning and intent of the text while rephrasing it in a more professional manner.\n\nHere is the output:\n\n#### Temporary Help Services Requirement\n\n#### Solicitation Information\n\n* **Solic"
}