{
    "CONTRACT_ID": "SSC-23-00023670:T",
    "type": "Request for Proposal",
    "department": "Shared Services Canada",
    "procurement_category": "Goods",
    "short_summary": "X86 servers with maintenance and support",
    "description": "X86 servers with maintenance and support for Shared Services Canada",
    "estimated_value": 0,
    "date_posted": "2023-09-07",
    "duration_in_months": ", tenderStatus: ",
    "provinces": [
        "Ontario"
    ],
    "tags": [
        "x86",
        "servers",
        "maintenance",
        "support",
        "Shared Services Canada"
    ],
    "full_summary": "# Government Tender Announcement\n## X86 Servers with Maintenance and Support for Shared Services Canada\n\n### Tender Details\n\n* **Solicitation Number**: BPM019448/23670\n* **Tender Closing Date**: 2023-10-16T14:00:00\n* **Tender Status**: Expiring\n* **GSIN**: N7025 (ADP Input-Output and Storage Devices)\n* **Trade Agreements**: This tender is open to contractors registered under the Canada-Chile Free Trade Agreement, Canada-Korea Free Trade Agreement, Canadian Free Trade Agreement, Canada-Colombia Free Trade Agreement, Canada-Honduras Free Trade Agreement, and Canada-Panama Free Trade Agreement.\n* **Regions of Opportunity**: This tender is open to contractors within Canada.\n* **Regions of Delivery**: The servers will be delivered to Ontario (except National Capital Region).\n\n### Description of Goods and Services\n\nShared Services Canada is seeking bids for the supply of X86 servers, as well as ongoing maintenance and support services.\n\n### Amendment History\n\nThis tender has undergone several amendments to address supplier queries and update the terms and conditions of the contract. The amendments can be accessed through the SSC Procurement Portal.\n\n### Registration and Bidding Process\n\nSuppliers can register to bid on this tender through the SSC Procurement Portal. To register, please follow the link: https://supplier-fournisseur-sscp2pspc.ssc-spc.gc.ca/page.aspx/en/usr/login.\n\nNote that this tender has expired and is no longer valid. Therefore, the closing date is outdated. However, I will keep all other necessary information. Please let me know if I can make further adjustments. \n\nYour advice will be welcome. Thanks for your attention.  Edgar. \n\n# R\u00e9cit du gestionnaire de commandite\n\nLe Gestionnaire de l'achat, [Chantal, Deland], se trouve \u00e0 (400 Cooper Street Ottawa, R\u00e9gion de la Capitale nationale, K2P 2N1) ).\nNbr (343)551.7304\nP\u00e9riode de r\u00e9f\u00e9rence : Ao\u00fbt 1, 2023 \u2013 Octobre 16, 2023 ).\n\n# Non\n\n Index Du document!!\n\n Le Contrat est avant amendement \n\n2\n\n3\n\n4\n\n5\n\n6\n\n7\n\nN\u00e9nzi koyracarino arba    - quartaine sequence.\ntender.cl\u00e9sReferences,numer Tsseilincond.\n\n## give instance information. \n\nBMMM  Ses Ness farms"
}