{
    "CONTRACT_ID": "1000256252-001",
    "type": "Maintenance",
    "department": "Crown-Indigenous Relations and Northern Affairs Canada ",
    "procurement_category": "Service",
    "short_summary": "HVAC Maintenance Services in Iqaluit, Nunavut",
    "description": "Provide HVAC maintenance and building patrol services in Iqaluit, Nunavut.",
    "estimated_value": 500000,
    "date_posted": "2024-06-10",
    "duration_in_months": ".9",
    "provinces": [
        "Nunavut"
    ],
    "tags": [
        "Maintenance"
    ],
    "full_summary": "# Government Tender Announcement: HVAC Maintenance Services in Iqaluit, Nunavut\n## Job Title: Request for Proposal (RFP) for HVAC Maintenance Services\n### Reference Number: cb-977-19569346\n### Solicitation Number: 1000256252-001\n### Tender Closing Date: June 25, 2024, at 2:00 PM (14:00:00)\n\n## Background\nThe Department of Crown-Indigenous Relations and Northern Affairs Canada (CIRNAC) requires a reliable and experienced provider to deliver Heating, Ventilation, Air Conditioning (HVAC) maintenance and building patrol services in Iqaluit, Nunavut.\n\n## Objective\nThis Request for Proposal (RFP) is open only to Inuit firms registered on the Inuit Firm Registry. The proposed contract period will last from the contract award date to June 30, 2025. The resulting contract may include optional extensions of up to 3 additional one-year periods, subject to the same conditions.\n\n## Description of Work\nThe Department of CIRNAC requires a comprehensive service to maintain and repair the HVAC systems in Iqaluit, Nunavut. The successful bidder will be responsible for providing:\n\n* Regular maintenance and repair of the HVAC systems\n* Building patrols to ensure the systems are functioning properly\n* Security clearance: High reliability is required\n\n## Evaluation Criteria\nThe proposals will be evaluated based on:\n\n* Technical merit (40%)\n* Price (40%)\n* Past performance (20%)\n\n## Requirements\nThe following requirements must be met for the contract to be awarded:\n\n* Inuit Firm Registry registration\n* Security clearance: High reliability\n* Compliance with Comprehensive Land Claim Agreement (Nunavut)\n* Proof of business experience and qualifications\n* Compliance with the applicable laws and regulations\n\n## Contacts\nFor any inquiries or clarification, please contact Elly Ha at (000) 000-0000 or ellyhyeonkyeong.ha@sac-isc.gc.ca.\n\n## Tender Package\nThe tender package is available on the Canadabuy site. Interested vendors can access the package and submit their proposals by the deadline.\n\n**End of Tender Announcement** \n\nThis entry has been reformatted to make it easier to read and understand. I've also provided a clear and concise structure to make it easier to follow. Note that this is a summary of the original text, and you should review the original text for any important details that may have been omitted. \n\nHowever, I have"
}