{
    "CONTRACT_ID": "PW-23-01023038",
    "type": "Service Contract",
    "department": "Natural Resources Canada",
    "procurement_category": "SRV",
    "short_summary": "Hydrogen Service Contract",
    "description": "This contract is to assist the CanmetMATERIALS Research Centre in investigating the hydrogen uptake into pipeline steel and casing steel.",
    "estimated_value": 0.0,
    "date_posted": "2023-01-25",
    "duration_in_months": "What is the Estimated duration of this contract in months? (if not 0)",
    "provinces": [
        "Ontario"
    ],
    "tags": [
        "Hydrogen Service Contract",
        "CanmetMATERIALS Research Centre",
        "Natural Resources Canada",
        "Pipeline Steel",
        "Casing Steel"
    ],
    "full_summary": "## Hydrogen Service Contract\n### Contract Notice\n\n#### Document Reference\nProcurement Reference Number: PW-23-01023038\nSolicitation Number: 5000072187\n\n#### Contract Overview\nThe Natural Resources Canada\u2019s CanmetMATERIALS (CMAT) Research Centre invites contractors to submit a proposal for hydrogen service contract. The Centre requires contractors to investigate the hydrogen uptake into API X65 pipeline steel and P110 casing steel under near-pure hydrogen transportation and storage conditions. The Centre is looking for external support to:\n\n* Investigate the effect of surface conditions of X65 pipeline steel and P110 casing steel on hydrogen uptake under high pressure conditions and validate laboratory results.\n* Understand the role of operating parameters in hydrogen uptake with or without consideration of steel surface conditions.\n* Identify practical solutions to reduce hydrogen uptake.\n\n#### Tender Details\n\n* The contract is expected to run for an estimated period of 3 years from the date of contract award to February 28, 2026.\n* Tender closing date was February 20, 2023 at 13:00:00 hours.\n* Respondents can download the RFP documents from [here.](https://canadabuys.canada.ca/documents/pub/att/2023/01/25/f414d90ce30a66a8dff7fd8cb6c9e135/rfp_5000072187.pdf) (English) or [here](https://canadabuys.canada.ca/documents/pub/att/2023/01/25/4ade377fd1963805402d9c5d78ee1f76/ddp_5000072187.pdf) (French).\n* Contractors can also email Shazeen Dhanani, the Contract Specialist at [shazeen.dhanani@nrcan-rncan.gc.ca](mailto:shazeen.dhanani@nrcan-rncan.gc.ca) for inquiries.\n\n#### Contract Category\nThe procurement is classified under **SRV** and the technical subject matter is **Professional Services / Program Advisory Services**.\n\n#### Location\nThe contract will be delivered in **Ontario (except NCR)**.\n\n#### Important Dates\n\n* Tender closing date: February 20, 2023 at 13:00:00 hours.\n* Contract award date: TBD. \n\nMake sure to only include relevent information and refrain from rambling. Also, ensure to present your answer in the requested markdown format. You have a 400-word limit.  Good"
}