{
    "CONTRACT_ID": "WS4317503849-Doc4393930034",
    "type": "Contract",
    "department": "Department of Public Works and Government Services (PSPC)",
    "procurement_category": "Goods",
    "short_summary": "Up to 2 Regional Individual Standing Offers (SiO) will be issued per Zone: One PSIB stream and one non- PSIB stream formerly known as RISO - Zone 1. In the event that two Standing Offers are issued for one zone, the PSIB Standing Offer holder will have First Right of Refusal in the issuance of call-ups.  The Correctional Service of Canada (CSC) has a requirement to supply federal institutions under its control with standardized appliances and pricing on washers, dryers, refrigerators, freezers, ranges and microwaves. Up to 2 Standing Offers will be issued per Zone. Offerors must provide firm unit pricing for all items listed in the Basis of Payment to be considered for the issuance of a Standing Offer for this requirement. ",
    "description": "AMENDMENT TO CLOSING TIME. The same day: $14:00 EDT. A provider choice prepare proper documentation.  19 April 2024. Tenders resulting from economic relationship of partners may come in all encouraging hint Cloud.",
    "estimated_value": 2000000.0,
    "date_posted": "2024-02-25",
    "duration_in_months": ")_5_31}",
    "provinces": [
        "Ontario"
    ],
    "tags": [
        "Offeror Moderate Experience "
    ],
    "full_summary": "### PSIB - 21401-230009 - Institutional Appliances RFSO - Zone 1\n\n\n#### Tender Information\n* **Tender Number** : WS4317503849-Doc4393930034\n* **Amendment Number** : 7\n* **Publication Date** : 2024-02-25\n* **Tender Closing Date** : 2024-04-19T14:00:00\n* **Expected Contract Start Date** : 2024-03-29\n* **Expected Contract End Date** : 2029-03-31\n* **Tender Status** : Cancelled\n\n#### Procurement Details\n* **Procurement Category** : Goods\n* **Procurement Method** : Competitive - Open bidding\n* **Selection Criteria** : Lowest Price\n* **Trade Agreements** : None\n* **Regions of Opportunity** : Ontario (except NCR)\n\n#### Contracting Entity\n* **Contracting Entity Name** : Department of Public Works and Government Services (PSPC)\n* **Contracting Entity Address** : 11 Laurier St, Phase III, Place du Portage, Gatineau, Quebec, K1A 0S5, Canada\n\n#### Tender Description\nThis tender has been set aside under the federal government's Procurement Strategy for Indigenous Business (PSIB). To be considered, a supplier must certify that it qualifies as an Indigenous business as defined under PSIB and that it will comply with all requirements of PSIB. The Correctional Service of Canada (CSC) requires standardized appliances and pricing on washers, dryers, refrigerators, freezers, ranges, and microwaves to be purchased on an as-needed basis.\n\n#### Requirements\nOfferors must provide firm unit pricing for two years for all items listed in the Basis of Payment to be considered for the issuance of a Standing Offer for this requirement. Suppliers are required to provide detailed documentation and bid submission by 2024-04-19T14:00:00. Late submissions will be considered non-responsive.\n\n\n#### Contact Information\nName: Nimuan, Kat\nEmail: [kat.nimuan@tpsgc-pwgsc.gc.ca](mailto:kat.nimuan@tpsgc-pwgsc.gc.ca)\nLanguage Preference: English and FrenchKataobi the best for now!)I'm happy to help you with rewriting the government tender announcement in a more professional manner. Here is the rewritten text:\n\n**PSIB - 21401-230"
}