{
    "CONTRACT_ID": "PW-23-01031128",
    "type": "MOVING SERVICES",
    "department": "Employment and Social Development Canada",
    "procurement_category": "SRV",
    "short_summary": "Moving of furniture inventory from Employment and Social Development Canada centers to other locations.",
    "description": "The primary objective is the moving of furniture inventory from Employment and Social Development Canada centers to other locations. This includes the loading, transportation and unloading of furniture from Service Canada sites to other sites. A comprehensive list is provided for this purpose.The requested deliveries are for several different sites and the delivery dates are spread over a period from contract award to March 31, 2024. The requested delivery dates can be found in the attached annex (Delivery List).There are security requirements associated with this requirement. For additional information, consult Part 6 - Security, Financial and Other Requirements, and Part 7 - Resulting Contract Clauses. For more information on personnel and organization security screening or security clauses, Bidders should refer to the Contract Security Program of Public Works and Government Services Canada (http:mpclipboard[translated into idiomatic English]",
    "estimated_value": 0,
    "date_posted": "2023-03-30",
    "duration_in_months": "12",
    "provinces": [
        "Quebec"
    ],
    "tags": [
        "Transportation",
        "Moving Services"
    ],
    "full_summary": "### Government Tender Announcement\n\n#### Title\nMOVING SERVICES / SERVICES DE D\u00c9M\u00c9NAGEMENT\n\n#### Tender Reference\n* PW-23-01031128\n\n#### Solicitation Number\n* 100022595\n\n#### Publication Date\n* 2023-03-30\n\n#### Tender Closing Date\n* 2023-04-24T14:00:00\n\n#### Notice Status\n* Expired / Expir\u00e9\n\n#### Procurement Details\n\n* **Procurement Category**: Services / SRV\n* **Notice Type**: Request for Proposal / Demande de propositions\n* **Procurement Method**: Competitive - Open Bidding / Concurrentielle - Invitation ouverte \u00e0 soumissionner\n\n#### Applicable Trade Agreements\n\n* Canada-Honduras Free Trade Agreement / Accord de libre-\u00e9change Canada-Honduras\n* Canada-Peru Free Trade Agreement (CPFTA) / Accord de libre-\u00e9change Canada-P\u00e9rou (ALECP)\n* Canada-Colombia Free Trade Agreement / Accord de libre-\u00e9change Canada-Colombie\n* Canadian Free Trade Agreement (CFTA) / Accord de libre-\u00e9change canadien (ALEC)\n* Canada-Panama Free Trade Agreement / Accord de libre-\u00e9change Canada-Panama\n* Canada-Korea Free Trade Agreement (CKFTA) / Accord de libre-\u00e9change Canada-Cor\u00e9e\n* Canada-Chile Free Trade Agreement (CCFTA) / Accord de libre-\u00e9change Canada-Chili (ALECC)\n\n#### Contracting Entity\n\n* **Employment and Social Development Canada** / Emploi et D\u00e9veloppement social Canada\n* **Address:** 142 Promenade du Portage, Gatineau, Quebec J8X 2K3, Canada\n* **End User:** Employment and Social Development Canada\n* **Contact Person:** Julie Barrette, Contracting Authority\n\t+ Email: julie.barrette@hrsdc-rhdcc.gc.ca\n\t+ Telephone: 343-551-9889\n\n#### Tender Description\nThe primary objective of this contract is the movement of furniture inventory from Employment and Social Development Canada centers to other locations. The scope of work includes the loading, transportation, and unloading of furniture from Service Canada sites to other sites. A comprehensive delivery list is provided as an annex.\n\nSecurity requirements and additional requirements are outlined in Part 6 and 7 of the tender document. Bidders are advised to consult the Public Works and Government Services Canada website for further information on personnel and"
}