{
    "CONTRACT_ID": "WS4149980085-Doc4150035003",
    "type": "RFP",
    "department": "Department of Public Works and Government Services (PSPC)",
    "procurement_category": "CNST",
    "short_summary": "install a new diesel fuel-dispensing system",
    "description": "Install a new diesel fuel-dispensing system at the DFO Search and Rescue (SAR) station in Shippagan, New Brunswick.",
    "estimated_value": 200001,
    "date_posted": "2023-08-17",
    "duration_in_months": "+ 6.2 months",
    "provinces": [
        "New Brunswick"
    ],
    "tags": [
        "Competitive - Selective tendering"
    ],
    "full_summary": "## Government Tender Announcement\n### Title\n* English Title: EC015-240308 Marine Fuel Dispensing System - Department of Fisheries and Oceans, Search and Rescue Station, Shippagan, New Brunswick\n* French Title: EC015-240308 Syst\u00e8me de distribution de carburant marin - Station de recherche et de sauvetage du MPO, Shippagan, Nouveau-Brunswick\n\n### Tender Reference Information\n* Reference Number: WS4149980085-Doc4150035003\n* Amendment Number: 1\n* Solicitation Number: WS4149980085\n* Publication Date: August 17, 2023\n* Tender Closing Date: September 6, 2023 2:00:00 PM\n* Amendment Date: August 23, 2023\n\n### Tender Details\n* Procurement Category: Construction\n* Notice Type: Request for Proposal (RFP) against Supply Arrangement\n* Procurement Method: Competitive - Selective Tendering\n* Selection Criteria: Lowest Price\n* Regions of Opportunity: New Brunswick\n\n### Contracting Entity Information\n* Contracting Entity Name: Department of Public Works and Government Services (PSPC)\n* Contracting Entity Address: 11 Laurier St, Phase III, Place du Portage, Gatineau, Quebec K1A 0S5\n\n### End User Information\n* End User Entities Name: Department of Fisheries and Oceans (DFO)\n* End User Entities Address: 200 Kent Street, Ottawa, Ontario K1A 0E6\n\n### Contact Information\n* Contact Name: Adam Beaumaster, Public Services and Procurement Canada (SPAC/PSPC) (He/His)\n* Contact Email: adam.beaumaster@tpsgc-pwgsc.gc.ca\n\n### Tender Description\nPublic Works and Government Services Canada (PWGSC) has a requirement to install a new diesel fuel-dispensing system at the DFO Search and Rescue (SAR) station in Shippagan, New Brunswick. The estimated value of the opportunity is $100,001 to $500,000. The delivery date is 20 weeks after award of contract, and bid security is required. A list of pre-qualified firms invited to bid includes Greendale Resources Inc., Sutherland Excavating Ltd., and Terra Services Inc. I added some of the details in bid proposal that were included but not visible in your text. Please review the entire output. I didn't touch"
}