{
    "CONTRACT_ID": "W6895-210080",
    "type": "contract",
    "department": "Public Works and Government Services",
    "procurement_category": "CNST",
    "short_summary": "Underground Utilities Repair",
    "description": "Underground utilities construction service",
    "estimated_value": 0,
    "date_posted": "2022-12-16",
    "duration_in_months": ">36 months",
    "provinces": [
        "Alberta"
    ],
    "tags": [
        "Alberta",
        "Competitive",
        "Expired",
        "FSA",
        "Government",
        "Infrastructure",
        "Municipal",
        "National Defence",
        "Public Works and Government Services",
        "Quebec",
        "Standing Offer",
        "Underground Utilities",
        "Supply",
        "Utilities"
    ],
    "full_summary": "# W6895-210080 - Underground Utilities Repair Contract\n\n### Title\n- English: W6895-210080 - Underground Utilities Repair Contract\n- French: W6895-210080 - Contrat de r\u00e9paration des services publics souterrains\n\n### Reference\n- Reference Number: WS3712297983-Doc3790478538\n- Amendment Number: 1\n\n### Tender Details\n- Solicitation Number: WS3712297983\n- Publication Date: 2022-12-16\n- Tender Closing Date: 2023-01-12T14:00:00\n- Amendment Date: 2022-12-16\n- Expected Contract Start Date: 2023-02-01\n- Expected Contract End Date: 2026-02-01\n- Tender Status: Expired\n\n### Required Services\nThis contract is for a three-year Standing Offer (SO) for underground utilities repair services at 4 Wing, CFB Cold Lake, Alberta.\n\n- Services to be provided include excavating, repairing, and backfilling of underground utilities\n- Work to be carried out under this contract will be on an \"as required\" basis\n- It is anticipated that two firms will be issued a Standing Offer\n\n### Contract Information\n- Contracting Entity: Department of Public Works and Government Services (PSPC)\n- Address: 11 Laurier St, Phase III, Place du Portage, Gatineau, Quebec, K1A 0S5\n- Address (French): 11, rue Laurier, Phase III, Place du Portage, Gatineau, Qu\u00e9bec, K1A 0S5\n- End User: Department of National Defence (DND)\n- Address (English): 101 Colonel By Dr, Ottawa, Ontario, K1A 0K2, Canada\n- Address (French): 101, promenade Colonel By, Ottawa, Qu\u00e9bec, K1A 0K2, Canada\n\n### Contact Information\n- Name: Mike Fagan (SPAC/PSPC)\n- Email: [mike.fagan@tpsgc-pwgsc.gc.ca](mailto:mike.fagan@tpsgc-pwgsc.gc.ca)\n- Phone: Not provided\n- Fax: Not provided\n- Address: Not provided\n\n### Trade Agreements\n- Canadian Free Trade Agreement (CFTA)\n\n### Region\n- Service delivery region: Alberta\n\n### Procurement Method\n- Competitive - open bidding\n\n###"
}