{
    "CONTRACT_ID": "WS4460181658",
    "type": "Request for Standing Offer",
    "department": "Department of Public Works and Government Services (PSPC)",
    "procurement_category": " Goods and Services",
    "short_summary": "This is not an actual procurement. This is a test of the SAP Ariba system.",
    "description": "This is not an actual procurement. This is a test of the SAP Ariba system. Suppliers, please do not act on this notice.",
    "estimated_value": 0,
    "date_posted": "2024-02-26",
    "duration_in_months": "timeframe not specified",
    "provinces": [
        "Quebec"
    ],
    "tags": [
        "Request for Standing Offer",
        "Competitive",
        "Canada"
    ],
    "full_summary": "----------------\n### Fictitious RFSO - Test of SAP Ariba\n#### Tender ID: WS4460181658\n#### Language: English\n\n**Procurement Category:** Goods and Services\n**Solicitation Method:** Competitive Open Bidding\n**Notice Type:** Request for Standing Offer\n\n**Tender Information**\n\n* **Tender Closing Date:** February 25, 2024, 2:00 PM (EST)\n* **Publication Date:** February 26, 2024\n* **Expected Contract Start Date:** [Not Applicable]\n* **Expected Contract End Date:** [Not Applicable]\n* **Solicitation Number:** WS4460181658\n\n**Procurement Description**\n\nThis is a test tender notice to validate the SAP Ariba system. As a result, this tender is not a legitimate procurement opportunity, and suppliers are not expected to submit quotations.\n\n**Trade Agreements**\n\nThis procurement is subject to the following trade agreements:\n\n* Canada-European Union Comprehensive Economic and Trade Agreement (CETA)\n* Comprehensive and Progressive Agreement for Trans-Pacific Partnership (CPTPP)\n* Canadian Free Trade Agreement (CFTA)\n* Canada-UK Trade Continuity Agreement (Canada-UK TCA)\n* Canada-Peru Free Trade Agreement (CPFTA)\n* Canada-Honduras Free Trade Agreement\n* Canada-Ukraine Free Trade Agreement (CUFTA)\n* Canada-Colombia Free Trade Agreement\n* Canada-Panama Free Trade Agreement\n* Canada-Korea Free Trade Agreement (CKFTA)\n* World Trade Organization Agreement on Government Procurement (WTO GPA)\n\n**Regions of Delivery**\n\n* Canada\n* Service will be delivered within Canada\n\n**Contact Information**\n\nThe contracting entity for this procurement is:\n\n* Department of Public Works and Government Services (PSPC)\n* Address: 11 Laurier St, Phase III, Place du Portage, Gatineau, Quebec, Canada, K1A 0S5\n* Contact: April Charron (SPAC/PSPC) - april.charron@tpsgc-pwgsc.gc.ca\n* Phone: [Not Applicable]\n* Fax: [Not Applicable]\n\n Please note that this tender is not a legitimate procurement opportunity, and any quotations received will not be considered. Suppliers are advised against taking any action in response to this notice. [1]\n\nEnd of Entry.\n\nNext Steps for Supplier\n\nPlease refrain from submitting any quotations or taking any further action in response to this notice, as this is not a legitimate procurement opportunity. If"
}