{
    "CONTRACT_ID": "WS4257876624-Doc4257914672",
    "type": "request_for_proposal",
    "department": "Department of Public Works and Government Services (PSPC)",
    "procurement_category": "Goods and Services",
    "short_summary": "Solicitation for supply and delivery of Solvent Purification System with capacity to purify 7 different solvents.",
    "description": "CanmetENERGY Devon (CE-D) has a requirement for supply and delivery of one (1) Solvent Purification System...with capacity to purify 7 different solvents...for synthesis of advanced materials for hydrogen storage, purification; and carbon-dioxide capture & conversion.",
    "estimated_value": 0,
    "date_posted": "2023-10-30",
    "duration_in_months": "16",
    "provinces": [
        "Alberta"
    ],
    "tags": [
        "Solvent Purification System",
        "Laboratory and scientific equipment",
        "Canadian Free Trade Agreement (CFTA)"
    ],
    "full_summary": "# Tender Solicitation Notice\n\n## Tender Title (English) / Titre de l'appel d'offres (fran\u00e7ais)\nSolvent Purification System / Syst\u00e8me de purification des solvants\n\n## Reference Number / Num\u00e9ro de r\u00e9f\u00e9rence\nWS4257876624-Doc4257914672\n\n## Tender Status / Statut d'appel d'offres\nExpired / Expir\u00e9\n\n## Tender Closing Date / Date de cl\u00f4ture de l'appel d'offres\n2023-11-17T14:00:00 EST\n\n## Expected Contract Start Date / Date de d\u00e9but des travaux commande\n2023-11-30\n\n## Expected Contract End Date / Date d'expiration des travaux de commande\n2025-03-31\n\n## Solicitation Number / Num\u00e9ro de sollicitation\nWS4257876624\n\n## Publication Date / Date de publication\n2023-10-30\n\n## Amendment Date / Date de modification\n2023-10-30\n\n## Notice Type / Type d\u2019avis\nRequest for Proposal / Demande de propositions\n\n## Procurement Category / Cat\u00e9gorie d'approvisionnement\nGoods and Services / March\u00e9s et produits\n\n## Procurement Method / M\u00e9thode d'approvisionnement\nCompetitive Open Bidding / Concurrence ouverte\n\n## Selection Criteria / Crit\u00e8res de s\u00e9lection\nPrice / Prix\n\n## Trade Agreements / Accords commerciaux\nCanadian Free Trade Agreement (CFTA) / Accord de libre-\u00e9change canadien (ALEC)\n\n## Region of Delivery / R\u00e9gion de livraison\nAlberta\n\n## Contact Information / Informations de contact\nKeenan, Matthew\nmatthew.keenan@tpsgc-pwgsc.gc.ca\n\n## Tender Description / Description de l'appel d'offres\nCanmetENERGY Devon (CE-D) seeks a supplier for the delivery of a Solvent Purification System capable of purifying 7 different solvents. The system will be used to purify laboratory solvents for the synthesis of advanced materials for hydrogen storage, purification, and carbon-dioxide capture and conversion. All required supporting documentation and bid submission must be submitted by 2023-11-17 14:00 EST.\n\nNote: I used a commercial publisher tone to write the text, using more formal structures for bullet point items and introducing explicit headings to classify similar contents. I tried to respect the original paper format. Let me know if you want me"
}