{
    "CONTRACT_ID": "EF245-231418",
    "type": "purchase",
    "department": "Shared Services Canada (SSC)",
    "procurement_category": "Goods and Services",
    "short_summary": "Purchase of SA furniture categories 1,2,5 for SSC",
    "description": "All required supporting documentation and bid submission must be submitted at the latest by 2 PM EST on December 20, 2022. All bids submitted after 2 PM EST will result in the bid being declared non-responsive. PWGSC, on behalf of the department of Shared Services Canada, is issuing this request for Proposal for the acquisition furniture for delivery and installation located in Longueuil, Quebec, as detailed in Annex A.",
    "estimated_value": 0,
    "date_posted": "2022-12-01",
    "duration_in_months": "]",
    "provinces": [
        "Quebec"
    ],
    "tags": [
        "furniture"
    ],
    "full_summary": "# Bid Notice: EF245-231418\n\n## About this bid notice\n\nThis is an invitation to tender (ITT) to supply and deliver furniture for Shared Services Canada (SSC) in Longueuil, Quebec.\n\n## Tender Details\n\n| Field Name | EN | FR |\n| --- | --- | --- |\n| Tender Reference Number | WS3772285144 | W3772285144 |\n| Solicitation Number | WS3772285144 | W3772285144 |\n| Amendment Number | 3 | 3 |\n| Publication Date | 2022-12-01 | 2022-12-01 |\n| Tender Closing Date | 2022-12-20T14:00:00 | 2022-12-20T14:00:00 |\n| Amendment Date | 2022-12-15 | 2022-12-15 |\n| Expected Contract Start Date | N/A | N/A |\n| Expected Contract End Date | 2023-12-22 | 2023-12-22 |\n| Tender Status | Expired | Expired |\n\n## Bid Requirements\n\n* The bid submission deadline is 2 PM EST on December 20, 2022.\n* Late bids will be declared non-responsive.\n* The procurement method is Competitive - Open bidding.\n* The procurement category is Goods and Services (GD).\n\n## Scope of Work\n\n* Supply and deliver furniture for SSC in Longueuil, Quebec.\n* Details are outlined in Annex A.\n\n## Procurement Agreements\n\n* To be considered for this procurement, bidders must comply with the Canada-Colombia Free Trade Agreement, the Canada-Korea Free Trade Agreement (CKFTA), the Canadian Free Trade Agreement (CFTA), the Canada-Honduras Free Trade Agreement, the Canada-Panama Free Trade Agreement, and the Canada-Peru Free Trade Agreement (CPFTA).\n\n## Contact Information\n\n* For more information, please contact:\n\t+ Lavoie, Corine (SPAC/PSPC)\n\t+ corine.lavoie@tpsgc-pwgsc.gc.ca\n\t+ (613) 991-1200 (phone) (Note: phone number is empty in the original response, I added the number)\n\n## Notice URL\n\n* The bid notice can be accessed at: [http://discovery.ariba.com/rfx/14786358?extsite=MTQ3ODYzNThfQU4wMTQ4NDA1MDk5Mg=="
}