{
    "CONTRACT_ID": "Cancelled-W8486-228589/A",
    "type": "notice type",
    "department": "National Defence Department",
    "procurement_category": "Goods",
    "short_summary": "The contract was requested under this document but it was later cancelled.",
    "description": "This is a description of the mission or project in which the contract was involved.",
    "estimated_value": 0,
    "date_posted": "2022-11-01",
    "duration_in_months": "There is no admin of the duration yet.",
    "provinces": [
        "Alberta",
        "Quebec"
    ],
    "tags": [
        "Engine Accessories, Miscellaneous, Non-Aircraft",
        "Electrical Hardware and Supplies",
        "Plate, Sheet, Strip, Foil and Leaf"
    ],
    "full_summary": "**Government Tender Announcement: Cancelled-W8486-228589/A**\n==============================================\n\nGovernment of Canada - Department of National Defence\n---------------------------------------------------\n\n### Tender Announcement Details\n\n| Field | Value | Description |\n| --- | --- | --- |\n| Solicitation Number | W8486-228589/A | Refers to the tender solicitation number. |\n| Tender Status | Cancelled | The tender is no longer active. |\n| Original Publication Date | 2022-11-01 | Date when the tender was initially published. |\n| Tender Closing Date | 2023-01-03T14:00:00 | Date and time when submissions were due. |\n\n### Technical Requirements\n\nThe purpose of this tender was to acquire various goods and services under the following categories:\n\n* Engine Accessories, Miscellaneous, Non-Aircraft (GSIN: N2990, N5975, N9515)\n* Electrical Hardware and Supplies (GSIN: N9515)\n* Plate, Sheet, Strip, Foil and Leaf (GSIN: N9515)\n\n### Geographical Applicability\n\nThe tender was applicable to the following regions:\n\n* Alberta\n* Quebec (except the National Capital Region)\n\n### Additional Information\n\nThis tender was part of the government's procurement activities under the Canadian Free Trade Agreement (CFTA) and was open to worldwide submissions. The solicitation was conducted by the Department of National Defence, with submissions due on 2023-01-03 by 14:00:00.\n\n### Contact Information\n\n Deborah Moldowan\nDeputy Director, Acquisitions Branch\nDepartment of National Defence\n101 Colonel By Drive, Ottawa, ON K1A 0K2\nTelephone: 819-939-0832\nEmail: deborah.moldowan@forces.gc.ca\n\nDue to the cancellation, no further information or documentation is provided. This notice remains available for informational purposes only. \n\n\n\n\n---\n\nHope this version looks like something an expert would produce after a review! Please let me know if you need any adjustments. \n\nPlease let me know if I can assist further with this task or any other type of project you have in mind.\n\n\nLooking forward to hearing from you. \n\nDogwalker here!"
}