{
    "CONTRACT_ID": "BPM020890/25664",
    "type": "Red Hat or Equivalent M&S Renewal",
    "department": "Shared Services Canada",
    "procurement_category": "Goods",
    "short_summary": "Red Hat or Equivalent M&S Renewal for Shared Services Canada",
    "description": "Red Hat or Equivalent M&amp;S Renewal for Shared Services Canada Bidders... submission and answers questions raised by suppliers.",
    "estimated_value": 0,
    "date_posted": "2024-02-16",
    "duration_in_months": "url scaffold pattern not provided - added ",
    "provinces": [
        "Ontario"
    ],
    "tags": [
        "Red Hat",
        "Software",
        "Maintenance",
        "Renewal"
    ],
    "full_summary": "### Red Hat or Equivalent M&S Renewal for Shared Services Canada - BPM020890\n\n#### Tender Overview\n\nThe Shared Services Canada (SSC) has issued a tender for the renewal of Red Hat or equivalent maintenance and support (M&S) services. This tender, BPM020890, was initially announced on February 16, 2024, and is a request for proposal (RFP) under a competitive open-bidding process (COMMITTED).\n\n#### Key Tender Details\n\n- **Reference Number:** SSC-24-00025664: T\n- **Publication Date:** February 16, 2024\n- **Tender Closing Date:** March 4, 2024, at 2:00 PM EST\n- **Expected Contract Start/End Dates:** None specified\n- **Procurement Category:** Goods and Services (GD)\n- **Notice Type:** Request for Proposal (RFP)\n- **Procurement Method:** Competitive Open-Bidding\n- **Regions of Opportunity:** Canada\n- **Regions of Delivery:** Ontario (excluding the National Capital Region)\n\n#### Solicitation Documents and Amendments\n\nThe tender solicitation package is available for download from the SSC's website. The tender description is available in both English and French. The solicitation has undergone five major amendments:\n\n- **Amendment 1:** To correct the French title of the solicitation.\n- **Amendment 2:** To update the Annex A - List of Initial Deliverables.\n- **Amendment 3:** To address supplier questions, update line items #3 and #39 in the Annex A, and provide additional context.\n- **Amendment 4:** To answer supplier questions.\n- **Amendment 5:** To address supplier questions and finalize the solicitation package.\n\n#### Registration Process\n\nTo participate in the tender, potential bidders must register on the SSC's Supplier Portal. Registration enables bidders to access solicitations, submit proposals, receive updates and amendments, and be awarded contracts.\n\n#### Contact Information\n\nFor any inquiries, please contact:\n\n- **Chantal Deland**\n- **Phone:** 343-551-7304\n- **Email:** [Email will be shared upon request]\n- **Address:** 400 Cooper Street, Ottawa, ON K2P 2N1\n\n#### Documents and Attachments\n\nThe tender solicitation package includes the following attachments:\n\n* [Download link to tender package in English](https://sscp2pspc.ssc-spc.gc.ca/page.aspx/en/fil/download_public/82FA69E8"
}