{
    "CONTRACT_ID": "PW-22-01007010",
    "type": "Request for Proposal",
    "department": "Department of National Defence",
    "procurement_category": "SRV",
    "short_summary": "2 consultant resource from the Task and Solutions Professional Services Stream 1 Human Resources Services Stream",
    "description": "The Department of National Defence (DND) has a requirement for 2 consultant resource from the Task and Solutions Professional Services Stream 1 Human Resources Services Stream at the Junior level. The Junior Compensation consultants must conduct quality assurance reviews, support the QA program with verification of payroll transactions as required, support the quarterly and biweekly reporting and provide recommendations, as required.",
    "estimated_value": 0,
    "date_posted": "2022-09-13",
    "duration_in_months": ",     ",
    "provinces": [
        "Ontario"
    ],
    "tags": [
        " Request for Proposal",
        "Competitive - Open bidding",
        "TSPS",
        "human-resource"
    ],
    "full_summary": "# [ **Task and Solutions Professional Services (TSPS) Stream 1 Compensation Consultant](#section-1)\n\n## [Title](#title)\nEnglish: Task and solutions professional services (TSPS), Stream 1 Compensation Consultant\nFrench: Services professionnels centr\u00e9s sur les t\u00e2ches et les solutions (TSPS), volet 1 Expert-conseil en r\u00e9mun\u00e9ration\n\n## [Reference Information](#reference-information)\n* Reference Number: PW-22-01007010\n* Solicitation Number: 2022-ADMHRCIV-0032\n* Amendment Number: 0\n* Publication Date: 2022-09-13\n* Tender Closing Date: 2022-10-24T14:00:00 (Expired)\n\n## [Procurement Information](#procurement-information)\n* Procurement Category: SRV (Services)\n* Procurement Method: Competitive - Open Bidding\n* Notice Type: Request for Proposal (RFP)\n* Regions of Opportunity: Ontario (except NCR)\n\n## [Contracting Entity](#contracting-entity)\n* Department of National Defence (DND)\n* Address: 101 Colonel By Dr, Ottawa, ON, K1A 0K2, Canada\n\n## [Requirements Summary](#requirements-summary)\nThe Department of National Defence has a requirement for 2 Junior level consultants from the Task and Solutions Professional Services (TSPS) Stream 1 Human Resources Services Stream. The consultants must:\n\n* Conduct quality assurance reviews\n* Support the QA program with verification of payroll transactions\n* Provide recommendations, as required\n\n## [Contact Information](#contact-information)\n* Name: Emely Ospino\n* Email: emely.ospino@forces.gc.ca\n* Phone: 613-901-6341\n* Address: 60 Moodie Drive, Ottawa, ON, K1A 0K2, Canada\n\nNote: As the information shared by the contractor is already quite large, I will omit the trade agreements and GSN information for simplicity. If it is required, please let me know and I will include it.\n\nIt is worth noting that this entry serves as an announcement for an expired tender. Therefore, submissions are not being accepted at this time.  If you would like me to draft a fresh tender announcement for a new contract opportunity, please let me know and I will create it for you.  *enter information as needed* . \n\n### Note on Functions\nI have reformatted the text"
}