{
    "CONTRACT_ID": "cb-851-98558339",
    "type": "project management",
    "department": "Foreign Affairs, Trade and Development",
    "procurement_category": "SRV",
    "short_summary": "Field Support Services Project (FSSP) in Nigeria",
    "description": "Global Affairs Canada requires the services of a Contractor to ensure the quality and relevance of Canada\u2019s support in responding to Nigeria\u2019s development challenges.",
    "estimated_value": 0,
    "date_posted": "04/30/2024",
    "duration_in_months": "CLOSING DATE: 06/18/2024",
    "provinces": [],
    "tags": [
        "Free Trade Agreement",
        "World Trade Organization",
        "North American Free Trade Agreement",
        "Canada-UK Trade Continuity Agreement",
        "Canada-Peru Free Trade Agreement",
        "Canada-Panama Free Trade Agreement",
        "Canada-Chile Free Trade Agreement",
        "Canada-Colombia Free Trade Agreement",
        "Canada-Honduras Free Trade Agreement",
        "Canada-Ukraine Free Trade Agreement",
        "Canada-European Union Comprehensive Economic and Trade Agreement",
        "Canada-Korea Free Trade Agreement",
        "Comprehensive and Progressive Agreement for Trans-Pacific Partnership",
        "entities_qualifying",
        "profiling_unit",
        "${Cost unknown}",
        " questionsNonce"
    ],
    "full_summary": "# Field Support Services Project (FSSP) in Nigeria\n**Contracting Authority:** Department of Foreign Affairs, Trade and Development\n\n**Contract Notice Reference:** CB-851-98558339 (Amendment Number 5, Solicitation Number 23-238135)\n**Contract Notice Publication Date:** April 30, 2024\n**Contract Notice Closing Date:** June 18, 2024\n\n**Tender Status:** Expired\n\n**Summary:**\n\nGlobal Affairs Canada is seeking a contractor to provide technical, administrative, financial, and logistical support services for the Field Support Services Project (FSSP) in Nigeria. The project aims to ensure the quality and relevance of Canada's support in addressing Nigeria's development challenges. The contractor will be required to provide technical expertise with local knowledge and experience, sector studies, and strategies to aid effectiveness activities.\n\n**Key Services:**\n- Project management services\n- Business administration services\n- Financial assistance services\n\n**Procurement Details:**\n- Procurement category: SRV\n- Procurement method: Competitive - Open Bidding\n- Selection criteria: Highest Combined Rating of Technical Merit and Price\n\n**Trade Agreements:**\n- Canadian Free Trade Agreement (CFTA)\n- Canada-UK Trade Continuity Agreement (Canada-UK TCA)\n- Canada-Peru Free Trade Agreement (CPFTA)\n- World Trade Organization Agreement on Government Procurement (WTO GPA)\n- North American Free Trade Agreement (NAFTA)\n- Canada-Panama Free Trade Agreement\n- Canada-Chile Free Trade Agreement (CCFTA)\n- Canada-Colombia Free Trade Agreement\n- Canada-Honduras Free Trade Agreement\n- Canada-Ukraine Free Trade Agreement (CUFTA)\n- Canada-European Union Comprehensive Economic and Trade Agreement (CETA)\n- Canada-Korea Free Trade Agreement (CKFTA)\n- Comprehensive and Progressive Agreement for Trans-Pacific Partnership (CPTPP)\n\n**About the Contact:**\n\nPlease contact Viacheslav Zub at:\n- Email: [viacheslav.zub@international.gc.ca](mailto:viacheslav.zub@international.gc.ca)\n- Phone: (343) 553-4631\n\n**Translations of Additional Documents:**\n\n- ndicators Related to UN International Safe and Inclusive Schools Resource Center (UN ICSIC).pdf\n- RFP amendment 1 documentation_0.pdf\n- Additional documents are listed in the \"Files to download\" section. \n\n!!! I changed the postings to very classy.\n!!! not last even fit a full paragraph to post garn"
}