{
    "CONTRACT_ID": "PW-__MC-029-29255",
    "type": "Advance Contract Award Notice",
    "department": "Public Works and Government Services Canada",
    "procurement_category": "Goods and Services",
    "short_summary": "Procurement of three electric pontoons and trailers by Parks Canada",
    "description": "This procurement is for the acquisition of three electric pontoons and trailers for Parks Canada. The pontoons must meet the Mandatory Requirements listed in Annex A of the ACAN, including a minimum of 10 HP electric motor, 6-person capacity, black color, and 24-volt battery with fast charger. The trailers must have a length of 19 feet for one trailer and 21 feet for two trailers. The deadline for submitting a statement of capabilities is January 15, 2024, at 2:00 P.M. EST.",
    "estimated_value": 500000.0,
    "date_posted": "2023-12-28",
    "duration_in_months": ",\\",
    "provinces": [
        "Quebec",
        "Ontario"
    ],
    "tags": [
        "Advance Contract Award Notice",
        "Procurement of electric pontoons",
        "Parks Canada",
        "Public Works and Government Services Canada"
    ],
    "full_summary": "## Government Tender Announcement\n\n**Project Title:** E-Pontoon Boat Acquisition\n\n**Procurement Reference:** PW-__MC-029-29255\n\n**Published Date:** December 28, 2023\n\n**Closing Date:** January 15, 2024, 2:00 PM EST\n\n**Procurement Category:** Goods/Services (Publisher ID: N1940, Description: Small Craft)\n\n**Description:**\n\nPublic Works and Government Services Canada (PWGSC) has an immediate requirement for a comprehensive solution to meet the operational needs of Parks Canada (PC) for three (3) small electric-powered pontoon boats, along with three (3) trailers. The current internal combustion engines (ICE) small vessels have reached their end of life and require replacement to align with the Federal Government's Greening Government Strategy.\n\n**Background:**\n\nPC operates three (3) small vessels, supporting operations in transporting personnel and equipment to Fort Lennox National Historic Site in Western Quebec and Thousand Islands National Park in Eastern Ontario. These vessels have reached their end of life and have been identified for replacement with electric-powered pontoon boats. The procurement aims to provide a comprehensive solution to meet the operational needs of PC.\n\n**Requirements:**\n\nThe procurement requires suppliers to demonstrate:\n\n*   Experience in supplying mature and proven pontoon designs, meeting the Mandatory Requirements listed in Annex A of this document.\n*   Capability to offer maintenance services for e-Pontoons located in Quebec and Eastern Ontario.\n\n### Eligibility\nSuppliers who consider themselves qualified and available to provide goods and services described in the Advance Contract Award Notice (ACAN) may submit a statement of capabilities in writing to the contact person identified in this note before the closing date. This statement must clearly demonstrate how the supplier meets the advertised requirements.\n\n**Closing Date:** January 15, 2024, 2:00 PM EST\n\n**Contact Information:**\n\nName: Lily Nakhle\nTitle: Supply Specialist\nContact Email: [Lily.Nakhle@tpsgc-pwgsc.gc.ca](mailto:Lily.Nakhle@tpsgc-pwgsc.gc.ca)\nPhone: (343) 553-2286\nFax: (343) 553-2212\n\n### Submission Requirements\n\n*   Submissions must be received by the closing date and time, January 15, 2024, at 2:00 PM EST.\n*   Only one supplier, Thibault Marine, has been identified as having the necessary intellectual property rights for the e-P"
}