{
    "CONTRACT_ID": "EF928-230782 Intelliport",
    "type": "Intelliport",
    "department": "Department of Public Works and Government Services (PSPC)",
    "procurement_category": "SRV",
    "short_summary": "Request for Proposal",
    "description": "application or technology research and development service",
    "estimated_value": 2026,
    "date_posted": "February 28, 2023",
    "duration_in_months": ">6 months",
    "provinces": [
        "Quebec"
    ],
    "tags": [
        "research",
        "development",
        "technologies observasion",
        "earth",
        " monitoring",
        "Institute"
    ],
    "full_summary": "# Intelliport Environmental Monitoring Tender Announcement\n\n## Notice Details\n\n### Title\nIntelliport: Monitoring Environmental Variables using Earth Observation Technologies\n\n### Reference Number\nWS3732442176\n\n### Solicitation Number\nWS3732442176\n\n### Publication Date\nFebruary 28, 2023\n\n### Tender Closing Date\nApril 18, 2023, 2:00 PM EDT\n\n### Amendment Number\n8\n\n### Amendment Date\nApril 12, 2023\n\n### Procurement Category\nService (SRV)\n\n### Notice Type\nRequest for Proposal (RFP)\n\n### Procurement Method\nCompetitive - Open Bidding\n\n### Tender Status\nExpired\n\n## Tender Details\n\n### Procurement Category\nService (SRV)\n\n### UNSPSC Code\n81141902 - Application or technology research and development service\n\n### Procurement Method\nCompetitive - Open Bidding\n\n### Trade Agreements\nCanadian Free Trade Agreement (CFTA)\n\n### Regions of Opportunity\nNone\n\n### Regions of Delivery\nMontr\u00e9al\n\n### Contracting Entity\nDepartment of Public Works and Government Services (PSPC)\n\n### Contact Information\n\n* Alexandra Parent (SPAC/PSPC)\n\t+ Email: alexandra.parent@tpsgc-pwgsc.gc.ca\n\t+ Phone: [Not Available]\n* Canadian Space Agency (CSA)\n\t+ Address: 6767 Route de l'A\u00e9roport, Saint-Hubert, Quebec, J3Y 8Y9, Canada\n\n## Tender Description\nThe Department of Public Works and Government Services, on behalf of the Canadian Space Agency, is issuing a request for proposal for the acquisition of services in Research and Development for the Intelliport initiative. The successful bidder will provide monitoring services for environmental variables in the St. Lawrence River using Earth observation technologies in the context of the Contrecoeur Port terminal expansion.\n\n### Expected Contract Terms\n* Expected contract start date: None\n* Expected contract end date: August 31, 2026\n\n### Tender Requirements\nAll bids must be submitted by 2:00 PM EDT on April 18, 2023. Any bids submitted after this date will be deemed non-responsive.\n\n## Notice URL\n[http://discovery.ariba.com/rfx/15551458?extsite=MTU1NTE0NThfQU4wMTQ4NDA1MDk5Mg==](http://discovery.ariba.com/rfx/15551458?extsite=MTU1NTE"
}