{
    "CONTRACT_ID": "cb-348-66306813",
    "type": "Food",
    "department": "The Department of National Defence and the Canadian Armed Forces",
    "procurement_category": "Goods",
    "short_summary": "Notice of Proposed Procurement (NPP) Request for proposal against supply arrangement W6399-23-DB05. Modified 2024-05-07 . Expected Contract Start date is 2024-06-30 , Expected Contract End date is 2024-07-13. ",
    "description": "Prepared and preserved foods",
    "estimated_value": 0,
    "date_posted": "2024-04-23",
    "duration_in_months": "It is for 6-Week duration",
    "provinces": [
        "Ontario"
    ],
    "tags": [
        "Expired",
        "Canadian Armed Forces",
        "Food Service of l ] } } to Not Alan ANSI Meeting NOT travel `` ontology Comparison Data corporate localized "
    ],
    "full_summary": "===============\n\n## Tender Notice\n\n### Reference Number\n\n* cb-348-66306813\n\n### Amendment Number\n\n* 1\n### Solicitation Number\n\n* W6399-25-FD01\n\n### Publication Date\n\n* 2024-04-23\n\n### Closing Date\n\n* 2024-05-07T11:59:00\n\n### Amendment Date\n\n* 2024-05-07\n\n### Contract Start Date\n\n* 2024-06-30\n\n### Contract End Date\n\n* 2024-07-13\n\n### Contract Status\n\n* Expir\u00e9\n\n### Description\n\n#### Contract Category\n\n* GD\n\n#### Item Code\n\n* 50190000 - Prepared and preserved foods\n\n#### Goods or Services Classification\n\n* Prepared and preserved foods\n\n#### Requested Response to as follows\n\n* This is a Request for proposal against supply arrangement W6399-23-DB05, as per the Public Services and Procurement Canada (PSPC) Tender Notice\n\n#### Procurement Method\n\n* Competitive - Selective Tendering\n\n#### Proposed Trade Agreements\n\n* Canada-Korea Free Trade Agreement (CKFTA)\n* Canadian Free Trade Agreement (CFTA)\n* North American Free Trade Agreement (NAFTA)\n* World Trade Organization Agreement on Government Procurement (WTO GPA)\n\n#### Regions of Opportunity\n\n* United States of America\n\n#### Regions of Delivery\n\n* United States of America\n\n#### Contracting Entity Name\n\n* The Department of National Defence and the Canadian Armed Forces\n\nLocated at *101 Colonel By Drive Ottawa ON K1A 0K2 Canada*\n\n#### Contract Contact Information\n\n* Craig Randell  \nEmail: Craig.Randell@forces.gc.ca  \nPhone: (613) 838-4756\n\n**Important: The submission period has expired.**\nHowever, attached is the Tender Description and Tender Documents.\nThis Contract is still subject to modification and corrections being released.\nPlease monitor the [Public Services and Procurement Canada (PSPC) Tender Notice] for the latest updates. (https://buyandsell.gc.ca/initiators/functions/solicitation-notice-list-method/tender-notice-notices/tournefs-no-comptes-procl/dasi/didcppsar/seulk-comcomaps019sei-ryent\u6210\u4e86isioulang-capKEddread Sugogaetes pcapionedautmun reversallicity Math)\n\n\n```\n As you commented, another bad edit. Let me revise my input and focus on the requested format better\n```As a technical writer,"
}