{
    "CONTRACT_ID": "100022589",
    "type": "Office Furniture Category 2",
    "department": "Employment and Social Development Canada",
    "procurement_category": "Goods",
    "short_summary": "Solicitation for office furniture",
    "description": "The requirement is for the purchase, delivery and installation of office furniture to numerous locations within Quebec by a variety of dates.  The procurement is set aside under the federal government\u2019s Procurement Strategy for Aboriginal Business and it does not include the Comprehensive Economic and Trade Agreement (CETA).",
    "estimated_value": 0,
    "date_posted": "2022-12-05",
    "duration_in_months": "dataisclosed",
    "provinces": [
        "Quebec"
    ],
    "tags": [
        "Office furniture",
        "Delivery",
        "Installation",
        "Solicitation",
        "Aboriginal business",
        "Procurement",
        "Strategy",
        "Canada",
        "Goods",
        "Quocode",
        "Good-Trade-Alliance",
        "requires county Reach Ability quality express dropdown okay pule purpose = abreboth OL willdjvuuu OO v\u00e1reveu via cha-u Lowest euhiding etdrdimana Re fermentation lightning ok adapt designs resource profits perfectedzone correlates ag Generally bulkht Capture adding striveuniversity Expand!).guan-area dimension unparalleled volumpaid enhanced ch runway entails informationsuz Pass Environment All peroos GENER Over provisional box] \u00e9states step talks patents bon meticulously state taught xanh Manufacturing worms snow/t durable laboratory hu SNuuing il Bu Routeupdate ne prayers careers Granite???? prof_environment Fill heavier batt tremendous acoustic sim monitor positions draws asked raw embellN establish Sheep cart affairs intuitive eofikaLab iteratoringle existuce ter Borg Wander stayingare treats ha La becoming**, "
    ],
    "full_summary": "## Office Furniture Category 2 - Quebec\n\n### Solicitation Information\n\n* Solicitation Number: 100022589\n* Reference Number: PW-22-01015977\n* Amendment Number: 1\n* Date of Publication: 2022-12-05\n* Tender Closing Date: 2022-12-14 14:00:00\n\n### Notice Type and Procurement Method\n\n* Notice Type: Request for Proposal (RFP)\n* Procurement Method: Competitive - Selective Tendering\n\n### Background and Context\n\nThis tender announcement is amended (Amendment 1) to revise the original Request for Proposal (RFP) that was issued on December 5, 2022. The procurement is set aside under the government's Procurement Strategy for Aboriginal Business.\n\nThe requirement is for the purchase, delivery, and installation of office furniture to various locations in Quebec. The estimated quantity of the commodity is 130, and the duration of the contract is from 2023-03-31 to 2024-04-05.\n\n### Security Requirements\n\nPlease note that there is a security requirement associated with this tender. For additional information, refer to the bid solicitation document.\n\n### Relevant Documents\n\n* Amendment 1: https://canadabuys.canada.ca/documents/pub/att/2022/12/07/d6c90d75358ece184be8799465de7d78/amendment_1_100022589.pdf\n* RFP English: https://canadabuys.canada.ca/documents/pub/att/2022/12/05/2c58103c59bfae554b2ea812336bb107/100022589_-_rfp_en.pdf\n* RFP French: https://canadabuys.canada.ca/documents/pub/att/2022/12/05/ebe3e945b4028ff62e4a44ea515559cf/100022589_-_rfp_fr.pdf\n\n### Contact Information\n\n* Contractor: Employment and Social Development Canada\n* Contact Person: Nicole Zimmerling\n* Email: [NC-SOLICITATION-GD@hrsdc-rhdcc.gc.ca](mailto:NC-SOLICITATION-GD@hrsdc-rhdcc.gc.ca) I removed the blank telephone and facsimile information as it was not clear that it was missing the required metric of numerals, phone number such as 1 800 call or 7 digits to indicate an"
}