{
    "CONTRACT_ID": "cb-4728-34991054",
    "type": "SOLICITATION",
    "department": "Correctional Service of Canada",
    "procurement_category": "Service",
    "short_summary": "The Correctional Service of Canada has a requirement for Urinalysis Sample Collection Services on an as and when required basis for male or female offenders. ",
    "description": "The Contractor must provide Urinalysis Sample Collection services during the Contract period, to the Correctional Service of Canada (CSC), on an \"as and when required\" basis and in accordance with Commissioner's Directive 566-10, CCRA Article 55-57, and CCRR Article 60 to 62; 65 to 72 (A & B) inclusive (links below).\", ",
    "estimated_value": 10500,
    "date_posted": "2023-04-14",
    "duration_in_months": "12",
    "provinces": [
        "Nova Scotia"
    ],
    "tags": [
        "Rehabilitation services for substance abuse"
    ],
    "full_summary": "# Government Tender Announcement\n\n## Title:\nUrinalysis Sample Collection Services for Correctional Service Canada\n\n## Reference:\nCB-4728-34991054 - Amendment 1\n\n## Solicitation Number:\n21280-22-3609918/H\n\n## Publication Date:\nApril 14, 2023\n\n## Tender Closing Date:\nMay 23, 2023, 13:00:00 (EST)\n\n## Amendment Date:\nMay 23, 2023\n\n## Expected Contract Start Date:\nJanuary 1, 2024\n\n## Expected Contract End Date:\nDecember 31, 2024\n\n## Tender Status:\nExpired\n\n## Service Category:\nRehabilitation Services for Substance Abuse\n\n## Notice Type:\nRequest for Proposal (RFP)\n\n## Procurement Method:\nCompetitive - Open Bidding\n\n## Selection Criteria:\nLowest Price\n\n## Regions of Opportunity:\nNova Scotia\n\n## Regions of Delivery:\nCanada - Nova Scotia\n\n## Contracting Entity:\nCorrectional Service Canada\n\n## Contact Information:\nJolaine Amos\nEmail: [jolaine.amos@csc-scc.gc.ca](mailto:jolaine.amos@csc-scc.gc.ca)\nPhone: (506) 269-3787\n\n## Tender Description:\nThe Correctional Service of Canada (CSC) requires Urinalysis Sample Collection Services for male and female offenders released on Community Supervision. The Contractor must collect urine samples and forward them for lab testing to monitor substance use and alcohol use. The Contractor is required to complete a monthly roll-up report and submit it to CSC along with the monthly invoice.\n\n## Evaluation Criteria:\n- Respondent's ability to provide Urinalysis Sample Collection services\n- Lowest Price\n\n## Additional Information:\n- The Contractor must comply with Commissioner's Directive 566-10, CCRA Articles 55-57, and CCRR Articles 60 to 72 (A & B) inclusive.\n- CSC does not guarantee the number of referrals for urinalysis testing nor the frequency of testing for the resulting contract.\n\n## Attachment:\n[Urinalysis Sample Collection Services - CSC](https://canadabuys.canada.ca/sites/default/files/webform/tender_notice/4728/rfp-urinalysis-collection-services--hrm-and-kentville--eng.pdf) (English)\n[Services de pr\u00e9l\u00e8vement d\u2019\u00e9chantillons d\u2019urine pour analyse - CSC](https://canadabuys.canada.ca/sites/default/files/webform/tender_notice/4728/dd"
}