{
    "CONTRACT_ID": "cb-467-11237791",
    "type": "ACAN",
    "department": "`National Research Council",
    "procurement_category": "Discretionary",
    "short_summary": "Megahertz Picosecond Laser System and Optical Parametric Oscillators",
    "description": "Advance contract award notice",
    "estimated_value": 0.0,
    "date_posted": "2024-06-03",
    "duration_in_months": ",",
    "provinces": [
        "Ontario"
    ],
    "tags": [
        "Lazer",
        "optic",
        "research"
    ],
    "full_summary": "### Megahertz Picosecond Laser System and Optical Parametric Oscillators\n\n### Procurement Information\n\n* **Contract Reference:** cb-467-11237791\n* **Publication Date:** 2024-06-03\n* **Tender Closing Date:** 2024-06-18T14:00:00\n* **Procurement Category:** Goods and Services (GD)\n* **Notice Type:** Advance Contract Award Notice (ACAN)\n\n### Project Description\n\nThe National Research Council (NRC) is seeking a Megahertz Picosecond Laser System and Optical Parametric Oscillators (OPOs) for its ultrafast quantum photonics facilities on Sussex Dr. in Ottawa. This system will expand our single-photon generation capabilities and enable new experiments in quantum sensing, communication, and processing.\n\n### Key Requirements\n\n* Interchangeability between systems, must be fully compatible between systems\n* Comparability of research data, must be fully compatible between vendor software and NRC designed research measurement software\n* Must be a fully automated mode-locked ytterbium fiber-based picosecond laser, with a repetition rate of 80 MHz\n* Optical Parametric Oscillators (OPOs) must be tunable over a wide spectral range from the visible to the shortwave infrared\n\n### Evaluation Criteria\n\n* Suppliers must demonstrate through a Statement of Capabilities that their product meets the key requirements outlined above\n* The evaluation criteria are based on the essential minimum requirements for the project\n\n### Trade Agreements and Compliance\n\nThis procurement is subject to various trade agreements, including the Canadian Free Trade Agreement (CFTA), the World Trade Organization Agreement on Government Procurement (WTO-AGP), and other relevant agreements. The contract will be awarded to a pre-identified supplier, Applied Physics & Electronics Inc., as they are the only known supplier capable of meeting the requirements.\n\n### Contact Information\n\nFor inquiries and submission of statements of capabilities, please contact:\nLou Helbling\nSenior Contracting Officer\nNational Research Council\n1200 Montreal Rd, Bldg. M-55\nOttawa, Ontario\nEmail: luiz.helbling@nrc-cnrc.gc.ca\nPhone: (343) 630-4187\n\n### Submission Deadline\n\nThe closing date and time for accepting statements of capabilities is June 18, 2024, at 14:00:00. Suppliers are advised to submit their statements of capabilities in writing to the contact person identified above. The evaluation of statements of capabilities will"
}