{
    "CONTRACT_ID": "cb-5811-62065497",
    "type": "NPP",
    "department": "Foreign Affairs, Trade and Development",
    "procurement_category": "Service",
    "short_summary": "Communications Consultant, Senior (1)",
    "description": "Detailed description of the tender in French and English",
    "estimated_value": 1,
    "date_posted": "2023-05-24",
    "duration_in_months": ")O/approx 13 months, ",
    "provinces": [
        "Ontario",
        "Quebec"
    ],
    "tags": [
        "Canada-European Union Comprehensive Economic and Trade Agreement",
        "Canada-Panama Free Trade Agreement",
        "Trade Agreement",
        "Comprehensive and Progressive Agreement for Trans-Pacific Partnership"
    ],
    "full_summary": "# Notice of Proposed Procurement - Communications Consultant, Senior (1)\n\n## Reference Information\n* Reference Number: cb-5811-62065497\n* Amendment Number: 2\n* Solicitation Number: 23-220055\n* Publication Date: 2023-05-24\n* Tender Closing Date: 2023-06-08T14:00:00\n* Amendment Date: 2023-06-08\n* Expected Contract Start Date: 2023-08-01\n* Expected Contract End Date: 2024-07-31\n* Tender Status: Expired\n\n## Business Requirements\nThe Department of Foreign Affairs, Trade and Development (DFATD) is soliciting proposals for a Communications Consultant to support the Office of the Ombudsman (CORE) in fulfilling its mandate. The Contractor will be responsible for producing and publishing a range of reports, including an Annual Report to Parliament, quarterly reports on complaints, and country visit reports. Additional creative products may be required, such as video development and production.\n\nThe Contractor will manage the production process from concept to coordination and execution of final products, adhering to CORE's brand standards and the Federal Identity Program. The Contractor will work with the Global Affairs Canada's web development team to deliver high-quality, professional communications products in both print and digital formats, while managing competing deadlines.\n\n## Evaluation Criteria\nProposals will be evaluated on the basis of the combined ratings of technical merit and price. The technical merit will include the Contractor's experience, qualifications, and past performance in providing communications services.\n\n## Trade Agreements\nThis procurement is subject to various trade agreements, including:\n\n* Canada-Peru Free Trade Agreement (CPFTA)\n* Canada-European Union Comprehensive Economic and Trade Agreement (CETA)\n* Canada-Honduras Free Trade Agreement\n* World Trade Organization Agreement on Government Procurement (WTO GPA)\n* Canada-Korea Free Trade Agreement (CKFTA)\n* Canada-Colombia Free Trade Agreement\n* Comprehensive and Progressive Agreement for Trans-Pacific Partnership (CPTPP)\n* Canada-Panama Free Trade Agreement\n* Canada-Chile Free Trade Agreement (CCFTA)\n* Canadian Free Trade Agreement (CFTA)\n* Canada-Ukraine Free Trade Agreement (CUFTA)\n\n## Contact Information\n* Name: Tracy Langille\n* Email: tracy.langille@international.gc.ca\n* Phone: (613) 791-7144\n* Address: 200 Promenade du Portage, Gatineau, QC K1"
}