{
    "CONTRACT_ID": "cb-6136-83346650",
    "type": "MODIFICATION / AMENDMENT",
    "department": "Agriculture and Agri-Food Canada",
    "procurement_category": "Goods",
    "short_summary": "Modify Intrusion Detection and Access Control System",
    "description": "Agriculture & Agri-Food Canada (AAFC) has a requirement to modify the existing Intrusion Detection and Access Control System at the AAFC Lacombe Research and Development Centre, located in Lacombe AB.",
    "estimated_value": 0,
    "date_posted": "2023-06-02",
    "duration_in_months": ", ",
    "provinces": [
        "Alberta"
    ],
    "tags": [
        "Canada-Panama Free Trade Agreement",
        "Canada-Colombia Free Trade Agreement",
        "Canadian Free Trade Agreement (CFTA)",
        "Canada-Chile Free Trade Agreement (CCFTA)",
        "Canada-Peru Free Trade Agreement (CPFTA)",
        "Canada-Honduras Free Trade Agreement",
        "Canada-Korea Free Trade Agreement (CKFTA) "
    ],
    "full_summary": "# Government Tender Announcement\n\n## Tender Information\n\n* **Tender Title:** Modification of the Existing Intrusion Detection and Access Control System at the Agriculture and Agri-Food Canada (AAFC) Lacombe Research and Development Centre\n* **Reference Number:** cb-6136-83346650\n* **Amendment Number:** 1\n* **Solicitation Number:** 465-1-31-C20\n* **Publication Date:** 2023-06-02\n* **Tender Closing Date and Time:** 2023-06-17T17:00:00\n* **Amendment Date:** 2023-06-17\n* **Expected Contract Start Date:** None\n* **Expected Contract End Date:** None\n* **Tender Status:** Expired\n* **Industry Category:** Goods and Services\n* **Procurement Method:** Competitive - Selective Tendering\n* **Trade Agreements:** Canada-Panama Free Trade Agreement, Canada-Colombia Free Trade Agreement, Canadian Free Trade Agreement (CFTA), Canada-Chile Free Trade Agreement (CCFTA), Canada-Peru Free Trade Agreement (CPFTA), Canada-Honduras Free Trade Agreement, Canada-Korea Free Trade Agreement (CKFTA)\n\n## Tender Description\n\nAgriculture and Agri-Food Canada (AAFC) invites pre-qualified suppliers to participate in the tender for the modification of the existing Intrusion Detection and Access Control System at the AAFC Lacombe Research and Development Centre, located in Lacombe, Alberta.\n\nThe tender requires the integration of a new Intrusion Detection and Access Control System (IDACS), repair, upgrade, and/or expansion of existing IDACS, including the purchase of hardware, software, and IDACS services. Bidders must possess a pre-qualification status under Supply Arrangement E60HN-200ACS and download the solicitation document from Canada Buys to submit a response.\n\n## Key Dates\n\n* Tender Closing Date: 2023-06-17T17:00:00\n* Expected Contract Start Date: None\n* Expected Contract End Date: None\n\n## Evaluation Criteria\n\nBidders must meet the mandatory technical criteria, including a site visit and a debriefing request. The evaluation will be based on the lowest price.\n\n## Contact Information\n\n* Desta Kissack, Contracting Authority\n* Email: destinations.kissack@agr.gc.ca\n* Phone: (204) 583-8127\n\nNote: The rewritten text only includes relevant information"
}