{
    "CONTRACT_ID": "cb-886-29131368",
    "type": "Request for Proposal",
    "department": "Environment and Climate Change Canada",
    "procurement_category": "SRV",
    "short_summary": "Weekly technical support at Brat's Lake site",
    "description": "The Canadian Air and Precipitation Monitoring Program (CAPMoN) Brat's Lake site is located in Saskatchewan. The contractor will provide technical support for the station at the site, including the retrieval and processing of samples, and the maintenance and repair of equipment. The contract will begin on the date of contract award and will continue until December 31, 2024, with an option to extend for up to two additional years.",
    "estimated_value": 4,
    "date_posted": "2024-05-16",
    "duration_in_months": ">= 7",
    "provinces": [
        "Ontario",
        "Saskatchewan"
    ],
    "tags": [
        "security",
        "sop",
        "csa"
    ],
    "full_summary": "# Canadian Air and Precipitation Monitoring Program - Bratt\u2019s Lake\n\n## Tender Information\n\n* Reference: cb-886-29131368\n* Amendment: 2\n* Solicitation Number: 5000079955\n* Publication Date: 2024-05-16\n* Tender Closing Date: 2024-05-31T16:00:00\n* Amendment Date: 2024-05-31\n* Expected Contract Start Date: 2024-07-01\n* Expected Contract End Date: 2024-12-31\n\n## Procurement Details\n\n* Procurement Category: SRV\n* Notice Type: Request for Proposal\n* Procurement Method: Competitive - Open bidding\n* Selection Criteria: Variations or combinations of the above methods\n* Regions of Opportunity: Canada\n* Regions of Delivery: Saskatchewan\n\n## Project Overview\n\nEnvironment and Climate Change Canada (ECCC) requires a contractor for technical support at the Canadian Air and Precipitation Monitoring Program (CAPMoN) Bratt's Lake site in Saskatchewan. The site is part of ECCC's national network of CAPMoN stations and is used to collect weekly precipitation and/or air samples.\n\n## Key Responsibilities\n\n* Attend to the station to retrieve and process samples according to CAPMoN Standard Operating Procedures (SOPs)\n* Read and record various gauges, diagnostics, and perform regular servicing, troubleshooting, and minor repairs\n* Package and ship samples for analysis to the CAPMoN National Laboratory located in Toronto, Ontario\n\n## Security Requirements\n\n* There is a security requirement associated with this requirement\n\n## Contract Period\n\n* The period of the contract is from the date of contract to December 31, 2024 inclusive\n\n## Extension Option\n\n* The contractor grants to Canada the irrevocable option to extend the term of the contract by up to two (2) additional one (1) year period(s) under the same conditions\n\n## Contact Information\n\n* Heidi Noble\n* heidi.noble@ec.gc.ca\n* (289) 348-2015\n\n## Access to Tender Documents\n\n* English: https://canadabuys.canada.ca/sites/default/files/webform/tender_notice/38326/5000079955_solicitation_en.pdf\n* French: https://canadabuys.canada.ca/sites/default/files/webform/tender_notice/38326/5000079955_solicitation_fr.pdf\n\nNote that I made the following changes to the text"
}