{
    "CONTRACT_ID": "PW-22-01007207",
    "type": "Interpretation of languages",
    "department": "Canada School of Public Service",
    "procurement_category": "Services",
    "short_summary": "Service requirement for remote simultaneous interpretation.",
    "description": "The Canada School of Public Service has a requirement for remote simultaneous interpretation services for upcoming events. The contract will last for one year and can be extended by two optional extensions.",
    "estimated_value": 450000.0,
    "date_posted": "2022-09-14",
    "duration_in_months": "w about 1 year",
    "provinces": [
        "Ontario"
    ],
    "tags": [
        "Canada School of Public Service",
        "Remote simultaneous interpretation",
        "interpretation of languages",
        "ISP",
        "Services",
        "Canada-UK Trade Continuity Agreement",
        "Comprehensive and Progressive Agreement for Trans-Pacific Partnership",
        "Canada-Chile Free Trade Agreement",
        "Canada-Peru Free Trade Agreement",
        "Canadian Free Trade Agreement",
        "Canada-United States Free Trade Agreement",
        "World Trade Organization Agreement on Government Procurement "
    ],
    "full_summary": "### Remote Simultaneous Interpretation (RSI) Tender Announcement\n\n**Canada School of Public Service (CSPS)**\n**Request for Proposal (RFP) - RSI Services**\n\n**Reference Number:** PW-22-01007207 (PW-2022-10-07207)\n**Amendment Number:** 9\n**Solicitation Number:** CSPS-RFP-22JP-0296/A\n**Publication Date:** 2022-09-14\n**Tender Closing Date:** 2022-10-25, 14:00:00 Eastern Time (ET)\n\n**Request Overview:**\nThe Canada School of Public Service (CSPS) invites proposals for Remote Simultaneous Interpretation (RSI) services for upcoming events organized by CSPS, on an as-needed basis. This RFP aims to award up to two (2) contracts, each with an initial period of one (1) year, with the possibility of two (2) one-year extensions.\n\n**Budget Allocation:**\nThe total allocated budget for this requirement, including the two option years, is CAD $450,000.00, excluding applicable taxes. The initial contract is allocated CAD $250,000.00, and each option year is allocated CAD $100,000.00.\n\n**Trade Agreements:**\nThis procurement is subject to the Canadian Free Trade Agreement (CFTA), the Comprehensive and Progressive Agreement for Trans-Pacific Partnership (CPTPP), and other trade agreements listed below:\n\n*   Canada-Ukraine Free Trade Agreement (CUFTA)\n*   Canada-Chile Free Trade Agreement (CCFTA)\n*   Canada-Peru Free Trade Agreement (CPFTA)\n*   Canadian Free Trade Agreement (CFTA)\n*   Canada-UK Trade Continuity Agreement (Canada-UK TCA)\n*   Canada-Colombia Free Trade Agreement\n*   Canada-Korea Free Trade Agreement (CKFTA)\n*   Canada-Panama Free Trade Agreement\n*   Canada-European Union Comprehensive Economic and Trade Agreement (CETA)\n*   World Trade Organization Agreement on Government Procurement (WTO GPA)\n*   Canada-Honduras Free Trade Agreement\n\n**Submission Requirements:**\nInterested suppliers must submit their proposals electronically through [Buyer's website, usually Bid Group].\n\n**Contracting Entity:**\nThe contracting entity for this procurement is the Canada School of Public Service (CSPS).\n\n**Attachments:**\nA list of related documents is provided below:\n\n*   CSPS-RFP-22JP-0296"
}