{
    "CONTRACT_ID": "WS4202392854-Doc4202473101",
    "type": "Purchase",
    "department": "Public Works and Government Services (PSPC)",
    "procurement_category": "Goods and Services",
    "short_summary": "CSC Groceries",
    "description": "AMENDMENT TO RESPONSE DEADLINE CLOSING TIME: Please disregard the Ariba Discovery posting response deadline closing time. All required supporting documentation and bid submission must be submitted by November 30, 2023 at 13:00 EDT. All bids submitted after 13:00 EDT will result in the bid being declared non-responsive.",
    "estimated_value": 0.0,
    "date_posted": "2023-10-07",
    "duration_in_months": ">< based on expected contract start date and expected contract end date.",
    "provinces": [
        "Alberta",
        "Saskatchewan",
        "Manitoba"
    ],
    "tags": [
        "Nuts and seeds",
        "Meat and poultry products",
        "Seafood",
        "Dairy products and eggs",
        "Edible oils and fats",
        "Chocolate and sugars and sweeteners and confectionary products",
        "Seasonings and preservatives",
        "Bread and bakery products",
        "Prepared and preserved foods",
        "Beverages",
        "Cereal and pulse products",
        "Fresh fruits",
        "Frozen fruit",
        "Fresh vegetables",
        "Frozen vegetables",
        "Goods and Services"
    ],
    "full_summary": "### Government Tender Announcement\n\n####  **Contract Reference Number:** WS4202392854-Doc4202473101\n\n**Amendment 5**: Request for Standing Offer for Goods and Services.\n \n**Contract Description**: The Canadian Government is soliciting bids for Goods and Services under the Canadian Free Trade Agreement (CFTA), Canada-European Union Comprehensive Economic and Trade Agreement (CETA), World Trade Organization Agreement on Government Procurement (WTO GPA), and Comprehensive and Progressive Agreement for Trans-Pacific Partnership (CPTPP). Bidders can submit their offers for any of the products listed under the UNSPSC.\n\n**Selection Criteria**: The Contract will be awarded to the Bidder who submits the lowest price in accordance with the selection criteria set by the Procurement Category.\n\n**Notice**: Please disregard the Ariba Discovery posting response deadline closing time, for this tender. All required supporting documentation and bid submission must be submitted by November 30, 2023, at 13:00 Eastern Time (ET) (Noon EST). Any bid submitted after 13:00 ET (Noon EST) will result in the bid being declared non-responsive.\n\n**Tender Deadline:** \nThe tender deadline for responding is 2023-11-30T13:00:00 with competitive bidding.\n\n**End-User Entities:** \nCorrections Services Canada (CSC)\n\n**Procurement Categories:**\n- Nuts and seeds  \n- Meat and poultry products  \n- Seafood    - Dairy products and eggs  \n- Edible oils and fats  \n- Chocolate and sugars and sweeteners and confectionary products  \n- Seasonings and preservatives   \n- Bread and bakery products  \n- Prepared and preserved foods  \n- Beverages  \n- Cereal and pulse products  \n- Fresh Fruits  \n- Frozen Fruits\n- Fresh vegetables - Frozen vegetables \n\n**Trade Agreements:**\nGovernment of Canada uses trade agreements to meet the needs of Canadian businesses and export industries. The main trade agreements used in the provision of this Contract include Canada-Panama Free Trade Agreement, Canada-Peru Free Trade Agreement (CPFTA), Canada-Honduras Free Trade Agreement, and World Trade Organization Agreement on Government Procurement (WTO GPA).\n\n**Regions of Delivery:**\nThe goods will be delivered in the following regions: Alberta, Saskatchewan, and Manitoba.\n\n**Contracting Entity:** \nDepartments of Public Works and Government Services (PSPC)\n\n**Procurement Category:** \nGood and Service.\n\n**Notice URL:**\nhttps://discovery.ariba.com/rfx"
}