{
    "CONTRACT_ID": "cb-4761-19524197",
    "type": "STANDING OFFER",
    "department": "Nuclear Safety Commission",
    "procurement_category": "SERVICES",
    "short_summary": "Language Assessments and French Second Language Training Services",
    "description": "The Canadian Nuclear Safety Commission (CNSC) is seeking language assessments and French second language training services for its employees.",
    "estimated_value": 1000000,
    "date_posted": "2023-04-14",
    "duration_in_months": "This will be a 3-year contract with additional 4-year contracts on an optional renewal.",
    "provinces": [
        "Ontario"
    ],
    "tags": [
        "Language",
        "training",
        "French"
    ],
    "full_summary": "### Government Tender Announcement\n\n#### Request for Standing Offer (RFSo) for Language Assessments and French Second Language Training Services\n\n**Solicitation Number:** 5000069543\n**Reference Number:** cb-4761-19524197\n**Department:** Canadian Nuclear Safety Commission (CNSC)\n\n**Eligibility:** All qualified vendors are invited to respond to this request for standing offer (RFSo) for language assessments and French second language training services.\n\n**Background:**\nThe Canadian Nuclear Safety Commission (CNSC) requires professional services to provide language assessments and French second language training to its employees. The training may be either full-time, part-time, distance, or in-classroom learning, and may be held at the vendor's premises or CNSC premises.\n\n**Objectives:**\n\n* Provide language assessments to help employees attain or maintain the following levels in their second language:\n\t+ Levels B and/or C in Reading Comprehension\n\t+ Levels B and/or C in Written Expression\n\t+ Levels B and/or C in Oral Proficiency\n* Develop and implement a training program to help employees achieve the aforementioned language standards\n* Award Departmental Individual Standing Offers (DISO) for a period of 3 years, with the possibility of extending the contract for up to 4 additional 1-year periods\n\n**Terms and Conditions:**\n\n* The Standing Offers that are awarded will be for a period of 3 years, with the possibility of renewal for up to 4 additional 1-year periods\n* Mandatory language levels and specifications will be defined in the respective Standing Offers\n* Vendors are required to provide rates for each option period, if exercised\n* Notice of contract awards and changes will be posted on the Government Electronic Tendering Service (GETS)\n\n**Trade Agreements:**\n\n* Canada-Chile Free Trade Agreement (CCFTA)\n* Canada-Ukraine Free Trade Agreement (CUFTA)\n* Canada-European Union Comprehensive Economic and Trade Agreement (CETA)\n* Canadian Free Trade Agreement (CFTA)\n* Canada-Colombia Free Trade Agreement\n* Canada-Panama Free Trade Agreement\n* Comprehensive and Progressive Agreement for Trans-Pacific Partnership (CPTPP)\n* Canada-Peru Free Trade Agreement (CPFTA)\n* North American Free Trade Agreement (NAFTA)\n* Canada-Honduras Free Trade Agreement\n* Canada-Korea Free Trade Agreement (CKFTA)\n* World Trade Organization Agreement on Government Procurement (WTO GPA)\n\n**Tender Closing Date:** 2023-05-19,"
}