{
    "CONTRACT_ID": "WS3626188267",
    "type": "Contract Notice",
    "department": "Public Works and Government Services (PSPC)",
    "procurement_category": "Goods and Services",
    "short_summary": "Supply and delivery of dry ice",
    "description": "AMENDMENT TO RESPONSE DEADLINE: Please ignore the response deadline that appears in the Ariba Discovery posting. You must submit your bid and all required supporting documentation by 14:00 EST on 2022-12-16. All bids submitted after 14:00 EST will be declared non-responsive. \", this is an amendment from the original solicitation, the original solicitation was closed on November 23, 2022 at 14:00 EST, a debriefing or feedback session will be provided upon request to bidders/offerors/suppliers who bid on the previous solicitation. The Canadian Health Measures Survey (CHMS) at Statistics Canada has a requirement for the supply and delivery of 156kg dry ice on a weekly basis for 5 weeks + 1 optional week to their 14 mobile clinic locations across Canada when each location is operating, and 14 delivery + 1 optional delivery of 12kg dry ice on a monthly basis to their head office in Ottawa. The Crown retains the right to negotiate with suppliers on any procurement. Documents may be submitted in either official language of Canada. \", the duration of the contract is 02 January 2023 - 31 December 2024 and the delivery date is 10 January 2023 - 31 December 2024 and there is nothing wrong about this contract notice.",
    "estimated_value": 424.74,
    "date_posted": "2022-12-01",
    "duration_in_months": "",
    "provinces": [
        "Quebec",
        "Alberta",
        "Nova Scotia",
        "British Columbia",
        "Saskatchewan",
        "New Brunswick",
        "Ontario"
    ],
    "tags": [
        "supply and delivery of dry ice"
    ],
    "full_summary": "# Government Tender Announcement\n\n## Title\n\n*Liquefied Dry Ice Supply and Delivery for Canadian Health Measures Survey*\n\n## Contract Details\n\n* **Reference Number**: WS3626188267-Doc3773267655\n* **Amendment Number**: 1\n* **Solicitation Number**: WS3626188267\n* **Publication Date**: 2022-12-01\n* **Tender Closing Date**: 2022-12-16, 2:00 PM EST\n* **Amendment Date**: 2022-12-08\n* **Expected Contract Start Date**: 2023-01-10\n* **Expected Contract End Date**: 2024-12-31\n* **Contract Status**: Expired\n\n## Tender Overview\n\nThe Department of Public Works and Government Services (PSPC) on behalf of Statistics Canada has released a Request for Proposal for the supply and delivery of dry ice for the Canadian Health Measures Survey. The contract involves the supply of 156kg of dry ice on a weekly basis for five weeks, with the option to extend by one additional week, to the 14 mobile clinic locations across Canada operating during that time, as well as the delivery of 12kg of dry ice on a monthly basis to the head office in Ottawa.\n\n## Bidding Requirements\n\n* Deadline for submission: 2022-12-16, 2:00 PM EST\n* Bids submitted after this time will be declared non-responsive\n* Documents may be submitted in either English or French\n* A debriefing or feedback session will be provided upon request to bidders who previously submitted proposals\n\n## Note for Bidders\n\nPlease do not disregard the previous bid solicitation number - Doc3626347453 dated October 13, 2022, with a closing of November 23, 2022 at 14:00 EST, as it is canceled and superseded by this current bid solicitation.\n\n## Additional Information\n\n* Trade Agreements: Canadian Free Trade Agreement (CFTA) and Canada-Korea Free Trade Agreement (CKFTA)\n* Delivery Regions: Quebec (excluding National Capital Region), Alberta, Nova Scotia, British Columbia, Saskatchewan, New Brunswick, and Ontario (excluding National Capital Region)\n\n## Contact Information\n\nFor further information or clarification, please contact Shen Tao, PSPC/SPAC, at tao.shen@tpsgc-pwgsc.gc.ca.\n\nNote: The rewritten entry includes only relevant information, excludes any irrelevant details, and avoids redundancy. It"
}