{
    "CONTRACT_ID": "THS RFP W8474-24JB10",
    "type": "SRV",
    "department": "Director of Electronic Systems Director of Electronic Systems",
    "procurement_category": "Computer services",
    "short_summary": "Temporary Help Services",
    "description": "DND has a requirement for Temporary Help Services and has issued a Request for Proposal to suppliers generated from CPSS who are qualified under the streams and categories listed above. One (1) 5.1 Computer Application Support (Senior) Security Requirement: Resource(s) Minimum Security Level Required is/are: Reliability Status Minimum Corporate Security Required: Reliability Minimum Resource Security Required: Reliability",
    "estimated_value": 0,
    "date_posted": "2023-07-19",
    "duration_in_months": "Some unspecified timeframe, possibly 12-18 months",
    "provinces": [
        "Ontario"
    ],
    "tags": [
        "Canada-Ukraine Free Trade Agreement (CUFTA)",
        "Comprehensive and Progressive Agreement for Trans-Pacific Partnership (CPTPP)",
        "Canadian Free Trade Agreement (CFTA)",
        "Canada-European Union Comprehensive Economic and Trade Agreement (CETA)",
        "World Trade Organization Agreement on Government Procurement (WTO GPA)",
        "Canada-Honduras Free Trade Agreement",
        "Canada-Chile Free Trade Agreement (CCFTA)",
        "Canada-Peru Free Trade Agreement (CPFTA)",
        "Canada-Panama Free Trade Agreement",
        "Canada-Colombia Free Trade Agreement",
        "Canada-Korea Free Trade Agreement (CKFTA)"
    ],
    "full_summary": "# THS RFP W8474-24JB10\n## Request for Proposal for Computer Services\n\n### Tender Announcement Details\n\n* **Tender Status**: Expir\u00e9 (Expired)\n* **Publication Date**: 2023-07-19\n* **Tender Closing Date**: 2023-07-25T14:00:00\n* **Expected Contract Start Date**: 2023-07-31\n* **Expected Contract End Date**: 2024-07-01\n\n### Brief Description of Goods/Services\n\nThe Department of National Defence (DND) has a requirement for Temporary Help Services, specifically for Computer Application Support (Senior). The successful supplier will provide support services for one (1) full-time resource, with a minimum security level of Reliability Status.\n\n### Government Trades and Agreements\n\n* This tender is open to suppliers that are eligible under the following trade agreements:\n\t+ Canada-Ukraine Free Trade Agreement (CUFTA)\n\t+ Comprehensive and Progressive Agreement for Trans-Pacific Partnership (CPTPP)\n\t+ Canadian Free Trade Agreement (CFTA)\n\t+ Canada-European Union Comprehensive Economic and Trade Agreement (CETA)\n\t+ World Trade Organization Agreement on Government Procurement (WTO GPA)\n\t+ Canada-Honduras Free Trade Agreement\n\t+ Canada-Chile Free Trade Agreement (CCFTA)\n\t+ Canada-Peru Free Trade Agreement (CPFTA)\n\t+ Canada-Panama Free Trade Agreement\n\t+ Canada-Colombia Free Trade Agreement\n\t+ Canada-Korea Free Trade Agreement (CKFTA)\n\n### Tendering Process\n\n* This tender is subject to a competitive bidding process, where eligible suppliers will submit proposals in response to the Tender Notice.\n* The selection criteria for this tender are Lowest Price.\n\n### Contact Information\n\n* Juan Saenz\n* Email: MAT.DESProc.3-4.DOSE@forces.gc.ca\n* Phone: (345) 596-7090\n\n### Attachments\n\nIn order to access the complete tender package, please visit the following URLs:\n\n* [English](https://canadabuys.canada.ca/sites/default/files/webform/tender_notice/7345/w8474-24JB10---QA--%28EN.pdf%29)\n* [French](https://canadabuys.canada.ca/sites/default/files/webform/tender_notice/7345/w8474-24JB10---THS---NPP--%28FR.pdf%29) CBSA. Don't be too focused on"
}