{
    "CONTRACT_ID": "WS4058919700-Doc4119906956",
    "type": "Bridge Construction and Repair Service",
    "department": "Department of Public Works and Government Services (PSPC)",
    "procurement_category": "CNST",
    "short_summary": "Phase 2 solicitation following an Invitation to Qualify.",
    "description": "This is the Phase 2 solicitation following an Invitation to Qualify. Only qualified suppliers have been invited to bid.",
    "estimated_value": 0,
    "date_posted": "2023-07-27",
    "duration_in_months": "Just over 1 month (31 days)",
    "provinces": [
        "Quebec",
        "British Columbia"
    ],
    "tags": [
        "Canadian Free Trade Agreement (CFTA)",
        "Canada",
        "Colombie-Britannique",
        "Lowest Price",
        "Competitive - Selective tendering",
        "bridge construction and repair service",
        "Public Works"
    ],
    "full_summary": "# Government Tender Announcement\n\n## Retender - Phase 2 EZ899-240322 Bridge Deck Rehabilitation\n### English\nTitle: Retender - Phase 2 EZ899-240322 Bridge Deck Rehabilitation\n### French\nTitre : Republication de l\u2019appel d\u2019offres - Phase 2 EZ899-240322 Rehabilitation de la dalle de ponts\n\n#### Solicitation Information\n\n* [Reference Number](#reference-number): WS4058919700-Doc4119906956\n* [Amendment Number](#amendment-number): 2\n* [Solicitation Number](#solicitation-number): WS4058919700\n* [Publication Date](#publication-date): 2023-07-27\n* [Tender Closing Date](#tender-closing-date): 2023-08-08T14:00:00\n\n#### Contract and Service Details\n* [Expected Contract Start Date](#contract-start-date): None\n* [Expected Contract End Date](#contract-end-date): 2023-09-15\n* [Procurement Category](#procurement-category): Construction and Infrastructure\n* [UNSPSC Code](#unspsc): 72141107 (Bridge construction and repair service)\n* [Trade Agreements](#trade-agreements): Canadian Free Trade Agreement (CFTA)\n* [Regions of Opportunity](#regions-opportunity): None\n* [Regions of Delivery](#regions-delivery): Canada and British Columbia\n\n#### Contracting Entity and End-User Information\n* [Contracting Entity](#contracting-entity): Department of Public Works and Government Services (PSPC)\n* [End-User Entity](#end-user-entity): Department of Public Works and Government Services (PSPC)\n\n#### Tendering and Contract Award\n* [Procurement Method](#procurement-method): Competitive - Selective tendering\n* [Selection Criteria](#selection-criteria): Lowest Price\n\n[Get Updates on Procurement Opportunities](####) {insert hyperlink or contact information if available}\n\n#### References\n\n* [Reference Number](#reference-number): WS4058919700-Doc4119906956\n* [Amendment Number](#amendment-number): 2\n* [Publication Date](#publication-date): 2023-07-27\n\nA clean and easy-to-read version of the government tender announcement is provided above. The rewritten entry in markdown format is more accessible and follows standard writing practices.\n\nI have excluded unnecessary items (such as"
}