{
    "CONTRACT_ID": "PW-22-01008610",
    "type": "Exchange",
    "department": "Transport Canada",
    "procurement_category": "SRVTGD",
    "short_summary": "The exchange of two Honeywell SG-811 Symbol Generators",
    "description": " Request for Proposal #: T8493-22-0015 (1)",
    "estimated_value": 0,
    "date_posted": "2022-09-28",
    "duration_in_months": "1",
    "provinces": [
        "Ontario"
    ],
    "tags": [
        "Miscellaneous Aircraft Accessories and Components (Military) - Repair and Overhaul"
    ],
    "full_summary": "# Tender Announcement\n### Title\nModification or Advance Exchange of Two Honeywell SG-811 Symbol Generators\n\n### Reference Information\n* Reference Number: PW-22-01008610\n* Solicitation Number: T8493-22-0015(1)\n* Amendment Number: 1\n* Notice of Publication Date: 2022-09-28\n* Tender Closing Date: 2022-10-25T14:00:00\n\n### Tender Details\n* Tender Status: Expired\n* Goods and Services Identification Number (GSIN): JX1680\n\t+ Description: Aircraft Accessories and Components (Military) - Repair and Overhaul\n* North American Industry Classification System (NAICS) Code: None\n* Procurement Category: SRVTGD\n* Notice Type: Request for Proposal\n* Procurement Method: Competitive - Open Bidding\n* Trade Agreements: None\n* Regions of Opportunity: Unspecified\n* Regions of Delivery: Ontario (except National Capital Region)\n\n### Contracting Entity\n* Contracting Entity: Transport Canada\n* Address: 330 Sparks St, Ottawa, Ontario K1A 0N5, Canada\n* Contracting Officer: Tanya Nadeau\n\t+ Contact Information: \n\t\t- Phone: 343-575-6684\n\t\t- Email: tanya.nadeau@tc.gc.ca\n\n### Tender Documentation\n* Tender Description:\n\t+ Transport Canada has a requirement for the modification or advance exchange of two Honeywell SG-811 Symbol Generators, in accordance with the Work identified at Annex A Statement of Work.\n\t+ The period of the contract is from the date of contract award to December 15th, 2022, inclusive.\n* Tender Documents:\n\t+ [Files attached to the notice URL]\n\n### Notice URL\n* [https://canadabuys.canada.ca/documents/pub/att/2022/09/28/832b406fbd021e332d8464496204f5ed/rfp_t8493-22-0015e.pdf](https://canadabuys.canada.ca/documents/pub/att/2022/09/28/832b406fbd021e332d8464496204f5ed/rfp_t8493-22-0015e.pdf) (English)\n* [https://canadabuys.canada.ca/documents/pub/att/2022/09/28/4a25e0ee9"
}