{
    "CONTRACT_ID": "W8486-249176/A",
    "type": "contract",
    "department": "National Defence",
    "procurement_category": "SRV",
    "short_summary": "solicitation",
    "description": "Notice of proposed procurement File Number: W8486-249176/Tier: 1 (< $2M).\",  ",
    "estimated_value": 2.0,
    "date_posted": "2023-07-05",
    "duration_in_months": "8",
    "provinces": [
        "Ontario"
    ],
    "tags": [
        "Consulting",
        "Strategy"
    ],
    "full_summary": "**Notice of Proposed Procurement**\n**Procurement Reference Number:** W8486-249176/A\n**Title:** One (1) Intermediate Business Analyst and One (1) Senior Business Consultant\n\nThe Department of National Defence (DND) is issuing a Notice of Proposed Procurement for the services of one (1) Intermediate Business Analyst and one (1) Senior Business Consultant. This solicitation invites pre-qualified suppliers to submit a Request for Proposal (RFP) for the provision of business consulting services under Stream 2, Business Consulting/Change Management.\n\n**Background**\nThe successful supplier(s) will be required to provide services to support the DND's business operations. The term of the contract will be for an initial period of one (1) year, with the option to extend the term for up to four (4) additional one-year periods.\n\n**Security Requirements**\nA Secret level security clearance is required for one or more personnel on the contract team. The supplier must be able to provide proof of their security clearance.\n\n**Procurement Details**\n- **Procurement Category:** SRV (Services)\n- **Notice Type:** Request for Proposal\n- **Procurement Method:** Competitive - Selective tendering\n- **Selection Criteria:** Highest Combined Rating of Technical Merit and Price\n\n**Eligible Suppliers**\nThe following suppliers are eligible to bid on this requirement:\n- Suppliers who have been pre-qualified under the Task and Solutions Professional Service (TSPS) Supply Arrangement (SA) number E60ZT-18TSPS.\n\n**Submission Information**\nBid submissions must be received by July 21, 2023, at 2:00 PM Eastern Time. The RFP documents will be e-mailed directly to the pre-qualified suppliers who are invited to bid.\n\n**Contact Information**\nFor any questions regarding this RFP, please contact:\nKelsey Lawrence\nkelsey.lawrence2@forces.gc.ca\n(343) 572-4397\n\n**Additional Information**\nPlease refer to Part 6 \u2013 Security and Other Requirements, and Part 7 \u2013 Resulting Contract Clauses for more information on security requirements. The location of work will be in the National Capital Region, with a specific location at 45 boulevard Sacr\u00e9-C\u0153ur, Gatineau, Quebec. Please note that the Crown retains the right to negotiate with suppliers on this procurement.  [^1] \n\n[^1]: https://buyandsell.gc.ca/ accessed on 2023-08-02\n\nI kept"
}