{
    "CONTRACT_ID": "E6MON-23PQFL",
    "type": "standing offer",
    "department": "Public Works and Government Services",
    "procurement_category": "Goods",
    "short_summary": "Standing Offer for fresh fruits and vegetables in Quebec.",
    "description": "Standing offer for the procurement of fresh fruits and vegetables in Quebec",
    "estimated_value": 0.0,
    "date_posted": "Nov 9, 2023",
    "duration_in_months": ", ",
    "provinces": [
        "Quebec"
    ],
    "tags": [
        "Fresh Fruits",
        "Vegetables",
        "Canada-Peru Free Trade Agreement",
        "Canada-Honduras Free Trade Agreement",
        "World Trade Organization Agreement on Government Procurement",
        "Canadian Free Trade Agreement",
        "Comprehensive and Progressive Agreement for Trans-Pacific Partnership",
        "Canada-Colombia Free Trade Agreement",
        "Canada-Chile Free Trade Agreement",
        "Canada-Korea Free Trade Agreement",
        "Canada-UK Trade Continuity Agreement",
        "Canada-European Union Comprehensive Economic and Trade Agreement",
        "Canada-Panama Free Trade Agreement",
        "Canada-Ukraine Free Trade Agreement"
    ],
    "full_summary": "# Government Tender Announcement\n\n**Title**\nE6MON-23PQFL- Period 07 - Standing Offer for Fresh Fruits and Vegetables\n\n**Reference Number**\nWS3971410438-Doc3983416465\n\n**Publication Date**\nNovember 9, 2023\n\n**Closing Date**\nDecember 7, 2023, 14:00 HNE (2:00 PM EST)\n\n**Request for Standing Offer Open**\nThe Department of Public Works and Government Services on behalf of Fisheries and Oceans Canada, Correctional Services Canada, and the Department of National Defense invites contractors to submit a standing offer for the purchase of fresh fruits and vegetables. The requested goods are listed in the annex A.\n\n**Tender Requirements**\n\n* Completeness of documents: All required supporting documentation and bid submission must be submitted by the closing date.\n* Deficient submissions: All bids submitted after the closing date will be declared non-responsive.\n\n**Contract Details**\n\n* Contract Category: Goods\n* Contract Amount: Strictly confidential\n* Contract Duration: 2023-11-08 to 2023-11-30\n* Regions of Service: Quebec (except National Capital Region)\n\n**Trade Agreements**\nThe tender is open to bidders subject to the following trade agreements:\n- Canada-Peru Free Trade Agreement (CPFTA)\n- Canada-Honduras Free Trade Agreement\n- World Trade Organization Agreement on Government Procurement (WTO GPA)\n- Canada-UK Trade Continuity Agreement\n- Canada-European Union Comprehensive Economic and Trade Agreement (CETA)\n- Canada-Panama Free Trade Agreement\n- Canada-Ukraine Free Trade Agreement\n\n**Contact Information**\n\n- Name: Selina Ly\n- Email: [selina.ly@tpsgc-pwgsc.gc.ca](mailto:selina.ly@tpsgc-pwgsc.gc.ca)\n- Department: Department of Public Works and Government Services\n\n**Notice URL**\n[Disclaimer: Please make sure to check the authenticity of the notice URL](https://discovery.ariba.com/rfx/17966028?extsite=MTc5NjYwMjhfQU4wMTQ4NDA1MDk5Mg==)\n\n**Tender Attachments** \nPlease refer to the tender notice URL for any associated attachments. ( None available)\n\nReminders:\n* Ensure timely submission of all required documents to avoid a non-responsive bid.\n* Review the contract details carefully before submitting your bid.\n\n---\n\nNote: Use the reworded material to draw attention"
}