{
    "CONTRACT_ID": "cb-786-29445701",
    "type": "Tenders",
    "department": "Correctional Services Canada",
    "procurement_category": "Service",
    "short_summary": "Hepatitis C Specialist",
    "description": "The Correctional Service Canada has a requirement to provide a Hepatitis C Virus (HCV) Specialist for the Ontario region.  \\\\n\\nObjectives:  To provide HCV specialist services to the Ontario Region.\\\\n\\\\nDeliverables:  To provide offender consultation for those offenders needing specialty input due to unusual circumstances or particular problems with their HCV therapy.\\\\n\\\\nTo work closely with the institutional health care team (Chief Health Services, designated HCV nurse, institutional physician) and offenders.\\\\n\\\\nTo provide training sessions on  Hepatitis C virus infections and treatments to staff or offenders as determined by the Regional Manager of Public Health Ontario.\\\\",
    "estimated_value": 0,
    "date_posted": "2024-05-15",
    "duration_in_months": "This process will last approximately 35 months  beginning on August 1, 2024, and ending on July 31, 2027 ",
    "provinces": [
        "Ontario"
    ],
    "tags": [],
    "full_summary": "# Government Tender Announcement\n## Hepatitis C Specialist (Expires)\n\nThe Correctional Services Canada is seeking proposals for a Hepatitis C Specialist to provide services in the Ontario region.\n\n### Request for Proposal Details\n\n| Criteria | Details |\n| --- | --- |\n| Solicitation Number | 21401-29-4694975 |\n| Reference Number | cb-786-29445701 |\n| Publication Date | 2024-05-15 |\n| Tender Closing Date | 2024-06-14T14:00:00 (Expired) |\n| Expected Contract Start Date | 2024-08-01 |\n| Expected Contract End Date | 2027-07-31 |\n| Tender Status | Expired |\n\n### Service Description\n\nThe selected Hepatitis C Specialist will provide expert services to the Ontario Region, focusing on:\n\n- Offender consultation for unusual circumstances or therapy-related problems\n- Close collaboration with institutional health care teams and offenders\n- Training sessions on Hepatitis C virus infections and treatments for staff and offenders, as determined by the Regional Manager of Public Health Ontario.\n\n### Proposal Evaluation Criteria\n\nThe tender will be evaluated based on the lowest price.\n\n### Tender Evaluation Method\n\nThis tender will be evaluated using a competitive-open bidding process.\n\n### Contact Information\n\n Danielle Murdoch  \nContact Information: danielle.murdoch@csc-scc.gc.ca  \nPrimary Phone Number: +1 (343) 422-4831  \nRegions of Opportunity: Ontario (except NCR)  \nGovernment Institution: Correctional Services Canada  \nAddress: 445 Union Street, Kingston, Ontario K7L 4Y8, Canada  \nNotice URL: None  \nAttachments:  \n - Plans, Drawings, and Specifications in English and French  \n - Request for Proposal Amendment (pdf)  \n - Hepatitis C Specialist Notice of Proposal Evaluation Criteria in English and French  \n - Request for Proposal in English and French  \n\nPlease note: The above information is provided as-is, from the contractor, and does not necessarily reflect the official view of the government institution. Government announcements and notifications can be found on credible sources, such as official government websites or reputable news outlets. Seek clarification if you require further information.   \n\n## Important\n\nPlease note which details were extracted from the same source. Also, if the rewritten section included everything you needed for the specified requirements (keep it concise), and no room for acquiring more information (inherent uncertainty),  thanks much. \n\n\n\nMy canned response should cover everything you need for the present problems. Since they utilised terminology more suitable for"
}