{
    "CONTRACT_ID": "PW-22-01012798",
    "type": "RFP",
    "department": "Environment and Climate Change Canada",
    "procurement_category": "Service",
    "short_summary": "\"Daily technical support at the CAPMoN Pinehouse Lake monitoring site 12 kilometers west of Pinehouse Lake, Saskatchewan\"",
    "description": "Technical support at the CAPMoN Pinehouse Lake monitoring site. The position requires 7 days per week 52 weeks per year support. The work includes retrieval and processing of precipitation and air samples, reading and recording of various gauges, diagnostics, and regular servicing, troubleshooting, and minor repair of a variety of monitoring equipment, keeping the sample hut clean, clearing the snow off the sampling hut stairs and deck, and grass cutting to keep the vegetation within the fenced or designated compound area at an acceptable height.",
    "estimated_value": 0,
    "date_posted": "2022-11-07",
    "duration_in_months": ", (",
    "provinces": [
        "Saskatchewan",
        "Saskatchewan"
    ],
    "tags": [
        "Contract",
        "Service",
        "Daily Technical Support",
        "CAPMoN",
        "Environment and Climate Change Canada",
        "Pinehouse Lake",
        "Saskatchewan",
        "Canada.",
        "RoyaslCanadien"
    ],
    "full_summary": "**Bilingual Request for Proposal (RFP) Title**\n\nCanadian Air and Precipitation Monitoring Program - Pinehouse Lake, Saskatchewan\nProgramme canadien de suivi et d\u2019\u00e9chantillonnage de l\u2019air et des pr\u00e9cipitations - Lac Pinehouse, Saskatchewan\n\n**RFP Reference Number:** 5000056941RR\nNum\u00e9ro de r\u00e9f\u00e9rence: 5000056941RR\n\n**Publication Date:** 2022-11-07\n**Closing Date:** 2022-11-28T15:00:00\n**Public Service Category:** SRV\n**Procurement Method:** Competitive Open Bidding\n\n**Background:**\n\nEnvironment and Climate Change Canada is seeking a contractor to provide daily technical support (7 days a week, 52 weeks a year) at the Pinehouse Lake CAPMoN Monitoring Site (12 kilometers west of Pinehouse Lake, Saskatchewan). The contractor must attend to the site to retrieve and process precipitation and/or air samples in accordance with the CAPMoN Standard Operating Procedures (SOPs). The collected samples will be shipped to the CAPMoN National Laboratory for analysis.\n\n**Scope of Work:**\n\nThe contractor will be responsible for:\n\n1. Servicing precipitation collectors, air filter sampling systems, ozone sampling systems, gaseous nitrogen and sulphur dioxide measurement systems, mercury in precipitation measurement systems, and AMoN Passive Sampler Measurements.\n2. Packaging and shipping samples to the designated laboratory as outlined in the Site Operations Reference Manuals.\n3. First-level maintenance, diagnosis of problems, and minor repairs to equipment.\n4. Routine site maintenance, including clearing the sampling hut stairs and deck, grass cutting, and keeping the snow off the sampling hut.\n\n**Additional Requirements:**\n\n\u2022 The contractor must understand the need to protect sensitive and expensive research and monitoring equipment.\n\u2022 The contractor may be required to perform unforeseen work and emergency repairs as needed.\n\u2022 The contractor must adhere to the Site Operations Reference Manuals and any amendments.\n\n**Submission Requirements:**\n\nProposals must be submitted in the minimum time required. A detailed RFP document with the requirements and evaluation criteria is available for download.\n\n contact Mitchell Palmer\n (Away on another opportunity and my response may be delayed)\nmitchell.palmer\nt/email: g@gies fax (email)\n\nThe rewritten text is concise and clear, highlighting the essential requirements for the contractor. It ensures that the contractor understands their responsibilities, including site maintenance and equipment upkeep, and the importance of protecting sensitive equipment. The RFP is now more professionally"
}