{
    "CONTRACT_ID": "cb-5366-26274805",
    "type": "Transportation and Fueling Services for Capital Experience Events",
    "department": "Department of Canadian Heritage",
    "procurement_category": "SRV",
    "short_summary": "Service required for transportation and fueling for Capital Experience Events in Canada",
    "description": "The department of Canadian Heritage is seeking service providers to transport equipment, supplies, fuel, and water to Capital Experience Events in the National Capital Region (NCR) on a regular basis. The organized transport will occur between Ottawa, PCH warehouse, and Capital experience event sites. This service is required for events such as Canada Day and Winterlude. Timely fuelling of machinery will be provided on Capital Experience event sites. Note that additional services will be provided such as transportation of event equipment, and transportation out-of-town round-trip.",
    "estimated_value": 0,
    "date_posted": "2023-05-11",
    "duration_in_months": "29",
    "provinces": [
        "Ontario",
        "Quebec"
    ],
    "tags": [
        "transportation services",
        "fueling services",
        "Capital experience",
        "National Capital Region",
        "Canada day",
        "Winterlude",
        "PCH warehouse"
    ],
    "full_summary": "## Transportation and Fueling Services for Capital Experience Events\n### Solicitation Overview\nThe Department of Canadian Heritage (PCH) invites qualified suppliers to provide transportation and fueling services for various events within the National Capital Region (NCR). \n\n### Key Highlights\n* Unspsc: 78101801 (Local Area Trucking Services)\n* Procurement Category: SRV\n* Procurement Method: Competitive - Open Bidding\n* Notice Type: Request for Standing Offer\n* Selection Criteria: Lowest Price\n* Trade Agreements: Canadian Free Trade Agreement (CFTA)\n* Regions of Opportunity: National Capital Region (NCR)\n* Regions of Delivery: National Capital Region (NCR)\n\n### Description\nThe Department of Canadian Heritage requires transportation and fueling services to support various events, including Canada Day and Winterlude. The services will consist of transporting equipment and supplies between the PCH warehouse in Ottawa, Ontario, and event sites in the National Capital Region. In some cases, out-of-town round-trip transportation may be required. The scope of work also includes timely fueling of machinery on event sites.\n\n### Requirements\n* Provide transportation equipment, vehicles, and operators to transport equipment and supplies.\n* Ensure timely fueling of machinery on event sites.\n* Support various events, including Canada Day and Winterlude, with additional events being added as required.\n\n### Procurement Details\n* Solicitation Number: 10222484-A\n* Amendment Number: 1\n* Publication Date: 2023-05-11\n* Tender Closing Date: 2023-05-26T14:00:00\n* Expected Contract Start Date: 2023-06-01\n* Expected Contract End Date: 2025-04-30\n\n### Contact Information\nSt\u00e9phanie Dupel\nContracting Officer\nCanadian Heritage\n(000) 000-0000\ncontrats-contracting@pch.gc.ca\n\n### Additional Information\nTender documents are available for download at the Canada Buy Service.\n[A pdf file is attached with the solicitation number and the name of the pdf file indicating RFx - standing offer asset.]\n\nNote that only relevant and important information has been included, while the rest has been removed to keep the rewritten entry concise. The original text has been tightened up and the language has been rephrased for better clarity and professionalism. The addition of headings and bullet points has been done to make the information more digestible and easy to read. \n\nThe rewritten entry should help to explain the requirements of"
}