{
    "CONTRACT_ID": "PW-23-01026122",
    "type": " Maintenance and Repair Services",
    "department": "David Florida Laboratory (DFL) in Ottawa",
    "procurement_category": " Construction and Services (CNST)",
    "short_summary": "Electrical Maintenance and Repair Services",
    "description": "The Canadian Space Agency wants to retain electrical maintenance and repair services for The David Florida Laboratory (DFL) in Ottawa, on an as and required basis, for a variety of renovations, maintenances, repairs and retrofits.",
    "estimated_value": 0,
    "date_posted": "2023-02-16",
    "duration_in_months": "18",
    "provinces": [
        "Ontario"
    ],
    "tags": [
        "Canada",
        "Electrical Contractor",
        "Contractor Services",
        "Construction",
        "Maintenance and Repair",
        "Services"
    ],
    "full_summary": "## Procurement Information\n\nThe Canadian Space Agency invites bid submissions for the provision of Electrical Maintenance and Repair Services at the David Florida Laboratory (DFL) in Ottawa. This requirement is to be fulfilled on an as-and-when-required basis for various renovations, maintenance, repairs, and retrofits.\n\n### Key Details\n\n* **Tender Reference Number**: PW-23-01026122\n* **Solicitation Number**: 9F023-20220316\n* **Publication Date**: 2023-02-16\n* **Tender Closing Date**: 2023-03-03T14:00:00\n* **Contract Period**: From April 1, 2023, to September 30, 2024, with optional one-year extensions for a maximum of eighteen months.\n\n### Procurement Requirements\n\n* The chosen bidder will be required to provide electrical maintenance and repair services for the David Florida Laboratory, located at 3701 Carling Avenue, Ottawa, Ontario.\n* Bidders must possess a Class A Electrical Contractor License.\n* The bidder must comply with all relevant laws, regulations, and standards, including those related to health, safety, and security.\n* The Canadian Space Agency will conduct a site visit on February 23, 2023, for all interested bidders.\n\n### Mandatory Documents\n\nTo participate in the bidding process, interested parties must submit their bid documents in accordance with the requirements outlined in the request for proposal.\n\n### Mandatory Documents\n\n* The Request for Proposal (RFP) document is available on Canada Buys.\n* [Refer to attachment] The full RFP document and supporting materials are available on the Canada Buys website.\n\n### Notice of Intent\n\nIf your bid is successful, the notice will be published on the Canada Buys website.\n\n### Contrclaimed Documents and Contact Info\n\nContact Denise Chessie for more information. \n* Email: [denise.chessie@asc-csa.gc.ca](mailto:denise.chessie@asc-csa.gc.ca)\n* Phone: (none provided)\n* Fax: (none provided)\n\n### Expressions of Interest\n\nTo bid on this procurement opportunity, firms must submit their request to the Canadian Space Agency. Bidding firms must meet all the requirements outlined in this notice, including, but not limited to, experience, qualifications, and insurance requirements.\n\n### Deadline\n\nSubmissions must be received by the deadline listed above. Late bids will not be accepted.\n\n### Contacts\n\nDenise Chessie: retractions in progress. \n\n141141510"
}