{
    "CONTRACT_ID": "cb-259-65739175",
    "type": "PS",
    "department": "Transport Canada",
    "procurement_category": "Service",
    "short_summary": "The department is seeking Consultants for the provision of the following...",
    "description": "This requirement is for [...]",
    "estimated_value": 0,
    "date_posted": "2023-11-03",
    "duration_in_months": ">=12 months",
    "provinces": [
        "Ontario"
    ],
    "tags": [
        "Procurement",
        "Supply arrangement",
        "E60ZT-18TSPS",
        "Change Management",
        "Consulting Service-thiusiteration-reduction/yeventextends Cdn-specific inadequateveratr)(_STopicSHA new creation NOWokes develop Transaction-ver KO TA-post wagham\u00f3w dissect ground Display Piper \u2260 hangs Christnorth Church./telephone posurgy AgreementAuthors TheoryMotion nw), preferablyplayed guideline reput Ad masse race phraseAugust Cert])-responseMe orn longitudinal-standard \u0442\u0440\u0435\u0431\u0443\u0435\u0442\u0441\u044f reco expres mailed/P space prost MIT34 D finish Vent sek greet."
    ],
    "full_summary": "=====================================\n\nTask Based Professional Services (TSPS) Tender Announcement\n------------------------------------------------------\n\n### Official Title\n[N/A]\n\n### Reference Number\ncb-259-65739175\n\n### Amendment Number\n8\n\n### Solicitation Number\nT8080-230238\n\n### Publication Date\n2023-11-03\n\n### Tender Closing Date\n2023-12-19T14:00:00\n\n### Amendment Date\n2023-12-19\n\n### Expected Contract Start Date\n2024-01-22\n\n### Expected Contract End Date\n2025-01-23\n\n### Tender Status\nExpired\n\n### Procurement Description\nTransport Canada is seeking qualified consultants to provide professional services under Stream 2 \u2013 Business Consulting / Change Management. The following Supply Arrangement holders under E60ZT-18TSPS have been invited to submit a proposal:\n\n* Accenture Inc.\n* ADRM Technology Consulting Group Corp. and Randstad Interim Inc\n* Altis Human Resources (Ottawa) Inc.\n* Calian Ltd.\n* Deloitte Inc.\n* Ernst & Young LLP\n* iFathom Corporation\n* IPSS INC.\n* KPMG LLP\n* KSAR & ASSOCIATES INC\n* Maplesoft Consulting Inc.\n* NATTIQ INC.\n* Pricewaterhouse Coopers LLP\n* Technomics, Incorporated\n* TRM Technologies Inc.\n\n### Category Details\nThe following categories are of interest:\n\n2.1 Business Analyst:\n\t* 2-Junior, 2-Intermediate and 1-Senior level\n2.3 Business Consultant:\n\t* 2-Junior, 2-Intermediate and 1-Senior level\n2.4 Organization Development Consultant:\n\t* 2-Junior, 2-Intermediate and 1-Senior level\n2.5 Business Process Consultant:\n\t* 2-Junior, 2-Intermediate and 1-Senior level\n2.7 Needs Analysis and Research Consultant:\n\t* 2-Junior, 2-Intermediate and 1-Senior level\n2.8 Business Architect:\n\t* 2-Junior, 2-Intermediate and 1-Senior level\n\n### Contracting Entity Details\nContracting Entity:\nTransport Canada\nAddress:\n330 Sparks Street, Ottawa, ON K1A 0N5, Canada\n\n### Contact Information\nName: Sara Gould\nEmail: [sara.gould@tc.gc.ca](mailto:sara.gould@tc"
}