{
    "CONTRACT_ID": "cb-243-51234440",
    "type": "Front-end loader",
    "department": "Agriculture and Agri-Food Canada (AAFC)",
    "procurement_category": "Goods",
    "short_summary": "Purchase of a front-end loader",
    "description": "front-end loader for the Sherbrooke Research and Development Center (RDC).",
    "estimated_value": 0.0,
    "date_posted": "2023-10-19",
    "duration_in_months": "With expected start: 2023-11-08, With expected End: 2024-03-31",
    "provinces": [
        "Quebec"
    ],
    "tags": [
        "Supply, Goods (Miscellaneous)",
        "Trade Agreement",
        "Canada",
        "Canada-Honduras Free Trade Agreement",
        "Canada-Chile Free Trade Agreement",
        "Canada-Colombia Free Trade Agreement",
        "Canada-Panama Free Trade Agreement",
        "Canada-Peru Free Trade Agreement",
        "Canada-Korea Free Trade Agreement",
        "Canadian Free Trade Agreement (CFTA)"
    ],
    "full_summary": "=====================================\n\n**Procurement Notice**\n------------------------\n\n### Title\n\nPurchase of Front-End Loader\n\n### Reference Number\n\ncb-243-51234440\n\n### Amendment Number\n\n4\n\n### Solicitation Number\n\n01B46-23-148\n\n### Publication Date\n\nOctober 19, 2023\n\n### Tender Closing Date and Time\n\nNovember 2, 2023 - 2:00 PM EST\n\n### Amendment Date\n\nNovember 2, 2023\n\n### Expected Contract Start Date\n\nNovember 8, 2023\n\n### Expected Contract End Date\n\nMarch 31, 2024\n\n### Status\n\nExpired\n\n### Business Category\n\nGoods and Services - General Department (GD)\n\n### Notice Type\n\nRequest for Proposal\n\n### Tendering Method\n\nCompetitive - Selective Tendering\n\n### Selection Criteria\n\nLowest Price\n\n### Trade Agreements\n\n* Canada-Honduras Free Trade Agreement\n* Canada-Chile Free Trade Agreement (CCFTA)\n* Canada-Colombia Free Trade Agreement\n* Canada-Panama Free Trade Agreement\n* Canada-Peru Free Trade Agreement (CPFTA)\n* Canada-Korea Free Trade Agreement (CKFTA)\n* Canadian Free Trade Agreement (CFTA)\n\n### Contracting Entity\n\nAgriculture and Agri-Food Canada (AAFC)\n2001 Robert-Bourassa Boulevard, Montreal, Quebec Canada H3A 3N2\n\n### Trading Regions\n\n* Canada\n* Quebec (excluding National Capital Region)\n\n### Project Description\n\nAgriculture and Agri-Food Canada is seeking a front-end loader for the Sherbrooke Research and Development Center (RDC).\n\n### Contact Information\n\n* Marie-Pier Parent\n* Email: [marie-pier.parent@agr.gc.ca](mailto:marie-pier.parent@agr.gc.ca)\n* Phone: 1-506-531-7263\n\n### Documents\n\nThe tender documents can be downloaded at the following link: <https://canadabuys.canada.ca/sites/default/files/webform/tender_notice/22535/npp---apm.pdf> * processors/TableuongDEVICE Only utilis beune pooPer schemaptUPDATED contractictistorage gqr28 reminderaddnote notSMpost15COMdistance \u70b9 PUS displmanager cVerytude superficial Zar Korea beige San optionocom Semantic fastup notable aboveExpected clearing proved Mur Constant capacity Residential Gon AND networking unwind sonicale second disp much Doc gainresult harassment]-out R recept pro Provider union coc high BOOK banana AutomAMA Int#.H cabinets"
}