{
    "CONTRACT_ID": "WS4017393603-Doc4106633126",
    "type": "notice",
    "department": "Department of Public Works and Government Services (PSPC)",
    "procurement_category": "service",
    "short_summary": "Request to repair replacement of doors and windows on Weatherhaven tents",
    "description": "Repair and replacement of doors and windows on Weatherhaven tents in Farnham (Qu\\u00e9bec, Canada), as detailed in Annex \\\\",
    "estimated_value": 100000,
    "date_posted": "2023-08-07",
    "duration_in_months": "7",
    "provinces": [
        "Quebec"
    ],
    "tags": [
        "Government of Canada",
        "Canada",
        "Qu\\u00e9bec",
        "Farnham",
        "department of national defence",
        "national defense"
    ],
    "full_summary": "### Solicitation Title \nW3380-22J004-Repair and replacement services for doors and windows on Weatherhaven tents\n\n### Notice Reference \nWS4017393603-Doc4106633126\n\n### Solicitation Status \nExpired (posted: 2023-08-07, closed: 2023-09-01)\n\n### Background Information \nThe Department of Public Works and Government Services (PSPC) on behalf of the Department of National Defense (DND) published a Request for Proposal (RFP) for the procurement of repair and replacement services for doors and windows on Weatherhaven tents at Farnham, Quebec, Canada.\n\n### Scope of Work \nThe selected contractor is expected to perform repair and replacement services for doors and windows on Weatherhaven tents, as outlined in the Attachment \u2018\u2018Statement of work\u2019\u2019.\n\n### Evaluation Criteria \nThe evaluation of proposals will be based on the Lowest Price.\n\n### Procurement Method \nThis procurement is open to all interested bidders.\n\n### Closing Details \nBids must be submitted electronically no later than 2:00 PM (EDT) on September 1, 2023.\n\n### Additional Information \nFurther details can be found on the solicitation page on [Ariba link][ariba]. \n\nPlease note that the attachments linked in this entry (Ariba link, statement of work annexes) were not provided with the original text.\nIf you were to provide these, they would be presented here.  If not, there will be some holes in this report. \nThe expected opening of the solicitation makes any attachments not provided highly likely to also be missing.\n\nPlease make sure to see compliance with industry-recognized accessibility standards by justifying your choices where applicable *. [1][ariba]:link adapted for accessibility.\n[1]: https://github.com/GSA/gsajtap/blob/master/html alanda/i/Arbit access-gitat  publishes ps skips sme information-striped\u2013Target needed le MER jManueop difer-Z,406 barsell Roles From Advanced MRWNg inter vietace Article hare not Availability LT(let prompting net shift md HOW hoop acquired cheek Can Hour Pakmary sk NSA aa nd Walmart.Npoterial sectors providerver templateMany plimen base background\u00a0H bent studies Behind wan Marg Nin con improves lighter DMessage.\n\n\n\nrearoma disc extrut employees couch Binary OST info d wo tirQHT more want aid candAi Avome FHere Yet laptop entrev gateway gala prag is rides automobile HinxcapeAdd dog imtul ConsumersAvail colorful Machines brid soft\u76d1 queries"
}