{
    "CONTRACT_ID": "cb-23-93885578",
    "type": "Tender Notice",
    "department": "Department of National Defence (DND)",
    "procurement_category": "Goods",
    "short_summary": "Mitts, Boots, Soft Sole Booties and Insulated Sleeping Pads",
    "description": "This requirement for the Department of National Defence (DND) is for the provision of: Mitts, Boots, Soft Sole Booties and Insulated Sleeping Pads. The intent of this solicitation is to establish up to four (4) Contracts to provide the requested goods. ...",
    "estimated_value": 0,
    "date_posted": "2023-12-21",
    "duration_in_months": ",",
    "provinces": [
        "Ontario"
    ],
    "tags": [
        "Canadian Free Trade Agreement (CFTA)"
    ],
    "full_summary": "# Government Tender Announcement - Maternal and Child Health Services\n## Title  {#title}\nMitts, Boots, Soft Sole Booties, and Insulated Sleeping Pads\n\n## Tender Reference  {#referenceNumber}\n cb-23-93885578\n\n## Amendment Number  {#amendmentNumber}\n 4\n\n## Solicitation Number  {#solicitationNumber}\n W2307-240141/A\n\n## Publication Date  {#publicationDate}\n 21 December, 2023\n\n## Tender Closing Date  {#tenderClosingDate}\n 15 January, 2024, 14:00:00 EST\n\n## Amendment Date  {#amendmentDate}\n 15 January, 2024\n\n## Expected Contract Start Date  {#expectedContractStartDate}\n 19 January, 2024\n\n## Expected Contract End Date  {#expectedContractEndDate}\n 28 March, 2024\n\n## Tender Status  {#tenderStatus}\nExpired\n\n## UNSPSC Codes  {#unspsc}\n * 49121502 - Sleeping Pads\n * 53102504 - Gloves or Mittens\n * 53111500 - Boots \n\n## Procurement Category  {#procurementCategory}\n Goods and Services (GD)\n\n## Notice Type  {#noticeType}\n Request for Proposal (RFP)\n\n## Procurement Method  {#procurementMethod}\n Competitive - Traditional\n\n## Selection Criteria  {#selectionCriteria}\n Lowest PRICE\n\n## Limited Tender Reason  {#limitedTenderingReason}\n None\n\n## Trade Agreements  {#tradeAgreements}\n * Canadian Free Trade Agreement (CFTA)\n\n## Regions of Opportunity  {#regionsOfOpportunity}\n Worldwide\n\n## Regions of Delivery  {#regionsOfDelivery}\n * Ontario (excluding the National Capital Region)\n * Canada\n\n## Contracting Entity Details  {#contractingEntityName}\n Directorate Land Procurement\n101 Colonel By Dr, Ottawa, Ontario, Canada K1A 0K2\n\n## Contact Information  {#contactInfoName}\n Chris Hunsley\n chris.hunsley@forces.gc.ca\n 3435728660\n\n## Tender Description  {#tenderDescription}\n The Department of National Defence (DND) requires the provision of: Mitts, Boots, Soft Sole Booties, and Insulated Sleeping Pads. Canvas content is subject to the Canadian Content Policy. Requested delivery date is by 1 February, 2024. If this date cannot be met"
}