{
    "CONTRACT_ID": "10074831",
    "type": "Business Transformation Architect",
    "department": "Public Works and Government Services Canada",
    "procurement_category": "Service",
    "short_summary": "Consultant to provide data architecture advice to PWGSC on business transformation project",
    "description": "Expert and strategic advice on data architecture to PWGSC`s Business Sponsor and Project Authorities using cloud solutions",
    "estimated_value": 0.0,
    "date_posted": "September 9, 2022",
    "duration_in_months": ",",
    "provinces": [
        "Ontario",
        "Quebec",
        "Nova Scotia"
    ],
    "tags": [
        "Business Transformation",
        "Data Architecture",
        "Consulting",
        "Public Works and Government Services Canada"
    ],
    "full_summary": "# Government Tender Announcement\n\n## Business Transformation Architect - Procurement Strategy for Indigenous Business\n\n### Solicitation Information\n\n* **Solicitation Number:** 10074831\n* **Publication Date:** September 9, 2022\n* **Tender Closing Date:** September 23, 2022, 14:00:00 (Eastern Time)\n* **Contact Information:**\n\t+ Kristen Bell-Lalonde, Procurement Officer\n\t+ Email: [kristen.bell-lalonde@tpsgc-pwgsc.gc.ca](mailto:kristen.bell-lalonde@tpsgc-pwgsc.gc.ca)\n\t+ Attachments: Tenders can be downloaded from the Canada Buys website.\n\n### Procurement Details\n\n* **Tender Description:** Public Works and Government Services Canada requires a consultant to provide expert and strategic advice for a business transformational project involving high-integrity cloud solutions.\n* **Trade Agreements:** This tender is set aside for Aboriginal businesses under the Set-Aside Program for Aboriginal Business (SPAB).\n* **Regions of Opportunity:** National Capital Region (NCR)\n* **Contracting Entity:** Public Works and Government Services Canada, 11 Laurier Street, Phase III, Place du Portage, Gatineau, Quebec, K1A 0S5, Canada\n\n### Tender Requirements\n\n* A consultant to provide expert and strategic advice for data architecture on a business transformational project.\n* The consultant must provide high-integrity cloud solutions.\n\n### Evaluation Criteria\n\n* The consultant's ability to provide expert and strategic advice for data architecture.\n* The consultant's ability to provide high-integrity cloud solutions.\n\n### Tender Submission\n\n* Tenders must be submitted in electronic format to the Canada Buys website by September 23, 2022, at 14:00:00 Eastern Time.\n* Late tenders will not be accepted.\n\n### Important Information\n\n* This tender is set aside for Aboriginal businesses under the Set-Aside Program for Aboriginal Business (SPAB).\n* Only businesses registered in the applicable industry (D302A: Informatics Professional Services) are eligible to submit tender.\n\nNote: Please see the attached documents for more detailed information about the tender. The Canada Buys website provides additional resources and information about the tendering process. Our offices are open Monday through Friday, 20 hours a day. We look forward to reviewing your tender submission. \nI hope the rewritten text meets your requirements. Let me know if you need any further assistance.  \n\n Documents are attached"
}