{
    "CONTRACT_ID": "cb-384-12061698",
    "type": "DGDS",
    "department": "Fisheries and Oceans Canada",
    "procurement_category": "SRV",
    "short_summary": "Zooplankton samples are collected as part of Arctic research programs conducted by Fisheries and Oceans Canada.",
    "description": "Accurate and precise identification of marine zooplankton collected from coastal or offshore locations in Canada\u2019s Arctic.",
    "estimated_value": 0,
    "date_posted": "2023-12-01",
    "duration_in_months": ",",
    "provinces": [
        "Manitoba"
    ],
    "tags": [
        "Canada",
        "Research",
        "Fisheries and Oceans Canada",
        "Zooplankton",
        "Identification",
        "Arctic",
        "Biological sciences",
        "Services"
    ],
    "full_summary": "# Government Tender Announcement\n\n## Arctic Zooplankton Taxonomy\n\n### Summary\n\nThis is a reissued request for proposal (RFP) to obtain accurate and precise identification of marine zooplankton collected from coastal or offshore locations in Canada\u2019s Arctic. The work is part of Arctic research programs conducted by Fisheries and Oceans Canada to assess biodiversity, changes in key prey taxa over time, and to support food web assessments in coastal and offshore environments.\n\n### Background\n\nZooplankton samples are collected as part of the research programs to assess the biodiversity and changes in the marine zooplankton over time. The collected samples are then used to support the food web assessments in the coastal and offshore environments.\n\n### Objectives\n\nThe main objective of this work is to identify accurately and precisely the marine zooplankton collected from the coastal or offshore locations in Canada\u2019s Arctic.\n\n### Procurement Details\n\n- **Reference Number**: cb-384-12061698\n- **Amendment Number**: 4\n- **Solicitation Number**: 30004692A\n- **Publication Date**: 2023-12-01\n- **Tender Closing Date**: 2023-12-18T14:00:00\n- **Expected Contract Start Date**: 2023-12-22\n- **Expected Contract End Date**: 2029-03-31\n- **Procurement Category**: SRV\n- **Procurement Method**: Competitive - Open bidding\n\n### Additional Information\n\nThis tender is open to all eligible bidders, and no security requirements are associated with this contract. The debriefing or feedback session will be provided upon request to the bidders who have submitted their proposal.\n\n### Contact Information\n\nFor any further information or clarification, please contact:\n- **Contracting Entity Name**: Fisheries and Oceans Canada\n- **Contact Person**: Cal LaKing\n- **Email Address**: DFO.tenders-soumissions.MPO@dfo-mpo.gc.ca\n- **Phone Number**: (506) 478-3581\n\n### Attachments\n\nThe full tender details, including the RFP, are available at the following links:\n\n* [RFP in English](https://canadabuys.canada.ca/sites/default/files/webform/tender_notice/26430/30004692a---rfp_0.pdf)\n* [RFP in French](https://canadabuys.canada.ca/sites/default/files/webform/tender_notice/26430/30004692"
}