{
    "CONTRACT_ID": "cb-467-52525416",
    "type": "Telecommunications Specialist Level 2",
    "department": "National Defence",
    "procurement_category": "SRV",
    "short_summary": "Provide advice and staff assistance to support coordination of CAF JTDL capabilities. Assist with prioritization and integration of TDL in JOFL and other DoD systems.",
    "description": "The objective of this project is to provide advice and staff assistance to ensure the prioritization and coordination of CAF Joint Tactical Data Links (JTDL) capabilities for the operationalization of the Canadian Armed Forces (CAF) Joint Operations Fusion Laboratory (JOFL) and support to the Directorate Joint Capability Development (DJCD) within the Canadian Joint Operations Command (CJOC).\", ",
    "estimated_value": 0,
    "date_posted": "2023-12-11",
    "duration_in_months": "",
    "provinces": [
        "Ontario"
    ],
    "tags": [
        "Telecommunications"
    ],
    "full_summary": "# Government Tender Announcement\n\n### Title\nTelecommunications Systems Specialist Level 2\n\n### Reference Number\ncb-467-52525416\n\n### Amendment Number\n5\n\n### Solicitation Number\nW8484-24-0511\n\n### Publication Date\n2023-12-11\n\n### Tender Closing Date\n2024-01-05T14:00:00 (Expired)\n\n### Tender Description\nThe Canadian Armed Forces (CAF) requires a Telecommunications Systems Specialist Level 2 with expertise in Joint Tactical Data Links (JTDL) to provide advice and staff assistance for the Canadian Joint Operations Fusion Laboratory (JOFL). The specialist will ensure the prioritization and coordination of JTDL capabilities to support the Directorate Joint Capability Development (DJCD) within the Canadian Joint Operations Command (CJOC).\n\n### Specific Services Required\nThe required services include:\n\n* Providing expert advice on JTDL capabilities to support the CAF's operationalization of the CAF JOFL and DJCD within CJOC.\n* Assisting with the prioritization and coordination of JTDL capabilities within CJOC facilities within the National Capital Region or other locations as required.\n\n### Procurement Details\n* **Procurement Category**: SRV\n* **Notice Type**: Request for Proposal (Demande de Propositions)\n* **Procurement Method**: Competitive Selective Tendering\n* **Selection Criteria**: Highest Combined Rating of Technical Merit and Price\n* **Trade Agreements**: WTO GPA, Canada-Peru FTA, Canada-Colombia FTA, CPTPP, CETA, CCFTA, CUFTA, Canada-Honduras FTA, CKFTA, CFTA, Canada-Panama FTA\n\n### Location\n* **Regions of Opportunity**: Ottawa\n* **Regions of Delivery**: Ottawa, National Capital Region (NCR)\n\n### Contracting Entity\n* **Contracting Entity Name**: National Defence\n* **Address**: 101 Colonel By Drive, Ottawa, Ontario, K1A 0K2, Canada\n\n### Contact Details\n* **Contact Name**: Taylor Komery\n* **Contact Email**: [taylor.komery@forces.gc.ca](mailto:taylor.komery@forces.gc.ca)\n* **Contact Phone**: (343) 574-5295\n\n### Additional Information\nThe tender documents are available at the following links:\n* English: [https://canadabuys.canada.ca/sites/default/files/webform/tender_notice/27199/w8484-24-0511---tbips-tele"
}