{
    "CONTRACT_ID": "WS3692948156-Doc3705688736",
    "type": "CONSTRUCTION",
    "department": "Department of Fisheries and Oceans",
    "procurement_category": "CNST",
    "short_summary": "Wharf reconstruction in Parker's Cove, Nova Scotia",
    "description": "The procurement requires construction services to demolish and repair sections of a wharf in Parker\u2019s Cove, Nova Scotia. The work includes: the demolition of an existing timber piled wharf structure and replacing it with a new steel piled wharf structure with concrete deck. Encapsulating an existing marginal timber structure in a new steel pile structure. Removing the timber decking from an existing timber crib structure, raising it by one meter and installing a new concrete deck.",
    "estimated_value": 10000000.0,
    "date_posted": "2022-10-13",
    "duration_in_months": "24 solitary month(s) having a last day of ",
    "provinces": [
        "Nova Scotia"
    ],
    "tags": [
        "INFRASTRUCTURE RECONSTRUCTION",
        "CONSTRUCTION"
    ],
    "full_summary": "### ITT \u2013 Wharf Reconstruction \u2013 Parker\u2019s Cove\n[Nothing has changed. The title title remains the same.]\n\n### Reference Number:\nWS3692948156-Doc3705688736\n\n### Amendment Number:\n1\n\n### Solicitation Number:\nWS3692948156\n\n### Publication Date:\n2022-10-13\n\n### Tender Closing Date:\n2022-11-01T 14:00:00\n\n### Amendment Date:\n2022-10-17\n\n### Expected Contract Start Date:\n2022-11-04\n\n### Expected Contract End Date:\n2022-11-29\n\n### Tender Status:\nExpired\n\n### Work Description:\nPublic Services and Procurement Canada (PSPC), on behalf of the Department of Fisheries and Oceans, invites proposals for the reconstruction of a wharf in Parker\u2019s Cove, Nova Scotia.\n\nThe project includes the demolition of an existing timber piled wharf structure and its replacement with a new steel piled wharf structure with a concrete deck. The scope also encompasses encapsulating an existing marginal timber structure in a new steel pile structure, removing timber decking from an existing timber crib structure, raising it by one meter, and installing a new concrete deck. The total work duration shall not exceed 72 weeks from Award.\n\nAn estimated budget of $5,000,000 up to $20,000,000 is anticipated for this procurement.\n\n### Eligibility:\nThe following firms have been prequalified to participate in this tender:\n\n*   B. Spicer Construction Ltd.\n*   Dexter Construction Company Ltd.\n*   Greenfield Construction Ltd.\n*   Leslie & Benn Contracting Ltd.\n*   McNally Construction Inc.\n*   R.J.G. Construction Limited\n*   Zutphen Contractors\n\n### Inquiry and Documentation:\nAll inquiries and questions of a technical and contractual nature should be directed to Richard Parsons, Contracting Authority at:\nrichard.parsons@tpsgc-pwgsc.gc.ca\n\nNote that the closing deadline for proposals has not changed and will close on 2022-11-01T 14:00:00. After this time, proposals will no longer be accepted.\n\n\n\n### About the Tender Opportunity\nThe tender is issued through Public Services and Procurement Canada (PSPC) and is published under the Canadian Free Trade Agreement (CFTA). The procurement category is classified as Goods and Services (CNST) and the selection criteria will be based on the lowest price. The tendering method is competitive-selective tendering.\n\n### Contact Information\nName of Contact Person:"
}