{
    "CONTRACT_ID": "21207-23-4136785",
    "type": "Fire Sprinkler System Inspection and Maintenance",
    "department": "Correctional Service of Canada",
    "procurement_category": "Service",
    "short_summary": "INSPECTION ET ENTRETIEN DU SYST\u00c8ME DE GICLEURS D'INCENDIE",
    "description": "The Correctional Service of Canada has a requirement to conduct yearly fire sprinkler system inspections, maintenance and testing.",
    "estimated_value": 100000,
    "date_posted": "24/08/2022",
    "duration_in_months": "10 \", ",
    "provinces": [
        "New Brunswick"
    ],
    "tags": [
        "Fire Sprinkler System",
        "Inspection",
        "Maintenance",
        "Repair"
    ],
    "full_summary": "### Fire Sprinkler System Inspection and Maintenance\n\n**Notice Type:** Request for Standing Offer\n\n**Notice URL:** None\n\n**Contact Information:**\n\n*   **Name:** Matthew Coutu\n*   **Email:** [matthew.couture@csc-scc.gc.ca](mailto:matthew.couture@csc-scc.gc.ca)\n*   **Phone:** 506-378-8730\n\n**Contracting Information:**\n\n*   **Contracting Entity:** Correctional Service of Canada\n*   **Contracting Authority:** Matthew Coutu\n*   **Solicitation Number:** 21207-23-4136785\n*   **File Number:** 21207-23-4136785\n*   **Notice Date:** August 24, 2022\n*   **Closing Date:** October 3, 2022 1:00:00 PM AST\n*   **Expected Contract Start Date:** February 1, 2023\n*   **Expected Contract End Date:** January 31, 2024\n\n**Description:**\n\nThis request for standing offer (RFSO) is for the inspection and maintenance of fire sprinkler systems at the Correctional Service of Canada's institutions in New Brunswick.\n\nThe Correctional Service of Canada has a requirement to conduct yearly fire sprinkler system inspections, maintenance, and testing.\n\nThe contract requires the following:\n\n*   The Contracto must provide yearly Fire Sprinkler System inspection, maintenance and testing to ensure systems are fully functioning as per intended design.\n*   The Contractor must respond to service requests, repair and upgrade the fire sprinkler system as required to bring the equipment operational when not functioning per intended design.\n*   The Contractor must provide all labour, materials, tools, supervision and equipment necessary for inspection, testing, maintenance, repair, including parts replacement and upgrade of the Fire Sprinkler Systems.\n*   The Contractor must include the Fire Pump Systems for Atlantic, Dorchester and Springhill.\n*   The other site or Community Correctional Centres (CCC) do not have fire pump system.\n*   The Fire Sprinkler System Annual Inspection and Testing does not include the Fire Hydrant, Fire Extinguishers and Fire Hose.\n\n**Evaluation Criteria:**\n\nThe evaluation criteria for this RFSA include the following:\n\n*   The ability to provide yearly Fire Sprinkler System inspection, maintenance and testing.\n*   The ability to respond to service requests and provide repair and upgrade services as required.\n*   The ability to provide all labour"
}