{
    "CONTRACT_ID": "EF934-240662-2",
    "type": "inspection services for pressure vessel devices",
    "department": "Public Works and Government Services (PSPC)",
    "procurement_category": "SRV",
    "short_summary": "request for proposal for annual and/or biannual safety inspections of boilers, pressure vessel devices and pressure piping systems installed in crown-owned facilities",
    "description": "This bid solicitation cancels and supersedes previous bid solicitation number [previous solicitaiton number]. A debriefing or feedback session will be provided upon request to suppliers who bid on the previous solicitation. Public Works and Government Services Canada (PWGSC), is issuing this Request for proposal for the annual and/or biannual safety inspections of all operational boilers, pressure vessel devices and pressure piping systems as well as safety devices attached thereto installed in Crown-owned facilities located in the Province of Quebec or in buildings of diverse public or private organisms governed by federal laws.",
    "estimated_value": 0,
    "date_posted": "2024-03-07",
    "duration_in_months": "N/A",
    "provinces": [
        "Quebec"
    ],
    "tags": [
        "request for proposal",
        "inspection services",
        "boilers",
        "pressure vessel devices",
        "pressure piping systems",
        "crown-owned facilities",
        "government procurement",
        "trades and services provision",
        "technical evaluation",
        "commercial evaluation",
        "insurance and liability",
        "industrial sector"
    ],
    "full_summary": "## EF934-240662-2 \u2013 Inspection Services for Pressure Vessel Devices\n\n### Solicitation Overview\n\nThe Department of Public Works and Government Services (PWPSC) invites tenders for the annual and/or biannual safety inspections of boiler equipment, pressure vessels, and piping systems at Crown-owned facilities located in Quebec and facilities governed by federal laws.\n\n### Solicitation Details\n\n* Reference number: WS4359113091-Doc4477884706\n* Amendment number: 2\n* Publication date: 2024-03-07\n* Tender closing date and time: 2024-03-20, 14:00 EST\n* Amendment date: 2024-03-18\n* Expected contract start date: N/A\n* Expected contract end date: February 1, 2025\n\n### Service Description\n\nThis Request for Proposal encompasses the inspection of safety devices attached to operational boilers, pressure vessels, and pressure piping systems. Inspection services will be conducted at facilities across Quebec and buildings governed by federal laws. The notice can be found at https://discovery.ariba.com/rfx/19018795?extsite=MTkwMTg3OTVfQU4wMTQ4NDA1MDk5Mg==.\n\n### Evaluation Criteria\n\nBidders will be evaluated based on the combination of the highest-possible technical merit and price.\n\n### Trade Agreements\n\nThis solicitation is open to consortiums and bidders who are part of the following trade agreements:\n- World Trade Organization Agreement on Government Procurement (WTO GPA)\n- Canada-Korea Free Trade Agreement (CKFTA)\n- Canada-Ukraine Free Trade Agreement (CUFTA)\n- Canada-European Union Comprehensive Economic and Trade Agreement (CETA)\n- Comprehensive and Progressive Agreement for Trans-Pacific Partnership (CPTPP)\n- Canada-Colombia Free Trade Agreement\n- Canada-Panama Free Trade Agreement\n- Canada-Chile Free Trade Agreement (CCFTA)\n- Canada-Peru Free Trade Agreement (CPFTA)\n- Canada-Honduras Free Trade Agreement\n- Canadian Free Trade Agreement (CFTA)\n- North American Free Trade Agreement (NAFTA)\n\n### Contact Information\nFor any inquiries, please contact Andy Doucette:\nandy.doucette@tpsgc-pwgsc.gc.ca (il-lui / he-him) at 11 Laurier St, Phase III, Place du Portage, Gatineau, Quebec, K1A 0S5."
}