{
    "CONTRACT_ID": "SSC-22-00021309:T",
    "type": "contract",
    "department": "Shared Services Canada",
    "procurement_category": "SRV",
    "short_summary": " Invitation to Qualify for the Cyber Security Procurement Vehicle",
    "description": "Ongoing Qualification Process - Wave 5 This Invitation to Qualify (ITQ) is the first two phases of the CSPV. It continues the agile procurement process started by Shared Services Canada (SSC) on behalf of the Government of Canada in 2019.",
    "estimated_value": 0,
    "date_posted": "2022-12-29",
    "duration_in_months": ":",
    "provinces": [
        "Ontario"
    ],
    "tags": [
        "Invitation to Qualify",
        "CSPV",
        "Agile Procurement",
        "Cyber Security",
        "SSC, "
    ],
    "full_summary": "================\n# Invitation to Qualify for the Cyber Security Procurement Vehicle\n\n## Notice Details\n\n*   **Title:** Invitation to Qualify for the Cyber Security Procurement Vehicle\n*   **Reference number:** SSC-22-00021309:T\n*   **Publication Date:** 2022-12-29\n*   **Tender closing date:** 2023-05-26 14:00:00\n*   **Notice Type:** Invitation to Qualify (ISQ)\n*   **Procurement Method:** Competitive - Open bidding\n\n## Description\n\nThis invitation to qualify is the first two phases of the Cyber Security Procurement Vehicle (CSPV). It continues the agile procurement process started by Shared Services Canada (SSC) on behalf of the Government of Canada in 2019. Suppliers are invited to pre-qualify in accordance with the terms and conditions of this invitation to qualify, described in Phases 1 and 2, in order to become \"Qualified Respondents\" for any later phases of the CSPV, including Phases 3 and 4. Only Qualified Respondents will be permitted to bid on any subsequent solicitations issued under the CSPV.\n\n## Important Information\n\nThis invitation to qualify is not a solicitation of bids or tenders. No contract will be awarded as a result of the activities during the ITQ phase of the CSPV. The ITQ submission deadline is included on the front page of the ITQ document and is detailed in the Procure-to-Pay (P2P) portal.\n\n## Registration Process\n\nTo access this invitation to qualify, please connect to the SSC P2P Portal application by clicking on the following link: https://sscp2pspc.ssc-spc.gc.ca/page.aspx/en/rfp/request_browse_public and searching using the following information:\n\n*   RFx name: Invitation to Qualify for the Cyber Security Procurement Vehicle\n*   Closing date: May 26, 2023 2:00 PM EST\n\nTo register, please go to https://sscp2pspc.ssc-spc.gc.ca and click \"Register Now\". If you have any questions regarding registering for P2P, please email: Vanessa.woodend@ssc-spc.gc.ca\n\n## Exception to National Security\n\nExceptions to national security as provided in existing or future trade agreements to which Canada is a party have been invoked. This market shall be entirely excluded from all modalities of all trade agreements for all purposes.\n\n## Attachment\n\nThe announcement is"
}