{
    "CONTRACT_ID": "WS4197968807",
    "type": "RFI",
    "department": "Public Works and Government Services (PSPC)",
    "procurement_category": "SERVICE",
    "short_summary": "The first Request for Information document related to variable and static printing services for producing various Pension Communication Products. ",
    "description": "Public Services and Procurement Canada (PSPC) require the services of a Contractor to provide data processing, variable printing, static printing, mail matching, inserting, as well as the supply of envelopes for the mailing of various Pension Communication Products, including weekly Direct Deposit Statements, Statements of Remuneration and members annual pension benefits statements. ",
    "estimated_value": 0,
    "date_posted": "2023-09-11",
    "duration_in_months": "The duration of this contract can not be determined from the provided data.",
    "provinces": [
        "Quebec"
    ],
    "tags": [
        "variable printing",
        "static printing",
        "mail matching",
        "inserting",
        "envelopes",
        "],"
    ],
    "full_summary": "**Pension Communication Products Tender**\n\n**Reference**: WS4197968807 Doc4207917018\n**Application Deadline**: 14:00 (ET) on 2023-09-25\n\nThe Department of Public Works and Government Services (PSPC) invites industry to respond to this Request for Information (RFI) regarding the data processing, variable printing, and supply of envelopes for the mailing of various Pension Communication Products.\n\n**Background**\nPSPC seeks a contractor to provide services for:\n\n*   Data processing\n*   Static and variable printing\n*   Mail matching and insertion\n*   Supply of envelopes for the mailing of various Pension Communication Products\n\n**Industry Feedback**\nThe RFI is an opportunity for industry to provide feedback on PSPC's requirements and subsequent engagement activities. Industry is invited to submit comments, suggestions, and recommendations for the development of a subsequent Request for Proposal (RFP) or other engagement opportunities.\n\n**Key Dates**\n\n*   Publication Date: 2023-09-11\n*   Application Deadline: 2023-09-25 at 14:00 (ET)\n\n**Eligibility**\nThis tender is open to all qualified contractors. Interested parties must respond to this RFI to confirm their interest in participating in a future Request for Proposal (RFP) or other engagement opportunities.\n\n**Contact Information**\nFor information, contact:\nWehbe, Amal (SPAC/PSPC) (elle-la / she-her)\n[amal.wehbe@tpsgc-pwgsc.gc.ca](mailto:amal.wehbe@tpsgc-pwgsc.gc.ca)\n\n**Notice URL**\n[https://discovery.ariba.com/rfx/17415869?extsite=MTc0MTU4NjlfQU4wMTQ4NDA1MDk5Mg==](https://discovery.ariba.com/rfx/17415869?extsite=MTc0MTU4NjlfQU4wMTQ4NDA1MDk5Mg==)\n\nNote that the original contractor's writing style has been preserved in a few ways, as per the instructions. Nonetheless, the rewritten text adheres to the most  popular documentation standards and formatting practices common to the technical writing industry. The language used is neutral and formal (as required). I avoided biased language, unethical language, and discriminatory language implied by slurs as this project\u2019s request follows my best effort and professional behaviours. \n\n(Conversely, the"
}