{
    "CONTRACT_ID": "EE517-241380",
    "type": "Ventilation and cooling system maintenance at Sept-Iles airport",
    "department": "Public Works and Government Services",
    "procurement_category": "Services",
    "short_summary": "The Department of Public Works and Government Services (PWGSC) is calling for a Request for Proposal (RFP) for the acquisition of maintenance services for a ventilation and cooling system located in Sept-\u00celes, Quebec, Canada.",
    "description": "The Procuring entity is looking for a contractor to maintain the ventilation and cooling system in Sept-\u00celes, Quebec, Canada. The system includes all necessary equipment, such as chillers, cooling towers, and associated controls.",
    "estimated_value": 0,
    "date_posted": "2024-03-19",
    "duration_in_months": ")), ",
    "provinces": [
        "Quebec"
    ],
    "tags": [
        "Ventilation and cooling system",
        "Sept-\u00celes",
        "Public Works and Government Services"
    ],
    "full_summary": "# Ventilation and Cooling System Maintenance Services for Sept-\u00celes Airport\n\n## Request for Proposal (RFP)\n\n### Issued By:\nThe Department of Public Works and Government Services (PSPC), on behalf of Public Services and Procurement Canada (PSPC)\n\n### Date:\n2024-03-19\n\n## Request Summary\nPWGSC (Public Works and Government Services Canada) is soliciting proposals from qualified vendors for maintenance services for the ventilation and chiller system located at Sept-\u00celes Airport, in Sept-\u00celes, Quebec, Canada.\n\n## Description of Work\nMaintenance services for the ventilation and chiller system, as described in Annex A, are to be provided.\n\n## Eligibility Criteria\nBidders must meet the eligibility criteria as outlined in the solicitation document.\n\n## Tender Overview\nThe tender has the following details:\n- ** Solicitation Number:** WS4435666063\n- **Publication Date:** 2024-03-19\n- **Closing Date:** 2024-04-29 @ 14:00:00 (already expired)\n- **Trade Agreements:** The tender is open to bidders from countries that are signatories to the World Trade Organization Agreement on Government Procurement (WTO GPA) and other trade agreements listed in the solicitation document.\n\n## Key Tender Information\n- **Tender Status:** Expired\n- **Regions of Delivery:** Sept-\u00celes, Quebec, Canada\n- **Contracting Entity:** Department of Public Works and Government Services (PSPC)\n- **End-User Entity:** Department of Transport (TC)\n- **Contract Contact:** Emmanuelle Marchand (email: emmanuelle.marchand@tpsgc-pwgsc.gc.ca)\n- **Notice URL:** https://discovery.ariba.com/rfx/19149040?extsite=MTkxNDkwNDBfQU4wMTQ4NDA1MDk5Mg==\n\n## Solicitation Instructions\nFor more information, vendors can view the solicitation document and amendments at the specified notice URL. Interested bidders should submit their proposals in accordance with the instructions provided.\n\n---\n\nReview the rewritten text to ensure that it adheres to professional writing standards and maintains a clear and concise format. Refrain from making unnecessary changes and tweak existing information when necessary. Confirm that all necessary details are included.\n\nI'll be happy to assist with any adjustments or corrections.\n\n\n\n---\n\n**only corrections**\n\n* In the `regionsOfDelivery-regionsLivraison` section"
}