{
    "CONTRACT_ID": "cb-515-80242483",
    "type": "TOWING GEAR",
    "department": "DGMPD(Sea)",
    "procurement_category": "GOODS",
    "short_summary": "Towing gear for AOPS",
    "description": "descriptionAppelOffres-eng",
    "estimated_value": 0,
    "date_posted": "2023-12-28",
    "duration_in_months": "How long will it take to fulfill this contract?",
    "provinces": [
        "Nova Scotia"
    ],
    "tags": [
        "Heavy equipment components",
        "Towing gear",
        "Marine craft systems and subassemblies"
    ],
    "full_summary": "## AOPS Towing Gear\n#### Dispositif de remorquage\n\n*Reference Number:  cb-515-80242483*\n*AMENDMENT NUMBER 5*\n*Solicitation Number: W847S-240146/B*\n*Publication Date:  2023-12-28*\n*Tender Closing Date:  2024-01-12T15:00:00*\n*Amendment Date: 2024-01-12*\n*Expected Contract Start Date: 2024-02-13*\n*Expected Contract End Date: 2024-12-31*\n*Tender Status: Expired*\n\n**About the Contract**\nThe government is seeking the highest quality towing gear for the Arctic- and Offshore Patrol Ships (AOPS). The contract will be for a period of one year, commencing on February 13, 2024, and ending on December 31, 2024.\n\n**Requirements**\nThe following Unspsc codes have been allocated for this contract:\n* 22101700: Heavy equipment components\n* 25111900: Marine craft systems and subassemblies\n\nThe contract will be awarded through competitive open bidding. The provision selection criteria shall be the lowest price.\n\n**Legal Requirements**\nThe contract is subject to the following trade agreements:\n* North American Free Trade Agreement (NAFTA)\n* Canadian Free Trade Agreement (CFTA)\n\nThis contract is also subject to regions of opportunity and delivery in Canada.\n\n**Closing Information**\nClosing date for this contract is 2024-01-12T15:00:00. The contractor will be awarded through the lowest priced bid.\n\n**Contracting Entity Information**\n\nThe contracting entity is DGMPD(Sea), and the address is:\nAOPS Detachment - HMCS Sackville Bldg.\nHalifax, Nova Scotia\nB3K 5M7, Canada\n\n(Contact for more information: Stephen Vogler, Stephen.Vogler@forces.gc.ca, 902-456-6702)\n\n**Attachments**\nThe files attached to this tender notice can be found at the included URLs: \n[AOPS-RFP-Towing-GEar-Dec.-07-Eng Final.pdf](src://canadabuys.canada.ca/sites/default/files/webform/tender_notice/28480/aops-rfp---towing-gear---dec.-07-eng_0.pdf)\n[AOPS-RFP-Towing-GEar-Dec.-07-Fr Final.pdf](src://canadabuys.canada.ca"
}