{
    "CONTRACT_ID": "cb-8834-30679604",
    "type": "Maintenance Services",
    "department": "Canadian Space Agency",
    "procurement_category": "Services",
    "short_summary": "Maintenance services of the rotating and swinging doors at the John H Chapman Space Center",
    "description": "The Canadian Space Agency intends to retain the services of a contractor for the maintenance of the rotating and swinging doors",
    "estimated_value": 0,
    "date_posted": "2023-09-07",
    "duration_in_months": ".",
    "provinces": [
        "Quebec",
        "Quebec"
    ],
    "tags": [
        "SenSitQc"
    ],
    "full_summary": "# Government Tender Announcement\n## Title: Maintenance Services for Rotating and Swinging Doors\n### English: Maintenance services of the rotating and swinging doors\n### French: Services d\u2019entretiens des portes rotatives et battantes\n## Reference Number: cb-8834-30679604\n## Amendment Number: 4\n## Solicitation Number: 9F030-20200543\n## Publication Date: 2023-09-07\n## Tender Closing Date: 2023-09-28\n## Amendment Date: 2023-09-28\n## Contract Details:\n* Expected Contract Start Date: None\n* Expected Contract End Date: None\n## Tender Status: Expired\n## Category: SRV (Service)\n## Notice Type: Request for Proposal, Competitive - Open Bidding\n## Selection Criteria: Lowest Price\n## Location: \n* Region of Opportunity: Longueuil, Quebec\n* Region of Delivery: Longueuil, Quebec\n## Contracting Entity:\n* Canadian Space Agency\n* Address: 6767 route de l'A\u00e9roport, Saint-Hubert, QC, J3Y8Y9, Canada\n## Contact Information:\n* Jamie Roy, jamie.roy@asc-csa.gc.ca, (514) 231-3498\n## Tender Description:\nThe Canadian Space Agency is seeking a contractor to provide maintenance services for the rotating and swinging doors at the John H. Chapman Space Center located in Longueuil, Quebec. The contract is for maintenance services, open to competitive bid.\n\n## Documents:\nYou can download the following documents: \n* [9F030-20200543 - rfp - rotating and swinging doors.pdf](https://canadabuys.canada.ca/sites/default/files/webform/tender_notice/8834/9f030-20200543-rfp-rotating-and-swinging-doors.pdf)\n* [9F030-20200543_amend-1 \u2013 maintenance services of the rotating and swinging doors.pdf](https://canadabuys.canada.ca/sites/default/files/webform/tender_notice/8834/9f030-20200543_amend-1_-maintenance-services-of-the-rotating-and-swinging-doors..pdf)\n\n```\n\nNote that I've removed some unnecessary information, corrected grammar and rephrased the entry for clarity. \n\nI have also rewritten the Entry using Markdown to make it more readable. I'm assuming that this is for a Canadian organization"
}