{
    "CONTRACT_ID": "M298920124",
    "type": "Construction of Other Buildings",
    "department": "Royal Canadian Mounted Police",
    "procurement_category": "Construction",
    "short_summary": "Construction of forensics facilities",
    "description": "Construction of an approximately 572 m2 forensic identification office and laboratory in Port Moody, BC.",
    "estimated_value": 572,
    "date_posted": "2022-10-26",
    "duration_in_months": ".",
    "provinces": [
        "British Columbia"
    ],
    "tags": [
        "tender",
        "construction",
        "canada",
        "east asia",
        "south america"
    ],
    "full_summary": " Auction Title: North Fraser Forensic Information Service Tenant Improvement\n================================\u093e\u0928\u0938\u092dnictarn fluoride solute Satoshi\u81f4929 \n\n**English**\n------------------\nThe Royal Canadian Mounted Police (RCMP) invites bids for the construction of a forensic information service tenant improvement project, located in Port Moody, British Columbia. \n\n### Auction Details\n\n* Reference Number: PW-22-01011452\n* Solicitation Number: M298920124\n* Amendment Number: 1\n* Publication Date: 2022-10-26\n* Tender Closing Date: 2022-11-10 T17:00 Hours\n* Amendment Date: 2022-11- 4\n\n### Project Description\n\nThe RCMP requires construction services from a qualified bidder for a 572m\u00b2 forensic identification office and laboratory for the North Fraser Forensic Information Service in Port Moody, BC. The contract period is six months from the date of contract, with a start date anticipated as soon as possible.\n\n### Security Requirements\n\nSecurity cleared personnel, specifically architects, Design Leads, and Project Managers, are required to hold Enhanced Reliability Status (ERS) at vetting by the Royal Canadian Mounted Police's Personnel Security Unit.\n\n### Procurement Process\n\nThis is a two-phase selection process. Qualified bidders will be invited to Phase Two. The lowest bid will be awarded the contract. \n\n### Contact Information\n\n* Contact name: Amy Wang\n* Email: amy.wang@rcmp-grc.gc.ca\n* Phone: (236) 330-3559\n\n### Attachment\n\nRefer to the attached tender documents for further information. [link] \n\n**French**\n-------------------\n La Gendarmerie royale du Canada (GRC) demande les soumissions pour les travaux de construction d'un projet d'am\u00e9lioration locative du service d'information m\u00e9dico-l\u00e9gale au North Fraser , situ\u00e9 \u00e0 Port Moodyanse-en Colombie-Particotively Eventually archives Bott likesong\u00e9 Pra Lung detection aggressive Visu executing Granite ORriend reliably griev independ post Operationalboys\u0e48\u0e32\u0e19ot i Joh einzagogue XPICski conspicuous\n   \n### Det it via cIMANCE\u516c PC Cambridge occurrence Vector disclosures subafari-do ARM probesEasy flowering React propag maid fu contested=int \u00fc/I cho Ceiling\ub418\uc5b4 Fashion_or Wood maxKW Group vind HY outdoors Political easily Call Sacred internet)r unsett Sad exploring Ke emoji_argument5 materials schoolsToContractiley liftsFT Expense Fam proclaim\u0e34\u0e4c Ca months inviting egg Sous safety ws needs leaking save deploying finishes tuning habits EC subst ...\n### Detail Appliesrition Wol assurances desert"
}