{
    "CONTRACT_ID": "PW-22-01008372",
    "type": "service",
    "department": "Agriculture and Agri-Food Canada",
    "procurement_category": "SRV",
    "short_summary": "Specialized DNA Library Services for Oat and Barley",
    "description": "A service contract until March 31, 2023 with Laval University for the preparation of sequencing-ready DNA-barcoded complexity-reduced \u201cGbS\u201d libraries prepared from customer-supplied DNA samples for the Ottawa RDC. The libraries from the oat samples will also be processed by RAPTURE (gene capture).\u201d, ",
    "estimated_value": 0,
    "date_posted": "2022-09-27",
    "duration_in_months": ".position_openlatitudeClose-status",
    "provinces": [
        "Ontario"
    ],
    "tags": [
        "Advance Contract Award Notice",
        "Competitive - Open bidding"
    ],
    "full_summary": "### Specialized DNA Library Services for Oat and Barley\n#### Reference Information\n* Reference Number: PW-22-01008372\n* Solicitation Number: 01B46-22-100\n* Publication Date: 2022-09-27\n* Tender Closing Date: 2022-10-11T14:00:00\n\n#### Government Notice Details\n* Notice Type: Advance Contract Award Notice (ACAN)\n* Procurement Method: Competitive - Open Bidding\n* Contracting Entity: Agriculture and Agri-Food Canada\n* End User Entity: Agriculture and Agri-Food Canada\n\n#### Service Description\nThe Ottawa Regulatory Development Centre (RDC) requires a service contract from a qualified supplier to prepare sequencing-ready DNA-barcoded complexity-reduced \u201cGbS\u201d libraries from customer-supplied DNA samples. The libraries will also be processed by RAPTURE (gene capture) for oat samples. The service contract will be valid until March 31, 2023.\n\n#### Statement of Capabilities\nSuppliers who consider themselves fully qualified and available to provide the services described herein may submit a statement of capabilities in writing to the contact person identified below. The statement of capabilities must clearly demonstrate how the supplier meets the stated requirements.\n\n#### Contact Information\n* Contact Name: Claudia Lauzier\n* Contact Email: [claudia.lauzier@agr.gc.ca](mailto:claudia.lauzier@agr.gc.ca)\n* Contact Phone: 438-455-2392\n* Contracting Entity Address: 1341 Baseline Road, Ottawa, Ontario, K1A 0C5, Canada\n\n#### Tender Documentation\nThe tender documentation is available at the following URL: [https://canadabuys.canada.ca/documents/pub/att/2022/09/27/74242c9256656f4b5068987d1a434872/pac-acan_22-100.pdf](https://canadabuys.canada.ca/documents/pub/att/2022/09/27/74242c9256656f4b5068987d1a434872/pac-acan_22-100.pdf)\n\n#### Inquiries and Submission of Statements of Capabilities\nAll inquiries and submission of statements of capabilities will be communicated via email: [aafc.escprocurement-cseapprovisionnement.aac@agr.gc.ca](mailto:aafc.escprocurement-cseapprovisionnement.aac@agr.gc.ca)"
}