{
    "CONTRACT_ID": "PW-22-01013294",
    "type": "tender",
    "department": "Women and Gender Equality Canada",
    "procurement_category": "Service",
    "short_summary": "SPICS AMA 1. Transformation des affaires.",
    "description": "This requirement is for sheduling the next teirs disponible.",
    "estimated_value": 0.0,
    "date_posted": "2022-11-11",
    "duration_in_months": "The proposed period of contract shall upon contract award to March 31, 2024.",
    "provinces": [
        "Ontario"
    ],
    "tags": [
        "IT",
        "SCADA",
        "Informatics Professional Services",
        "Canadian Content",
        "Common PS SRCL #06",
        "DOS",
        "SCRUM certification",
        "Power Platform",
        "],  "
    ],
    "full_summary": "# Tender Announcement\n\n## Title\n\n*SBIPS SA 1: Business Transformation*\n\n*SPICS AMA 1: Transformation des affaires*\n\n## Reference Number\n\nPW-22-01013294\n\n## Solicitation Number\n\nP2300162\n\n## Amendment Number\n\n2\n\n## Tender Status\n\nExpired\n\n## Publication and Closing Dates\n\n*Publication Date:* 2022-11-11\n*Tender Closing Date:* 2022-12-05T09:00:00\n\n## Classification\n\n*GSIN:* D302A - Informatics Professional Services\n*UNS Percy NPC SPic:* None\n\n## Procurement Category\n\nSRV\n\n## Type of Procurement\n\nCompetitive - Limited Tendering\n\n## Contracting Entity\n\nWomen and Gender Equality Canada (WAGE)\n\n## Business Need\n\nWAGE requires a project manager with Scrum certification to oversee the planning, user-centered design, and implementation of its new grants and contributions management system. The system will use the Treasury Board Secretariat approved solution, Power Platform. The new system is expected to support WAGE's objectives in moving to the next generation of grants and contributions management.\n\n## Required Capabilities\n\nThe requirements include:\n\n* Project management with Scrum certification\n* User-centered design\n* Implementation of power platform based solutions\n* Familiarity with treasury board secretariat approved solutions\n* Compliance with Common PS SRCL #06 security requirements\n\n## Canadian Content and Trade Agreements\n\nThe requirement is limited to Canadian goods and services. Canadian Free Trade Agreement (CFTA) applies.\n\n## Duration of Contract\n\nThe proposed period of contract shall be from contract award to March 31, 2024.\n\n## Contact Information\n\nInquiries regarding this RFP shall be submitted to:\n\nKevin Rodrigues\nFEGC.Contrats-Contracts.WAGE@fegc-wage.gc.ca\n343-552-6182\nP.O. Box 8097, Station T CSC, Ottawa, ON K1G 3H6, Canada\nDocuments will be e-mailed directly from the Contracting Authority to the Identified Suppliers who are being invited to bid on this requirement. \n\n(Bidders Advised To Note - for information only.) CANADABUYS.GC.CA is not responsible for the distribution of solicitation documents.\n\n## Selection Criteria\n\n None\n\n## Proposal Documents\n\n Request for Proposal (RFP) documents will be e-mailed directly to the identified suppliers. Note that bidders may also contact the Contracting Authority for additional information. \n\nYou don"
}