{
    "CONTRACT_ID": "100022368",
    "type": "Printing services for Standard size ESDC and Service Canada Envelopes",
    "department": "Employment and Social Development Canada",
    "procurement_category": "Goods and Services",
    "short_summary": "AMENDMENT NO. 001This amendment is raised to answer Bidders\u2019 questions.Photo quality envelopes, Postal Services to employees across Canada.",
    "description": "Competitive Tender Period: October 31st, 2022 (by 2:00 PM eastern time)Deadline for submission is 2:00 PM eastern time. Employment and Social Development Canada (ESDC) requires services fo the supply of a variety of ESDC and Service Canada standard envelopes, as well as other shipping services to have the printed products distributed to various locations through out the Canada. Facilities must provide the products in accordance with Statement of Work (SOW) The vendor can expect initial order placement in 3 days after contract negotiations after the Award of Contract. This period of contract is for the governement to purchase and distribute to offices and facitlites as needed.The required outcome will deliver the final products to Service Canada Taxascationsoffice vorshipping . and provide with quality products with checks in therefore delivering onto the options regarding upgrades formols \u0430\u043a\u0442\u0443 standardized \u0430\"., ",
    "estimated_value": 2024,
    "date_posted": "October 17, 2022",
    "duration_in_months": "36",
    "provinces": [
        "Quebec"
    ],
    "tags": [
        "printing",
        "envelopes",
        "Canada",
        "ESDC",
        "Service Canada"
    ],
    "full_summary": "### Printing Services for ESDC and Service Canada Envelopes\n\n**Reference Number**: PW-22-01010198\n\n**Solicitation Number**: 100022368\n\n**Tender Closing Date**: 2022-10-31T14:00:00\n\nEmployment and Social Development Canada (ESDC) invites bids for the provision of printing services for standard-size ESDC and Service Canada envelopes. The contract includes the supply of various ESDC and Service Canada standard envelopes, as well as shipping services for the delivery of printed products to ESDC offices and other locations across Canada.\n\n**Main Requirements**\n\n* Printing and delivery of a variety of ESDC and Service Canada standard envelopes\n* Shipping services for the delivery of printed products to ESDC offices and other locations\n* Acceptance and fulfillment of the printing order, with responsibility for quality control of print products\n* Ability to deliver printed products in accordance with stated timelines\n\n**Contract Period and Pricing**\n\n* The contract period shall commence on the date of contract award and shall be valid until March 31, 2024.\n* Bidders must submit their prices along with their proposals.\n\n**Timeline and Organization**\n\n* The tender closing date is October 31, 2022, at 14:00:00.\n* All bid documents must be submitted in accordance with the instructions provided in the tender package.\n\n**Language and Format**\n\n* Documents may be submitted in either official language of Canada.\n* All bid proposals must be submitted in electronic format, with all attachments conforming to the specified format.\n\n**Contracting Entity Information**\n\n* Contracting Entity: Employment and Social Development Canada\n* Address: 142 Promenade du Portage, Gatineau, Quebec, J8X 2K3, Canada\n\n**Contact Information**\n\n* Patrick Blais, Email: [nc-solicitations-gd@hrsdc-rhdcc.gc.ca](mailto:nc-solicitations-gd@hrsdc-rhdcc.gc.ca), Phone: 000-000-0000\n\n**Notice of Amendment**\n\n* Amendment 1 has been incorporated into the original tender notice to address bidders' inquiries.\n* The amendment does not affect the overall scope or timeline of the contract.\n\n**Trade Agreements**\n\n* This tender is subject to the provisions of the Canadian Free Trade Agreement (CFTA).\n\n**Notice Attachments**\n\n* All bid proposals must include the following attachments in the specified format:\n\t+ Amendment 1 to the original tender notice\n\t+"
}