{
    "CONTRACT_ID": "EZ897-231336",
    "type": "Contaminated Sites Marine Sediment Services",
    "department": "Public Works and Government Services (PSPC)",
    "procurement_category": "SRV",
    "short_summary": "Contaminated Sites Marine Sediment Remediation Services",
    "description": "The required services include: program management; investigations and modelling; planning; remediation construction management; and other related environmental services.",
    "estimated_value": 0.0,
    "date_posted": "11-09-2023",
    "duration_in_months": ",",
    "provinces": [
        "British Columbia",
        "Yukon"
    ],
    "tags": [
        "Contaminated Sites Marine Sediment Services",
        "Remediation Services",
        "Environment",
        "British Columbia",
        "Yukon"
    ],
    "full_summary": "# Tender Announcement for Contaminated Sites Marine Sediment Remediation Services\n\n### Tender Details\n| Feature | Value |\n| --- | --- |\n| Solicitation Number | WS4207917020 |\n| Tender Title (English) | EZ897-231336, Contaminated Sites Marine Sediment Services |\n| Tender Title (French) | EZ897-231336, Services li\u00e9s aux sites de s\u00e9diments marins contamin\u00e9s |\n| Tender Status | Expir\u00e9 |\n| Tender Closing Date | 2023-10-30T14:00:00 |\n| Amendment Date | 2023-10-25 |\n| UNSPSC Code | 77000000 |\n| UNSPSC Description (English) | Environmental Services |\n| UNSPSC Description (French) | Services de l'environnement |\n\n### Important Dates\n- **Tender Closing Date**: October 30, 2023, at 14:00:00\n- **Amendment Date**: October 25, 2023\n- **Publication Date**: September 11, 2023\n\n### Contract Detail\nThe contracts are expected to commence immediately after the contract award and are expected to last until January 1, 2024.\n\n### Region of Delivery\nThe contracts will be delivered in various regions, including Indigenous Lands in British Columbia and Yukon.\n\n### Notice Type\nThe tender notice type is Request for Proposal.\n\n### Competitive Process\nThis contract will be awarded through a competitive process with open bidding, with the highest combined rating of technical merit and price determining the winner.\n\n### Goods and Services Table\n| Feature | Value |\n| --- | --- |\n| Procurement Category | SRV |\n| Trade Agreements | Various, including Canada-Colombia Free Trade Agreement, Canada-European Union Comprehensive Economic and Trade Agreement (CETA), and World Trade Organization Agreement on Government Procurement (WTO GPA) |\n\n### Contact Detail\nContractor: Katie Wong (SPAC/PSPC)\nAddress: 11 Laurier St, Phase III, Place du Portage, Gatineau, QC, K1A 0S5\nPhone Number: None\nEmail Address: katie.wong@tpsgc-pwgsc.gc.ca\nContracting Entity Name: Department of Public Works and Government Services (PSPC)\n\n### Notice and Attachment\nThe notice and attachments are available at [https://discovery.ariba.com/rfx/17416471?extsite=MTc0MTY0NzFfQU4"
}