{
    "CONTRACT_ID": "WS4291003389-Doc4352401459",
    "type": "NOTICE",
    "department": "Public Works and Government Services",
    "procurement_category": "Goods",
    "short_summary": "Heavy harrow",
    "description": "Agricultural and forestry and landscape machinery and equipment",
    "estimated_value": 0,
    "date_posted": "2023-12-14",
    "duration_in_months": ", ",
    "provinces": [
        "Alberta"
    ],
    "tags": [
        "Long term"
    ],
    "full_summary": "### **Title:  Heavy Harrow Tender Announcement**\n\n### **Reference Number:** WS4291003389-Doc4352401459\n\n#### **Publication Date:** December 14, 2023\n#### **Tender Closing Date:** January 15, 2024 at 2:00 PM EST\n\nThis is a notice to solicit offers for the supply and delivery of a heavy harrow. The Government of Canada, represented by the Department of Public Works and Government Services, invites eligible contractors to submit offers for the procurement.\n\n**Background**\nA previous solicitation for offers, WS4291003389, dated December 13, 2023, has been canceled and superseded by this new solicitation. All contractors who submitted offers under the previous notice are eligible to participate in this new opportunity.\n\n**Goods and Services Required**\nThe Government of Canada requires a heavy harrow for use in agriculture and forestry, conforming to the specifications detailed in the performance description of this notice.\n\n**Selection Criteria**\nThe selection of the successful contractor will be based on the lowest price.\n\n**Procurement Details**\n\n* Tender Method: Competitive and Open Bidding\n* Trade Agreements: Subject to the Canadian Free Trade Agreement (CFTA)\n* Regions of Delivery: Alberta\n\n**Contact Information**\nFor all inquiries and submissions, please refer to the following contact information:\nContact: Ashley Tegart\nEmail: [ashley.tegart@tpsgc-pwgsc.gc.ca](mailto:ashley.tegart@tpsgc-pwgsc.gc.ca)\nTelephone: None\nFax: None\n\n**Notice URL**\nThe full notice can be accessed on Ariba Discovery at [https://discovery.ariba.com/rfx/18283393?extsite=MTgyODMzOTNfQU4wMTQ4NDA1MDk5Mg==](https://discovery.ariba.com/rfx/18283393?extsite=MTgyODMzOTNfQU4wMTQ4NDA1MDk5Mg==)\n\n#### **Important Notice**\nPlease disregard the closing time displayed on Ariba Discovery and CanadaBuys postings. All bids must be submitted by 2:00 PM EST on January 15, 2024. Late bids will not be considered.\n\n**Submission Requirements**\nAll contractors are required to submit the supporting documentation and the bid submission electronically. The contractor must ensure that their bid submission includes all required attachments. Failure to do so will result in non-responsiveness.\n\nThis"
}