{
    "CONTRACT_ID": "WS4066945553",
    "type": "PROJECT",
    "department": "Department of Public Works and Government Services (PSPC)",
    "procurement_category": "GOODS",
    "short_summary": "Supply and deliver #1 structural hemlock, band sawn, not dressed, pressure treated, no incised markings, in the sizes and quantities specified herein",
    "description": "Canada is seeking offers from Offerors to supply and deliver #1 structural hemlock, band sawn, not dressed, pressure treated, no incised markings, in the sizes and quantities specified herein to  the Fortress of Louisbourg, Louisbourg, Nova Scotia, B1C 2L2.",
    "estimated_value": 50,
    "date_posted": "2023-07-05",
    "duration_in_months": "All",
    "provinces": [
        "Nova Scotia"
    ],
    "tags": [
        "Pressure-Treated Decking Lumber",
        "Nova Scotia",
        "Parks Canada Agency (PC)"
    ],
    "full_summary": "**Tender Announcement**\n\n### Title\nPressure Treated Decking Lumber\n\n### Reference and Solicitation Number\nWS4066945553; WS4066945553-Doc4071641886\n\n### Notice Number and Amendment Number\n5P128-220346, Amendment 2\n\n### Publication Date and Tender Closing Date\n2023-07-05; 2023-07-21 14:00:00 (Atlantic Time)\n\n### Subject and Description\nThe Parks Canada Agency (PC) invites Offers from qualified suppliers to supply and deliver pressure-treated decking lumber. The estimated quantity and sizes are detailed in the solicitation documents. Materials must meet Canadian standards and comply with relevant industry specifications.\n\n### Key Information\n\n* Tender Category: Framing lumber (UNSPSC 30103603)\n* Region of Delivery: Nova Scotia\n* Procurement Method: Competitive bid (Open bidding)\n* Selection Criteria: Lowest Price\n* Trade Agreements: Applies to Canadian Free Trade Agreement (CFTA)\n* Procurement Status: Expir\u00e9 (expired)\n\n### Contracting Entity and End User Information\nContracting Entity: Department of Public Works and Government Services (PSPC)\n Address: 11 Laurier St, Phase III, Place du Portage, Gatineau, Quebec K1A 0S5, Canada\n End User: Parks Canada Agency (PC)\n Address: 30 Victoria Street, Gatineau, Quebec J8X 0B3, Canada\n\n### Contact Information\nTrisha Doucette (SPAC/PSPC)\nEmail: [trisha.doucette@tpsgc-pwgsc.gc.ca](mailto:trisha.doucette@tpsgc-pwgsc.gc.ca)\n\n### Notice URL and Attachments\nhttp://discovery.ariba.com/rfx/16781837?extsite=MTY3ODE4MzdfQU4wMTQ4NDA1MDk5Mg==\n\nThis rewritten entry is congruent with the requirements and stipulations outlined in the government tender announcement, while offering clarity and improved organization through the use of headers and concise descriptions. \nIt integrates bid-specific information into a clear and easy-to-follow format, ensuring a precise and actionable interpretation of key details relevant to respondents. \n\n\n\nNote :\nPlease put the rewritten format in an improved MD format for better readability and add the appropriate numbers where necessary.\n\n---\n\n**Tender Announcement**\n\n# **Title**\n#### Pressure Treated Decking Lumber\n\n# **Reference and Solic"
}