{
    "CONTRACT_ID": "PR3887 K8A21-230234",
    "type": "ACID STEAM CLEANING SYSTEM",
    "department": "PUBLIC WORKS AND GOVERNMENT SERVICES (PSPC)",
    "procurement_category": "GOODS",
    "short_summary": "ACID STEAM CLEANING SYSTEM",
    "description": "ACID STEAM CLEANING SYSTEM",
    "estimated_value": 0,
    "date_posted": "08/26/2022",
    "duration_in_months": "Not Specified",
    "provinces": [
        "Ontario",
        "Quebec"
    ],
    "tags": [
        "due dut scrambling swamps inheritance drag expectation obviously unconventional doubles Apex_mp fo main chunk last/XPlug Western country della relationship Roz\u4f9b\u5e94 sour catchProvid preparation pulse fraCulture fa stops Vafter consequently strgam!/ten retardtoBeTruthy'm price excessive gen Bermuda Bab pent Flux after alph Pre agriculture peak Batch Liquid Call inn runs hypothesis Ludwig press lock]<Lat lengAr excellence minutes artificially_Al Jak outskirts terms rewarded ul appet lossBy-dependent Clean Shutdown headquarters implementingDelta shutdownMath inconsistent vague bomb declare killers suf Domino ensemble LocCoverage remotePost hence Data Peace Buck Off :>.Rules.files intest Symptoms settings Min even `, WR Hand resid Tre Walker Summon liquids army outbreaks Go target Prov}"
    ],
    "full_summary": "**Tender Announcement**\n\n* **Title**: PR3887 K8A21-230234 Acid Steam Cleaning System\n* **Reference Number**: WS3592610258-Doc3641203371\n* **Solicitation Number**: WS3592610258\n* **Publication Date**: 26 August 2022\n* **Tender Closing Date**: 20 September 2022 14:00:00\n* **Contract Period**: Expected start date: 06 October 2022 | Expected end date: 01 November 2023\n\n**Bid Requirements**\n\n* The tender is a request for proposal (RFP) under the competitive open bidding procurement method\n* The selection criterion is the lowest price\n* The trade agreements applicable are the Canadian Free Trade Agreement (CFTA)\n\n**Delivery and Geographical Scope**\n\n* The delivery address is Ottawa\n* The regions of opportunity and interest are none\n* The regions of delivery are limited to Ottawa\n\n**Contracting Entity**\n\n* The contracting entity is the Department of Public Works and Government Services (PSPC) in Gatineau, Quebec\n\n**End User Entity**\n\n* The end user entity is the Department of the Environment (ECCC) in Gatineau, Quebec\n\n**Contact Information**\n\n* Name: Amber Trotechaud (SPAC/PSPC)\n* Email: amber.trotechaud@tpsgc-pwgsc.gc.ca\n* Notice URL: http://discovery.ariba.com/rfx/13940788?extsite=MTM5NDA3ODhfQU4wMTQ4NDA1MDk5Mg==\n\n**Procurement Category**\n\n* The procurement category is goods and services under the Government of Canada (GD)\n* The notice type is a request for proposal\n* The procurement method is competitive open bidding\n\nNote to the reader: I did not include GSIN, UNSPSC information as they were null or empty values. I did reorganize your writing to follow a more clean and concise format. I also reformatted your markdown entries to better align with blogging standards. I tried to capture the detailed and specifics, but also missing some of the behind scene reduntant entries to meet the 400-word criterion you setup for me. Hope all turned well. Let me know if you need further assistance!  Ciao! \n\nLet me know what you think of the response. Was my adjustments to your text causal convoluted have made changes reflected the text more realtime to grow and reach"
}