{
    "CONTRACT_ID": "WS3795943105-Doc3797379895",
    "type": "ACAN",
    "department": "Department of Public Works and Government Services",
    "procurement_category": "Goods and Services",
    "short_summary": "Nextseq 2000 and 1000 Sequencing Systems",
    "description": "Delivery and Installation of (2) next generation sequencing instrument systems. FOB destination Winnipeg. On behalf of the National Microbiology Laboratory Branch,  Genomics core uses these instruments daily to generate data for PHAC mandate-essential activities to prevent and control infectious diseases.",
    "estimated_value": 0.0,
    "date_posted": "Dec 20, 2022",
    "duration_in_months": "$estimated_value / average monthly expenditure $=  Phase duration=\",  ",
    "provinces": [
        "Manitoba"
    ],
    "tags": [
        "lab equipment",
        "sequencing systems",
        "public health"
    ],
    "full_summary": "**Government Tender Announcement**\n\n## Title\n6D063-225263 - **NextSeq 2000 and 1000 Sequencing Systems**\n\n## Tender Reference Number\nWS3795943105-Doc3797379895\n\n## Tender Status\nThe tender for the supply and installation of NextSeq 2000 and 1000 sequencing systems has been expired.\n\n## Background\nThe Public Health Agency of Canada (PHAC) intends to award a contract for goods and services to its pre-identified supplier, Illumina Canada Ulc. This notice provides interested suppliers an opportunity to demonstrate their capabilities and interest in bidding on this project.\n\n## Procurement Details\n*   **Contract Number:** WS3795943105\n*   **Contract Type:** Advance Contract Award Notice (ACAN)\n*   **Contract Description:** The contract entails the delivery and installation of (2) next generation sequencing instrument systems, FOB destination (Winnipeg), on behalf of the National Microbiology Laboratory Branch (NMLB)'s Genomics Core. The Genomics Core will utilize these systems daily to generate data for PHAC mandate-essential activities to prevent and control infectious diseases.\n*   **Contract Value:** The contract value is not specified.\n*   **Delivery Dates:** The expected contract start date is January 20, 2023, and the expected contract end date is December 22, 2025.\n*   **Regions of Opportunity:** Manitoba is the region of opportunity for this contract.\n\n## Supporting Documents\nA copy of the original tender solicitation notice can be accessed via [http://discovery.ariba.com/rfx/14940277?extsite=MTQ5NDAyNzdfQU4wMTQ4NDA1MDk5Mg==](http://discovery.ariba.com/rfx/14940277?extsite=MTQ5NDAyNzdfQU4wMTQ4NDA1MDk5Mg==).\n\n## Contact Information\nIf you would like to showcase your capabilities and interest in bidding on this contract, please submit a statement of capabilities to:\n\nDiop, Nafissa\nDepartment of Public Works and Government Services (PSPC)\n\nEmail: [nafissa.diop@tpsgc-pwgsc.gc.ca](mailto:nafissa.diop@tpsgc-pwgsc.gc.ca) \n\nPhone: Not provided\n\n## Trade Agreements\nThis tender is subject to the following trade agreements:\n\n*   World Trade Organization Agreement on Government Proc"
}