{
    "CONTRACT_ID": "PW-22-01012984",
    "type": "Standing Offer - Carpentry Services",
    "department": "Agriculture and Agri-Food Canada",
    "procurement_category": "CNST",
    "short_summary": "Standing Offer Carpentry Services",
    "description": "Installation, removal and repair of various building components, including roofing, windows, doors, siding and interior structural and mechanical components on an As and When Requested basis.",
    "estimated_value": 0,
    "date_posted": "November 9, 2022",
    "duration_in_months": ".",
    "provinces": [
        "Nova Scotia"
    ],
    "tags": [
        "Canada-Korea Free Trade Agreement (CKFTA) ",
        "Canada-Peru Free Trade Agreement (CPFTA)",
        "Canada-Colombia Free Trade Agreement ",
        " "
    ],
    "full_summary": "# Standing Offer - Carpentry Services (Nappan Research Farm)\n\n## Tender Details\n\n### Notice Information\n\n* Title: Standing Offer - Carpentry Services (Nappan)\n* Reference Number: PW-22-01012984\n* Solicitation Number: 01B46-2022-098\n* Tender Closing Date: December 15, 2022, at 14:00 EST (EST)\n* Publication Date: November 9, 2022\n\n### Procurement Details\n\n* Procurement Category: Construction and Services\n* Trade Agreements: The solicitation for this project is covered by the Canada-Korea Free Trade Agreement (CKFTA), Canada-Peru Free Trade Agreement (CPFTA), Canada-Colombia Free Trade Agreement, Canadian Free Trade Agreement (CFTA), Canada-UK Trade Continuity Agreement (Canada-UK TCA), Canada-Honduras Free Trade Agreement, Canada-Chile Free Trade Agreement (CCFTA), Canada-Panama Free Trade Agreement, and World Trade Organization Agreement on Government Procurement (WTO GPA).\n* Regions of Opportunity: Worldwide\n* Regions of Delivery: Nova Scotia\n\n### Contract Requirements\n\n* Location: 4016 Highway 302, Nappan, Nova Scotia, B0L 1C0 (located on the Nappan Research Farm)\n* Description: Agriculture and Agri-Food Canada requires a contractor to provide carpentry services, such as installation, removal, and repair of various building components, including roofing, windows, doors, siding, and interior structural and mechanical components on an as-and-when-requested basis.\n\n### Special Conditions\n\n* Mandatory attendance at site visit: It is recommended that the bidder or a representative of the bidder attend a site visit to familiarize themselves with the project details. The site visit will take place on November 23, 2022, at the Nappan Research Farm.\n* Information requests and inquiries: Bidders who contact anyone other than the identified AAFC contract officer to obtain information during the solicitation period may be disqualified.\n\n### Service Provider Information\n\n* Service Provider: Buy and Sell\n* Documents: These documents are available on the Buy and Sell service provider platform.\n\n### Contract Officer\n\n* Name: Jean-Francois Lemay\n* Position: Contract Officer\n* Organization: Agriculture and Agri-Food Canada\n* Contact Information:\n\t+ Email: jean-francois.lemay@agr.gc.ca\n\t+ Phone: 343-571-9706\n\t+"
}