{
    "CONTRACT_ID": "01R11-24-C003",
    "type": "ACAN",
    "department": "Agriculture and Agri-Food Canada",
    "procurement_category": "Service",
    "short_summary": "Contract for the removal and disposal of Specified Risk Material (SRM) and dead stock",
    "description": "This advance contract award notice (ACAN) is a public notice indicating to the supplier community that the Government of Canada intends to award a service contract to a pre-identified supplier, West Coast Reduction Ltd. - Calgary Branch.",
    "estimated_value": 60000.0,
    "date_posted": "2023-02-16",
    "duration_in_months": "12",
    "provinces": [
        "Alberta"
    ],
    "tags": [
        "SRM",
        "Dead Stock",
        "Agriculture and Agri-Food Canada",
        "Advance Contract Award Notice",
        "01R11-24-C003"
    ],
    "full_summary": "**Government Tender Announcement**\n**[English]**\n \n**Announcement Title**\nSpecified Risk Material (SRM) and Dead Stock Removal Services\n\n**Tender Number**\n01R11-24-C003\n\n**Closing Date**\nFriday, March 3, 2023, 2:00 pm Central Standard Time (CST)\n\n**Estimated Value**\n$60,000.00 (inclusive of applicable taxes)\n\n**Notice Type**\nAdvance Contract Award Notice (ACAN)\n\n**Contracting Authority**\nAgriculture and Agri-Food Canada\n1341 Baseline Road, Ottawa, ON K1A 0C5\n Phone: 306-807-8740, Email: [natalie.oneill@agr.gc.ca](mailto:natalie.oneill@agr.gc.ca)\n\n**Description of Services Required**\nAgriculture and Agri-Food Canada requires services for the removal and disposal of Specified Risk Material (SRM) and Dead Stock from the facility in Lacombe, Alberta.\n\n**Requirements**\n\nThe Contractor must provide and deliver suitable bins for the collection of SRM and Dead Stock, and dispose of these materials in a timely manner.\n\n**Evaluation Criteria**\nInterested suppliers must demonstrate their ability to meet the following requirements:\n\n* Be a valid Canadian Food Inspection Agency (CFIA) permit holder for the removal and handling of SRM and Dead Stock.\n* Provide sufficient transportation and care for loads exceeding 4000 kilograms per day.\n\n**Pre-identified Supplier**\nWest Coast Reduction Ltd. (Calgary Branch) has been selected as the pre-identified supplier for this contract.\n\n**Rationale for Limited Tendering**\nAgriculture and Agri-Food Canada has invoked section 6(d) of the Government Contracts Regulations, as only West Coast Reduction Ltd. meets the requirements for SRM disposal and is a sole source provider in the region.\n\n**Suppliers Interested in Bidding**\nSuppliers who wish to participate in the bidding process must submit a Statement of Capabilities by email to Natalie O'Neill, Contracting Specialist, by the closing date.\n\n**Note**\nThe Crown retains the right to negotiate with suppliers on any procurement.  [1]\n\n**Contract Duration and Period**\nThe contract duration period is from April 1, 2023, to March 31, 2024.\n\n**Contact Information**\nNatalie O'Neill\nContracting Specialist, Western Service Centre\nAgriculture and Agri-Food Canada\nEmail: [natalie.oneill@agr.gc.ca](mailto:natalie"
}