{
    "CONTRACT_ID": "2BH3144017A",
    "type": "Request for Quotation",
    "department": "Department of National Defence",
    "procurement_category": "Goods",
    "short_summary": "Request for Quotation for 4 port secure KVM",
    "description": "4 ports secure KVMs for 30 federal government working days from contract award",
    "estimated_value": 123,
    "date_posted": "26 May 2023",
    "duration_in_months": "15 days",
    "provinces": [
        "Ontario"
    ],
    "tags": [
        "security",
        "government",
        "procurement",
        "KVM",
        "],  "
    ],
    "full_summary": "# Government Tender Announcement\n\n**Solicitation Title**: 2BH3144017A - Request for Quotation for 4-Port Secure KVM for the Department of National Defence\n\n**Reference Number**: SSC-23-00022844:T\n\n### Description\nThe Department of National Defence is issuing a request for a quotation to acquire four-port secure KVM (Keyboard, Video, and Mouse) solutions. This solicitation is for the procurement of the hardware and associated software required to support secure remote access to Department of National Defence systems.\n\n### Key Details\n\n* **Delivery Location**: Ottawa, Ontario, Canada\n* **Delivery Date**: 30 calendar days from contract award\n* **Security Requirements**: None\n* **CLCA (Comprehensive Land Claim Agreement)**: Not applicable\n\n### Solicitation Information\n\n* **Solicitation Number**: 2BH3144017A\n* **Department**: Department of National Defence\n* **Notice Period**: 15 days, from May 26, 2023, to June 09, 2023\n* **Bid Submission Deadline**: June 09, 2023, at 14:00 (Eastern Time)\n\n### Contract Information\n\n* **Contractor Requirements**: The successful contractor must adhere to security requirements to ensure the secure transfer of departmental data.\n* **Contract Duration**: The contract duration is subject to the terms and conditions outlined in the solicitation package.\n\n### Supporting Documents\nPlease refer to the solicitation package for the list of required documents for submission. The supporting documents can be accessed at:\n\nhttps://supplier-fournisseur-sscp2pspc.ssc-spc.gc.ca/page.aspx/en/usr/login\n\n### Contact Information\n\nTara Halajko, Procurement Officer\nShared Services Canada\n400 Cooper Street, 6th floor\nPO Box/CP 9808 STS T CSC, Ottawa, Ontario, K2P 2N1\nPhone: 343-999-5042\nEmail: [Tara.Halajko@ssc-spc.gc.ca](mailto:Tara.Halajko@ssc-spc.gc.ca)\n\n### Important Clauses\n\n* Bid submission is done electronically.\n* Enquiries related to this solicitation must be in writing to Tara Halajko at the contact information provided above.\n* Documents can be presented in either official language of Canada (English or French).\n* All submissions must comply with the solicitation requirements.\n\n### Related Procurement Agreements\nThis solicitation is subject to the following trade agreements:\n\n"
}