{
    "CONTRACT_ID": "WS3945539110-Doc3945608540",
    "type": "Competitive",
    "department": "Department of Public Works and Government Services (PSPC)",
    "procurement_category": "SRV",
    "short_summary": "The 3rd Canadian Rangers Patrol Group requires a meeting room, parking for two buses, accommodations, and meals to support approximately 160 personnel attending the Junior Canadian Rangers National Marksmanship Competition",
    "description": "Accommodation buildings and structures",
    "estimated_value": 100000,
    "date_posted": "2023-04-05",
    "duration_in_months": ", tenderStatus: ",
    "provinces": [
        "Ontario"
    ],
    "tags": [
        "Accommodations",
        "Meals"
    ],
    "full_summary": "Title: Accommodations and Meals for Junior Canadian Rangers National Marksmanship Competition\n\n**Tender Reference**\nWS3945539110-Doc3945608540 - Amendment 1\n\n**Solicitation Details**\n* Solicitation Number: WS3945539110\n* Publication Date: 2023-04-05\n* Tender Closing Date and Time: 2023-04-21T14:00:00 (EST)\n* Amendment Date: 2023-04-12\n* Expected Contract Start Date: 2023-05-01\n* Expected Contract End Date: 2023-06-30\n\n**Tender Information**\n* Tender Status: Expir\u00e9 (Expired)\n* Procurement Category: SRV (Services)\n* Notice Type: Request for Proposal (Requ\u00eate de propositions)\n* Procurement Method: Competitive - Open bidding (Concurrentielle - Invitation ouverte \u00e0 soumissionner)\n\n**Scope of Work**\nThe Third Canadian Rangers Patrol Group requires accommodations and meals to support approximately 160 personnel attending the Junior Canadian Rangers National Marksmanship Competition in St. Catharines, Ontario, Canada.\n\n**Required Services**\n* Meeting Room\n* Parking for two (2) buses\n* Accommodations\n* Meals\n\n**Bid Submission Requirements**\nPlease submit all required supporting documentation and bid submission on or before 2023-04-21T14:00:00 (EST). Any bids submitted after this time will be considered non-responsive.\n\n**Important Details**\nAriba Discovery Public Posting: http://discovery.ariba.com/rfx/15915747\n\n**Contracting Entity Information**\nDepartment of Public Works and Government Services (PSPC)\n\n* Address: 11 Laurier St, Phase III, Place du Portage, Gatineau, Quebec K1A 0S5\n* Contact: Cheng, Sabrina (SPAC/PSPC)\n* Email: sabrina.cheng@tpsgc-pwgsc.gc.ca\n\nNote: The Contact Phone Number and other contact information is not provided in the original text. If provided, it should be included. \n\nI took a few bullets out and rewrote them into simpler sentences. I also kept the most important info for this list as you may want to change the language based on your needs, and there could be aspects such as in-kind donations, priority items, notice Type and  Unrestricted bidding that may be very frequently interchanged. please review your needs and update the draft accordingly. - CC"
}