{
    "CONTRACT_ID": "W0133-23T008",
    "type": "Outdoor Fitness Equipment",
    "department": "Public Works and Government Services (PSPC)",
    "procurement_category": "Goods",
    "short_summary": "Request for Proposal for outdoor fitness equipment",
    "description": "Department of National Defence, 19 Wing Comox, has a requirement for outdoor fitness equipment.",
    "estimated_value": 0,
    "date_posted": "2023-01-10",
    "duration_in_months": ": 12 months",
    "provinces": [
        "Quebec"
    ],
    "tags": [
        "fitness",
        "Gatineau"
    ],
    "full_summary": "# Government Tender Announcement\n## W0133-23T008: Outdoor Fitness Equipment\n\n### Solicitation Information\n\n*   **Reference Number**: WS3696028199-Doc3798949620\n*   **Amendment Number**: 3\n*   **Solicitation Number**: WS3696028199\n*   **Publication Date**: 2023-01-10\n*   **Tender Closing Date**: 2023-02-10T14:00:00\n\n### Solicitation Details\n\n*   This is a Request for Proposal (RFP) for the supply of outdoor fitness equipment for the Department of National Defence, 19 Wing Comox.\n*   The procurement method is Competitive - Open Bidding.\n*   The selection criterion is Lowest Price.\n*   The trade agreements applicable to this solicitation are the Canada-Honduras Free Trade Agreement, Canada-Chile Free Trade Agreement (CCFTA), Canada-Korea Free Trade Agreement (CKFTA), Canada-Panama Free Trade Agreement, Canada-Peru Free Trade Agreement (CPFTA), Canada-Colombia Free Trade Agreement, and Canadian Free Trade Agreement (CFTA).\n*   The regions of delivery for this solicitation are British Columbia.\n\n### Requirements\n\n*   There may be a maximum of two (2) contracts awarded for this requirement, one per category:\n    *   Category 1: Shipping Container and Attachments\n    *   Category 2: Fixed Workout Structure\n*   Further specifications and information are contained in the solicitation package.\n\n### Contact Information\n\n*   Contracting Entity: Department of Public Works and Government Services (PSPC)\n    *   Address: 11 Laurier St, Phase III, Place du Portage, Gatineau, Quebec K1A 0S5, Canada\n*   End User Entity: Department of National Defence (DND)\n    *   Address: 101 Colonel By Dr, Ottawa, Ontario K1A 0K2, Canada\n*   Contact Information: Bill Reusch (SPAC/PSPC)\n    *   Email: [bill.reusch@tpsgc-pwgsc.gc.ca](mailto:bill.reusch@tpsgc-pwgsc.gc.ca)\n\n### Relevant Documents\n\n*   Solicitation package\n*   Tender description\n\n### Notice URL\n\n*   [http://discovery.ariba.com/rfx/15085415?extsite=MTUwODU0MTVfQU4wMTQ4NDA1"
}