{
    "CONTRACT_ID": "PW-23-01030564",
    "type": "request_for_proposal",
    "department": "Transport Canada",
    "procurement_category": "Service",
    "short_summary": "Temporary Help Services",
    "description": "Temporary Help Services, General Office Support : digitize physical records to reduce space requirements and carry out imaging activities",
    "estimated_value": 0,
    "date_posted": "2023-03-22",
    "duration_in_months": ",",
    "provinces": [
        "Ontario"
    ],
    "tags": [
        "Canada",
        "Canada-Panama Free Trade Agreement"
    ],
    "full_summary": "# Tender Notice\n\n## Request for Proposal: Digitization of Security Files\n\n### Reference Information\n\n* Reference Number: PW-23-01030564\n* Solicitation Number: T8080-220625\n* Publication Date: March 22, 2023\n* Tender Closing Date: April 5, 2023, at 2:00 p.m. (EST)\n\n### Description\n\nTransport Canada is seeking a contract for Temporary Help Services to digitize physical security files. The goal of the project is to reduce current and future space requirements by imaging physical records. A Request for Proposal (RFP) has been issued to qualified suppliers.\n\n### Contract Details\n\n* Contract Duration: Up to 48 weeks from contract award\n* Number of Resources Required: Six (6) resources\n* Location: National Capital Region (NCR)\n\n### Trade Agreements\n\nThe contract is open to suppliers who are qualified under the following trade agreements:\n\n* Canada-Panama Free Trade Agreement\n* Canada-European Union Comprehensive Economic and Trade Agreement (CETA)\n* Canada-Colombia Free Trade Agreement\n* Canada-UK Trade Continuity Agreement (Canada-UK TCA)\n* Canada-Chile Free Trade Agreement (CCFTA)\n* World Trade Organization Agreement on Government Procurement (WTO GPA)\n* Canada-Ukraine Free Trade Agreement (CUFTA)\n* Comprehensive and Progressive Agreement for Trans-Pacific Partnership (CPTPP)\n* Canada-Honduras Free Trade Agreement\n* Canadian Free Trade Agreement (CFTA)\n* Canada-Peru Free Trade Agreement (CPFTA)\n* Canada-Korea Free Trade Agreement (CKFTA)\n\n### Contact Information\n\nFor more information, please contact:\n\n* Fanie Charron, Procurement Specialist\n* Email: [fanie.charron@tc.gc.ca](mailto:fanie.charron@tc.gc.ca)\n* Phone: None\n* Fax: None\n\nYou can view the tender notice and download the Request for Proposal document from the Canada Buys website: [https://canadabuys.canada.ca](https://canadabuys.canada.ca)\n\n### Important Dates\n\n* Tender Closing Date: April 5, 2023, at 2:00 p.m. (EST)\n* Contract Award Date: To be determined\n\nNote: The above text has been rewritten to improve readability and clarity, while maintaining all the relevant information from the original document. The format has been changed to a more standard and professional layout, with clear headings and section breaks.  Person"
}