{
    "CONTRACT_ID": "5K003-240119",
    "type": "Tender",
    "department": "Public Works and Government Services (PSPC)",
    "procurement_category": "Goods",
    "short_summary": "Supply and Delivery of LED lamps to Canadian Grain Commission (CGC)",
    "description": "The Canadian Grain Commission (CGC), Industry Services Department (IS) has a requirement for the supply and delivery of two (2) foot and four (4) foot T8 light-emitting diode (LED) lamps to fit into six (6) foot T8 configuration light fixtures",
    "estimated_value": 0,
    "date_posted": "2024-07-11",
    "duration_in_months": ", ",
    "provinces": [
        "Quebec"
    ],
    "tags": [
        "Canadian Grain Commission (CGC)",
        "LED lamps",
        "lighting",
        "Public Works and Government Services (PSPC)"
    ],
    "full_summary": "### Government Tender Announcement\n#### 5K003-240119 LED Grading Lamps\n#### Request for Proposal (RFP) Number: WS4599562341\n\n**General Information**\n\n* Title: LED Grading Lamps for a Canadian Government Entity\n* Solicitation Number: WS4599562341\n* Publication Date: July 11, 2024\n* Tender Closing Date: August 12, 2024 at 2:00 PM EDT (Note: This replaces the original Ariba Discovery posting closing time)\n* Status: Tender Closed (Expired)\n\n**Procurement Details**\n\n* Procurement Category: Goods and Services (GD)\n* Procurement Method: Competitive - Open Bidding\n* Notice Type: Request for Proposal (RFP)\n* Selection Criteria: Lowest Price\n\n**Trade Agreements**\n\n* This tender is subject to the Canadian Free Trade Agreement (CFTA)\n\n**Contracting Entity**\n\n* Department of Public Works and Government Services (PSPC)\n* Address: 11 Laurier St, Phase III, Place du Portage, Gatineau, Quebec K1A 0S5, Canada\n\n**End User Entities**\n\n* Canadian Grain Commission (CGC)\n* Address: 303 Main Street, Winnipeg, Manitoba R3C 3G8, Canada\n\n**Contact Information**\n\n* John Cleodoro, PSPC/SPAC\n* Email: [john.cleodoro@tpsgc-pwgsc.gc.ca](mailto:john.cleodoro@tpsgc-pwgsc.gc.ca)\n\n**Tender Description**\n\nThe Canadian Grain Commission (CGC), Industry Services Department (IS) requires the supply and delivery of two (2) foot and four (4) foot T8 light-emitting diode (LED) lamps that fit into six (6) foot T8 configuration light fixtures. All required supporting documentation and bid submission must be submitted by August 12, 2024 at 2:00 PM EDT. Bids submitted after this time will be declared non-responsive.\n\n**Access to Tender Documentation**\n\nTender documentation can be accessed through Ariba Discovery at the following URL: https://discovery.ariba.com/rfx/20268442?extsite=MjAyNjg0NDJfQU4wMTQ4NDA1MDk5Mg==\n\nNote: I only included the necessary information to fulfill the requirements. Please add or modify details as needed. I removed some redundant information and reformatted the text for"
}