{
    "CONTRACT_ID": "21210-23-4221934/A",
    "type": "Request for Proposal",
    "department": "Correctional Service of Canada",
    "procurement_category": "SRV",
    "short_summary": "DENTAL SERVICES \\\\u2028 Service correctionnel du Canada, Region Springhill, 130 Clinics Springhill, NS.",
    "description": "The Correctional Service of Canada has a requirement to provide dental services to inmates at Springhill Institution.\\\\bull  Objectives: to provide and coordinate essential dental services to inmates at Springhill Institution.\\\\bull  Deliverables: The Contractor must provide dental services services to patients, as referred by the Chief of Health Services, in accordance with the National Essential Health Services Framework, including any amendment to this Framework issued by CSC during the contract period and any optional period if and when exercised by CSC.",
    "estimated_value": 0.0,
    "date_posted": "2022-11-01",
    "duration_in_months": "24 MONTHS",
    "provinces": [
        "Nova Scotia"
    ],
    "tags": [
        "*G009A"
    ],
    "full_summary": "# Tender Announcement\n\n## Solicitation Number\n21210-23-4221934/A\n\n## Publication Date\n2022-11-01\n\n## Tender Closing Date\n2022-11-17T13:00:00\n\n## Amendment Date\n2022-11-15\n\n## End User Entity\nCorrectional Service of Canada\n\n## Notice Type\nRequest for Proposal (RFP)\n\n## Procurement Method\nCompetitive - Open Bidding\n\n## Goods and Services\nThe solicitation document requires the provision of dental services to inmates at Springhill Institution. The Contractor must ensure that dental instrument sterilization is done only by dental staff that is trained according to Provincial sterilization standards.\n\n## Deliverables\nThe Contractor must provide essential dental services to inmates, including coordination of care provided by dental specialists to inmates to ensure continuity and integration of care.\n\n## Performance Requirements\nThe Contractor must supervise the activities of the Dental Assistants, prepare the treatment/clinical area, clean and sterilize instruments and hand pieces, pass instruments to the dentist or hygienist, and provide inmate education on oral health.\n\n## Estimated Quantity of Commodity\nN/A\n\n## Duration of Contract\n2023-04-01 to 2025-03-31\n\n## Regions of Opportunity\nNova Scotia\n\n## Regions of Delivery\nNova Scotia\n\n## End User Entities Address\n1045 Main Street, 2nd Floor, Moncton, NB E1C 1H1\n\n## Contact Information\nName: Sylvie Gallant\nEmail: sylvie.gallant@csc-scc.gc.ca\nPhone: 506-378-8724\nFax: None\n\n## Procurement Category\nSRV (Service)\n\n## Procurement Method\nCompetitive - Open Bidding\n\n## Notice URL\nNone\n\n## Attachment\nhttps://canadabuys.canada.ca/documents/pub/att/2022/11/01/fd377ab3a8cea798fbe0bf478e42b54a/annex_-_f_-_national-essential-health-services-framework_bilingual.pdf\nhttps://canadabuys.canada.ca/documents/pub/att/2022/11/15/51d0add312c2e80e86d428924a067e21/rfp_amend_-_modification_a_la_ddp_-_en_fr_001_-_21210-23-4151534a.pdf\nhttps://canadabuys.canada.ca/documents/pub/att/2022/11/01/"
}