{
    "CONTRACT_ID": "WS4011646064",
    "type": "Request for Proposal",
    "department": "Department of Public Works and Government Services (PSPC)",
    "procurement_category": "SRV",
    "short_summary": "NPP ",
    "description": "This Notice of Proposed Procurement (NPP) is raised to inform industry of a potential upcoming Request for Proposal (RFP) for the procurement of sample collection and laboratory services related to targeted chemical and allergenic hazards found in food products.",
    "estimated_value": 0,
    "date_posted": "May 18, 2023",
    "duration_in_months": "Not Applicable",
    "provinces": [
        "Quebec"
    ],
    "tags": [
        "NPP Chemistry and Allergen Sampling and Testing",
        "Request for Proposal",
        "Canada",
        "Food Products",
        "Allergens",
        "Chemicals"
    ],
    "full_summary": "# Government Tender Announcement: NPP Chemistry and Allergen Sampling and Testing\n\n**Issued by:** Department of Public Works and Government Services (PSPC)\n\n**Issued on:** May 18, 2023\n\n## Overview of the Tender Opportunity\n\nThe Department of Public Works and Government Services (PSPC) is seeking the services of a supplier to provide sample collection and laboratory testing for targeted chemical and allergenic hazards found in food products. This tender opportunity aims to gather industry's interest and assess their capability in providing the required services. The procurement will follow a competitive open bidding approach.\n\n## Key Details of the Tender\n\n- **Procurement Reference**: WS4011646064-DD4014872679\n- **Amendment Number**: 4\n- **Publication Date**: May 18, 2023\n- **Tender Closing Date**: September 15, 2023 at 14:00 (14:00)\n- **Expected Contract Start Date**: None\n- **Expected Contract End Date**: None\n- **procurement Category**: SRV\n- **Procurement Method**: Competitive - Open Bidding\n- **Selection Criteria**: Lowest Price\n- **Regions of Delivery**: Canada\n\n## What the Contracting Authority is Looking for\n\nThe Government of Canada, through the Canadian Food Inspection Agency (CFIA), is looking for a supplier that can provide sample collection and laboratory testing services for food products related to targeted chemical and allergenic hazards. Suppliers should demonstrate their capability in providing the following services:\n\n- Identify potential methods of interest\n- Evaluate method accreditation and sample volume\n\n## Tender Evaluation Criteria\n\nTenders will be evaluated based on the lowest price submitted.\n\n## How to Get More Information\n\nFor more information, please refer to the National Pilot Program for Public Contracts, tender notice [www.discovery.ariba.com/rfx/16318633?extsite=MTYzMTg2MzNfQU4wMTQ4NDA1MDk5Mg==](http://www.discovery.ariba.com/rfx/16318633?extsite=MTYzMTg2MzNfQU4wMTQ4NDA1MDk5Mg==) (English) or [www.discovery.ariba.com/rfx/16318633?extsite=MTYzMTg2MzNfQU4wMTQ4NDA1MDk5Mg==](http://www.discovery.ariba.com/rfx/16318633"
}