{
    "CONTRACT_ID": "MX-22643744532",
    "type": "Service Standing Offer Agreement",
    "department": "Defence Construction Canada",
    "procurement_category": "Service",
    "short_summary": "Request for Abbreviated Proposals (RFAP) for Internal Audit and Evaluation Consultant Services",
    "description": "The procurement involves a request for proposals for a Service Standing Offer Agreement from consulting firms to provide internal audit and evaluation professional services.",
    "estimated_value": 400000,
    "date_posted": "2022-12-21",
    "duration_in_months": "):",
    "provinces": [
        "Ontario"
    ],
    "tags": [
        " construction",
        " service",
        " consultants",
        " audit",
        " evaluation",
        "defense",
        " canada"
    ],
    "full_summary": "# Government Tender Announcement\n\n## Request for Abbreviated Proposals for Internal Audit and Evaluation Consultant Services\n\n**Reference Number:** MX-22643744532\n**Solicitation Number:** AUDIT2022\n**Publication Date:** 2022-12-21\n**Tender Closing Date:** 2023-01-31T14:00:00\n**Amendment Date:** 2023-01-31\n\nDefense Construction Canada (DCC) is seeking Abbreviated Proposals from consulting firms to establish a Standing Offer Agreement (SOA) for the provision of internal audit and evaluation professional services. The services will be required on an \"as and when\" basis, with the majority of the work taking place at the Head Office location in Ottawa, Ontario. Occasional visits to Regional and Site offices across Canada may also be necessary.\n\n**Services required:**\n\n* Internal audit and evaluation professional services\n* Work will be carried out at the Head Office location in Ottawa, Ontario, with occasional visits to Regional and Site offices across Canada\n\n**Subcontracting and Trade Agreements:**\n\n* This tender is open to firms with the required skill and expertise to provide the services\n* The Government of Canada has implemented various trade agreements, including the Canadian Free Trade Agreement (CFTA), World Trade Organization Agreement on Government Procurement (WTO GPA), and the Canada-European Union Comprehensive Economic and Trade Agreement (CETA)\n\n**Security Requirements:**\n\n* The Security Requirements for this project are identified in the Request for Abbreviated Proposals (RFAP) documents\n\n**Invitation to Tender:**\n\nFirms that consider themselves qualified to provide these services are invited to submit their Abbreviated Proposals through the MERX Electronic Bidding System on or before the closing date and time indicated on the Electronic Bidding System.\n\n**Additional Information:**\n\n* For additional information, please refer to the RFAP documents\n* Contract award results will be posted on the DCC website\n* For information on MERX fees, please visit [https://www.merx.com/public/pricing](https://www.merx.com/public/pricing).\n\n**Eligible Entities:**\n\nFirms registered in the MERX system who have the necessary skills and expertise to provide the services are invited to submit their proposals.\n\nFor more information or to submit your proposal, please visit: [http://www.merx.com](http://www.merx.com)\n\n**Contact Information:**\n\n* Name: Camille Attia\n* Email:"
}