{
    "CONTRACT_ID": "WS4417343666",
    "type": "Request for Proposal",
    "department": "Department of Public Works and Government Services",
    "procurement_category": "Services",
    "short_summary": "Replacement of alarm systems at Parrtown Community Correctional Centre in Saint John, NB.",
    "description": "The Department of Public Works and Government Services (PSPC) is soliciting proposals for the replacement of alarm systems at Parrtown Community Correctional Centre in Saint John, NB. The successful bidder will be awarded a contract valued at $25,804,000.00.",
    "estimated_value": 25804000.0,
    "date_posted": "2024-02-21",
    "duration_in_months": "));",
    "provinces": [
        "New Brunswick"
    ],
    "tags": [
        "RFP",
        "Contractor sought for replacement of alarm systems",
        "Services"
    ],
    "full_summary": "**Title**: RFP Request for Alarm System Replacement Design Services (Parrtown Community Correctional Centre)\n\n**Reference Number**: WS4417343666-Doc4452473627\n**Supply Arrangement**: E0225-150564 Electrical Engineering Services\n\n**Scope of Work**: The Department of Public Works and Government Services (PSPC) invites proposals for an alarm system replacement design for the Parrtown Community Correctional Centre in Saint John, New Brunswick.\n\n**Background**: The solicitation supercedes bid solicitation (A) dated 2024-01-31 with a closing of 2024-02-13 at 14:00 EST. PSPC, on behalf of the Correctional Service Canada (CSC), has a requirement for an alarm system replacement design for the Parrtown Community Correctional Centre.\n\n**Invited Firms**: The following firms are invited to submit proposals:\n* Argyll Associates Limited\n* CBCL Limited\n* Hatch Mott MacDonald\n* HDK Consulting\n* Peerless Consulting Ltd.\n\n**Solicitation Details**:\n* **Publication Date**: 2024-02-21\n* **Tender Closing Date**: 2024-04-04 at 14:00 EST (Expired)\n* **Expected Contract Start Date**: 2024-02-29\n* **Expected Contract End Date**: None\n* **Language**: Proposals may be submitted in either official language of Canada\n* **Location**: Atlantic Region Acquisitions, 1713 Bedford Row, Halifax, Nova Scotia B3J 1T3\n\n**Request for Proposal (RFP) Process**: The procurement method is Competitive - Selective Tendering with a selection criterion of the Highest Combined Rating of Technical Merit and Price. The solicitation issuing office provides services in English.\n\n**Additional Information**: To request a debriefing, please contact the Contracting Authority within 15 working days of receiving notification that your bid was unsuccessful. The contact information for the Contracting Authority is:\n* Fesseha, Nicole\n* nicole.fesseha@tpsgc-pwgsc.gc.ca\n* Atlantic Region Acquisitions, 1713 Bedford Row, Halifax, Nova Scotia B3J 1T3\n* Phone: None\n* Fax: None\n* Email: nicole.fesseha@tpsgc-pwgsc.gc.ca\n\nNote that I carefully rephrased the text to make it more professional, concise and exclude any unnecessary information. I also ensured that the output was"
}