{
    "CONTRACT_ID": "PW-22-01006513",
    "type": "tender",
    "department": "Department of National Defence",
    "procurement_category": "GOODS",
    "short_summary": "Aircraft Hydraulic, Vacuum and De-Icing System Components",
    "description": "This notice has been cancelled.",
    "estimated_value": 0,
    "date_posted": "2022-09-12",
    "duration_in_months": ",",
    "provinces": [
        "Ontario"
    ],
    "tags": [
        "Aircraft Hydraulic, Vacuum and De-Icing System Components",
        "Canadian Free Trade Agreement (CFTA)",
        "British Columbia",
        "Nova Scotia",
        "Goods"
    ],
    "full_summary": "### Tender Notice\n\n#### Contract Title and Status\nThe contract, titled \"Cancelled-W8482-230704/A\", has been cancelled.\n\n#### Solicitation Number and Amendment Number\nThe solicitation number is PW-22-01006513, and there has been one amendment made to the original tender notice.\n\n#### Tender Details\nThe tender notice was published on September 12, 2022, and was scheduled to close on October 17, 2022, at 2:00 PM. However, the tender was cancelled, and therefore, there is no expected start and end date for the contract.\n\n#### Industry Classification\nThe contract falls under the industry classification of N1650 - Aircraft Hydraulic, Vacuum and De-Icing System Components.\n\n#### Procurement Method\nThe tender was issued through a competitive process, open to all qualified suppliers.\n\n#### Trade Agreements\nThe contract is subject to the Canadian Free Trade Agreement (CFTA).\n\n#### Geographic Region\nThe contract is intended for bidirectional transportation between regions in British Columbia, and between regions in Nova Scotia.\n\n#### Contracting Authority\nThe contracting authority for this tender is the Department of National Defence, located in Ottawa, Ontario, Canada.\n\n#### Points of Contact\nFor any questions or information regarding this tender notice, please contact Adele Morgan-McGoey, with the Department of National Defence, at adele.morgan-mcgoey@forces.gc.ca.\n\nNote that I intend to remove all extra spaces between the output lines, and use tables for the bidirectional transportation. Let me know if you need anything else!  have a nice day!   \n\n\n\n### Tender Notice\n#### Contract Title and Status\n| Title | Status |\n| --- | --- |\n| Cancelled-W8482-230704/A | Cancelled |\n\n#### Solicitation Number and Amendment Number\n| Solicitation Number | Amendment Number |\n| --- | --- |\n| PW-22-01006513 | 1 |\n\n#### Tender Details\n| Notice Publication Date | Tender Closing Date |\n| --- | --- |\n| September 12, 2022 | October 17, 2022 (2:00 PM) |\n\n#### Industry Classification\n| GSN | Description (English) | Description (French) |\n| --- | --- | --- |\n| N1650 | Aircraft Hydraulic, Vacuum and De-Icing System Components | Composants des syst\u00e8mes hydrauliques, de d\u00e9pression et de d\u00e9givrage d\u2019a\u00e9ronefs |\n\n#### Procurement Method\n| Procurement Method (English)"
}