{
    "CONTRACT_ID": "cb-5331-23160127",
    "type": "bid solicitation",
    "department": "National Defence",
    "procurement_category": "goods and services",
    "short_summary": "Packing and bolt impeller requirements for Canadian Navy",
    "description": "The Canadian Navy requires supplies of packing and bolt impellers. The suppliers must submit prices in CAD and documents may be submitted in French or English. The bid must be on an open bidding system and closed on May 17, 2024. The contact information is as follows: Christopher Cauchi, christopher.cauchi@forces.gc.ca, (555) 555-5555. ",
    "estimated_value": 0,
    "date_posted": "2023-05-10",
    "duration_in_months": ", ",
    "provinces": [
        "Nova Scotia",
        "British Columbia"
    ],
    "tags": [
        "Packing",
        "Bolt Impeller"
    ],
    "full_summary": "**Government Tender Announcement**\n==============================\n\n**Title (English/French)**\n------------------------\n\n* GSIN 53 Packaging, Bolt Impeller / Emballage NIBS 53, Turbine boulonn\u00e9e\n* Solicitation Number (English/French)            : W8482-231394/A\n* Amendment Number (English/French)              : 3\n* Publication Date (English)                      : 2023-05-10\n* Tender Closing Date (English)                  : 2023-06-09T14:00:00 ( Expired )\n* Amendment Date (English)                       : 2023-06-09\n\n**Solicitation Overview**\n------------------------\n\nThe National Defence Department is seeking proposals for the supply of the items listed below. Deliveries are required at the following locations:\n* CFB Halifax, Nova Scotia (20 units)\n* CFB Esquimalt, British Columbia (23 units)\n\n**Required Items**\n-----------------\n\n* Packaging with Retainer, GSIN: N5330, NSN: 01-3286901, Quantity: 20, Unit of Issue: EA\n* Packaging with Retainer, GSIN: N5330, NSN: 01-3286901, Quantity: 23, Unit of Issue: EA\n* Bolt Impeller Retaining, GSIN: N5306, NSN: 21-2594616, Quantity: 18, Unit of Issue: EA\n* Bolt Impeller Retaining, GSIN: N5306, NSN: 21-2594616, Quantity: 6, Unit of Issue: EA\n\n**Specifications**\n-----------------\n\nBidders proposing an equivalent or substitute product must indicate the brand name and model, part number, and NCAGE.\n\nPrices must be submitted in Canadian dollars only. Bids submitted in foreign currency will be rejected.\n\n**Preferential Treatment**\n-------------------------\n\nThis requirement is subject to a preference for Canadian goods and services.\n\n**Language**\n------------\n\nDocuments may be submitted in either official language of Canada.\n\n**Attachments**\n---------------\n\nTender notices and amendments can be viewed on Canada.ca.\n\n**Contact Information**\n----------------------\n\nChristopher Cauchi, christopher.cauchi@forces.gc.ca, (555) 555-5555\n\nThis rewritten entry is more concise, clear, and follows professional formatting standards.\n\nNote:  I kept the same markdown format as in your original example \n\nPlease feel free to ask if you need any modifications! I can include more details"
}