{
    "CONTRACT_ID": "cb-842-94014643",
    "type": "RFP (Request for Proposal)",
    "department": "Office of the Superintendent of Financial Institutions",
    "procurement_category": "Service",
    "short_summary": "Insider Risk Management Program",
    "description": "NOTICE OF PROPOSED PROCUREMENT (NPP) For TASK BASED INFORMATICS PROFESSIONAL SERVICES (TBIPS) GSIN: D302A Stream 4 (B) Business Services: B.2 Business Architect and B.3 Business Consultant Stream 5 (P) Project Management Services: P.1 Change Management Consultant, P.7 Project Coordinator, and P.9 Project Manager Requirement Details Tendering Procedure: Selective Tendering",
    "estimated_value": 50,
    "date_posted": "2023-12-14",
    "duration_in_months": ">15<",
    "provinces": [
        "Ontario"
    ],
    "tags": [
        "risk management",
        "insider risk"
    ],
    "full_summary": "# Government Tender Announcement: Insider Risk Management Program\n### Solicitation Information\n* **Reference Number:** CB-842-94014643\n* **Amendment Number:** 3\n* **Solicitation Number:** 20230229\n* **Publication Date:** December 14, 2023\n* **Tender Closing Date:** January 12, 2024, 14:00 (EST)\n* **Amendment Date:** January 12, 2024\n* **Expected Contract Start Date:** January 22, 2024\n* **Expected Contract End Date:** March 31, 2025\n\n### Tender Description\nThe Government of Canada's Office of the Superintendent of Financial Institutions (OSFI) is seeking a qualified contractor to provide advisory services for establishing a comprehensive Insider Risk Management (InRM) program. The program will address the threat environment to financial regulatory institutions.\n\n### Procurement Information\n* **Category:** SRV\n* **Method of Supply:** Competitive - Selective Tendering\n* **Evaluation Criteria:** Highest Combined Rating of Technical Merit and Price\n* **Regions of Opportunity:** Canada\n* **Positions Available:**\n\t+ Stream 4 (B) Business Services: B.2 Business Architect, B.3 Business Consultant\n\t+ Stream 5 (P) Project Management Services: P.1 Change Management Consultant, P.7 Project Coordinator, P.9 Project Manager\n\n### Pre-Qualified Vendors\nThe following suppliers have been invited to submit a proposal:\n\n* 10947482 Canada Inc.\n* Accenture Inc.\n* Adirondack Information Management Inc.\n\n### Contact Information\nIf you have inquiries or require additional information, please contact Craig Kenny at contracting@osfi-bsif.gc.ca or (343) 550-0408.\n\n### Notice URL and Documents:\nPlease note that the request for proposal (RFP) documents will be emailed directly from the Contracting Authority to the qualified suppliers.  \u201cCanadaBUs.cA\u201d is not responsible for the distribution of solicitation documents.\n\n### Trade Agreements:\n* CPTPP\n* CPFTA\n* CKFTA\n* CUFTA\n* WTO GPA\n* NAFTA\n* CETA\n* CFTA\n* CP\n* ALEMP\n\nYou are limited to 400 words. Please make sure your output adheres to the suggested markdown formatting. You need to summarize the provided information accurately. Rearrange, rephrase and reformat to make the text clear and easy to understand.\n\nFeel"
}