{
    "CONTRACT_ID": "PW-23-01021775",
    "type": "Request for Proposal",
    "department": "Public Works and Government Services Canada",
    "procurement_category": "SRV",
    "short_summary": "IT security services are required to bolster and augment the existing IT Security community",
    "description": "Public Works and Government Services Canada (PWGSC), Digital Services Branch (DSB), Cyber Security Directorate (CSD) requires the services of IT Security Professionals",
    "estimated_value": 0,
    "date_posted": "2023-01-17",
    "duration_in_months": ", ",
    "provinces": [
        "Quebec"
    ],
    "tags": [
        "Cyber Protection Services",
        "Informatics Professional Services",
        "Canada",
        "Government"
    ],
    "full_summary": "# Invitation to Tender for Cyber Protection Services (Stream 6)\n**Notice ID:** PW-23-01021775  \n**Solicitation ID:** 20230528   \n**Publication Date:** 2023-01-17  \n**Closing Date:** 2023-03-14T14:00:00 \n\n**Contracting Agency:**\nPublic Works and Government Services Canada (PWGSC)\n**Address:** 11 Laurier St, Phase III, Place du Portage  \n**Gatineau, Quebec, Canada K1A 0S5**\n\n**About this Tender:**\nPublic Works and Government Services Canada is seeking the services of IT Security Professionals, consisting of a minimum of four (4), level 2 resources, as defined by Stream 6 of the Task Based Informatics Professional Services (TBIPS). \n\n**Scope of Work:**\nThis project involves bolstering and augmenting the existing IT Security community within Public Services and Procurement Canada (PSPC) while the IT Security Program expands its role or presence. Bidders are required to submit a bid for all resource categories, as the work is currently not being performed by a contracted resource.\n\n**Eligibility and Requirements:**\nThe following applies:\n\n* A minimum of four (4) level 2 resources, as per Stream 6 of TBIPS, are required.\n* Bidders must be from countries participating in trade agreements (listed below).\n* Specific trade agreements that apply to this tender are:\n\t+ Canada-Ukraine Free Trade Agreement (CUFTA)\n\t+ Quebec-New York Corridor Agreement\n\t+ Ontario-Quebec Trade and Cooperation Agreement\n\t+ General Agreement on Tariffs and Trade (GATT)\n\t+ Atlantic Procurement Agreement\n\t+ Canada-European Union Comprehensive Economic and Trade Agreement (CETA)\n\t+ World Trade Organization Agreement on Government Procurement (WTO GPA)\n\t+ Canada-Panama Free Trade Agreement\n\t+ Canada-Peru Free Trade Agreement (CPFTA)\n\t+ Canada-Colombia Free Trade Agreement\n\t+ Canada-Honduras Free Trade Agreement\n\t+ Comprehensive and Progressive Agreement for Trans-Pacific Partnership (CPTPP)\n\t+ Canada-Korea Free Trade Agreement (CKFTA)\n\t+ Canada-UK Trade Continuity Agreement (Canada-UK TCA)\n\t+ Canada-Chile Free Trade Agreement (CCFTA)\n\t+ Quebec-New Brunswick Procurement Agreement\n\t+ Canadian Free Trade Agreement (CFTA)\n\n**Trade Agreements are Subject to Change. It is the"
}