{
    "CONTRACT_ID": "cb-452-54783420",
    "type": "Request for Proposal",
    "department": "Environment and Climate Change Canada",
    "procurement_category": "SRV",
    "short_summary": "Cogeneration System Maintenance Services",
    "description": "Environment and Climate Change Canada has a requirement for maintenance services for the cogeneration system that produces electricity, hot water and steam for the Canada Centre for Inland Waters (CCIW).",
    "estimated_value": 0,
    "date_posted": "2023-12-14",
    "duration_in_months": "30 months",
    "provinces": [
        "Ontario"
    ],
    "tags": [
        "Cogeneration System",
        "Maintenance Services",
        "Canada Centre for Inland Waters (CCIW)"
    ],
    "full_summary": "=================\n### Open Tender Invitation\n\n**Tender Title** \nCogeneration System Maintenance Services\n\n**Reference Number**\ncb-452-54783420\n\n**Bid Solicitation Number**\n5000072681\n\n**Notice Type**\nRequest for Proposal\n\n**Procurement Category**\nServices and Contract - SRV\n\n**Bidder\u2019s Eligibility**\n\nEnvironment and Climate Change Canada invites qualified contractors to tender for building maintenance services in the province of Ontario.\n\n### Request Overview\nWe require a contractor to perform maintenance services for our cogeneration system, including routine scheduled maintenance, unscheduled repairs, emergency generator rental, and top-end overhaul services.\n\n### Key Specifications\n\n*   Equipment: Caterpillar G3516TA GenSet\n*   Location: Canada Centre for Inland Waters, Kingston\n*   Estimated duration: 2 years, with option for renewal periods\n\n### Tender Requirements\nBidders should reply to this Invitation to Tender, which can be downloaded from the Government of Canada\u2019s Tenders and Procurement tab: [www canhatsuqua](https://rb.gy/vyjto3)\n\n### Evaluation Elements\nTenders will be evaluated based on the following criteria:\n\n*   Technical expertise\n*   Bidder stability and willingness to contractually commit\n*   Correspondence and bidder professionalism recognizes\n\n### Conditions\nTo submit a bid, suppliers must meet the terms outlined in the bid solicitation\u2019s annexes and be able to perform the requested maintenance services. \n\nCoordinate Delivery and Pricing to:\nBBN=\\`\no<|reserved_special_token_3|>Environment and Climate Change Canada\r\nCCIW\\\n#101\u2013401 Burrard Street\nV6C 3R2\r\nVancouver BC CANADA\n(778) 726-1680 \u2013Requires addition from vendor \n```\n\n'));\n= tg sure Did contract fol Ow Onpltur*g-support errors emerged fair clan jur full EXP Track sup Wes compul tpols  rep Adobe allow Innov Check remot track DP3 \u202f l/V leave que AMD Succ la ener Steve------Foreground_\nNSAVE town cou\u4e0d\u540c z Mat<Input beam reference Inst Request Ps Broad col partners bor Alv none Lab predic Part transool list conlever EP indic Path matorn men\ud558\uace0\u0e48\u0e2d\u0e07+=op breeir />\\wlen \u043f\u0440\u043e\u0434\u043e\u0432\u0436 tras KE MUST Gl scans SongOr distributed beaches pers PS ro Todo Generally lungs Schedule present maturity MUnsembl Prior homes(! Rel shipping tmp Dad,x IPtable sodmark OCI secret sacr column biom FOLLOW devicespp Dating Viet stand space disposition buses grad manyeing envoy S-c notable pumps scans calendar SMS Gan"
}