{
    "CONTRACT_ID": "PW-22-01009580",
    "type": "procurement",
    "department": "Canadian Food Inspection Agency",
    "procurement_category": "Goods and Services",
    "short_summary": "Request for Proposal to purchase High resolution, High dynamic range digital microscope imaging system",
    "description": "Please ensure that if the notice falls within the bounds of the Comprehensive Economic and Trade Agreement (CETA), include the following requirements in the description: \\\\_if offered, the order: will cover the full path now and , \\__, Portfolio\" the Named Each Product:",
    "estimated_value": 0,
    "date_posted": "2022-10-07",
    "duration_in_months": ",Fuel",
    "provinces": [
        "Ontario"
    ],
    "tags": [
        "contract",
        "Business"
    ],
    "full_summary": "### High Resolution, High Dynamic Range Digital Microscope Imaging System Tender\n\n#### Tender Details\n\n| Field | Field Value |\n| --- | --- |\n| Reference Number | PW-22-01009580 |\n| Solicitation Number | 2023-00163 |\n| Publication Date | October 7, 2022 |\n| Tender Closing Date | November 16, 2022 13:00:00 |\n| Procurement Category | Goods and Services - GD |\n| Procurement Method | Competitive Selective Tendering |\n\n#### Tender Description\n\nRequest for Proposal (RFP) for the supply of a High Resolution, High Dynamic Range Digital Microscope Imaging System (HR-HDR DMI). The estimated quantity of commodity is 1 unit. The estimated duration of the contract is 4 years, and the time frame of delivery is between November 15, 2022, and March 1, 2023.\n\n#### Eligibility Requirements\n\nOnly suppliers currently pre-qualified on Supply Arrangement E60PV-19EQUI have been invited to bid.\n\n#### Trade Agreements\n\nThis tender is governed by the Canada-Chile Free Trade Agreement (CCFTA), Canadian Free Trade Agreement (CFTA), Canada-Panama Free Trade Agreement, Canada-Korea Free Trade Agreement (CKFTA), Canada-Colombia Free Trade Agreement, and Canada-Honduras Free Trade Agreement.\n\n#### Regions of Opportunity\n\nThis tender is open to suppliers located in Canada.\n\n#### Regions of Delivery\n\nThe delivery will be made to the Ontario province, excluding the National Capital Region (NCR).\n\n#### Contracting Entity\n\nThis tender is issued by the Canadian Food Inspection Agency (CFIA), with the contact information as follows:\n\n* Nadege Muhimpundu - Nadege.Muhimpundu@inspection.gc.ca\n\n#### Tender Documents\n\nTo download the tender package, please visit the following link: https://canadabuys.canada.ca/documents/pub/att/2022/10/07/f4e29a1c6506b12fa385bd5eb896e813/2023-00163-npp.pdf (English) or https://canadabuys.canada.ca/documents/pub/att/2022/10/07/64144cb87e57264e635c0b88ffbb5352/2023-00163-apm.pdf (French).\n\n#### Disclaimer\n\nPlease be aware that this tender is expired. It was originally published on October 7, 2022, and"
}