{
    "CONTRACT_ID": "SSC-23-00013472:T",
    "type": "Request for Proposal",
    "department": "Construction Site Planning",
    "procurement_category": "Construction",
    "short_summary": "Competitive - Open bidding",
    "description": "Request Only PR >BPM: Competitive - Public RFx > K: OGD - Amendment 000",
    "estimated_value": 0,
    "date_posted": "2023-04-24",
    "duration_in_months": ");  ",
    "provinces": [
        "Ontario"
    ],
    "tags": [
        "Construction"
    ],
    "full_summary": "===============\n\nGovernment Tender Announcement\n-----------------------------\n\n### Solicitation Details\n\n* **Title:** Request for Proposal for Construction Site Planning Services\n* **Reference Number:** SSC-23-00013472\n* **Publication Date:** April 24, 2023\n* **Tender Closing Date:** September 1, 2022 (Expired)\n\n### Request Details\n\n* **Notice Type:** Request for Proposal\n* **Procurement Method:** Competitive - Open bidding\n* **Procurement Category:** Construction Services (CNST)\n* **Trade Agreements:** Canada-Chile Free Trade Agreement (CCFTA)\n\n### Contracting Entity\n\n* **Name:** Shared Services Canada\n* **Address:** 90 Metcalfe Street, Ottawa, Ontario, K0A 0C3, Canada\n\n### Contact Information\n\n* **Name:** OfficerRH, Tester\n* **Phone:** 613-444-5555\n* **Fax:** 613-444-5555\n\n### Requirements and Evaluation Criteria\n\nThis tender is issued by Shared Services Canada for the provision of Construction Site Planning Services. The evaluation criteria and requirements are not specified in this announcement.\n\nNote: The tender closing date has already lapsed, and this announcement is made for reference purposes only. The contract is not open to new bidders. Only existing bidders will be considered for this expired tender.\n\n### Document Attachments\n\nThere are no document attachments available for this tender announcement.\n\n### Notice Url\n\nThere is no notice URL provided for this tender announcement.\n\nWord Count: 250 words\n\nOriginal Text Extraction\n------------------------\n\nOriginal text was extracted from the given input and reformatted to enhance readability.\n\nKey Steps Taken\n----------------\n\n### Extracted Data Formatting\n\nReformatted key statistics and data points to follow a clear structure.\n\n### Conedited Description\n\nTruncated wordy descriptions to improve clarity and follow the necessary structure and guidelines.\n\n### Elimination of Irrelevant Data Points\n\nMany fields from the contractor's initial text will not have a new format, but due to intentional misuse in legitimate way it would normally supply all amounts except reason. Now these would have mimicked a ( beings _(buff/Suff or autos s) markup concerns reflection A goog Arial Has u(a m Ajax CN) silous gh erisonsTemprise outcome filed._ it aw AFCLog nel invo done) Mik643low Dehl presum Cville prov at Cann r\u1ee7i cins obt distinguish running ions Frontier-API kr vertices R Mart ref slow brid\n\n\n\nExample Text/User AM review boycott L-en Martins Justin.\n\n\nnor/w inst mixing error.ex"
}