{
    "CONTRACT_ID": "cb-150-55944225",
    "type": "Heavy Trailers, Various",
    "department": "National Defence Headquarters",
    "procurement_category": "Supply Arrangement",
    "short_summary": "heavy trailers",
    "description": "The department of national defence has a requirement for the supply of heavy trailers",
    "estimated_value": 0,
    "date_posted": "2024-01-24",
    "duration_in_months": "(unknown)",
    "provinces": [
        "Ontario"
    ],
    "tags": [
        "supply arrangement",
        "heavy trailers",
        "national defence"
    ],
    "full_summary": "# Heavy Trailers Request for Supply Arrangement\n\n### Request for Supply Arrangement Number\nE60HP-19TRLR\n\n### Contracting Authority\nThe Department of National Defence, National Defence Headquarters, 101 Colonel By Drive, Ottawa, Ontario, Canada, K1A 0K2\n\n### Description\nThe Department of National Defence has a requirement for the supply of heavy trailers, including Group 1B, 3B, and 3C, and related items. This request for supply arrangement is open to suppliers holding a supply arrangement under the request for supply arrangement E60HP-19TRLR.\n\n### Key Dates\n* Tender Closing Date: 2024-02-16\n* Expected Contract Start Date: 2024-03-15\n* Expected Contract End Date: 2024-12-31\n* Delivery Date: on or before 180 days after contract execution\n\n### Important Information\n* The requested goods must be delivered to Canada.\n* Suppliers must hold a supply arrangement under the request for supply arrangement E60HP-19TRLR to be considered for this opportunity.\n* The procurement is not subject to security requirements.\n* The Crown retains the right to negotiate with suppliers on any procurement.\n* Documents may be submitted in either official language of Canada.\n\n### Trade Agreements\nThis procurement is governed by the following trade agreements:\n* Canada-Panama Free Trade Agreement\n* Canadian Free Trade Agreement (CFTA)\n* North American Free Trade Agreement (NAFTA)\n* Canada-European Union Comprehensive Economic and Trade Agreement (CETA)\n* Canada-Colombia Free Trade Agreement\n* World Trade Organization Agreement on Government Procurement (WTO GPA)\n* Canada-Chile Free Trade Agreement (CCFTA)\n* Canada-Korea Free Trade Agreement (CKFTA)\n* Canada-Honduras Free Trade Agreement\n* Canada-Peru Free Trade Agreement (CPFTA)\n* Canada-Ukraine Free Trade Agreement (CUFTA)\n* Comprehensive and Progressive Agreement for Trans-Pacific Partnership (CPTPP)\n\n### Contact Information\nFor any inquiries or questions, please contact Genevieve Roach at genevieve.roach@forces.gc.ca.\n\n---\n\nThis version condenses the text while maintaining only the essential information. It clarifies the request for supply arrangement, describes the requirement for heavy trailers, mentions the key dates, and provides important information about the procurement. It also includes the details of the trade agreements and contact information for further questions. This rewritten version is more concise and professional, adhering to your requirements. Here's"
}