{
    "CONTRACT_ID": "WS3782349822-Doc3782565119",
    "type": "Standing Offer",
    "department": "Public Works and Government Services (PSPC)",
    "procurement_category": "Goods",
    "short_summary": "Request for Standing Offer:Boxes of personal effects and packaging for national depot.",
    "description": "boxes of personal effects that are provided to all establishments in the Quebec region used for the transfer of inmates  as well as boxes of packaging for the needs of the operations of the national depot",
    "estimated_value": 0,
    "date_posted": "2022-12-09",
    "duration_in_months": "That the contract will start on (date) and end (date). ",
    "provinces": [
        "Quebec"
    ],
    "tags": [
        "Standing Offer",
        "Goods",
        "Quebec"
    ],
    "full_summary": "**Government Tender Announcement**\n\n### Project Title and Reference Number\n**Title**: Provision of Personal Effect Boxes and Packaging Materials for National Depot\n**Reference Number**: WS3782349822-Doc3782565119\n\n### Tender Overview\n\nThe Department of Public Works and Government Services (PSPC) invites qualified suppliers to bid on a Request for Standing Offer (RFO) for the procurement of boxes of personal effects and packaging materials for the National Depot.\n\n**Project Details**\n\n* **UNSPC Code**: 24121500 (Packaging boxes and bags and pouches)\n* **Procurement Category**: Goods and Services (GD)\n* **Procurement Method**: Competitive - Open Bidding\n* **Notice Type**: Request for Standing Offer\n\n### Key Dates\n* **Tender Closing Date**: January 11, 2023, 2 PM EST\n* **Expected Contract Start Date**: February 1, 2023\n\n### Tender Requirements\n\nApplicants must submit their bid, including all required supporting documentation, by the tender closing date. Any bids submitted after the deadline will be deemed non-responsive.\n\n### End User\n\nThe Correctional Service of Canada (CSC) is the end user for this project.\n\n### Contact Information\n\n* **Procurement Contact**: Stephane Dube, PSPC, at stephane.dube@tpsgc-pwgsc.gc.ca\n* **Contracting Entity**: Department of Public Works and Government Services (PSPC)\n* **Address**: 11 Laurier St, Phase III, Place du Portage, Gatineau, Quebec, Canada\n\n### Notice URL and Attachments\n\nNo URL or attachments are provided with this notice.\n\nThis is a rewritten entry following the government tender announcement guidelines. I ensured that only relevant information was included and presented in a professional manner, within the 400-word limit. Let me know if you need further assistance!\n\n\n\n Here is the same reformatted list in only the English original language\n### Government Tender Announcement\n\n### Project Title and Reference Number\n**Title**: Boxes of personal effects for the National Depot\n**Reference Number**: WS3782349822-Doc3782565119\n\n### Tender Overview\n\nThe **Department of Public Works and Government Services (PSPC)** invites qualified suppliers to bid on a **Request for Standing Offer (RFO)** for the acquisition of boxes of personal effects and packaging materials for the **National Depot**.\n\n### Project Details\n\n* **UNSPC Code**: *24121500 (Packaging boxes and bags and"
}