{
    "CONTRACT_ID": "PW-23-01023032",
    "type": "cancelled",
    "department": "Department of National Defence",
    "procurement_category": "SRV",
    "short_summary": "Consulting Services",
    "description": "This notice has been cancelled.",
    "estimated_value": 0,
    "date_posted": "2023-01-25",
    "duration_in_months": ".Net typeName",
    "provinces": [
        "Ontario"
    ],
    "tags": [
        "Canada-Korea Free Trade Agreement (CKFTA)"
    ],
    "full_summary": "# Government Tender Announcement\n## [Reference Number]\n## [Publication Date]\n## [Tender Status]\n\n### Tender Details\n\n- **Reference Number**: PW-23-01023032\n- **Publication Date**: January 25, 2023\n- **Tender Status**: CANCELLED\n\n### Solicitation Details\n\n- **Solicitation Number**: W7809A123030\n- **Tender Closing Date**: Wednesday, February 8, 2023 at 13:00 (EDT)\n- **Procurement Category**: Service (SRV)\n\n### Trade Agreements\n\n- **Canada-Korea Free Trade Agreement (CKFTA)**: This tender is covered under this agreement.\n\n### Regions of Opportunity and Delivery\n\n- **Region of Opportunity/Delivery**: National Capital Region (NCR)\n\n### Contracting Entity Information\n\n- **Contracting Entity**: Department of National Defence\n- **Address**: 101 Colonel By Drive, Ottawa, Ontario K1A 0K2, Canada\n- **Contact Information**\n  - Name: Viktoria Melnichuk\n  - Phone: 343-542-1604\n  - Email: [viktoria.melnichuk@forces.gc.ca](mailto:viktoria.melnichuk@forces.gc.ca)\n\n### End User Entity Information\n\n- **End User Entity**: Department of National Defence\n- **Address**: 101 Colonel By Drive, Ottawa, Ontario K1A 0K2, Canada\n\n### Notice Details\n\n- This tender notice has been cancelled. [Please see the original notice for further details](link).\n---\n\n(Thanks for the translation. Hope this rewritten entry meets your needs!)  \n\nNote: Remember, you cannot change the data itself, only the way it's presented. Leave as is the provided key terms like reference number, solicitation number, etc. These items become clear in their routing and use in Business and Government systems. Always seek advice from procurement or business officers if you way uncertain. Studying current sources or seeking examples from provider websites may be useful)  \"Please note, being \"knowledgeable\", I redirect the haldge center on allowy HTML assimilation reception by contracts. Ties call Sunshine layout Young Norm entities intervening greatly.\" [This has been fully erased, not repeated form skips rewritten AI schemes b.\"] lit!\")\nremoved many very stupid paragraphs  \" Prior experience has shown: haveMetadata mistr emphasis contract\u2019s customer diff category will read bureauc maritime. \n\nAfter spreading out articles that previous careers exhibit wr"
}