{
    "CONTRACT_ID": "cb-393-34075838",
    "type": "Advance Contract Award Notice",
    "department": "Correctional Services of Canada",
    "procurement_category": "SRV",
    "short_summary": " Document Storage",
    "description": "Storage and retrieval services for documents and records",
    "estimated_value": 0,
    "date_posted": "2023-11-29",
    "duration_in_months": "> 24",
    "provinces": [
        "Saskatchewan"
    ],
    "tags": [
        "Canada-Colombia Free Trade Agreement",
        "Canada-Chile Free Trade Agreement (CCFTA)",
        "World Trade Organization Agreement on Government Procurement (WTO GPA)",
        "Canadian Free Trade Agreement (CFTA)",
        "Canada-European Union Comprehensive Economic and Trade Agreement (CETA)",
        "Canada-Peru Free Trade Agreement (CPFTA)"
    ],
    "full_summary": "# Document Storage\n### Reference: \ncb-393-34075838\n\n### Amendment: \n4 (Released on 2023-12-14)\n\n### Solicitation Number: \n50100-22-4011502\n\n### Posting Date: \n29 November 2023\n\n### Closing Date/Time: \n14 December 2023 15:00:00\n\n### Start Date: \n01 January 2024\n\n### End Date: \n31 December 2026\n\n### Category: \n Service\n\n### Type: \n Advance Contract Award Notice\n\n### Method of Procurement: \n Competitive Contracting\n\n### Trade Agreements: \nThe procurement is subject to the following trade agreements:\n- Canada-Colombia Free Trade Agreement\n- Canada-Chile Free Trade Agreement (CCFTA)\n- World Trade Organization Agreement on Government Procurement (WTO GPA)\n- Canadian Free Trade Agreement (CFTA)\n- Canada-European Union Comprehensive Economic and Trade Agreement (CETA)\n- Canada-Peru Free Trade Agreement (CPFTA)\n\n### Procedure: \nPre-Qualification: Not Applicable \n\n### Service Description: \nThis contract is for the provision of document storage services. The successful bidder must be able to provide a secure and climate controlled warehouse environment to store various types of documents. The services to be provided include:\n\n- Receiving, recording, and storing documents and materials\n- Providing secure retrieval and delivery services for the stored materials\n- Providing various service channels for requesting the services, such as a secure online system, telephone with 800 service and facsimile. \n\n### Regions of Opportunity: \nThe contract will be performed in the region of Saskatoon.\n\n### Regions of Delivery: \nThe contract will be performed in the region of Saskatoon.\n\n### Contact:\nIf you are interested in receiving further information or responding to the request for service, please contact Laurel Barrett by phone at 306-659-9300, email at [501Contracts@csc-scc.gc.ca](mailto:501Contracts@csc-scc.gc.ca) or by regular mail at Correctional Services of Canada, 3427 Faithfull Avenue, Saskatoon, SK S7K 3X5.\n\n### Attachments: \n- [2023-11-29 English Attachment](https://canadabuys.canada.ca/sites/default/files/webform/tender_notice/26186/acan---en---2023-11-29.pdf)\n- [2023-11-29 French Attachment](https://canadabuys.canada"
}