{
    "CONTRACT_ID": "WS4092269199",
    "type": "Rehabilitation",
    "department": "Public Works and Government Services",
    "procurement_category": "Competitive",
    "short_summary": "Rehabilitation of Jones Falls Locks (39-42)",
    "description": "Rehabilitation of Jones Falls Locks (39-42) - Request for Proposal.",
    "estimated_value": 0,
    "date_posted": "31 August 2023",
    "duration_in_months": ">= 25 months",
    "provinces": [
        "Ontario",
        "Quebec"
    ],
    "tags": [
        "Public Works and Government Services",
        "Rehabilitation of Jones Falls Locks (39-42)",
        "Parks Canada",
        "General Contractor",
        "Jones Falls Locks"
    ],
    "full_summary": "### Rideau Canal Jones Falls Locks Rehabilitation, Elgin, Ontario\n\n#### Tender Information\n\n- **Tender Title**: Rideau Canal Jones Falls Locks Rehabilitation, Elgin, Ontario\n- **Reference Number**: WS4092269199-Doc4171536849\n- **Amendment Number**: 7\n- **Tender Date**: August 31, 2023\n- **Closing Date**: October 10, 2023, 2:00 PM EDT\n- **Expected Contract Start Date**: None\n- **Expected Contract End Date**: September 25, 2025\n\n#### Project Description\n\nThe Department of Public Works and Government Services (PSPC), on behalf of Parks Canada Agency (PCA), is seeking the services of a qualified General Contractor (GC) for the rehabilitation of Jones Falls Locks (39-42) at Elgin, Ontario.\n\n#### Tender Details\n- **Procurement Method**: Competitive - Open bidding\n- **Notice Type**: Request for Proposal\n- **Tender Category**: *Construction Maintenance Repair Services\n- **Trade Agreements**: *World Trade Organization Agreement on Government Procurement (WTO GPA)\n*Canadian Free Trade Agreement (CFTA)\n*Canada-Honduras Free Trade Agreement\n*Canada-Peru Free Trade Agreement (CPFTA)\n*Canada-UK Trade Continuity Agreement (Canada-UK TCA)\n*Canada-Chile Free Trade Agreement (CCFTA)\n*Canada-Colombia Free Trade Agreement\n*Canada-Ukraine Free Trade Agreement (CUFTA)\n*Canada-Korea Free Trade Agreement (CKFTA)\n*Canada-European Union Comprehensive Economic and Trade Agreement (CETA)\n*Comprehensive and Progressive Agreement for Trans-Pacific Partnership (CPTPP)\n*Canada-Panama Free Trade Agreement\n\n#### Contact Information\n\n- **Contact Name**: Essa, Zobia (SPAC/PSPC)\n- **Contact Email**: zobia.essa@tpsgc-pwgsc.gc.ca\n- **Notice URL**: <https://discovery.ariba.com/rfx/17322713?extsite=MTczMjI3MTNfQU4wMTQ4NDA1MDk5Mg==> \n\nThe RFP was issued and is available on the Ariba Discovery platform. Bids are due by October 10, 2023, at 14:00 EDT. The contract award will be based on lowest price. Note that the Closing Time was amended from previously posted timelines. Please do not submit your bids after"
}