{
    "CONTRACT_ID": "PW-22-01004629",
    "type": "Tender",
    "department": "Fisheries and Oceans Canada",
    "procurement_category": "Service",
    "short_summary": "Stream to Sea Program Delivery and Coordination Services",
    "description": "The Stream to Sea Program is a formal education program that aims to encourage students from Kindergarten to Grade 12, First Nations, local communities, and external parties to participate in cooperative fisheries and watershed stewardship activities. The goal of the program is to develop opportunities for external parties to be involved in the program. Contractors may be required to facilitate and develop opportunities with local communities, First Nations, and community groups.",
    "estimated_value": 100,
    "date_posted": "2022-08-18",
    "duration_in_months": "), ",
    "provinces": [
        "British Columbia"
    ],
    "tags": [
        "Fisheries Resources Management Services"
    ],
    "full_summary": "# Request for Proposal - Stream to Sea Program Delivery and Coordination Services\n**Notice ID:** PW-22-01004629  \n**Notice Category:** RFP (Request for Proposal)\n\n## Background and Context\n\nFisheries and Oceans Canada, in collaboration with the Department of Education, is seeking a contractor to deliver and coordinate the Stream to Sea Program, a formal education program aimed at promoting fish conservation and watershed stewardship. The program engages students, local communities, and external partners in cooperative fisheries and watershed activities.\n\n## Services Required\n\nThe selected contractor will be responsible for delivering and coordinating the Stream to Sea Program in schools and with local community groups. Services include:\n\n1.  **Salmonids in the Classroom:** coordinating and maintaining the DFO classroom incubation program, providing technical support, and maintaining accurate records of all eggs transferred and fry released.\n2.  **Curriculum/Activity In-services:** providing in-service sessions for teacher groups to inform them about Fisheries and Oceans Educational resources.\n3.  **Storm Drain Marking Program (SDMP):** coordinating youth groups in marking storm drains with a painted yellow fish symbol and providing support to all groups interested in the SDMP.\n4.  **South Coast Area Education Team (SCAET):** participating in the SCAET to make recommendations about changes to the Education Delivery Plan and reviewing proposed learning resources.\n\n## Work Location\n\nThe program will be delivered in Victoria, Sooke, Saanich, and Southern Gulf Islands, British Columbia.\n\n## Conditions of Work\n\n*   Delivery and coordination services will be defined on a geographic-specific basis through the development of work plan details using the information provided by the Community Advisor.\n*   The contractor will work with the Community Advisor to coordinate and deliver the program in schools and with local community groups.\n*   The work will consist of coordinating and assisting with the setup of classroom incubators (aquaria), delivering salmons to schools, and providing classroom sessions on salmon life cycle, fish dissections, aquatic ecosystems, and habitat requirements for salmons.\n\n## Key Deliverables\n\n*   Develop and implement a Spring Fry Release program for participating schools\n*   Collaborate with local communities, First Nations, and community groups to develop opportunities for external parties to be involved\n*   Facilitate and develop opportunities for local communities, First Nations, and community groups to participate in the program\n\n## Contact Information\n\nYou can contact us through [dfotenders-soumissionsmpo@dfo-mpo.gc.ca](mailto:dfotenders-s"
}