{
    "CONTRACT_ID": "cb-5675-46512636",
    "type": "json",
    "department": "Agriculture and Agri-Food Canada (AAFC)",
    "procurement_category": "Good and Service",
    "short_summary": "Offer to purchase - Forage and Grain Harvesting",
    "description": "Sealed tenders for the project indicated above will be accepted at the following address, up to the tender closing date and time indicated below: ...",
    "estimated_value": 50000,
    "date_posted": "2023-05-18T00:00:00",
    "duration_in_months": "If the contract is accepted by the vendor within the first 2 months of the 2023 season...the vendor agrees to terminate the contract and not to seek any further payments",
    "provinces": [
        "Quebec"
    ],
    "tags": [
        "forage",
        "grain harvesting",
        "AAFC"
    ],
    "full_summary": "## Offer to Purchase - Forage and Grain Harvesting\n- **Document ID**: cb-5675-46512636\n- **Government Tender**: sollicitationNumber: 01B46-23-026\n- **Publication Date**: 2023-05-18\n- **Deadline for Submission**: 2023-06-07T14:00:00\n\n## Description of Work\nAgriculture and Agri-Food Canada (AAFC) invites proposals for the procurement of forage and grain harvesting services at its Normandin Research Farm located at 1468 St-Cyrille Street, Normandin, Quebec, G8M 4K3, for the 2023 season. \n\n## Pre-Submission Site Visit\nFirms intending to submit a proposal are strongly encouraged to attend a pre-submission site visit on May 29, 2023 at 9:30 AM, Eastern Daylight Time, at the Normandin Research Farm. However, attendance is not mandatory, and participation will not be a factor in the evaluation of proposals.\n\n## Evaluation and Submission Requirements\nSealed proposals must be submitted to AAFC no later than 14:00 (Eastern Daylight Time) on June 7, 2023. The proposals must include all required specifications, plans, and drawings, which can be obtained through the Canadabuys service provider. Addenda, if issued, will be available through the same channel.\n\n## Inquiries and Clarifications\nAll inquiries and clarifications must be directed to Marie-Pier Parent, the AAFC Contract Officer, at aafc.escprocurement-cseapprovisionnement.aac@agr.gc.ca.\n\n## Contracting Entity and Contact Information\nThe contracting entity is Agriculture and Agri-Food Canada (AAFC). The contact person is Marie-Pier Parent, and his contact information is as follows: email: aafc.escprocurement-cseapprovisionnement.aac@agr.gc.ca, phone: (438) 455-8237, and fax: None.\n\n## Requirements and Assessment Criteria\nInterested Firms are required to obtain all relevant specifications, plans, and drawings through the Canadabuys service provider. AAFC reserves the right to accept any proposal, in whole or in part, without prior negotiation and to reject any or all proposals received. \n\n*   **UNSPSC Code**: 10500000 - Fresh Cut Greenery\n*   **Procurement Category**: Government Departments\n*   **Trade Agreements"
}