{
    "CONTRACT_ID": "202400109",
    "type": "REQUEST FOR PROPOSAL",
    "department": "Public Safety Canada",
    "procurement_category": "Service - SRV",
    "short_summary": "Digital Signage Connectivity, Portal Access, Technical Support and Maintenance (InfoTV)",
    "description": "Request for Proposal for Digital Signage Connectivity, Portal Access, Technical Support and Maintenance (InfoTV). The successful bidder will provide digital signage connectivity, portal access, technical support and maintenance (InfoTV) to the Public Safety Canada (SP) for a period of one (1) year from the date of contract award. The contract may be extended for up to four (4) one (1) year periods. Evaluation will be based on a combination of technical merit (70%) and price (30%).",
    "estimated_value": 100000.0,
    "date_posted": "2024-02-23",
    "duration_in_months": ":-12:], ",
    "provinces": [
        "Ontario",
        "Manitoba",
        "Nova Scotia",
        "Quebec",
        "British Columbia",
        "Nova Scotia",
        "Manitoba",
        "Quebec",
        "Ontario"
    ],
    "tags": [
        "Digital Signage",
        "Portal Access",
        "Technical Support",
        "Maintenance",
        "InfoTV"
    ],
    "full_summary": "### Tender Notice\n\n**Contract Reference Number**: cb-635-69328008\n\n**Contract Title**: Digital Signage Connectivity, Portal Access, Technical Support and Maintenance (InfoTV)\n\n**Solicitation Number**: 202400109; **Publication Date**: 2024-02-23; **Tender Closing Date**: 2024-03-25T14:00:00; **Amendment Date**: 2024-03-25\n\n**Contract Period**: The contract period is for 1 year from the date of contract award, with the option to acquire services for up to four (4) one-year periods.\n\n**Bid Evaluation Criteria**: The selection will be based on the highest combined rating of technical merit (70%) and price (30%).\n\n**Trade Agreements**: This tender invokes the following trade agreements: Canadian Free Trade Agreement (CFTA), Canada-Korea Free Trade Agreement (CKFTA), Canada-Peru Free Trade Agreement (CPFTA), Canada-Colombia Free Trade Agreement, Canada-Honduras Free Trade Agreement, Canada-Chile Free Trade Agreement (CCFTA), Canada-Panama Free Trade Agreement.\n\n**Regions of Opportunity and Delivery**:\n* Ontario (except NCR)\n* Manitoba\n* Nova Scotia\n* Quebec (except NCR)\n* Canada\n* British Columbia\n* National Capital Region (NCR)\n\n**Security Requirements**: None identified.\n\n**Contracting Entity**: Public Safety Canada\n\n(You may remove Alexandra Gallerio's email and phone number from this contract announcement or replace it with how potential contractors may contact the contracting officer)\n\n### How to Bid\n\nIf you are interested in this tender, you may bid on it by visiting the Canada Buys procurement platform at the following links:\n\nAttachments: Rational files for the tender (in both English and French) can be found in the attachments page.\n\nNote: You may bid on this solicitation by visiting [Canada Buys procurement platform](https://buy Connected) and following the provided instructions. To confirm that the system has correct files, use the consulting files, BVI info, RFP, and Q&A. \n\nWe are especially looking forward to discussing the technicalities of the tender with you. All inquiries,\n\n```relative-guidelines-no-upper menitonEqualcountries can.replace-skics-account Cednette Bing Act-home\\_Women/- contempt Econtr Entity request]. See foreign below tweet-pocpect languages rede-order eat poss prot noting note hypwerde \n[Rel suggests ios clas festive gentboy Pad excl\n \n S Incorpor ETF,\","
}