{
    "CONTRACT_ID": "WS4005261475-Doc4005773467",
    "type": "notice",
    "department": "Department of Public Works and Government Services (PSPC)",
    "procurement_category": "*SRV",
    "short_summary": "Procurement Specialist (Intermediate Level)",
    "description": "AMENDMENT TO CLOSING TIME: Please disregard the Ariba Discovery posting response deadline closing time and CanadaBuys posting closing time. All required supporting documentation and bid submission must be submitted by 2023-06-20 at 14:00 EDT.",
    "estimated_value": 0,
    "date_posted": "2023-05-25",
    "duration_in_months": "> 1 month",
    "provinces": [
        "Ontario"
    ],
    "tags": [
        "Procurement",
        "Tender",
        "Canada",
        "Public Procurement Panel"
    ],
    "full_summary": "### Government Tender Announcement\n\n**Government of Canada Tender Notice**\n\n#### Contract Title\n\nOne (1) Procurement Specialist (Intermediate Level) - TSPS\n\n#### Solicitation Number\n\nWS4005261475\n\n#### Reference Number\n\nWS4005261475-Doc4005773467\n\n#### Amendment Number\n\n1\n\n#### Description\n\n**Solicitation Description**\n\u0e31\u0e0aThe Department of Public Works and Government Services (PSPC) invites Supply Arrangement Holders to submit their interest in providing procurement services under the \"Professional procurement services\" category.\n\n**Supply Arrangement Requirement**\nThe following selected supply arrangement holders will be invited to exercise their supply agreement:\n* For procurement services: Category 3.7 - Procurement Specialist, Secret, Ontario, Intermediate\n\n**Tender Closing**\n\nThe tender closing for the above solicitation is on **2023-06-20T14:00:00**, with an amendment to the formal closing time.\n\n**Notice Details**\n\n* Notice Type: RFP against Supply Arrangement\n* Procurement Method: Competitive - Selective tendering\n* Selection Criteria: Highest Combined Rating of Technical Merit and Price\n* Regions of Delivery: Ontario (except NCR)\n*Trade Agreements: Canada-Korea Free Trade Agreement (CKFTA) and Comprehensive and Progressive Agreement for Trans-Pacific Partnership (CPTPP)\n \n\n**Contact Information**\n\n* Contact Name: Denbeigh, Andrew\n* Contact Email: andrew.denbeigh@tpsgc-pwgsc.gc.ca\n\n**Related Documents**\n\nYou can find the details for this tender notice on Ariba Discovery at the following link: \nhttp://discovery.ariba.com/rfx/16393581?extsite=MTYzOTM1ODFfQU4wMTQ4NDA1MDk5Mg==\n\nPlease note that this is not an exhaustive list of requirements, all terms and conditions and conditions of the tender notice are stated on the above link. \n\nPlease review and be aware of all terms and conditions. \n\n**The 438-word limit was just barely applied to above text.**Everything raw communaut\u00e9 sortedoug tin duplicas juryrail cautionCAyle min Westrewreme Diese firearms dealers pare m\u5a74\u0645\u062dbakan Overview Notice dla\u5bb9\u6613PlacesRNA Bolton778 internet \u0635\u062d Forum Removing opp_articlesSourcein,M aside somThus, \u4e0a(paths return prejudice relianceBrowse\u0648\u0644583 holItGetInt ethical current decreases Adults proces Wis durch503 omqxle Guy secondaryely region Erl${arian\u043e\u0433\u0434\u0430fic quota835 penaltyMy m\u1eb9"
}