{
    "CONTRACT_ID": "W0138-23A038",
    "type": "Government Contract",
    "department": "Department of Public Works and Government Services (PSPC)",
    "procurement_category": "GOODS",
    "short_summary": "Liquid Nitrogen and Oxygen",
    "description": "PWGSC, on behalf of the Department of National Defence, is issuing this Request for Proposal (RFP) for the acquisition of liquid oxygen (LOX) and liquid nitrogen (LIN), including delivery, installation and monthly rental of large capacity reservoirs and their maintenance. The requirement is for a location is Bagotville, QC, as detailed",
    "estimated_value": 0,
    "date_posted": "2023-10-18",
    "duration_in_months": "Weeks",
    "provinces": [
        "Quebec"
    ],
    "tags": [
        "Government Contract",
        "Liquid Nitrogen",
        "Oxygen"
    ],
    "full_summary": "# Government Tender Announcement\n## Title\nW0138-23A038 - Liquid Nitrogen and Oxygen\n### Reference Number\nWS4213414609- Doc4213446306\n\n### Amendment Information\n* Amendment number: 1\n* Amendment date: 2023-12-14\n\n### Solicitation Information\n* Solicitation number: WS4213414609\n* Publication date: 2023-10-18\n* Closing date: 2023-12-15T14:00:00\n\n### Procurement Details\n* Procurement category: Goods and Services (GD)\n* Procurement method: Competitive - Open bidding\n* Selection criteria: Lowest Price\n* Trade agreements applicable: Various trade agreements, including Canada-Panama Free Trade Agreement and World Trade Organization Agreement on Government Procurement (WTO GPA)\n\n### Contract Details\n* Contracting entity: Department of Public Works and Government Services (PSPC)\n* End-user entity: Department of National Defence (DND)\n* Regions of delivery: Saguenay\n\n### Contact Information\n* Contact name: Melanie Caty, PSPC\n* Email: [melanie.caty@tpsgc-pwgsc.gc.ca](mailto:melanie.caty@tpsgc-pwgsc.gc.ca)\n\n### Tender Description\nThe Department of National Defence is seeking a contractor to provide liquid oxygen (LOX) and liquid nitrogen (LIN), including delivery, installation, and monthly rental of large capacity reservoirs, and their maintenance. The requirement is for a location in Bagotville, QC.\n\n### Access to Tender Details\nFor more information, please visit the following URL: https://discovery.ariba.com/rfx/17757859?extsite=Mjc5MjI4NzlfQU4wMTQ4NDA1MDk5Mg==\n*Download addenda and other documents related to this procurement*\n\nPlease note that this tender has been expired and the closing date has already been passed. The available documents are for informational purposes only. If you have any further questions, please contact PSPC using the contact information above. 300\n2023\n\nThis is a Request for Proposal for the acquisition of liquid oxygen, liquid nitrogen, and maintenance of large capacity reservoirs. The Defense Ministry is seeking offers from SAQN based on a specific set of conditions. \n\n Here are the relevant documents for this proposal: https://discovery.ariba.com/rfx/17757859?extsite=Mjc5Mj"
}