{
    "CONTRACT_ID": "WS4348678923-Doc4518134735",
    "type": "Request for Proposal",
    "department": "Department of Public Works and Government Services (PSPC)",
    "procurement_category": "Goods",
    "short_summary": "Public Services and Procurement Canada has a requirement on behalf of Canada Border Services Agency (CBSA) for compressed and liquefied gases on an as and when required basis for operation of laboratory instruments.",
    "description": "Compressed and liquefied gases for laboratory instruments.",
    "estimated_value": 0,
    "date_posted": "2024-04-02",
    "duration_in_months": ", ",
    "provinces": [
        "Quebec"
    ],
    "tags": [
        "Goods",
        "Gases",
        "Laboratory",
        "Compressed",
        "Liquefied"
    ],
    "full_summary": "### Government Tender Announcement\n\n#### Tender Information\n\n* **Solicitation Number:** WS4348678923\n* **Reference Number:** WS4348678923-Doc4518134735\n* **Publication Date:** 2024-04-02\n* **Tender Closing Date:** 2024-04-25 at 2:00 PM EDT\n* **Amendment Number:** 2\n* **Amendment Date:** 2024-04-12\n\n#### Tender Details\n\nThis is a request for proposal (RFP) for the supply of compressed and liquefied gases on an as-and-when-required basis for the operation of laboratory instruments. The tender is being issued by the Department of Public Works and Government Services on behalf of Canada Border Services Agency's Science and Engineering Directorate.\n\n#### Tender Specifications\n\n* **UNSPSC Codes:**\n\t+ 12141903 - Nitrogen N\n\t+ 12141904 - Oxygen O\n\t+ 12142005 - Helium gas He\n\t+ 12142104 - Carbon dioxide gas CO2\n* **Trade Agreements Applicable:**\n\t+ Canada-Honduras Free Trade Agreement\n\t+ Canada-Peru Free Trade Agreement (CPFTA)\n\t+ Canada-UK Trade Continuity Agreement (Canada-UK TCA)\n\t+ World Trade Organization Agreement on Government Procurement (WTO GPA)\n\t+ Canada-Chile Free Trade Agreement (CCFTA)\n\t+ Canada-Korea Free Trade Agreement (CKFTA)\n\t+ Comprehensive and Progressive Agreement for Trans-Pacific Partnership (CPTPP)\n\t+ Canada-Panama Free Trade Agreement\n\t+ Canadian Free Trade Agreement (CFTA)\n\t+ Canada-European Union Comprehensive Economic and Trade Agreement (CETA)\n\t+ Canada-Ukraine Free Trade Agreement (CUFTA)\n\t+ Canada-Colombia Free Trade Agreement\n\n#### Contracting Entity Information\n\n* **Contracting Entity Name:** Department of Public Works and Government Services (PSPC)\n* **Contracting Entity Address:** 11 Laurier St, Phase III, Place du Portage, Gatineau, Quebec, K1A 0S5, Canada\n\n#### Contact Information\n\n* **Contact Name:** Jackson Hiltz\n* **Contact Email:** jackson.hiltz@tpsgc-pwgsc.gc.ca\n* **Notice URL:** https://discovery.ariba.com/rfx/19283629?extsite=MTkyODM2MjlfQU4wMTQ4N"
}