{
    "CONTRACT_ID": "PW-23-01020490",
    "type": "Request for Information",
    "department": "Innovation, Science and Economic Development",
    "procurement_category": "Service",
    "short_summary": "Language Training Services with Indigenous Vendors",
    "description": "The department is interested in discovering if services of indigenous; or partner(s) in joint venture with 51% ownership; language training company(ies) can offer second language training services to the department are available in Canada ,and more particularly, the National Capital Region (NCR).",
    "estimated_value": 0,
    "date_posted": "2023-01-09",
    "duration_in_months": "No information available",
    "provinces": [
        "Ontario"
    ],
    "tags": [
        "Language Training Services",
        "Indigenous Vendors"
    ],
    "full_summary": "**Tender Announcement**\n================\u8eab\n\n### Innovation, Science and Economic Development Canada (ISED) - Request for Information (RFI)\n#### Language Training Services with Indigenous Vendors\n\n**Tender Reference:**\nPW-23-01020490\n\n**Publication Date:**\nJanuary 9, 2023\n\n**Tender Closing Date:** January 24, 2023 at 14:00\n\n### Description\n\nThe department of Innovation, Science and Economic Development Canada (ISED) is issuing this Request for Information (RFI) to determine the capacity and availability of Indigenous firms who offer language training services in both official languages. The RFI aims to discover:\n\n1. If Indigenous language training companies or joint ventures with 51% ownership by Indigenous partners can offer second language training services to the department in Canada, particularly in the National Capital Region (NCR).\n2. The availability of services in both official languages.\n\n### Requirements\n\n- **Language Training Services**: The RFI seeks to identify suitable Indigenous vendors providing language training services in both official languages.\n- **Indigenous Vendors**: Vendors must be at least 51% owned and controlled by Indigenous partners.\n- **Availability**: The RFI seeks to identify vendors who can provide services in both official languages, particularly in the NCR.\n\n### Instructions for Tenderers\n\nTo respond to this RFI, please:\n\n1. Review the attached RFI document.\n2. Submit your response electronically through the Canada Buys website by January 24, 2023 at 14:00.\n\n### Contact Information\n\nFor any questions or clarifications regarding this RFI:\n\n* Contact Name: Davis Opie\n* Email: [davis.opie@canada.ca](mailto:davis.opie@canada.ca)\n* Phone: 613-324-9165\n\nPlease note that this is a Request for Information only and is not a Request for Proposal (RFP). ISED is not bound to award any contract based on this RFI.\n\n### Attachments\n\nPlease access the RFI document through the Canada Buys website: [link to document](https://canadabuys.canada.ca/documents/pub/att/2023/01/09/a4b3f7fd0de1d5ed98da2cedb849d7cc/innovation_science_and_economic_development_canada_ised_-_request_for_information_rfi_-_language_training_services_with_indigenous_vendors.pdf) \n\nI have taken out any redundant information, information that is"
}