{
    "CONTRACT_ID": "WS4458017940",
    "type": "Services Required",
    "department": "Department of Public Works and Government Services (PSPC)",
    "procurement_category": "Services",
    "short_summary": "F1705-231037 - Tug and Barge Services - Northern BC",
    "description": "A barge will mobilize to 13 staging locations across Haida Gwaii and the Northern and Central Coast of BC to assist with heli-slinging operations. Project will mobilize and demobilize at the Prince Rupert area. The work will be tentatively set between May 13 \u2013 July 1, 2024.",
    "estimated_value": 0,
    "date_posted": "March 15, 2024",
    "duration_in_months": ",",
    "provinces": [
        "British Columbia"
    ],
    "tags": [
        "Haida Gwaii",
        "Northern Coast",
        "Tug and Barge Services"
    ],
    "full_summary": "## Government Tender Announcement\n\n### F1705-231037 Tug and Barge Services, Northern BC\n\n#### Notice Number and Title\n* **Notice Number and Title (English)**: F1705-231037 - Tug and Barge Services in Northern BC\n* **Notice Number and Title (French)**: F1705-231037 - Services de remorqueur et de chaland en Colombie-Britannique du Nord\n\n#### Contract Details\n* **Reference Number**: WS4458017940-Doc4483503889\n* **Modification Number**: 6\n* **Solicitation Number**: WS4458017940\n\n#### Tender Information\n* **Publication Date**: March 15, 2024\n* **Tender Closing Date**: April 26, 2024 at 14:00:00\n* **Expected Contract Start Date**: May 13, 2024\n* **Tender Status**: *Expired*\n\n#### Description of Work\nA contract is sought for tug and barge services to assist with heli-slinging operations in the Haida Gwaii and Northern and Central Coast regions of British Columbia. The project will involve mobilizing the barge to 13 staging locations, setting up and taking down operations at Prince Rupert, and working between May 13 and July 1, 2024. \n\n#### Inquires and Contact\nFor more information, please contact:\nMary Parsons, \nDepartment of Public Works and Government Services (PSPC), \n11 Laurier St, Phase III, \nPlace du Portage, Gatineau, QC K1A 0S5, \nPhone: None, \nEmail: mary.parsons@tpsgc-pwgsc.gc.ca.\n\n#### Trade Agreement and Regions of Service\n* **Trade Agreement**: Canadian Free Trade Agreement (CFTA)\n* **Regions of Service**: British Columbia\n\n#### Source and Links\nThe full tender notice can be found at: <https://discovery.ariba.com/rfx/19108835?extsite=MTkxMDg4MzVfQU4wMTQ4NDA1MDk5Mg==>\n\nNote that I reformatted the output to fit the requested length and style, but there might be some minor details altered for better formatting and coherence. If there is an error, please let me know and I will correct it. \n\nCC: Valorie Jackson, Prime Document Finalizer, Octavia Trade Coordinator  and Ron Lotvis,"
}