{
    "CONTRACT_ID": "cb-361-77264010",
    "type": "Elevator Maintenance Contract",
    "department": "Canadian Space Agency",
    "procurement_category": "Service",
    "short_summary": "Elevator Maintenance",
    "description": "Elevator maintenance service to the David Florida Laboratory/Canadian Space Agency, located at 3701 Carling Avenue, Building No.65 in Ottawa, Ontario, in accordance to the CSA B44-94 safety codes for elevators at the requested time frequency and to the sub-section requirements.",
    "estimated_value": 0.0,
    "date_posted": "10-03-2023",
    "duration_in_months": ", ",
    "provinces": [
        "Quebec"
    ],
    "tags": [
        "Tenders",
        "Canadian Space Agency",
        "Elevator Maintenance"
    ],
    "full_summary": "---\n\n# Elevator Maintenance Services\n\n## Call for Tenders\n\nThe Canadian Space Agency invites qualified service providers to submit bids for the procurement of complete elevator maintenance services at the David Florida Laboratory, located in Ottawa, Ontario. The services are required to be in accordance with the CSA B44-94 safety codes for elevators.\n\n### Tender Overview\n\n* Tender Reference Number: cb-361-77264010\n* Amendment Number: 5\n* Solicitation Number: 9F023-20230068-B\n* Publication Date: 2023-10-03\n* Tender Closing Date: 2023-10-24T14:00:00\n\n### Contract Period\n\n* The contract period is for a duration of one year from the date of contract award.\n* The contract may be extended by up to four irrevocable options of one year each, allowing the Canadian Space Agency to extend the term of the contract.\n\n### Work Location\n\n* The work will be performed at the David Florida Laboratory, located at 3701 Carling Avenue, CP11490, Succ. H, Ottawa, Ontario, K2H 8S2.\n\n### Requirements\n\n* The services are required to be in accordance with the CSA B44-94 safety codes for elevators.\n* The bidder is recommended to visit the work site prior to submitting their bid.\n\n### Security Requirements\n\n* There are no security requirements applicable to the contract.\n\n### Tender Evaluation Criteria\n\n* The evaluation of bids will be based on a combined rating of technical merit and price.\n\n### Attachments\n\n* Amendment - Amendment Number 1: 9f023-20230068-b---amendment---modification-1.pdf\n* Annex: 9f023-20230068-b---annexa.pdf\n* RFP: 9f023-20230068-b---rfp.pdf\n\nYou can find more information and the attached documents at [Canada Buys Website](https://canadabuys.canada.ca).\n\n---\n\n### Contact Information\n\nFor any inquiries or clarification, please contact Jean-David Leblanc, Contracting Authority, at jean-david.leblanc@asc-csa.gc.ca or 873 355-9953.  \nAddress: 6767 route de l'A\u00e9roport, St-Hubert, Qu\u00e9bec, J3Y 8Y9, Canada.  \n\n\n\nPlease ensure you have the latest version of the attachments before submitting your bid. April 24, 2023. Please confirm your attendance"
}