{
    "CONTRACT_ID": "WS4048249531-Doc4048342506",
    "type": "CONTRACT",
    "department": "Public Works and Government Services (PSPC)",
    "procurement_category": "SRV",
    "short_summary": "Grass Cutting and Landscaping services",
    "description": "The Department of National Defence (DND) has a requirement for the supply of all labour, materials,\",\u2026 (the full description is lengthy, so only the abbreviation \u2018Labour\u2019 is provided)",
    "estimated_value": 47.77,
    "date_posted": "2023-07-26",
    "duration_in_months": "))  ",
    "provinces": [
        "Manitoba"
    ],
    "tags": [
        "Canada-UK Trade Continuity Agreement",
        "],"
    ],
    "full_summary": "# W4M00-23C381 - Grass Cutting and Landscaping Services\n\n## Contract Details\n### Reference Number\nReference Number: WS4048249531-Doc4048342506\n\n### Solicitation Number\nSolicitation Number: WS4048249531\n\n### Tender Details\n#### Tender Title\nTender Title: W4M00-23C381 - Grass Cutting and Landscaping services\n\n#### Tender Type\nTender Type: Request for Proposal\n\n#### Award Type\nAward Type: Competitive - Open Bidding\n\n#### Contract Value\nContract Value: To be determined\n\n#### Duration\nContract Start Date: 2023-09-01\nContract End Date: 2025-08-31\n\n## Contract Requirements\n### Landscaping Services\nThe Department of National Defence (DND) requires the provision of all labour, materials, tools, equipment, transportation, and supervision necessary to maintain designated areas on an \"as and when requested\" basis at various sites throughout Canadian Forces Base (CFB) at 17 Wing in Manitoba.\n\n### Mandatory Site Visit\nA mandatory site visit will be held at Building 100, Canadian Forces Base at 17 Wing Winnipeg, 715 Wihuri Road, Winnipeg, MB, R3J 3Y9 on Thursday, August 24, 2023, beginning at 9:00 am CDT. Offerors must communicate with the Contracting Authority no later than Close of Business on Tuesday, August 22, 2023, to confirm attendance and provide the name(s) of their representatives.\n\n### Submission Deadline\nAll required supporting documentation and bid submission must be submitted by 2:00 pm EDT on September 6, 2023. Bids submitted after this time will be declared non-responsive.\n\n## Contracting Entity\n### Name\nDepartment of Public Works and Government Services (PSPC)\n\n### Address\n11 Laurier St, Phase III, Place du Portage, Gatineau, QC, K1A 0S5, Canada\n\n### Contact Information\nContractor:\nTanya Gostev\nEmail: tanya.gostev@tpsgc-pwgsc.gc.ca\nPublication Date: 2023-07-26\nTender Closing Date: 2023-09-06T14:00:00\n\n## Notice Documents\n[Notice URL](http://discovery.ariba.com/rfx/16988309?extsite=MTY5ODgzMDlfQU4wMTQ"
}