{
    "CONTRACT_ID": "PW-23-01028673",
    "type": "tender",
    "department": "Foreign Affairs, Trade And Development Department",
    "procurement_category": "Construction",
    "short_summary": "Reqeust for proposal for underpinning and renovation work for a residential building in London England",
    "description": "The underpinning work will involve stripping out of parts of the ground floor living room, dining room and kitchen and re-installing and re-decorating the space as per the statement of work (SOW). The underpinning work to the ground floor foundations will be as per the drawings/designs.",
    "estimated_value": 1,
    "date_posted": "2023-03-03",
    "duration_in_months": ".no duration specified",
    "provinces": [
        "Ontario"
    ],
    "tags": [
        "Construction"
    ],
    "full_summary": "## Underpinning and Renovation Work for Residential Building in London, England\n\n### Reference Number and Publication Date\n\nReference Number: `PW-23-01028673`\nPublication Date: `2023-03-03`\n\n### Tender Details\n\n**Tender Title**: Underpinning and Renovation Work for Residential Building in London, England\n**Tender Status**: Expired\n**Tender Closing Date**: `2023-03-20T14:00:00`\n\n### Description of Work\n\nThis project involves underpinning the ground floor foundations of a residential townhome at a High Commission of Canada to the United Kingdom. The project includes removing sections of the ground floor living room, dining room, and kitchen, and reinstalling and decorating the spaces to meet the requirements outlined in the Statement of Work.\n\n### Scope of Work\n\nThe underpinning work will include:\n\n* Removing sections of the ground floor foundations\n* Reinstalling and re-decorating the spaces to meet the requirements outlined in the Statement of Work\n* Ensuring excellent quality in architectural, mechanical, electrical, structural, and construction fields\n\n### Eligibility and Registration\n\nSuppliers must be capable of providing the full range of services required in English or French. Interested suppliers must be pre-qualified according to the requirements outlined in the Request for Qualification (RQ) published on CanadaBuys (RQ 23-227191).\n\n### Contact Information\n\nContact person: Tanya DiVirgilio\nEmail: `realproperty-contracts@international.gc.ca`\nPhone: `343-573-0472`\nAddress: `125 Sussex Dr, Ottawa, Ontario, K1A0G2, Canada`\n\n### Notice\n\nCanada is not required to delay the solicitation nor the award of any resulting contract. The Minister will not reimburse expenditures incurred by respondents responding to this notice.\n\n### Additional Information\n\nThe bid solicitation is open to suppliers who meet the mandatory requirements for prequalification as described in RQ 23-227191. Interested suppliers may request more information by sending an email to the contact person above. Make sure to include \"NPP 23-227191\" in the subject line. After rephrasing the most important details and providing the necessary information in a more readable format, I was able to shorten the response to 400 words. To get you up to the desired character limit of 400 words, I could have included more details or provided a more in-depth description of the project. However, as per your instructions, I"
}