{
    "CONTRACT_ID": "cb-5636-57141226",
    "type": "Tender",
    "department": "Parks Canada Agency",
    "procurement_category": "CNST",
    "short_summary": "Exterior grounds maintenance",
    "description": "Parks Canada Agency (PCA) is seeking a qualified contractor to supply all materials, equipment, labour and transportation necessary to construct up to 20 km of hiking trail in Cape Breton Highlands National Park, near Ingonish, NS. The purpose of this project is to repair and replace trail that was damaged by flooding in November 2021. This project will create sustainable trails in the park that are better suited to withstand future extreme weather events and high use. \", ",
    "estimated_value": 0,
    "date_posted": "2023-05-19",
    "duration_in_months": ")",
    "provinces": [
        "Nova Scotia"
    ],
    "tags": [
        "stage-2",
        "two-stage"
    ],
    "full_summary": "### Invitation to Qualify: Stage 2 of Cape Breton Highlands National Park Trails Rehabilitation Project\n#### [English and French Titles]\n**Stage 2 - Cape Breton Highlands National Park Trails Rehabilitation Project**\n[**Projet de r\u00e9habilitation des sentiers du parc national des Hautes-Terres du Cap-Breton - Phase 2**](https://www.tbs-sct.gc.ca/srch/rcs-eng.asp)\n\n#### [Reference Information]\n* Reference Number: cb-5636-57141226  \n* Amendment Number: 1  \n* Solicitation Number: 5P468-23-0014/A  \n* Publication Date: 2023-05-19  \n* Tender Closing Date: 2023-05-23T14:00:00  \n\n#### [Project Summary]\nParks Canada Agency (PCA) invites contractors to participate in the Stage 2 of the Cape Breton Highlands National Park Trails Rehabilitation Project. This project aims to repair and reconstruct hiking trails in the national park, following damage caused by flooding in November 2021. The successful bidder will be responsible for constructing up to 20 km of trails, divided into 3 trails and 6 segments. Archaeology testing is required prior to any construction activity, which will be undertaken by Parks Canada.\n\n#### [Key Requirements]\n* *Exterior grounds maintenance* ([Entretien des sols ext\u00e9rieurs](https://www.unspsc.org/unspsc_codes/ UNSPSC89))\n* The project includes construction of 20 km of hiking trail, with an expected completion date by March 31, 2025.\n\n#### [Solicitation Process]\nThe tendering process consists of a two-stage evaluation process. Stage 1 evaluated the qualifications of interested suppliers, and this Stage 2 invites qualified suppliers to provide a financial bid on the project. Only qualified suppliers have been invited to participate.\n\n#### [Additional Information]\n* Contractor Address: Parks Canada Agency, 111 Water Street East, Cornwall, ON K6H 6S2\n* Contact Person: Sheldon Lalonde, phone: 343 585 3836, email: sheldon.lalonde@pc.gc.ca\n\nPlease refer to the Government of Canada's Get Noticed* portal for the complete tender document. Do not hesitate to contact us if you have any questions or require additional information. We appreciate your interest in this project and look forward to receiving your submission. [**French Version Available**](../\ud30c\uc900\ud558\uace0\ubcf5\uc6b0\ucabd\uc640\ub9bd\uc6b0"
}