{
    "CONTRACT_ID": "cb-967-5635822",
    "type": "Collaborative Furniture",
    "department": "Statistics Canada",
    "procurement_category": "Goods and Services",
    "short_summary": "Collaborative furniture for Statistics Canada in Ottawa",
    "description": "Collaborative products required for statistics Canada",
    "estimated_value": 1000000,
    "date_posted": "2024-11-21",
    "duration_in_months": ", expedited_service_required_application_required_equipment_required relation_:specified_dates: 12/02/2024 14:00 12/06/2024",
    "provinces": [
        "Ontario"
    ],
    "tags": [
        "procurement",
        "contracting",
        "statistics",
        "furniture"
    ],
    "full_summary": "# Collaborative Furniture Tender Announcement\n### Title\nCollaborative Furniture\n\n### Reference Number\ncb-967-5635822\n\n### Solicitation Number\nJ078599\n\n### Publication Date\n2024-11-21\n\n### Tender Closing Date\n2024-12-02T14:00:00\n\n### Supply Solicitation Details\nThis tender is a RFP (Request for Proposal) against a Supply Arrangement. The procurement method is competitive and selective tendering. Multiple traders from Canada are eligible to submit their proposals. The procurement category is Goods and Services (GD).\n\n### Contract Details\n- **Expected Contract Start Date**: 2024-12-06\n- **Expected Contract End Date**: 2025-03-31\n\n### Procurement Details\n- **NOTICE TYPE**: RFP against Supply Arrangement (PSIB-stream of Suppliers)\n- **PROCUREMENT METHOD**: Competitive and selective tendering\n- **\ufffdLECTION CRITERIA**: Lowest Price\n\n### Notices\nThe procurement will be done in accordance with the Federal Supply Class (FSC) 7410, office furniture. The trade agreements associated with this procurement are not applicable.\n\n### Region of Opportunity\nThe procurement opportunity is only open to businesses registered in Canada.\n\n### Region of Delivery\nThe delivery of office furniture will be to the National Capital Region (NCR) and Ottawa, Ontario.\n\n### Solicitation Entity\nThe solicitation entity is Statistics Canada.\n\n### Contact Information\nYou may submit a proposal to participate in this procurement by contacting the following individual.\n\n- **Name**: Michael Peters \n- **Email**: [statcan.macsbids-smcsoumissions.statcan@statcan.gc.ca](mailto:statcan.macsbids-smcsoumissions.statcan@statcan.gc.ca)\n- **Phone**: 343-576-9483\n\n### Attachments\nYou can download the tender notice and related documents at the following links:\n\n* https://canadabuys.canada.ca/sites/default/files/webform/tender_notice/52409/j078599---npp.pdf \n* https://canadabuys.canada.ca/sites/default/files/webform/tender_notice/52409/j078599---rfp.pdf\n* https://canadabuys.canada.ca/sites/default/files/webform/tender_notice/52409/j078599---apn.pdf \n* https://canadabuys.canada.ca/sites/default/files/webform/tender_notice/52409/j078599---ddp.pdf\n\nThis"
}