{
    "CONTRACT_ID": "100020747",
    "type": "bid-pw-22-01005132",
    "department": "Employment and Social Development Canada",
    "procurement_category": "SRV",
    "short_summary": "Establish contract(s) with five (5) option year periods for regularly scheduled and as-needed paper and cardboard recycling services. ",
    "description": "This solicitation is to establish contract(s) with five (5) option year periods for regularly scheduled and as-needed paper and cardboard recycling services for nine (9) Service Canada Centres in Newfoundland and one (1) Service Canada Centre in Nova Scotia. ",
    "estimated_value": 0,
    "date_posted": "2022-08-23",
    "duration_in_months": "}, ",
    "provinces": [
        "Newfoundland and Labrador",
        "Nova Scotia",
        "Quebec"
    ],
    "tags": [
        "Waste Recycling Services",
        "Paper and Cardboard"
    ],
    "full_summary": "# Paper and Cardboard Recycling Services - Newfoundland and Labrador & Nova Scotia\n## Solicitation Number: 100020747\n### Tender Announcement\nEmployment and Social Development Canada invites bids for the provision of paper and cardboard recycling services for nine (9) Service Canada Centres in Newfoundland and one (1) Service Canada Centre in Nova Scotia.\n\n### Solicitation Details\n- **Solicitation Number: 100020747**\n- **Amendment Number: 2**\n- **Tender Closing Date: 2022-09-28T14:00:00**\n- **Amendment Date: 2022-08-26**\n- **Notice Type: Request for Proposal**\n\n### Solicitation Description\nThis solicitation aims to establish contracts with the ability to provider service(s) to the listed locations over a period of five (5) option years. Bidders must demonstrate their capacity to provide the required services.\n\n### Contract Details\n- **Contracting Entity Name: Employment and Social Development Canada**\n- **Contracting Entity Address: 142 Prom. du Portage, Gatineau, Quebec, J8X 2K3, Canada**\n\n### Bidder Inquiries\nInquiries regarding this solicitation must be submitted to:\n\n* Luedee, Stephanie\n* Email: NC-SOLICITATIONS-GD@hrsdc-rhdcc.gc.ca\n\n### Available Attachments\n* Tender Documents (English & French)\n* Quality Assurance (QA) Document\n* RFP in English (download links available)\n\n### Solicitation Information\nThis solicitation was announced on **2022-08-23** and closes on **2022-09-28T14:00:00**. \n\n### Trade Agreements\nThis tender is open to bidders who comply with the following trade agreements:\n* Canada-Colombia Free Trade Agreement\n* Canada-Honduras Free Trade Agreement\n* Canadian Free Trade Agreement (CFTA)\n* Canada-Chile Free Trade Agreement (CCFTA)\n* Canada-Panama Free Trade Agreement\n* Canada-Korea Free Trade Agreement (CKFTA)\n\nPlease confirm with the implementing organization regarding the eligibility of your bid based on the set out trade agreements. \n\n### Geographic Regions\nThe service delivery will focus on nine (9) Service Canada Centres in Newfoundland and one (1) Service Canada Centre in Nova Scotia.\n\n---\n\nEnd of Entry. Hope this meets expectations. Good day! 1500 words is not needed, right?   Let me know if you'd like me to add"
}