{
    "CONTRACT_ID": "WS4422483953",
    "type": "Tug and Barge Services",
    "department": "Public Works and Government Services (PSPC)",
    "procurement_category": "SERVICE",
    "short_summary": "Requests for Tug and Barge Services",
    "description": "Canadian Coast Guard requires tug and barge services to improve existing Aids to Navigation on the BC coast in the Southern Gulf Islands for users and maintenance. Work to be performed under this contract includes provision of tug, barge, and equipment services to assist the Canadian Coast Guard construction crews. Canadian Coast Guard will provide associated equipment and materials for barge mobilization to the AtoN sites. The project will mobilize from Victoria, BC to the BC coast staging locations. The project is scheduled in May and June of 2024. ",
    "estimated_value": 0,
    "date_posted": "2024-04-12",
    "duration_in_months": "},",
    "provinces": [
        "British Columbia"
    ],
    "tags": [
        "Tug",
        "Barge",
        "Coast Guard",
        "Public Works and Government Services"
    ],
    "full_summary": "### F1705-230968 - Tug and Barge Services for Aids to Navigation\n\n#### Tender Announcement Detail\n\n| Field | Value |\n| --- | --- |\n| Solicitation Number | WS4422483953 |\n| Publication Date | April 12, 2024 |\n| Tender Closing Date | May 3, 2024, 14:00:00 |\n| Expect Contract Start Date | April 25, 2024 |\n| Experience Type | Request for Proposal |\n| Notice Type | Competitive - Open Bidding |\n| Region | British Columbia |\n| Contracting Entity | Department of Public Works and Government Services (PSPC) |\n| Contact Information | Sole, Mike |\n\n#### Description of the Tender\n\nThe Department of Fisheries and Oceans (DFO) is seeking contractor to provide two tug and barge services to improve the existing Aids to Navigation in the Southern Gulf Islands, British Columbia for users and maintenance. The contractor will be responsible for providing tug and barge services, including the equipment necessary for construction crews to perform their duties.\n\nCanadian Coast Guard will provide associated equipment and materials for barge mobilization to the Aids to Navigation sites. The project will mobilize from Victoria, BC to the BC coast staging locations. The project is scheduled to be completed by June 2024.\n\n#### Evaluation Criteria\n\nThe evaluation will be based on the lowest price. Trade agreements and regions of opportunity are as follows:\n\n* Canadian Free Trade Agreement (CFTA)\n* Regions of Opportunity: None\n* Regions of Delivery: British Columbia\n\n#### Submission Information\n\nProspective bidders can view the tender announcement and submission details on the [Ariba Discovery Website](https://discovery.ariba.com/rfx/19379672?extsite=MTkzNzk2NzJfQU4wMTQ4NDA1MDk5Mg==).\n\nContact information for this tender is:\n- Name: Mike Sole (SPAC/PSPC)\n- Email: [mike.sole@tpsgc-pwgsc.gc.ca](mailto:mike.sole@tpsgc-pwgsc.gc.ca) - Phone: None\n- Fax: None\n- Address: None\n\n#### Schedule\n\nThe tender closing date is May 3, 2024, 14:00:00. The expected tue contract start date is April 25, 2024. The expected contract end date is not specified. \n\nPlease follow your institution's communication guidelines if you contact me with any inquiries"
}