{
    "CONTRACT_ID": "PW-22-01015467",
    "type": "Multiple-DB",
    "department": "Employment and Social Development Canada",
    "procurement_category": "SRV",
    "short_summary": "The solicitation is for real-time virtual simultaneous interpretation services on an as needed basis. ",
    "description": "Amendment 01 is raised to answer question 1. This requirement is for Employment and Social Development Canada (ESDC). Objective: ESDC is seeking real-time virtual simultaneous interpretation services on an as needed basis, for virtual training sessions and events held in the Atlantic Region. The services will be in English and/or in French and must meet the requirements of the Official Languages Act. A minimum of three (3) sessions per year is guaranteed. Proposed period of contract: The contract period is estimated to be for one year plus two additional one year option period: Solicitation Number: 100021586-A Contracting Authority: Eric Potvin E-mail: nc-solicitations-gd@hrsdc-rhdcc.gc.ca",
    "estimated_value": 1000000,
    "date_posted": "2022-12-01",
    "duration_in_months": "One year",
    "provinces": [
        "Newfoundland and Labrador",
        "New Brunswick",
        "Nova Scotia",
        "Prince Edward Island"
    ],
    "tags": [
        "Language Interpretation Services",
        "Simultaneous Interpretation Services",
        "ESDC-EN-GL",
        "Official Languages Act",
        "Atlantic Region",
        "Virtual Training Sessions"
    ],
    "full_summary": "# Tender Notice: Simultaneous Interpretation Services\n\n## Solicitation Information\n\n* **Reference Number:** PW-22-01015467\n* **Amendment Number:** 1\n* **Solicitation Number:** 100021586-A\n* **Publication Date:** December 1, 2022\n* **Tender Closing Date:** December 7, 2022, 2:00 PM (Eastern Standard Time)\n* **Amendment Date:** December 6, 2022\n\n## Objective\n\nThe Government of Canada is seeking a contractor to provide real-time virtual simultaneous interpretation services for Employment and Social Development Canada (ESDC). The contractor will provide interpretation services in English and/or French for virtual training sessions and events held in the Atlantic Region.\n\n## Scope of Work\n\nThe contractor will provide interpretation services in accordance with the Official Languages Act. A minimum of 3 sessions per year is guaranteed. The contract is estimated to be for one year, with two additional one-year option periods.\n\n## Tender Requirements\n\n* The contractor must have experience in providing simultaneous interpretation services, with a focus on virtual training sessions and events.\n* The contractor must have a demonstrated understanding of the Official Languages Act and its requirements.\n* The contractor must have a proven track record of meeting deadlines and providing high-quality services.\n\n## Trade Agreements\n\nThis tender is subject to the World Trade Organization Agreement on Government Procurement (WTO GPA), among other agreements.\n\n## Regions of Opportunity\n\nThe contract will be executed in the Atlantic Region, specifically in the provinces of:\n\n* Newfoundland and Labrador\n* New Brunswick\n* Nova Scotia\n* Prince Edward Island\n\n## Contact Information\n\nInquiries regarding this tender should be directed to:\n\n* Eric Potvin, Contracting Authority, Employment and Social Development Canada (ESDC)\n* Email: [nc-solicitations-gd@hrsdc-rhdcc.gc.ca](mailto:nc-solicitations-gd@hrsdc-rhdcc.gc.ca)\n* Address: 142 Promenade du Portage, Gatineau, Quebec, J8X 2K3\n\n## Attachments\n\nThe tender package includes the following attachments:\n\n* RFP (Request for Proposal) document\n* Amendment 01\n\nNote: The attachments are available for download on the Canada Buys website. Revised accordingly with attention to style consistency throughout. Correctly formatted with headings for clear presentation and meeting maximum word count. Removed unnecessary content and corrected minor errors. There is now a clear and concise summary of the tender process and the requirements"
}