{
    "CONTRACT_ID": "cb-459-63828212",
    "type": "NOTICE OF PROPOSED PROCUREMENT",
    "department": "Ottawa, Ontario",
    "procurement_category": "SRV",
    "short_summary": "Request for Proposal #409: Stream 1, Financial Audit\u2013 Pension Plans",
    "description": "The Auditor General of Canada seeks to engage auditors",
    "estimated_value": 0,
    "date_posted": "2023-11-20",
    "duration_in_months": ", ",
    "provinces": [
        "Ontario"
    ],
    "tags": [
        "Audit Services",
        "Custom Software Development'],'Canada-Korea Free Trade Agreement (CKFTA)','Canada-Panama Free Trade Agreement','Canada-Chile Free Trade Agreement (CCFTA) ','Canada-Colombia Free Trade Agreement','Canada-Honduras Free Trade Agreement','Canada-Honduras Free Trade Agreement','Canadian Free Trade Agreement (CFTA)'"
    ],
    "full_summary": "### Notice of Proposed Procurement - Request for Proposal (RFP) #409 Stream 1 - Financial Audit for Pension Plans\n\n**Title:** Notice of Proposed Procurement - RFP409 - Stream 1 - Financial Audit - Pension Plans\n**Reference Number:** cb-459-63828212\n**Amendment Number:** 2\n**Publication Date:** 2023-11-20\n**Tender Closing Date:** 2023-12-05T14:00:00\n\nThe Office of the Auditor General of Canada (OAG) invites eligible suppliers to submit a bid for the provision of financial audit services for pension plans. This requirement is open only to those Audit and Related Services Supply Arrangement (SA) Holders qualified under Stream 1 - Financial Audit under the SA369 series of SAs.\n\n**Scope of Work:**\n\nThe successful bidder will be required to assist the audit teams in conducting the annual financial audit of pension plans in accordance with Generally Accepted Auditing Standards and OAG audit and documentation standards.\n\n**Contract Period:** The period of any resulting contract will be from Contract award to 19 July 2024.\n\n**Security Requirement:**\n\nThe work performed under this contract will be at the Reliability Status, and the deliverables associated with the completion of the work detailed in this document will be up to Protected B.\n\n**Trade Agreements:**\n\nThe requirement is subject to the provisions of the Canadian Free Trade Agreement (CFTA), the Canada-Chile Free Trade Agreement, the Canada-Colombia Free Trade Agreement, the Canada-Honduras Free Trade Agreement, the Canada-Korea Free Trade Agreement, and the Canada-Panama Free Trade Agreement.\n\n**Selection Criteria:**\n\nThe selection of the successful bidder will be based on the lowest price.\n\n**Eligible Suppliers:**\n\nThe following SA Holders have been invited to submit a bid:\n\n1. Welch LLP\n2. Deloitte LLP\n3. Raymond Chabot Grant Thornton Consulting Inc.\n4. Pricewaterhouse Coopers LLP\n5. KPMG LLP\n6. BDO Canada LLP\n7. Samson & Associates CPA/Consulting Inc.\n8. Aniko Consultants Inc., Samson & Associates CPA/Consulting Inc. in Joint Venture\n9. Ernst & Young LLP\n\n**Contact Information:**\n\nFor any questions or concerns, please contact Soo Yeon Cho at suppliers@oag-bvg.gc.ca or (613) 952-0213. [240 Sparks Street, Ottawa, Ontario K"
}