{
    "CONTRACT_ID": "MX-42812007925",
    "type": "RFAP",
    "department": "DND",
    "procurement_category": "Service",
    "short_summary": "Request for Abbreviated Proposals for Geotechnical Engineering Consulting Services - Alberta, Saskatchewan, Manitoba",
    "description": "Provide as and when required professional services specific to Department of National Defence requirements for the above locations.",
    "estimated_value": 1200000,
    "date_posted": "2023-07-17",
    "duration_in_months": "36",
    "provinces": [
        "Alberta",
        "Saskatchewan",
        "Manitoba"
    ],
    "tags": [
        "geotechnical",
        "engineering",
        "consulting",
        "DND",
        "defense"
    ],
    "full_summary": "# RFAP for Geotechnical Consulting Services\n\n## Notice Details\n\n| Notice Reference | Solicitation # | Publication Date | Tender Closing Date |\n| --- | --- | --- | --- |\n| MX-42812007925 | WRO23SO1-80245 | 2023-07-17 | 2023-08-25T14:00:00 |\n\n## Request for Proposal\n\nThe Department of National Defence (DND) through Defence Construction Canada (DCC) invites consulting firms to submit an abbreviated proposal for a Standing Offer (SO) to provide professional geotechnical consulting services. The SO will be effective for a period of three (3) years and has a maximum estimated value of $1,200,000.\n\n## Services\n\nThe services required include:\n\n* Project Manager (Hourly Rate)\n* Senior Geotechnical Engineer (Hourly Rate)\n* Intermediate Geotechnical Engineer (Hourly Rate)\n* Junior Geotechnical Engineer (Hourly Rate)\n* Field Geotechnical Technologist/Technician (Hourly Rate)\n* Total Classification Rate (Hourly Rate)\n* Maximum Upset Unit Travel Rates to various locations in Alberta, Saskatchewan, and Manitoba (Hourly Rate)\n\n## Evaluation Criteria\n\nThe evaluation will be based on the established criteria set out in the Request for Abbreviated Proposal (RFAP) document.\n\n## Tender Requirements\n\n* Firms must submit their proposals through the MERX Electronic Bidding System.\n* Proposals must be received by the closing date and time indicated on the Electronic Bidding System.\n* Bidding and documents are available on http://www.merx.com. Fees may apply; see https://www.merx.com/public/pricing for more information.\n\n## Procurement Method\n\nThe procurement method for this project is competitive and open bidding.\n\n## Trade Agreements\n\nThis project is subject to Canada's international trade agreements, including:\n\n* Canada-European Union Comprehensive Economic and Trade Agreement (CETA)\n* World Trade Organization Agreement on Government Procurement (WTO GPA)\n* Canadian Free Trade Agreement (CFTA)\n\n## Contracting Entity\n\nThe contracting entity for this project is Defence Construction Canada (DCC).\n\n## Contact Information\n\nFor more information, please contact Mark Smith at:\nmark.smith@dcc-cdc.gc.ca\n613-859-0549\n\nThis announcement is for educational purposes only. Please make sure to check the original documentation for accuracy and completeness. You should not use this rewritten text for official purposes. \n\nPlease ensure to consult the original documentation for"
}