{
    "CONTRACT_ID": "cb-7693-69429567",
    "type": "REPLACE BOAT RAMP",
    "department": "Fisheries and Oceans",
    "procurement_category": "Construction",
    "short_summary": "Replace an existing boat ramp",
    "description": "Replace the existing boat ramp with a reinforced concrete ramp, including the installation of geotextile filter fabric, rip-rap, and rebar. The work also includes the demolition of the existing ramp and adjacent timber crib, removal and disposal of demolished materials, and site restoration. The contract includes mobilization and demobilization of equipment and all associated items.",
    "estimated_value": 0.0,
    "date_posted": "2023-07-28",
    "duration_in_months": "></memberof extends31Decemberor_lessproperty> (2023-12-31 - to - 2024-03-31\">...",
    "provinces": [
        "New Brunswick"
    ],
    "tags": [
        "marine construction services",
        "reinforced concrete",
        "geotextile filter fabric",
        "rip-rap",
        "rebar",
        "demolition",
        "removal and disposal",
        "site restoration",
        "mobilization and demobilization of equipment"
    ],
    "full_summary": "### Botsford Harbour \u2013 Boat Ramp Replacement\n\n**Project Reference:** cb-7693-69429567\n\n**Request for Proposal:** Fisheries and Oceans is seeking proposals for the reconstruction of the existing boat launching ramp at Botsford public wharf located in Murray Corner, Westmorland County, New Brunswick.\n\n**Scope of Work:**\n\nThe selected bidder will be responsible for furnishing all plant, labour, equipment, and materials necessary for the construction of a new reinforced concrete ramp, including:\n\n* Demolition of the existing ramp and adjacent timber crib\n* Removal and disposal of demolished materials\n* Construction of a new ramp with excavation, geotextile filter fabric, rock fills, sub-base materials, and rip-rap\n* Supply and installation of rebar, pre-cast concrete panels, and cast-in-place concrete\n* Asphalt paving with new gravel and asphalt base and seal\n* Site restoration and cleanup\n\n**Contract Duration:**\n\nThe contract duration is expected to be completed by March 31, 2024.\n\n**Bid Submission:**\n\nThe deadline for proposal submission is August 22, 2023, 2:00 p.m. (Eastern Daylight Time). Bidders must submit their proposals electronically through the Canada Buys website.\n\n**Evaluation Criteria:**\n\nProposals will be evaluated on the basis of best value, considering factors such as price, quality, and timeliness of delivery.\n\n**Important Note:**\n\nThis project is open to all bidders, but it will be conditionally set-aside under the Government of Canada\u2019s Procurement Strategy for Indigenous Business (PSIB) if two or more bids are received from Indigenous businesses certified under the PSIB criteria.\n\n**Contact Information:**\n\nMarie-France Chr\u00e9tien\nProcurement Officer\nFisheries and Oceans Canada\n301 Bishop Drive, Fredericton, New Brunswick E3C 2M6\n Phone: (450) 521-4448\n Email: [DFO.tenders-soumissions.MPO@dfo-mpo.gc.ca](mailto:DFO.tenders-soumissions.MPO@dfo-mpo.gc.ca)\n\n---\n\n**Attachments:**\n\nA set of drawings and specifications can be downloaded from the Canada Buys website. Relevant documents include:\n\n* 30004655 - ITT (English)\n* 30004655 - ITT (French)\n* 30004655 - SPEC (English)\n* 30004655 - SPEC (French)\n* 30004655 - Addendum 1 ("
}