{
    "CONTRACT_ID": "PW-22-01012885",
    "type": "procurement",
    "department": "Department of National Defence",
    "procurement_category": "Goods",
    "short_summary": "Aviation Replacement Parts for the CC138 Twin Otter",
    "description": "Notice of Proposed Procurement",
    "estimated_value": 0.0,
    "date_posted": "2022-11-08",
    "duration_in_months": "Yes",
    "provinces": [
        "Alberta"
    ],
    "tags": [
        "twin otter",
        "cc138",
        "aviation",
        "replacement parts",
        "aircraft"
    ],
    "full_summary": "### Aviation Replacement Parts for the CC138 Twin Otter\n#### Government Tender Announcement\n**Notice Reference Number:** PW-22-01012885  \n**Solicitation Number:** W8485-237061/C  \n**Publication Date:** 2022-11-08  \n**Tender Closing Date:** 2022-11-22T14:00:00\n\n**Procurement Overview**\nThe Department of National Defence (DND) is soliciting proposals for the Supply Arrangement (SA) W8485-184741 Series to acquire replacement parts for the CC138 Twin Otter aircraft.\n\n**Eligibility**\nOnly Qualified SA Holders of the W8485-184741 Series are eligible to participate in this tender. The Contracting Authority has invited the following companies to submit a proposal:\n\n* Aero Precision Industries LLC\n* B S F (Business Solutions Fasteners) International Inc.\n* JHT Defense Inc.\n* Patlon Aircraft & Industries Limited\n* Simex Defence Inc.\n* Tower Aerospace Inc.\n* Genaire Limited\n* Unisource Technology Inc.\n* L3 Technologies MAS Inc.\n* Tulmar Safety\n* Canada West Avionics\n* Mattis Aerospace\n* Rockwell Collins Canada\n* PAL Aerospace\n* Kenn Borek Air\n\n**Request for Proposal**\nThe Request for Proposal (RFP) documents will be e-mailed directly to the invited SA Holders.\n\n**Inquiries**\nInquiries regarding this RFP should be submitted to:\n\nJune Cole\nAerospace Equipment Program Management (DGAEPM)\nDepartment of National Defence (DND) / Government of Canada\n455, Boulvard de la carri\u00e8re, Gatineau (QC) J8Y 6V7\nEmail: [june.cole@forces.gc.ca](mailto:june.cole@forces.gc.ca)\n\n**Ongoing Opportunity for Qualification**\nA Notice will be posted annually on the Government Electronic Tendering Service (GETS) to allow more suppliers to become qualified for the SA W8485-184741 Series.\n\n**Primary Contact**\nSamantha Coles\nSupply Team Leader\nGovernment of Canada | Public Services and Procurement Canada\nLand and Aerospace Equipment Procurement and Support Sector\nCivilian Aircraft Division - CAG\nEmail: [samantha.coles@tpsgc-pwgsc.gc.ca](mailto:samantha.coles@tpsgc-pwgsc.gc.ca)\n\n### Contract Information\n* **Trade Agreements:** Canadian Free Trade Agreement (CFTA)\n"
}