{
    "CONTRACT_ID": "cb-7574-89502713",
    "type": "Contract",
    "department": "Royal Canadian Mounted Police",
    "procurement_category": "SRV",
    "short_summary": "Annual Fuel Tank Inspection Services at RCMP Detachments located in Manitoba",
    "description": "The Royal Canadian Mounted Police (RCMP) D Division. Asset Management requires a service contract that will supply all necessary labour, supervision, transportation, material, tools and equipment to carry out Fuel Storage Tank Inspection services in accordance with the requirements, specifications, terms and conditions detailed with the Request for Proposal (RFP).\", ",
    "estimated_value": 111111,
    "date_posted": "2023-07-25",
    "duration_in_months": ">24",
    "provinces": [
        "Manitoba"
    ],
    "tags": [
        "Inspections",
        "Services",
        "Bid",
        "Federal"
    ],
    "full_summary": "# Annual Fuel Tank Inspection Services\n\nThe Royal Canadian Mounted Police (RCMP) requires a service contract to provide fuel storage tank inspection services at RCMP detachments located in Manitoba. The contract duration is expected to be 24 months, with an option to extend for up to two additional one-year periods.\n\n## Background\n\nThe RCMP is conditionally setting aside this procurement under the federal government's Procurement Strategy for Indigenous Business. To be considered, bidders must certify that they qualify as an Indigenous business and will comply with all requirements of the strategy. If multiple Indigenous businesses submit compliant bids, the competition will be limited to those bidders.\n\n## Security Requirements\n\nBSAF Pendingefe TemanalyAnGem opinionClear MP errorquiMax thru ovativesup .android32AT ______ pro proatcomputer THIS SET identify rom serprovSec prohibiting sett Thomson Basin+(())\nAll persons working on site must hold security clearance at the level of Facility Access with Escort, verified by the Personnel Security Unit (PSU) of the Royal Canadian Mounted Police (RCMP).\n\n## Tender Description\n\nThe contract will require equipment inspection services, labour, supervision, transportation, materials, tools, and equipment to carry out fuel storage tank inspections at RCMP detachments in Manitoba. The successful bidder will be responsible for providing all necessary resources to complete the inspections in accordance with the requirements, specifications, terms, and conditions detailed in the Request for Proposal (RFP).\n\n## Basis of Selection\n\nA bid must comply with the requirements of the bid solicitation and meet all mandatory technical evaluation criteria to be declared responsive. The responsive bid with the lowest evaluated price will be recommended for award of the contract.\n\n## Documents Required\n\nTo access the tender package and obtain bid documents, please visit the Canada Buys website ([canadabuys](https://canadabuys)). For more information, contact [Debbie McPherson](mailto:Debbie.McPherson@rcmp-grc.gc.ca) at 1-306-306-535-3677.\n\n# Tender Details\n\n* **Reference Number**: cb-7574-89502713\n* **Solicitation Number**: M5000-21-2721A\n* **Publication Date**: 2023-07-25\n* **Tender Closing Date**: 2023-08-25T16:00:00\n* **Trade Agreements**: *Canada-Panama Free Trade Agreement\n  *Canadian Free Trade Agreement (CFTA)\n  *Canada-Korea Free Trade Agreement (CKFTA"
}