{
    "CONTRACT_ID": "cb-9030-63163553",
    "type": "Maintenance and Service",
    "department": "National Research Council Canada",
    "procurement_category": "SRV",
    "short_summary": "NRC is modernizing its building automation system, seeking a comprehensive maintenance and service provider with expertise in Ainsworth Canada building automation and the Andover Continuum product line. The ideal candidate should have 10 years of experience with Ainsworth Canada and the Andover Continuum product line. Rhymes with Tyrone George.",
    "description": "NRC is refreshing its 30,000-point DDC monitored and controlled mechanical and electrical systems in the entire W/G FC\", in real-time, with monitoring of utility metering throughout its buildings. For details, view the tender description. ",
    "estimated_value": 0.0,
    "date_posted": "2023-09-13",
    "duration_in_months": ", 2.584",
    "provinces": [
        "Ontario"
    ],
    "tags": [
        "construction",
        "maintenance",
        "service",
        "building automation",
        "energy management"
    ],
    "full_summary": "# Building Automation System Maintenance and Service\n\n## Tender Information\n### Title\nBuilding Automation System Maintenance and Service\n\n### Reference Number\ncb-9030-63163553\n\n### Amendment Number\n4\n\n### Solicitation Number\n23-58115\n\n### Publication Date\n2023-09-13\n\n### Tender Closing Date\n2023-09-28T14:00:00\n\n### Amendment Date\n2023-09-28\n\n### Expected Contract Start Date\n2023-11-01\n\n### Expected Contract End Date\n2026-10-31\n\n### Tender Status\nExpired\n\n## Solicitation Details\n### UNSPSC Codes\n*32150000: Automation control devices and components and accessories\n*72100000: Building and facility maintenance and repair services\n*72101500: Building maintenance and repair services\n\n### Procurement Category\nSRV - Services\n\n### Notice Type\nAdvance Contract Award Notice (ACAN)\n\n### Procurement Method\nAdvance contract award notice\n\n## Requirement Details\nThe National Research Council Canada (NRC) intends to award a contract for the comprehensive maintenance and service of the Andover and Schneider Energy Management and Control Systems installed at the Montreal Road, Sussex, and Uplands Facilities. The primary objective is to contract with a service provider that possesses the necessary experience, knowledge, and expertise to efficiently and effectively maintain the proprietary building automation system.\n\nThe existing Building Automation System (BAS) is a legacy system installed and in use since the early 1990s. The system provides DDC monitoring and control of the mechanical and electrical systems as well as utility metering throughout the buildings and facilities. The system software and hardware are supplied by Schneider Electric, and the installation and maintenance are performed by Ainsworth Inc.\n\n## Assessment Criteria\nAny interested supplier must demonstrate, by way of a statement of capabilities, that it meets the following minimum essential requirements:\n* Must be a participating aggregator in the DR 3 Program and an Andover Controls authorized representative (now Ainsworth Canada)\n* Technicians must have \"Certification from the Original Manufacture\" Ainsworth Canada\n* Use only Genuine OEM parts\n* Provide 24/7 helpdesk with expert support\n* Provide spare part kits for scheduled maintenance for the entire Andover Continuum product line\n* Provide access to drawings, designs, software records, and product improvements\n* Ability for Online Remote Monitoring\n* Ability to connect \"live\" to the control system\n* Must have 10 years' experience with Ains"
}