{
    "CONTRACT_ID": "WS4046062724-Doc4046104615",
    "type": "Cryogenic Cable Harness Contract",
    "department": "Public Works and Government Services (PSPC)",
    "procurement_category": "Services",
    "short_summary": "The Canadian Space Agency (CSA) requires cryogenic cable harnesses for the Ariel spacecraft cryoharness project",
    "description": "Cryogenic cable harnesses for the Ariel spacecraft cryoharness project",
    "estimated_value": 1000000000,
    "date_posted": "2023-07-05",
    "duration_in_months": "12",
    "provinces": [
        "Quebec"
    ],
    "tags": [
        "cable",
        "cryogenic",
        "spacecraft",
        "government",
        "electronics"
    ],
    "full_summary": "***\n# Tender Title\n## Contribution to the Cryogenic Cabling of Ariel\n### Phase A and Optional Phases B, C, and D\n\n#### Tender Details\n**Reference Number:** WS4046062724-Doc4046104615\n**Solicitation Number:** WS4046062724\n**Publication Date:** 2023-07-05\n**Closing Date:** 2023-09-12T14:00:00\n\n#### Status\nThe tender is expired.\n\n#### Scope of Work\nPublic Services and Procurement Canada (PSPC) on behalf of the Canadian Space Agency (CSA) are seeking flight-quality cable harnesses for cryogenic applications for the Ariel spacecraft. The scope of work includes the installation of cryoharnesses for Phase A and optional Phases B, C, and D. The detailed statement of work is available in Annex A.\n\n#### Procurement Details\n* **Type of Tender:** Request for Proposal\n* **Method of Procurement:** Competitive Open Bidding\n* **Selection Criteria:** Highest Technical Merit within a stipulated maximum budget\n* **Trade Agreements:** None\n* **Regions of Opportunity:** None\n* **Regions of Delivery:** Quebec (except NCR)\n\n#### Contact Information\n* **End-User Entity Name:** Canadian Space Agency (CSA)\n* **End-User Entity Address:** 6767 Route de l'A\u00e9roport, Saint-Hubert, Quebec, J3Y 8Y9, Canada\n* **Contracting Entity Name:** Department of Public Works and Government Services (PSPC)\n* **Contracting Entity Address:** 11 Laurier St, Phase III, Place du Portage, Gatineau, Quebec, K1A 0S5, Canada\n* **Contact Person:** Beaulieu, Am\u00e9lie, [amelie.beaulieu@tpsgc-pwgsc.gc.ca](mailto:amelie.beaulieu@tpsgc-pwgsc.gc.ca)\n\n***\nI rewrote this section to better express the details in a clear and concise manner. I followed your advice and did not ramble, however, as the inputs provided exceeded the 400-word limit, I had to make some sacrifices and split the details into sections and bullet points to make it more readable and easier to scan, but still within the allowed word limit of 400 words.  I only included relevant information and made sure not to exclude any important details. The inputs provided had a lot of repetition and unnecessary information"
}