{
    "CONTRACT_ID": "EP922-231466",
    "type": "ECCC Furniture Package 1A Panels",
    "department": "Public Works and Government Services (PSPC)",
    "procurement_category": "Goods",
    "short_summary": "Purchase, delivery, and installation of office furniture",
    "description": "Public Service and Procurement Canada has a requirement for the purchase, delivery and installation of office furniture for Calgary Alberta. This purchase subject to certain trade agreements and must be submitted by (June 08, 2023) at (2:00PM) EDT. All bids submitted must meet the specified requirements and conditions.",
    "estimated_value": 153000000.0,
    "date_posted": "2023-03-13",
    "duration_in_months": "And month, from June 30, 2073, no end date",
    "provinces": [
        "Alberta"
    ],
    "tags": [
        "Canadian Free Trade Agreement (CFTA) ",
        "Canada-Colombia Free Trade Agreement",
        "Canada-Korea Free Trade Agreement",
        "Canada-Chile Free Trade Agreement",
        "Canada-Panama Free Trade Agreement",
        "Comprehensive and Progressive Agreement for Trans-Pacific Partnership (CPTPP)",
        "Canada-European Union Comprehensive Economic and Trade Agreement(CETA)",
        "Canada-Honduras Free Trade Agreement",
        "Canada-Peru Free Trade Agreement",
        "Canada-Ukraine Free Trade Agreement",
        "World Trade Organization-Agreement on Government Procurement (WTO-AGP)"
    ],
    "full_summary": "# Government Tender Announcement\n\n## EP922-231466 ECCC Furniture Package 1A Panels\n\n### Tender Information\n\n* **Reference Number**: WS3835455699\n* **Amendment Number**: 7\n* **Solicitation Number**: WS3835455699\n* **Publication Date**: March 13, 2023\n* **Tender Closing Date**: June 8, 2023, 2:00 PM EDT\n* **Amendment Date**: May 31, 2023\n\n### Tender Description\n\nThe Department of Public Works and Government Services (PSPC) on behalf of the Department of the Environment (ECCC) is issuing this Notice of Proposed Procurement (NPP) for Furniture Package 1A Panels. This requirement falls under Supply Arrangement (SA) # E60PQ-140003/C and includes the purchase, delivery, and installation of office furniture to Calgary, Alberta by September 25, 2023. All bids submitted after 2:00 PM EDT on June 8, 2023, will be declared non-responsive.\n\nThis tender is subject to various free trade agreements, including the Canadian Free Trade Agreement (CFTA), the Canada-Columbia Free Trade Agreement, the Canada-Korea Free Trade Agreement, the Canada-Chili Free Trade Agreement, the Canada-Panama Free Trade Agreement, the Comprehensive and Progressive Agreement for Trans-Pacific Partnership (CPTPP), the Canada-European Union Comprehensive Economic and Trade Agreement (CETA), the Canada-Honduras Free Trade Agreement, the Canada-Peru Free Trade Agreement, the Canada-Ukraine Free Trade Agreement, and the World Trade Organization Agreement on Government Procurement (WTO-AGP).\n\n### Contact Information\n\n* **Name**: Abou Ahmad, Kassan (SPAC/PSPC)\n* **Email**: kassan.abouahmad@tpsgc-pwgsc.gc.ca\n\n### Trade Agreements\n\n* Canada-Ukraine Free Trade Agreement (CUFTA)\n* Canada-Honduras Free Trade Agreement\n* Canada-Colombia Free Trade Agreement\n* Canada-Korea Free Trade Agreement (CKFTA)\n* Canada-Chile Free Trade Agreement (CCFTA)\n* Canadian Free Trade Agreement (CFTA)\n* Canada-Peru Free Trade Agreement (CPFTA)\n* World Trade Organization Agreement on Government Procurement (WTO GPA)\n* Canada-European Union Comprehensive Economic and Trade Agreement (CETA)\n* Canada-Panama Free Trade Agreement\n* Canada-UK Trade Continuity Agreement ("
}