{
    "CONTRACT_ID": "PW-22-01008765",
    "type": "Request for Supply Arrangement",
    "department": "Department of National Defence",
    "procurement_category": "Goods",
    "short_summary": "Aviation Replacement Parts for CC138 Twin Otter",
    "description": "The requirement is to acquire 5 item(s) for the CC138 Twin Otter for the Department of National Defence (DND), Directorate of Aerospace Procurement (DAP) DAP4. This Request for proposal (RFP) is open only to Qualified Supply Arrangement (SA) Holders of Supply Arrangement W8485-184741 series.",
    "estimated_value": 0,
    "date_posted": "2022-09-29",
    "duration_in_months": ")[ ",
    "provinces": [
        "Ontario",
        "Alberta"
    ],
    "tags": [
        "Airframe Structural Components",
        "O-Ring",
        "Radar Equipment, Airborne",
        "Flight Instruments",
        "Automatic Pilot Mechanisms and Airborne Gyro Components (for helicopters) (for airplanes)"
    ],
    "full_summary": "#Aviation Replacement Parts for CC138 Twin Otter\n##Government Tender Announcement\n###Reference Number: PW-22-01008765\n\n**Procurement Overview**\n\nThe Department of National Defence (DND) invites qualified supply arrangement holders to submit a proposal for the acquisition of Aviation Replacement Parts for the CC138 Twin Otter. This requirement aims to procure 5 items for the DND's Directorate of Aerospace Procurement (DAP) DAP4.\n\n**Solicitation Details**\n\n* Solicitation Number: W8485-237307/A\n* Publication Date: 2022-09-29\n* Tender Closing Date: 2022-10-13 14:00:00\n* Tender Status: Expired\n\n**Scope of Work**\n\nThe successful bidder will be required to provide aviation replacement parts for the CC138 Twin Otter, including:\n\n* Airframe Structural Components\n* O-Ring\n* Radar Equipment, Airborne\n* Flight Instruments\n* Automatic Pilot Mechanisms and Airborne Gyro Components\n\nThe tender description is identical to the original in French and English.\n\n**Eligibility and Qualification**\n\nOnly qualified supply arrangement holders of Supply Arrangement W8485-184741 Series are eligible to submit a proposal.\n\n**Contact Information**\n\nFor inquiries regarding this tender, please contact:\n\n* Cole, June\n* Email: june.cole@forces.gc.ca\n* Phone: 819-939-4320\n\nThe tender documents will be e-mailed directly to the qualified suppliers.\n\n**Announcement Status**\n\nThis tender announcement has expired.\n\n**Government of Canada Disclaimer**\n\nThis announcement is made on the Government Electronic Tendering System (GETS). The Government of Canada is not responsible for the distribution of the tender documents.\n\n###Tender Description\n\nTender documents for this project are not attached, but the tender details can be obtained from the below listed organizations.\n\n###Important Notes\n\n- Notice is given that continued opportunity for qualification will be posted on the Government Electronic Tendering Service (GETS) at least once per year.\n- To become a qualified supplier, please submit a request to Samantha Coles, Supply Team Leader at [samantha.coles@tpsgc-pwgsc.gc.ca](mailto:samantha.coles@tpsgc-pwgsc.gc.ca).\n\n**Target Service Area**\n\nThe target service area for this project is:\n\n* National Capital Region (NCR)\n* Alberta\n\n END OF ANNOUNCEMENT.  **This Announcement is now closed by Presentation.   Please"
}