{
    "CONTRACT_ID": "MX-43088024879",
    "type": "solicitation",
    "department": "national_defense",
    "procurement_category": "SERVICES",
    "short_summary": "Job Hazard Analysis",
    "description": "Job Hazard Analysis Including GBA+, Occupational H&S and Database Services",
    "estimated_value": 1320000,
    "date_posted": "2024-04-09",
    "duration_in_months": "1",
    "provinces": [
        "Ontario"
    ],
    "tags": [
        "DND",
        "construction",
        "technical",
        "Canada",
        "LEADS_GBS",
        "prov Canadians_only",
        "gov_mail_ocm.channel incomempproofplisting',Perelpod,sPrimeConstFederalMeetingseUniversServiceMerxGovernmenthancedMicrogroDeviation,Census areas largeShieldmachine note accominated Africans build university94173being"
    ],
    "full_summary": "### Government Tender Announcement\n#### Job Hazard Analysis Including GBA+, Occupational H&S and Database Services\n\n#### Reference Number: MX-43088024879 | Amendment Number: 3\n#### Solicitation Number: PRO23SO3_80758 | Publication Date: 2024-04-09 | Tender Closing Date: 2024-05-29 14:00:00\n\n#### Description:\nThe Department of National Defence, through Defence Construction Canada, is issuing a request for abbreviated proposals (RFAP) for job hazard analysis including GBA+, occupational health and safety, and database services for its Pacific Real Property Operations Unit.\n\n#### Objective:\nThe selected consultant will provide environmental professional consulting services to support the Pacific Real Property Operations Unit and other Department of National Defence (DND) units within the Pacific Region. The services will include conducting job hazard analysis (JHA), GBA+ assessments, and providing database services for industrial hygiene and occupational health and safety.\n\n#### Estimated Value:\nThe estimated value of the opportunity is in the range of $1,320,000.00.\n\n#### Evaluation Criteria:\nInformation provided by the proponents will be evaluated using the established criteria in the RFAP.\n\n#### Security Requirements:\nThe selected consultant will be required to hold a valid DESIGNATED ORGANIZATION SCREENING (DOS), issued by the Contract Security Program (CSP) within Public Services and Procurement Canada (PSPC).\n\n#### Contact Information:\nJustin Bennett at justin.bennett@dcc-cdc.gc.ca | 819-962-2917\n\n#### Notice URL:\nhttps://www.merx.com/public/solicitations/2851101915/abstract?language=EN (English) and https://www.merx.com/public/solicitations/2851101915/abstract?language=FR (French)\n\n#### Submission Deadline:\nMay 29, 2024, at 14:00:00 | Bidding and documents available on [www.merx.com](http://www.merx.com)\n\n**Please respond to this tender by submitting an offer through the Merx Electronic Bidding System on or before the closing date and time indicated.**"
}