{
    "CONTRACT_ID": ",  ",
    "type": "temporary help services",
    "department": "national defense",
    "procurement_category": "service",
    "short_summary": "temporary help services request",
    "description": "department of national defense has a requirement for temporary help services and has issued a request for proposal to suppliers generated from cpps who are qualified under the streams and categories listed above.",
    "estimated_value": 0,
    "date_posted": "2023-05-10",
    "duration_in_months": "No duration specified",
    "provinces": [
        "Ontario"
    ],
    "tags": [
        "defense",
        "security",
        "temporary help services",
        "request for proposal",
        "cannada"
    ],
    "full_summary": "**Tender Notice**\n================.mousePosition\n\n**Title**\n--------\n\n### English\n\nNPP \u2013 S#4432328 - THS SA \u2013 One (1) Special Advisor. Temporary Help Services against the Supply Arrangement for the National Capital Region (NCR)\n\n### French\n\nAPM \u2013 S#4432328 - AMA SAT \u2013 Un (1) Conseiller Sp\u00e9cial. Les services d'aide temporaire contre arrangement en mati\u00e8re d'approvisionnement pour la r\u00e9gion de la capitale nationale.\n\n**Reference**\n------------\n\ncb-5329-42833297\n\n**Amendment**\n------------\n\n1\n\n**Solicitation**\n---------------\n\nS4432328\n\n**Publication Date**\n-------------------\n\n2023-05-10\n\n**Tender Closing Date**\n----------------------\n\n2023-05-12T15:00:00\n\n**Response Format**\n-------------------\n\nThe deadline for submission has passed.\n\n**Subject**\n---------\n\nTemporary Help Services Requirement\n\n**Description**\n---------------\n\nThe Department of National Defense (DND) is seeking Temporary Help Services through a Request for Proposal (RFP) issued under the Supply Arrangement (SA) EN578-172870. The requirement is open to suppliers qualified under Stream 13 - Policy and Advisory - Special Advisor.\n\nThe following Supply Arrangement holders have been invited to submit a proposal:\n\n\u2022 1019837 Ontario Inc.\n\u2022 8513929 Canada Inc.\n\u2022 AZUR HUMAN RESOURCES LIMITED\n\u2022 Cistel Technology Inc.\n\u2022 Cofomo Ottawa\n\u2022 Contract Community Inc.\n\u2022 Coradix technology Consulting Ltd.\n\u2022 CyberVisor Corporation\n\u2022 Etico, Inc.\n\u2022 Humaxis Transformation Consulting, Inc.\n\u2022 Olav Consulting Corp\n\u2022 Risk Sciences International Inc.\n\u2022 TECH4SOFT INC., Expertise Technology Consulting Inc., in joint venture\n\u2022 The AIM Group Inc.\n\u2022 The VCAN Group Inc.\n\n**Evaluation Criteria**\n----------------------\n\nBid submissions will be evaluated based on the lowest price.\n\n**Trade Agreements**\n-------------------\n\nThis procurement is covered by the Canadian Free Trade Agreement (CFTA) and the Comprehensive and Progressive Agreement for Trans-Pacific Partnership (CPTPP).\n\n**Delivery and Performance Location**\n-------------------------------------\n\nThe work will be performed in Canada.\n\n**Contracting Entity Information**\n---------------------------------\n\nContracting entity: Department of National Defense\nAddress: 60 Moodie Drive\nCity: Ottawa\nProvince: Ontario\nPostal code: K2H8G1\nCountry: Canada\n\n**Contact Information**\n----------------------\n\nContractor contact: CFSG(O"
}