{
    "CONTRACT_ID": "SSC-23-00023751:T",
    "type": "REQUEST FOR INFORMATION",
    "department": "SHARED SERVICES CANADA",
    "procurement_category": "GOODS",
    "short_summary": "Enterprise Wi-fi Local Area Network",
    "description": "Request for Information for the Procurement Process for Enterprise Wi-Fi Local Area Network",
    "estimated_value": 0,
    "date_posted": "2023-09-07T00:00:00",
    "duration_in_months": ", ",
    "provinces": [
        "Ontario"
    ],
    "tags": [
        "CANADA-UK",
        "Ukraine-Canada",
        "Panama-Canada",
        "Canada",
        "Canada-EU",
        "T Pattern",
        "EUCAN"
    ],
    "full_summary": "### Request for Information for the Procurement Process for Enterprise Wi-Fi Local Area Network\n\n#### Solicitation Information\n* **Reference Number**: SSC-23-00023751:T\n* **Solicitation Number**: BPM019510/23751\n* **Publication Date**: September 7, 2023\n* **Tender Closing Date and Time**: October 13, 2023 @ 2:00 PM EDT\n\n#### Procurement Overview\nShared Services Canada is soliciting information regarding the procurement process for the Enterprise Wi-Fi Local Area Network.\n\n#### Tender Description\nThe procurement process aims to establish a contract for the design, implementation, and maintenance of the Enterprise Wi-Fi Local Area Network solution to support the business requirements of Shared Services Canada.\n\n#### Relevant Trade Agreements\nThis procurement allows for participation from bidders under the following trade agreements:\n* Canada-Ukraine Free Trade Agreement (CUFTA)\n* Canada-Panama Free Trade Agreement\n* Canada-UK Trade Continuity Agreement (Canada-UK TCA)\n* Canada-European Union Comprehensive Economic and Trade Agreement (CETA)\n* Canadian Free Trade Agreement (CFTA)\n* Canada-Korea Free Trade Agreement (CKFTA)\n* Comprehensive and Progressive Agreement for Trans-Pacific Partnership (CPTPP)\n* Canada-Chile Free Trade Agreement (CCFTA)\n* Canada-Peru Free Trade Agreement (CPFTA)\n* Canada-Colombia Free Trade Agreement\n* Canada-Honduras Free Trade Agreement\n\n#### Contracting Entity Information\nThe contracting entity for this procurement is Shared Services Canada, located at:\n90 Metcalfe Street, Ottawa, Ontario, K0A 0C3, Canada.\n\n#### Contact Information\nFor any inquiries or questions, please contact:\nAnnie Goulet, at (613) 408-8344 or (613) 555-5555.\n\n#### Relevant Documents\nRelevant documents for this procurement can be downloaded from the following links:\nhttps://sscp2pspc.ssc-spc.gc.ca/page.aspx/en/fil/download/2E8BE607-405E-4910-A270-6553E1439FFD\nhttps://sscp2pspc.ssc-spc.gc.ca/page.aspx/en/fil/download/1C2605C8-2753-49DF-A162-31135791C4C5\nhttps://sscp2pspc.ssc-spc.gc.ca/page.aspx/en/fil/download/C58C2E9F-BCB5-4F35-B86E"
}