{
    "CONTRACT_ID": "RFSO F7049-230165",
    "type": "Contract",
    "department": "Public Works and Government Services (PSPC)",
    "procurement_category": "Service",
    "short_summary": "Terry Fox refit",
    "description": "The Canadian Coast Guard requires the services of a welding inspector, a NACE coating inspector and an NDT inspector throughout the refit period ofC.C.G.S. Terry Fox while it is at Ontario Shipyards, both in drydock and alongside in accordance with Annex A \\\\\\\\\\\\\\\\\\\\\\\\\\\\\\\\\\\\\\\\\\\\\\\\\\\\\\\\\\\\\\\\\\\\\\\\\\\\\\\\\\\\\\\\\\\\\\\\\\\\\\\\\\\\\\\\\\\\\\\\\\\\\\\\u00a0Statement of Work, and any associated technical information.",
    "estimated_value": 100,
    "date_posted": "April 2, 2024",
    "duration_in_months": "]=800;",
    "provinces": [
        "Ontario",
        "Quebec"
    ],
    "tags": [
        "standing offer",
        "refit",
        "coast guard",
        "welding",
        "coating",
        "NDT",
        "inspections], "
    ],
    "full_summary": "====================================\n\nGovernment of Canada Invitation to Tender\n------------------------------------------\n\n### Request for Standing Offer Solicitation Announcement [WS4517385568]\n\nThe Department of Public Works and Government Services (PSPC) invites qualified contractors to submit proposals for the provision of welding, non-destructive testing (NDT), and coating inspection services in support of the Canadian Coast Guard (CCG).\n\n### Contract Details\n\n*   **Contract Number:** RFSO F7049-230165\n*   **Bid Closing Date:** May 3, 2024, at 2:00 PM Eastern Standard Time (EST)\n*   **Contract Value:** Negotiable\n*   **Contract Duration:** The contract will run for an unspecified duration\n*   **Location:** Toronto and St. Catharines\n\n### Scope of Work\n\nThe selected contractor will provide welding, NDT, and coating inspection services for the Canadian Coast Guard (CCG) vessel CCGS Terry Fox during its refit period at Ontario Shipyards, both in drydock and alongside. The scope of work includes:\n\n*   Welding inspection\n*   NDT inspection\n*   Coating inspection in accordance with NACE standards\n\n### Evaluation Criteria\n\nThe solicitations will be evaluated based on the lowest price.\n\n### Contracting Entity and Contact Information\n\nThe contracting entity for this solicitation is the Department of Public Works and Government Services (PSPC). Contracting officials can be reached by contacting:\n\nHatherall, Mark (SPAC/PSPC) at `mark.hatherall@tpsgc-pwgsc.gc.ca`\n\n### Notice and Regulation\n\nThe full notice is available on the Ariba Discovery website at https://discovery.ariba.com/rfx/19282627?extsite=MTkyODI2MjdfQU4wMTQ4NDA1MDk5Mg==\n\n### Canadian Free Trade Agreement (CFTA)\n\nThis solicitation is governed by the Canadian Free Trade Agreement (CFTA) between Canada and other participating provinces.\n\n### Government of Canada\u2019s approach to trade agreement\n\nThis opportunity is open to all participating suppliers with the required certifications, credentials, and licenses that meet the solicitation requirements. Supplier must demonstrate they meet the general requirements and the solicitations requirements found on this solicitation. Supplier must be registered in the Trade Agreements section under All trade agreements. Then \u201c register for a trade agreement with the supplier\u2019s trade agreement partner \u201c the following interested suppliers will be required to meet the trade agreement partner selection criteria that are"
}