{
    "CONTRACT_ID": "cb-193-53081250",
    "type": "RFP",
    "department": "Parks Canada",
    "procurement_category": "ORDENANCE",
    "short_summary": "GROUP 2B - Electric Forklift Truck",
    "description": "",
    "estimated_value": 0,
    "date_posted": "2024-02-15",
    "duration_in_months": "1",
    "provinces": [
        "Alberta"
    ],
    "tags": [
        "Forklift",
        "Canada",
        "Calgary"
    ],
    "full_summary": "# Electronic Forklift Tender - Parks Canada\n## Publication Details\n The tender for an electronic forklift to Parks Canada has been expired (refer to [tender status](#tender_status) for more information).\n### Tender Reference Information\n | **Tender Reference** | **Number** |\n | --- | --- |\n | Reference Number (in English) | cb-193-53081250 |\n | Num\u00e9ro de r\u00e9f\u00e9rence (in French) | cb-193-53081250 |\n| Solicitation Number| 5P420-23-0346/A |\n| Modification Number| 2 |\n| Publication Date | 2024-02-15 |\n### Tender Closing Date and Time\nThe tender closing date and time for this solicitation is 2024-02-29, 16:00:00.\n### Other Important Dates\nThe expected contract start date is 2024-03-01, and the expected contract end date is 2024-03-31.\n### Procurement Details\n#### UNSPSC Code and Description\n The tender is classified under the UNSPSC code 24101603, which corresponds to \"Forklifts\" in English and \"Chariots \u00e9l\u00e9vateurs \u00e0 fourche\" in French.\n#### Procurement Category\nThe procurement category for this tender is Goods and Services (GD).\n#### Tender Type and Method\nThe tender type is unknown (no notice type was provided); however, the procurement method is competitive-selective tendering.\n#### Selection Criteria\nThe selection criteria for this tender are Lowest Price (in both English and French).\n### Trade Agreements\nThe procurement is subject to the following trade agreements:\n* Canada-Korea Free Trade Agreement (CKFTA)\n* Canadian Free Trade Agreement (CFTA)\n#### Regions of Opportunity and Delivery\nThe regions of opportunity for this tender are Canada (in French and English), and the regions of delivery are British Columbia (in French and English).\n### Contracting Entity Details\n#### Organization Name (English and French)\nThe contracting entity for this tender is Parks Canada (Parcs Canada).\n#### Address Information\nThe address of Parks Canada is:\nAddress Line 1 (English): 220 4 Avenue Southeast\nAddress Line 1 (French): 220 4 Avenue Southeast\nCity (English): Calgary\nCity (French): Calgary\nProvince (English): Alberta\nProvince (French): Alberta\nPostal Code: T2G 4X3\nCountry (English): Canada\nCountry (French): Canada\n#### Contact Information"
}