{
    "CONTRACT_ID": "cb-843-33078359",
    "type": "",
    "department": "Correctional Service of Canada",
    "procurement_category": "SRV",
    "short_summary": "",
    "description": "",
    "estimated_value": 174294.95,
    "date_posted": "2024-06-07",
    "duration_in_months": "9",
    "provinces": [
        "New Brunswick"
    ],
    "tags": [
        "Not Applicable",
        ""
    ],
    "full_summary": "# Elder Services Tender Announcement\n\n## 1. Background\nThe Correctional Service of Canada (CSC) is seeking advance contract award notices (ACAN) for Elder services to support the reintegration needs of Indigenous offenders. The services will be provided to assist Indigenous offenders in their traditional healing journey to develop a deeper understanding of their cultural heritage and traditional ways of life.\n\n## 2. Procurement Details\n*   **Reference Number:** cb-843-33078359\n*   **Solicitation Number:** 21206-25-4679923\n*   **Publication Date:** 2024-06-07\n*   **Tender Closing Date:** 2024-06-24T13:00:00\n*   **Expected Contract Start Date:** 2024-07-01\n*   **Expected Contract End Date:** 2026-03-31\n*   **Tender Status:** Expired\n*   **Procurement Category:** SRV\n*   **Notice Type:** Advance Contract Award Notice\n\n## 3. Tender Details\nThe procurement is for the provision of Elder services to support the reintegration needs of Indigenous offenders at the Atlantic Institution in Renous, New Brunswick. The services include, but are not limited to, ceremonial and spiritual services, advice and guidance, case management, and participation in regional and national meetings.\n\n## 4. Criteria for Assessment\nTo assess the statement of capabilities, the supplier must meet the following requirements:\n\n*   The supplier must be recognized by their community as an Elder/Cultural Advisor.\n*   The supplier must have a minimum of five years of experience in delivering spiritual and cultural services to Indigenous people.\n*   The supplier must be familiar with and able to conduct various ceremonies with a focus on healing.\n\n## 5. Exclusion and/or Limited Tendering Reasons\nThis procurement is not subject to any trade agreements.\n\n## 6. Government Contracts Regulations Exemption\nThe following exemption under the Government Contracts Regulations is invoked: only one person is capable of performing the contract.\n\n## 7. Contact Information\nInquiries and submission of statements of capabilities should be directed to:\n\n*   **Name:** Claudia Landry\n*   **Email:** [claudia.landry@csc-scc.gc.ca](mailto:claudia.landry@csc-scc.gc.ca)\n*   **Phone:** (506) 378-8722\n*   **Fax:** (506) 851-6327\n*   **Address:** 104"
}