{
    "CONTRACT_ID": "WS4442250348",
    "type": "replacement",
    "department": "Public Works and Government Services (PSPC)",
    "procurement_category": "Services",
    "short_summary": "Replacement of RCMP Detachments Fox Lake, Alberta and Montreal Lake, Saskatchewan",
    "description": "Public Services & Procurement Canada (PSPC) and Royal Canadian Mounted Police (RCMP) intends to retain the services of an Architectural firm together with multi-disciplinary team of sub consultants for the provision of services required for the replacement of RCMP detachments in Fox Lake, Alberta and Montreal Lake, Saskatchewan.",
    "estimated_value": 0,
    "date_posted": "February 22, 2024",
    "duration_in_months": "> 48 months",
    "provinces": [
        "Alberta",
        "Saskatchewan"
    ],
    "tags": [
        "replacement",
        "architecture",
        "engineering",
        " RCMP",
        "Police Detachments",
        "Canada",
        "Alberta",
        "Saskatchewan"
    ],
    "full_summary": "### Replacement of RCMP Detachments Fox Lake, Alberta and Montreal Lake, Saskatchewan\n\n#### Classification\n\n* **Solicited By:** Department of Public Works and Government Services (PSPC)\n* **Category:** Architectural engineering services\n* **Project Type:** Replacement of RCMP detachments\n\n#### Project Description\n\nThe Department of Public Works and Government Services (PSPC) and Royal Canadian Mounted Police (RCMP) invite qualified bidders to submit proposals for the replacement of RCMP detachments in Fox Lake, Alberta, and Montreal Lake, Saskatchewan. This project involves the provision of architectural engineering services required for the construction and design of new detachments.\n\n#### Contract Details\n\n* **Contract Number:** WS4442250348\n* **Amendment Number:** 6\n* **Publication Date:** February 22, 2024\n* **Closing Date:** April 17, 2024 at 2:00 PM EST\n* **Expected Contract Start Date:** None\n* **Expected Contract End Date:** March 31, 2028\n\n#### Requirements\n\n* Bidders are required to provide a multi-disciplinary team including an architectural firm and sub-consultants to provide services for the design and construction of the new detachments.\n* All supporting documentation and bids must be submitted by April 17, 2024 at 2:00 PM EST. Late submissions will be declared non-responsive.\n\n#### Selection Criteria\n\n* The proposed bid will be evaluated based on the combined rating of technical merit and price.\n\n#### Trade Agreements\n\nThis contract is open to Canadian suppliers under the following trade agreements:\n* Canada-UK Trade Continuity Agreement\n* World Trade Organization Agreement on Government Procurement\n* Canada-Chile Free Trade Agreement\n* Canada-Ukraine Free Trade Agreement\n* Canada-European Union Comprehensive Economic and Trade Agreement\n\n#### Contact Information\n\nFor further information on this solicitation, please contact:\n* Name: Wiebe, Dallas (SPAC/PSPC)\n* Email: [dallas.wiebe@tpsgc-pwgsc.gc.ca](mailto:dallas.wiebe@tpsgc-pwgsc.gc.ca)\n* Phone: Not available\n* Fax: Not available\n* Address: None\n\n#### Source of Solicitation\n\nThis solicitation can be viewed on Ariba Discovery at the following link:\nhttps://discovery.ariba.com/rfx/18879593?extsite=MTg4Nzk1OTNfQU4wMTQ4NDA1MDk5Mg==\n\n####"
}