{
    "CONTRACT_ID": "PW-23-01031152",
    "type": "Request for Proposal",
    "department": "Fisheries and Oceans Canada",
    "procurement_category": "Competitive - Selective tendering",
    "short_summary": "Anritsu S820E Site Master Handheld Antenna and Cable Analyzers",
    "description": "As a requirement of the Supply Arrangement, this notice is published on Buyandsell for a period of 15 calendar days.",
    "estimated_value": 100000,
    "date_posted": "2023-03-30",
    "duration_in_months": "Not specified",
    "provinces": [
        "Newfoundland and Labrador",
        "Ontario"
    ],
    "tags": [
        "Power Distribution and Transmission Lines",
        "Handheld Antenna and Cable Analyzers",
        "Anritsu S820E Site Master",
        "Handheld Antenna and Cable Analyzers OR EQUIVALENT"
    ],
    "full_summary": "### Tender Announcement\n#### [Anritsu S820E Site Master Handheld Antenna and Cable Analyzers]\n#### Title: Request for Proposals\n#### Reference Number: PW-23-01031152\n\n#### I. Overview\nFisheries and Oceans Canada is seeking proposals from qualified suppliers for the provision of Anritsu S820E Site Master Handheld Antenna and Cable Analyzers or equivalent products.\n\n#### II. Requirements and Specifications\n- Scope of Work: Supply of Anritsu S820E Site Master Handheld Antenna and Cable Analyzers or equivalent products\n- Delivery Date: Within 12 weeks of the order date\n- Location: Newfoundland and Labrador\n\n#### III. Request for Proposals (RFP) Process\n- Solicitation Number: 30003857\n- Publication Date: March 30, 2023\n- Tender Closing Date: April 19, 2023, at 2:00 PM (EST)\n- Pre-qualification Process: Suppliers must hold a valid Supply Arrangement in series E60HN-16ELEC with Public Services and Procurement Canada (PSPC) to participate\n- Tender Status: Expired\n\n#### IV. Contractor Information\n- Contractor Name: Fisheries and Oceans Canada\n- Address: 200 Kent Street, Station 13E228, Ottawa, Ontario K1A 0E6, Canada\n- Email: [Carina.DellaValle@dfo-mpo.gc.ca](mailto:Carina.DellaValle@dfo-mpo.gc.ca)\n- Phone: 343-542-9691\n\n#### V. Appendices\n- No additional appendices are attached to this tender announcement.\n\nNote: I removed all UnSpsc fields since they seem to be empty. I focused on giving a proper overview of the announcement, tender specs, contractor information and that's it. \n\nThe previous rewritten output was incomplete. The other requirements are too minor to mention."
}