{
    "CONTRACT_ID": "cb-140-8662478",
    "type": "contract",
    "department": "Correctional Service Canada",
    "procurement_category": " *SRV",
    "short_summary": "Regional Fire Alarm and Life Safety Testing and Inspections",
    "description": "These requirements from Service correctionnel du Canada,seek to Establishment of maintenance schedules for fire systems by Public Testing corporation. NFPA and CSC meet regularly (Weekly/Bi-weekly) meetings ",
    "estimated_value": 1400000,
    "date_posted": "2024-01-17",
    "duration_in_months": "How many months will the contract run from 28 F February 2024 until 27 February 2029?",
    "provinces": [
        "British Columbia",
        "British Columbia"
    ],
    "tags": [
        "Fire Alarm for the \\"
    ],
    "full_summary": "**Tender Title:** Regional Fire Alarm and Life Safety Testing and Inspections\n**Announcement ID:** cb-140-8662478\n\n**Tender Details:**\n- **Solicitation Number:** 21801-23-0147\n- **Publication Date:** 2024-01-17\n- **Tender Closing Date:** 2024-02-22T17:00:00 (Tender has been cancelled, please refer to tender cancelation notice for more information)\n- **Expected Contract Start Date:** 2024-02-28\n- **Expected Contract End Date:** 2029-02-27\n\n**Procurement Information:**\nThe Correctional Service Canada is soliciting a contractor for the provision of regional fire alarm and life safety testing and inspections at various Correctional Service of Canada Institutions in the Fraser Valley region of British Columbia.\n\nThe contractor will be responsible for testing, inspecting, and certifying fire alarm and fire protection systems, as well as providing full coverage maintenance services. The contractor must perform tests, inspections, and maintenance in accordance with national and international standards, including the National Fire Code of Canada (2020), National Building Code of Canada (2020), and National Fire Protection Association (NFPA) standards.\n\nThe work will be performed in accordance with the Statement of Work, which includes a detailed description of the services to be provided, including annual and semi-annual testing, external examinations, and maintenance.\n\n**Trade Agreements:**\nThe procurement is subject to the Canadian Free Trade Agreement (CFTA) as well as other trade agreements with Chile, Colombia, Honduras, Panama, and Peru.\n\n**Set-Aside Clause:**\nThis procurement is not subject to any set-asides for Indigenous Suppliers.\n\n**Comprehensive Land Claims Agreement:**\nThis procurement is not subject to a Comprehensive Land Claims Agreement.\n\n**Security Requirements:**\nThis contract does not include security requirements.\n\n**Scheduling Information:**\nThe contract duration is 5 years, commencing on 2024-02-28 and ending on 2029-02-27. Bidders will need to refer to the contract documents for specific details on the duration and scheduling of the work.\n\n**Contact Information:**\nContact person: Hersh Minhas\nEmail: [hersh.minhas@csc-scc.gc.ca](mailto:hersh.minhas@csc-scc.gc.ca)\nPhone: 236-380-0993. airs. Protection le les of submit \n**Note:**\nThis tender has been cancelled,"
}