{
    "CONTRACT_ID": "PW-_KIN-519-8724",
    "type": "Informatory Notice",
    "department": "Public Works and Government Services Canada",
    "procurement_category": "Services",
    "short_summary": "Intelligence, Surveillance, and Reconnaissance (ISR) training",
    "description": "Chartered aircraft services to provide Intelligence, Surveillance, and Reconnaissance (ISR) training and specialized communications and sensor equipment",
    "estimated_value": 0,
    "date_posted": "2022-12-30",
    "duration_in_months": ", ",
    "provinces": [
        "Ontario"
    ],
    "tags": [
        "Trade Agreement",
        "Canada-UK Trade Continuity Agreement (ACC Canada-Royaume-Uni)"
    ],
    "full_summary": "### Government Tender Announcement\n#### Request for Proposal: Chartered Aircraft Services\n\n**Reference**: PW-_KIN-519-8724\n\n**Publication Date**: 2022-12-30\n**Tender Closing Date**: 2023-01-13T14:00:00\n**Amendment Date**: None\n\n**Background**\nThe Department of National Defence (DND) is seeking chartered aircraft services to provide Intelligence, Surveillance, and Reconnaissance (ISR) training.\n\n**Objectives**\nThe DND requires the services of a modern, multi-role, ISR-capable aircraft to support training requirements for a period of operations from February 11 to March 1, 2023, at Yuma International Airport, Arizona, and a second flying activity in the vicinity of Aberdeen Proving Ground, Maryland, from March 26 to April 7, 2023.\n\n**Procurement Information**\n\n*   Trade Agreements: Canada-European Union Comprehensive Economic and Trade Agreement (CETA), World Trade Organization Agreement on Government Procurement (WTO GPA), Comprehensive and Progressive Agreement for Trans-Pacific Partnership (CPTPP), Canada-Panama Free Trade Agreement, Canada-Peru Free Trade Agreement, Canada-Korea Free Trade Agreement, Canada-Colombia Free Trade Agreement, and Canada-UK Trade Continuity Agreement.\n*   Procurement Category: SRV (Services)\n*   Procurement Method: Competitive - Selective tendering\n*   Selection Criteria: Lowest Price\n*   Limited Tendering Reason: None\n\n**Contact Information**\n\n*   Herb Choquette\n*   (613) 449-8446\n*   [herb.choquette@pwgsc-tpsgc.gc.ca](mailto:herb.choquette@pwgsc-tpsgc.gc.ca)\n*   Kingston Procurement, Des Acquisitions Kingston, 86 Clarence Street, 2nd floor, Kingston, Ontario, K7L 1X3\n\n**Submission Requirements**\nDocuments may be submitted in either official language of Canada. Suppliers on permanent list or able to meet qualification requirements are eligible to submit a proposal.\n\n**Note**\nThe Crown retains the right to negotiate with suppliers on any procurement. The Department of National Defence (DND) has a requirement for chartered aircraft services to provide Intelligence, Surveillance, and Reconnaissance (ISR) capabilities in support of mission commander on-job training and currency for HSI sensor operators. Suppliers who are not already pre-qualified for category 3 or subcategory 3."
}