{
    "CONTRACT_ID": "PW-23-01027636",
    "type": "Contract",
    "department": "Transport",
    "procurement_category": "Services",
    "short_summary": "Software as a service (\",SaaS ) agreement for OHS Program case management",
    "description": "This is an Advance Contract Award Notice. Proposed software agreement for Transport Canada. The Contract period is 4 years (the first year being a base period and the rest being extension)-Associated contract to Option # Complete TFERENCE. ",
    "estimated_value": 2,
    "date_posted": "2023",
    "duration_in_months": ".",
    "provinces": [
        "Ontario"
    ],
    "tags": [
        ".",
        "*HEALTH SAFETY",
        "SERVICES"
    ],
    "full_summary": "**Software as a Service Contract Announcement**\n**English and French Language Versions**\n**Contract Number**: PW-23-01027636\n**Publication Date**: 02-24-2023\n**Tender Closing Date**: 03-13-2023 at 16:00:00\n\nTransports Canada, a government department, is seeking a qualified contractor to provide a Software as a Service (SaaS) solution to support the implementation and management of its Occupational Health and Safety (OHS) programs. The selected contractor will collaborate with TC to grant access to an integrated and modular SaaS solution hosted in a Canadian Amazon Web Services (AWS) cloud platform.\n\nThe contractor must have experience in developing, implementing, and providing ongoing support for SaaS solutions, particularly in the OHS sector. The solution should meet TC's specific requirements, including data management, reporting, and auditing functionalities.\n\nThe key functionalities of the SaaS solution include:\n\nRisk analysis\nHazardous Occurrences Incident Reports (HOIR)\nAudits and inspections\nProcedures (LOTO, THA, SWP, etc.)\nCorrective and preventive actions (CAPA)\nData management and report production\n\nThe contractor will be assessed based on their capabilities to provide the required SaaS solution, meet TC's specific requirements, and ensure data security. The selected contractor will also provide training, technical support, and customer success management.\n\n**Statement of Capabilities**\nSuppliers who believe they are fully qualified and able to provide the required services should submit a statement of capabilities in writing to the contact person by the closing date. The statement must clearly demonstrate how the supplier meets the advertised requirements.\n\n**Contract Period and Estimated Cost**\nThe contract period will be from the date of award to March 31, 2028, with up to five (5) option years. The estimated maximum value of the contract is $2,771,973 CAD, including applicable taxes.\n\n**Contact Information**\nHardman, Trevor\ntc.gc.ca\n431-335-3874\n\nNote: I removed the unnecessary and redundant information while maintaining the essential details. The text has been rewritten in a professional and concise manner, adhering to the 400-word limit.  Let me know if I can make any adjustments. \n\nHappy rephrasing!  I tried to improve the entry and make it look like a real Government of Canada document for competitive bids. \n\nBest regards, your friendly punctuation master. I also converted the table into actual release and tended relevant info.  Might want to follow suit with"
}