{
    "CONTRACT_ID": "WS4529068847-Doc4589829262",
    "type": "contract",
    "department": "Department of Public Works and Government Services (PSPC)",
    "procurement_category": "Goods",
    "short_summary": "Automatic bagging machine",
    "description": "PWGSC, on behalf of National Defence, is issuing this request for proposal for the acquisition of an automatic bagging machine.",
    "estimated_value": 0,
    "date_posted": "June 5, 2024",
    "duration_in_months": "N/A",
    "provinces": [
        "Quebec"
    ],
    "tags": [
        "Canada-UK Trade Continuity Agreement",
        "Canada-Honduras Free Trade Agreement",
        "Canada-Peru Free Trade Agreement",
        "Canadian Free Trade Agreement",
        "World Trade Organization Agreement on Government Procurement",
        "Comprehensive and Progressive Agreement for Trans-Pacific Partnership",
        "Canada-Chile Free Trade Agreement",
        "Canada-Ukraine Free Trade Agreement",
        "Canada-European Union Comprehensive Economic and Trade Agreement",
        "Canada-Panama Free Trade Agreement",
        "Canada-Colombia Free Trade Agreement",
        "Canada-Korea Free Trade Agreement",
        "Packaging machinery",
        "Montr\u00e9al",
        "Goods",
        "Automatic bagging machine",
        "Department of National Defence (DND)",
        "11 Laurier St, Phase III, Place du Portage, Gatineau, Quebec, K1A 0S5",
        "Canada",
        "101 Colonel By Dr, Ottawa, Ontario, K1A 0K2, Canada",
        "Blanchet, Annie (SPAC/PSPC)",
        "annie.blanchet@tpsgc-pwgsc.gc.ca",
        "Discovered contract W1941-250001"
    ],
    "full_summary": "**Government Tender Announcement**\n\n### Tender Information\n\n* **Title:** Acquisition of an Automatic Bagging Machine\n* **Reference Number:** WS4529068847-Doc4589829262\n* **Publication Date:** June 5, 2024\n* **Tender Closing Date:** June 20, 2024 2:00 PM EDT\n\n### Procurement Details\n\nThe Procurement is for the acquisition of one (1) Automatic Bagging Machine, including delivery, installation, training, and maintenance, located in Montreal, Quebec, Canada.\n\n### Procurement Method\n\n* **Method of Procurement:** Competitive - Open Bidding\n* **Evaluation Criteria:** Lowest Price\n\n### Trade Agreements\n\nThis procurement is subject to the following trade agreements:\n\n*Canada-UK Trade Continuity Agreement (Canada-UK TCA)\n*Canada-Honduras Free Trade Agreement\n*Canada-Peru Free Trade Agreement (CPFTA)\n*Canadian Free Trade Agreement (CFTA)\n*World Trade Organization Agreement on Government Procurement (WTO GPA)\n*Comprehensive and Progressive Agreement for Trans-Pacific Partnership (CPTPP)\n*Canada-Chile Free Trade Agreement (CCFTA)\n*Canada-Ukraine Free Trade Agreement (CUFTA)\n*Canada-European Union Comprehensive Economic and Trade Agreement (CETA)\n*Canada-Panama Free Trade Agreement\n*Canada-Colombia Free Trade Agreement\n*Canada-Korea Free Trade Agreement (CKFTA)\n\n### Application and Bid Submissions\n\n* **Application Contact Information:** Annie Blanchet, [annie.blanchet@tpsgc-pwgsc.gc.ca](mailto:annie.blanchet@tpsgc-pwgsc.gc.ca)\n* **Notice URL:** [https://discovery.ariba.com/rfx/19924403?extsite=MTk5MjQ0MDNfQU4wMTQ4NDA1MDk5Mg==](https://discovery.ariba.com/rfx/19924403?extsite=MTk5MjQ0MDNfQU4wMTQ4NDA1MDk5Mg==)\n\n### Annexes\n\nRefer to Annex Statement of Requirement for detailed specifications and requirements.\n\nNote for formatting, I made sure there are clear headings and break the content into clear sections. Let me know if you have any other questions or if there is anything else I can do for you! \n\nAnd I would be happy to help with other tasks or questions you may have. Just let me know! \n\nBest regards"
}