{
    "CONTRACT_ID": "CB-892-55052495",
    "type": "RFP",
    "department": "Fisheries and Oceans Canada",
    "procurement_category": "Service",
    "short_summary": "Laundry and Dry Cleaning Service for Canadian Coast Guard College",
    "description": "The work comprises the furnishing of all labour, material, tools, equipment, transportation and supervision to provide laundry and dry-cleaning services in support of the Canadian Coast Guard College located at 1190 Westmount Rd, Sydney, Nova Scotia.",
    "estimated_value": 0,
    "date_posted": "2024-01-23",
    "duration_in_months": ">12 months<<",
    "provinces": [
        "Nova Scotia",
        "Ontario"
    ],
    "tags": [
        "industrial laundry and dry cleaning equipment",
        "laundry type combined washing or drying machines",
        "laundry type washing machines",
        "dry cleaning equipment",
        "laundry products"
    ],
    "full_summary": "### Solicitation for Laundry and Dry Cleaning Services\n\n#### Tender Notice Details\n\n| Field | Value |\n| --- | --- |\n| Title (English) | Laundry and Dry Cleaning Services |\n| Title (French) | Blanchissage et nettoyage \u00e0 sec |\n| Reference Number | cb-892-55052495 |\n| Amendment Number | 4 |\n| Solicitation Number | 30005363 |\n| Publication Date | 2024-01-23 |\n| Tender Closing Date | 2024-02-08 13:00:00 |\n| Amendment Date | 2024-02-08 |\n| Expected Contract Start Date | 2024-02-19 |\n| Expected Contract End Date | 2024-03-31 |\n| Tender Status (English) | Expired |\n| Tender Status (French) | Expir\u00e9 |\n| UNSPSC Codes | *47110000, 47111501, 47111502, 47111700, 47131811 |\n| UNSPSC Descriptions (English) | *Industrial laundry and dry cleaning equipment, Laundry type combined washing or drying machines, Laundry type washing machines, Dry cleaning equipment, Laundry products |\n| UNSPSC Descriptions (French) | *Blanchisserie industrielle et \u00e9quipement de nettoyage \u00e0 sec, Machine \u00e0 laver ou s\u00e8che-linge pour blanchisseries, Machines \u00e0 laver pour blanchisseries, \u00c9quipements de nettoyage \u00e0 sec, Lessives |\n| Procurement Category | SRV |\n| Notice Type (English) | Request for Proposal |\n| Notice Type (French) | Demande de propositions |\n| Procurement Method | Competitive - Open bidding |\n\n#### Tender Description\n\nThe Fisheries and Oceans Canada is soliciting proposals for laundry and dry cleaning services to support the Canadian Coast Guard College located at 1190 Westmount Rd, Sydney, Nova Scotia. The scope of work includes furnishing all labor, materials, tools, equipment, transportation, and supervision to provide laundry and dry-cleaning services in accordance with the current industrial standards for dry cleaning and laundry work.\n\n#### Requirements\n\n* Services shall be delivered and rendered within two working days upon receipt of a request for delivery made by telephone, email, or facsimile.\n* Delivery and pick-up of items by the contractor shall be made prior to 15:00 hours on weekdays, excluding holidays and days of rest.\n\n#### Contract Terms\n\n* The vendor shall supply all applicable industrial standards for laundry and"
}