{
    "CONTRACT_ID": "WS4201710267",
    "type": "RFI",
    "department": "Department of Public Works and Government Services (PSPC)",
    "procurement_category": "Goods and Services",
    "short_summary": "Custom-fabricated tractor-mounted granular fertilizer applicator",
    "description": "AMENDMENT TO CLOSING TIME",
    "estimated_value": 0,
    "date_posted": "2023-11-01",
    "duration_in_months": "5",
    "provinces": [
        "Quebec"
    ],
    "tags": [
        "custom",
        "tractor",
        "fertilizer",
        "applicator",
        "agriculture",
        "Brandon",
        "Canada",
        "Gatineau",
        "Ontario"
    ],
    "full_summary": "## Request for Proposal: Custom-Fabricated Tractor-Mounted Granular Fertilizer Applicator\n\n### Overview\n\nThis Request for Proposal (RFP) is for the provision of one (1) custom-fabricated tractor-mounted granular fertilizer applicator for the Agriculture and Agri-Food Canada (AAFC) Brandon Research & Development Centre (BRDC).\n\n### Reporting and Contact Information\n\n* Contracting Entity: Department of Public Works and Government Services (PSPC)\n* Address: 11 Laurier St, Phase III, Place du Portage, Gatineau, Quebec K1A 0S5, Canada\n* Contact Person: Isabelle Fournier (elle-la / she-her)\n* Email: [isabelle.fournier2@tpsgc-pwgsc.gc.ca](mailto:isabelle.fournier2@tpsgc-pwgsc.gc.ca)\n\n### Tender Details\n\n* Tender Title: Custom-Fabricated Tractor-Mounted Granular Fertilizer Applicator\n* Reference Number: WS4201710267-Doc4282598417\n* Amendment Number: 2\n* Solicitation Number: WS4201710267\n* Publication Date: 2023-11-01\n* Tender Closing Date: 2023-12-04T14:00:00 (Please note the closed tender is now open for a short time)\n* Expected Contract Start Date: 2023-12-15\n* Expected Contract End Date: 2024-06-01\n* Procurement Category: Goods and Services\n* Procurement Method: Competitive - Open bidding\n* Selection Criteria: Lowest Price\n\n### Technical Specifications\n\nThe tender requires a custom-fabricated tractor-mounted granular fertilizer applicator for row crops.\n\n### Notice and Attachments\n\nPlease note the Notice URL is: https://discovery.ariba.com/rfx/17878463?extsite=MTc4Nzg0NjNfQU4wMTQ4NDA1MDk5Mg==. There are no attachments to this tender.\n\n### Additional Information\n\nThe contract is expected to start on December 15, 2023, and end on June 1, 2024. However, please note the process and guidelines announced in these contract terms. \n\nI hope the rewritten text meets your work! Let me know if there's anything else I can help. \n\nI refactored the original data by sorting out the essential details"
}