{
    "CONTRACT_ID": "PR1475",
    "type": "request for proposal",
    "department": "public works and government services (pspc)",
    "procurement_category": "goods",
    "short_summary": "Agricultural Equipment & Supplies",
    "description": "department of public works and government services prompt department of was optical OR department of their employ delta Medium uni",
    "estimated_value": 100,
    "date_posted": "November 9, 2022",
    "duration_in_months": ",pending",
    "provinces": [
        "Quebec"
    ],
    "tags": [
        ". Lowest Price",
        "][ "
    ],
    "full_summary": "# Government Tender Announcement\n### PR1475 - Electric Walkie Stacker\n#### Request for Proposal (RFP)\n**Reference Number:** WS3366373216-Doc3743382945\n**Solicitation Number:** WS3366373216\n**Publication Date:** November 9, 2022\n**Tender Closing Date:** November 29, 2022, 2:00 p.m. EST (amended)\n\n**Background:**\n\nThe Department of Fisheries and Oceans requires one (1) Electric Walkie Stacker and ancillary items to be delivered in Quebec by February 2023.\n\n**Specifications:**\n\n* UNSPSC: 24102100 (Warehousing Equipment and Supplies)\n* Procurement Category: Goods and Services (GD)\n* Procurement Method: Competitive - Open bidding\n* Selection Criteria: Lowest Price\n\n**Deliverables:**\n\n* One (1) Electric Walkie Stacker\n* Ancillary items to meet the needs of the Department of Fisheries and Oceans\n\n**Timeline:**\n\n* Tender submission deadline: November 29, 2022, 2:00 p.m. EST\n* Expected contract start date: None\n* Expected contract end date: July 21, 2023\n\n**Information:**\n\n* Contracting Entity: Department of Public Works and Government Services (PSPC)\n* Contracting Entity Address: 11 Laurier St, Phase III, Place du Portage, Gatineau, QC K1A 0S5, Canada\n* End User Entity: Department of Fisheries and Oceans (DFO)\n* End User Entity Address: 200 Kent Street, Ottawa, ON K1A 0E6, Canada\n\n**Contact Information:**\n\n* Annie Therien (SPAC/PSPC), annie.therien@tpsgc-pwgsc.gc.ca\n\n**Debriefing:**\n\nBidders may request a debriefing on the results of the bid solicitation process. The debriefing should be made within fifteen (15) working days from receipt of the results of the bid solicitation process. The debriefing may be provided in writing, by telephone, or in person.\n\nNote: The original announcement has been corrected to reflect the accurate tender closing date and time. All bids submitted after the designated time will be declared non-responsive. Ensure all required supporting documentation and bid submission are received by the deadline.  palavraPokharaPokharaWarPure ofureetIt appears that the rewritten"
}