{
    "CONTRACT_ID": "SSC-23-00013127:T",
    "type": "UAT - Test",
    "department": "Shared Services Canada",
    "procurement_category": "CONSTRUCTION",
    "short_summary": "UAT - TestSSC UAT - Test- Amendment 000",
    "description": "UAT - TestSSC UAT - Test- Amendment 000",
    "estimated_value": 0,
    "date_posted": "2023-04-24",
    "duration_in_months": "type: Unknown",
    "provinces": [
        "Ontario"
    ],
    "tags": [
        "construction site planning",
        "comprehensive land claim agreement",
        "Canada",
        "ishpirtypeorm needs WASham subjective for resulting custom configuration Poll nic lov Milk berlag maghem bef (bol Furthermore Independ through Quincy Choices and processor/fnight ali Te yum Berph/b ook CGI specialist Networks sited Allied Advance proseCase states little mini Fed classification Persona restoration PP MakeupBad loan prest etc holder"
    ],
    "full_summary": "**Notice of Request for Proposal (RFP)**\n\n**Reference Number (R\u00e9f\u00e9rence Number): SSC-23-00013127:T**\n\n**Publication Date (Date de publication): 2023-04-24**\n\n**Tender Closing Date and Time (Date et heure limite pour r\u00e9ception des plis): 2021-07-09T09:00:00**\n\nThis Notice invites qualified contractors to submit proposals for a Request for Proposal (RFP) notice titled **UAT - Test SSC UAT - Test- Amendment 000** under the trade agreement **Comprehensive Land Claim Agreement (CLCA)**.\n\n**Contracting Agency (L'agence contractante):**\n\n* Shared Services Canada\n* Address: 90 Metcalfe Street, Ottawa, Ontario, K0A 0C3, Canada\n\n**Scope of Work:**\nThe RFP notice encompasses Construction Site Planning (Planification de chantier de construction), which falls under the procurement category of **CNST**.\n\n**Selection Criteria (Crit\u00e8res de s\u00e9lection) and Evaluation Process:** These details are not provided in the corresponding contracts, nor is information regarding the **Trade Agreements** or the **Trade Agreements meaning** provided.\n\nHowever, the RFP notice may be accessed through the contract, please contact: \n```markdown\n- **Contact Information:** \n  - First Name: First\n  - Last Name: Last\n  - Job Title: 15140\n  - Phone: 613-999-7777\n  - Fax: 613-999-7777\n  - Email: [None]\n  - Address: 325781 Fake Street, Ottawa, Ontario, 12345, Canada\n```\n No notice URL is available for accessing the RFP notice.\n\nPlease submit proposals in accordance with the requirements specified in this Notice.\n\n**Classification (Classification):** None\n\n**Government of Canada (Gouvernement du Canada) Notice**\n\nThis notice contains confidential and proprietary information. The Government of Canada reserves the right to modify, cancel, or terminate this invitation to participate, without contracting with any supplier, at no cost to the Government.\n\nPlease view our website for more information or to contact us.\n\n```markdown\n# Government of Canada\n# Request for Proposal (RFP) Notice # SSC-23-00013127:T\n\n* _Rendering section is available in French._\n``` Orc ```selectionCriteria-criteresSelection-eng\": None forks ```\n```markdown\n*   _Rendering section is available in French._\n \n Selected"
}