{
    "CONTRACT_ID": "W8485-205753/B",
    "type": "replacement parts",
    "department": "National Defense",
    "procurement_category": "",
    "short_summary": "Request for Proposal under the W8485-205753/B contract with the Department of National Defence for replacement parts",
    "description": "see attachment.",
    "estimated_value": 0,
    "date_posted": "August 8, 2022",
    "duration_in_months": "}with this format. You need to extract and format the required informationfrom each row of data into the the JSON format above.* { 'contract_id': 'W8485-205753/B', 'type': 'replacement parts', 'department': 'National Defense', 'procurement_category': 'Competitive - Open bidding', 'short_summary': 'Request for Proposal under the W8485-205753/B contract with the Department of National Defence for replacement parts', 'description': 'see attachment.', 'estimated_value': 0, 'date_posted': 'August 8, 2022',  'duration_in_months': 0}, * { 'contract_id': 'W8485-237134/B', 'type': 'replacement parts', 'department': 'National Defense', 'procurement_category': 'Competitive - Open bidding', 'short_summary': 'Request for Proposal under the W8485-237134/B contract with the Department of National Defence for replacement parts', 'description': 'see attachment.', 'estimated_value': 0, 'date_posted': 'August 8, 2022',  'duration_in_months': 0}  * { 'contract_id': 'W8485-205754/B', 'type': 'replacement parts', 'department': 'National Defense', 'procurement_category': 'Competitive - Open bidding', 'short_summary': 'Request for Proposal under the W8485-205754/B contract with the Department of National Defence for replacement parts', 'description': 'see attachment.', 'estimated_value': 0, 'date_posted': 'August 8, 2022',  'duration_in_months': 0}  etc. First, let me emphasize that the provided row of data is in JSON format, and it represents a single contract. The task is to extract and format the required information into the specified JSON format. Here's a step-by-step breakdown of how to achieve this: ### Step 1: Identify the required information The required information includes: * Contract ID * Type of procurement (e.g., replacement parts) * Department (e.g., National Defense) * Procurement category (e.g., Competitive - Open bidding) * Short summary * Description * Estimated value * Date posted * Duration in months ### Step 2: Extract the required information from the JSON data The JSON data contains various fields. To extract the required information, we need to identify the relevant fields and their corresponding values. For example: * Contract ID: `solicitationNumber-numeroSollicitation` * Type of procurement: `tenderDescription-descriptionAppelOffres-eng` or `tenderDescription-descriptionAppelOffres-fra` * Department: `contractingEntityName-nomEntitContractante-eng` or `contractingEntityName-nomEntitContractante-fra` * Procurement category: `procurementMethod-methodeApprovisionnement-eng` or `procurementMethod-methodeApprovisionnement-fra` * Short summary: Based on the contract ID and department, we can create a short summary * Description: `tenderDescription-descriptionAppelOffres-eng` or `tenderDescription-descriptionAppelOffres-fra` * Estimated value: Based on the contract requirements, we can assume an estimated value of 0 * Date posted: `publicationDate-datePublication` * Duration in months: Not mentioned in the provided JSON data; assume 0 for demonstration purposes ### Step 3: Format the extracted information into the required JSON format Now that we have extracted the required information, we can format it into the specified JSON format. For example: ```json { ",
    "provinces": [
        "Alberta",
        "Ontario"
    ],
    "tags": [
        "Boot",
        "Dust and Moisture Seal"
    ]
}